Filename,Size,Unit
Deadmau5/The Veldt EP/01 The Veldt (Original Mix) [feat. Chris James] 1.mp3,26.55,M
Deadmau5/It Sounds Like/15 Secondary Complications (Original Mix) 1.mp3,25.04,M
Deadmau5/For Lack of a Better Name/10 Strobe 1.mp3,24.31,M
Deadmau5/4X4=12/07 Cthulhu Sleeps 1.mp3,24.26,M
Deadmau5/It Sounds Like/12 I Remember (Vocal Mix) 1.mp3,23.09,M
Deadmau5/It Sounds Like/19 I Remember (Instrumental Mix) 1.mp3,23.01,M
Deadmau5/It Sounds Like/05 Complications (Original Mix) 1.mp3,22.79,M
Deadmau5/For Lack of a Better Name/09 The 16th Hour 1.mp3,21.73,M
Deadmau5/It Sounds Like/14 Not Exactly (Original Mix) 1.mp3,21.34,M
Deadmau5/Random Album Title/07 I Remember 1.mp3,21.07,M
Deadmau5/It Sounds Like/13 Jaded (Original Mix) 1.mp3,20.46,M
Deadmau5/At Play/04 Faxing Berlin 1.mp3,20.06,M
Deadmau5/It Sounds Like/08 Faxing Berlin (Original Mix) 1.mp3,20,M
"Deadmau5/At Play, Vol.2/06 Orca 1.mp3",19.66,M
Deadmau5/Vexillology/06 Orca 1.mp3,19.57,M
Deadmau5/4X4=12/09 Raise Your Weapon (Ft. Greta Svabo Bech) 1.mp3,19.23,M
Deadmau5/It Sounds Like/01 Alone With You (Original Mix) 1.mp3,19.01,M
Deadmau5/It Sounds Like/17 Some Kind of Blue (Original Mix) 1.mp3,18.51,M
Deadmau5/Random Album Title/10 Not Exactly 1.mp3,18.49,M
Deadmau5/4X4=12/08 Right This Second 1.mp3,18.11,M
Deadmau5/It Sounds Like/16 Slip (Original Mix) 1.mp3,17.9,M
Deadmau5/For Lack of a Better Name/06 Word Problems 1.mp3,17.89,M
Deadmau5/Vexillology/05 Lai 1.mp3,17.48,M
"Deadmau5/At Play, Vol.3/04 Lai 1.mp3",17.47,M
Deadmau5/Random Album Title/06 Alone With You 1.mp3,17.35,M
Deadmau5/Vexillology/07 Plus 1.mp3,17.28,M
Deadmau5/Aural Psynapse - Single/01 Aural Psynapse 1.mp3,17.22,M
Deadmau5/4X4=12/01 Some Chords 1.mp3,17.11,M
"Deadmau5/At Play, Vol.3/03 Plus 1.mp3",17.09,M
Deadmau5/Maths - Single/01 Maths 1.mp3,16.97,M
Deadmau5/At Play/09 Dr. Funkenstein 1.mp3,16.78,M
"Deadmau5/Random Album Title/01 Sometimes Things Get, Whatever 1.mp3",16.77,M
Deadmau5/It Sounds Like/02 Arguru (EDXs 5un5hine Remix) 1.mp3,16.69,M
Deadmau5/Vexillology/03 Dr. Funkenstein 1.mp3,16.64,M
Deadmau5/Vexillology/10 Trepid 1.mp3,16.37,M
Deadmau5/At Play/06 Turning Point 1.mp3,16.36,M
Deadmau5/At Play/01 Vanishing Point 1.mp3,16.35,M
"Deadmau5/At Play, Vol.2/09 This Noise 1.mp3",16.3,M
Deadmau5/4X4=12/06 I Said (Michael Woods Remix) 1.mp3,16.28,M
"Deadmau5/At Play, Vol.2/07 Tau v2 1.mp3",16.23,M
Deadmau5/Full Circle/01 Turning Point (Original Mix) 1.mp3,16.21,M
Deadmau5/Get Scraped/03 Careless 1.mp3,16.03,M
Deadmau5/For Lack of a Better Name/08 Lack of a Better Name 1.mp3,15.96,M
Deadmau5/The Veldt EP/04 The Veldt (Tommy Trash Short Edit) [feat. Chris James] 1.mp3,15.86,M
Deadmau5/Random Album Title/12 So There I Was 1.mp3,15.77,M
Deadmau5/Get Scraped/02 Intelstat 1.mp3,15.68,M
Deadmau5/Random Album Title/03 Slip 1.mp3,15.61,M
"Deadmau5/At Play, Vol.2/04 Reduction 1.mp3",15.59,M
"Deadmau5/At Play, Vol.3/09 Stereo Fidelity 1.mp3",15.58,M
Deadmau5/Vexillology/01 1981 1.mp3,15.56,M
Deadmau5/It Sounds Like/04 Clockwork (Original Mix) 1.mp3,15.53,M
Deadmau5/4X4=12/02 Sofi Needs A Ladder (Ft. Sofi) 1.mp3,15.37,M
Deadmau5/It Sounds Like/07 Everything Before (Original Mix) 1.mp3,15.31,M
Deadmau5/It Sounds Like/10 Hi Friend (feat. Mc Flipside) (Instrumental Mix) 1.mp3,15.27,M
Deadmau5/It Sounds Like/11 Hi Friend (feat. Mc Flipside) (Vocal Mix) 1.mp3,15.27,M
Deadmau5/Full Circle/05 Cyclic Redundancy (Original Mix) 1.mp3,15.19,M
Deadmau5/4X4=12/11 Everything Before 1.mp3,15.18,M
Deadmau5/It Sounds Like/18 We Fail (Original Mix) 1.mp3,15.16,M
"Deadmau5/At Play, Vol.3/01 Cyclic Redundancy 1.mp3",15.13,M
Deadmau5/For Lack of a Better Name/01 FML 1.mp3,15.1,M
"Deadmau5/At Play, Vol.2/02 Attention Whore 1.mp3",15.09,M
Deadmau5/At Play/05 Hey Baby (Adam K Dirty Remix) 1.mp3,14.72,M
Deadmau5/Random Album Title/04 Some Kind of Blue 1.mp3,14.66,M
Deadmau5/Full Circle/06 Templar (Original Mix) 1.mp3,14.65,M
Deadmau5/Get Scraped/05 Waking Up From The American Dream 1.mp3,14.64,M
"Deadmau5/At Play, Vol.3/08 Templar 1.mp3",14.57,M
Deadmau5/4X4=12/05 Animal Rights (Ft. Wolfgang Gartner) 1.mp3,14.4,M
Deadmau5/It Sounds Like/09 Ghosts N Stuff (Original Mix) 1.mp3,14.36,M
Deadmau5/At Play/10 Afterhours 1.mp3,14.26,M
Deadmau5/It Sounds Like/06 Everything After (Original Mix) 1.mp3,14.24,M
"Deadmau5/At Play, Vol.2/01 Outta My Life (Touch Mix) 1.mp3",14.18,M
Deadmau5/At Play/08 1981 1.mp3,14.15,M
Deadmau5/Full Circle/03 1981 (Adam K Remix) 1.mp3,14.13,M
Deadmau5/For Lack of a Better Name/07 Soma 1.mp3,14.02,M
"Deadmau5/At Play, Vol.2/08 Sexslave 1.mp3",14.01,M
Deadmau5/Full Circle/04 1981 (Miminal Remix) 1.mp3,14.01,M
Deadmau5/At Play/07 This Is The Hook 1.mp3,13.96,M
"Deadmau5/At Play, Vol.2/05 This Is Also The Hook 1.mp3",13.96,M
"Deadmau5/At Play, Vol.2/10 R My Dreams 1.mp3",13.89,M
Deadmau5/At Play/02 Sex Lies Audiotape 1.mp3,13.81,M
"Deadmau5/At Play, Vol.3/10 Whispers feat. Melleefresh (Remix) 1.mp3",13.56,M
"Deadmau5/At Play, Vol.3/07 Full Bloom 1.mp3",13.52,M
Deadmau5/Full Circle/07 Subvert (Original Mix) 1.mp3,13.43,M
Deadmau5/It Sounds Like/03 Bye Friend (Original Mix) 1.mp3,13.21,M
Deadmau5/Vexillology/02 Bounce 1.mp3,12.99,M
"Deadmau5/At Play, Vol.3/06 Bounce 1.mp3",12.98,M
Deadmau5/4X4=12/03 A City In Florida 1.mp3,12.93,M
Deadmau5/Random Album Title/05 Brazil (2nd Edit) 1.mp3,12.9,M
Deadmau5/Random Album Title/02 Complications 1.mp3,12.79,M
Deadmau5/Random Album Title/11 Arguru 1.mp3,12.77,M
Deadmau5/At Play/03 Cocktail Queen 1.mp3,12.71,M
Deadmau5/4X4=12/04 Bad Selection 1.mp3,12.68,M
Deadmau5/Full Circle/02 Mr. G (Original Mix) 1.mp3,12.44,M
Deadmau5/For Lack of a Better Name/05 Bot 1.mp3,12.31,M
"Deadmau5/At Play, Vol.2/03 Mr. G 1.mp3",12.15,M
Deadmau5/Vexillology/08 Apply Overnight 1.mp3,12.03,M
Deadmau5/For Lack of a Better Name/04 Hi Friend! 1.mp3,12.02,M
"Deadmau5/At Play, Vol.3/02 Apply Overnight 1.mp3",11.91,M
Deadmau5/Get Scraped/15 Careless (Acoustic) 1.mp3,11.39,M
Deadmau5/Vexillology/04 Fustercluck 1.mp3,11.27,M
Deadmau5/The Veldt EP/02 Failbait (feat. Cypress Hill) [Original Mix] 1.mp3,11.16,M
Deadmau5/Get Scraped/08 8bit 1.mp3,10.8,M
Deadmau5/Get Scraped/13 Satisfaction 1.mp3,10.52,M
Deadmau5/Get Scraped/09 Overdraft 1.mp3,10.34,M
Deadmau5/Vexillology/09 Tl7 1.mp3,10.33,M
"Deadmau5/At Play, Vol.3/05 TL7 1.mp3",10.32,M
Deadmau5/For Lack of a Better Name/02 Moar Ghosts N Stuff 1.mp3,10.3,M
Deadmau5/Get Scraped/11 Support 1.mp3,9.68,M
Deadmau5/4X4=12/10 One Trick Pony (Ft. SOFI) 1.mp3,9.17,M
Deadmau5/Get Scraped/01 The Oshawa Connection 1.mp3,9,M
Deadmau5/Get Scraped/12 Edit Your Friends 1.mp3,8.43,M
Deadmau5/Get Scraped/14 Sometimes I Fail 1.mp3,8.37,M
Deadmau5/Get Scraped/04 Unspecial Effects 1.mp3,7.52,M
Deadmau5/Get Scraped/07 Try Again 1.mp3,7.45,M
Deadmau5/For Lack of a Better Name/03 Ghosts 'n Stuff (feat. Rob Swire) 1.mp3,7.44,M
Deadmau5/The Veldt EP/03 The Veldt (Freeform Five Remix) [feat. Chris James] 1.mp3,7.42,M
Deadmau5/Get Scraped/10 Bored Of Canada 1.mp3,6.64,M
Deadmau5/Get Scraped/06 I Forget 1.mp3,6.17,M
Deadmau5/Random Album Title/09 Faxing Berlin (Instrumental) 1.mp3,6.12,M
Deadmau5/Random Album Title/08 Faxing Berlin (Piano Acoustic Version) 1.mp3,3.98,M
Deadmau5/At Play/At Play.png,238.46,K
Deadmau5/It Sounds Like/It Sounds Like.png,220.98,K
"Deadmau5/At Play, Vol.2/At Play, Vol.2.jpg",127.93,K
Deadmau5/The Veldt EP/The Veldt EP.png,114.2,K
Deadmau5/Vexillology/Vexillology.jpg,103.63,K
Deadmau5/Maths - Single/Maths - Single.jpg,85.88,K
"Deadmau5/At Play, Vol.3/At Play, Vol.3.jpg",68.06,K
Deadmau5/For Lack of a Better Name/For Lack of a Better Name.jpg,40.12,K
Deadmau5/Aural Psynapse - Single/Aural Psynapse - Single.jpg,38,K
Deadmau5/4X4=12/4X4=12.jpg,34.42,K
Deadmau5/Get Scraped/Get Scraped.jpg,25.52,K
XxUnkn0wnxX - ReadMe 1st.nfo,6.67,K
