User Type,Username,Date,Text
[V],spastik64,2012-05-13T05:05Z,"DO NOT DOWNLOAD: THIS IS NUKED

NUKE: [mislabeled.S01E16_dupe.2HD.2012-05-06] 

get AFG .avi"
[V],spastik64,2012-05-13T05:06Z,It's the same episode as last week.
,cindy25,2012-05-13T05:25Z,"AFG avi is also NBC release (ep 16)

can someone in Canada post the Global ?"
,osiris420,2012-05-13T08:20Z,[NUKE] [ The Firm S01E17 HDTV x264-ASAP ] [mislabeled.S01E16_dupe.2HD.2012-05-06]
,BAIDESIGN,2012-07-22T12:59Z,"DO NOT DOWNLOAD THIS.
IS NOT Chapter Seventeen,"
