Filename,Size,Unit
Mats Bergmans-100%.mp3,4.61,M
Mats Bergmans-Ain´t that a shame.mp3,3.99,M
Mats Bergmans-All Världens Rosor.mp3,4.53,M
Mats Bergmans-Aloha Oe.mp3,5.57,M
Mats Bergmans-Alvar.mp3,5.97,M
Mats Bergmans-Att Skiljas Är Att Dö Lite Grann.mp3,4.74,M
Mats Bergmans-Bara tystnad.mp3,4.44,M
Mats Bergmans-Bara va en man.mp3,5.12,M
Mats Bergmans-Blue Christmas.mp3,5.12,M
Mats Bergmans-Blueberry Hill.mp3,5.09,M
Mats Bergmans-Breaking up is hard to do.mp3,4.3,M
Mats Bergmans-Broken hearted.mp3,6.01,M
Mats Bergmans-Bruna ögon.mp3,4.74,M
Mats Bergmans-Cannibals.mp3,5.36,M
Mats Bergmans-Ciao ciao Bambina.mp3,3.62,M
Mats Bergmans-Corrine Corrina.mp3,4.69,M
Mats Bergmans-Darling.mp3,5.9,M
Mats Bergmans-De Ensammas Promenad.mp3,5.3,M
Mats Bergmans-Den lilla krogen där nere i hamnen.mp3,5.45,M
Mats Bergmans-Den sista dansen..mp3,6.21,M
Mats Bergmans-Den stora dagen.mp3,6.26,M
Mats Bergmans-Det Borde Vara Jag.mp3,4.5,M
Mats Bergmans-Det Kommer Från Hjärtat.mp3,5.52,M
Mats Bergmans-Dream Lover.mp3,5.41,M
Mats Bergmans-Du Gav Bara Löften.mp3,5.48,M
Mats Bergmans-Du Tror Nog Att Jag Är Blåögd.mp3,4.07,M
Mats Bergmans-Du Är Den.mp3,5.52,M
Mats Bergmans-Du är mitt solsken.mp3,5.71,M
Mats Bergmans-Då tänds lyktorna i stan.mp3,4.7,M
Mats Bergmans-En Kväll Med Dig.mp3,5.14,M
Mats Bergmans-En Liten Fågel.mp3,5.4,M
Mats Bergmans-En lycklig man.mp3,5.47,M
Mats Bergmans-En sommar är kort.mp3,4.92,M
Mats Bergmans-Ett av dom sätt.mp3,4.1,M
Mats Bergmans-Ett hjärta av guld.mp3,3.81,M
Mats Bergmans-Ett Sårat Hjärta.mp3,4.85,M
Mats Bergmans-Ett Två Tre.mp3,5.7,M
Mats Bergmans-Farväl Romantica.mp3,5.4,M
Mats Bergmans-Fattig bonddräng.mp3,3.76,M
"Mats Bergmans-Finders, Keepers,Loosers, Weepers.mp3",3.88,M
Mats Bergmans-För dina blåa ögons skull.mp3,5.6,M
Mats Bergmans-Ge Mig Ett Svar.mp3,4.93,M
Mats Bergmans-Ge Mig Tid.mp3,5.2,M
Mats Bergmans-Guld Och Gröna Skogar.mp3,4.17,M
Mats Bergmans-Hallå Hallå.mp3,4.71,M
Mats Bergmans-Happy Maggie.mp3,5.53,M
Mats Bergmans-Har Du Tid Med Kärleken.mp3,4.54,M
Mats Bergmans-He'll Have To Go.mp3,6.96,M
Mats Bergmans-Här Nere På Jorden.mp3,5.83,M
"Mats Bergmans-Höga Berg, Djupa Hav.mp3",4.84,M
Mats Bergmans-I Got Stung.mp3,4.02,M
Mats Bergmans-I Just Want To Dance With You.mp3,5.71,M
Mats Bergmans-I Mitt Hjärta.mp3,4.76,M
Mats Bergmans-I många många tusen år.mp3,4.07,M
Mats Bergmans-In My Arms.mp3,5.92,M
Mats Bergmans-In your arms.mp3,3.23,M
Mats Bergmans-Ingen har dina ögon.mp3,6.35,M
Mats Bergmans-It's A Matter Of Time.mp3,5.67,M
Mats Bergmans-Jag har inte tid.mp3,4.98,M
Mats Bergmans-Jag Vill Andas Samma Luft Som Du.mp3,5.33,M
Mats Bergmans-Jag Vill Dela Varje Dag Med Dig.mp3,5.26,M
Mats Bergmans-Jag Vill Va Din.mp3,5.47,M
Mats Bergmans-Jag Vill Vara En Människa Av Idag.mp3,5.58,M
Mats Bergmans-Jag ångrar mig inte en sekund..mp3,6.65,M
Mats Bergmans-Jeannie.mp3,6.71,M
Mats Bergmans-Just Call Me Lonesome.mp3,3.82,M
Mats Bergmans-Kalifornien.mp3,5.67,M
Mats Bergmans-Kan Du Hålla Dom Orden.mp3,5.16,M
Mats Bergmans-Kan Man Älska Nå'n På Avstånd.mp3,5.38,M
Mats Bergmans-King Of The Whole Wide World.mp3,4.38,M
Mats Bergmans-Klia mig på ryggen.mp3,5.25,M
Mats Bergmans-Kungen Av Sommaren.mp3,5.57,M
Mats Bergmans-Kärlek I Månljus.mp3,4.75,M
Mats Bergmans-Kärlekens Skugga.mp3,5.58,M
Mats Bergmans-Köp en ros.mp3,5.53,M
Mats Bergmans-Landsvägens Cowboy.mp3,4.91,M
Mats Bergmans-Leker med elden.mp3,4.71,M
Mats Bergmans-Let me be there.mp3,4.66,M
Mats Bergmans-Lika kär nu som då.mp3,4.63,M
Mats Bergmans-Lilla Fågel.mp3,5.29,M
Mats Bergmans-Lite blyg.mp3,5.82,M
Mats Bergmans-Little June.mp3,4.66,M
Mats Bergmans-Lycka För Mig.mp3,4.64,M
Mats Bergmans-Ma-Ma Marie.mp3,4.97,M
Mats Bergmans-Makin' Music Mama.mp3,4.67,M
Mats Bergmans-Mariann Från Skrea Strand.mp3,4.5,M
Mats Bergmans-Min egen ängel.mp3,5.91,M
Mats Bergmans-Min Famn.mp3,5.78,M
Mats Bergmans-Min Plats Här I Världen.mp3,5.27,M
Mats Bergmans-Mina allra bästa minnen.mp3,5.4,M
Mats Bergmans-Mitt bästa för dej.mp3,6.95,M
Mats Bergmans-När Alla Drömmar Slår In.mp3,5.54,M
Mats Bergmans-När jag vaknar.mp3,5.91,M
Mats Bergmans-Om du går nu.mp3,5.09,M
Mats Bergmans-Om Och Om Igen.mp3,5.54,M
Mats Bergmans-Om änglar finns.mp3,4.9,M
Mats Bergmans-Pretty Suzy Sunshine.mp3,3.4,M
Mats Bergmans-Resa in i kärleken.mp3,4.51,M
Mats Bergmans-Rock me.mp3,5.02,M
Mats Bergmans-Rosen Som Du Gav Mig.mp3,6.98,M
Mats Bergmans-Say Yo'll Stay Until Tomorrow.mp3,5.74,M
Mats Bergmans-Schack Och Matt.mp3,4.98,M
Mats Bergmans-Se kärlekens ljus.mp3,6.3,M
Mats Bergmans-Snälla stanna kvar.mp3,4.7,M
Mats Bergmans-Som Ett Öppet Hav.mp3,5.74,M
Mats Bergmans-Sommaren Med Dig.mp3,4.89,M
Mats Bergmans-Stanna Hos Mig I Natt.mp3,4.25,M
Mats Bergmans-Stuck On You.mp3,3.99,M
Mats Bergmans-Störst av allt är ändå kärleken.mp3,5.11,M
Mats Bergmans-Svara Mig.mp3,4.7,M
Mats Bergmans-Säg som det är.mp3,4.34,M
Mats Bergmans-Så kan det gå..mp3,4.14,M
Mats Bergmans-Så Länge Drömmen Finns Kvar.mp3,5.62,M
Mats Bergmans-Så Länge Jag Lever.mp3,5.33,M
Mats Bergmans-Ta Min Hand.mp3,4.08,M
Mats Bergmans-Tack för att du finns.mp3,5,M
Mats Bergmans-Tack För En Vanlig Dag.mp3,6.18,M
Mats Bergmans-Tack och hej.mp3,5.49,M
Mats Bergmans-The Great Snowman.mp3,5.02,M
Mats Bergmans-The Phantom Of The Opera.mp3,5.13,M
Mats Bergmans-This Little Girl Of Mine.mp3,4.86,M
Mats Bergmans-Three steps to heaven.mp3,4.43,M
Mats Bergmans-Til you try.mp3,4.94,M
Mats Bergmans-Till Folkets park.mp3,5.19,M
Mats Bergmans-Tur I Kärlek.mp3,5.51,M
Mats Bergmans-Tusen tack för alla dessa år.mp3,5.02,M
Mats Bergmans-Tusen vackra bilder.mp3,6.1,M
Mats Bergmans-Två mörka ögon.mp3,5.12,M
Mats Bergmans-Tycker om dig.mp3,5.18,M
Mats Bergmans-Varje Natt Hörs Klockor Ringa.mp3,5.38,M
Mats Bergmans-Varje Natt Och Dag.mp3,4.95,M
Mats Bergmans-Varje Natt.mp3,4.89,M
Mats Bergmans-Varma vindar och soligt hav.mp3,4.35,M
Mats Bergmans-Vart tar alla åren vägen.mp3,4.94,M
Mats Bergmans-Vart Tog Tiden Vägen.mp3,5.18,M
Mats Bergmans-Vem har svaren.mp3,5.65,M
Mats Bergmans-Vem Ska Älska Dig Sen.mp3,5.17,M
Mats Bergmans-Vem vet..mp3,5.24,M
Mats Bergmans-Vem Vill Ha.mp3,5.39,M
Mats Bergmans-Vet Du Om.mp3,5.3,M
Mats Bergmans-Vild och kär.mp3,5.36,M
Mats Bergmans-Vilken Underbar Dag Just Idag..mp3,5.01,M
Mats Bergmans-Vindarna Växlar.mp3,5.06,M
Mats Bergmans-Vägen Genom Livet.mp3,6.6,M
Mats Bergmans-Vänd Dig Inte Om.mp3,5.42,M
Mats Bergmans-Våra vägar ska mötas igen.mp3,4.69,M
Mats Bergmans-Vårda ömt vår kärlek.mp3,5.31,M
Mats Bergmans-What A Wonderful Life.mp3,4.16,M
Mats Bergmans-What You're Missing.mp3,6.02,M
Mats Bergmans-Wild At Heart.mp3,3.92,M
Mats Bergmans-You'll Never Know.mp3,4.93,M
Mats Bergmans-Young And Beautiful.mp3,5.27,M
Mats Bergmans-Är det vad du vill.mp3,5.3,M
Mats Bergmans-Är du min älskling än.mp3,6.29,M
"Mats Bergmans-Åh, Vilken Underbar Dag (Just Idag).mp3",4.72,M
Mats Bergmans-Årets skiftningar.mp3,6.13,M
Mats Bergmans.jpg,48.6,K
