User Type,Username,Date,Text
,Dody_Dody,2012-08-04T15:36Z,fake wsh kda
,TeamCC,2012-08-04T17:18Z,Its Not Fake... Its Real..
,Dody_Dody,2012-08-04T21:26Z,ok i will see
,Dody_Dody,2012-08-04T21:26Z,i will download it.. now
,izzybel,2012-08-05T05:06Z,so its only a screen shot? 
,chiay08,2012-08-09T02:01Z,fake?
,THEinformat,2012-08-26T23:11Z,"wait so is this fake cuz i want to show it at a movie night in my skul, i am middle skul student counsil president"
,isinghhardeep,2012-09-01T21:44Z,extremely bad blur cam print!! audio -5/ video-2
