User Type,Username,Date,Text
,Centurion13337,2012-04-26T22:22Z,Thanks for sharing this in awesome quality! Nice set list.
,Centurion13337,2012-04-27T16:39Z,A bit more seeding would be appreciated though.
,twix41,2012-04-29T16:21Z,"Should be good, now please can we get it seeded, loads of us stuck on 97%"
,henriquestock,2012-05-01T02:36Z,"Foi ripado do MSHD? A qualidade está boa?
Is it ripped from MSHD? Is it awesome quality?"
,schamlos,2012-05-01T22:10Z,"henriquestock
Sim, foi ripado do MSHD, a qualidade esta em HD 1080i"
,eusousidney,2012-05-02T02:36Z,"muito obrigado, tentei gravar mas estava um tumulto aqui em casa e não deu."
,henriquestock,2012-05-04T05:21Z,"schamlos, a qualidade está ótima mesmo. Dei um play no arquivo antes de concluir o download e deu pra ver. Agora é esperar o download acabar. Valeu mesmo."
,rodilhasep,2012-05-11T01:59Z,"Velocidade do download aqui não passa de 20k/s :///
Minha internet é de 1 mega"
