User Type,Username,Date,Text
,G.a.m.e.s,2012-06-15T12:46Z,Like us for more updates - Games At TPB on facebook. 
,motley666,2012-06-15T13:00Z,What portable means? I never get it.
,G.a.m.e.s,2012-06-16T01:36Z,"@motley666 it means no install, you can copy and paste the whole lot onto usb and play. Just a lot easier when its portable."
,gabeV,2012-06-26T11:21Z,"one of the best game uploader on TPB, please more Portable games!"
,mystikal999,2012-08-15T11:30Z,wot about the restrigy entries
,mystikal999,2012-08-15T11:31Z,i get 1.1mb download :p
,kattie224,2012-08-31T15:02Z,"Sweet, thanks!"
,zullia,2012-09-11T00:03Z,HOOO !!!
