Filename,Size,Unit
Poster/Teenage Mutant Ninja Turtles 2.jpg,50.68,K
Sample/Teenage Mutant Ninja Turtles 2 Sample.mp4,38.89,M
Subtitles/5 Ways To Download Torrents Anonymously.txt,4.13,K
Subtitles/English SDH.srt,184.62,K
Subtitles/French.srt,149.6,K
Subtitles/Spanish.srt,156.98,K
Subtitles/Torrent downloaded from AhaShare.com.txt,59,B
Subtitles/Torrent downloaded from Demonoid.com.txt,47,B
Subtitles/Torrent Downloaded from SilverTorrents.me.txt,41,B
Subtitles/Torrent Downloaded from TorrentState.com.txt,46,B
Subtitles/tracked_by_h33t_com.txt,23,B
Kingdom RG.nfo,11.51,K
Teenage Mutant Ninja Turtles 2.mp4,2.98,G
