User Type,Username,Date,Text
,Applegrenade,2012-03-28T05:06Z,What happened to American History X? same movie but from like 2 different perspectives
,abj642,2012-03-28T13:53Z,thanks YIFY
,tingya,2012-03-28T22:39Z,"hey man do some 1080p HD to
1080p"
,blackbears28,2012-03-29T02:50Z,Hey can you please do 007's Tomorrow Never Dies...no one has ever uploaded an hd version
,lvnitup,2012-03-29T04:00Z,"Hey Yify, any chance you will re up Fast and Furious 2009 as it is the only one of the set you dont have up. thanks heaps!"
,suraj_b_h,2012-05-26T22:12Z,"yeah one very good movie   :)
thanks a lot for such a nice torrent :)

A=10
V=9

ONE MUST WATCH MOVIE "
