Filename,Size,Unit
My vibrator is ready for my clitty - Home Porn Bay_(new).avi,133.85,M
Pussy eating in a public place - Home Porn Bay_(new).avi,125.95,M
"So pretty ebony girlfriend make awezone webcam sex fun for the World,enjoy - Home Porn Bay_(new).avi",67.49,M
Slippery hairy cunt rammed hard - Home Porn Bay_(new).avi,59.89,M
"Pretty chubby redhair wife make a lustful sex fun monday afternoon,!damn! - Home Porn Bay_(new).avi",55.08,M
Super tight amateur babe rammed - Home Porn Bay_(new).avi,42.92,M
So pretty brunette milf wife make sex fun with his lustful husband sunday night - Home Porn Bay_(new).avi,35.55,M
MILF taking it up her nasty pussy - Home Porn Bay_(new).avi,24.29,M
Rare amateur black and white video - Home Porn Bay_(new).avi,22.56,M
"Pretty ebony girlfriend make a hell of a blowjob in hotel room bathroom,!damn! - Home Porn Bay_(new).avi",18.69,M
Stunning brunette on her knees - Home Porn Bay_(new).avi,17.53,M
So pretty latin girlfriend make sex fun with his friend when stay alone in house - Home Porn Bay_(new).avi,13.87,M
Red haired chick on her knees - Home Porn Bay_(new).avi,11.28,M
