User Type,Username,Date,Text
,Kreved_Prevedko,2012-10-20T16:31Z,What version? Patched?
,roullade,2012-10-20T18:08Z,i downloaded the torrent and got 13 parts what do i have to do now to install the game? 
[H],shirepirate,2012-10-21T00:20Z,"@roullade

use a program to extract them like Universal Extractor then mount the ISO"
,xXgogoXx,2012-10-22T11:37Z,Same here... What version? Patched? 
,matekun,2012-10-24T14:05Z,"yeah,is patched or the bugged original?"
,Skidrowz,2012-10-25T05:20Z,sir this flt patch version skidrowzgames
,jmrs11,2012-11-11T20:11Z,"I can't find any ISO file, where is it?"
