User Type,Username,Date,Text
,drozono,2012-12-29T10:48Z,"FAKE. DONT DOWNLOAD IT! this is a cycling trailer, start and finish, start and finish, so to the long movie... FAKE. USER BANN PLEASE!"
,drozono,2012-12-29T11:01Z,FAKE... FAKE...FAKE...DONT DOWNLOAD...IS A CYCLING TRAILER...
,drozono,2012-12-29T11:05Z,User will be banned by post fake torrents
,mafranser,2012-12-29T21:30Z,"mentira solo es el triler que se repite.
fake fakeeeeeeeeeeeeeeeeeeeeeeeeeeeeeeeeeeeeeeeeeeeeeeeeeeeeeeeeeeeeeeeeeee!!!!!!!!!!!!"
