User Type,Username,Date,Text
,agustaufik,2012-10-27T17:26Z,"Does this package require Microsoft SharePoint Server 2013 by any chance? If so, where can I get SharePoint 2013, or any related package such as Exchange 2013 or Lync 2013. Thank you very much for the post. Great..."
,unmarkedfaith,2012-10-27T21:53Z,"ill grab those for u and get them posted. I honestly dont know.  I installed just the office suite and Exchange 2013, which i love. I love the new ECP :)"
,taosd,2012-10-28T03:32Z,Seed exchange 2013 pls
,taosd,2012-10-28T06:18Z,Keep getting proof.cab errors just like the lulziso
,jklequal,2012-10-30T12:32Z,Please upload MSDN/Technet versions of Exchange 2013 & Sharepoint 2013.
