Filename,Size,Unit
Magic Mike (2012) 1080p BluRay AC3+DTS HQ Eng NL Subs/Magic Mike (2012) 1080p BluRay AC3+DTS HQ Eng NL Subs.mkv,8.17,G
Magic Mike (2012) 1080p BluRay AC3+DTS HQ Eng NL Subs.nfo,1.18,K
Torrent downloaded from AanMeHoelaJa Torrents on BTScene.eu.txt,71,B
Torrent downloaded from AhaShare.com.txt,58,B
Torrent Downloaded From BTScene.eu.txt,45,B
Torrent downloaded from Demonoid.me.txt,46,B
Torrent Downloaded From ExtraTorrent.com.txt,353,B
Torrent downloaded from KAT.ph.txt,41,B
Torrent Downloaded from limetorrent.txt,50,B
Torrent downloaded from Rarbg.com.txt,33,B
Torrent downloaded from silvertorrent.org.txt,86,B
Torrent downloaded from thepiratebay.se.txt,50,B
tracked_by_h33t_com.txt,23,B
