User Type,Username,Date,Text
,RedRaw1,2012-09-22T01:13Z,Thanks
,justslide,2012-09-22T11:47Z,Finally! Thank you!
,IceBizNiz,2012-09-22T13:11Z,Thank you SO MUCH for the XL version. I can't understand why anyone would want LESS QI :)
,voltaireisdead,2012-09-23T09:59Z,can MP4SUX be the new SKID and provide us with quality QI XL? I say yes!
,Harrumble,2012-09-24T05:56Z,"You are fantastic. Thank you so much for uploading the new QI episodes so quickly. And great quality episodes at that, too :)"
,MP4SUX,2012-09-25T07:07Z,"Can't take personal credit for the quality - that belongs to some unknown but wonderful Brit.

I am but a humble messenger.

I miss my [place that won't allow other www in forums] ... shhh ..."
