User Type,Username,Date,Text
,daco1xxl,2012-07-09T23:26Z,is there better audio with this copy? thats all it needs!!!
,saint84,2012-07-10T00:35Z,agree. better audio
,saint84,2012-07-10T00:48Z,"well . even worse, out of sync .  this is a step down  ."
,beerswagger,2012-07-10T12:16Z,i think saint is out of sync and a step down
,RIIX,2012-07-10T23:14Z,LOL I WAS WONDERING WHERE THE AUDIO WENT...WATCHABLE.Thank You
,nani177,2012-07-12T03:47Z,"This is  the same previous version I've checked  
You know what i mean it's shot somewhere in India 
in this video some dude talking in the phone in Hindi 
Hindi was the official language in India"
