User Type,Username,Date,Text
,getdownfast,2012-08-03T04:55Z,VTV is amazing love this show
,Jasonsj10,2012-08-03T05:00Z,Great Show! We need some seeders! I missed this episode today. Thank you VTV. But this download will take forever xD
,tromac,2012-08-03T05:18Z,Thanks for posting
,Elropo,2012-08-03T05:44Z,Thanks.  It's always good!
,Jasonsj10,2012-08-03T05:46Z,This is hylarous. I think Burn Notice will come back on in 15 mins before this even finishes downloading :P. So I wont have a use to download this xD
,random12345,2012-08-03T14:28Z,Thanks for this was a fast download took 10mins :D will seed for a while. Good quality as well :)
,CosmAvngr,2012-08-03T16:10Z,"I thought x264 was going to lead to smaller files, not bigger ones?

I miss BoB."
,dee60,2012-08-03T17:48Z,Thanks for sharing.
,OASAASLLS,2012-08-04T00:54Z,"Seriously, what is going on with this stuff???"
,SrMLove,2012-08-05T04:23Z,"@Jasonsj10: there is nothing hilarious about what you said... except perhaps you poor spelling... and that you use ""emoticons"" or whatever they are called... are you a little girl in grade school? this site is for ppl over 18.... this content may be too much for you..  how did you get past the parental controls?..... oh "
,SrMLove,2012-08-05T04:28Z,and the end part is hilarious as well... 
