User Type,Username,Date,Text
,MX27,2012-06-17T21:37Z,Is this supposed to say 250? or is it just a different format for 450?
,saphir18,2012-06-18T00:51Z,Mx27 it is 450 Moto 2. Thank Slick.
,MX27,2012-06-18T05:52Z,muchos Gracias Slickness
,MX27,2012-06-18T05:53Z,I also suggest donating to him which I have already done. :)
,slicknick610,2012-06-18T07:16Z,I am waiting on CMBracing for both 250 motos because they were on Fueltv and the first 450 moto because it was on NBC and my local affiliate did not show it.
,MX27,2012-06-19T08:57Z,"Wow. Thanks for both Moto's Slick....
I understand Format now ;)"
