Filename,Size,Unit
b-youtube-downloader.exe,5.71,M
laxity.nfo,6.91,K
file_id.diz,406,B
Torrent downloaded from ExtraTorrent.com.txt,353,B
Torrent downloaded from Ahashare.com.txt,59,B
Torrent downloaded from Demonoid.me.txt,46,B
Torrent downloaded from ThePirateBay.se.txt,39,B
ser.no.txt,39,B
Torrent downloaded from IsoHunt.com.txt,35,B
Torrent downloaded from Btarena.org.txt,35,B
Torrent downloaded from 1337x.org.txt,33,B
Torrent downloaded from Rarbg.com.txt,33,B
Torrent downloaded from H33t.com.txt,32,B
Torrent downloaded from Kat.ph.txt,30,B
