User Type,Username,Date,Text
,smurphyzeke,2012-08-29T12:07Z,Thanks
,dragonbandit314,2012-08-29T14:46Z,"Many thanks, yet again a set of albums I have never heard.
Appreciated. Be well. T."
[V],steevo-be-thy-name,2012-08-29T16:12Z,"I have a crazy request sir ,  I don't suppose you have a good copy of Fruits of Passion , the name of the album is Fruits of Passion , I can find it on lots of places but the problem is it's very low quality , I think its round about 46 mb and barely 128kbps , so it's  total rubbish .

If you can do this , you will go from legend to a god ."
[V],80zforever,2012-08-30T20:43Z,"Hi steevo-be-thy-name, it's not a problem at all and will post it for you. but I will be away from home for two weeks, so once I am back, I'll get the record, clean it and post a high quality mp3 here. cheers"
,r.trifun,2012-08-30T22:32Z,"The Get Smart! album is a real punk rock gem.
World without End and Room with a View are, in my opinion, anthology songs in punk rock terms. 
Thanks once again for these wonderful discoveries.
Cheers."
,8675309,2012-08-31T02:10Z,Awesome! Thank You!
,alejandro70pb,2012-09-01T02:16Z,GRACIAS  !!!!!!!!!!!!!!!!!!!!!!!!!!!!!!!!!!!!!!!!!!!!!!!!!!!!!!!!!!!!!!!!!!!!!!!!!!!!!!!!!!!!!!!!!!!!!!!!!!!!!!!!!!!!!!!!!!!!!!!!!!
