User Type,Username,Date,Text
[V],merzedes,2012-04-26T23:56Z,Ser det er noen norske innpå her  :-) hvis det er problemer å takke på Engelsk så er dere hjertelig velkommen til å takke på Norsk  :-)  Cheers  (Skål)
,shallow2,2012-04-27T00:15Z,"Er du og Norsk ?? nemmen :) å vent, det visste jeg jo.. hehe"
,nightprowler.,2012-04-27T01:02Z,Takk
,nilodum,2012-04-27T05:14Z,Thanks a lot!
,donthom,2012-04-27T17:21Z,"oh yes, Thank you."
,bertie_01,2012-04-27T19:43Z,Takk skal du og dere ha :)
,p3ns3ur,2012-05-03T23:03Z,;D  takker og (stram)bukker!
