User Type,Username,Date,Text
,f.veeresh,2012-12-17T09:28Z,thanku thanku very much pls upload arakashka dvd rip pls bro.....
,Bindas143,2012-12-17T10:05Z,"@f.veeresh sorry buddy, I had some problems while uploading this torrent, please download the newly created torrent. sorry again"
,Bindas143,2012-12-17T10:43Z,"Please download this one, which is working fine.

http://thepiratebay.se/torrent/7931696/Jarasandha_Kannada_DVDRip_2011__BindassBro_s"
,ssanthosh,2012-12-17T12:12Z,Thx bindass bro keep uploading:P
,rajakumar,2013-01-03T04:37Z,"@Bindas143:

Can u please upload these kannada movies like Kariya 2003, Ranga S.S.L.C, Kiccha Huccha 2010, Sanju Weds Geetha 2011, and Jogayya 2011. "
