User Type,Username,Date,Text
,cschrille1,2012-03-18T04:09Z,"Can you use play Cry of Fear using cracked HL, or is steam needed?"
,DeathPants64,2012-03-19T00:13Z,"@cschrille1
You need the steam version."
,Myrexx,2012-03-19T02:36Z,Did I give you guys more than Half Life? (excluding the half Life mods)
,mockets,2012-03-19T20:37Z,It doesn't let me extract it is there something wrong?
,mockets,2012-03-20T00:15Z,"!   C:UsersOwnerDownloadsHalf-Life Ultamite Pack.zip: The archive is either in unknown format or damaged

If someone tells me how to fix this ill seed forever :)"
,Myrexx,2012-03-20T04:39Z,"@mockets
Want me to reupload?
"
,mockets,2012-03-20T05:54Z,"yes please, if that would work, when i open the file there is nothing in it"
,mockets,2012-03-20T05:57Z,"if reuploading it would work, then yes."
,jive5trio,2012-03-20T07:44Z,Can't read the read me file. I got the same error. instructions on what to do with this giant packet??
,Myrexx,2012-03-26T00:11Z,"Dont worry... Im gonna reupload, and as an apoligy, im gonna add in an extra."
,Myrexx,2012-03-26T03:39Z,http://thepiratebay.se/torrent/7131853 Go here for new upload.
