User Type,Username,Date,Text
,sHaDoWeXiLe187,2012-08-11T13:17Z,"please be patient as i am currently the only seeder.. i will be uploading at my maximum speed, which is only 80kbps.. so again.. please be patient & dont forget to help seed so other ninjas can peep this freshness.. mcl"
,darthcheeto,2012-08-11T14:15Z,lol Whoop Whoop Ninja Fuck yea ima Seed for a bit and ive already Preordered My Copys *White pop and Black pop Thanx For the torrent i always like to back up my data/files/Cds/whatever the fuck i has and it nice to get it at the same time as everyone at the Gathering lol MMFWCL!!!
,darthcheeto,2012-08-11T14:16Z,Oh and Say Ninja Whats up on that Underground Avengers isnt #BBC Releasing it at the Gathering for free i havnt been able to find it online itd be nice to lol Hook it up fam lol MCL
,sHaDoWeXiLe187,2012-08-11T14:34Z,im not at the gathering ninja.. but i'll have a look for it.. if i find it i'll post it up..
,GimmeWCL,2012-08-12T09:19Z,Fuck thanks so much
,jon_the_juggalo,2012-08-12T20:57Z,@shadow- Man you are the shit!! I will seed thins like no other!! Thanks a million MMFWCL
,sacredpotion24,2012-08-17T17:06Z,thanks for the torrent... 100% REAL DEAL... but personally i don't like t his new stuff ta all... i miss the old icp.... thank for the upload though man.
