User Type,Username,Date,Text
,ccelias,2012-02-19T23:30Z,"Fenomenal amigo, muito obligado !!! Se tiver outros, cursos, provas, etc.... posta ai !!! Grande abraço e novamente..FENOMENAL, M.OBRIGADO"
,ccelias,2012-02-22T15:39Z,"Excelente post.
Nao obstante, nao descarrega de nenuma forma, levo mais de 1 sem. com ele e so conseguí descarregar 59 mb (Tamaño total 2.42 Gb) ???

Sera que me poden dar uma ajuda ?
M.OBrigado."
,danilo.valadao,2012-04-07T22:07Z,Também disponível no mediafire.
,canariobr,2012-06-23T21:59Z,Tem video ou audioaulas também?? Faz UP aí! Valeu!
,canariobr,2012-06-23T21:59Z,quem tiver material do medcel compartilha!!
,gustavo259,2012-08-10T17:26Z,"Ola amigo, será q voce nao poderia conseguir o Medcurso ciclo 2 (M.E.D) e o intensivão??? M.OBRIGADO"
,gustavo259,2012-08-10T17:27Z,"Ola amigo sera q poderia conseguir pra nois o Medcurso ciclo 2, seria tb fenomenal!! 1abz"
,gustavo259,2012-08-11T20:14Z,OLa amigo sera q poderia subir tb o Medcurso ciclo 2 (MED) seria fenomenal!!!
