User Type,Username,Date,Text
,STFmaryville,2012-11-14T15:55Z,I'm not crazy about Bendis but this was not a half-bad story to read. Look forward to the next issue. Thanks for uploading GunningHawk90.
[V],GunningHawk90,2012-11-14T16:11Z,I gotta agree with ya. This was a pretty decent 1st issue.
,Rhayne,2012-11-14T18:52Z,"GunningHawk, you're my superhero. "
,riverchase,2012-11-14T20:45Z,thank you for all your hard work
,kophee,2012-11-14T22:03Z,thanks!
,new52,2012-11-15T01:28Z,More seeders for this book than TWD right now!
[V],GunningHawk90,2012-11-15T09:21Z,"^Yeah, right now. TWD always walks away with it later."
