User Type,Username,Date,Text
,xjessiieex,2012-03-23T13:45Z,"A??
V??
M??"
,Celeste1,2012-03-23T13:48Z,Any comments at all?
,azza3211,2012-03-23T13:59Z,I just thought I would post this in case some of you don;t read the description. The audio is in Russian.
,murgret,2012-03-23T14:04Z,"Here are a few screencaps:
http://lostpic.net/?photo=937149
http://lostpic.net/?photo=937158
http://lostpic.net/?photo=937150
http://lostpic.net/?photo=937168"
,Thugnificent777,2012-03-23T14:13Z,Its in russian (from the title) Ill report with AVM after I download it
,parksey84,2012-03-23T14:15Z,Dont forget its in Russianmight want to wait for the english one...
,Blauwdrop,2012-03-23T14:17Z,"A:6
V:7
M:10 ofc
I stopped downloading after 30 minutes, I realised it was all in Russian -.-"
,Celeste1,2012-03-23T14:19Z,IMO A:5  V:3 Why can't it be in English!!? ^.^
,Thugnificent777,2012-03-23T14:27Z,"Its all in russian (Like I and others have stated before) The camera is zoomed in too much so it feels like some peoples faces are cut out, the quality of the sound honestly isnt that bad, but its in russian...

A:8
V:4(the typical camrip)
M: 10 (awesome movie)"
,remcycle,2012-03-23T14:30Z,"Looks pretty good for a russian cam, audio is about a 6.

I miss the days when people could plug their cameras into handicap audio jacks! :)

And yes...this is very much in Russian."
,AppleSauceCanadian,2012-03-23T14:49Z,"I hope someone uploads an english one soon, I am seeing this on Tuesday but I really can't wait..."
,Kmlkmljkl,2012-03-23T15:58Z,Looks like I will have to wait a while ... :(
,trueboss926,2012-03-23T17:09Z,Why Russian? WHY!!?????
,dgcash,2012-03-23T17:41Z,Any chance of getting english subs?
,AppleSauceCanadian,2012-03-23T19:23Z,Any chance of the guy who filmed it to go to the English version?
,John12642,2012-03-23T19:39Z,I have to get this Movie so bad. Why did it have to be in Russian. I guess they're probably psyched  about this.
,cafedon,2012-03-23T19:55Z,"Russians is the best people on a planet!!! and it say that is on russian, why you download it? are you stupid? dont download, dont comment...seamply as that..SRBIJA!"
,jinzouningen,2012-03-23T20:20Z,Subtitles possibly then? someone make some and link us =s
,megz2608,2012-03-23T20:21Z,i really wanna c this but wots quicker . waiting till I saved sum pennies then go c it at movies or learn russian and watch this version lol
,mikiqex,2012-03-23T21:19Z,"For those, who would like to see ""better quality"" as runechampion or Ershad posted, have your credit cards ready! It's for registered users only and during reg it asks for this. For others (like me) it's only a waste of time."
,sup1990,2012-03-23T21:57Z,"This is great for Russian viewers, really hope to see an English version up here soon :)"
,Ratkobom,2012-03-23T22:08Z,i am not downloading only because its russian
,theeccentrik,2012-03-23T22:14Z,"Yeah get your credit cards ready and prepare for a lawyer enduced 12month hell tryin to get the £5k raped from your account!
All to view a slightly better cam version!! lmao

You could count the genuine sites online on one hand! (If your a simpson that is )"
,bdawg83,2012-03-23T23:11Z,"What I don't get is there are TONS of ppl who wanna see this movie....you're tellin me not one of those many ppl has uploaded this movie in English....Russian is great, if you understand it....where's the english version...come on ppl...we know you're out there...haha"
,Kingman_Arizona,2012-03-23T23:28Z,"Its all in russian (Like I and others have stated before) The camera is zoomed in too much so it feels like some peoples faces are cut out, the quality of the sound honestly isnt that bad, but its in russian............................................."
,Kingman_Arizona,2012-03-23T23:29Z,"Quality: CAMRip
Duration: 02:13:21
Container: AVI
Video: DivX 5.x, 672x432, 15.00 fps, 1300 Kbps, 0.299 bits/pixel
Audio: Russian Dub, MPEG Audio Layer 3, 48000Hz stereo, 192Kbps	"
,Kingman_Arizona,2012-03-23T23:31Z,"What I don't get is there are TONS of ppl who wanna see this movie....you're tellin me not one of those many ppl has uploaded this movie in English....Russian is great, if you understand it....where's the english version...come on ppl...we know you're out there...haha "
,spaceballz2010,2012-03-23T23:59Z,"i wish i was russian, they seem to always get the new releases first.  Remember 30 min or less, there was a rusian copy out there for two months before there was an english"
,Killer12972,2012-03-24T01:09Z,WHY NO ENGLISH?
,Killer12972,2012-03-24T01:10Z,Why No English?
,noybinhd,2012-03-24T01:32Z,Hey! I found a better version at Fekk off you fekkin spammers!
,keallineage,2012-03-24T03:35Z,Well heck... I'm just gonna download the dogon thing in Russian and watch it anyways. LOL I might not be able to understand what they are saying but the action should be good just as well.
,firstyoulive,2012-03-24T05:38Z,"i don't know what makes me sadder, all the spam links to other sites or a russian movie. "
,Gros_Shadok,2012-03-24T09:03Z,"firstyoulive, I think what is sadded are all those links pretending to give a ""dvdrip"" or ""hd"" version of the movie... only a few minutes after its 1st day release. Come on guys ! How stupid do you think people are ?"
,whitepower72,2012-03-24T10:11Z,slotivic zlatcto bluurrrbbirshz.. wot the fuk in russian. who understands this shit. fuck all spammers and fake pirates. .argghhh... real pirate movies only you god damm fucking idiots.. aussie aussie aussie oi oi oi
,Android_sheep,2012-03-24T11:46Z,Спасибо за раздачу. Очень оперативно).
,myst279,2012-03-24T13:11Z,"I'm waiting for an English vers, but ty maxrus for giving folks a REAL upload so quickly."
,memoboiii,2012-03-24T13:41Z,English version is already out i found it on here 
,memoboiii,2012-03-24T14:11Z,good !
,JOStheFOX,2012-03-24T16:15Z,"russian sh*t
spasziba m*ther f*cker
pls ban maxrus cause he is 1 real biaaaaaaaaaaaaaaaaaaatch"
,Airgunner2012,2012-03-24T16:25Z,"Why has no one uploaded it in english yet when its out on tube + in english!!!!!!!!!!!!!!!!!!!!!!!!!!!!!!!!!!!!!!!!!!!!!!!!

COMON PPL Please."
,Cerawmn,2012-03-24T17:36Z,"Hey memoboiii, you said that you found this in english but neglected to tell us where! Obviously I am not the only person here that has been looking for it and only found this sooo 1. either you are not telling us the truth or 2. you have forgotten something in your comments. How about sharing some of that knowledge... "
,Cerawmn,2012-03-24T17:41Z,Thank you slaipriv. I am going to look at it now. Is it in english? 
,trigger757,2012-03-24T18:11Z,"Here is hash for downloading CAM in ENG. This is the russian release with eng sound.

383DCFDD321ADE8CD4339AF18CB9E88BDB29F810

ENJOY"
,trigger757,2012-03-24T18:15Z,"Here is the hash for Hunger games in Eng:

383DCFDD321ADE8CD4339AF18CB9E88BDB29F810

ENJOY"
,Snaff_foo,2012-03-24T19:11Z,"if you want to have your windows validation stolen..then click on any one of those spammers trying to direct you to there *better version* site.
Yall chinks and turks need to be H-bombed."
,tattoogirl72,2012-03-24T21:18Z,there is an english version uploaded today taking along time though to upload but that is the only english version
,keallineage,2012-03-24T22:16Z,"Trigger, how do you find it using the Hash?"
,sunbeam412,2012-03-24T22:58Z,"@ dishaaa
go to hell and back again."
,dayglo666,2012-03-25T04:00Z,yes we know its in russian cos we read the 6000000000 comments b4 urs and funnily enuf it says so in the title so what its in russian and all u tards ary theyve got a right to up movies in theyre language as well as anyone else
,Alexei_s,2012-03-26T02:14Z,out of sync
,oikjgbvguiugfc,2012-03-28T15:34Z,"quit spamming, losers ^
Guys, don't follow those bung links."
,luciano.duarte,2012-04-22T20:58Z,"V=1
A=1"
,Osqa,2012-06-05T17:47Z,Thanks for the effort thou! 
