Filename,Size,Unit
Sheer Heart Attack/01 Brighton Rock.mp3,11.94,M
Sheer Heart Attack - Bonus EP/01 Now I'm Here (Live).mp3,10.27,M
Sheer Heart Attack/06 Now I'm Here.mp3,9.91,M
Sheer Heart Attack/12 She Makes Me (Stormtrooper In Stilettos).mp3,9.56,M
Sheer Heart Attack/13 In The Lap Of The Gods...Revisited.mp3,8.72,M
Sheer Heart Attack - Bonus EP/02 Flick Of The Wrist (BBC Session).mp3,7.95,M
Sheer Heart Attack/07 In The Lap Of The Gods.mp3,7.8,M
Sheer Heart Attack/04 Flick Of The Wrist.mp3,7.59,M
Sheer Heart Attack/02 Killer Queen.mp3,6.95,M
Sheer Heart Attack - Bonus EP/03 Tenement Funster (BBC Session).mp3,6.91,M
Sheer Heart Attack/03 Tenement Funster.mp3,6.43,M
Sheer Heart Attack - Bonus EP/05 In The Lap Of The Gods...Revisited.mp3,6.01,M
Sheer Heart Attack - Bonus EP/04 Bring Back That Leroy Brown (A Capella).mp3,5.35,M
Sheer Heart Attack/08 Stone Cold Crazy.mp3,5.25,M
Sheer Heart Attack/11 Bring Back That Leroy Brown.mp3,5.23,M
Sheer Heart Attack/10 Misfire.mp3,4.26,M
Sheer Heart Attack/05 Lily Of The Valley.mp3,4.06,M
Sheer Heart Attack/09 Dear Friends.mp3,2.68,M
