User Type,Username,Date,Text
,nas.ebooks,2012-04-18T23:46Z,"Thank you very much for these - my mother loves Sidney Sheldon's books, and I'm going to load the Kindle I'm giving her for Mother's Day with as many of her favorite authors as I can find!

You are a true treasure, KK..."
,kymp322,2012-04-19T00:07Z,Thanks for another awesome UL KK!
,shelleyjohn,2012-04-19T00:35Z,Do you by chance have The Replacement Wife by Eileen Goudge
,MABY8686,2012-04-19T10:51Z,Ty so much KK your back in style :)
,pencritical,2012-04-25T06:16Z,"Thanks so much, this fills in the holes in my collection. I love his books!"
