User Type,Username,Date,Text
,humptyhumping,2012-11-05T17:59Z,Great Pack thank you ! Any chance tho these will work under 7 x64 ? Or at least XP 32bit ?
,Lovok,2012-11-05T18:20Z,GOG versions are generally tweaked to be compatible with new Windows OSes including Win7. There are also unofficial patches included which enhance compatibility and visual quality.
,Xigor,2012-11-06T08:54Z,For thief 3 does it still do that thing where when you go to the next level it exits out of thief 3 and opens up another window to load the level?
,Lovok,2012-11-09T09:52Z,"New TafferPatcher for Thief 2, now including NewDark engine: http://www.ttlg.com/forums/showthread.php?t=131106"
,lol10101,2012-11-15T02:02Z,So...how do you install?
