User Type,Username,Date,Text
,theo23rd,2012-11-06T17:21Z,"Thanks, mate. You're the antidote the scenebalance's greed."
,TWEETY2455,2012-11-06T18:23Z,THANKS TONY U ARE THE BEST
,TWEETY2455,2012-11-06T18:44Z,"TONY DOESNT M,ATTER IF U ARE A GIRL OR A BOY
WOULD U DO ME ? LOZZZZZZZZZZZZ,I AM A BOI LOL LOST MY I@"
,B0b_D0le,2012-11-06T21:53Z,"lol, some people get awfully worked up over judge judy."
,gayavenger,2012-11-06T22:39Z,Thanks Tony!  53 & 54 + 56 onwards are still missing.  It would be incredible if you could upload them for us all.  Cheers mate!
,TWEETY2455,2012-11-06T23:14Z,TONY SWEETY IF U COULD DL MORE I SURE WILL PRAY 4 UR SOUL *_*
