User Type,Username,Date,Text
,girlwitharose,2012-06-03T16:00Z,Uh... not out yet buddy...? Did you mean another season or are you uploading fakes?
,pseudoism101,2012-06-03T18:39Z,"its real, thanks Skimpy007"
,Skimpy007,2012-06-04T16:01Z,"Welcome!

Nah its Season 3.  Real deal.

I have stopped uploading it so if its slow or doesn't work. 
You'll have to ask fello Pirater's to seed"
,rblair90,2012-06-04T18:06Z,LEGIT!! I don't know how you got these eps but thank you AWESOME
,TyranaTopherRex,2012-06-04T18:09Z,Its only 59 Mb so no its not real
,TyranaTopherRex,2012-06-04T23:56Z,Nvm it is real!!!!
,danielwe,2012-06-05T01:58Z,"skeptical about this one, but will try on my deadbeat unused laptopt from 05, will get back wether it died or not ;)"
,danielwe,2012-06-05T02:07Z,"Well it works, a 6 / v 9 also it seems it's censored, don't remember it usually being that. But yeah great work thanks! Will check E03 soon."
,Skimpy007,2012-06-05T21:14Z,"rblair90 - Welcome

danielwe - Welcome, ya sorry tried to convert to HD no luck."
