User Type,Username,Date,Text
,vnlima,2012-10-09T02:11Z,"Awesome upload by HobbitGamez, as usual.
Is there any chance that you upload FIFA Soccer 13? There aren't any NTSC releases out there. Thx."
,jamesrb,2012-10-25T10:02Z,I've only played the My Player mode but it's just the NBA2K11 My player. It appears to be 2k11 with different rosters and layouts.
,xsotic,2012-10-27T20:53Z,Can We Please Get This For Mac
,thejosif,2012-11-10T14:39Z,"Anytime I press ""Quit"" the game gets blocked, no matter what game mode i'm playing. (playing with USB drive)"
