Filename,Size,Unit
ChattChitto RG.nfo,12.53,K
Greatest Hits/01 Are You Gonna Go My Way.mp3,8.07,M
Greatest Hits/02 Fly Away.mp3,8.46,M
Greatest Hits/03 Rock & Roll Is Dead.mp3,7.78,M
Greatest Hits/04 Again.mp3,8.73,M
Greatest Hits/05 It Ain't Over 'Til It's Over.mp3,9.25,M
Greatest Hits/06 Can't Get You off My Mind.mp3,10.44,M
Greatest Hits/07 Mr. Cab Driver.mp3,8.78,M
Greatest Hits/08 American Woman.mp3,9.98,M
Greatest Hits/09 Stand by My Woman.mp3,9.9,M
Greatest Hits/10 Always on the Run.mp3,8.86,M
Greatest Hits/11 Heaven Help.mp3,7.26,M
Greatest Hits/12 I Belong to You.mp3,9.8,M
Greatest Hits/13 Believe.mp3,11.25,M
Greatest Hits/14 Let Love Rule.mp3,13.06,M
Greatest Hits/15 Black Velveteen.mp3,11.01,M
Lenny Kravitz - Greatest Hits [ChattChitto RG] Cover.png,124.74,K
www.ChattChitto.com.nfo,7.9,K
