User Type,Username,Date,Text
[T],mrriser007,2012-06-23T15:34Z,seed.comment.rate
,nitrojunkie007,2012-06-24T00:30Z,so nice of you..jus the skull is missin'...!! :-)
,Cuelebre,2012-06-24T03:09Z,"Directions to use the keygen, please?"
,bmwusaz,2012-06-28T03:27Z,"It works very good.
best of all it's FREE!"
,r46u50r1n,2012-07-04T22:32Z,"Windows cannot access the specified device, path, or file. you may not have the appropriate permissions to access the item. This only on the setup file.

The keygen works fine. Thx anyway. "
