User Type,Username,Date,Text
,Crash2701,2012-04-17T03:32Z,"Why do you re-up all this stuff? Appreciate the effort, but it' s been up here for a few weeks..."
,SH0CK90,2012-04-17T16:51Z,"@Crash2701 Well i couldn't help notice that most of the uploads are in *Rar format, my uploads are RWP which benefits people using the legit copy of RailWorks"
,Crash2701,2012-04-17T16:58Z,"Oh, ok. Thanks for clarification. Didn't know that."
,muhu88,2012-04-18T08:28Z,I just extracted the files & there is no setup file. How to install this game?
,ColinC74,2012-05-06T00:56Z,After completing the scottish east coast main line. some parts tells me that to continue on Part 2 will be released soon.. So can anyone tell me when Part 2 will be released? this is a great simulator and works perfect. Part 2 would be great to get my hands on.. Thanks :)
