User Type,Username,Date,Text
,Yaboo56,2012-08-31T04:22Z,http://www.imdb.com/title/tt2256491/
,MTLGENTLEMAN,2012-08-31T12:53Z,Thanks for this UL. Great quality work & worth watching !!!
,dee60,2012-08-31T13:56Z,Thanks for sharing.
,MrPigface,2012-09-03T14:09Z,Thanks muchly. Any chance of the next episodes?
,libertaswv,2012-09-09T23:08Z,"Some info:

Good Cop is a British police procedural television series currently airing on BBC One and BBC One HD, set in the city of Liverpool. The first episode of the four-part series was broadcast on Thursday 30 August 2012.

Minor spoilers in the BBC synopsis of the 1st ep:

It starts as an ordinary day, but while out running on Crosby beach, beat cop PC John Paul Rocksavage (Sav) bumps into his ex-girlfriend Cassandra and their daughter Libby. Sav catches a glimpse of the family he could have had, but Cassie isn’t interested in a reunion.

Later that day Sav is having lunch with his best friend and colleague Andy Stockwell when he witnesses a gang of men mistreating a waitress. Sav intervenes and finds himself face to face with a very unpleasant Finch, who threatens to attack the next copper he sees.

Their shift starts and Sav and Andy attend what seems like another regular call out: neighbours have complained about the noise at a house party. But when they arrive at the house, Finch and the gang from the diner are waiting. As Sav tries to get in from the back, Andy manages to get in through the front where the gang launch a brutal assault on him. They escape, leaving Sav tending to a badly beaten Andy.

That night, haunted by images of Finch, Sav returns to the scene of Andy’s beating hoping to make sense of it all and finds a loaded gun concealed under a loose floorboard. At that moment Finch returns, but Sav stands his ground and makes a split second decision that changes the course of his life and career. 

-----

Thx to EZ and all s/l's"
,MRMKHS1,2012-09-10T08:17Z,Maraming Salamat.
