User Type,Username,Date,Text
[V],smbdownload,2012-03-08T03:07Z,rock on brothers and sisters ~ peace
,lex860,2012-03-09T04:09Z,"OH My Gosh!!,Thanks a lot.All I could find was shabby aud stuff.Once agian you made an old hippie super happy.The first time I saw Jackie.I was Who's this guy?Phils son.I hope he can play.Those were some of my favorite shows.Thanks agian.Dude your killing me.Do you have 17&18?"
[V],smbdownload,2012-03-09T04:10Z,17th - trading a friend for 18th next week - will have 17th up this week ;-)
,lex860,2012-03-09T16:34Z,"Thanks my friend.I'd like to see this band tour,and come east.And thanks for those dead shows.I hope the last ones are Jones Beach?Those accustic sets kicked ass!!That's really cool patching in the Dylan tunes.Many thanks Lex"
[V],smbdownload,2012-03-12T18:05Z,sorry lex - don't have the NY shows :-(
