Filename,Size,Unit
The Unit S03E02 Pandemonium deel 2.avi,351,M
The Unit S03E05 Inside Out.avi,351,M
The Unit S03E07 Five Brothers.avi,351,M
The Unit S03E08 Play 16.avi,350.99,M
The Unit S03E09 Binary Explosion.avi,350.99,M
The Unit S03E03 Always kiss them goodbye.avi,350.99,M
The Unit S03E06 Mp's.avi,350.85,M
The Unit S03E10 Gone Missing.avi,350.02,M
The Unit S03E01 Pandemonium deel 1.avi,350.01,M
The Unit S03E04 Every step you take.avi,350,M
The Unit S03E11 Side Angle Side.avi,349.99,M
