Filename,Size,Unit
And More/The Holy Spirit/2011-11-26 - Paul Godfrey - The New Covenant Christian.mp4,738.56,M
2012-09-01- Paul Godfrey - Prepare to Meet Thy God.avi,577.41,M
Your Greatest Friend Died for You - Matt Haney.avi,561.74,M
The Anabaptist Vision.avi,293.38,M
And More/SIN-ister Clips/Nephilim giants.mp4,252.92,M
Victory Over Evil.avi,243.07,M
The Lordship of Christ - Dr Adrian Rogers (Surrender).avi,236.35,M
The Joy of the Lord.avi,193,M
And More/The Holy Spirit/Agents of Satan  Satan's War Against the Sabbath.flv,190.33,M
Your Life Dont Waste It by John Piper.avi,176.36,M
And More/SIN-ister Clips/Subliminal Walmart Cars Curtain - SUCK DI^@ SEX - warning foul language.flv,84.55,M
600 Volumes - POtHS Torrents seeded 7-4-2012.rar,69.71,M
And More/SIN-ister Clips/UK trains  arms future enemies repeats errors of past.flv,66.58,M
And More/The Holy Spirit/Be Still And Know That I Am God (2).mp4,61.99,M
And More/SIN-ister Clips/Marijuana Gas Copyrights.flv,52.62,M
Shorts/The Lordship Of Christ - SM Lockridge.flv,48.99,M
And More/Signs of the Times/2012 2013 Warnings Update_War Is Inevitable.flv,47.75,M
And More/Signs of the Times/Athens Anger  Greek police rhetoric reminds of military dictatorship.flv,45.83,M
And More/SIN-ister Clips/TX schools punish students who refuse to be tracked with microchips.flv,42.31,M
And More/The Holy Spirit/Behold Part 4  The Lamb of Elohim.flv,40.86,M
Shorts/David Pawson Timantit - Raamattu On Totta.avi,38.19,M
Shorts/D-DAY For Gun Owners UN Gun Grab.flv,37.61,M
Shorts/SermonIndex.net Simulcast 2012  Persecution   the Cross by Steve Gallagher.mp4,37.47,M
And More/The Holy Spirit/Christian Persecution by David Wilkerson.flv,35.82,M
And More/Signs of the Times/Biofarms to integrate vaccines pharmaceuticals into GMO biopharmaceutical crops.flv,28.03,M
And More/Signs of the Times/Giant Foot Print 200 Million Yrs Old - South Africa.flv,27.33,M
Shorts/Jesus is Lord - SM Lockridge.flv,27.31,M
And More/Signs of the Times/Chossudovsky  Turkey Already Waging War on Syria.flv,26.81,M
Shorts/AMAZING GRACE IN CHEROKEE - NATIVE AMERICAN.flv,26.4,M
And More/SIN-ister Clips/Message To The Choir 2.flv,26.21,M
"And More/The Holy Spirit/10,000 REASONS (Bless The Lord) - Matt Redman Worship Video with lyrics.flv",25.25,M
Shorts/Whats the BIG DEAL About the KJV  Episode 2.flv,24.74,M
And More/The Holy Spirit/Against the World - The Mainstream Media.flv,24.67,M
And More/Signs of the Times/27 Questions the mainstream media should be asking.flv,23.6,M
Shorts/Prayercast   Singapore.flv,21.82,M
Shorts/Wretched  Aurora Drought and God.flv,21.38,M
And More/The Holy Spirit/All things Are Possible- NewLife.flv,21.15,M
Shorts/Wretched  Your problem is.flv,19.43,M
And More/The Holy Spirit/Cece Winans- Holy Spirit Come Fill This Place (3).flv,18.93,M
And More/SIN-ister Clips/Romney Ryan Mental State  Officially Full of Mitt  Absurdity Today 10-11-12.flv,18.11,M
And More/Signs of the Times/Hamas launches rockets at Israel in order to save face in Gaza   The GAME of War.flv,17,M
And More/War and Rumors of Wars/Opium fields guarded by US troops in Afghanistan.flv,16.51,M
And More/Martyrs of Today/Persecution in Early Church History.flv,15.47,M
And More/SIN-ister Clips/Radical Muslim Jihadists Train on American Soil 10-8-12.flv,14.15,M
And More/War and Rumors of Wars/Intercepted  First video aboard Syria-bound plane diverted by Turkey.flv,13.63,M
And More/SIN-ister Clips/The Doctor Prescribed Honey Not A Pharma Medicine 10-8-12.flv,13.33,M
Shorts/America Police Thugs in Nashville TN flush an alive baby down toilet 10-9-12.flv,12.37,M
And More/SIN-ister Clips/The Human Avatar Programs by NASA  DARPA.flv,12.32,M
Shorts/What You Do Not Know Can Kill You.flv,12.31,M
Shorts/What Is Tolerance.flv,11.51,M
And More/Signs of the Times/BRAIN SURGEON  NOW I believe in God and Heaven Afterlife exists says top brain surgeon.flv,10.77,M
And More/SIN-ister Clips/Wretched  Depression is a Liar.flv,10.27,M
And More/War and Rumors of Wars/Israel kills Qaeda-tied leader of Gaza militant group.flv,9.75,M
And More/Signs of the Times/Entire Vaccine Industry (Big Pharma) Exposed Misrepresentation of Data.flv,9.51,M
And More/The Holy Spirit/All Heaven Declares.flv,9.5,M
And More/Signs of the Times/Four Herbs that heal the liver gall bladder and other ailments.flv,8.75,M
And More/Signs of the Times/Crosses chopped down  Anti-church hysteria spreads across Russia 8-26-12.flv,8.53,M
Shorts/Contemporary Moral Arguments.flv,8.41,M
And More/The Holy Spirit/By Your Side - Tenth Avenue North (2).flv,8.36,M
And More/SIN-ister Clips/Vote Fraud - Diebold Whistleblower Speaks Out.flv,8.1,M
And More/War and Rumors of Wars/Up-date   Russians aboard intercepted Syrian plane were state agents.flv,7.94,M
And More/Signs of the Times/13000 Likely Exposed To Meningitis From Tainted Drugs.flv,7.64,M
And More/Signs of the Times/ISPs Maybe Spying Now.flv,7.05,M
And More/Martyrs of Today/The Privilege of Persecution.flv,6.83,M
And More/SIN-ister Clips/Palestinian terrorists fired over 55 mortar shells at Israel settlements.flv,6.79,M
And More/The Holy Spirit/Christians classified as Terrorists by Obama Admin.flv,6.77,M
And More/SIN-ister Clips/TSA Ruins Dying Woman Last Trip Rips Bandages Off Ruins Meds.flv,6.53,M
Shorts/BREAKING 2012 OBAMA WINS ELECTION OVER ROMNEY CBS NEWS.mp4,5.82,M
And More/The Holy Spirit/Amazing Grace - A Cappella Multitrack.flv,5.56,M
And More/Signs of the Times/Fake Bills Found In ATMs.flv,3.3,M
Shorts/Salvation Transaction.flv,1.85,M
And More/The Holy Spirit/Are you witnessing for Christ (2).mp4,1.82,M
POtHS - Why We Do What We Do.txt,7.89,K
Info.txt,3.25,K
Torrent downloaded from Conspiracyhub.com.txt,47,B
