User Type,Username,Date,Text
,bert2006,2012-02-16T00:04Z,"European screen shots, hotimg please"
,lukeeec,2012-02-16T00:11Z,i have only watched the sample.....wait for a better copy to come along because its unwatchable and looks like it was filmed on a phone or something. 
,J.R.3,2012-02-16T03:29Z,"The movie is finally uploaded, but there still people complaining? You're getting it for free, be grateful"
,kazmandu,2012-02-16T03:44Z,"yeah it looks like handheld phone recording, shaky and bad video, audio is pretty good for a cam. Burn in hell for this shit upload, BURN IN HELL!!!!!!  Just kidding, thanks for the try Hackulus

a - 6
v - 2"
,PrincessPink,2012-02-16T12:08Z,"thank you for this d/l. I am too scared to see it in the cinema. I had nightmares after watching the 1989 version! Thank you Hackulus, you always have good films on offer. "
,thom1803,2012-02-16T13:33Z,why bother!!!!!!!!!!!!!! i dont give a shit if its free its unwatchable
,J.R.3,2012-02-16T15:31Z,Ungrateful bastards like thom1803 are the ones who ruin shit for everyone.
,Lucus7,2012-02-16T15:33Z,Yeah i agree with Thom..why the fuck bother for if it's not watchable....and why should we be grateful for watching a shit upload free or not.
,gamester21,2012-02-16T17:10Z,"yea like if your copy is shit why share shit...then you tools are like be grateful he shared the shit out of his ass, tell you what, ill be grateful when theres something to be grateful for, someone wipes there fat ass and shares the tp online and were supposed to say thanks, and some of you losers get upset when we dont like it.....wow"
,gamester21,2012-02-16T17:11Z,jr3 ur a cunt
,Moive_lover,2012-02-16T18:35Z,"you know for a fact that it is a cam so why bother commenting, if you want to wait for the DVD rip then do but their is no need in been utter arse holes "
,Lucus7,2012-02-16T18:46Z,Yeah i secound that...J.R.3 YOUR A CUNT!
,teamholmez86,2012-02-16T22:27Z,i came on here to dl the woman in black but the comments are just as entertaining !! :D lmfao FIGHT ! FIGHT ! FIGHT ! FIGHT ! 
,pyramania,2012-02-17T03:30Z,"Yeah, your all cunts, and we're so grateful that a prick like Hackulus fucked you all with this shit download."
,gamester21,2012-02-17T04:27Z,"moive gay lover, ur a slob shut ur mouth, go dick jr3's father"
,gamester21,2012-02-17T04:30Z,"i like how cunts like moive say we knew it was a cam like all cams are shit.....ur a noob cunt i see, ive had cams that looked like dvd rips, so swallow ur fathers load moive and get a damn clue"
,skullhill,2012-02-17T04:47Z,"A 4

V 6

unwatchable due to the sound"
,PrincessPink,2012-02-17T10:34Z,"Thank you Hackulus. Unlike others who have commented, I am grateful that you have posted this. A good film, and not bad quality for a cam. If anyone doesn't appreciate the d/l let them pay to see it - or wait and buy the dvd. "
