User Type,Username,Date,Text
[H],Chris-Aksel,2012-07-25T22:05Z,dont pump your torrents on my torrent comments.
,POPOIO1,2012-08-14T13:22Z,"I keep getting the same message. ""you need to apply patch when license screen appears"".
I´ve tried everything but nothing.
Gimme a clue on how to proceed. Tnxs"
,cooldude187,2012-08-14T17:43Z,"@ POPOIO1  FIRST INSTALL REVIT, AFTER INSTALLING DISABLE YOUR INTERNET CONNECTION AND RUN THE KEYGEN PROVIDED IN LICENCE FOLDER BY RIGHT CLICKING AND RUNNING IT AS ADMINISTRATOR THEN COPY THE REQUEST CODE FROM REVIT'S LICENCE SCREEN AND PASTE IT IN THE KEYGEN AND PRESS GENERATE NOW COPY THE GENERATED CODE TO YOUR REVIT'S LICENCE SCREEN AND IN KEYGEN PRESS PATCH IT SHOULD SHOW SUCCESSFULLY PATCHED NOW IN REVIT LICENCE SCREEN YOU CAN PROCCED AND IT SHOULD SAY LICENCED.. "
,bigmun,2012-08-20T07:22Z,cooldude - installation went smoothly but the keygen appears to be 7 numbers short so i cannot activate the license. what am i doing wrong? 
,cooldude187,2012-08-20T09:39Z,@ bigmun THE KEYGEN PROVIDES THE KEY WHICH IS SHORT BUT YOU JUST IGNORE THAT AND PROCEED AND FOLLOW THE STEPS WHICH I HAVE MENTIONED IT WILL SURELY GET LICENCED..
,bigmun,2012-08-21T05:37Z,"@cooldude187 - i am still not having luck. i am logged in as administrator (on windows 7 via bootcamp) and turned off UAC, and when i paste in the request code and hit the 'patch' button, i get this error: ""Make sure you can write to current directory"". i still have 29 days left to activate so i have some time to figure it out. thanks for being patient with me - i'm new here. "
