User Type,Username,Date,Text
,DiscographyAllAt320kbps,2012-04-07T11:22Z,"Comment and please rate guys

I need some ratings

If I get positive ratings, I'll keep uploading high quality (320 kbps) Torrents
"
,MAVERICK900,2012-04-08T22:26Z,"Great torrent keep uploading at 320 kbps
I also upload my torrents at 320 kbps
They can always downsize it if they want to"
,DimsumDynam,2012-05-07T00:49Z,Don't bother with this torrent. Been at 66% for over a week. Doesn't look like uploader is coming back.
,gerijeb,2012-05-27T20:24Z,Seed please
