Filename,Size,Unit
Thanks/Torrent downloaded from 1337x.org.txt,33,B
Thanks/Torrent downloaded from Darkcore.me.txt,35,B
Thanks/Torrent downloaded from Extratorrent.com.txt,47,B
Thanks/Torrent downloaded from h33t.com.txt,39,B
Thanks/Torrent downloaded from Silvertorrent.org.txt,25,B
Thanks/Torrent downloaded from thepiratebay.se.txt,39,B
CharmeLeon on FaceBook.txt,385,B
Cover.png,271.33,K
Hum Aapke Hain Koun...! 1994 720p DTHRip CharmeLeon Silver RG.mkv,1.1,G
Sample.mkv,6.05,M
Silver RG on FaceBook.txt,165,B
SilverRG NFO Read it.nfo,8.24,K
