Filename,Size,Unit
The Story of Vampires.pdf,49.64,M
"Bram Stoker's Dracula; Sucking Through the Century, 1887-1997.pdf",23.79,M
"Real Vampires, Night Stalkers and Creatures from the Darkside.pdf",22.9,M
"Blood Thirst; 100 Years of Vampire Fiction - Wolf, Leonard.pdf",18.8,M
"Monster Theory - Cohen, Jeffrey Jerome.pdf",17.14,M
"The Vampire in Europe - Summers, Montague.pdf",9.5,M
"Vampire, Werewolves and Other Monsters.pdf",7.91,M
"Vampires; A Field Guide to the Creatures That Stalk the Night - Curran, Bob.pdf",7.02,M
"Encyclopedia of the Undead; A Field Guide to the Creatures That Cannot Rest in Peace - Curran, Bob.pdf",6.58,M
"The Horror Reader - Gelder, Ken.pdf",5.43,M
"Vampires, Burial, and Death; Folklore and Reality - Barber, Paul.pdf",4.48,M
"Reading the Vampire - Gelder, Ken.pdf",2.22,M
"Vampires; Myths and Metaphors of Enduring Evil - Kungl, Carla T..pdf",2.15,M
"The Vampire Encyclopedia - Bunson, Matthew.pdf",2.06,M
"Draculas, Vampires and Other Undead Forms; Essays on Gender, Race and Culture - Browning, John Edgar & Picart, Caroline Joan.pdf",1.97,M
Encyclopedia of Vampire Mythology.pdf,1.65,M
"Speaking with Vampires; Rumor and History in Colonial Africa - White, Luise.pdf",1.54,M
Vampire God; Tha Allure of the Dead in Western Culture.pdf,1.5,M
"Gothic Realities; The Impact of Horror Fiction on Modern Culture - Cooper, L. Andrew.pdf",1.4,M
Celluloid Vampires; Life After Death in the Modern World.pdf,1.37,M
"The Vampire; His Kith and Kin - Summers, Montague.pdf",1.35,M
"Vampire Films - Odell, Colin & Le Blanc, Michelle.pdf",1.22,M
"Twilight and Philosophy; Vampires, Vegetarians and the Pursuit of Immortality - Housel, Rebecca & Wisnewski, Jeremy L..pdf",1.21,M
The Science of Vampires.pdf,980.69,K
"Vikram And The Vampire; Classic Hindu Tales of Adventure, Magic, and Romance - Burton, Richard R..pdf",920.01,K
Why Buffy Matters; The Art of Buffy the Vampire Slayer.pdf,748.72,K
"Zombies, Vampires and Philosophy; New Life for the Undead.epub",482.75,K
Hada.jpg,111.1,K
Don't Read Me Please!.txt,134,B
I up - You down!.URL,60,B
