User Type,Username,Date,Text
,donmahajan,2012-06-17T12:44Z,quality guys?????????
,elpk97,2012-06-19T11:27Z,"Cam Rip. Video is not good as I expected but still watchable. Dn't Miss It.

Friends! Want a online PART TIME JOB from home. Don't get fooled by investing ur hard earned money in so called ""Speak Asia"".

A genuine online job company will never ask u for a registration fee to do their job. I'm gonna provide you a URL link of a genuine online survey job specially meant for India. Registration is free. 

But, Piratebay Terms & Conditions doesn't allow me to provide u that URL in this comment. So, interested people can send me their URL request to vjyshrma@gmail.com

I'll forward the URL to your E-mail immediately. REMEMBER HARD WORK IS THE ONLY WAY TO SUCCESS....GUD LUCK"
