User Type,Username,Date,Text
[S],velvet.,2012-06-04T18:29Z,"Do not upload the same item more than once.
Your other upload of this has been deleted."
,Jogjakarta,2012-06-04T19:05Z,"thanks, just a newbie dude"
,Jogjakarta,2012-06-05T17:24Z,"anyone who has finished download, please seed"
,rayquest9,2012-06-07T16:25Z,seeding
,kilo1-1,2012-07-28T02:14Z,"Good content, zip file includes pdf and epub edition of the book along with decent quality mp3 of the audio parts, legit torrent. thanks to the uploader"
