User Type,Username,Date,Text
,emil50,2012-12-26T15:33Z,"If you posted this,why dont you speed?"
,emil50,2012-12-26T15:40Z,"see
http://thepiratebay.se/torrent/7950188/Billboard_Top100_Single_Charts_vom_22_12_2012_%5BMp3%5D"
,final_87,2012-12-29T15:54Z,"DO NOT DOWNLOAD THIS!
This stupid guy put ALL covers with his stupid face, even if I search for the lyrics on my phone it sends me to his fkin e-mail, this is bullshit."
,final_87,2012-12-29T16:03Z,download this instead http://thepiratebay.se/torrent/7928410/VA_-_Billboard_2012_-_Year_End_Hot_100_Songs_[2012-Compilation]_
,HerpesOutbreak,2013-01-05T11:44Z,What a douche. Don't download.
