User Type,Username,Date,Text
,jersson,2012-08-29T21:40Z,Once again. Thank You. seems like it's a new vers out almost every week.
,jersson,2012-08-29T21:50Z,Would you concider uploading DVD Cloner http://www.opencloner.com/ The best of the best. Thank You
[T],iahq76,2012-09-01T04:35Z,@jersson: here you go download it http://thepiratebay.se/torrent/7588409
,atzensuisse,2012-09-08T05:22Z,Thanks buddy-you're far ahead of the rest of the lame uploaders!!! You're stuff so far has worked perfectly!!! No viruses's or bugs of any kind detected-flawless!!! We owe you - have a great weekend~~~~~~~~~ :))
,kentcave,2012-09-11T04:54Z,Thank Thee Ser!
