User Type,Username,Date,Text
,zapattak,2012-10-09T04:26Z,"hi there, thank you for putting this up...do you happen to have the first episode for season 2?"
[T],GlowGaze,2012-10-09T12:47Z,Yup...I'll upload it soon since we had problems with our server :( 
[T],GlowGaze,2012-10-09T23:41Z,"You can get the 1st Episode here....

http://glowgaze.com/forum/showthread.php?1285-Once-Upon-a-Time-Season-2-Premiere-Episode-1-Download-S02E01-HDTV-x264-Subtitles"
,zapattak,2012-10-10T14:02Z,"oh cool thank you, very much appreciated :)"
,LoveLara,2012-11-04T18:01Z,excellent! thank you so much! will you continue uploading as the show keeps airing? :3
