User Type,Username,Date,Text
,yacobD,2012-08-01T18:06Z,fucking great. as always 
,Mellow129,2012-08-01T19:21Z,"6 hours after your upload.
""Sorry, the site is currently invite only.""
-http://www.torrentday.com/
Was it ever really open for sign-ups?"
,strathmeyer,2012-08-12T05:31Z,The funny thing Mellow is the only reason they shut down invites is because people were leeching and starting new accounts. Guess they'll never see my bandwidth?
,JTP_11,2012-08-24T23:20Z,"huh, not fast enough I guess, as I was able to register, MONTHS ago when I first noticed it. "
