User Type,Username,Date,Text
,aldwin123,2012-09-26T12:55Z,"you can use the onthreeseaspersonalize.exe to personalize windows 8 without using this so called ""activator"". This is shit..."
,Alpha.Omega,2012-09-26T15:12Z,this just simply corrupts the file to make it show that it is activated BUT ITS NOT!!!
,seppmoser,2012-09-26T15:48Z,complete bullshit...
,zcarneiro,2012-09-26T15:51Z,doesnt work windows 8 pro 9200 pt pt
,bambong,2012-09-26T17:44Z,thanks for the warnings.
,moviekil,2012-09-26T17:44Z,"The same Alpha Olmega always Bitchin in everybody's torrents,the looser doesnt even have a forsaken torrent  , another shit is he loves writing ""fake"" in everybody's movies torrents too (even when the torrents are legit and good) marked my words, that a** h**e is only critizicing everybody's torrents unless if you are a buddy buddy with him, @ Alpha Omega get a life and let others do their work in peace, you are a loser, your words means garabage to a lot of us."
,searpe,2012-09-26T17:59Z,alpha.omega...you are an idiot...a shit
,moviekil,2012-09-26T18:04Z,"maybe is not a legit activation but I got this same one activator and its been 3 weeks and still working fine, right now this is the best hack working, @ alpha Omega you got a thing for windows 8, so stop crying and go deep in your pockets and buy an activation key and leave peoples torrents in peace and the new uploaders do their job cause behind a computer you are tough guy, yea anybody is."
,zullia,2012-09-26T19:15Z,"PIECE OF SHIT . this doesn't work, pure bullshit and poop and pee !!!"
,T1417B,2012-09-26T19:43Z,How can you activate Win8 when Key Management Service is offline
,T1417B,2012-09-26T19:53Z,key management service is offline
,srimex,2012-09-26T20:07Z,Not Worrrrrrrrrrrrrrrrrrrrrrrrrrrrrrrrrrkkkkkkkkkkkkkkkkkkkkkkkkkkkkkkkkiiiiiiiiiiiiiiiiiiiiiiiiiiiiiiiinnnnnnnnnnnnnnnnnnnnnnngggggggggggggggggggggggggggggggggggggggggggggggggg!
,KKS21199,2012-09-27T05:18Z,"GUYS WHO SUPPORTED THIS THANKS, WHO DIDN'T, SHUT YOUR MOUTH AND GET LOST IF YOU DON'T WANNA FREE VERSION. 

@zcarneiro : IT WORKS PREFECTLY, I AM USING WINDOWS 8 PRO 9200 64BIT AND I HAVE ACTIVATED"
,KKS21199,2012-09-27T05:19Z,@ MOVIEKIL THANKS FOR SUPPORTING.
,cwong668,2012-09-27T07:33Z,"this is WORKING 100% with the enterprise english version 917522 i downloaded from the full packs ... i tried the whole day on the methods suggested in full packs using CMD and NO activation is good ... the windows system edition in the control panel keep saying WINDOWS IS NOT ACTIVATED ... there is display on the screen saying the Windows needs to be activated and the Enterprise version 9200 on the lower right hand corner...

FINALLY, i downloaded & tried this Activator and i was not hoping too much ... but to my surprise at the end of executing all the steps and rebooting the system ... IT WAS ACTIVATED FINALLY ... the screen display in the lower right hand corner is gone and i checked the windows system edition in the control panel and IT IS SAYING ""WINDOWS IS ACTIVATED"" ... i also clicked the view details in Windows Activation and it also said WINDOWS is activated and Windows currently running on your PC is activated ... the current product key displays *****-X4PK2 ... i think the info is true & correct...

it looks my Windows 8 is activated and this activator is a good one...

i hope it will not change the status tomorrow...

cheers,"
,BenKaz,2012-09-27T17:35Z,"I dont know about you guys, but it did activated for me, not fully tho, cant use Users tab correcly, but the ""activate windows"" watermark dissapeared, in my computer it says that its activated and pc loads faster now that its activated, so respect for you uploader and shut up morons who doesnt download ant talk shit."
,italiano69,2012-09-27T19:27Z,"thanks for the effort butthis is a fake acticetor.
it is been going around for a while but all it does it messes with your file system and after you reboot it a few time it will show not activated again.
Also the release preview it is activated."
,pxpierre,2012-09-28T01:25Z,"The website mentioned in the description @ the present contains only links to youtube and facebook and all the other pages are placeholder latin text.

Funny!"
,moviekil,2012-09-28T01:53Z,"@italian 69, you know why your windows is not activated after the next reboot ? because your security essensial recognized the hacktool and erased, you have to go to settings (on your anti virus - security essensial) and find where the hacktool is quarantine and select to ALLOW, so when you activatedagain it wont do that again,, i went through the samething too and finally realized what was the problem (remember hacktools are recognized as backdoor virus or malware. so deal with it and you'll see it wont deactivate again, ALLOW the hacktool in your security essensials"
,stmux,2012-09-28T02:48Z,"I cannot say this is intended to be a fake or if the creators genuinely thought they were making a working activator.  That said, both Windows 8 Ent N VL and Server 2012 Datacenter VL show as Activated in the System window. Even slmgr /xpr shows permanantly activated.  However, when viewing with Server Manager they show as Not Activated.  While how they did this has me intriqued, I think it is best to wait for a kms server to  come online or for a mini kms to come out.
mux"
,KKS21199,2012-09-28T04:37Z,"Final comment, this work perfectly as this is tested,
guys if it did not work then you have some problem, try doing @moviekil step above."
,csgo4life,2012-09-28T12:18Z,"@ all who think this ""Activates"" windows, just shoot yourself and die, you'll do the world a big fucking favor."
,moviekil,2012-09-28T13:22Z,"@csgo4life this is just a hack , and gladly i' ll love to shoot you and see your brains blown off, (response to your ignorant comment with another ignorant BUT i'm capable to do comment to assholes like you)"
,KKS21199,2012-09-28T13:31Z,@ u fucker4life this activates windows n i have prove for it. You fucker try adding the loader to your exceptions. ok madafucker.
,KKS21199,2012-09-28T13:34Z,"@ f***er4life : this works n i have prove for it. if u couldnt work then do like moviekil said above, is it ok madafu**er"
,csgo4life,2012-09-28T18:37Z,"@moviekil: learn english first, THEN comment, fucking faggot"
,csgo4life,2012-09-28T18:40Z,"@kks: if it works then why the fuck cant u personalize windows? its because it just makes it appear as if it is unlocked, its not a genuine unlock... seriously fucking get some brains before posting shit torrents and shit comments, you ""hack"" has been uploaded before on tpb, u aint doing anyone a favor, so just delete your account and stick ur head in ur mom's pussy"
,xtraB,2012-09-28T21:36Z,"@csgo4life shut the fuck up already, Or do you plan to fill this pages with more Dhiarreas ? I got mine activated too and personalization got on running too, so stop SHUT THE FUCK UP IMBECILE"
,moviekil,2012-09-28T21:43Z,"YEA , i AGREED  with xtraB, you must have a crappy piece of shit for computer or maybe a piece of junk that you can even personalize your fuckin junk of pc, get a life and  tell me if need english to send you to hell , you are the faggott, i will fuck your mother right in front of you but i wont fuck you cause i dont eat donkey meat, you are hommo and dumb fuck.. how's my english now bitch ? buy a god damn computer, you cant activate junks you find in the sidewalks of the bronx , you fuckin parasite, germ. bugger, turd, hows the english now bitch ?"
,moviekil,2012-09-28T21:53Z,@csgo4life  Are you sure you got a computer or a 39 dollars DVD player ?
,moviekil,2012-09-28T22:27Z,"@csgo4life, here is a link where you can upgrade your dvd player asshole
http://www.bestbuy.com/site/Dynex%26%23153%3B+-+7%22+Portable+DVD+Player/3613424.p?id=1218420266503&skuId=3613424"
,pumaile,2012-09-29T00:49Z,This is not really working it just modifies the activation files. You can't personalize and it just says it's activated. It doesn't activate your Windows.
,xtraB,2012-09-29T02:02Z," buy a key then,, ungrateful"
,KKS21199,2012-09-29T03:54Z,"If u dont want win 8 for free, then go n buy win 8 for cost, you fucking peoples never appreciate anyone, @fucker4life : shut ur mouth n suck ur moms pussy"
,xtraB,2012-09-29T07:25Z,"@KKS21199 I just upload a torrent moviekil send me and i like to let you know you can reupload both torrents together and make a new torrent with both toolkits, your windows 8 activation toolkit and movekil and mine personalization toolkit , If you like to do so, you are welcome. okay,,here is the personalization toolkit link if you like to check it out..  http://thepiratebay.se/torrent/7684232       AND stay strong, always haters going to made shitty comments .."
,KKS21199,2012-09-29T14:10Z,"@xtrab : thanks bro, i will reupload it now with mine."
,KKS21199,2012-09-29T14:33Z,http://thepiratebay.se/torrent/7685228
,lamrialaaeddine,2012-09-29T14:56Z,doesnt work windows 8
,xtraB,2012-09-29T15:23Z,"yea, good work, i seen it and downloaded too and i check it out and is really cool.. good work KKS21199 .. lets see whos going to start bitchin now  lol, always few assholes do it."
,callennaidoo,2012-09-29T16:11Z,@ KKS21199 Thanks works like indicated!!!!
,KKS21199,2012-09-30T04:54Z,"xtraB : i know, some peoples dont want anyone to be famous, sometimes i have the same problem in youtube.

@callennaidoo : welcome "
,qutbz11,2012-09-30T14:55Z,@ KKS21199 - plz help me...i downloaded the activator...but i cant even open the file...plz help
,KKS21199,2012-10-01T12:59Z,first extract it and try running as admin
