User Type,Username,Date,Text
,Bibliophile_Indian,2012-05-04T15:26Z,"Thank You... Thank You... Thank You... Thank You... Thank You... Thank You...
MAY GOD BLESS YOU!!!"
,newtamy,2012-05-04T16:15Z,"Millions of thanks pal, you are wonderful... keep uploading from time to time, we really appreciate it."
,newtamy,2012-05-15T19:07Z,"Do you have the rest from Cinebook mdusanjay ?
I wish you can upload them if you have... and thank you for your great uploads."
,The_Who_01,2012-05-19T20:37Z,Thanks very much!  Nuch appreciated!
