User Type,Username,Date,Text
,KristKing,2012-12-20T18:22Z,yaaaaaaaaaaaaaa aer si es verdad
[T],nosnavis,2012-12-20T22:06Z,"多Y era tollo, o no?"
,amencl,2012-12-24T04:27Z,imagen y audio al 100% la acabo de descargar y revisar...a compartir!! gracias nosnavis
,chilemirror,2013-01-02T21:24Z,"Version alternativa extended de 3.8GB, 120min duracion en:

http://thepiratebay.se/torrent/7980596/STEFAN_vs_KRAMER_-_Extended_Edition_2012

magnet:?xt=urn:btih:2a90f6f16e42258a8d0d31aaf8e62cc09af921e3&dn=STEFAN+vs+KRAMER+-+Extended+Edition+2012&tr=udp%3A%2F%2Ftracker.openbittorrent.com%3A80&tr=udp%3A%2F%2Ftracker.publicbt.com%3A80&tr=udp%3A%2F%2Ftracker.istole.it%3A6969&tr=udp%3A%2F%2Ftracker.ccc.de%3A80"
