User Type,Username,Date,Text
,Taker009,2012-11-05T14:20Z,seed and enjoy
,futile4,2012-11-05T14:26Z,u r on et too??
,IanCurtisZombie,2012-11-06T06:06Z,"is this the version that has both episodes from liberty city? cause ive downloaded that version before and both episodes just refused to start, main game worked fine though"
,Taker009,2012-11-06T10:31Z,The Lost and Damned and The Ballad of Gay Tony  two parts of EFLC expansion pack and the main game GTA 4 all are working fine :))
,Taker009,2012-11-06T10:44Z,U can install both game seperately.
,Ert9897,2012-11-10T23:23Z,Hi if I trie to install it it doesen´t intall there is always only the window but it doesen´t load.Can anyone help me?
,MakoNeko,2012-11-12T06:24Z,How do you save game without logging in and giving product key/
,TestSmith,2012-11-12T22:02Z,Can i update this to the latest patch and if so will it ask for a CD Key.
,TestSmith,2012-11-12T22:04Z,"You can play off line and it wont ask for the CD Key. This is how you do it.

http://forums.relicnews.com/showthread.php?219695-Games-for-Windows-Live"
