Filename,Size,Unit
Blonde College Teen Dorm.wmv,69.21,M
Fucking My Wife Doggystyle And Missionary.flv,52.2,M
Amateur Teen Missionary Anal Sex.flv,50.8,M
Hot Skinny Teen Brunette Gets Fucked On Bed.flv,47.9,M
Amazing Anal Girlfriend.wmv,45.95,M
Amateur Milf With Pantyhose Fucked By Two Guys.flv,44.25,M
Brunette Girlfriend Sucking Bfs Cock And Gets Fucked Dude Ends On His Hand.flv,39.07,M
Hot Brunette Teen With Nice Ass Teases Naked On Her Bed.flv,33.82,M
Brunette Teen Fucking With Lingerie.flv,30.65,M
Asian American Hottie  Has A Missionary Quickie Sex.flv,26.99,M
Close Up Anal Fuck.flv,25.77,M
Teen Rides Her BF On The Sofa.wmv,23.15,M
Brunette Teen With Big Booty Rides Her BF On The Sofa.wmv,19.74,M
Brunette Teen Masturbates With A Massive Cumcumber.wmv,17.89,M
Teen Masturbates On The Bathroom Sink.wmv,17.35,M
Cute Latina Cumswallow.flv,16.97,M
Amazing Ass Rides Dick.flv,11.42,M
