User Type,Username,Date,Text
,Chrome69,2012-10-30T15:14Z,This is suppose to be Pineapple Express but its Cloverfield (2008)?
,Amafule10,2012-10-30T23:16Z,it's probably Cloverfield right?
,stealth_smok3r,2012-10-31T00:58Z,this is cloverfield. heres the real pineapple express... http://thepiratebay.se/torrent/7764361/Pineapple_Express_EXTENDED_(2008)_720p_BrRip_x264_-_YIFY
[V],YIFY,2012-10-31T03:01Z,"info is wrong,

this is in fact 720p  Cloverfield"
,BoomErupt,2012-11-03T11:35Z,"@Yify everyone makes mistakes :P it's human nature I just want to TYVM 4 all you have done for us I seed back 2x what I DL from you ALWAYS you are the first I go to for movies, and always will ^ ^"
