Filename,Size,Unit
Torrent downloaded from Demonoid.me.txt,46,B
"_____padding_file_0_if you see this file, please update to BitComet 0.85 or above____",255.96,K
Torrent downloaded from Extratorrent.com.txt,40,B
"_____padding_file_1_if you see this file, please update to BitComet 0.85 or above____",255.96,K
Torrent downloaded from h33t.com.txt,32,B
"_____padding_file_2_if you see this file, please update to BitComet 0.85 or above____",255.97,K
[sage]_Daily_Lives_of_High_School_Boys_-_12_[720p][10bit][EBB074ED].mkv,252.23,M
