User Type,Username,Date,Text
[V],bubanee,2012-10-29T20:52Z,tracks 16 to 18 are the second CD... 
,fall1en,2012-10-30T07:59Z,Thanks!
,LinusVanPelt,2012-11-02T05:42Z,Thank you B. It is much appreciated.
,leander3932,2012-11-08T03:22Z,thank you sooo much. xox
,leander3932,2012-11-08T03:55Z,"dear bubanee, would it be rude of me to ask if u could get the album train, drive by? all the ones on TPB are just the single.  thanks.  much appreciated. xox"
,ja_iom_jedi,2012-11-16T18:29Z,Excellent Sir. Top quality as always
