User Type,Username,Date,Text
,Wicho_,2012-12-31T01:25Z,"Como todo lo que puedo hacer por mi agradecimiento es decir ''Gracias''! Eso hare, Gracias Man, sigue subiendo los torrents :)"
,87master,2012-12-31T03:19Z,Muchas Gracias! Muy bueno! :D
,codybobo,2013-01-01T19:04Z,xfa xfa el descenso 1 i 2 en latino 480p xfa graxx
,EACOMPANY,2013-01-02T05:01Z,Man no sabes lo feliz que estoy... Estoy que grito y brinco de la alegria esta es la peli que estaba esperando desde que vi los trailers YEAH MAN!!!!! TU MANDAS jcguku21
,Wicho_,2013-01-02T10:51Z,Que buena mierda de peilcula jaja me encanta! :D
,-NECROPHAGIST-,2013-01-10T21:18Z,"Gracias amigo se agrdece el aporte y sigue subiendo en latino porfavor, me gustan los dobaljes en latino."
