Filename,Size,Unit
A filologia portuguesa.Esboço historico.J.Leite de Vasconcellos/cg-3652-v_0000_rosto-919_t24-C-R0072.pdf,4.05,M
A lingua portugueza e filha da latina/l-352-v_0000_capa-80_tXX-X-R0072.pdf,10.54,M
A lingua portugueza.Curso de literatura nacional para uso dos lyceus.F.Adolpho Coelho/l-19477-p_0000_anterrosto-200_t08-G-R0072.pdf,9.5,M
A lingua portugueza.Phonologia etymologia morphologia e syntaxe.F.Adolpho Coelho/l-19927-v_0000_capa-contracapa_t08-G-R0072.pdf,8.88,M
Arte da grammatica da lingua portugueza. Antonio Jose Reis Lobato/clul-r-116_0000_guardas1-guardas2_t24-C-R0072.pdf,11.52,M
Bases para a unificacao da ortografia que deve ser adoptada nas escolas e publicacoes oficiais/l-9765-7-v_0000_capa-49_t24-C-R0072.pdf,3.38,M
Breves lovvores da lingva portvgvesa/l-321-4-v_0000_76v-2guardas_t24-C-R0072.pdf,988.19,K
Casos de analogia na lingua portugueza.F. Adolpho Coelho/l-7036-8-v_0000_capa-38_t24-C-R0072.pdf,3.78,M
Compendio de orthografia/Compendio de orthografia.doc,319,K
Da glottica em Portugal/uel-fl-lgp1_0000_capa-343_t24-C-R0072.pdf,39.81,M
Deux faits de phonologie historique portugaise.A.R.Gonçalves Vianna/hg-7378-1-v_0000_capa-12_t24-C-R0072.pdf,614.07,K
Ensaio critico sobre qual seja o uso prudente das palavras/Ensaio crítico sobre qual seja o uso prudente das palavras.doc,107,K
Esquisse d'une dialectologie portugaise.L.Leite de Vasconcellos/l-71265-v_0000_capa-179c_t24-C-R0072.pdf,11.26,M
Estudos da língua portuguesa.Júlio Moreira/Estudos da língua portuguesa.doc,377,K
Estudos de fonetica portuguesa.A.R.Gonçalves Vianna/l-22133-v_0000_capa-capa2_t24-C-R0072.pdf,19.41,M
Exposicao da pronuncia normal portuguesa/hg-7378-3-v_0000_anterosto-106_t24-C-R0072.pdf,8.28,M
Grammatica dalingoagem portuguesa.Fernao Doliueira/res-274-v_0000_capa-guardas2_t24-C-R0072.pdf,3.18,M
grammatica philosophica lingua portugueza/l-296-v_0000_capa-guardas2_t24-C-R0072.pdf,70,M
Gênio da língua portuguesa/Gênio da língua portuguesa.doc,398,K
Historia da lingua portuguesa.Origem e vida externa.J.Leite de Vasconcellos/j-2497-b_0000_5-28_t24-C-R0072.pdf,1.78,M
Memoria em que se pretende mostrar que a lingua portugueza nao he filha da latina/pp-24160-v_0000_anterrosto-43_t08-G-R0072.pdf,3.78,M
Memórias de literatura portuguesa/Memórias de literatura portuguesa.doc,63,K
Opusculo acerca origem lingua portugueza/hg-6641-15-v_0000_anterrosto-55_t08-G-R0072.pdf,2.63,M
Origem da lingoa portvgvesa. Dvarte Nvnez de Liao/res-277-1-v_0000_capa-151_t24-C-R0072.pdf,6.39,M
Origem da lingua portugueza.A.Soromenho/l-58936-v_0000_anterrosto-32_t08-G-R0072.pdf,1.81,M
Origens do portugues do sul.F.Adolpho Coelho/j-1632-b_0000_317-324_t08-G-R0072.pdf,730.44,K
Orthographia da lingoa portuguesa/res-277-2-v_0000_rosto-78v_t24-C-R0072.pdf,7.22,M
Orthographia da lingoa portuguesa.obra vtil e necessaria assi pera/res-277-2-v_0000_rosto-78v_t24-C-R0072.pdf,7.22,M
Orthographia da lingua portuguesa.Luis Caetano Lima/l-658-p_0000_capa-2guardas_t24-C-R0072.pdf,6.22,M
Orthographia ou arte de escrever e pronunciar com acerto a lingua portugueza/l-5049-a_0000_rosto-556_t24-C-R0072.pdf,23.93,M
Orthographia ou modo para escrever certo na lingua portuguesa/l-321-1-v_0000_capa-48r_t24-C-R0072.pdf,4.56,M
Ortografia da língua portugueza.Joam Franco Barretto/l-323-v_0000_capa-guardas2_t24-C-R0072.pdf,30.74,M
"Os dialectos romanicos ou neo-latinos na África, Ásia e América/Os dialectos romanicos ou neo-latinos na África, Ásia e América.doc",89.5,K
Phonologie syntactique du cancioneiro geral.Jules Cornu/re-272-v_0000_243-306_t08-G-R0072.pdf,3.45,M
Prosas Portuguesas/l-4459-a_0000_capa-guardas2_t24-C-R0072.pdf,63.94,M
Reflexoes ethnographicas philologicas e historicas a proposito de uma publicacao/j-155-b_0000_391-rosto_t08-G-R0072.pdf,553.67,K
Regras lingua portugueza espelho lingua latina/l-601-p_0000_capa-2guarda_t24-C-R0072.pdf,8.62,M
Reprezentacao a Academia Real das Ciencias sobre a reforma da ortografia/l-11677-8-v_0000_rosto-24_tXX-X-R0072.pdf,6.16,M
Syntaxe historica do portugues.Augusto Epifanio Dias/texto.pdf,22.72,M
Verdadeiro método de estudar/Verdadeiro método de estudar.doc,320,K
CD Sobre a Memória da Língua.doc,23,K
