User Type,Username,Date,Text
,ilovedub78,2012-10-22T13:05Z,SEED PLZ CURRENTLY O Ko/s
,piratonzon,2012-10-22T13:45Z,"Gracias,gracias y mas gracias"
,sutil1,2012-10-22T21:10Z,"Gracias protonotario por tu excelente trabajo!!!
MIL GRACIAS SOS UN GRANDE!!!!!
GRACIAS GRACIAS GRACIAS"
,optikus165,2012-10-22T23:04Z,"Hey Protonontario can you get and upload
http://thepiratebay.se/torrent/7417132/Under_the_Boardwalk_-_The_Monopoly_Story_(2010).avi ?..
there are no seeders for this torrent."
,Edgardomx,2012-10-23T01:53Z,buena serie gracias.
,cesc89,2012-10-23T05:44Z,Muy buena calidad y que bueno por los subs!!
