User Type,Username,Date,Text
,jezus1234,2012-03-18T16:27Z,"Thanks

AT last PirateBay is fine 

@merzedes -- dont you upload your torrent anywhere else other than PIRATEBAY???

COS piratebay is under attack

thanks anyway ;-)"
,DuckBharma,2012-03-18T22:34Z,Remy is gorgeous.  Thanks!
,shallow2,2012-03-18T22:44Z,"Eh, haven't TPB been under attack since day one ? :)

If anything should happen to tpb we'll just upload elsewhere. If you do a google search for one of Merzedes' torrents with the exact name you'll find duplicates on several other trackers.

The torrents are made with public trackers so anyone can dl em."
,nemez505,2012-03-19T09:17Z,"i think TPB since founding was under attack :)
thx a lot."
