User Type,Username,Date,Text
,somedude72,2012-05-07T05:07Z,Thanks!
,DamnitDoll2012,2012-05-07T05:10Z,"one thing at a time...dont be hasty.
Thanks ettv for the upload."
,lambofgodman67,2012-05-07T05:11Z,Thanks very much. Keep up the great work.
,BreakingBadFan,2012-05-07T05:16Z,yea where is game of thrones lol?
,TheKilljoy343,2012-05-07T06:05Z,"""where is game of thrones""

It's playing on HBO. What's that? You don'wanna pay for HBO? Then chill out and wait."
,BreakingBadFan,2012-05-07T06:35Z,"it was just a honest question internet tough guy. Did i go crazy and rage? Is there something im missing? o yea.... your an asshole, thats it."
,MethMad,2012-05-07T08:48Z,winge backstab lie and keyboard tuff that sums you clowns up in full how about just say thank you and seed ?
,gravatar8,2012-09-22T00:40Z,"Swedish Subtitle: http://s4u.se/?serie=1582457

Besรถk http://s4u.se fรถr fler texter till The Borgias eller sรถk bland tusentals andra texter. "
