User Type,Username,Date,Text
,[AKATSUKI],2012-11-16T12:16Z,there is many cracks; we need some lanfix & zombie enabler crack
[T],Gh0stNet,2012-11-16T12:17Z,there isn any lanfix of which i know off
,[AKATSUKI],2012-11-16T13:00Z,hope they gonna make one/ tunngle/aviara/teknogods
,thesteve420,2012-11-16T13:03Z,Well does this fix zombies?
,lokesh380,2012-11-16T13:11Z,"tried with skidrow torrent..its not working!

i tried every method to make the game running but no luck!

plz help...i get the black screen and that stupid error :

Error during initialization:
Unhandled exception caught"
,mutz-nutz,2012-11-16T13:12Z,Not working for me :(
,thesteve420,2012-11-16T13:19Z,"Are you guys changing your date and time??

I've noticed most of these cracks work when that is done"
[T],Gh0stNet,2012-11-16T13:21Z,"hey mine was working all good on nov14 but on nov 15 it keeps on giving me

Error during initialization:
Unhandled exception caught

on start up.and i was using Call.of.Duty.Black.Ops.II.Crackfix.Repack-SKIDROW

and this proper crack by 3dm fixed it."
[T],Gh0stNet,2012-11-16T13:23Z,another thing use latest nvidia beta drivers and update your directx 
,DFC-Louise,2012-11-16T13:32Z,"yep, doesn't work for me either."
,0omaple123,2012-11-16T14:36Z,"good crack.

works with skidrow's torrent."
,vasav,2012-11-16T15:42Z,What the fuck.....!!!!!!!! NOT WORKING...
,jfloid,2012-11-16T15:44Z,"It worked for me, but I had to change the time zone  to +8 Hong Kong and the date to November 13th. However I do not know if will hold for the entire game."
,Anonymou5e,2012-11-16T16:28Z,C2D127F6306FBA675BC2FDDEF735703AE3071EAB
,thesteve420,2012-11-16T16:43Z,you shouldn't have to change the time zone. if you did everything correctly the only thing you will have to do is change date and time.
,asoktulsigm,2012-11-16T17:07Z,"on the third mission at Afghanisthan, why the horse is stucked there ?  Till there it is working fine.. I uninstalled and reinstalled many times, every time when that mission starts, the horse stuck on there.. What to do ? some one please help me.."
,asoktulsigm,2012-11-16T17:18Z,"na tretji misiji v Afghanisthan, zakaj je konj stucked tam? Do tam se delajo fine .. Sem odstranil in zopet večkrat, vsakič, ko je ta misija začne, konj obtičal tam .. Kaj storiti? nekdo prosim pomagajte mi .."
,thesteve420,2012-11-16T17:20Z,The only thing in common with all the cracks is the time issue later cracks won't have the same issue.
[T],Gh0stNet,2012-11-16T17:33Z,i dont know what is the problem with your game but i have played the hole afgan mission with this crack
,laser345,2012-11-16T18:32Z,"IT DIDN'T HELPED ME TO FIX THE ""initialization unhandled exception caught"" ERROR!"
,laser345,2012-11-16T18:46Z,THIS DOESN'T FIX THE ERROR DURING INITIALIZATION!!!!
,Kecman991,2012-11-16T18:56Z,"It worked for me :D
Thanks GhostNet ;)"
,killared22,2012-11-16T19:02Z,all works good but the sound keeps going out. is any one else haveing that problem if so any info on how to fix it would be great thanks 
,clkgtr2,2012-11-16T19:15Z,Not Working...
,manouras,2012-11-17T01:14Z,working fine
,demonninja12,2012-11-17T01:16Z,Is there any crack that lets you play anything other than campaign yet?
,MkvSeeker,2012-11-17T04:18Z,Thank u it worked my son says thank u as well
,mshawaz,2012-11-17T04:26Z,This works.  I no longer have to set the timezone to hong kong or the date to 11/13 to play it with this crack.
,mshawaz,2012-11-17T04:28Z,It works. 
,hpham228,2012-11-17T05:15Z,"TO ANYONE WHO TRIED EVERYTHING BUT STILL COULDNT GET IT TO WORK (UPDATE CRACK, CHANGE TIMEZONE AND DATE TO 13TH 14TH ETC....) YOU GOTTA UPDATE YOUR WINDOWS. I BELIEVE MOST OF US ARE USING PRIVATED WINDOWS 7 SO ITS NOT GONNA AUTOMATICLY UPDATE ITSELF. IN THAT CASE, YOU GO TO ""START"" BUTTON, CLICK ON SEARCH AND TYPE ""UPDATE"", THEN CLICK ON ""WINDOWS UPDATE"" AND LET IT DO ITS JOB, AFTER THAT, LET YOUR COMPUTER DO A REBOOT. BEFORE YOU TRY TO RUN THE GAME, YOU MIGHT WANT TO CHANGE THE DATE BACK TO THE 14TH AND TIMEZONE +8:00 (JUST IN CASE)...NOW YOU SHOULD BE ABLE TO PLAY THE GAME. ENJOY :D"
,Richy2012,2012-11-17T06:27Z,works with skidrow release?
,Richy2012,2012-11-17T07:26Z,"Reinstalled Skidrow version, installed Direct X driver and cc+, applied this crack and also put installed folder into the exclusion list for AVG anti virus. Tried setting back the time and forward (+8h China) and also tried putting teh clock forward and nothing worked. 

Just a black screen and when I go back to teh desktop it just crashes and stops working with a message. What am I doing wrong? This is the very first game I have not been able to start for a very very long time :S Plz help"
,smoktup,2012-11-17T07:57Z,"if u really want to play the game and cant figure out how to take ur thumb out ur ass and install the crack the right way like most of the other people including my self as ive beaten the game twice already, the just got buy the fucking game support the companies that work hard to bring you somthing enjoyable to play...."
,albo88,2012-11-17T09:01Z,"@ smoktup  enjoyable my ass buoyed both mw2 and black ops 1 at the time both lagged like shit and never where fixed so yeah this is the same shit 
just getting it for the single player ill play 7 hour then uninstall its a waste of gb keeping it and playing it again "
,Pshot19,2012-11-17T09:07Z,"Ok this crack worked for me, no you don't need to change the date with this crack (I didn't).  How I got this crack to work was to install steam and register.  Navigate to your ""C"" drive find your ""steam program"" folder, open it, then u will see a folder called ""steam apps"" Then put the ""black ops 2 folder"" into the 'steam apps folder"" and then run single player from there!  I dont even have to be running steam to start the game, but as long as the time zone is hong kong +8 and ""black ops 2"" is located in steam apps, it should work.  i didnt even have to turn a firewall on or do anything with my antivirus!  Thats just me so it cant hurt if u do!! Try all the suggestions that you have seen, but no one says to put it in the ""steam apps folder and to run it from there!!  Good luck, that show i got it to work!"
,Pshot19,2012-11-17T09:13Z,"One last thing, the first time u run black ops 2 from the ""steam apps"" folder, it might take a good 2 or 3 minutes for the game to load, so if u get a black screen be patient, give it time it will load, after that initial 1st run, the game starts quickly!!  Again change the time zone to hong kong, try not changing the date at first, put game in the ""steam apps"" folder, run game from steam apps folder.  it should work.  if it doesn't maybe run steam offline, change date and run from steam apps!!  Experiment, but this was the only crack that worked 4 me!!  I hope u get it working my pirate bay friends!!! "
,vr.vijay06,2012-11-17T09:23Z,"hi ghostnet...can you upload completed save file of /players folder.

i am not able to play past mission 5 because of some.bsp file miising"
,manouras,2012-11-17T10:11Z,"no time change needed,no steam needed(i had it installed but is not running right now).just place this crack in game installation folder and the game works"
,wayned1985,2012-11-17T10:22Z,"Finally got this to work, windows 8 x64. Go to: C:Program Files (x86)ActivisionCall of Duty Black Ops IIredistDirectXDXSETUP.exe

Run and install. Set the date and time to the 14th Nov, +8 hong kong.

Run the game.

Alternatively use one of the new cracks that fix the date and time issue.

Game is working fine so far! No black screen or crashing."
,wayned1985,2012-11-17T10:23Z,"Finally got this to work, windows 8 x64. Go to: C:Program Files (x86)ActivisionCall of Duty Black Ops IIredistDirectXDXSETUP.exe

Run and install. Set the date and time to the 14th Nov, +8 hong kong.

Run the game.

Alternatively use one of the new cracks that fix the date and time issue.

Game is working fine so far! No black screen or crashing. "
,vr.vijay06,2012-11-17T10:46Z,"wayned1985 and manouras ..

can u get past india mission.are you getting missing .bsp file error?"
,Hara_RMC,2012-11-17T11:21Z,"It works so far, no need for date changing , no crashing ,no black screen !
TNX uploader :)"
,Yoyu7,2012-11-17T11:44Z,YES ! Thanks.. It Works :)D)D)D)D)D)
,huuvuong,2012-11-17T12:01Z,"it' worked ,thanks"
,Jovica007,2012-11-17T12:12Z,The ONE AND ONLY that works for me. Thx for the upload!
,Richy2012,2012-11-17T14:36Z,"Thanks for the tips guys but still cant get it to run. I copied the COD folder after installation n crack into the steamapps folder even set the time to 8h + hong kong and ran the exe from there with no luck. Same error, black screen."
,Leiss,2012-11-17T14:46Z,"It works, but when i get to the Colossus Database it stuck on D and -> ..i can't pass that moment..any help?"
,laser345,2012-11-17T15:12Z,"IT DOESN'T WORK. I CHANGED THE TIME-ZONE AND THE DATE AND PASTE THE NEW CRACK AND THE SCREEN GOES BLACK AND IT SAYS BO2 HAS STOPPED WORKING AND ERROR DURING INITIALIZATON -.-"""""""
,hjorten66,2012-11-17T15:28Z,not working screen goes black in game. This sucks
,Richy2012,2012-11-17T15:38Z,I wish someone could release a decent crack that works for everyone *sigh* 
,xZorrox,2012-11-17T15:51Z,"Not working at all!!!

Just black screen pops up to every crack available on Pirate Bay installed game

I am not changing time zone on my system.

Please release Crack Fix that works for True in Singleplayer

Any chance of creating cracked servers for Multiplayer"
,killared22,2012-11-17T17:25Z,i have it working but my sound keeps going out i have updated sound card and tryied everything i know to do any ideas would be great thank some one please help and is any1 else have that problem with the sound
,killared22,2012-11-17T17:44Z,works but my sound keeps going in and out. any1 else having that problem if so any tip on how to fix it. ive updated sound card but still sound keeps going out thanks
,dudeson1,2012-11-17T17:57Z,works great but i have no sound. Anybody else have this problem?
,Kuttlu,2012-11-17T19:36Z,"Again same poor quality crack as few last games have-for some crack works,for some it doesn't.Strangely but for me this shit works without changing any time zones or time.
Come on Skidrow team,get back on right path and start marching forward you lazy bastardos!"
,albo88,2012-11-17T20:51Z,works like it should bitches stop the complains  just finished the game and uninstall it bye bye acti not gona buy your shit that lags played on my friends come 2 hour of mp 2 hour of frustration 
,clkpower,2012-11-17T21:20Z,nao funciona
,Kindergaten,2012-11-17T22:00Z,I finally got this to work after looking at a tutorial video. Search gligar2tennyson on u tube
,mutz-nutz,2012-11-17T22:08Z,"IT DOES WORK

I tried all the others with no luck, but this one worked. Here's how I got it working for me.

1. Install the game from SKIDROW
2. Copy/Replace this crack in game directory
3. NVidia users update to latest BETA Driver
4. Run DXSETUP.exe, its located in Program Files (x86)Call of Duty Black Ops 2redistDirectX
5. Set the time +8 hours hong kong time
6. Set the date to 14th november 2012
7. Run the game as administrator

Played all the way through with no crashes, great game, will buy it in a few weeks when the servers aren't too overcrowded."
,mcilroyrick,2012-11-18T17:10Z,The crack isn't proper unless it fixes the unhandled exception.  Changing the date and time and the time zone to make a crack work is shoddy programming.  It simply isn't right until I can just start the game without changing settings on my system.  That is the definition of a proper crack.
,AssassinMirror13,2012-11-18T19:05Z,"Finally got this to the main menu. Loading screens work perfectly. Way to perfect I guess. It decides to crash when launching the game.
Figures."
,hank266,2012-11-18T19:25Z,Thx Gh0snet and mutz-nutz for your instructions. I follow all steps except the change of date just to see if it worked and it did. I have only play through first mission and so far so good. Thx^^
,reryn,2012-11-19T15:30Z,"Doesn't work.

fail crack."
,smoktup,2012-11-19T15:31Z,working fix final http://thepiratebay.se/torrent/7840951/Black.Ops_II_CrackFix-Final(Gamecopyworldsource)
,SpaceCadet6969754,2012-11-19T18:13Z,"This does not fix the time and date issue with this game, it still crashes if you don't set your date to the 13th.
This game is not good enough not worth to have my computer constantly living on the 13th of November you know I do use it for other stuff as well.We need a fixed crack that works after 13th of November date."
