Filename,Size,Unit
Freestyle Friday/33 No Doubt.mp3,11.43,M
Freestyle Friday/24 Paradise City.mp3,11.2,M
Freestyle Friday/53 Robots Can't Drink.mp3,11.02,M
Free Songs/10 Honors Bio.mp3,10.91,M
Free Songs/08 Grey Skies.mp3,9.98,M
Freestyle Friday/35 Dayquil.mp3,9.79,M
Freestyle Friday/25 Loosen Up.mp3,9.59,M
Free Songs/07 Fight for Days.mp3,9.49,M
Freestyle Friday/23 Aches.mp3,9.39,M
Freestyle Friday/28 Arcade.mp3,9.34,M
Freestyle Friday/31 Grounded.mp3,9.12,M
Freestyle Friday/29 Get Out of Park.mp3,8.37,M
Free Songs/01 Be a King.mp3,8.22,M
Free Songs/05 My Last Dream.mp3,7.71,M
Freestyle Friday/50 Grown For a Minute.mp3,7.67,M
Freestyle Friday/48 Cold Stars.mp3,7.52,M
Freestyle Friday/47 Standing Tall.mp3,7.26,M
Free Songs/09 Last Man Standing.mp3,7.13,M
Freestyle Friday/54 Last Man Standing.mp3,7.13,M
Free Songs/02 Where We Are.mp3,7.13,M
Freestyle Friday/09 Let Me Ohh.mp3,6.94,M
Freestyle Friday/51 Space Rivers.mp3,6.43,M
Freestyle Friday/45 Palm Trees.mp3,6.37,M
Freestyle Friday/46 Party With Wookies.mp3,6.21,M
Freestyle Friday/06 Underdog.mp3,6.18,M
Freestyle Friday/12 Sidelines.mp3,6.02,M
Freestyle Friday/30 Green Lights.mp3,5.96,M
Freestyle Friday/52 Make Like a Tree.mp3,5.95,M
Freestyle Friday/15 Class Clown.mp3,5.93,M
Freestyle Friday/08 Hard Bargain.mp3,5.78,M
Freestyle Friday/14 Night Table.mp3,5.72,M
Freestyle Friday/42 New Trouble.mp3,5.66,M
Freestyle Friday/34 Something Better.mp3,5.58,M
Freestyle Friday/37 Get on Board.mp3,5.51,M
Freestyle Friday/41 Harmonium.mp3,5.5,M
Freestyle Friday/21 Shortcuts.mp3,5.41,M
Freestyle Friday/36 Nyquil.mp3,5.24,M
Free Songs/04 Rebuild.mp3,5.21,M
Freestyle Friday/20 Board Game.mp3,5.19,M
Freestyle Friday/39 Automatic.mp3,5.04,M
Freestyle Friday/49 Gone.mp3,5.02,M
Freestyle Friday/40 Taking My time.mp3,5.02,M
Freestyle Friday/16 Never Heard.mp3,4.95,M
Freestyle Friday/Changed My Mind.mp3,4.9,M
Freestyle Friday/17 Tired.mp3,4.85,M
Freestyle Friday/10 Simple.mp3,4.85,M
HipHop Is Good/11 Jambox.mp3,4.84,M
Freestyle Friday/44 No Brakes.mp3,4.84,M
Free Songs/06 Life Coach.mp3,4.64,M
Freestyle Friday/18 Cool Like That.mp3,4.63,M
HipHop Is Good/07 Drinking With My Headphones On.mp3,4.56,M
Freestyle Friday/26 Animal.mp3,4.5,M
Free Songs/03 Be Okay.mp3,4.49,M
Freestyle Friday/19 Hard Worker.mp3,4.45,M
HipHop Is Good/02 Alive til I Die.mp3,4.39,M
Freestyle Friday/05 Cloak & Dagger.mp3,4.38,M
Freestyle Friday/38 Roller Coaster.mp3,4.31,M
Freestyle Friday/13 Move Out.mp3,4.26,M
Freestyle Friday/03 On The Radio.mp3,4.14,M
Freestyle Friday/27 Hoist That Rag.mp3,4.13,M
HipHop Is Good/13 Miracle.mp3,3.96,M
Freestyle Friday/11 Opening Day.mp3,3.88,M
Freestyle Friday/32 Good Friday.mp3,3.84,M
HipHop Is Good/04 Nest.mp3,3.84,M
Freestyle Friday/07 Hampden Parks.mp3,3.8,M
HipHop Is Good/03 In The Bag.mp3,3.48,M
HipHop Is Good/08 Dogface Go.mp3,3.4,M
Freestyle Friday/04 Conundrum.mp3,3.4,M
HipHop Is Good/09 Don't Like My Music.mp3,3.34,M
HipHop Is Good/01 Hip Hop Is Good.mp3,3.32,M
HipHop Is Good/10 Karaoke Night.mp3,3.22,M
Freestyle Friday/01 Clap on Clap Off.mp3,3.19,M
HipHop Is Good/12 No Time.mp3,3.17,M
Freestyle Friday/02 I Know.mp3,3.05,M
HipHop Is Good/05 The Dude.mp3,2.86,M
HipHop Is Good/06 Robots Pop Songs.mp3,2.86,M
