User Type,Username,Date,Text
,yudodis,2012-07-11T10:51Z,this is not 320 kbps. Y U DO DIS
,jahrhymez86,2012-07-13T06:05Z,Thanks man! Will Seed! Good quality too!
,Huntman50,2012-07-13T18:50Z,Not even close to the iTunes quality. It's tolerable but I prefer better quality
,Gwynnbleidd,2012-09-03T19:00Z,"Hey you dickheads don´t post stupid comments about the quality, ENJOY this great music!
Thanx loverulz 4 this great upload!"
,toebee97,2012-09-04T04:11Z,"NOT 320kbps... Might be upconverted to that, but it sounds like a shitty webrip. No dice kiddies. This one is much better. http://thepiratebay.se/torrent/7427756/P.O.D._-_Murdered_Love_2012-MFA"
