Filename,Size,Unit
Blonde princess is home alone_(new).avi,202.02,M
All natural teeny posing_(new).avi,72.09,M
Close up teen outdoors sex (new).avi,59.89,M
Her cunt is so yummy(new).avi,52.09,M
Face fucked blonde loves it(new).avi,44.05,M
Huge breasts bouncing up and down (new).avi,41.22,M
Another video of so pretty chubby puertorrican _morena_recorded by a friend _(new).avi,37.63,M
Her hairy pussy needs fisting(new).avi,25.27,M
Bum fucking his horny wife_(new).avi,10.99,M
Banging her with no mercy _(new).avi,10.5,M
