User Type,Username,Date,Text
,raajs,2012-07-17T13:38Z,hai floresta pls upload boys days2 also
,Floresta,2012-07-17T18:15Z,OK raajs 
,raajs,2012-07-18T11:20Z,thanks in advance i am waiting for that cuties
,Tubarina,2012-07-22T04:26Z,Thank you. hot sex boys .. beautiful ...
,azzbrutha,2012-07-22T15:44Z,Floresta is the BAREBACK action? I love bareback action
,Floresta,2012-07-22T18:12Z,azzbrutha  not BAREBACK action;
,azzbrutha,2012-07-27T10:28Z,"You have beautiful movies love to see bareback only please can u explicity state in your movies section : ""BAREBACK"" ????? Thanks a lot"
