User Type,Username,Date,Text
,JamesPY,2012-04-29T04:53Z,"Bienvenido de vuelta DJREYLY, en verdad estuvimos esperandote! Gracias por compartir!"
,DJREYLY,2012-04-30T02:11Z,de nada amigo gracias cuidate 
,ado69,2012-05-14T06:44Z,"Que bien que estes de vuelta, eres de los pocos que suben audio latino y con excelente calidad, siempre estoy pendiete de lo que subes .... Saludos."
,ado69,2012-05-14T06:45Z,"Que bien que estes de vuelta, eres de los pocos que suben audio latino y con excelente calidad."
,DJREYLY,2012-05-14T21:02Z,de nada amigo ado69 salu2
