User Type,Username,Date,Text
,nezzx,2012-09-02T04:45Z,Excellent 
,extracube,2012-09-02T11:22Z,"Not being picky but anyone who has done it please snap a desktop pic and upload to a pic host site, would like to see.  Snap a few if poss."
,xpmule,2012-09-02T13:46Z,"in case people don't know Stardock makes a beta application that adds a start menu and i heard of one called classic shell too.
I hear the stardock one is impressive with amount of features.

and maybe that's what the guy posted here but since he has no title or description then i have no clue what this is and i don't download things just find out what it is lol"
,sukh16,2012-09-02T14:40Z,"To see the screenshots: open google search in images and type 'start8"". "
,delhiflats,2012-09-02T14:56Z,very smart tool...perhaps makes up one feature that was being missed in win 8....it does disable the quick access to metro interface from the bottom left screen corner of the desktop ...but very smart tool all the same
,delhiflats,2012-09-02T14:58Z,very smart tool...makes up one missing feature in win 8..it disables the quick access to metro interface from bottom left screen though
,j555guy,2012-09-02T15:04Z,"Works Great, Thanks sukh16"
