User Type,Username,Date,Text
,DEBRATABOR,2012-09-23T22:04Z,WOW! YouRGR8!
,simbamax,2012-09-23T22:06Z,Thank you so much for doing this! really appreciated..Keep up the good work! 
,trainsmart,2012-09-23T22:26Z,"Thank you yet again for my weekly fix, you're a wonderful person to do this all of us!!!"
[S],velvet.,2012-09-23T22:58Z,Enjoy your pink skull.
,computermek,2012-09-24T04:39Z,Thank you !!!
,adkonn,2012-09-24T11:20Z,thanks
[T],tri895,2012-09-24T20:33Z,"thanks for your comments, seed if you can
and enjoy! :)


a pink skull, wohoo :) x"
,NaNaMoose,2012-09-26T18:44Z,SOOO GLAD You got ur SKULL BACK!!!!!!!! Thank you as always.
