User Type,Username,Date,Text
,Rastamanse,2012-05-01T20:27Z,http://www.imdb.com/title/tt1560985/
,Rosapanten,2012-05-01T21:51Z,"Ett bra initiativ och eftersom det är gratis på piratebay att ladda ner filmer m.m. så ska det inte finnas några krav på kvalité vad det gäller video och Svensk undertext. Men underbetyg för den här uppladdaren.

Video och Audio: 1/10, ljudet i osynk med ca 1 sek fördröjning

Svensk undertext: 1/10  (Google translation) "
,Rastamanse,2012-05-02T01:15Z,"kvaliten kom från senaste uppladdning av the devil inside, ""extremezone"" hyfsat okej, antar att du kollade igenom bara 30-60 sekunder, och kan dock då förstå din poäng :) "
,FilmTrix,2012-05-02T11:54Z,"Tack! Filmen var bra, texten var lite konstig men funkade utmärkt ändå :)"
,Masters100,2012-05-02T21:04Z,"Vad är det för ljudkodex som har använts, för jag får inget ljud ur ps3 som media spelare."
