User Type,Username,Date,Text
,ThomasYO,2012-10-24T06:16Z,"All RAR's, just wait for TvTeam, don't waste time with 474MB fakes."
,J3rryKo42O,2012-10-24T07:39Z,"@ThomasYO  Are you stupid? Just because its a RAR doesnt means its fake. Unpacking them is simple and takes 3 seconds at the most(unless your running a dinosaur of a computer). 

p.s. green skull = no fakes "
,jc4321234,2012-10-24T08:36Z,"@ThomasYo  People like you should be banned for talking out of your arse.  It's a 720p mkv file, it works perfect.  Piss off "
,beormalte,2012-10-24T09:00Z,"Its not J3rryKo42O fault he rides the short bus.
Everyone loves a trier."
