User Type,Username,Date,Text
,pinutu,2012-09-20T17:26Z,thanks man
,mbtamuli,2012-09-21T16:23Z,"Done downloading...""OK"" quality (being DvDScr its as good as possible)... thanks Team_xRG

A: 7
V: 6

Will be seeding now..."
,arth0heen,2012-09-22T19:59Z,Why do you tag a CamRip as a DVDScr?
,anshulnow,2012-09-23T12:27Z,"if you really want to see this movie, go to the cinemas.

about this print v was tolerable but the audio was so pathetic that i deleted it after 5 failed attempts to understand the shit that was being said there!!!

dont download!!!"
,damanjatt,2012-09-24T16:11Z,@anshulnow ..well....thanx for telling me about the movie...dude...i m not going to download it....
,ahell11,2012-09-26T02:38Z,best FR & ENG subtitles: http://www.moviesubtitles.org/movie-8559.html
,Segway101,2012-09-29T08:23Z,Isnt it enough that we have to deal with this call centre nation every fucking support and telemarketing call?  Do we have to be inflicted with their fucked up ripoff movie industry as well?
,neel101,2012-09-29T16:04Z,"@Segway101 - are u fucking retarded or something?? Do search through torrents for fun? even if they are foreign and ur brain cant understand it?
why the hell did u come on this page in the first place...and then why the fuck do u need to comment? 
if Indians are uploading torrent on this site...are they being uploaded into your ass?? then why do u need to scream so much?
dont understand something....then fuck off..."
,tpbse2010,2012-09-29T17:55Z,"I love you people and your racist comments. Your companies such as MS and Intel are outsourcing cutting edge research to countries like India and all you are bothered about is a few call center jobs! Your govt is sending your youth to die in the middle east for the profit of your oil companies and using your taxes to bail out corrupt corporate while laying you off as if it were a hunting game and instead of blaming your own people for screwing you in the rear, you blame Indians for getting paid to work. You geniuses deserve to be treated by everyone, including your own govt, your companies,Cuba and the Arab world (which, for your information does not include India - light bulb!!), the way you are treated. You losers are so lame that Indians and Chinese score much, much higher than you in your standardized tests like SAT & GMAT and come to your country and hog your elite universities. I have more schoolmates who are Ivy league alumni than any of you will ever have. 

I love Obama because his 4 years have been the worst in US history for your people and I wish you reelect him so he screws you even more. 
PLEASE badmouth India/Hindi movies/Arabs/Muhammad/my family because that is all you Yankees can do since your govt is yanking the rug off from under your feet while you impotently count the days left until your unemployment checks run out. I love my American boss, because she is so dumb that she spaces out the moment I start mouthing technical jargon. And I get paid in dollars for doing just that. In fact we use the Indian term for dumb to refer to Americans. So for you, curry=Indian=cab driver/call center, Muslim = terrorist. For us dumb = American, blonde in my office = free pussy (actually a few drinks, so not free entirely. Sometimes she pays).

US rocks!! Continue rocking till you hit rock bottom. Then you will get a plane ticket to India where the jobs are. Actually it has already started.

YES!! Start barfing/barking as we take your jobs, your money and finger your women in the front and the rear. Only choicest expletives please, starting with a, s or f and containing 3 -4 letters as I know longer words hurt your teeny weeny little rudimentary brain."
,tpbse2010,2012-09-29T18:24Z,"@Segway101 : Sweety, you do. btw, I need your address to send a WMD I just crapped."
,erraticchevy,2012-09-30T18:05Z,"@tpbse2010 Its real convenient for a Indian fuck like you to bad mouth this country that you live in and thrive in yourself, Why dont you go back to your shit hole country and work your shit jobs that our country has great-fully blessed yours with and then you can talk shit about this country, If it wasnt for THE U.S.A. India would be nothing but slum dogs, so watch your virgin mouth and be greatful your not sleeping in the streets eating out of garbage cans and blowing dudes cocks to make a few pennies like your mother did to get you to this fine country so keep your mouth shut ''People With glass house shouldn't throw stones'' bitch ass!"
,tpbse2010,2012-09-30T20:09Z,"@erraticchevy: dumb = American
Your barfing proves my point. You resort to calling names because you don't have a single logical point to counter the facts I have stated. Your govt portrays only the poverty in India because that is what it wants you to see and be complacent in your stupidity and watch Jerry Springer or something while it conveniently siphons off your taxes to corporate for firing you. 
You should be ashamed of what you have done to the great economic powerhouse your forefathers gave you. More than 3 centuries of autonomy and what do you have to show for that? The largest proportion of obese people on the planet. A country headed towards bankruptcy, one of the highest unemployment rates in the world and a (dumb) population deeply divided on almost every important issue.
Abuse me and my country as much as you can, it wont change the fact that you are a country of (dumb)losers, and the only reason your economy still stands is the wealth your ancestors accumulated is yet to run out. 

i> Your govt took photos of props in the desert and fooled your parents into believing that an American had landed on the moon. You beat your chest like a gorilla, but the fact is that your govt was just bluffing to piss the Soviets off. If it had actually sent one, with the advanced tech, NASA would have sent 10 more by now. Conclusion - Americans are extremely gullible and will buy any BS their govt sells them.

ii>Poor uneducated nomads from Middle East did not break your high tech security, steal your planes and launch a co-ordinated attack on 9/11. Your govt did, so that it could scare you into agreeing to any security policy they want to agree to.Conclusion - Americans are scared little chickens, always afraid of the bearded boogeyman. So much for your tech and your nukes.

iii>In Vietnam war.....sorry, that one your people saw through after your valiant army was boinked in the rear by a bunch of ill fed Vietnamese civilians. So much for mighty Uncle Sam. Iraq never had any WMDs. Your govt just wanted to finger the middle east region for the oil.

iv >I have a WMD as per my earlier blurb, but you have not sent me your address.

US is only trying to stop India from becoming a power by supplying arms to Pakistan and slapping sanctions the moment it hears the N-word. But I am not scared that US will ever have the balls to attack India no matter what we do. You guys profit too much from us, and our dicks have nuclear tips too.

Just one more thing to prove what a true (dumb)American you are, just like the rest of your people. I have never been to the US, so your conclusions don't hold true. So much for your assumptions, dumbass!!"
,tpbse2010,2012-09-30T20:10Z,"@erraticchevy: dumb = American
Your barfing proves my point. You resort to calling names because you don't have a single logical point to counter the facts I have stated. Your govt portrays only the poverty in India because that is what it wants you to see and be complacent in your stupidity and watch Jerry Springer or something while it conveniently siphons off your taxes to corporate for firing you. 
You should be ashamed of what you have done to the great economic powerhouse your forefathers gave you. More than 3 centuries of autonomy and what do you have to show for that? The largest proportion of obese people on the planet. A country headed towards bankruptcy, one of the highest unemployment rates in the world and a (dumb) population deeply divided on almost every important issue.
Abuse me and my country as much as you can, it wont change the fact that you are a country of (dumb)losers, and the only reason your economy still stands is the wealth your ancestors accumulated is yet to run out. 

i> Your govt took photos of props in the desert and fooled your parents into believing that an American had landed on the moon. You beat your chest like a gorilla, but the fact is that your govt was just bluffing to piss the Soviets off. If it had actually sent one, with the advanced tech, NASA would have sent 10 more by now. Conclusion - Americans are extremely gullible and will buy any BS their govt sells them.

ii>Poor uneducated nomads from Middle East did not break your high tech security, steal your planes and launch a co-ordinated attack on 9/11. Your govt did, so that it could scare you into agreeing to any security policy they want to agree to.Conclusion - Americans are scared little chickens, always afraid of the bearded boogeyman. So much for your tech and your nukes.

iii>In Vietnam war.....sorry, that one your people saw through after your valiant army was boinked in the rear by a bunch of ill fed Vietnamese civilians. So much for mighty Uncle Sam. 

iv >Iraq never had any WMDs. Your govt just wanted to finger the middle east region for the oil.I have a WMD as per my earlier blurb, but you have not sent me your address.

US is only trying to stop India from becoming a power by supplying arms to Pakistan and slapping sanctions the moment it hears the N-word. But I am not scared that US will ever have the balls to attack India no matter what we do. You guys profit too much from us, and our dicks have nuclear tips too.

Just one more thing to prove what a true (dumb)American you are, just like the rest of your people. I have never been to the US, so your conclusions don't hold true. So much for your assumptions, dumbass!!"
,erraticchevy,2012-09-30T21:38Z,"@tpbse2010 ""INDIA, THE JOKE OF THE WORLD"" Its So Nice to see that you can say you have never been to the U.S. yet you have the same Ignorant Foreign assumptions that you see on the news per ""OUR GOVERNMENT WANT YOU TO SEE""   india has a 9.8 Percent jobless rate The USA is at 9 percent so get your facts correct   Maybe America would have a lower unemployment rate if it wasn't trying hard to help shit countries like India to have jobs thus fore creating a bigger profit margin for us. but that's where our government steps in with something called welfare so we get payed and don't have to worry about starving, therefore our country is over weight because its prosperous and we have that much more money to spend on food you think our stomachs our big you should see my penis O but you haven't given me your address yet.:) .. And don't get upset cause our country bullies other countries if you got oil and we want it we will take it and you will take it up the rear deal with it maybe get a military than can conquer more then a riot and you can prosper too why don't you mind your business stop believing the conspiracy shit you see on TV stay on true topics, who wants to debate over fiction I Guess you believe Hitler has a base on the moon and flies ufos around too, sucks that someone like you with incorrect knowledge wants to fight over american topics you know nothing about, your wasting my time tpbse2010 = Dumbass "
,erraticchevy,2012-09-30T21:40Z,Man My Cock feels HUGE
,NMEMEDIC,2012-09-30T22:34Z,Hahahahaha all this over a stupid movie??  Who gives a fuck... We all know everyone talks shit about America but the truth is they want to live here.  
,tpbse2010,2012-09-30T22:48Z,"@erraticchevy: dumb = American
You actual unemployment rate is approx 11%. Your govt is misleading you (yet again, dumbass). Google 'Labor Force Participation Rate' and try to follow what the experts say, though I am certain its a futile exercise. America is only helping its corporate, not its people and certainly not any other country. Your tax rates are highest in the world, so what if you get a couple of hundred dollars in 'welfare'?

Scandinavian countries are more prosperous than US, and yet the people are not as obese. Finish your school, your logical reasoning is really weak. And while you are at it, try learning punctuation.

Hitler 'has' a base? Wrong tense dude...sorry, dumb yankee!! All the science fiction has been used up by your govt in fooling you. This is the latest - Bigfoot stole your taxes and your unemployment checks will now be less by an amount corresponding to 20 weeks pay.

Before talking about your military, read about what happens to US soldiers in joint training exercises. They are the runt of the litter, only depending on tech. No wonder you scampered back from Vietnam with your tail between your legs. Superpower my ass!

I gave my address to your mom, last night. My cock felt huge, in her ass :) !"
,erraticchevy,2012-10-01T01:19Z,"@tpbse2010 right O my mother..You had sex with a corpse? You sick bastard. You still live with your parents I assume like the rest of the slums in your ""Country"" Do you share a bed with your mother and sisters? what a horrible way of life but i guess that's why you're so bitter to the AMERICAN way of life. I'm sure half your family has wised up and came to America, I don't mind as long as you don't. I'm sure your hated at home. this will be my last transmission because I'm tired of debating with a HARD HEADED dumb IGNORENT Indian fuck who believes anything he reads on the internet. SURPRISE ANOTHER WAIST OF AN INDIAN CITIZEN..Poor poor man
tpbse2010=WAIST OF LIFE

p.s. do us all a favor and kill yourself ;)"
,erraticchevy,2012-10-01T01:19Z,"@tpbse2010 right O my mother..You had sex with a corpse? You sick bastard. You still live with your parents I assume like the rest of the slums in your ""Country"" Do you share a bed with your mother and sisters? what a horrible way of life but i guess that's why you're so bitter to the AMERICAN way of life. I'm sure half your family has wised up and came to America, I don't mind as long as you don't. I'm sure your hated at home. this will be my last transmission because I'm tired of debating with a HARD HEADED dumb IGNORANT Indian fuck who believes anything he reads on the internet. SURPRISE ANOTHER WAIST OF AN INDIAN CITIZEN..Poor poor man
tpbse2010=WAIST OF LIFE

p.s. do us all a favor and kill yourself ;)"
,xsadx,2012-10-01T10:00Z,Fuck India and the retarded movies they come out with. You cow urine rubbing mother fuckers 
,jeffengg,2012-10-03T14:33Z,Paap pls upload this movie
