Filename,Size,Unit
Facebook Marketing- Leveraging Facebook's Features for Your Marketing Campaigns (3rd Edition)[Team Nanban][TPB].epub,35.09,M
Facebook Marketing- Leveraging Facebook's Features for Your Marketing Campaigns (3rd Edition)[Team Nanban][TPB].pdf,7.63,M
README.txt,946,B
Release Notes.txt,100,B
Other/Torrent downloaded from Silvertorrents.me.txt,52,B
Other/Torrent downloaded from extratorrent.com.txt,51,B
Other/Torrent downloaded from Piratebay.se.txt,50,B
Other/Torrent downloaded from Demonoid.me.txt,46,B
Other/Torrent downloaded from 1337x.org.txt,44,B
Other/Torrent downloaded from h33t.com.txt,43,B
Other/Torrent downloaded from Kat.ph.txt,41,B
