User Type,Username,Date,Text
,michaelrwatson,2012-11-03T04:18Z,"Wow.... All that info up above, and NO FRAMERATE. Is it NTSC? PAL? 30fps (cam)?? 

And NO SAMPLE either.  WTF?

Soura, you should dispense with the trivia, e.g. useless crap like color space, chroma sampling, matrix coefficients, etc. and include the aforementioned essentials instead."
,sinner77,2012-11-03T19:53Z,"@Michaelwatson
Why dnt u upload something urself before abusing someone...Wat do u mean WTF??? huh

Dnt like it go someplace else....."
,Nochobdia,2012-11-26T04:23Z,"Great release, thanks!
Btw., @Michaelwatson if you don't like it, just find something else and stop bothering people with your inappropriate remarks!"
