Filename,Size,Unit
Doc.West.2009.Rel.2012.PAL.Retail.DVDR.9.DD5.1.NL.Subs.nfo,336,B
Doc.West.2009.Rel.2012.PAL.Retail.DVDR.9.DD5.1.NL.Subs/DOC_WEST.iso,7.63,G
Doc.West.2009.Rel.2012.PAL.Retail.DVDR.9.DD5.1.NL.Subs/DOC_WEST.mds,4.21,K
Torrent downloaded from AhaShare.com.txt,58,B
Torrent downloaded from Demonoid.me.txt,46,B
Torrent Downloaded From ExtraTorrent.com.txt,353,B
Torrent downloaded from P2PDL.com.txt,81,B
Torrent downloaded from Rarbg.com.txt,33,B
Torrent downloaded from silvertorrents.me.txt,29,B
Torrent Downloaded from TorrentState.com.txt,46,B
tracked_by_h33t_com.txt,23,B
