User Type,Username,Date,Text
,In_Da_Club,2012-09-20T22:20Z,"yay, thanks, was looking for this, epic soundtrack, something that blizzard does right with every expansion :)"
,gromster,2012-09-21T19:54Z,Thank you so much!!!!
,Silentfate,2012-09-24T05:05Z,"Hey, 

Since you have the physical cd, would you mind upping this in better quality than 128? "
,quezacolt,2012-09-24T17:59Z,could you upload the behind the scenes dvd please?
,todaba,2012-09-25T18:54Z,Files in wma format.
,afterh8,2012-09-25T22:39Z,I ain't playing WoW anymore.. but thanks for this ;)
