User Type,Username,Date,Text
,mmike91,2012-10-06T06:19Z,please put up Real Time With Bill Maher.. please!!!!
,majik895,2012-10-06T15:16Z,Mike it is up. Thanks for the upload VTV your great.
,strovilos,2012-10-08T09:19Z,Thanks :)
,bladedracula,2012-10-09T20:44Z,THANKS
,websterphreaky,2012-10-10T20:14Z,"Bill Maher is a LibTard MORON, don't bother with any upload.

Thanks for all the Boss Uploads, shows just how crooked Chitcago is."
,Jesterito,2012-10-19T01:30Z,This is probably the best show on TV right now. 
