Filename,Size,Unit
INFO/postergr.jpg,87.73,K
INFO/poster.jpg,18.89,K
INFO/The Hobbit An Unexpected Journey (2012) SCR XVID Extern nl Subs BB.txt,2.14,K
INFO/Torrent_downloaded_from_AhaShare.com.txt,278,B
INFO/Torrent Downloaded from  Movie-Torrentz.txt,260,B
INFO/Tracked by H33T.txt,257,B
INFO/Torrent downloaded from BettyBoop torrents on BTScene.eu.txt,68,B
INFO/Torrent Downloaded from  btscene.eu.txt,42,B
MOVIE/The Hobbit An Unexpected Journey (2012)  SCR XVID Externe Subs Simply ReleaseS Toppers.avi,1.47,G
MOVIE/The Hobbit An Unexpected Journey (2012)  SCR XVID Externe Subs Simply ReleaseS Toppers.srt,93.01,K
The Hobbit An Unexpected Journey (2012) SCR XVID Extern nl Subs BB.nfo,2.14,K
