User Type,Username,Date,Text
[V],mirrormaster82,2012-03-08T18:51Z,I was thinking of uploading this yesterday...but said what the hell...read it today...ok for 1st issue...
[T],MrDowntown,2012-03-08T18:54Z,"I had read ABOUT it and looked interesting, havent gotten a chance to get to it yet."
,muckymucks,2012-03-08T20:47Z,Looks interesting. Checking it out.
[T],MrDowntown,2012-03-09T02:16Z,"Just read this - kinda slow, and the story is a little eh, but it has promise, esp with the ending, depending on issue #2 - I may start following this"
,unnim2,2012-03-09T04:18Z,thanks Mr.D
[T],MrDowntown,2012-03-09T04:49Z,"This is REALLY good:
http://thepiratebay.se/torrent/7086802/Supurbia_01_(of_4)_(2_Covers)_(2012)_(Digital)_(Zone-Empire)"
,suicidebattery,2012-03-09T19:00Z,Really enjoyed this comic. Nice ending. Hopefully the next will be just as good. Thanks for the share.
[T],MrDowntown,2012-04-05T16:09Z,"Issue #2:
http://thepiratebay.se/torrent/7161284/Hell_Yeah_02.cbr"
,MuserClair,2012-05-11T01:53Z,thanks for the ul! :)
