User Type,Username,Date,Text
,andrada.costea,2012-09-04T10:58Z,When can we expect the new episode of The Real Housewives of New York City ? 
[T],rkstr,2012-09-04T11:08Z,as that comment is neither a thank you or a rating on the upload I will choose to ignore it
,andrada.costea,2012-09-04T11:31Z,"Sorry, I don't  watch Hip Hop Atlanta, I do thank you for the housewives uploads :)"
,Manny662,2012-09-04T19:46Z,Thank U So Much...
,bmm5568,2012-09-05T01:36Z,"You rock so much, I cant even begin to thank you enough!!!!!!! You are very much appreciated in my house :)"
,cocokissu,2012-09-05T14:24Z,"I love your shows is there a way you can upload R&B Divas and the Steve Harvey TV show, both are new shows and I like to download my shows and watch them when I'm not business with work. I don't even get the chance to turn my TV on. So this would be a big Help. Thanks,"
,miishelly,2012-09-08T01:12Z,i would give you a million hugs for uploading all of the season
