User Type,Username,Date,Text
,ilord32,2012-03-27T21:54Z,"thank jou boobsman your the beste.
is there any news of the new naruto game ? thank jou."
,salazam1,2012-03-27T22:19Z,@ilord32 http://thepiratebay.se/torrent/7095100/Naruto_Shippuden_Ultimate_Ninja_Storm_Generations_USA_XBOX360-SP
[V],boobsman,2012-03-27T23:34Z,@ ilord32 i thought someone had already posted both the PAL and NTSC versions? if not i'll post for you :)
,Mamba4ever,2012-03-28T09:15Z,"Cheers for this bud, any chance you can up 'Capcom Digital Collection' when you get a chance? Many thanks"
,esotericizm,2012-03-28T15:02Z,"Dude your the bomb, Great work. Registered just to say this. Keep it up, Guys like me really appreciate it."
[V],boobsman,2012-03-28T15:32Z,@ Mamba4ever yep i'll post it later when other stuff has had time to seed :)
,john4551,2012-03-29T14:02Z,Cant get past the start menu
,ilord32,2012-03-29T18:19Z,@boobsman.yes I know. I have already downloaded this game but there is something with this torrent.so I'll wait for the good uploader.so I can work and continue seeding.
,xkeyjunkie,2012-03-29T19:36Z,"Downloaded DMC HD but when I run the game through abgx doesnt recognize the iso????

Tried running through xkey it doesnt boot!!!

Any help would be appreciated!!!
"
,john4551,2012-03-30T12:01Z,HELLO cant get past the start menu any ideas it works on my lt 2.0 but not on my lt 3.0 R.G.H
,Assassinprofessor,2012-03-30T15:28Z,downloaded 50% and it shows error when i want to start the torent again for another 50% left..it says'files missing from job' what's supposed to mean?? :(((
,john4551,2012-03-30T22:10Z,sorry working now just doesnt work if you have a scene it sensor plugged in
,jagoal12,2012-04-04T23:37Z,"how do i play this game hv a xbox 360 slim, do i need to mod if if i do how? any help guys jagoal12@gmail.com"
,truemaster,2012-04-13T00:39Z,this is xgd3 iso. burn using ihas burner flashed with burner max firmware and verbatim dvd+dl made in sigapoure is also ap2.5 active use ltv3.0 and topology data for ltv2.0 users probably hitachi 78-79 owners use ap sector that match this game 
,truemaster,2012-04-13T00:40Z,this is xgd3 iso. burn using ihas burner flashed with burner max firmware and verbatim dvd+dl made in sigapoure is also ap2.5 active use ltv3.0 and topology data
,Bassdrop,2012-07-16T04:33Z,Works great Thank you boobsman!
,huydinh282,2012-07-28T18:56Z,You rule boobsman!
