User Type,Username,Date,Text
,Kole97,2012-09-01T16:33Z,"“Feeling gratitude and not expressing it is like wrapping a present and not giving it.”

Thanks mate for sharing!! 
I3endik = Green Skull :) direct"
,nevermask7,2012-09-02T02:13Z,"Don't know how you got it early, but thanks!  
Good quality, hopefully I won't get busted for putting this on my iPod before the release, seeing as it's on iTunes.  Haha"
,dollasaurus,2012-09-02T21:30Z,You're amazing! Thanks!
,mary_ox,2012-09-04T14:53Z,"Thank You, finding this is awesone¡¡¡"
,MMG-Spunky,2012-09-05T19:33Z,"Hey man i have been downloading your torrents since i even knew what torrents were, so could you please do me a favor and upload Lecrae - Gravity (Deluxe Edition)                                                   You Deserve a Green Skull BTW :D  "
,nevermask7,2012-09-06T17:38Z,"Just a followup comment:
Quality is perfectly fine, no viruses or anything.  
Album is great by the way, but better if you've been a fan for a while"
,BakedUp,2012-09-09T12:56Z,"“Feeling gratitude and not expressing it is like wrapping a present and not giving it.”


Thank you for this.:) Sharing music is like sharing a piece of goodness that always tingles away. You made my day!"
,DameGiggsy,2012-09-09T19:58Z,Cheers. Belated birthday gift for my mum.
,TheEmpathicEar,2012-09-14T20:27Z,"Great up! But, WIKI shows one more bonus track - 15. Waiting on a Train""?"
