Filename,Size,Unit
Cover/Kuife Het Geheim van de Eenhoorn.jpg,1.14,M
Cover/poster.jpg,24.83,K
INFO/The Adventures of Tintin (2011)Pal Retail multi BB.txt,1.34,K
INFO/Torrent_downloaded_from_AhaShare.com.txt,278,B
INFO/Torrent Downloaded from  Movie-Torrentz.txt,260,B
INFO/Tracked by H33T.txt,257,B
INFO/Torrent downloaded from BettyBoop torrents on BTScene.eu.txt,68,B
INFO/Torrent Downloaded from  btscene.eu.txt,42,B
Movie/Kuife Het Geheim van de Eenhoorn.iso,4.32,G
Movie/Kuife Het Geheim van de Eenhoorn.MDS,4.24,K
Movie/The Adventures of Tintin (2011)Pal Retail multi BB.NFO,1.34,K
