Filename,Size,Unit
"Buddha's Brain- The Practical Neuroscience of Happiness, Love, and Wisdom[Team Nanban]tmrg.epub",1.24,M
"Buddha's Brain- The Practical Neuroscience of Happiness, Love, and Wisdom[Team Nanban]tmrg.jpeg",73.91,K
"Buddha's Brain- The Practical Neuroscience of Happiness, Love, and Wisdom[Team Nanban]tmrg.mobi",1.05,M
"Buddha's Brain- The Practical Neuroscience of Happiness, Love, and Wisdom[Team Nanban]tmrg.pdf",1.36,M
others/Torrent downloaded from AhaShare.com.txt,59,B
others/Torrent downloaded from Demonoid.me.txt,46,B
others/Torrent Downloaded From ExtraTorrent.com.txt,353,B
others/Torrent downloaded from Torrentmafia.org.txt,40,B
README.txt,1.28,K
VISIT ME ON FACEBOOK.txt,89,B
