User Type,Username,Date,Text
[V],DibyaTPB,2012-04-02T20:49Z,"I was thinking of doing this, but seems like you did."
,nyder2,2012-04-02T21:27Z,"ya, DibyaTPB, the copy you uploaded sucks.  Video quality is like 3, audio sync if off.   

Plus no one uses WMV.
"
,-fLeAbItE,2012-04-03T14:49Z,"Just registered to say thanks and big up for this...ÂŁ15 up :)

A=10
V=10

Peace out pirates!!"
,OhioStateFan79,2012-04-05T03:11Z,no sound when playing to ps3 from media stream or after burning to disc just to let you know. I know if I knew that I wouldn't have downloaded it just saying
,CuntPole,2012-04-06T19:28Z,Is this torrent avi?
