User Type,Username,Date,Text
,MsWolfy59,2012-02-03T00:43Z,"Sans soleil en BluRay,c'est comme un rayon de soleil qui plane au dessus de ma tête et pour cinéphile seulement .Merci beaucoup ! :)))"
,MsWolfy59,2012-02-03T00:46Z,Mon commentaire ne fonctionne pas ? je voulais dire que Sans soleil en Bluray c'est comme un rayon de soleil au dessus de ma tête .Merci beau coup 
,eluent,2012-05-17T19:24Z,"Such a masterpiece !
A unique jewel of documented video-poetry.
Must-see, must-seed."
,magic_dude,2012-06-06T13:50Z,This is not english! French! I think... :(
