User Type,Username,Date,Text
,max114477,2012-11-15T18:53Z,niiice   goood game
,MARYUS1010,2012-11-15T19:00Z,Game crash all the time a start it!
,vr.vijay06,2012-11-16T07:10Z,"Does anyone have solution for this error before india mission:

""Couldn't find BSP for this map. Please build the fast file associated with mapsmpmp_drone.d3dbsp and try again"""
,picFloc,2012-11-17T16:38Z,"Not working, crashes all the time tested on 2 computers -_-"
,floridalucifer,2012-11-26T00:33Z,You have 2 change time to +8.00 hrs any city and change date to nov 14th then will work like a champ
,-Smash-,2012-11-29T01:12Z,"The game crashed in my computer, too!
For the new people: Don't download this!"
