User Type,Username,Date,Text
,chalakau,2012-04-06T16:39Z,"Russian DUB, 

but if you didn't read the NFO.. u probably not reaading this


10x    maxrus "
,Magickallife,2012-04-06T20:06Z,shame its not english ill start compiling a audio in english but i bet someone else will be beat me to it lol
,rschrake,2012-04-06T23:08Z,So does this mean they're speaking Russian throughout the movie? Or is it in English with Russian subs?
,cstraybeck,2012-04-07T00:33Z,"@rschrake they're speaking Russian throughout the movie, not subs, only Russian."
,gtw1212,2012-04-07T00:36Z,"@rschrake

I'm guessing that it has russian speaking throughout as 'Russian DUB' means russian has been dubbed over the original video."
,edteen207,2012-04-07T01:42Z,sucks that its russian but thanks for the torrent
,Dhizzy16,2012-04-07T04:11Z,im soooo waiting on the english dub
,Juxhin_666,2012-04-07T09:10Z,Omfg now i'm pissed off because i always skipped my russian language lessons :(
,weezy0000,2012-04-07T10:20Z,isn't there a way where u can change the audio to English? 
,hawkins4,2012-04-07T18:07Z,"Yes sure you can,dont you know"
,thisgonnaworkthistime,2012-04-13T16:09Z,crap copy. missing over 20 minutes. don't waste time. 
,Jonney12,2012-04-23T19:05Z,ITS  CRAP..  FULL IN RUSSIAN...
