User Type,Username,Date,Text
,michilllie,2012-11-27T21:38Z,"Oh, great...looks like CD10 begins before CD1...any ideas on how to fix that? 
Geez...I'm about to give up"
,sicanddisturbed,2012-11-27T21:49Z,It shouldn't be a problem
,michilllie,2012-11-27T23:03Z,"Maybe after you're done downloading and seeding, you can go into your file on your computer and change CD10 to CD99. That should make it play in proper order. "
,haveanotherpuff,2012-11-28T01:06Z,It should load in the proper order when imported into your player
