User Type,Username,Date,Text
[V],Nepotu,2012-11-11T03:27Z,"First airing date was june 6, 3007 (not may 30)
Sorry!"
[T],deandominic,2012-11-11T05:27Z,Awesome! I just traveled ahead in time 1000 years :-). Thanks for up!
[V],Nepotu,2012-11-11T11:08Z,"You're welcome, my friend!"
,jworks10,2012-11-12T11:48Z,"this is great, thanks for the up. If you have anymore of these NFL specials, i would love to see you upload them~"
[V],Nepotu,2012-11-13T02:55Z,Yes I have. Stay tuned! And you're welcome!
