Filename,Size,Unit
Amor Asombroso 2009/01- En Espíritu Y En Verdad - Vamos a cantar.mp3,3.61,M
Amor Asombroso 2009/02 - En Espíritu Y En Verdad - Infinito Dios .mp3,4.69,M
Amor Asombroso 2009/03 - En Espíritu Y En Verdad - Hermoso Jesús.mp3,5.31,M
Amor Asombroso 2009/04 - En Espíritu Y En Verdad - Jesús El Mesías.mp3,4.78,M
Amor Asombroso 2009/05 - En Espíritu Y En Verdad - Sublime Gracia.mp3,4.66,M
Amor Asombroso 2009/06 - En Espíritu Y En Verdad - Gloriosa Cruz.mp3,6.58,M
Amor Asombroso 2009/07 - En Espíritu Y En Verdad - Alaba al Padre.mp3,4.08,M
Amor Asombroso 2009/08 - En Espíritu Y En Verdad - Sólo de Jesús la sangre.mp3,4.63,M
Amor Asombroso 2009/09 - En Espíritu Y En Verdad - Mi Dios Es Amor.mp3,4.57,M
Amor Asombroso 2009/10 - En Espíritu Y En Verdad - En Tu Presencia.mp3,8.93,M
Amor Asombroso 2009/cover.jpg,22.23,K
Glorioso Rey/01 Los Santos.mp3,5.01,M
Glorioso Rey/02 Rodeas la Eternidad.mp3,6.25,M
Glorioso Rey/03 En tu Luz.mp3,5.31,M
Glorioso Rey/04 Generacion que danza.mp3,4.35,M
Glorioso Rey/05 Glorioso Rey.mp3,6.89,M
Glorioso Rey/06 Dios es Rey.mp3,5.67,M
Glorioso Rey/07 Espóntaneo.mp3,2.83,M
Glorioso Rey/08 Perfume a Tus pies.mp3,4.74,M
Glorioso Rey/09 Me dice Salvador.mp3,5.99,M
Glorioso Rey/10 Rey de Justicia.mp3,5.34,M
Glorioso Rey/11 Cuan Grande es Dios.mp3,9.06,M
Glorioso Rey/CUAN GRANDE ES DIOS.pdf,57.89,K
Glorioso Rey/DIOS ES REY.pdf,37.42,K
Glorioso Rey/EN TU LUZ.pdf,48.85,K
Glorioso Rey/GENERACIÓN QUE DANZA.pdf,69.55,K
Glorioso Rey/GLORIOSO REY.pdf,84.82,K
Glorioso Rey/LOS SANTOS VIENEN.pdf,43.23,K
Glorioso Rey/ME DICE EL SALVADOR.pdf,74.26,K
Glorioso Rey/PERFUME A TUS PIES.pdf,51.48,K
Glorioso Rey/REY DE JUSTICIA.pdf,48.19,K
Glorioso Rey/RODEAS LA ETERNIDAD.pdf,42.28,K
"Ha Vencido, ha Triunfado/01 Es Tiempo de Gracia - En Espíritu y en Verdad.mp3",5.46,M
"Ha Vencido, ha Triunfado/02 El Resucitó [Declaración] - En Espíritu y en Verdad.mp3",999.54,K
"Ha Vencido, ha Triunfado/03 Ha vencido - En Espíritu y en Verdad.mp3",4.43,M
"Ha Vencido, ha Triunfado/04 El Río [Espontáneo] - En Espíritu y en Verdad.mp3",6.16,M
"Ha Vencido, ha Triunfado/05 Haz Llover - En Espíritu y en Verdad.mp3",4.91,M
"Ha Vencido, ha Triunfado/06 Deja Tu gloria caer - En Espíritu y en Verdad.mp3",5.12,M
"Ha Vencido, ha Triunfado/07 Reposa En Este Lugar [Espontáneo] - En Espíritu y en Verdad.mp3",2.9,M
"Ha Vencido, ha Triunfado/08 Precioso Cordero (Espontáneo) - En Espíritu y en Verdad.mp3",1.45,M
"Ha Vencido, ha Triunfado/09 Acércate (Espontáneo) - En Espíritu y en Verdad.mp3",3.49,M
"Ha Vencido, ha Triunfado/10 Ha Triunfado, Ha Vencido [Declaración] - En Espíritu y en Verdad.mp3",4.14,M
"Ha Vencido, ha Triunfado/11 Griten a Dios - En Espíritu y en Verdad.mp3",3.05,M
"Ha Vencido, ha Triunfado/12 Digno Es El Señor - En Espíritu y en Verdad.mp3",5.57,M
"Ha Vencido, ha Triunfado/13 Majestad - En Espíritu y en Verdad.mp3",2.69,M
"Ha Vencido, ha Triunfado/14 Rey de Misericordia (Espontáneo) - En Espíritu y en Verdad.mp3",2.76,M
"Ha Vencido, ha Triunfado/15 El Espiritu y La Novia [Espontaneo] - En Espíritu y en Verdad.mp3",3.15,M
"Ha Vencido, ha Triunfado/16 Glorioso Cristo - En Espíritu y en Verdad.mp3",7.13,M
Incontenible s Tu Amor/01. Abiertos a Tu Verdad.mp3,12.98,M
Incontenible s Tu Amor/02. Aquí Estamos Para Ti.mp3,9.88,M
Incontenible s Tu Amor/03. Somos Libres.mp3,9.05,M
Incontenible s Tu Amor/04. Dios Es Amor.mp3,8.63,M
Incontenible s Tu Amor/05. Perla De Gran Precio.mp3,10.97,M
Incontenible s Tu Amor/06. Quién Podrá Creer.mp3,9.89,M
Incontenible s Tu Amor/07. Nuestro Dios.mp3,11.31,M
Incontenible s Tu Amor/08. Tuyo Soy.mp3,14.07,M
Incontenible s Tu Amor/09. El Gran Yo Soy.mp3,12.79,M
Incontenible s Tu Amor/10. Más Grande Tu Amor.mp3,11.39,M
Incontenible s Tu Amor/11. Santo.mp3,16.2,M
Incontenible s Tu Amor/12. Incontenible Es Tu Amor.mp3,11.22,M
Incontenible s Tu Amor/Cds320Kbps.url,87,B
Incontenible s Tu Amor/Como Ganar Dinero Real Leeme..txt,520,B
Incontenible s Tu Amor/En Espíritu Y En Verdad - Incontenible Es Tu Amor 2012 (Exclusivo WC).jpg,79.85,K
Incontenible s Tu Amor/Gana Dinero Con BuxCraft.url,92,B
Incontenible s Tu Amor/Gana Dinero Con Neobux.url,88,B
Incontenible s Tu Amor/Leeme.txt,146,B
La Hora Viene Y Ahora Es/01 Introducción.mp3,1.3,M
La Hora Viene Y Ahora Es/02 Abre mis ojos.mp3,3.88,M
La Hora Viene Y Ahora Es/03 Glorioso Rey.mp3,6.3,M
La Hora Viene Y Ahora Es/04 Abre el cielo.mp3,4.99,M
La Hora Viene Y Ahora Es/05 Por siempre.mp3,4.69,M
La Hora Viene Y Ahora Es/06 Yo quiero verte.mp3,5.59,M
La Hora Viene Y Ahora Es/07 Yaveh.mp3,6.73,M
La Hora Viene Y Ahora Es/08 Comentario.mp3,2.88,M
La Hora Viene Y Ahora Es/09 Agnus Dei.mp3,6.65,M
La Hora Viene Y Ahora Es/10 Comentario.mp3,1.02,M
La Hora Viene Y Ahora Es/11 Gloriosa cruz.mp3,7.05,M
La Hora Viene Y Ahora Es/12 Rey de Gloria.mp3,6.07,M
La Hora Viene Y Ahora Es/13 Solo me imagino.mp3,5.43,M
Lux y Salvation/01-En Tu Luz.mp3,2.79,M
Lux y Salvation/02 Te doy Gloria.mp3,5.25,M
Lux y Salvation/03 Fuente de la Salvación.mp3,6.02,M
Lux y Salvation/04 Torre Fuerte.mp3,4.97,M
Lux y Salvation/05 Desde Mi Interior.mp3,7.4,M
Lux y Salvation/06 Solo Tu Eres Santo.mp3,5.32,M
Lux y Salvation/07 Canto Espontaneo 1.mp3,5.34,M
Lux y Salvation/08 ¿Quien Como Él_.mp3,8.16,M
Lux y Salvation/09 Canto Espontaneo 2.mp3,4.11,M
Lux y Salvation/10 Solo Dios Puede Salvar.mp3,7.6,M
Lux y Salvation/11 Veo Amor.mp3,5,M
Lux y Salvation/12 Canto Espontaneo 3.mp3,5.17,M
Ncuentro/01 salmo 132.mp3,660,K
Ncuentro/02 gloria a Dios.mp3,6.34,M
Ncuentro/03 tu eres Dios.mp3,4.03,M
Ncuentro/04 todo poder.mp3,4.74,M
Ncuentro/05 por la cruz.mp3,4.89,M
Ncuentro/06 haz hallado gracia.mp3,4.64,M
Ncuentro/07 toma todo de mi.mp3,6.25,M
Ncuentro/08 majestad.mp3,2.69,M
Ncuentro/09 cristo yo te amo.mp3,5.53,M
Ncuentro/10 arabatame.mp3,5.1,M
Ncuentro/11 rain down.mp3,6.38,M
Ncuentro/12 haznos uno.mp3,3.62,M
Tu Reino Aqui/01 Día Feliz.mp3,5.09,M
Tu Reino Aqui/02 Tenemos Libertad.mp3,5.01,M
Tu Reino Aqui/03 Viene Un Rey.mp3,5.67,M
Tu Reino Aqui/04 Aquí Estoy.mp3,8.76,M
Tu Reino Aqui/05 Rey Humilde.mp3,8.24,M
Tu Reino Aqui/06 Es Tu Amor.mp3,7.99,M
Tu Reino Aqui/07 Vemos Tu Gloria.mp3,6.99,M
Tu Reino Aqui/08 Cubiertos Por Tu Sangre.mp3,7.8,M
Tu Reino Aqui/09 Cuanto Nos Ama.mp3,7.77,M
Tu Reino Aqui/10 Trae Tu Reino.mp3,9.34,M
Tu Reino Aqui/BajarMusicaCristianaGratis.url,136,B
Tu Reino Aqui/En Espiritu Y En Verdad Tu Reino Aqui 2010.jpg,65.73,K
