User Type,Username,Date,Text
,crowenterprises,2012-09-08T23:15Z,This is a croweneterprises release not DownSpaces.
,xsadx,2012-09-09T02:57Z,lol crowenterprises is up on everyone who has uploaded this .
,jh5637,2012-09-09T05:54Z,"@crowenterprises - Dude! WTF?! What freakin phone do you have? This is awesome for a cam made with a damn phone. Way better than other cams I've seen...and the audio is excellent for a freakin phone cam. And you're right dude..you should be given your due credit for the source, but also give credit to those who make your upload a lil bit better. I'll repost this on all the current torrents for ya.

For being a cam copy:
A:8
V:8
M:6 (Hollywood has lost their grip on the whole horror genre. IMO)"
,231tyler,2012-09-09T08:06Z,"crownenterprises, stfu, you fucking cry baby, its not your work, and not your movie, ok? if ur gonna act like this then go find a different site to cry on"
