User Type,Username,Date,Text
,BKKJack,2012-08-01T06:24Z,"Great quality! Cheers for this! It's only been out a few hours...

Top man."
,jerrbear,2012-08-01T18:14Z,Thank you!
,DRESSEDTOKILL,2012-08-01T21:03Z,this is great ! did eric singer sing ''beth''  cause that don't sound like him 
,cm2881,2012-08-02T00:29Z,"The best MP3 quality possible 320kbps CBR 44.1.kHz.u

Thank you hellstorm79 you rock!!
"
,jerrbear,2012-08-02T08:41Z,"@ DRESSEDTOKILL no, that is Peter Criss singing Beth, this is just the album remixed. it's the original Kiss"
,ppnq,2012-08-02T17:57Z,"i love KISS, thnx 4 da up"
,BaronVonWatermelon,2012-08-02T19:27Z,I see that I'm not the only Pirate Bay uploader who also visits GetMetal.org.
,DRESSEDTOKILL,2012-08-02T23:35Z,"ya know BARON VON WATERMELON                         YOU ARE A PRICK  YOU DON T HAVE TO BA A SMARTASS WITH PEOPLE  WHAT THE HELL IS WRONG WITH YOU  DO YOU GOT A STICK UP YOUR ASS OR SOMETHING
  JUST APPRECIATE  WHAT PEOPLE PUT ON THE SITE "
,RIPDmnoid,2012-08-11T00:30Z,thanks.  it would be cool if they released this on vinyl.
,CompuTerror,2012-08-19T19:22Z,"This was a big dissappointment. Big thanks to the uploader though, but I would rather see it in FLAC."
,dabl,2012-08-21T22:07Z,"""Big thanks to the uploader though, but I would rather see it in FLAC""

+1

And make it the HD Tracks 24bit 96 kHz version please :)"
,CompuTerror,2012-08-22T13:45Z,"I bought the CD and encoded it to FLAC here: http://thepiratebay.se/torrent/7556907

Don't know how to make it 24bit 96 kHz though, since that's usually for vinyl..."
,HvyMetal,2012-08-23T00:55Z,Thank you!!
,CompuTerror,2012-09-03T13:42Z,Someone just uploaded 24bit/96kHz here http://thepiratebay.se/torrent/7594275/
