User Type,Username,Date,Text
,anluis,2012-09-03T19:03Z,Es este DVD PAL o NTSC? Is this PAL or NTSC?
,Samsung04,2012-09-04T03:00Z,"no soy experto en ese tema, por lo que no puedo contestar a tu pregunta, perdona, pero la movie es copiada de un dvd original"
,anluis,2012-09-05T19:17Z,"PAL es el estandar de DVD Europeo, NTSC es el Americano. Donde conseguistes el DVD? Mira este link: http://es.wikipedia.org/wiki/PAL"
,Samsung04,2012-09-07T00:49Z,"A qui ; 
http://www.moviesdvdr.com"
,jesuskli,2012-09-14T01:29Z,porque no hay seeds? :(
