Filename,Size,Unit
ADW APEX GO - 3D ICS Plates v2.9.9-AnDrOiD/ADW APEX GO - 3D ICS Plates v2.9.9-AnDrOiD.apk,31.56,M
ADW APEX GO - Graphene Theme v2.9.9.1-AnDrOiD/ADW APEX GO - Graphene Theme v2.9.9.1-AnDrOiD.apk,33.33,M
Andy (Siri for Android) v5.6-AnDrOiD/Andy (Siri for Android) v5.6-AnDrOiD.apk,681.89,K
Apex Launcher Pro v1.4.0 Final-Android 4.0 Plus-AnDrOiD/Apex Launcher Pro v1.4.0 Final-Android 4.0 Plus-AnDrOiD.apk,2.66,M
BubbleUPnP Pro v1.6.4-AnDrOiD/BubbleUPnP License v1.1-AnDrOiD.apk,31.82,K
BubbleUPnP Pro v1.6.4-AnDrOiD/BubbleUPnP Pro v1.6.4-AnDrOiD.apk,2.48,M
CM10.1 CM9 TouchWiz 5.0 theme v3.3.3 Android 4.0 Plus-AnDrOiD/CM10.1 CM9 TouchWiz 5.0 theme v3.3.3 Android 4.0 Plus (Requires CM9 CM10 AOKP Rom)-AnDrOiD.apk,5.07,M
CM9 CM10 AOKP THEME POPSTYLE v1.5 Android 4.0 Plus (Requires CM9 CM10 AOKP Rom)-AnDrOiD/CM9 CM10 AOKP THEME POPSTYLE v1.5 Android 4.0 Plus (Requires CM9 CM10 AOKP Rom)-AnDrOiD.apk,6.49,M
Copy Paste It v4.2-AnDrOiD/Copy Paste It v4.2-AnDrOiD.apk,2.08,M
Deep Sleep Battery Saver Pro v1.1-AnDrOiD/Deep Sleep Battery Saver Pro v1.1-AnDrOiD.apk,449.43,K
ePSXe for Android v1.8.2-AnDrOiD/ePSXe for Android v1.8.2-AnDrOiD.apk,1.56,M
Extended Controls v5.6.2-AnDrOiD/Extended Controls v5.6.2-AnDrOiD.apk,2.62,M
Flash Image GUI v1.4.9-ROOTED DEVICES ONLY-AnDrOiD/Flash Image GUI v1.4.9-ROOTED DEVICES ONLY-AnDrOiD.apk,576.36,K
ForeverMap 2 - Offline Maps v2.0.3-AnDrOiD/ForeverMap 2 - Offline Maps v2.0.3-AnDrOiD.apk,22.01,M
GO Power Master Premium v3.0.4-AnDrOiD/GO Power Master Premium v3.0.4-AnDrOiD.apk,3.13,M
gReader Pro (Google Reader) v3.1.0-AnDrOiD/gReader Pro (Google Reader) v3.1.0-AnDrOiD.apk,2.34,M
Greeting Card Maker Pro v2.3-AnDrOiD/Greeting Card Maker Pro v2.3-AnDrOiD.apk,12.72,M
JEFIT Pro - Workout And Fitness v4.3.1214-AnDrOiD/JEFIT Pro - Workout And Fitness v4.3.1214-AnDrOiD.apk,6.81,M
Make Your Clock Widget Pro v1.1.1-AnDrOiD/Make Your Clock Widget Pro v1.1.1-AnDrOiD.apk,2.62,M
MIUI X4 Go Launcher Theme PRO v1.18.5-AnDrOiD/MIUI X4 Go Launcher Theme PRO v1.18.5-AnDrOiD.apk,18.31,M
Multiscreen Multitasking v4.1.1-AnDrOiD/Multiscreen Multitasking v4.1.1-AnDrOiD.apk,3.31,M
MX Player Pro 1.7.10 ARMv6 Plus VFP Codec 1.7.9-AnDrOiD/MX Player Pro 1.7.10 ARMv6 Plus VFP Codec 1.7.9-AnDrOiD.apk,4.1,M
MX Player Pro 1.7.10 ARMv7 (Tegra2) Codec 1.7.9-AnDrOiD/MX Player Pro 1.7.10 ARMv7 (Tegra2) Codec 1.7.9-AnDrOiD.apk,4.1,M
MX Player Pro 1.7.10 ARMv7 Plus NEON Codec 1.7.10-AnDrOiD/MX Player Pro 1.7.10 ARMv7 Plus NEON Codec 1.7.10-AnDrOiD.apk,4.31,M
MX Player Pro v1.7.10 (NEON)-AnDrOiD/MX Player Pro v1.7.10 (NEON)-AnDrOiD.apk,6.57,M
MX Player Pro v1.7.10-AnDrOiD/MX Player Pro v1.7.10-AnDrOiD.apk,2.29,M
Phases of the Moon Pro v2.8.3-AnDrOiD/Phases of the Moon Pro v2.8.3-AnDrOiD.apk,15.94,M
Rocket Music Player Premium v1.5.2-AnDrOiD/Rocket Music Player Premium v1.5.2-AnDrOiD.apk,5.29,M
Rocket Music Player Premium v1.5.2-AnDrOiD/Rocket Player Premium Unlocker v1.0.1-AnDrOiD.apk,276.05,K
RocketDial Pro (Smart Dialer) v3.3.0-AnDrOiD/RocketDial Pro (Smart Dialer) v3.3.0-AnDrOiD.apk,3.03,M
ROM Manager Premium v5.5.0.0-AnDrOiD/ROM Manager Premium v5.5.0.0-AnDrOiD.apk,2.6,M
Shot Control v2.6.4-AnDrOiD/Shot Control v2.6.4-AnDrOiD.apk,813.01,K
SPC - Music Sketchpad 2 v2.1.0-AnDrOiD/SPC - Music Sketchpad 2 v2.1.0-AnDrOiD.apk,7.62,M
Torque Pro (OBD2 and Car) v1.6.28-AnDrOiD/Torque Pro (OBD2 and Car) v1.6.28-AnDrOiD.apk,4.17,M
TSF Shell Theme Vintage v3.0-AnDrOiD/TSF Shell Theme Vintage v3.0-AnDrOiD.apk,8.23,M
Tweetings for Twitter v2.10.5-AnDrOiD/Tweetings for Twitter v2.10.5-AnDrOiD.apk,5.49,M
