User Type,Username,Date,Text
,spiderforpc,2012-05-18T19:42Z,"wow finaly out !
Thanx boobsman"
,spiderforpc,2012-05-18T19:44Z,"first comment 
I ll seed until end of year "
,host92,2012-05-18T19:44Z,is this region-free or ntsu and pal as on other sites
[V],boobsman,2012-05-18T19:51Z,@ spiderforpc hope you enjoy it mate :)
[V],boobsman,2012-05-18T19:55Z,"@ host92 sorry in the rush to get this out i didn't check n followed the nfo, this game is NOT region free, ONLY PAL AND NTSC/U"
,ix9nine009,2012-05-18T20:10Z,"thanks for the upload boooooobsman.

is this really region free or NTSC U/PAL only?

will be waiting for Dragon's Dogma"
,Bonji93,2012-05-18T20:18Z,"Hey boobsman, is this version already patched with the topology data? Is patching the data as simple as running it through abgx? Because right now i was getting this through ETGamez link. "
[V],boobsman,2012-05-18T20:23Z,"@ ix9nine009 yes sorry the iMARS version is only PAL, NTSC/U. The nfo says RF but this is NOT the case:

http://www.freeimage.us/image-E428_4FB693BC.jpg"
[V],boobsman,2012-05-18T20:26Z,"@ Bonji93 you don't know how to patch topology? No this does not come pre patched as some will want to use the downgrader to play on LT2.0, are you running LT2.0 or LT3.0???"
,Bonji93,2012-05-18T20:35Z,"Thanks for the upload boobsman, all we have do is run this through abgx now right?"
,Bonji93,2012-05-18T20:35Z,I did not mean to post that again
,Bonji93,2012-05-18T20:36Z,I'm am playing on 3.0
,ix9nine009,2012-05-18T20:37Z,can I still play this even if I have NTSC/J console? I dunno but some Ubisoft games that are NTSC/U are playable in NTSC/J console
,Bonji93,2012-05-18T20:42Z,Is there a way that I can keep these comments refreshed? I can only see them all when I post something new 
[V],boobsman,2012-05-18T20:48Z,"@ Bonji93 yes you can run through abgx to get topology or use the master topology although i've not tested to see if that works as it didn't with MP3.

@ ix9nine009 you'd need to download and test for yourself, abgx360 only says PAL and NTSC/U but since i don't have an NTSC/J console there is no way for me to test, if you do download and try please post back to let everyone know :)"
,kizo11,2012-05-18T20:51Z,"Hey boobsman , I have LT 2.0 can i somehow play this game , Will the topology work ?"
,murderdro,2012-05-18T21:00Z,hi im new to this download for the 360 thing.. does my 360 have to be modded? and is tehre software for a mac user i can use to burn? 
,nooralmadi008,2012-05-18T21:03Z,thank u man
,murderdro,2012-05-18T21:05Z,i cant see all of the comments as wel
[V],boobsman,2012-05-18T21:23Z,"@ kizo11 depends what drive you have, the old Hitachi's are not effected by topology so you can play as is, for other drives you'll need to use the downgrader, its worked for all xgd3 games so far:

http://thepiratebay.se/torrent/6999991/Final_Fantasy_13-2_XBOX360_LT3.0_ISO_Patch_To_LT2.0_

@ murderdro yes you need a modded console to be able to play copied games, Google xbox360 modding for more details :)"
,fankoosh,2012-05-18T21:40Z,"for those only with LT+2 consoles , they need to be sure that their consoles has not been online b4 , so u should have OFFLINE console to play all latest XGD3 games of course after u will update ur DB to 14719 via USB method & applying LT+2 ISO patch (ff) to remove topology data , so after u update ur console , reboot & wait till it finish metro dash updates , then reboot again & u r fine now u can play all XGD3 fully burn & truncated & all XGD2 with those OFFLINE consoles having Phat or slim Liteon drive , also benq & samsung drives r ok. i have done what i wrote here on my LT+2 phat Liteon console Offline & never got silent dae.bin , & remeber only ppl got that silent update fron XBL online & still on LT+2 , dont bother doing what i wrote , just go directly to flash ur box to LT+3 & u will be able to play all games with updated DB 14719"
,DanielRibeiroMarinho,2012-05-18T21:49Z,"Hi Boobsman, thank you so much for this, i wonder when you will upload Dragon's Dogma, how long will take ?
Thanks."
,kizo11,2012-05-18T21:50Z,"@ boobsman , which do you recommend , xbox backup creator the topology for final fantasy or the topology from abgx360 ?"
[V],boobsman,2012-05-18T23:13Z,"@ DanielRibeiroMarinho sorry i don't have a timeline for game release dates, you'll get it as soon as i do :)

@ kizo11 either but make sure you keep a copy of the iso in case something goes wrong you can easily undo :)"
,spiderforpc,2012-05-19T00:01Z,its slow DL max i saw it toch the 30kb/s what the wrong ?! 
,DanielRibeiroMarinho,2012-05-19T01:34Z,"@Boobsman thank your the aswner
@spiderforpc more leechers then seeders, i'm getting the same speed and my internet speed is good."
,ix9nine009,2012-05-19T03:22Z,"sad to say (especially those who own NTSC/J console) that this game is really region locked :(

you cannot play this on NTSC/J console

I hope someone will upload or will release an asian version of this game"
,xboxmodder420,2012-05-19T05:28Z,thanks
[V],boobsman,2012-05-19T08:54Z,"@ ix9nine009 sorry to hear that, if i come across the NTSC/J version i'll post it :)"
,mrthiago14,2012-05-19T10:10Z,NOOOOOO.. THIS IS WORSE THAN MAX PAYNE... PLEASE SEED WHY ARE YOU BEING SO SELFISH! SHARE ITS FUCKING FREE.
,cisse9,2012-05-19T11:16Z,"why are people still using torrents to dl games...
dl jdownloader and get on xboxpirate.com
i got this game dl in 3 hours..
NUMPTYS"
[V],boobsman,2012-05-19T11:33Z,"@ cisse9 because with 2 semi dedicated 1gb seedboxes i can do it faster than that, problem is people downloading don't like to share! If everyone would stop limiting there upload speed and seed what they take it would improve it for everyone!"
,cisse9,2012-05-19T11:45Z,"agree boobs,people dont seed anymore they just hit and run.
keep up the good work"
,noacta,2012-05-19T16:12Z,@boobsman Love your uploads just want to know if you have come a cross a pal game of thrones i here its pretty good but great upload thx
,vstream,2012-05-19T16:54Z,Its giving me an error code. It says there is no verified ini file in Xex/SS combination. Also it says there is no verified rip of Xex CRC AB794B9D in the online database. What do I do? Please RESPOND
,Bonji93,2012-05-19T17:53Z,Hey Boobs I have another question. Is it safe to play the single player while signed into xbox live?
[V],boobsman,2012-05-19T19:25Z,"@ vstream that's not an error it just means there is no shop brought copy to verify against so do not play online as stealth cannot be verified. You can burn and play the game now but if you plan to go online you'll need to reburn after the game has been released in the shops and you can properly patch.

@ Bonji93 no i would stay offline until the game has been released and has been properly patched.
"
,boneyjr,2012-05-19T19:32Z,Is anybody else having problems with the game? it starts up fine.. but the textures suck and the game freezes... pop in his horrible.. if the texture finally pops in at all.. 
,vstream,2012-05-19T19:41Z,Show I appear offline on xbox live or not even connect to xbox live?
,TheShark19,2012-05-19T19:46Z,My xbox LT3.0 ask for update when i start the game should i proceed or not? respond fast pls.:)
,TheShark19,2012-05-19T19:54Z,Hi idk if my post got here before but my xbox is lt3.0 and the game wants to update it should i proceed with it?
,vstream,2012-05-19T20:00Z,But what if I go online. I have a friend who is playing it right now. He has a flashed xbox but idk where he downloaded it.
,khuman,2012-05-19T21:25Z,Do I need to Patch with abgx360 GUI to work with my LT 3.0 Help ..... boobsman
,boneyjr,2012-05-19T21:59Z,I am playing online and all is well... game is actually pretty good. graphics aren't the best.. but the gameplay is great
,Smallz94,2012-05-20T00:21Z,bonejr  dont play the game. stay offline  you are going to get caught
,Smallz94,2012-05-20T02:15Z,seed guys im at 15 percent with 1.5kb 
,ix9nine009,2012-05-20T03:43Z,"thanks booooobsman appreciate it :)

will wait for asian version"
,khuman,2012-05-20T11:00Z,The game is unable to load at all. Console got stuck after kineck screen. And Cannot install at all. (US/NTSC Flashed)
,ausie,2012-05-20T11:53Z,"I have LT+2.0, and after i update the console, not any of my games work. So the update reflashes the console!!"
,amshanz12,2012-05-20T12:01Z,"I updated my cosole with LT+3 so , can i play this game or is it limited to only LT+2 format? or did i do wrong by updating my console to LT+3 format? i was told that every new games gunna come in LT+3 format so i have to update it from LT+2 to LT+3 , anyone can guide me here? "
,amshanz12,2012-05-20T12:05Z,"@boobsman , please reply , so that if all the games work in lt+2.0 only so ill downgrade my console immdeiately cause since i upgraded to lt3.0 , 5 of my old games doesnt work which includes batman arkham city , saints row the third , RAGE , need for speed the run , x men destiny.....so what will u advise me to do??"
,banesmash,2012-05-20T12:57Z,"@ amshanz12...as for downgrading i dont know..Old ganmes that dont work redownloaded them, run through abgx360 and reburn and they work..if your buying back ofline dont use xboxkings as they dont work correctly i ordered 10 games and only 2 worked on lt3.0.."
,banesmash,2012-05-20T13:01Z,"@amshanz12 as for doengrading i cant help there..but had same problem you have when i upgraded to LT3.0 with batman game..what i done was redownloaded game, run through abgx360 and reburnt and it working ok now same with rage and need for speed. if you buying your backup onlone dont use xboxkings i brought 10games from them and only 2 worked on lt3.0 but all worked on lt2.0.. "
,banesmash,2012-05-20T13:06Z,Downloaded and burnt with ihas drive..all working good for me no crashing no nothing (only offline for me dont do multiplayer)..thanks boobsman
,tomgam75,2012-05-20T14:54Z,"info and video at:
http://gameinfocenter.com/xbox/Tom-Clancy-Ghost-Recon-Future-Soldier.html"
,paff21,2012-05-20T15:03Z,works great on L.T 2.0
,snek35,2012-05-20T16:21Z,"THANKS BOOBSMAN!!!
DOWLOADED IN LES THAN 12 HRS
IM RUNNING OF 50 MEGS........."
,wiserxxx,2012-05-20T17:54Z,"If you have problems with (disk permission error) when the first mission begins, is that you install the whole game on the hard disk. You only need to install the audio track.
 I had this problem, and after losing three disc Verbatim DL, I delete the games from my hard drive, and the game works fine."
,ryunax14,2012-05-20T18:32Z,Heyy boobsman can you upload for NSTC/J Thanks : )
,khuman,2012-05-20T19:47Z,@wiserxxx I have the same problem I cannot solve it still not working I do used the same brand DVD Verbatim DL...... Where are you boobsman HELP HELP!
,NUTTFACTOR,2012-05-21T00:24Z,"Boobsman: First and foremost thanks. I love your work and never had a problem. I'm just asking for advice here. 

I get this error after I run ABGX; Failed to find a verified ini file for this xex. Verification failed. 
"
,NUTTFACTOR,2012-05-21T00:25Z,"Boobsman: First and foremost thanks. I love your work and never had a problem. I'm just asking for advice here. 

I get this error after I run ABGX; Failed to find a verified ini file for this xex. Verification failed. "
,sam_tauras_1990,2012-05-21T04:03Z,"@NUTTFACTOR:it hasnt been verified by abgx yet..it will be fully verified after its launch on 25th..just burn it..topology needs to be inserted..

u need ihas+verbs+abgx verified+LT3.0 to make it work perfectly..lt2.0 on certain drives like samsung and old hitachi."
,radwan1234,2012-05-21T16:51Z,man is it workin cuz idont want to download it for nothin
,NUTTFACTOR,2012-05-21T18:00Z,@sam_tauras_1990  So I just burn what I have now and no worries about running ABGX right? 
,NUTTFACTOR,2012-05-21T18:12Z,"@sam_tauras_1990. Thanks for your response. I'm assuming you just want me to burn what I have now w/o running ABGX, and it will work on LT2.0?"
,Zipgun,2012-05-21T18:59Z,Since us PC folk have to wait another month hows the game does it live up to all the hype? Lets hear some reviews on the gameplay!
,homdawg,2012-05-21T20:16Z,"i have lt2.0 with dash  13599
i use truncate method
when i put the game in..it ask for an update
is it safe to update from the disc
or shud i update via usb
and will updating flash my xbox back to stock!!!"
,Smallz94,2012-05-21T20:41Z,radwan1234  it works
,grimas55,2012-05-21T22:58Z,does anyone know whats the best app to burn the games on a Mac? thanx
,NUTTFACTOR,2012-05-22T02:01Z,@sam_tauras_1990. Thanks to both Boobsman (upload) and sam_tauras_1990 (advice). Game worked like a charm.
,radwan1234,2012-05-22T10:04Z,now iam downloading it and the top sped is300ks damn seeeeeeed
,radwan1234,2012-05-22T10:10Z, how can i persuade you guys to seed
,albanezzi,2012-05-22T19:34Z,boobsman u are the No1 thanks a llot 
,asafmiara,2012-05-22T20:56Z,im running on lt 3.0 it sayed i have to update please repley me
,snek35,2012-05-22T21:16Z,"DOWNLOADED IN  LESS THAN 12 HRS...
I ABGX THE ISO EVERYTING WAS VERFIED PERFECT...
NOW IM BURNING WITH IMAGE BURN...
ILL UPDATE ASOON AS I RUN IT ON MY XBOX....."
,homdawg,2012-05-22T22:00Z,"does updating from dash 13599 to 14719 on ll2.0
stop you from playing backups of ap2.5 and xgd3!!
and if it does what can i do to play them again!!
pls reply
i beg u!!!!!!!
i cant find the answer anywhere
have a heart!! :( :( :( :'("
,sam_tauras_1990,2012-05-23T03:49Z,"@homdawg:if u have a ap2.5 drive then yes..u will not be able to play them as ur xbox will get silent update.u will need to flash LT3.0 after that.
anyways if u go online then it is always recommended that revert to stock,update via usb and then flash to latest LT.otherwise u can get banned..u need LT3.0 on latest dash for all lite-on drives and ap2.5 capable hitachi's."
,snek35,2012-05-23T05:51Z,WORKS PERFECT!
,homdawg,2012-05-23T12:02Z,"@sam_tauras
how do will i know if i have a ap2.5 drive
and i have never connected my xbox to live and i never will
so if i update via usb will i get the silent dae update!
i think i have benq"
,sam_tauras_1990,2012-05-23T12:34Z,"@homdawg: dashboards after 13599 gives u silent update automatically without LIVE..happened with me too..and benq IS AP2.5 and latest LT is 3.0 for benq
http://c4evaspeaks.com/
just update via usb(NOT pirated dvd) and see if u lose ur flash or not..my own flash remained..then u will need lt3.0 to play games..check topology with abgx before burning."
,radwan1234,2012-05-23T12:45Z,snek35 listen idownloaded it and everytime i burn it to cd it says io error somebody reply
,homdawg,2012-05-23T13:50Z,"@sam_tauras
then how are some people playing new games on dash 14719 on lt2.0!!"
,homdawg,2012-05-23T15:54Z,"@sam_tauras
wat about lite-on!!???"
,yammyhihi03,2012-05-23T17:31Z,i really hope you can upload the NTSC/J version of this game :(
,Revoion,2012-05-23T18:02Z,This Works with no problems ;) everybody who is having problems is doing something wrong 
,Revoion,2012-05-23T18:04Z,works ;)
,ix9nine009,2012-05-23T19:06Z,"hello boooobsman.. i know i have so many request to you but still, 
can you upload this game?
http://www.xbox720iso.com/multi-tom-clancys-t592535.html

just change the ""720"" into ""360""

that game is the real region free
hope it'll reach you. cheers mate."
,important689,2012-05-23T20:35Z,Works perfect...Thanks!!!!
,esc-cos,2012-05-24T00:06Z,"have now lt3.0 and this dash. 14719.

i did get an question to upgate when i tryed this game

can i ignore that and just do the upgrade?

have be afraid of delating the firmware if i would do that.

but since i have the the new 3.0 and that dash cant i just always do an upgrade to play games of the future"
,snek35,2012-05-24T03:24Z,"radwan1234** are you using the rite dvds? (verbatim 8.5gb dl)?
what error are you getting?
and were are u geting this error?"
,ryunax14,2012-05-24T08:54Z,Hey boobsman Can you upload for NSTC/J for ASIA please! :) Thanks 
,bil9856,2012-05-24T11:35Z,"i'm a new user and i want to make some questions:
1.how can i seed?
2.what is LT?
3.how can i find out what LT i run?
4.can i play this game while my console is online and buy uplay items or i'll be banned?
thanx"
,bil9856,2012-05-24T11:40Z,"i'm a new user and i want to make some questions:
1.how can i seed?
2.what is LT?
3.how can i find out what LT i run?
4.can i play this game when i'm online and buy uplay items or i'll get banned?
thanx"
,sam_tauras_1990,2012-05-24T12:44Z,"@homdawg:lite-on needs LT3.0.u just refer to c4evaspeaks.com.u will always need latest LT with latest dash for game to work..some people may have samsung or old hitachi thats y they are playing on LT..all xbox's dont have same drives.

@.LT is the custom firmware required to run pirated xbox games..only person who hacked ur xbox knows which LT u have..refer to the above link to know which LT u need according to the dvd drive in ur xbox..google ""jungleflasher"" ifu want to know how to hack and es u can play online if u have all the prerequisites like ihas burner,latest dash with atest LT.etc but u always have a rish getting banned with a cfw and pirated game.. just keep utorrent on after u have downloaded to keep seeding.."
,sam_tauras_1990,2012-05-24T12:59Z,@esc-cos:if u are on latest dash then that is not a system update but a game update..its safe to update..
,radwan1234,2012-05-24T14:41Z,"
snek35 Iam using DVD-rl 8.5gb and when I burn the game it says I/0 error explain that"
,Beavis11,2012-05-24T16:25Z,I've got one problem. I quess at the air field there's a loding and it freezes for me. I tried writing couple times in new cd's but it still doesn't work. Any sugestions?
,luckybill14,2012-05-24T22:00Z,"Same problem, having freezes after second mission."
,zomaxeren,2012-05-24T22:33Z,"Hey Boobsman.
I patched this to work with LT 2.0, but keep getting the unreadable disc, both with this and Dirt Showdown. Patching it has worked previously with Prototype 2 being the latest succesful result.
I updated the dashboard with the Sniper Elite V2. 

Any idea what is wrong?"
,Assassinprofessor,2012-05-24T23:11Z,"@zomaxeren
put a usb into ur xbox, play whatever song u have on that stick, n viola, it works, piece of cake buddy..this happens with max payne, ghost recon ..im downloading dragons dogma , i dont know whats gonna happen with that ,hopefully it'll work just like these 2 games :))"
,zomaxeren,2012-05-25T01:34Z,"@Assassinprofessor

I just tried it and it did seem to make any difference at all. I play a song from usb, insert the disc and then get unreadable disc. 
Any other ideas?
Max Payne 3 works. "
,radwan1234,2012-05-25T08:57Z,what is the best write speed for this game???????
,bil9856,2012-05-25T10:49Z,"the first time i ran it it said ''disc unrecognised''
then i ran it a second time and now it works perfect"
,ryunax14,2012-05-25T16:29Z,Please upload for NSTC/J thanks :)
,siddy1200,2012-05-26T02:13Z,"Works fine. Downloaded in 10hr, will seed till the end of the month.

Needs to be run through abgx360
Burnt 4x on verbatium 8.5GB DL disc with flashed iHas drive.
Will not work on on regular drive with truncated disc (game failed to load).

Topology: Current (as of 26/5/12)
Basic stealth: Pass
Verification: Failed
SS: Valid"
,ryunax14,2012-05-26T04:19Z,Where can i get NSTC/J version for this plss rep thanks :)
,XxottoxX,2012-05-26T06:55Z,"hey i am new to xbox 360 pirating, ive got jailbroken ipod, custom firmware psp, and a shit ton of free pc games, but the xbox stuff confuses the hell out of me, can someone please walk me through this a little bit :/"
,Beavis11,2012-05-26T09:53Z,Does anyone knkw how to fix freezing bug? Please help!!
,Tyclone,2012-05-26T10:49Z,"This says Region Free...if it's a fucking NTSC/U, 'once again' with boobsman's upload, I'm going to be pissed."
,samtauras,2012-05-26T15:42Z,"@XxottoxX :google jungleflasher tutorial and read it..
@Tyclone:should have read comments first..its the 2nd comment..boobsman stated its region code.."
,radwan1234,2012-05-26T16:18Z,"thanks boobsman you are the best works perfectly you must burn it *6
to work perfect"
,170gone,2012-05-27T04:17Z,"Shout out to boobsban for the torrent, hope youve been getting bare boobs yeh :) To all the dickheads downloading the game and not seeding, Take a seat, look in the mirror..See your ugly face yeh, IMA SMASH IT IN...Start seeding bitches.."
,ix9nine009,2012-05-27T06:16Z,"@Tyclone
this is NTSC/U and PAL only
you can download the RF version of this on x360iso dot com

again thanks for this boooobsman :)"
,Tyclone,2012-05-28T08:07Z,Great...I now understand that I have to read almost every second comment to know the REAL Region Code...why is it stated as such when it's not. Many of boobs' recent games have all mentioned the RF code. Obviously they're not. 
,denka17,2012-05-29T00:10Z,"Can Anyone Help me???

I ve got the lt+3.0 on my xbox 360 and i dont know how to burn xgd3 games! i run through absx360 burn with img burn on verbatin 8.5 g disc and i got unreadable dis!"
,denka17,2012-05-29T00:23Z,Also how i seed? :D
,denka17,2012-05-29T00:26Z,Do I have to inject Topology Data? where do i find it? plz somone help!!!
,ix9nine009,2012-05-29T03:52Z,"@denka17
1. Search for the right setting to burn an XGD3 games
1.1 you must also have an iHas Burner with BurnerMax FW
2. you can seed when the download is done
3. you dont have to inject any topology, because, like you said, you have LT3.0"
,Law-Giver,2012-05-29T15:07Z,"I'm still using LT2 after the updates. I swapped my Liteon flashed with LT2 for a Liteon with an open tray error i had lying around. Installed the security update as i'd previously updated the dash via the game disk. I then put my flashed Liteon back in and plays a charm, no more update nagging.

This console is for offline play mind and i have to add the older dae.bin to the XGD3 games and burn with my ihas 124 drive. All my other disks play fine as well. ;-)"
,Drickoo,2012-05-29T16:06Z,"@Beavis11
@luckybill14
same problem here, the game freezes."
,tomboss82,2012-05-29T19:57Z,"@boobsman
WHY u didnt write this is dash 14719 ? I lost DL becouse of this ..."
,denka17,2012-05-30T15:15Z,"@ix9nine009

Thnx for the help! 
I ve seeded. But i still dont know how to use Ihas burner... 
 Anyway Thx for the help"
,gumph1688,2012-05-30T15:48Z,"cheers boobsman ('',) "
,soujik,2012-05-31T19:27Z,"does anyone get stuck on the first campaign mission after breach.. when I get on the mark to open the next door, it starts to load and it doesn't load.. :/"
,gumph1688,2012-05-31T20:20Z,"i kept getting a un athourised disk pop up. so i installed game 100% then deleted it off my HDD. turned off my box then tried again. game works perfect! also did same with Prototype2 i assume all XGD3 titles do this. try it ("",)"
,soujik,2012-05-31T22:27Z,"I dont have HDD storage, so I cant do this.. :(
is there another way? :("
,MIGUELbM,2012-06-02T00:37Z,@soujik I think a USB flashdrive MAY be able to work (Emphasis on the MAY)
,spulok,2012-06-02T07:42Z,requires update to play this game...what should i do plz help me out guys.....
,Orivuer,2012-06-02T22:10Z,"same problem as the other users
always receiving the message ""unreadable disc""

PLEASE SOMEONE HELP ME!
I lost already 7 dvds burn this shit and Max Payne disc 2.
The trick of the MP3 does not work!

Please someone tell me what to do!
My xbox is LT3 and already used abgx, and this fucking game still not working!"
,Pawl0,2012-06-03T20:13Z,i got lt 3.0 and older xgd3 games dont work like prototype and gears of war 3 i downloaded again gow 3 bcuz last one was with topology i thought that without topology this will work like with syndicate but nope again disc is not readable i have readen that i need to do something with abgx 360 so i ask. What should i do to make this games work  ?i didnt downloaded this yet but i think i will get again unauthorized so HELP !
,CaptainAlpro,2012-06-04T09:09Z,"BIG THX @boobsman! Game works 100% perfect!

And @all it doesn't do: 
READ HOW TO BURN THE NEW XGD3 GAMES!!! -.-"
,flat123456789123456789,2012-06-04T19:11Z,"Why do I hear people having problems with XGD3 games even when they have LT 3.0? I have LT2 and somehow prototype 2 works by using the playing a song from USB method but I'm getting LT3.0 soon and if even then I can't play these newer XGD3 games like ghost recon, max payne 3 and batman game of the year edition then wat the hell?"
,Pawl0,2012-06-07T01:48Z,on lt 3.0 works no need ihas or some tircks
,jascha37,2012-06-07T11:45Z,it says i need to update so that i can play. what do i need to do? should i update my xbox via usb? please reply!! :)
,jascha37,2012-06-07T14:59Z,do i need to update my dashboard to the latest version?
,Lynkin,2012-06-08T18:19Z,"Works like a charm !!! Thanks.

I've just finished Max Payne 3 and now i'm finishing Prototype 2... later on: ""Ghost Recon"".

For those who are having problem: I was on LT 3.0 and Dashboard 14699.. i simply downloaded the update at www.xbox.com and updated via USB. Then I checked the game on ABGX 1.0.6 and received all green message, after all this, i had to burn this with IMGBURN on Windows (cause i use mac) using Truncate Mode. That's it !!!

Any doubts i would be pleased to help !"
,pyxi007,2012-06-10T03:51Z,SEEEEEEED plzz----> thx u
,Koca114,2012-06-12T14:17Z,"What do I need to do to play this on Xbox 360?        
thanks"
,Daky1001,2012-06-12T22:46Z,"Thx,works great.
Awesome game."
,XsniferX,2012-06-13T02:43Z,thanks actualy seed to ratio 2.92
,henrike.vieira,2012-06-13T21:51Z,muito bom
,ObiSins,2012-06-15T11:09Z,d
,ObiSins,2012-06-15T11:10Z,"you cant play online with cracked games, try doing R1 for free microsoft points, plus it kept me on gold for a few months aswell, it takes a bit but its still pretty rad"
,joechai88,2012-06-17T14:34Z,nice!! big thanks!~ you re the man!~ boobsman!!
,fossil79,2012-06-26T18:59Z,German language?
