User Type,Username,Date,Text
,nfojunky321,2012-08-20T23:16Z,Thanks guys. Lorelei makes me happy. :-)
,Gecko85,2012-08-21T00:00Z,Thanks Great Work!
,shallow2,2012-08-21T18:55Z,"Merzedesis having some problems posting comments. 

But as mentioned the text is abit wrong, there are 54 videos in this pack with 54 corresponding screens.

Also, there are a few ht.com links missing, but I expect you all know the drill and can find em yourself if you need to. 

Anyways, it will probably be faster to download than to go to kink.com and look at preview :)"
,shallow2,2012-08-21T19:02Z,"Sorry, above comment was meant for HT 2001 Siterip torrent :)"
