User Type,Username,Date,Text
,grue77,2012-09-24T19:29Z,"if i had the time i would 
THANK YOU on each and every football torrent i get thru you

thanks very much ten yard torrents  got 15yd penalty, again

registered here for the sole purpose of saying

 thank you"
[V],Nepotu,2012-09-24T19:45Z,"well, my dear friend, it's an honour for me to be help you and other people to receive what they desire. It's a pleasure! Cheers, grue77!"
,JoeFoot11,2012-09-24T23:56Z,"Thanks a million Nepotu!!! 

People need to seed please!!!"
[V],Nepotu,2012-09-25T07:46Z,You're welcome mate!
,Aussielad,2012-09-26T04:34Z,"Wow, thank you so much for doing this. I also signed up to just thank you for all your time and effort!!!
"
,Aussielad,2012-09-26T04:56Z,"Thank you, thank you, thanks so much Nepotu..."
,ismylive,2012-09-26T15:20Z,Thank you very much!!!
,Cavemann,2012-09-27T01:13Z,Thanks
