User Type,Username,Date,Text
,KolokovichkUploads,2012-03-15T18:44Z,"Very well laid out.

**INFORMATION**

Please remember to read the DESCRIPTION COMPLETELY. It will help you if you have problems with FALSE POSITIVES on your ANTI-VIRUS by clicking the .PNG file.

Thanks for the torrent HeroMaster!"
[H],HeroMaster,2012-03-16T11:02Z,Thanks Kolokovichk :)
,inemanja,2012-03-26T03:17Z,"Great game, one of the best in my opinion :) Wendy keep going like that, your downloads are always good and safe :** "
