User Type,Username,Date,Text
,Sandi2001,2012-07-31T18:28Z,"Thank you SO SO much for all your work.
U rock!!!"
,jawick9,2012-07-31T19:27Z,I have to echo that thanks!
,Dimmis80,2012-07-31T19:58Z,Much oblige old girl.Your work and devotion is much apreciated.You are the best..Have a nice week girl.;-)
,MsMuffet,2012-08-04T12:26Z,It's going to be an interesting week and I'm so looking forward to watching all the dramas. Thanks so much MsFenmore for keeping me up to date - you're a legend!  Cheers from Down Under ;-)
