User Type,Username,Date,Text
,evilg0d,2012-08-08T04:12Z,Thank you very much for sharing this. I do appreciate your effort.
,phasar,2012-08-09T22:33Z,I haven't checked out the files yet but at least it's not password protected
,dexterchaos,2012-08-12T18:08Z,As far as I can tell it's only the first chapter
,dexterchaos,2012-08-14T05:06Z,oops never mind its all there! thanks for the upload!
,devisissy,2012-08-15T12:23Z,Many thanks!!
,thekwork,2012-08-18T23:02Z,Thank you very much!
,iso_bel,2012-08-19T13:26Z,Thank you indeed for sharing this. 
