User Type,Username,Date,Text
,weaping_reaper,2012-10-20T12:49Z,"Are these ""Simply GH's 720p rips? or are they better?"
[T],jmanwf,2012-10-21T02:25Z,720p by 400p pretty good quality my file are. cant find it in hd on the internet
,Dakota85,2012-10-21T18:29Z,"Thanks for this jman - i love the fact that you keep the opening title sequence in there too, just makes it feel a bit more ""real"" to those of us outside the US (I'm in Oz) - plus I appreciate how quickly you upload these, so thank you so much! =D"
,disneydreams,2012-10-22T13:15Z,thank you for doing this every day
[T],jmanwf,2012-10-27T02:22Z,i am in Australia to but download mine from hulu.com i have a vpn program
