Filename,Size,Unit
"TheBlackmail_scene1_720p_3800 (Tyler Sweet, John Magnum).mp4",1.05,G
"CaughtInTheShower_scene1_720p_3800 (Tyler Sweet, Robert Van Damme).mp4",963.31,M
"OnTheSet_scene1_720p_3800 (Tyler Sweet, Tony P, Spencer F, Sebastian K, Brad F).mp4",922.57,M
"CuriosityKilledTheCock_scene1_720p_3800 (Tyler Sweet, Spencer Fox).mp4",918.28,M
"CustodiansFury_scene1_720p_3800 (Tyler Sweet, Alexsander Freitas).mp4",831.28,M
"TheContest_scene1_720p_3800 (Tyler Sweet, Cliff Jensen).mp4",793.89,M
"TheBlackmail2_scene1_720p_3800 (Tyler Sweet, Zeb Atlas).mp4",787.74,M
"SeducingTheProfessor_scene1_720p_3800 (Tyler Sweet, Matt Cole).mp4",761.1,M
TheBully_scene1_720p_3800.mp4,733.83,M
"TheOtherGuy_scene1_720p_3800 (Tyler Sweet, Micah A, Trevor K).mp4",733.45,M
"BasicTraining_scene1_720p_3800 (Tyler Sweet, Trevor Knight).mp4",729.74,M
"FakingAnInjury_scene1_720p_3800 (Tyler Sweet, Matt Singer).mp4",668.81,M
"ChemistryPrank_scene1_720p_3800 (Tyler Sweet, Rocco Reed).mp4",665.4,M
"TwinkInABox_scene1_720p_3800  (Tyler Sweet, Topher Di Maggio).mp4",663.74,M
"FoodFight_scene1_720p_3800 (Tyler Sweet, Bobby Clark).mp4",583.49,M
"UnderTheDeskFun_scene1_720p_3800 (Tyler Sweet, Girth Brooks).mp4",567.82,M
NextDoorTwink - Alex Vaara  Hayden Michaels & Tyler Sweet.mp4,408.54,M
"BasicTrainingBTS_scene1_720p_3800 (Tyler Sweet, Trevor Knight).mp4",18.85,M
