User Type,Username,Date,Text
,BlaTaN,2012-12-26T00:10Z,"Thanks for the Up,  been waiting beyond the end of the world for this ;)

Please Seeeeeeeeeeeeeeeeeed already!  shessh!"
,Heppower,2012-12-26T00:26Z,Thank you. 
,gfw4lyfe,2012-12-26T01:03Z,"As soon as I finish downloading it, I'll be seeding at ~600KB/s for a least a day."
,TBAi,2012-12-26T13:17Z, Thank you! My cable to my DVR came unscrewed so it couldn't record it while I was at work
,DJJeoff,2012-12-26T14:45Z,Is anyone else having difficulty downloading this torrent? 
,yotorogo,2013-01-02T22:47Z,when i finished downloading ill seed this motherfucker for atleast a week
,patxolin,2013-01-09T21:32Z,"very nice , nice quality, could u upload the next episodes of Doctor Who? I love this serie"
