User Type,Username,Date,Text
,xBSAACHRIS434x,2012-03-21T04:26Z,Thank you
,Transist,2012-03-21T04:29Z,thanks so much eztv....can't wait till its done
,Dkhalil72,2012-03-21T05:05Z,"Hey, could you do me a favor and put up episode 4.   thanx for all the other ones!"
,BreakingBadFan,2012-03-22T22:33Z,"@dkhalil72, try kickasstorrents.com. That is where i had to get episode 4. The magnet links work for kat too. Thanks eztv, loving this show"
,T3HPWnEr3R,2012-04-09T04:09Z,Missing episode #4. Could someone post it please? 
