Filename,Size,Unit
Sing and Pay/01 Sing and Pay If Your'e Happy and You Know It.mp3,7.33,M
Sing and Pay/02 Sing and Pay Wheels on the Bus.mp3,5.75,M
Sing and Pay/03 Sing and Pay This Old Man.mp3,6.92,M
Sing and Pay/04 Sing and Pay I'm a Little Teapot.mp3,5.72,M
Sing and Pay/05 Sing and Pay S.T.O.P.mp3,6.48,M
Sing and Pay/06 Sing and Pay Eensie Weensy Spider.mp3,5.58,M
Sing and Pay/07 Sing and Pay Do your Ears Hang Low.mp3,6.95,M
"Sing and Pay/08 Sing and Pay Head, Shoulders, Knees & Toes.mp3",4.17,M
Sing and Pay/09 Sing and Pay Pat-a-Cake.mp3,6.6,M
Sing and Pay/10 Sing and Pay The Hokey Pokey.mp3,5.32,M
Sing and Pay/11 Sing and Pay Skip to my Lou.mp3,5.9,M
Sing and Pay/12 Sing and Pay B-I-N-G-O.mp3,5.58,M
"Sing and Pay/13 Sing and Pay Twinkle, Twinkle Little Star.mp3",7.75,M
"Sing and Pay/14 Sing and Pay One, Two, Buckle My Shoe.mp3",4.09,M
Sing and Pay/15 Sing and Pay The Bunny Hop.mp3,5.93,M
Sing and Pay/16 Sing and Pay You Are My Sunshine.mp3,4.76,M
Sing and Pay/17 Sing and Pay Ring Around the Rosie.mp3,5.14,M
Sing and Pay/18 Sing and Pay London Bridge.mp3,4.17,M
"Sing and Pay/19 Sing and Pay Play With Me, Sing Along.mp3",8.91,M
