Filename,Size,Unit
Live/05 Cortez the Killer.mp3,47.2,M
Live/09 Broken Chairs.mp3,43.96,M
"Ultimate Alternative Wavers/10 Built Too Long Parts 1, 2 & 3.mp3",21.71,M
Perfect from Now On/08 Untrustable_Part 2 (About Someone Else).mp3,20.76,M
You in Reverse/01 Goin' Against Your Mind.mp3,20.52,M
Keep It Like a Secret/Broken Chairs.mp3,20,M
Perfect from Now On/05 Velvet Waltz.mp3,19.99,M
Ultimate Alternative Wavers/04 Shameful Dread.mp3,19.6,M
There Is No Enemy/11 Tomorrow.mp3,18.03,M
Perfect from Now On/07 Kicked It in the Sun.mp3,17.67,M
There Is No Enemy/08 Done.mp3,16.24,M
Live/04 Virginia Reel Around the Fountain.mp3,16.21,M
Ultimate Alternative Wavers/09 Hazy.mp3,15.5,M
There Is No Enemy/04 Good Ol' Boredom.mp3,15.37,M
Ultimate Alternative Wavers/05 Nowhere Nothin' Fuckup.mp3,15.2,M
Perfect from Now On/03 Stop the Show.mp3,15.14,M
You in Reverse/06 Conventional Wisdom.mp3,15.14,M
There Is No Enemy/10 Things Fall Apart.mp3,14.75,M
You in Reverse/05 Wherever You Go.mp3,14.74,M
Perfect from Now On/02 I Would Hurt a Fly.mp3,14.72,M
Perfect from Now On/01 Randy Described Eternity.mp3,14.33,M
There's Nothing Wrong with Love/09 Some.mp3,13.76,M
You in Reverse/08 Mess With Time.mp3,13.68,M
Ultimate Alternative Wavers/06 Get a Life.mp3,13.64,M
You in Reverse/07 Gone.mp3,13.62,M
Ultimate Alternative Wavers/07 Built to Spill.mp3,13.6,M
Keep It Like a Secret/Carry the Zero.mp3,13.27,M
Perfect from Now On/06 Out of Site.mp3,13.23,M
The Normal Years/10 Terrible_Perfect.mp3,12.88,M
There Is No Enemy/06 Oh Yeah.mp3,12.69,M
There's Nothing Wrong with Love/12 Stab.mp3,12.68,M
Live/08 I Would Hurt A Fly.mp3,12.53,M
You in Reverse/03 Liar.mp3,12.48,M
Keep It Like a Secret/Time Trap.mp3,12.44,M
The Normal Years/04 Some Things Last a Long Time.mp3,12.06,M
You in Reverse/10 The Wait.mp3,12.05,M
Ancient Melodies of the Future/04 Alarmed.mp3,11.81,M
There Is No Enemy/05 Life's a Dream.mp3,11.63,M
Perfect from Now On/04 Made-Up Dreams.mp3,11.56,M
Live/01 The Plan.mp3,11.4,M
You in Reverse/02 Traces.mp3,11.39,M
Keep It Like a Secret/Temporarily Blind.mp3,11.15,M
Keep It Like a Secret/You Were Right.mp3,11.04,M
You in Reverse/09 Just a Habit.mp3,10.79,M
The Normal Years/01 So & So So & So from Wherever Wherever.mp3,10.73,M
There's Nothing Wrong with Love/06 Cleo.mp3,10.62,M
There Is No Enemy/09 Planting Seeds.mp3,10.59,M
Ancient Melodies of the Future/10 The Weather.mp3,10.58,M
The Normal Years/09 Still Flat.mp3,10.49,M
Ultimate Alternative Wavers/03 Revolution.mp3,10.29,M
There's Nothing Wrong with Love/10 Distopian Dream Girl.mp3,10.19,M
Ancient Melodies of the Future/05 Trimmed and Burning.mp3,10,M
Live/03 Stop the Show.mp3,9.89,M
The Normal Years/07 Some.mp3,9.7,M
Keep It Like a Secret/Else.mp3,9.65,M
There's Nothing Wrong with Love/03 Big Dipper.mp3,9.64,M
There Is No Enemy/03 Nowhere Lullaby.mp3,9.57,M
The Normal Years/08 Sick & Wrong.mp3,9.5,M
Ultimate Alternative Wavers/01 The First Song.mp3,9.42,M
Ancient Melodies of the Future/01 Strange.mp3,9.25,M
Ultimate Alternative Wavers/02 Three Years Ago Today.mp3,9.2,M
Live/02 Randy Described Eternity.mp3,9.13,M
Ancient Melodies of the Future/02 The Host.mp3,9.09,M
Keep It Like a Secret/Sidewalk.mp3,8.98,M
Ancient Melodies of the Future/08 You Are.mp3,8.9,M
There's Nothing Wrong with Love/11 Israel's Song.mp3,8.79,M
There's Nothing Wrong with Love/02 Reasons.mp3,8.75,M
Ancient Melodies of the Future/03 In Your Mind.mp3,8.74,M
There Is No Enemy/02 Hindsight.mp3,8.73,M
Ancient Melodies of the Future/06 Happiness.mp3,8.53,M
The Normal Years/06 Joyride.mp3,8.46,M
Live/07 Singing Sores Make Perfect Swords.mp3,8.28,M
Keep It Like a Secret/The Plan.mp3,8.13,M
There Is No Enemy/01 Aisle 13.mp3,7.94,M
Keep It Like a Secret/Bad Light.mp3,7.85,M
There's Nothing Wrong with Love/07 The Source.mp3,7.75,M
Ultimate Alternative Wavers/08 Lie for a Lie.mp3,7.65,M
Ancient Melodies of the Future/07 Don't Try.mp3,7.61,M
The Normal Years/03 Car.mp3,7.34,M
Live/06 Car.mp3,7.29,M
There's Nothing Wrong with Love/04 Car.mp3,6.95,M
The Normal Years/05 Girl.mp3,6.59,M
There Is No Enemy/07 Pat.mp3,6.5,M
Ancient Melodies of the Future/09 Fly Around My Pretty Little Miss.mp3,6.4,M
Keep It Like a Secret/Center of the Universe.mp3,6.38,M
There's Nothing Wrong with Love/01 In the Morning.mp3,6.12,M
You in Reverse/04 Saturday.mp3,6.11,M
There's Nothing Wrong with Love/05 Fling.mp3,5.99,M
There's Nothing Wrong with Love/08 Twin Falls.mp3,4.3,M
The Normal Years/02 Shortcut.mp3,3.59,M
There's Nothing Wrong with Love/13 Preview.mp3,3.3,M
