User Type,Username,Date,Text
,blind-anders,2012-04-06T20:54Z,"Bild o ljud? Nån?
Testar och lämnar kommentar.
Tack för UL."
,FFxxFFty,2012-04-06T21:54Z,What about quality of this torrent?
,Candlejacker,2012-04-07T18:13Z,"Best quality out there right now
About... A:7 V:7 or something along those lines."
,act378,2012-04-08T01:37Z,"Guys, does it have to take a while? 'cause I'm trying to get the torrent, and nothing seems to happen. Zero seeders, or something like that."
,act378,2012-04-08T02:11Z,"Yep, it's official. The torrent doesn't work."
[T],endrass,2012-04-08T06:52Z,"ac 1378 don¨t came with bullshit, it works. At 
this moment there are appr. 560 seeders and 
170 peers. Figures from my seedbox. // prien"
[T],endrass,2012-04-08T06:55Z,act378 - no bullshit it works // prien
[T],endrass,2012-04-08T06:59Z,act378 why do you throw shit. it works // prien
,Hippopotimoose,2012-04-08T07:13Z,Pretty sure act378 should just get better internet and stop blaming the torrent.
,act378,2012-04-08T13:04Z,"Sorry, guys, sorry, endrass. What I wrote about this torrent was crap indeed. 

It wasn't my internet connection, but the Bit Spirit torrent client I used. Now I installed uTorrent, and the download is progressing quite fine.

Thanks for seeding, guys. No hard feelings, ok?"
,act378,2012-04-08T13:11Z,"Hm... Now I seem to have a problem to leave a comment. Looks like somebody thought I was in a conspiracy against this torrent. Well, I'm not. I was just wrong, and I'd like to delete my previous messages, but I don't know how - I guess, there is no such function.

Anyway, I hope somebody reads this. Thanks again for sharing, bro."
,Soapy35,2012-04-09T19:19Z,Everything Inspiral posts is tracked!!! Another burner from this chump!!! got a letter from Comcast from his torrents!!!
,divedancer,2012-04-11T00:57Z,heh soapy35 do you police this site or are you just stalking this upper ???
,sneze27,2012-04-13T18:35Z,thanks for the torrent. fairly good quality
,aniken1234567,2012-05-05T15:21Z,A: 7 / V: 7 WATCHABLE... 
,SignificantOther,2012-07-05T06:46Z,"This is actually quite good for a cam. The sound is OK and the picture is excellent for a cam.

Thanks endrass  :o)"
,SsoftarN,2012-07-08T03:40Z,Highly recommended! You should download it here until it comes out on disc / better quality! :)
