User Type,Username,Date,Text
[V],smbdownload,2012-04-24T03:18Z,rock on brothers and sisters ~ peace
,l214l,2012-04-24T09:32Z,"Not Dio related, but put in here so you might see my info.

Hello smb, and others.  Demonoid has the following music which you might like to get?  I don't think this is one you've added?  It is in lossless.

Warren Haynes Band - Live at the Moody Theater (2012)."
[V],smbdownload,2012-04-24T15:13Z,I bought that my self also - will get it up soon :-)
,Flyfisher61,2012-04-28T15:02Z,Thanks!
,Zetsubou69,2012-05-19T08:38Z,THANK YOU SO MUCH! m/
,bry68,2012-06-03T12:37Z,thx
