Filename,Size,Unit
FPse for android v0.11.60 Final By bobiras2009/BIOS File By bobiras2009/scph1001.bin,512,K
FPse for android v0.11.60 Final By bobiras2009/Lucky Patcher By bobiras2009.apk,1.75,M
FPse for android v0.11.60 Final By bobiras2009/FPse for android v0.11.60 Final By bobiras2009.apk,1.5,M
FPse for android v0.11.60 Final By bobiras2009/FPse for android v0.11.60 Final By bobiras2009.txt,1.02,K
Holo Launcher HD Plus v1.0.6 Final By bobiras2009/Holo Launcher HD Plus 1.0.6 Final By bobiras2009.apk,1.43,M
Holo Launcher HD Plus v1.0.6 Final By bobiras2009/Holo Notifier v1.3 Final By bobiras2009.apk,43.29,K
Holo Launcher HD Plus v1.0.6 Final By bobiras2009/Holo Launcher HD Plus v1.0.6 Final By bobiras2009.txt,785,B
Birthday Clown v1.0 By bobiras2009.apk,37.71,M
"True Weather, Cities v4.00H Final By bobiras2009.apk",33.33,M
OfficeSuite Pro 6 + (PDF & HD) v6.5.1003 Final By bobiras2009.apk,15.88,M
Nexus Q GO Launcher EX Theme v1.3 Final By bobiras2009.apk,15.18,M
Premium Widgets & Weather v1.2.4 Final By bobiras2009.apk,15.07,M
Smart Office 2 v2.0.17 Final By bobiras2009.apk,12.72,M
AccuWeather Platinum v2.1.6 Final By bobiras2009.apk,12.52,M
Chordbot Pro v2.0 Final By bobiras2009.apk,10.97,M
ProCapture v1.6.1.2 Final By bobiras2009.apk,8.8,M
SPB Wallet v2.2 Final By bobiras2009.apk,8.57,M
Flightradar24 Pro v3.5.2 Final By bobiras2009.apk,8.06,M
Thumb Keyboard (PhoneTablet) v4.6.1.00.146 Final By bobiras2009.apk,7.97,M
Color Splash Effect Pro v1.3.0 Final By bobiras2009.apk,7.77,M
PhotoShake! Pro v2.0.2 Final By bobiras2009.apk,7.63,M
jetAudio Plus v1.9.0 Final By bobiras2009.apk,7.2,M
Locus Pro v2.7.0 Final By bobiras2009.apk,6.8,M
ROM Toolbox Pro v5.4.3 Final By bobiras2009.apk,6.76,M
Plant File v1.0 By bobiras2009.apk,6.68,M
Camera JB+ v1.1.3 Final By bobiras2009.apk,6.66,M
Jelly Bean Keyboard PRO v1.7.8 Final By bobiras2009.apk,6.65,M
Solo v1.54 Final By bobiras2009.apk,6.53,M
Animated Weather Widget&Clock v5.3.1 Final By bobiras2009.apk,6.33,M
Genius Scan v1.0.7 Final By bobiras2009.apk,6.24,M
Plex for Android v2.2.2.8 Final By bobiras2009.apk,5.23,M
Silouette HD v1.0 By bobiras2009.apk,5,M
ASTRO File Manager  Browser Pro v4.0.443 Final By bobiras2009.apk,4.98,M
Devil warrior GOLauncher Theme v1.0 By bobiras2009.apk,4.91,M
One More Clock Widget v1.3.9 Final By bobiras2009.apk,4.89,M
Jelly Bean ApexNova Theme v9.0 Final By bobiras2009.apk,4.77,M
BeWeather & Widgets Pro v1.3.16 Final By bobiras2009.apk,4.61,M
TweetCaster Pro for Twitter v6.9.2 Final By bobiras2009.apk,4.44,M
Tapatalk Forum App v2.4.1 Final By bobiras2009.apk,4.31,M
FolderSync v2.2.6 Final By bobiras2009.apk,4.04,M
Weather Services PRO v1.8pro Final By bobiras2009.apk,3.87,M
Sleep as Android FULL v20121024 Final By bobiras2009.apk,3.86,M
Autumn Forest Live Wallpaper v1.0.2 Final By bobiras2009.apk,3.81,M
GO TaskManager EX Pro v1.7 build 16 Final By bobiras2009.apk,3.8,M
"Pocket Informant-Events,Tasks v2.08.6092 Final By bobiras2009.apk",3.73,M
tinyCam Monitor PRO v4.1.2 Final By bobiras2009.apk,3.66,M
mVideoPlayer Pro v4.0.3 Final By bobiras2009.apk,3.66,M
BackCountry Navigator PRO GPS v4.8.0 Final By bobiras2009.apk,3.63,M
AIVC (Alice) - Pro Version v2.7 Final By bobiras2009.apk,3.42,M
Kaspersky Mobile Security v9.10.129 Final By bobiras2009.apk,3.23,M
17th memory GO Launcher Theme v1.1 Final By bobiras2009.apk,2.91,M
Battery Widget Reborn! Pro v1.1.1PRO Final By bobiras2009.apk,2.9,M
TypeSmart 2.0 Keyboard v2.0.3 Final By bobiras2009.apk,2.9,M
DW Contacts & Phone & Dialer v2.2.6-pro Final By bobiras2009.apk,2.84,M
Black Droid - Go Launcher EX vNone v1 By bobiras2009.apk,2.84,M
GoodNews Pro (Google Reader  RSS) v4.7.0 Final By bobiras2009.apk,2.78,M
Android File Manager Pro v2.5.2 Final By bobiras2009.apk,2.77,M
SD Maid Pro - System cleaning tool v2.0.2.0 Final By bobiras2009.apk,2.54,M
Make Your Clock Pro v1.0.11 Final By bobiras2009.apk,2.54,M
Equalizer FULL v3.2.5 Final By bobiras2009.apk,2.33,M
xPhonePro – Phone and Contacts v2.4 Final By bobiras2009.apk,1.91,M
Camera ZOOM FX v4.0.2 Final By bobiras2009.apk,1.9,M
Battery Indicator Pro v1.3.1 Final By bobiras2009.apk,1.85,M
Smart Memory Booster Pro v1.1 Final By bobiras2009.apk,1.82,M
WiFi Mouse HD v1.1 Final By bobiras2009.apk,1.77,M
Lucky Patcher v2.6.4 Final By bobiras2009.apk,1.77,M
HDR Camera+ v2.27 Final By bobiras2009.apk,1.77,M
3G Watchdog Pro v1.16.0 Final By bobiras2009.apk,1.7,M
GO Backup Pro (Premium) v2.3 Final By bobiras2009.apk,1.62,M
Ulysse Speedometer Pro v1.7.4 Final By bobiras2009.apk,1.53,M
FlashLight HD LED Pro v1.42 Final By bobiras2009.apk,1.42,M
Spectrum ICS Pro LWP v1.2.4 Final By bobiras2009.apk,1.3,M
NotifierPro Plus v6.3 Final By bobiras2009.apk,1.24,M
Private DIARY v4.8 Final By bobiras2009.apk,1.22,M
Audio Control v2.0.2 Final By bobiras2009.apk,1.18,M
ssLauncher the Original v1.8.8 Final By bobiras2009.apk,1.02,M
Camera FV-5 v1.31 Final By bobiras2009.apk,999.48,K
Lux Auto Brightness v0.75 Final By bobiras2009.apk,931.66,K
Power Control Plus (widget) v2.7 Final By bobiras2009.apk,893.44,K
Droid Scan Pro PDF v5.7.1 Final By bobiras2009.apk,854.53,K
MoviesBook v2.4.7 Final By bobiras2009.apk,746.05,K
Cellular Network Widget Pro v1.3.4 Final By bobiras2009.apk,731.71,K
Andy - Siri for Android (Full) v5.0 Final By bobiras2009.apk,672.78,K
Messaging Metro Beta (Donate) v0.725 Final By bobiras2009.apk,577.98,K
aCalendar+ Android Calendar v0.14.2 Final By bobiras2009.apk,557.6,K
Task List - To Do List - Pro v2.5 Final By bobiras2009.apk,521.77,K
1Tap Eraser Pro v1.3 Final By bobiras2009.apk,510.44,K
Total Screen Control v2.4.3 Final By bobiras2009.apk,487.15,K
MinimalLock Pro v1.3 Final By bobiras2009.apk,397.82,K
External Keyboard Helper Pro v5.1 Final By bobiras2009.apk,387.7,K
Conjure v1.3.0 Final By bobiras2009.apk,283.63,K
Fast Burst Camera & Anim-GIF v2.3 Final By bobiras2009.apk,275.75,K
Start menu for Android v1.1.7 Final By bobiras2009.apk,239.31,K
[root] Triangle Away v2.15 Final By bobiras2009.apk,227.34,K
Vignette v2012.10 Final By bobiras2009.apk,201.28,K
ReNotify+ v1.0 By bobiras2009.apk,199.4,K
franco.Kernel updater v7.1 Final By bobiras2009.apk,164.99,K
By bobiras2009.jpg,34.21,K
Delayed Lock v2.8.4 Final By bobiras2009.apk,4.51,K
[All Must Read It)Best Top Paid Android Apps October 2012 Part 8+9[bobiras2009].txt,639,B
