User Type,Username,Date,Text
,PK1031,2012-05-03T09:53Z,"man ur torrents r good bul plz seed it man....
if u seed then other people can download it ..
so plzzzzzzzz seeeeeeeeeeeeeeeeeeed"
[T],c_goldy,2012-05-03T10:50Z,"my seeding cd b slow coz i'm seeding 3 to 4 torrents at a time
ill try to make it 1 at a time tks man for feedbk"
,PK1031,2012-05-04T03:39Z,"bhenchod seed karna... 
chutiye ......"
[T],c_goldy,2012-05-04T08:43Z,"abe o pakistani pk1031

itni jaldi he to bazar se dvd kharid k dekh le

sala tum pakistaniyo ka yeich prob he wait nahi hota harami"
