User Type,Username,Date,Text
,frankinou,2012-11-05T05:17Z,somebody can link some screenshot please ?
,fishboy11,2012-11-05T06:31Z,seriously you cant take the 2 seconds it takes to highlight the title and right click and choose search google for??
[T],AncientRome,2012-11-05T06:36Z,"Check out IGN, they'll have some screenshots.
But since the release date of this is 2004, you can expect it to not be as good as today's games."
,Aintnevernot420,2012-11-06T03:04Z,@fishboy11 - right on brother - amazing isn't it.  half the people that use this site have no business being here (and that's being generous)  
