Filename,Size,Unit
CD-3/321-The Edwin Hawkins Singers-Oh Happy Day.mp3,8.73,M
CD-3/306-The Manhattan Transfer-Happy Holiday The Holiday Season.mp3,7.62,M
CD-2/218-Harry Belafonte-Marys Boy Child.mp3,7.52,M
CD-3/307-Tony Bennett-All I Want For Christmas Is You.mp3,7.23,M
CD-2/201-Johnny Mathis-Ill Be Home For Christmas.mp3,6.73,M
CD-2/221-Tony Bennett-Christmas Time Is Here.mp3,6.5,M
CD-3/318-Julie Andrews-In The Bleak Midwinter.mp3,6.19,M
CD-2/219-Julie Andrews-Away In A Manger.mp3,6.18,M
CD-3/317-Johnny Mathis-When A Child Is Born.mp3,6.06,M
CD-2/208-Jerry Vale-Silver Bells.mp3,5.87,M
CD-3/312-Bobby Vinton-O Holy Night.mp3,5.81,M
CD-1/111-Steve Tyrell And Jane Monheit-Baby Its Cold Outside.mp3,5.62,M
CD-3/314-Ray Conniff-What Child Is This.mp3,5.59,M
CD-2/203-Perry Como-Do You Hear What I Hear.mp3,5.58,M
CD-1/118-Julie Andrews-The Secret Of Christmas.mp3,5.56,M
CD-1/119-Lambert Hendricks And Ross-Deck Us All With Boston Charlie.mp3,5.53,M
CD-2/220-Steve Tyrell-Merry Christmas Baby.mp3,5.44,M
CD-3/319-Peggy Lee-The Christmas Spell.mp3,5.43,M
CD-3/302-Jim Reeves-White Christmas.mp3,5.4,M
CD-1/117-Mel Torme-The Christmas Song (Chestnuts Roasting On An Open Fire).mp3,5.31,M
CD-3/304-Don Sebesky-Snowfall.mp3,5.1,M
CD-1/101-Andy Williams-Its The Most Wonderful Time Of The Year.mp3,5.08,M
CD-3/315-Henry Mancini-Little Drummer Boy.mp3,5.05,M
CD-2/206-Bobby Vinton-My Christmas Preayer.mp3,5.03,M
CD-3/309-Bing Crosby-The Secret Of Christmas.mp3,4.95,M
CD-2/204-Aretha Franklin-Blue Holiday.mp3,4.94,M
CD-1/116-Harry Belafonte-I Heard The Bells On Christmas Day.mp3,4.91,M
CD-2/215-Frank Sinatra-It Came Upon A Midnight Clear.mp3,4.75,M
CD-1/104-Ella Fitzgeralo-Rudolph The Red-Nosed Reindeer.mp3,4.68,M
CD-1/114-The Crystals-Santa Claus Is Coming To Town.mp3,4.65,M
CD-3/305-Abndy Williams-O Little Town Of Bethlehem.mp3,4.52,M
CD-1/115-Johnny Cash-Little Drummer Boy.mp3,4.5,M
CD-3/313-Burl Ives-The Twelve Days Of Christmas.mp3,4.45,M
CD-2/207-Nancy Wilson-The Christmas Waltz.mp3,4.43,M
CD-3/316-Elvis Presley-If Everyday Was Like Christmas.mp3,4.36,M
CD-3/320-The Ames Brothers-Good King Wenceslas.mp3,4.15,M
CD-2/211-The Ronettes-Sleigh Ride.mp3,4.12,M
CD-2/209-Ediddie Fisher-Christmas Day.mp3,4.11,M
CD-1/102-Tony Bennett-Winter Wonderland.mp3,4.11,M
CD-1/112-John Pizzarelli And Don Sebesky-Let It Snow Let It Snow Let Is Snow.mp3,4.09,M
CD-3/310-Doris Day-Ill Be Home For Christmas.mp3,3.98,M
CD-1/107-Darlene Love-Christmas (Baby Please Come Home).mp3,3.95,M
CD-3/311-Nancy Wilson-What Are You Doing New Years Eve.mp3,3.89,M
CD-1/120-Nancy Wilson-Thats What I Want For Christmas.mp3,3.88,M
CD-1/121-The Ronettes-I Saw Mommy Kissing Santa Claus.mp3,3.87,M
CD-1/105-Eartha Kitt And Henri Rene-Santa Baby.mp3,3.84,M
CD-1/109-Johnny Mathis-Have A Holly Jolly Christmas.mp3,3.79,M
CD-2/213-Eddy Arnold-Jingle Bell Rock.mp3,3.75,M
CD-2/212-Elvis Presyley-Blue Christmas.mp3,3.61,M
CD-3/308-Eddy Arnold-C-H-R-I-S-T-M-A-S.mp3,3.46,M
CD-2/205-Billie Holiday-Ive Got My Love To Keep Me Warm.mp3,3.45,M
CD-3/301-Frank Sinatra-Santa Claus Is Comin To Town.mp3,3.42,M
CD-2/222-Patti Page-We Wish You A Merry Christmas.mp3,3.33,M
CD-1/108-Frank Sinatra-Have Yourself A Merry Little Christmas.mp3,3.2,M
CD-2/214-Louis Prima-Shake Hands With Santa Claus.mp3,3.16,M
CD-2/216-Gene Autry-Here Comes Santa Claus (Right Down Santa Claus Lane).mp3,3.15,M
CD-1/110-Gene Autry And Rosemary Clooney-The Night Before Christmas Song.mp3,3.11,M
CD-1/103-Jim Reeves-Jingle Bells.mp3,3.1,M
CD-1/106-Perry Como And The Fontaine Sisters-Its Beginning To Look A Lot Like Christmas.mp3,3.08,M
CD-3/303-Vic Damone-Deck The Halls.mp3,3.08,M
CD-2/210-Darlene Love-Winter Wonderland.mp3,2.98,M
CD-1/113-Aretha Franklin-Kissin By The Mistletoe.mp3,2.96,M
CD-2/202-Julie London-Warm December.mp3,2.61,M
CD-2/217-The Manhattan Transfer-Caroling Caroling.mp3,2.41,M
CD-3/322-Phil Spector And Co-Silent Night.mp3,2.36,M
Front.jpg,110.06,K
