Filename,Size,Unit
Scientific Literacy Under the Microscope- A Whole School Approach to Science Teaching and Learning[Team Nanban][TPB].pdf,3.16,M
README.txt,1.89,K
Release Notes.txt,100,B
Other/Torrent downloaded from Silvertorrents.me.txt,52,B
Other/Torrent downloaded from extratorrent.com.txt,51,B
Other/Torrent downloaded from Piratebay.se.txt,50,B
Other/Torrent downloaded from Demonoid.me.txt,46,B
Other/Torrent downloaded from 1337x.org.txt,44,B
Other/Torrent downloaded from h33t.com.txt,43,B
Other/Torrent downloaded from Kat.ph.txt,41,B
