User Type,Username,Date,Text
[H],HeroMaster,2012-03-17T08:46Z,ENJOY We Brought a Zoo DVDRip New Quality with Small Size and one file by AbSurdiTy!
,thomas matthews,2012-03-17T11:20Z,thank you. my daughter wanted this for a while
,ag_orange,2012-03-17T14:19Z,Tnx...excellent quality and excellent movie too...
,shaddi1973,2012-03-17T17:17Z,"does any one know what to do when
 a grey screen comes up"
,theeccentrik,2012-03-17T23:39Z,THANKS!
,amous1st,2012-03-17T23:58Z,Great audio and video!  Thanks for the upload HeroMaster!
,dragonballz,2012-03-18T16:40Z,Thanks BUT We are expecting a 600mb 720p version. 
,jjmastersword,2012-05-27T01:15Z,@shaddi1973 try downloading the k lite codec pack. not sure if it will help or not but mine as well try it
,primuspilus,2012-06-16T12:03Z,thks for taking the time to make this movie available !
,Shihabrockstar,2012-08-02T07:23Z,"a=9
v=9
m=10"
