User Type,Username,Date,Text
[T],Atilla82,2012-04-26T20:24Z,"screenshots:
http://www.pohrani.com/f/3d/kX/1NJVJYEV/total-recall-2070all.jpg"
,bryentheartist,2012-04-26T23:48Z,thnkx
[T],Atilla82,2012-04-27T14:39Z,This is UNCENSORED version of the show.
,downs429,2012-06-18T00:29Z,"Not sure why, but I get no sound"
[T],Atilla82,2012-06-30T16:07Z,"you probably have no AC3 filter, or it is set up incorrectly "
,floader01,2012-08-05T20:43Z,Thank you! Big Total Recall fan -- and didn't even know such a series existed!
[T],helder1965,2012-09-11T13:00Z,Anyone knows where can I find english subtitles?!
