Filename,Size,Unit
Made In Heaven/13 (untitiled).mp3,51.72,M
Made In Heaven/07 Heaven For Everyone.mp3,12.86,M
Made In Heaven/02 Made In Heaven.mp3,12.43,M
Made In Heaven/09 You Don't Fool Me.mp3,12.42,M
Made In Heaven/06 I Was Born To Love You.mp3,11.09,M
Made In Heaven/04 Mother Love.mp3,11.07,M
Made In Heaven/03 Let Me Live.mp3,10.94,M
Made In Heaven - Bonus EP/01 Heaven For Everyone (Single Version).mp3,10.77,M
Made In Heaven - Bonus EP/05 Rock In Rio Blues (Live B-Side).mp3,10.52,M
Made In Heaven/08 Too Much Love Will Kill You.mp3,9.93,M
Made In Heaven - Bonus EP/02 It's A Beautiful Day (B-Side Version).mp3,9.17,M
Made In Heaven/10 A Winter's Tale.mp3,8.81,M
Made In Heaven - Bonus EP/06 A Winter's Tale (Cosy Fireside Mix).mp3,8.78,M
Made In Heaven - Bonus EP/03 My Life Has Been Saved (1989 B-Side Version).mp3,7.51,M
Made In Heaven/05 My Life Has Been Saved.mp3,7.48,M
Made In Heaven/11 It's A Beautiful Day (reprise).mp3,6.92,M
Made In Heaven - Bonus EP/04 I Was Born To Love You (Vocal & Piano Version).mp3,6.76,M
Made In Heaven/01 It's A Beautiful Day.mp3,5.91,M
Made In Heaven/12 (Yeah).mp3,189.38,K
