User Type,Username,Date,Text
,PRESIDENT_CHAVEZ,2012-04-28T21:06Z,"downloading and seeding forever,  thethingy always the best."
,NYTropix22,2012-04-28T21:48Z,"I had seen other Photoshops CS6's released prematurely and I was hesitant to download them, but when I saw one released by you, thethingy, I knew it was the real deal..Thanks!"
,zomzom90,2012-04-28T22:04Z,"Finally trusted upload, thanks."
,Ivantav,2012-04-28T23:36Z,Finalmente..... Thanks Thethingy!!
,badboys57,2012-04-28T23:39Z,"Multilanguage ??
beta or final version ??"
,badboys57,2012-04-28T23:47Z,"Multilanguage ?
beta or final version ?"
,sayara69,2012-04-28T23:47Z,Oh nice thanks My Dear>>>
,nervin,2012-04-29T00:38Z,seed please slow download 4 kilo :| and 47 people to seed
[V],thethingy,2012-04-29T01:07Z,"badboys57, final and multilingual. "
,badboys57,2012-04-29T01:27Z,"Ok, thank you thethingy, I am confident because CS6 not available until May 23 at adobe, thank you very much"
,deifu,2012-04-29T01:36Z,"thanks..
I trust. but, no crack?"
,zomzom90,2012-04-29T02:43Z,I hope you didn't use [Painter Patch] coz this patch killing Extended and 3D and turn It to normal Photoshop.
,TheJoesif,2012-04-29T03:53Z,"TheThingy for prime-minister :D
I love you so much, Thanks for this!"
[V],thethingy,2012-04-29T04:44Z,"zomzom90, I dont know what that is but this you just install, start the trial and replace 2 (or 4 if 64bit) files then 3d works;

http://i.imgur.com/BY3y8.png
"
[V],thethingy,2012-04-29T04:45Z,"zomzom90, I dont know what that is but this you just install, start the trial and replace 2 (or 4 if 64bit) files then 3d works;

http://bayimg.com/gaONKAADe

I cant get a screenshot of the ""extended"" because the about page disappears when I click the capture button lol but its says ""extended"" in a sort of blue colour.  "
[V],thethingy,2012-04-29T04:51Z,"zomzom90, you just install, start the trial and replace 2 (or 4 if 64bit) files then 3d works;

http://bayimg.com/gaONKAADe

I cant get a screenshot of the ""extended"" because the about page disappears when I click the capture button lol but its says ""extended"" in a sort of blue colour.  "
,reelook,2012-04-29T05:04Z,"was waiting for your release....
AND AS USUAL
IT IS BEST.....:->>>
thanku very much....."
,p51d007,2012-04-29T06:11Z,Downloading & seeding.  I assume this installs both x32 & x64?
,Phoenix-III,2012-04-29T07:53Z,"As usual I'm downloading thethingy torrent....

BTW do I need to completely remove cs5 to install this?"
,zomzom90,2012-04-29T08:23Z,"Oops, I was using crack before starting the trial.
It's all fine now, Thanks."
,RedoName,2012-04-29T08:48Z,Thank you!  Always a relief to see your name on a file.  Cheers!
,zomzom90,2012-04-29T08:49Z,"I took the screen for you, really that's was so fast and my graphic card crashes, but I got it in the end :D
http://s19.postimage.org/ilkak8zfn/CS6_Extended.jpg"
,soahs,2012-04-29T08:55Z,"I always look forward to your releases, Thingy you are the best.  But CS6, it has only one file, the exe trial.  How do I patch or serial?  Unless I am missing something, probably am."
,soahs,2012-04-29T09:05Z,Oops I certainly was missing something!  I thought the download was just a regular exe install file.  After checking it out I realized this is a compressed file made into exe.  Sorry about that!  Everything is good now :)
,badboys57,2012-04-29T09:15Z,Pfff So with no crack is useless :(
,badboys57,2012-04-29T09:27Z,"Yes good fissure, Sorry !
Big Boss thethingy :D"
,MonkeyBizz,2012-04-29T09:50Z,Hey bro i need your help i downloaded and what it only shows is just a page file.Not even a folder i tried to open it up with pdf. Idk how to open this file what do i need to open this blank image file that looks like a paper? what pogram do i need to open it. sorry im a noob
,MonkeyBizz,2012-04-29T09:55Z,ok so once the torrent is downloaded what pogram do i need to open this file? i tried pdf. sorry im a noob pls help. 
,niknik71,2012-04-29T10:29Z,"The installer is asking to sign into my Adobe ID. Is it safe to do so, or will I have problems later on?"
,zomzom90,2012-04-29T11:01Z,@niknik71  It's safe
,MsSjampie,2012-04-29T11:19Z,greattttttttttttttttttt
,joshyym,2012-04-29T11:33Z,"I have CS5.1, is it worth upgrading?"
,WarRobe,2012-04-29T13:20Z,"@joshyym, worths every minute of downloading"
,deifu,2012-04-29T13:50Z,"why I don't get extended?
is there anything wrong?"
,dtdpite,2012-04-29T14:27Z,"Indeed, I dont get extended either (64bit)"
[V],thethingy,2012-04-29T14:27Z,"deifu, put back the original dll (its in the download for you) then start photoshop and start the trial, close photoshop and put back the other dll, if you still dont get 3d then your graphics card does not support it. "
,Phoenix-III,2012-04-29T15:17Z,"I'm having the same problem as deifu, dtdpite.

It could be that my graphic card is not upto scratch since I'm using the laptop...

""Photoshop detacted graphicshardware that is not officially supported. If you experience problems please uncheck the Use Graphics Processor checkbox in the Performance panel of the Preferences dialog.""


However I had no such problems on cs5."
,deifu,2012-04-29T15:23Z,"@thethingy : thanks, it's working"
,joblog,2012-04-29T15:48Z,Will i have to reinstall all the plugins ?
,soahs,2012-04-29T15:59Z,"{{{  badboys57 Wrote - 
Pfff So with no crack is useless :(  }}}

No, this is NOT just an exe file.  Think of a compressed rar file that is made into an exe.

So run the torrent download and it will uncompress into several folders.  There is a file ""installing instructions.txt"" will have all the info you will need to install and get CS6 activated.  This release uses dll files rather than a patch.

Be sure to download ""Adobe Tool"" this patches the hosts file for you automatically.  Nice touch Thingy!"
,zoetrope101,2012-04-29T16:17Z,"Amazing as always theThingy, thanks. "
,zomzom90,2012-04-29T16:38Z,@MonkeyBizz >> I think you have to change file type to exe
,BigFatCake,2012-04-29T16:44Z,"Could you explain this like I am a kid?
A step by step guide would surely be helpful.

I have so far downloaded the files, extracted them to a folder, and I tried using Adobe Tool, in which I patched and then looked for cs6 (which was not there).
I see people using trial versions of cs6 to download the file, but I see no way to download one.

Thank you!"
,slickpt,2012-04-29T17:14Z,"[..]
thethingy às 2012-04-29 14:27 CET:
deifu, put back the original dll (its in the download for you) then start photoshop and start the trial, close photoshop and put back the other dll, if you still dont get 3d then your graphics card does not support it.
[...]

This also worked for me, on win7 64. Just deactivate internet connection, so when you start PS with the original dlls it won't ask you to sign-in your Adobe ID. Start it, start trial and then close it. Then you can turn on the internet connection again, and change the dll to the provided =) Thanks Thethingy"
[V],thethingy,2012-04-29T17:25Z,"MonkeyBizz, what torrent client are you using?, do what zomzom90 says and rename the blank file to anything.exe , it shouldent do that but your not the first.

BigFatCake, Adobe Tools not ready yet so just install, start the trial by launching photoshop, close photoshop then copy 2 dll files or 4 dll file to the locations given in the read me (instructions.txt)"
,i508,2012-04-29T18:31Z,"Camera isn't working for me. If I try to open it on 64 bit bridge it says ""Camera RAW is not enabled"" and if I try to open it on 32 bit it stays still for a few secs then crashed (just closes). Any fix? Or am I doing it wrong? I got everything else working like a charm."
,rogersarevok,2012-04-29T18:41Z,"perfect, works like a charm! cant wait for the master suite"
[V],thethingy,2012-04-29T18:55Z,"i508, start bridge (both if you installed both) and leave it running for a few minutes then close it, try accessing it again from photoshop"
,LJUSALF,2012-04-29T19:08Z,"Everything seems to work perfectly. 
Used adobe tool. But when I start up cs6 it sais it´s a trial. Adobe tool had no serial for cs6 (can I use cs5.1?) and I thought that´s not necesarry when patch with Tool.
Anyone knows how it works??"
,ramjidubaiwala,2012-04-29T19:15Z,"thanks working 100% for me
:) THEHINGY :)"
,LJUSALF,2012-04-29T19:21Z,"2 0r 4 dll-files? But I can only replace 1 (one) dll file the directory bacause its only 1 to begin with.
What am I misunderstanding???"
,sumitg,2012-04-29T19:21Z,"Wow Whenever a Adobe product is needed ""thethingy"" is always my Preference!!"
,i508,2012-04-29T20:07Z,"@thethingy Thanks bro I got Camera RAW working. My problem was that I was using Adobe Bridge to open camera raw which led to an error. When I open Camera RAW directly from Photoshop, no errors show up whatsoever. Thanks for this awesome release. Cheers"
,babausis,2012-04-29T20:25Z,Thank you very much!
,cnp07,2012-04-29T21:02Z,"I think i followed all the instructions - i´m new in this - and i have the program working but i don´t see the 3d in the panel. What could went wrong?

Help please!!!"
,joblog,2012-04-29T21:06Z,Multilangages !!!!! Only english or japanese ! No french yet :(
,TheAslan,2012-04-29T21:33Z,"I don't know what I did wrong but I didn't get that 3D link, and my Photoshop is not showing Extended either, I uninstalled previous beta version of Photoshop CS6 first but maybe I didn't uninstall it completely and it left some .reg keys or something behind, I downloaded your torrent and then I installed only x64 version of Photoshop, then I replaced those .dll files and then I opened Photoshop.

Any help will be very wellcome =D"
,soahs,2012-04-29T21:39Z,"{{{BigFatCake at 2012-04-29 16:44 CET:
Could you explain this like I am a kid?
A step by step guide would surely be helpful.

I have so far downloaded the files, extracted them to a folder, and I tried using Adobe Tool, in which I patched and then looked for cs6 (which was not there).
I see people using trial versions of cs6 to download the file, but I see no way to download one.

Thank you!}}}
__________________

1.  Download the torrent and extract the exe file

2.  Download the Adobe Tool file (as the thingy said this is not ready yet for CS6 so just use it to patch the hosts file)  The hosts file must be patched to prevent Adobe from phoning home. Patch the hosts before installing CS6.  Close the Adobe Tool program.

3.  Disconnect from the internet and install the (included) CS6 trial.  Open photoshop after the install the close it.

4.  Find the (included) dll file.  There will be TWO dll: ONE for 32 bit and and a different dll for 64 bit.  If your computer is 32 bit then use only the 32 bit dll.   

5.  Copy the dll file to TWO different places:

AdobeAdobe Photoshop CS6 folder and
AdobeAdobe Bridge CS6 folder

6.  WHERE you will copy this (included) dll file will depend on if you have 32 bit or 64 bit.  There are instructions included in the torrent download.  Read them then go find where these folders are.  

7.  If you goof this up the torrent includes the original dll files to make it like it was.  Then you can try again.

8.  After copy and REPLACING the dll into the folders you can restart CS6 and also reconnect to the internet.

Hope this helps."
,diamonddogs,2012-04-29T22:44Z,"Why is it taking so long to dl,got 50mb dl speed.
But can only get 2.9kb/s dl speed on torrent, it's gonna take like forever."
,dpalme,2012-04-30T00:16Z,"1.Download the torrent 

2.Extract the contents with 7zip or winrar

3.Disconnect the internet

4.Run as adminstrator

5.choose the language

6.say I have a key
                 use the following serials:


              1325-0949-2080-9819-3777-3230

              1325-0160-5283-9851-2671-8951

7.it says no active internet connection, say validate later

8.wait till the installation is over

9.edit the hosts file or use the one i have uploaded

10.for x86 run the app it should show the same screen as mine; close it then replace dll file/ 

11.for x64 bit users better replace the dll file for x86 and run the x64 Photoshop and the viceversa it should show the same screen as mine and later replace dll files for both x86 and x64

reconnect to internet 

thats it that should be fine cheers lol

TNKS to thethingy
"
,LJUSALF,2012-04-30T00:19Z,"@soahs 
I don´t know if it helped Bigfatcake, but it sure helped me. 
Thank you very much!"
,soahs,2012-04-30T00:51Z,Shhh - hey dpalme you might want to take those serials off so they won't get blacklisted.  That's why the instructions said not to post them.  The install goes very nicely anyway without even using serial numbers if you are disconnected from the internet.  Just click on the trial and you don't have to put in a serial.
,p51d007,2012-04-30T01:23Z,"Installed w/o a hitch, works perfect (x64)"
,sexyface,2012-04-30T02:20Z,installed good... but when the photo is out of dock and i try and move it around it wont stay in place it moves up to the top of the screen and wont move any were eles is any one having  the same issue or is it just me?? or some new thing adobe put in... other then that its fab
,diamonddogs,2012-04-30T02:45Z,"Installed ok,but updates is greyed out and oil paint filter wont work.
Says ""The filter you were using encountered an unknown graphics processor error that caused an unexpected exit.Check the manufacturer's website for the latest software""
Graphics is intel HD 3000 and has the latest software.No trouble with the graphics on cs5,what a bummer."
,Hbloodbth,2012-04-30T02:48Z,Where is the 3d tools on the task bar?
,pir8s003,2012-04-30T05:20Z,can someone tell adobe Photoshop Extended CS6 is included in Master collection CS6 or Just simple Photoshop in cs6????
,dpalme,2012-04-30T05:25Z,@soahs unable to remove comment
,dentist2112,2012-04-30T05:50Z,"Why does it still give me thirty days?  If I go and try to enter a serial it wants to connect to internet.  I used the adobe patch tool, any ideas would be great"
,TJBab,2012-04-30T06:15Z,was using the beta version and waiting for a thethingy release....love it as always!
,MonkeyBizz,2012-04-30T06:34Z,Hi tHEthingy well this is what i did 1 i downloaded the torrent on BITComet .2. once download I Open directory. once im there the file shows a blank peace of paper. i tried to open with winrar 7zip and tried how to change it to a EXE wicth i dont know how.So is there another pogram besides BITCOMET i can download this Torrent? is there a way you can let me know what is best?  THANKS for you patience my torrent shows a page file and it wont open
,kvalentz,2012-04-30T06:54Z,"what do I click on, on this page to download CS6?
Thank you"
,soahs,2012-04-30T07:46Z,"kvalentz just click on ""Get This Torrent"" it is right below the big green ""Download"" button.  (The Download button is an ad).  Once you click on Get This Torrent it will open automatically in Utorrent.  Just click on Ok and it will download."
,ricbuster,2012-04-30T07:48Z,"waiting for this mate!
cheers!"
,soahs,2012-04-30T07:48Z,@dentist 2112 did you paste the dll in the correct folder?  They have to go in two different places.
,ibomb909,2012-04-30T08:04Z,"i have a question, can i download this one and still have cs5?"
,MonkeyBizz,2012-04-30T08:10Z,sweet i got it working 1 more question wicth DLL do i copy and paste? Original 64 bit folder or the one folder that just say 64bit. sorry im a noob.
,soahs,2012-04-30T09:14Z,"@MonkeyBizz the instructions say to paste the dlls everywhere there is a ""amtlib.dll"" - just to be safe.

Do yourself a favor and get that great great little search program ""Everything Search""

ES says on my computer I have this file in two folders.  So I pasted them in the folders that showed on ES.  

My computer is 32 bit so I had to choose the 32 bit dll file (there is only one 32 bit dll).

For those that have a 64 bit computer, note the folders where ES finds this dll file.  In a 64 bit computer, software programs will go into a certain place.  And 32 bit software programs will go in a different place.

So what you do is choose the 64 bit dll (again, there is only one 64 bit dll to choose from) then install that 64 bit dll where 64 bit CS6 is.  ONLY if your CS6 is 64 bit.  If not use the 32 bit dll.

Now:  besides CS6 you might also have CS5 installed too, or even CS4.  CS6 might be 64 bit and CS5 32 bit.  So what you do is to paste the 32 bit dll in each folder Photoshop 32 bit is installed.  Same with the 64 bit but you must paste the 64 bit file if 64 bit CS6 is installed.

This is why Everything Search is so great.  Just search for ""amtlib.dll"" and it will tell you where these are.  Don't forget there are TWO folders to paste the one dll in.  Read the instructions and with ES you can find these right away and explore the path."
,GuyGear,2012-04-30T11:40Z,"will give it a try. thank you thethingy!
seeded 2.41gb."
,Vrkolak,2012-04-30T11:41Z,Why is the update field grayed out?
,hth_fan,2012-04-30T12:18Z,"@thethingy IT WORKS! which is great but please explain how to make the 3D feauture work? I have a 64 bit operating system with 8gb ram and Intel core i5-2450M CPU @2.50ghz. please help! thanks for the great upload anyways, works perfectly! :)"
,Dalderup,2012-04-30T12:48Z,"Does the plugin's i have for CS5.5 still work? 
If not, can i have CS5.5 AND CS6 Installed at the same time?"
,diamonddogs,2012-04-30T12:57Z,"@Vrkolak,Yeah i've got the same problem."
,M0Nt3N3gR1N,2012-04-30T13:14Z,Its work fantastic! Well done and Thank You!
,ships52,2012-04-30T13:16Z,"Like all your apps no problem,no extended but that properly my graphics card.Your the best."
,Vrkolak,2012-04-30T13:54Z,"@diamonddogs
At first I tried it in trial mode. The update was working flawless.
But after putting the .dll files the field went greyed out.
Dunno why."
,Bantoo,2012-04-30T14:34Z,thethingy    is this beta version?
[V],thethingy,2012-04-30T14:47Z,"Vrkolak, updates disabled on patch, download any updates manually from Adobe, they come out every couple of months. "
[V],thethingy,2012-04-30T14:47Z,"Bantoo, no its the final version"
,pr0xy.am,2012-04-30T15:04Z,What is up with the OS X version that is for the real Designers?
,Vrkolak,2012-04-30T15:08Z,"@thethingy

Alright, thanks for the answer. 

I am wondering, can that be corrected, i.e updates to be available through the update option?
Like it was in CS5.1, and the hosts file?"
[V],thethingy,2012-04-30T15:31Z,"Vrkolak, it will be fixable when Ive finished the Adobe Tool for CS6"
,ships52,2012-04-30T15:45Z,If you are having problems with oil paint filter not working run graphics card in basic to do this just go to edit preferences-performance-advanced settings -draw mode drop down change to normal -pess ok restart cs6 .If still got problems tryadding another scrach disk hope this helps
,soahs,2012-04-30T16:10Z,"{{{@dentist2112 
Why does it still give me thirty days? If I go and try to enter a serial it wants to connect to internet. I used the adobe patch tool, any ideas would be great}}}

Are you sure you used the dll files from the correct folder in the download?  There are two sets, the ""original"" ones are to restore Photoshop like it was before patching in case things get goofed up.  Then you can try again with pasting the dlls-that-will-patch."
,cnp07,2012-04-30T16:17Z,"Sorry for being so anoying but i´m new in this and i don´t know how to fix it.

I downloaded beta version 4 days ago, thinking it was the cs6 extended. Now, in order to install this one, i uninstalled previously the beta. 

I had 86 and 64 and i installed again both. It´s working perfectly but i don't have the 3d option. 

I've noticed that the program also assumed the same configuration that i've done in beta version, like i didn´t changed anything!

Could anybody help me please!!! :(



Any help will be very wellcome =D "
,danperso,2012-04-30T16:24Z,It's British and japan version only.
,h2ojames,2012-04-30T17:44Z,can someone please explain like I'm a idiot how to get extended I hate photoshop 32 but when I run as  64 it ask to buy it and ask for the trial...
,h2ojames,2012-04-30T17:50Z,someone tell me what I did wrong like im a idiot. I have 32 running but when I run 64 bit it starts a trial? idk what I did wrong
,h2ojames,2012-04-30T18:14Z,I don't know how to use this damn adobe tool thing there are no introductions for it. someone please post a step by step guide cause just opening it obviously doesn't work
,capice1,2012-04-30T18:44Z,"tnx, great post....as always.
any chance of you getting a macversion up here?"
,Krizteena,2012-04-30T18:57Z,I'm sucha n00b I need help installing.
,h2ojames,2012-04-30T19:23Z,okay now I'm not getting the trial im just getting a 0xc000007b error when trying to open 64 bit please for the love of god help me
,CAPTAiN_24,2012-04-30T19:42Z,"U ROCK THE HOUSE !!!!

THANX thingy."
,geebee83,2012-04-30T21:22Z,Works perfectly! Thanks thethingy !
,albconus,2012-04-30T21:43Z,I cannot thank you enough thethingy. Definitely best uploader in TPB.
,rian85,2012-04-30T21:45Z,"ok so i done everything as perfect as i could...when i open cs6..it says something about a graphic processor not responding or something, uncheck it bla bla...but like 5 seconds later it asks to sign in..do i sign it? plz help, i wana use this, but dont know if i should sign in or not...it says i gotta sign in to use the trial version, did i do something wrong?"
,soahs,2012-04-30T23:17Z,rian85 did you disconnect from the internet before installing?  Did you use Adobe Tool to patch the Hosts file before installing?  Do you have Win Patrol installed?  You should.  The little Scotty dog kept barking its head off so I had to deny entries to the start several times.  Did you put the correct dll files in the correct folders?
,hashuboy,2012-04-30T23:42Z,THNXXXXXXXXXX THETHINGY!!!!!as always ur the best man thanku very much for this bud :)
,Elbichu,2012-04-30T23:44Z,"Hi guys I installed it and works good, but it;s not Extended.....How can I get it?...please!!!"
,Elbichu,2012-04-30T23:45Z,"Hi guys I installed it and works good, but it;s not Extended.....How can I get it?...please!!! I'm seeding"
,pjdee,2012-05-01T00:24Z,"I did everything, but, I am getting that I have 28 more days on my trial before I have to buy , when I start the program. Did I do something wrong ??
"
,Zimp,2012-05-01T00:41Z,"@h20james, Kriztina 
Extract>Install>make adobe ID> Sign in>Start Trial>Close PS6>replace DLL Files. start PS6 
should work after that"
,pjdee,2012-05-01T01:23Z,Do I need to reinstall
,LeoJan,2012-05-01T04:28Z,"Works great thethingy! Thank you very much.

The only thing I had to figure out was the extended version, but if you put the original dll files first and then replace them with the other ones the extended version works. I used a trial version before this version, delete the trial version but keeps the the way you set your PS up. I do not know the word in English, but this worked great, even your actions will still work.

I worked with your tool, this gave me a virus warning, but hey, this is thethingy, so I ignored it. It makes live very easy.

I am a happy man! "
,ne3ne3,2012-05-01T05:24Z,"i cant keep the program opened :/ everytime i'm working on a photo it closes, and i have to reopen it, only for it to close again.... "
,mrmut,2012-05-01T05:59Z,"For all of you people having problems, there are like 5 pages of comments. Read through all the comments and surely your questions will be answered somewhere in them. As always ALL Hail @thethingy, thank you."
,damnannoyed,2012-05-01T11:13Z,"Shanks!!!... Just curious, whats da go with the no file extension??.."
,pjdee,2012-05-01T12:43Z,"I've done everything by the book ,but, that darn 28 day trial period keeps popping up everytime I start the program. Is it suppose to ?"
,botakal,2012-05-01T13:52Z,I owe you USD 999.00 thethingy. Thanks.
,botakal,2012-05-01T14:06Z,"@pjdee, maybe you put the dll file in the wrong place, or check your hosts file - make sure it blocks the adobe sites. And it's good to turn off internet before installing photoshop"
,nitrojunkie007,2012-05-01T14:10Z,If I Install only 64-bit version it doesn't show extended.  But If I install Both it Shows extended.  Please Somebody tell me why is this so ?
,WarRobe,2012-05-01T14:55Z,"Put the original dlls first, then put the cracked ones. I`m also was not getting the extended, but I did this little trick and it worked. And if you have 64 machine you only need 64 software"
,ships52,2012-05-01T15:06Z,"Got extended working by putting original dll back then open cs6 run in trial close, then put thethingy dll back all done with internet dis connected. "
,jotap1337,2012-05-01T17:19Z,"Can't get the extended version to work, only the normal one.
Here is the steps I made:

1- Instaled photohop
2- Replaced the Dll files, only the 64 bit, cuz I only got the 64 bit folder.
3- Did the host hing with Adobe tool.
 I got it activated, but no extended, any help?!"
,cnp07,2012-05-01T17:39Z,"Finnaly I get the 3d working. :)

I unnistalled the program using the thethingy tool kit for a clean install. Deleted all the adobe photoshop files, located in the program files. 
Restart. 
Then installed again, only the 64 version. And run cs6 in the trial mode.
Next, I closed cs6 and put the thethingy dll. I did everything with internet disconnected.

Working perfectly! I'm your fan thethingy!!!

Thanks a lot!!!! :) "
,fillyflash123,2012-05-01T18:13Z,Does PS 6 beta need to be uninstalled?
,LeoJan,2012-05-01T18:33Z,"When I try to open a raw file in Bridge with ""open in camera raw"" I get the message ""bridge's parent application is not active"" 
I can however open the raw file by dubbel click the file(s) and then PS CS6 opens first and then the raw converter. 
Somebody a solution? "
