User Type,Username,Date,Text
,BIGboyman,2012-05-05T21:29Z,"I successfully installed CS6 extended. here is what i did. (I have win7 64 bit)

1.) disconnect the internet.

2.) install the .exe in trial mode. I installed 32 and 64 bit.



3.) open the program. it will say ""30 days trial period"". click open as trial. (MAKE SURE TO DO THIS. AT FIRST, I DID NOT DO THIS, INSTEAD I PROCEED WITH OVERWRITING THE DLL FILES, WHEN I OPEN THE PHTOSHOP CS6 I GOT THE CS6 FINAL VERSION AND NOT THE EXTENDED VERSION. )

4.) The DLL files both 32 bit and 64 bit.

32 bit
a. copy and overwrite the 32 bit ( amtlib.dll) to where you installed the program. mine is at c:/program files (x86)/adobe/ adobe bridge cs6.  (IF ADOBE BRIDGE ENCOUNTERS ERROR WHEN OPENING A FILE. THEN BRING BACK THE ORIGINAL 32 BIT (amtlib.dll). These what I did)

b. copy and overwrite the 32 bit ( amtlib.dll) to where you installed the program. mine is at c:/program files (x86)/adobe/ adobe photoshop cs6.

64 bit
c. copy and overwrite the 64 bit ( amtlib.dll) to where you installed the program. mine is at c:/program files/adobe/ adobe bridge cs6 (64 bit).

d. copy and overwrite the 64 bit ( amtlib.dll) to where you installed the program. mine is at c:/program files/adobe/ adobe photoshop cs6.

5.) THATS IT. I GOT THE CS6 EXTENDED VERSION. THOUGH THE ""UPDATES"" IS NOT HIGHLIGHTED. BUT I CAN UPDATE VIA ADOBE WEBSITE. I AM USING THE PROGRAM WITHOUT ANY PROBLEM.

GOOD LUCK.

BY THE WAY, I DID NOT INSTALL THE ADOBE TOOL. I UNINSTALL MY CS5 AFTER INSTALLING THE CS6."
,BIGboyman,2012-05-05T21:36Z,gsdfgsd
,BIGboyman,2012-05-05T21:37Z,"(I have win7 64 bit)

1.) disconnect the internet.

2.) install the .exe in trial mode. I installed 32 and 64 bit.



3.) open the program. it will say ""30 days trial period"". click open as trial. (MAKE SURE TO DO THIS. AT FIRST, I DID NOT DO THIS, INSTEAD I PROCEED WITH OVERWRITING THE DLL FILES, WHEN I OPEN THE PHTOSHOP CS6 I GOT THE CS6 FINAL VERSION AND NOT THE EXTENDED VERSION. )

4.) The DLL files both 32 bit and 64 bit.

32 bit
a. copy and overwrite the 32 bit ( amtlib.dll) to where you installed the program. mine is at c:/program files (x86)/adobe/ adobe bridge cs6.  (IF ADOBE BRIDGE ENCOUNTERS ERROR WHEN OPENING A FILE. THEN BRING BACK THE ORIGINAL 32 BIT (amtlib.dll). These what I did)

b. copy and overwrite the 32 bit ( amtlib.dll) to where you installed the program. mine is at c:/program files (x86)/adobe/ adobe photoshop cs6.

64 bit
c. copy and overwrite the 64 bit ( amtlib.dll) to where you installed the program. mine is at c:/program files/adobe/ adobe bridge cs6 (64 bit).

d. copy and overwrite the 64 bit ( amtlib.dll) to where you installed the program. mine is at c:/program files/adobe/ adobe photoshop cs6.


BY THE WAY, I DID NOT INSTALL THE ADOBE TOOL. I UNINSTALL MY CS5 AFTER INSTALLING THE CS6."
,BIGboyman,2012-05-05T21:39Z,"I successfully installed CS6 extended. here is what i did. (I have win7 64 bit)

1.) disconnect the internet.

2.) install the .exe in trial mode. I installed 32 and 64 bit.



3.) open the program. it will say ""30 days trial period"". click open as trial. (MAKE SURE TO DO THIS. AT FIRST, I DID NOT DO THIS, INSTEAD I PROCEED WITH OVERWRITING THE DLL FILES, WHEN I OPEN THE PHTOSHOP CS6 I GOT THE CS6 FINAL VERSION AND NOT THE EXTENDED VERSION. )

4.) The DLL files both 32 bit and 64 bit.

32 bit
a. copy and overwrite the 32 bit ( amtlib.dll) to where you installed the program. mine is at c:/program files (x86)/adobe/ adobe bridge cs6.  (IF ADOBE BRIDGE ENCOUNTERS ERROR WHEN OPENING A FILE. THEN BRING BACK THE ORIGINAL 32 BIT (amtlib.dll). These what I did)

b. copy and overwrite the 32 bit ( amtlib.dll) to where you installed the program. mine is at c:/program files (x86)/adobe/ adobe photoshop cs6.

64 bit
c. copy and overwrite the 64 bit ( amtlib.dll) to where you installed the program. mine is at c:/program files/adobe/ adobe bridge cs6 (64 bit).

d. copy and overwrite the 64 bit ( amtlib.dll) to where you installed the program. mine is at c:/program files/adobe/ adobe photoshop cs6.


"
,BIGboyman,2012-05-05T21:45Z,"I APOLOGIZE FOR THE REPEATED POST. I'VE GOT A SERVER PROBLEM I GUESS. At first my post is not showing up even after refreshing it, so i repost it so many time.

I am so sorry for flooding. it was not my intention. forgive me."
,hyper_2002,2012-05-05T22:13Z,"I confirm... After patching with amtlib.dll files Updates in each programm (even in CS6 Master Suite) are not highlithed... Looks like after cracking updates are completely disabled... Weird cause in CS5.5 Master Suite with the same method of patching Updates were working without problems... Any solution ?? 

PS.

In Acrobat X updates are working fine... however I doubt if the adobe updater stared from Acrobat looks for updates for other adobe products.... "
,Buzzlightyear7,2012-05-05T23:05Z,"HI people. I just have a question before downloading. if i disconnect from internet and install perfectly, can i be online after installing it. This may seem like a dumb question, but i have cs5 and i have to disconnect every time i want to use it, otherwise it says invalid key and then i need a new one. Please Answer"
,NYTropix22,2012-05-06T00:27Z,"@thethingy Great release, thank you, u rock!..ARe u coming up with AE CS6? By the way, people--The install instructions are clearly included in program"
,sexyface,2012-05-06T03:32Z,@Buzzlightyear7  its doing that because you havent done the host file down load adobe tool like the thing sais and patch the host and you wont have any problem... witch cs6 or cs5 when going on the net.... it blocks adobe sending out to look at the serial 
,anudoc,2012-05-06T04:08Z,"another way of making this torrent work and it has worked well for me

donload the adobe photoshop cs6  crack by k0r

run the exe file in trial mode

do not close the application

insert the registry file amtlib.dll into the adobe photoshop cs6 folder in the c drive program files

then run the crack as given by k0r according to your os type
it should say patch successfull

now close the adobe application

reboot  and it works

the only problem is that my laptop it says cs6 extended while on my desktop it says only photoshop cs6

why i dont know

"
,anudoc,2012-05-06T04:10Z,do disconnect the internet before using this torrent otherwise you would be asked to sign up before running the application
,Buzzlightyear7,2012-05-06T11:40Z,@sexyface thanks a lot! i am now 70% finished downloading. Cant wait to use it!
,pwningable,2012-05-06T19:28Z,Can you get updates with the normal Adobe Update Tool or how can you get updates?
,yashaka71107,2012-05-06T21:04Z,"thank you so much thethingy , i got everything's like it's said..EXTENDED!!!!!"
,quakerray,2012-05-06T21:39Z,"hi, installed ok, disabled internet in installation.
tranferred dll 64 bit file over.
rebooted
opened up photoshop cs6 and its asking me to sign in to use trial"
,quakerray,2012-05-06T22:07Z,"signed into my  adobe id, ok
im guessing theres no serials yet to use, will this cease after thr 30 days"
,Jashilthis,2012-05-07T04:44Z,"@thethingy
works great, thanks."
,jedimoose,2012-05-07T09:27Z,Worked perfect! You deliver yet another flawless setup Thingy! 
,GreenDiary,2012-05-07T19:49Z,How come the Camera RAW doesnt have any recovery option?
[T],Spetses,2012-05-07T21:16Z,"I guess your not the most popular guy at Adobe,keep up the fantastic work you have been doing for the last few years.Many thanks for a great upload,works like a dream."
,eShaYz1,2012-05-07T23:21Z,Thanks I used the Adobe Tool method as i found it way easier This is a great crack all of your adobe cracks are and we all appreciate the time and effort you put into these cracks  P.S if you are having trouble with installation there is a wide range of youtube tutorials... Hope i helped!
,Graphixr,2012-05-08T00:47Z,"Hey Mr. [thethingy].. Nice torrent...

but when I search about the New Adobe CS6 extended.. this happens to be the Photoshop cs6.. not the Extended Version.. 

hope you publish to real extended soon.. 
keep it up.."
,Graphixr,2012-05-08T00:52Z,what i mean is that when I searched about the CS6 splash screens... it is not the one that I expected .. After I installed.. I just easily recognized that this photoshop is not the extended version.. 
,crysisftw,2012-05-08T10:24Z,"thank a lot thethingy. u are the best.. one thing though, ummm, i cant find 3D settings in this version. is this really extended version?"
,willy647,2012-05-08T11:03Z,"This IS the extended version, all the 3D functions are there.

Did you all read the remarkt on the Adobe site re CS6 ??
""3D features and some GPU-enabled features are not supported on Microsoft® Windows® XP."""
,willy647,2012-05-08T11:12Z,"Those who complain about the extended version, did you read the comment on Adobe website ?
It says :
""3D features and some GPU-enabled features are not supported on Microsoft® Windows® XP."""
,quakerray,2012-05-08T11:12Z,can someone answer my question about the 30 day trial. does this just stop working.when will serial keys be released
,sunsetrider,2012-05-08T11:21Z,This is not the extended version and there is no 3d options in this. Fyi im using gpu supported pc
,sunsetrider,2012-05-08T11:29Z,okay problem fixed! you need to put back the original dll files and start up trial before cracking photoshop
,santoro80,2012-05-08T15:52Z,There is only Photoshop installation file in the torrent. I dont see any crack or patch...
,santoro80,2012-05-08T21:10Z,"oh, all the files are in one exe file, sorry.
anyway, Bridge allways crashes during opening of RAW file... does anybody found solution for this?"
,nikonians,2012-05-08T22:13Z,"Hi i download the software . Switch off internet download software and run in trial version. Replaced the dll  32 bits and the 64 bit dll. ( i got 64 bit)..... Run the program but it is still on a trial version. Check system info by going thru help, system info, checked the serial and it says trial version. Is this alright ? Or i am missing sonething? Thanks"
,Chuddee,2012-05-08T23:24Z,"Dont bother this torrent it's not the full version. 

Being as you have to install this as a Trial you're missing features. For instance all the ""artisitic"" Filter effects are missing when you install this as a trial, and a few other things are missing too. 

The Thingy always does this shit! He done the same with CS5 and it was pointed out then. If you want the FULL Photoshop CS6 then you NEED to install it using a serial. Using Trial mode will install PS CS6 with missing features and filter effects. "
,Dirk_07,2012-05-09T00:15Z,"This is not the real thing. Other dan adobe PhotoShop CS5 Extended and adobe PhotoShop CS5.1 Extended there are missing various capabilities of the program.

The cause of this is the new adobe applicationmanager wich doesn't allow you to put in a serial without internet connection.

Adobe PhotoShop CS5 Extended and Adobe PhotoShop CS5.1 Extended can be cracked without a cracked amtlib.dll ( signature in that file is changed ). This torrent uses a cracked dll file and various 3D functions aren't available and updating of the program or deactivating it is only possible when you have a degree in computing.

When you in the menu System info when adobe photoshop cs6 is installed you can see that it only is an evaluation version in spite of not seeing the 'reminder screen'

In my opinion uploaded to fast without good and flawless crack.

In spite of that thx for your efforts Thingy.

Keep up the good work."
,diamonddogs,2012-05-09T01:34Z,"@Chuddee and Dirk_07,
I can assure this the fully functioning CS6 extended with 3d and all filters working(check out jpeg)http://farm8.staticflickr.com/7211/7161321870_b946d2e327_b.jpg
What you have do is disable antivirus and disconect from internet,install as trial close program then open and close.Then copy the dll into the cs6 directory and now copy&paste the host file in system32/drivers/etc/host.
Restart pc and you'll find your the proud owner of CS6 extended."
,haydnos,2012-05-09T03:19Z,Ridiculously easy and seamless install. Many thanks as usual thethingy!
,botakal,2012-05-09T07:45Z,"Dear noobs,
Simple instructions. Even an elementary student can follow it. If you're still not sure of the included instructions, read the comments.   "
,graphicbull2010,2012-05-09T09:01Z,Hell of a torrent! Grazias @thethingy!
,missoula26,2012-05-09T09:51Z,not working I spend 3 hours looking for solution and nothing :( Do not download this rubish
,diamonddogs,2012-05-09T10:21Z,"@missoula26,
See my post on page 10."
,uheardmebitch,2012-05-09T10:49Z,"missoula26 i'm not sure what ur doing wrong. maybe u can elaborate instead of just throwing a tanty? it works perfectly. i have it open right now, been using it for a week. nothing is missing, the crack is easy, installation is a breeze. BE SURE ABOUT THIS. the torrent is fine, you however suck astronomically. one of these things you can fix, the other already works fine"
,willy647,2012-05-09T14:47Z,"I can only confirm I got the extended version working just by following the instructions. Easy go!!
Whatever thethingy posts works. If you can't get it to work, look at yourselve instead of shooting at the piano player.
Be aware 3D does not work on XP - you need W7.
"
,WarRobe,2012-05-09T14:56Z,"missoula26, I think your main problem is between the chair and the computer.
;-)"
,Chuddee,2012-05-09T15:37Z,"@diamonddogs

No it's not the full version. Yes the method to install this works, and i have 'extended' version and the 3D effects. 

But theres still missing things like the ""Artistic"" or ""Brush Strokes"" or ""Texture"" filter effects, just got to the Filter menu and have a look! None of these filter sub menu's are there when they should be. The ONLY way to get these effects is to install Photoshop CS6 using a serial. This has been the case with previous versions as well. Using Trial mode does NOT install everything, and it's been this way for years, people should know this by now!"
,soahs,2012-05-09T16:37Z,"@chuddee I have all the filter effects - artistic, brush strokes, distort, sketch, stylize, texture.  Look under filter/ filter gallery"
,diamonddogs,2012-05-09T16:49Z,"@Chuddee,
Well if i go to filters/filter gallery guess whats there ""Artistic"",""Brush Strokes""and ""Texture"" filter effects.Check out the image link below.
http://farm8.staticflickr.com/7085/7164938036_d683ef45a6_b.jpg"
,Chuddee,2012-05-09T17:24Z,"@soahs 

@diamonddogs

You're right! They've just moved these filters lol. They used to be directly under the Filter menu. I assumed they wasn't there at all because previous versions of Photoshop did not install everything when you installed it as a Trial. 

So anyway, this works perfectly then. Everything is there. I take back what i said before! :)"
,seta666,2012-05-10T01:23Z,"I can not use camera raw in Bridge
I get the following message 
""Camera Raw editing is not enabled""
"" Camera Raw editing requires that an qualifying product has been launched at least once to enable this feature""

I have launched bridge from Photoshop but nothing changes

It does work on PS

Regards"
,morlok,2012-05-10T02:03Z,multi or english only?
,diamonddogs,2012-05-10T11:00Z,"@seta666,
I had the same problem as you with camer raw in bridge.But it's a simple fix just copy the original dll into the bridge directory and bingo camera raw in bridge."
,yoalch,2012-05-10T12:43Z,"Is this 64-bit only?
Cause I'm running win7 32-bit and I can't seem to install it. In the error summary, it mentions something about 64-bit."
,geo__,2012-05-10T18:38Z,"Hey guys, i ve installed it and all is working well until i start to use more of the things like clone stamp and doing some new layers... cs6 is freezing and using 100% from cpu...any ideas of what can be the problem? Thanks! P.S. cool new stuff!"
,cainabel,2012-05-10T19:43Z,Brilliant work. Very comprehensive torrent with full instructions - works brilliant - including 3D using Vista 32 bit. This guy's the best
,Noxsy,2012-05-10T21:35Z,"Amazing torrent works great! :D

But...

Im trying to work with a RAW file i double click it and it opens up Photoshop... then photoshop says 

""Photoshop cannot open this file""
""If  you are attempting to open a raw file from a digital camera, make sure you have the latest camera raw update installed via help > updates..

If the problem persists, visit the following link for more information:""

Well i have looked up my camera and its compatiable for Camera raw version 4 ... and it says on photoshop its version 7 ? Why is camera raw not working for me ?! Help please x"
,diamonddogs,2012-05-10T22:04Z,"@Noxsy,
What camera are you using?"
,jpg055,2012-05-10T22:34Z,"@diamonddogs 
Where can i find the original dll, i replaced it, when i first intalled photoshop & bridge.! you mean i have to reinstall?? Thanks for your help, i really need Camera Raw!!"
,Noxsy,2012-05-10T23:06Z,"@diamonddogs

Im using a Cannon ESO 1000D... it says its compatible for version 4? but CS6 has version 7 ? its odd... :/"
,diamonddogs,2012-05-10T23:31Z,"@jpg055,
With ""thethingys""upload there is a folder named DLL FILE,inside here you will find original 32bit and 64bit open what version you have.
There you will see two folders photoshop and bridge open bridge and copy the AMTLib.dll and paste it into the bridge directory."
,MB0SS,2012-05-11T00:14Z,"Hi
i mange to fix problem  for those who lost EXTENDED EDITION after cracking photoshop cs6 with amtlib.dll both on 32bit & 64bit download my fix run it and you will get back ADOBE PHOTOSHOP CS6 EXTENDED EDITION

Download Link medifire

/?5j9bst10ham4ms1

MB0SS"
,MB0SS,2012-05-11T00:15Z,"Hi
i mange to fix problem  for those who lost EXTENDED EDITION after cracking photoshop cs6 with amtlib.dll both on 32bit & 64bit download my fix run it and you will get back ADOBE PHOTOSHOP CS6 EXTENDED EDITION

Download Link

m-e-d-i-a-f-i-r-e.com/?5j9bst10ham4ms1

MB0SS"
,diamonddogs,2012-05-11T00:33Z,"@Noxsy,
Yes that is odd i could understand it if you had a new camera thats just come on the market.
The only thing i could think of doing,which is a pain,is to uninstall and reinstall.
After uninstall use some sort  adobe clean tool or maybe ccleaner to clean the registry."
,rian85,2012-05-11T06:38Z,"hey, has anyone else had there brushes just disappear? i mean, i opend it 2day, and looked at my brushes, and i got all the preset brushes :/ idk if i accidentally hit the reset brushes, but im sure i didnt. any help?"
,Carnell_Whoaaa_Nelly,2012-05-11T09:09Z,Dont laugh you guys I know im a Noob at this...So i downloaded the adobe tool v2.1 and i tried following the instructions but i have no idea what a DLL folder or file is and i have no idea how to get this started can somebody please walk me through how all of this works after Ive downloaded the program? Please and Thank You
,diamonddogs,2012-05-11T11:45Z,"Trying out the video and can't get no audio.If i import audio it plays, but does'nt play the audio already with the video.
Tried different audio formats but still wont play.
Anyone know a fix for this?"
,killua-uchiha,2012-05-11T12:37Z,"Whats up with the flag ?!  THe picture isn't for you to post an emblem, but a pic related with the product, for an example the package cover ..."
[V],thethingy,2012-05-11T13:12Z,"killua-uchiha, shut up. "
,MyDadsDog,2012-05-11T13:18Z,"IMPORTANT!
For those who are having problems installing this as the ‘EXTENDED VERSION’.
You need to actually start Photoshop BEFORE swapping the cracked DLL’s over and choose ‘start trial’.
Once Photoshop has loaded, close it down and THEN swap the DLL’s over, you will now have a fully working Extended version of Photoshop.
Many thanks by the way to thethingy for your commitment and hard work."
,MyDadsDog,2012-05-11T13:23Z,"*
Please note that I use the word 'loaded' NOT installed."
,hoggdoc,2012-05-11T16:05Z,Looking for MAC version my searches are not finding CS 6 Extended yet.   ANYONE?
,Arbiter89,2012-05-11T17:24Z,"@hoggdoc 
The solution is rather simple, don't use something as shitty as a mac. They are overpriced, and have shit performance."
,Carnell_Whoaaa_Nelly,2012-05-11T17:28Z,What does DLL Mean ?! PLEASE HELP i dont know how to do any of this
,mexicomatt,2012-05-11T18:51Z,x
,soahs,2012-05-11T18:54Z,"@mboss I'm not sure what to think of your post/ fix.  In case newbies would fall for it, I would advise them and anyone else not to download.  I have an extra computer, downloaded your fix and ran it in a sandbox.

After clicking on the exe file (only that one file was in the download) all that happened a flag appeared waving in the breeze.  That's it.  

Just to be totally safe I put an image of my operating system back afterwards.

I don't know what you are trying to do, but as thethingy has provided us with the original dll files to fix any Extended problem, your fix isn't needed.  And I am suspicious that you would go to all the trouble of providing a flag waving in the breeze when simply restoring the original dll fixes the problem."
,pnonsense,2012-05-11T22:53Z,"First of all, I just wanted to say thank thethingy. All of your uploads are amazing. Thank you for your hard work and dedication. I downloaded the torrent and followed the instructions and everything worked fine at first. However, now it opens up and I get this message ""Photoshop detected graphics hardware that is not officially supported. If you experience problems, please uncheck the Use Graphics Processor checkbox in the Performance panel of the preferences dialog."" After I exit out of that window and try to open up any picture, my computer notifies me that photoshop has stopped working and it immediately freezes up and exits out of Photoshop. I have no idea what is wrong? I even tried to uninstall and reinstall and the same thing is happening. Somebody please help? :/"
,CrankyAVM,2012-05-12T00:09Z,"This looks like it's working great for me, thanks thethingy. Question though: why are there original DLLs included for Bridge and Photoshop folders but the cracked DLL folder only includes Photoshop DLLs?"
,TheBest7,2012-05-12T12:16Z,"This is the normal edition, not extended... at least on 32 bit."
,TheBest7,2012-05-12T12:42Z,"Hey, thank you, but at least the 32 bit version is the Standart edition and not extended... could you please check it out?"
,youtube_xadam123,2012-05-12T14:31Z,"Works perfectly, thanks"
,supasolja1,2012-05-12T19:18Z,Thanks thethingy as always for a great torrent! Those of you who are having trouble just READ THE INSTRUCTIONS given in the torrent...
,seta666,2012-05-12T19:20Z,@Diamonddogs  Thank you but moving the DLL did not solve the Brifdge camera raw issue; besides I installed noise ninja and when tried to run it Photoshop would crash. I just went back to CS5
,somesayimemo,2012-05-12T21:34Z,"I've been using this for two days now. Followed the install directions and it works perfectly w/windows 7 64-bit. I did have to update a driver in order to get ""oil paint"" to work but other then that, this was an easy install. One of many great torrents from thethingy."
,CloudyDream,2012-05-12T22:02Z,Can this run an Intel pentium (R) processor?
,blancob,2012-05-12T22:07Z,"somesayimemo, how did you upload that driver?  Did you have to re-install?  Great upload as usual thethingy is a modern day hero. "
,tcbar,2012-05-12T23:56Z,"Downloaded per all instructions, ran trial   aftr replaced the ddl's , all is working great except the updates links are greyed out. Any help would be greatly. Thanks"
,tcbar,2012-05-13T00:01Z,"Downloaded  followed insructions, started trial, stopped replaced ddls programs working great only 1 small problem . the update likes are greyed out. Any help would be great
Thanks"
,trivaga,2012-05-13T00:24Z,"I am rally sorry for the stupid question, but I have a problem with the instal. Aster I downloading the torrrent, windows asks me which program  to use to open the downloaded file. 
Please help me!"
,nourmed,2012-05-13T01:53Z,"Works great, many,many thanks Thethingy ..... and I confirm it's the extended version....for all of you having problems , just  follow the steps provided by ""soahs"" on page 3 and  that's it ..... and for those looking for the 3D tools you'll find them on the option bar for the move tool ( chose the move tool an you'll find them on the right)"
,rubys,2012-05-13T08:33Z,"Can any one help me? I am new here. I installed Adobe Photoshop cs6. But when I try to open it an error message desplayed. "" The procedure entry point Get Logical Processor information could not be located in the dynamic link library KERNEL32.dll.
   Please help me"
,Sonnybrimon,2012-05-13T13:35Z,Thanks thethingy....you're the man..perfect...but I got some problem with the adobe brige....it became the default explorer for my folders..everytime i open a folder it uses bridge instead of windows explorer...i cant get this fix..need a help for this..thanks
,soahs,2012-05-13T15:25Z,"@rubys see here:
http://forums.adobe.com/message/4222772#4222772

Sounds like your machine needs Service Pack 3.  Am assuming you have XP?"
,The_End_Is_Near,2012-05-13T15:53Z,wait how do you do this?
,rubys,2012-05-13T16:16Z,"@sohas
Thank you for your sudden reply. Yes, I use xp. My Laptop is DELL INSPIRON 1545. Now I am using Adobe photoshop cs5.1. Thank you very much."
