User Type,Username,Date,Text
,zvengar,2012-08-16T16:27Z,"not readible ,,even changed it to a zip file like jave explains..

nothing in the files are readible.

i have this series on audio book but would like in hard back."
,jemak17,2012-08-16T17:21Z,@zvengar this is a java application. copy it to your device (cellphone or anything) that is java capable then run/install it.
,zvengar,2012-08-16T17:59Z,"The computer is all i have.

So unless you can convert them to Adobe or Microsoft office, note pad would be even better..

These files do me no good, i've tried to change them myself with no success."
,jemak17,2012-08-16T18:43Z,I just uploaded the html and lit version. try here https://thepiratebay.se/torrent/7537977. pls rate ^^
