User Type,Username,Date,Text
,Jrdao,2012-05-29T22:34Z,"I am so sad because your page was great, so never mind you are the best."
,kreyng,2012-05-30T12:17Z,"hi i'm really new to this and i just wanna ask, if i'd like to play the latest version, what should i do? should i download an old version and then download updates or are there installers for the latest version so that i don't have to update anymore. please help. thanks :)"
,prg10,2012-05-30T14:38Z,"This file is an update, please reinstall 7.32 (http://thepiratebay.se/user/kompas909/) and follow the patch."
,kreyng,2012-05-30T15:52Z,thanks ;)
,jonaspt,2012-05-30T22:08Z,"all the other patches were going great and now this patch ruined the game for me.

whenever i try to join a game on gamespy i get ""join failed failed to join the game""

If im the host my friends get ""join failed"" and my friends are having the same problem they can't host or join since they installed this patch :"
,kompas909,2012-05-30T23:08Z,"Hmm, strange, well, try roll back, or wait for 7.36"
,banditco112,2012-05-31T11:27Z,Anyone else having issues with this patch?
,jonaspt,2012-06-01T03:39Z,and now this patch gave me a horrible diarreah! so liquid and smelly IUK
,Doziness,2012-06-01T22:51Z,This patch works fine for me on Tunggle. Thanks again Kompas.
