User Type,Username,Date,Text
[V],azizex666,2012-10-24T02:43Z,"Cover Images/Description here
https://forum.suprbay.org/showthread.php?tid=123060&pid=811079#pid811079"
,longtan2,2012-10-24T09:51Z,thanks azizex666
,Hghway61,2012-10-24T15:29Z,"Thanks, Aziz! Great work."
,carrollm5,2012-10-27T16:42Z,"Your torrents are awesome, actually the best out there! Your tags are clean and the book covers are perfect. I really appreciate the care and effort you put into creating these torrents.
How far back in the Booker Awards are you planning to go? I wish you would consider The American Book Awards, a lot of great books are on that list!
Thank you so much!"
[V],azizex666,2012-11-01T23:16Z,"@carrollm5
I'll go as far back as I can with the Man Booker lists. 
I'll Look into The American Book Awards."
