Filename,Size,Unit
2011-08-20 - Paul Godfrey - DS - The Wheat   The Tares.mp4,730.46,M
2012-05-05- Paul Godfrey - Singing or Stinging.mp4,702.25,M
2012-05-12- Paul Godfrey - She Loves Me She Loves Me Not.mp4,528.85,M
600 Volumes - POtHS Torrents seeded 7-4-2012.rar,69.71,M
Fine Tuning Into Gods Voice - 05 - Paul Godfrey - The Voice of Duty.mp4,728.83,M
POtHS - Why We Do What We Do.txt,7.89,K
Shorts/Abortion MURDER Repent or PERISH Will you take a stand.flv,42.99,M
Shorts/As America Has Done to Israel - PART II - YouTube.flv,15.88,M
Shorts/As America Has Done To Israel - YouTube.flv,17.55,M
Shorts/David Wilkerson-A Call to Anguish - YouTube.flv,65.5,M
Shorts/Home Bible Studies illegal in America - YouTube.flv,15.11,M
Shorts/Merk Scientist Dr M Hilleman Admitts SV40 AIDS and Cancer in Vaccines.webm,19.01,M
Shorts/Mind Control HAARP mind control used in Iraq.flv,52.99,M
Shorts/Pink Bibles recalled linked to Planned Parenthood mammogram promotions.flv,4.66,M
Shorts/Sackcloth Ashes I PET GOAT II LUCIFERS REDUX REVEALED PART I.flv,28.23,M
Shorts/The Beauty Of Gods Creation  The Heavens Declare The Glory Of God.mp4,242.93,M
Shorts/The Three Angels Message The Third Angel - YouTube.flv,4.95,M
Shorts/USA  Catholic Church guilty of covering up sex abuse in Kansas City - YouTube.flv,6.43,M
Shorts/Why was Christmas banned in America until 1820 - Unwrapping Christmas.flv,122.39,M
Shorts/Wretched  The Views Uneducated View - YouTube.flv,6.81,M
Signs of the Times/11 Kids Sick Cause  Unknown Parents Blindly Trusting School Officials 6-1-12.webm,11.34,M
Signs of the Times/Alien Hybrid Human Baby Found In Peru  - YouTube.flv,25.07,M
Signs of the Times/American Bank Runs - 7 Day Restriction on Bank Withdrawals - YouTube.flv,13.16,M
Signs of the Times/American Banks Funded The Nazis - YouTube.flv,24.84,M
Signs of the Times/Bioactive Chemical Turns Up On Money - YouTube.flv,15.02,M
Signs of the Times/Clear Evidence FDA Officials Have ZERO Interest In Protecting The American Public.flv,9.18,M
Signs of the Times/Doctored Family Album Image Deepens Obama Mystery.flv,16.28,M
Signs of the Times/DRONE BILLBOARDS What Are They Trying To Tell US  - YouTube.flv,2.52,M
Signs of the Times/Fluoride is Toxic Waste.mp4,33.51,M
Signs of the Times/Former Argentine President Convicted Of Kidnapping Children.flv,14.48,M
Signs of the Times/FTC and Facial Recognition - YouTube.flv,9.86,M
Signs of the Times/HA-HA FLASHBACK   Obama attacks George Bush trying to hide behind Executive Privilege 3-19-07.flv,3.26,M
Signs of the Times/Important  US West Coast to receive dangerous levels of Fukushima radiation.flv,11.93,M
Signs of the Times/Lawmakers lose election but refuse to leave - YouTube.flv,10.21,M
SIN-ister Clips/Syriagate  WikiLeaks releases Syria Files 2.5 mln emails to be published.flv,15.66,M
SIN-ister Clips/The empire strikes hack  UK to fight cyber foes with their own weapon.flv,7.88,M
SIN-ister Clips/The Euro Has Collapsed - Letter to Steve Quayle - YouTube.flv,17.7,M
SIN-ister Clips/The Great TV Licence Scam  - YouTube.flv,42.54,M
SIN-ister Clips/The Secret US - Japan Nuclear Program - GRTV Feature Interview.flv,81.69,M
SIN-ister Clips/Trailer2.avi,27.11,M
SIN-ister Clips/Tsunami Debris Clean-Up On US Shores May Take Years.flv,15.73,M
SIN-ister Clips/ULTIMATE POLICE BRUTALITY.flv,18.14,M
SIN-ister Clips/US Military Blamed For Polluted Water At Base.flv,11.42,M
SIN-ister Clips/US schools declare war on kids - YouTube.flv,36.96,M
SIN-ister Clips/US spy bases taking over parts of the UK - YouTube.flv,14.55,M
SIN-ister Clips/Washington Times Columnist - Jeff Kuhner Ballistic Over Arpaio Investigation.flv,9.16,M
SIN-ister Clips/Why You Should Care - GMOs on your plate.flv,10.29,M
SIN-ister Clips/Zombie Americans Dont Know What Memorial Day is For.flv,77.01,M
The Holy Spirit/2011-10-15 - Stuart Kinnon - Knowing Our Creator.mp4 - YouTube.mp4,508.23,M
The Holy Spirit/ACABO DE VER A JESUS - Ive Just Seen Jesus.mp4,214.26,M
The Holy Spirit/Brandon Heath - The Light in Me.flv,11.91,M
The Holy Spirit/BT Daily  Daniel Part 1 - Do You See the Handwriting on the Wall  - YouTube.flv,10.73,M
The Holy Spirit/BT Daily  Daniel Part 2 - Is Your Integrity Intact  - YouTube.flv,10.46,M
The Holy Spirit/BT Daily  Daniel Part 3 - Do Your Prayers Get You Through the Night  - YouTube.flv,9.76,M
The Holy Spirit/Come to Jesus - YouTube.flv,3.71,M
The Holy Spirit/Cross Connection Band - Hallelujah Christ Jesus Is King (feat. Debs Kislingbury-Boivie) - YouTube.mp4,33.37,M
The Holy Spirit/Dara Maclean - Free - YouTube.flv,9.53,M
The Holy Spirit/David Garibaldi  Jesus Painting on Vimeo.mp4,12.72,M
The Holy Spirit/Ecumenism False Shepherds and Doctrines of Devils.flv,109.29,M
The Holy Spirit/Forever by Michael W Smith.flv,25.63,M
The Holy Spirit/Freemason Timeline Decoded - 2012   2016 Antichrist   Bible Prophecy  - YouTube.flv,18.82,M
The Holy Spirit/Hillsong  Here I Am To Worship   Call Worship.flv,61.27,M
Torrent downloaded from Ahashare.com.txt,47,B
Torrent downloaded from Conspiracyhub.com.txt,47,B
Torrent downloaded from Demonoid.me.txt,47,B
