Filename,Size,Unit
On Guard Conference 2012  William Lane Craig - What Is Apologetics.mp4,496.55,M
Testimony - From Evolutionist to Creationist - Walter Veith.avi,351.09,M
Gods Cartoonist - The Comic Crusade Of Jack Chick.avi,249.41,M
And More/Signs of the Times/Phoenix Police now using K9's as warrants to randomly search houses.avi,247.77,M
Placebo a wake up call to the Church by Howard Pittman.avi,203.61,M
The Testimony of Tom Cantor Completed Jew.flv,197.83,M
Shorts/A Tale of Two Men.mp4,182.31,M
And More/The Holy Spirit/Ask The Preacher - WHY SO MANY RELIGIONS  - with Carl Gallups.avi,157.45,M
Fomer Illumanist Testimony.avi,148.53,M
Sex Drugs and Rock Music by Barry Westbrook.avi,145.31,M
Sharing the Gospel - Charlie Campbell.flv,124.36,M
My Life Story by Phil Shuler.avi,119.4,M
And More/The Holy Spirit/Signs of the Times Part 3 - OPEN YOUR EYES SO THAT YOU MAY SEE.flv,101.88,M
And More/SIN-ister Clips/We should prepare ourselves for ET exposure going mainstream.avi,93.19,M
World's Strongest Man Paul Anderson.avi,88.7,M
And More/The Holy Spirit/23 Minutes In Hell - Sid Roth Interviews Bill and Annette Wiese.flv,79.49,M
And More/War and Rumors of Wars/Beheading in Islam_ Islamic Honour Killings..avi,76.93,M
And More/Signs of the Times/On the brink of World War 3 - Part 1.avi,72.73,M
And More/SIN-ister Clips/Teen fights back against tracking chips in school ID cards.avi,68.75,M
And More/SIN-ister Clips/RFID 666 Teen fights back against tracking chips in school ID cards !.avi,68.66,M
And More/SIN-ister Clips/Will Community Banks Disappear At The End Of The Year.avi,67.51,M
And More/Signs of the Times/Proof UFOs are making the strange sounds around the world.avi,61.95,M
Shorts/RSA Animate  The Truth About Dishonesty.flv,61.18,M
Shorts/Introduction to the CAFR - Why You Cant Get Ahead.flv,59.67,M
Shorts/The Shame Game.flv,53.92,M
And More/Signs of the Times/Obama's Cybersecurity directive could allow military deployment within US.flv,48.02,M
And More/War and Rumors of Wars/Egypt Mursi the new Pharaoh_ fierice king will envoke Sharia Law Isaiah 19 11-23-12.avi,41.71,M
Shorts/THE SPIRITUAL WAR IN POLITICS -- Zeph Daniel.flv,39.5,M
And More/War and Rumors of Wars/Endtime News Updates 11-17-12.avi,37.64,M
Shorts/Counterfeit Gods    Spoken Word    Jefferson Bethke.flv,37.48,M
And More/The Holy Spirit/Counterfeit Gods    Spoken Word    Jefferson Bethke.flv,37.48,M
And More/SIN-ister Clips/US suspected in malware attack on French Pres Sarkozy 11-24-12.avi,36.05,M
Shorts/Christian Persecution by David Wilkerson.flv,35.82,M
And More/SIN-ister Clips/SANDY UPDATE_ Nov. 13_ 2012.avi,34.27,M
And More/The Holy Spirit/April McLean - Inside Out - Copy.mp4,33.25,M
And More/The Holy Spirit/A Mighty Fortress - Christy Nockels (2).flv,30.79,M
Shorts/Whats the Big Deal about the KJV - Sam Gipp.flv,30.42,M
And More/Signs of the Times/Mystery 50_000 STARFISH Beached DEAD in UNITED KINGDOM IRELAND 11-15-12.avi,28.76,M
And More/The Holy Spirit/And Your Praise Goes On - Chris Rice - lyrics.flv,27.5,M
And More/SIN-ister Clips/Rockets Fired from Egypt Hit Israel Egypt  PM Express Solidarity with the Palestinians.avi,27.08,M
And More/The Holy Spirit/Animal LOVE.flv,25.05,M
And More/Martyrs of Today/Imams convert to Christ.avi,24.33,M
And More/SIN-ister Clips/Towards Global Economic Collapse Update.avi,24.29,M
And More/The Holy Spirit/Britt Nicole - The Lost Get Found - Instrumental lyrics.mp4,23.84,M
And More/Signs of the Times/Rapidly spreading disease affecting Hawaii coral.avi,23.6,M
And More/The Holy Spirit/Chris Tomlin Matt Redman - The Wonderful Cross.flv,22.52,M
And More/Signs of the Times/New Pharaoh Military fascism replaced by Islamofascism in Egypt.avi,22.08,M
And More/The Holy Spirit/Draw me close to you Michael W Smith.flv,21.38,M
And More/Signs of the Times/Radiation Fukushima Report 11-8-12.flv,21.31,M
And More/Signs of the Times/Police chief killed in Libya's Benghazi 11-20-12.avi,20.7,M
And More/Signs of the Times/Obama Pres Memo_ Insiders will be Mitigated.avi,19.69,M
Shorts/pray repeatedly.avi,18.85,M
And More/SIN-ister Clips/Study Shows Proteins Cannot Evolve.flv,17.24,M
And More/SIN-ister Clips/Staten Island borough president blasts Red Cross.flv,17.08,M
And More/The Holy Spirit/BT Daily  Treasure on Fire.flv,14.01,M
Shorts/The Seal of God.flv,13.75,M
And More/Signs of the Times/Moon city photographs.avi,13.63,M
And More/The Holy Spirit/Divine Forewarning to Israel  in Today's End Times.flv,13.57,M
And More/SIN-ister Clips/The Myth We Use 10% Of Our Brains.avi,12.09,M
And More/SIN-ister Clips/SINKHOLE UPDATE 11-27-12.avi,11.76,M
Shorts/Christians Fired For Not Counseling Gay Couple Wearing Cross.flv,10.84,M
Shorts/Wretched  Christian Doubt vs Defection.flv,10.44,M
Shorts/Zombie Attack Victim Ronald Poppo Recovery Assistance.flv,10.25,M
Shorts/Stephen Hawking and God.webm,7.61,M
And More/Signs of the Times/Pentagon developing Submarine Drones.avi,7.32,M
And More/Signs of the Times/Bionic Hand Gives New Lease On Life.flv,7.1,M
And More/SIN-ister Clips/SINKHOLE UPDATE  11-14-12.flv,4.94,M
And More/SIN-ister Clips/UFO Top Secret Huge Space Craft By Russian Black-op Project.flv,3.53,M
And More/The Holy Spirit/Before The Last Depression by David Wilkerson.flv,2.84,M
"And More/Signs of the Times/More Fireballs Over Japan - Nov 4, 6, 8 2012.flv",2.12,M
Info.txt,9.61,K
POtHS - Why We Do What We Do.txt,7.89,K
Torrent downloaded from Conspiracyhub.com.txt,47,B
