User Type,Username,Date,Text
,TheDarkSaviour,2012-03-07T20:38Z,"Wow, it's great that you put all these together! :) I won't download it though, because I have them all already. But still, that's very nice of you. Thank you for the amazing comics!"
,muckymucks,2012-03-08T05:32Z,"Very cool of you to compile all these together, mirrormaster. You go above and beyond. Thank you, sir!"
,MAGIC_HATE_BALL,2012-03-11T04:48Z,If you had not put this together I would have passed on this series.  You do the work of Jesus my friend. 
,rctroh,2012-03-25T09:30Z,You Are God
,MickCt75,2012-04-05T08:02Z,Mirrormaster82 Is The Master (o_0)
,raven42767,2012-06-21T23:38Z,"Do you how i can get 21-24.
Thanks"
