Filename,Size,Unit
Guide To Meeting And Seducing Women.pdf,3.71,M
How to Blow Her Mind in Bed - The essential guide for any man who wants to satisfy his woman.pdf,2.4,M
Don Juan Boot Camp.pdf,2.35,M
Approach Anxiety Annihilator.pdf,424.8,K
10 Techniques fof Killing Approach Anxiety.pdf,356.86,K
The Don Juan Book.pdf,269.68,K
Speed Seduction Algorithm.pdf,239.48,K
Three Keys To Seducing Any Woman.pdf,228.31,K
How To Create Instantaneos Sexual Attraction.pdf,164.91,K
How To Give A Woman A Rush Just By Looking At Her.pdf,90.45,K
How To Pick Up Girls.pdf,70.68,K
The Complete Guide To Handling Women.pdf,50.44,K
