Filename,Size,Unit
Man On A Ledge (2012) CAM V3 FULL VIDEO StoneBoyTony.mkv,910.95,M
"_____padding_file_0_if you see this file, please update to BitComet 0.85 or above____",54.21,K
Sample.mkv,21.63,M
"_____padding_file_1_if you see this file, please update to BitComet 0.85 or above____",123.6,K
Torrent downloaded from AhaShare.com.txt,58,B
"_____padding_file_2_if you see this file, please update to BitComet 0.85 or above____",255.94,K
Torrent downloaded from Demonoid.me.txt,46,B
"_____padding_file_3_if you see this file, please update to BitComet 0.85 or above____",255.96,K
Torrent downloaded from Extratorrent.com.txt,40,B
