User Type,Username,Date,Text
,PrincePwn,2012-10-08T05:45Z,55.9% and stopped
[T],SecTPB,2012-10-08T06:03Z,"@PrincePwn
Fully seeded now. Should be good to go."
,tetnem,2012-10-08T06:37Z,I will download it.I will report if the torrent is fake or real. 
,tetnem,2012-10-08T06:39Z,Please seeeeeeeeeeeed!!!!!!!!
,tetnem,2012-10-08T07:23Z,"Those people who wants to watch dexter in high quality, please download this torrent. It's real!!

Sorry that I didn't trust you, but I had to be sure. Thanks for the episode and I hope you will give us the other episodes of this season. "
[T],SecTPB,2012-10-08T07:48Z,Every episode of this season will be up. Don't worry. :)
,ironymon,2012-10-08T08:28Z,3 gigs for an episode.... Maybe next time cause i already dloaded tons of shit yesterday lol
,xkinn123,2012-10-08T09:48Z,"hey man, have you converted it?
at least give me mvk format, please.
it has less file size but same quality"
,EXPERIMENTONGOD,2012-10-08T13:56Z,"Hey SecTPB, I like what you're trying to do here.

More quality is always good! I'm going to compare this to the usual 720p releases to see how much improvement we're getting.

Thanks!"
,lattari,2012-10-08T14:14Z,"Great. The bigger the better. Now that internet connections have evolved, it's good that video quality follows.

Thanks."
,rasp88,2012-10-08T14:24Z,This is so awesome!! Thankyou. I watch naruto as well :)
,letitbe123,2012-10-08T15:55Z,thank for this got 720p of dexter last weeki this is great hd thanks sectpb
,hutness,2012-10-08T19:59Z,"People need to be less whiny/bitchy and more appreciative. 
Thanks, SecTBP! "
,steaz55,2012-10-08T23:45Z,Thank you for 1080i. This is how it's broadcast. 
