Filename,Size,Unit
CD2/06. Red Fox Chasers - Tell Mother I'll Meet Her.mp3,7.62,M
"CD1/07. John D. Foster,Young - Some Day I'll Wander Back Again.mp3",7.62,M
CD4/21. Byrd Moore - Bed Bugs Makin' Their Last Go Round.mp3,7.59,M
CD4/22. Byrd Moore - All Night Long.mp3,7.56,M
"CD1/06. John D. Foster,Young - My Boyhood Happy Days.mp3",7.44,M
CD1/05. John D. Foster - The Cabin With Roses At The Door.mp3,7.4,M
CD3/04. Fiddlin' Doc Roberts - Jacks Creek Waltz.mp3,7.4,M
CD4/17. Byrd Moore - Careless Lover.mp3,7.38,M
CD1/18. John D. Foster - Cabin With Roses At The Door [#].mp3,7.37,M
"CD1/12. John D. Foster,Rutherford - My Carolina Home.mp3",7.37,M
CD4/20. Byrd Moore - Snatch 'em Back Blues.mp3,7.34,M
CD3/02. Fiddlin' Doc Roberts - The Devil In Georgia.mp3,7.33,M
CD2/02. Red Fox Chasers - Turkey In The Straw.mp3,7.29,M
CD2/10. Red Fox Chasers - Mississippi Sawyer.mp3,7.26,M
"CD1/08. John D. Foster,Young - We Can Only Have One Mother.mp3",7.25,M
CD1/21. Ernest V. Stoneman - John Hardy.mp3,7.25,M
CD4/15. Byrd Moore - That Old Tiger Rag.mp3,7.23,M
CD3/11. Fiddlin' Doc Roberts - Johnny Inchin' Along.mp3,7.23,M
"CD2/18. Red Fox Chasers - Makin' Likker In North Carolina, Pt. 1.mp3",7.21,M
CD2/01. Red Fox Chasers - The Arkansas Traveler.mp3,7.19,M
CD3/24. John Hammond - Purty Polly.mp3,7.18,M
CD3/01. Fiddlin' Doc Roberts - Deer Walk.mp3,7.17,M
CD3/05. Fiddlin' Doc Roberts - Martha Campbell.mp3,7.16,M
CD3/06. Fiddlin' Doc Roberts - The Girl I Left Behind Me.mp3,7.15,M
CD1/23. Ernest V. Stoneman - The Poor Tramp Has To Live.mp3,7.13,M
CD3/07. Fiddlin' Doc Roberts - Rocky Mountain.mp3,7.12,M
"CD1/02. Jesse James,John D. Foster - Good Bye, My Darlin'.mp3",7.11,M
CD1/24. Ernest V. Stoneman & His Grayson County Boys - Long Eared Mule.mp3,7.1,M
CD2/24. Oscar L. Coffey - My Dear Old Mountain Home.mp3,7.06,M
CD4/18. Byrd Moore - Mama Don't Allow No Low Down Hangin' Round.mp3,7.05,M
"CD2/03. Red Fox Chasers - Did You Ever See The Devil, Uncle Joe!.mp3",7.04,M
CD1/25. Ernest V. Stoneman & His Grayson County Boys - Round Town Gals.mp3,7.03,M
CD2/08. Red Fox Chasers - Little Sweetheart Pal Of Mine.mp3,7.02,M
CD3/13. Fiddlin' Doc Roberts - I've Got A Girl Named Susie.mp3,7.02,M
"CD1/10. John D. Foster,Rutherford - Richmond Blues.mp3",7.02,M
CD4/24. Byrd Moore - Birmingham Jail.mp3,6.99,M
"CD1/19. John D. Foster,Rutherford - Six Months Ain't Long.mp3",6.99,M
CD4/16. Byrd Moore - Favourite Two Step.mp3,6.99,M
CD4/14. Byrd Moore - Flop Eared Mule.mp3,6.98,M
"CD1/09. John D. Foster,Rutherford - Taylor's Quickstep.mp3",6.95,M
CD4/23. Byrd Moore - When The Snowflakes Fall Again.mp3,6.93,M
CD3/03. Fiddlin' Doc Roberts - Take Those Lips Away.mp3,6.92,M
"CD1/01. Jesse James,John D. Foster - When I Was Single My Pockets Would Jingle.mp3",6.89,M
CD4/03. Da Costa Woltz's Southern Broadcasters - Merry Girl.mp3,6.84,M
CD3/22. Ted Gossett's Band - Fox Chase.mp3,6.83,M
CD4/13. Byrd Moore - Last Days In Georgia.mp3,6.77,M
"CD1/11. John D. Foster,Rutherford - These Bones Gwine Rise Again.mp3",6.75,M
CD2/09. Red Fox Chasers - Put My Little Shoes Away.mp3,6.72,M
CD2/21. Red Fox Chasers - Naomi Wise.mp3,6.71,M
CD2/11. Red Fox Chasers - Twinkle Little Star.mp3,6.68,M
CD4/01. Da Costa Woltz's Southern Broadcasters - Richmond Cotillion.mp3,6.68,M
CD4/19. Byrd Moore - The Bully Of The Town.mp3,6.64,M
"CD2/14. Red Fox Chasers - May I Sleep In Your Barn Tonight, Mister.mp3",6.62,M
"CD1/13. John D. Foster,Rutherford - Let Her Go I'll Meet Her.mp3",6.62,M
CD2/23. Oscar L. Coffey - Six Feet Of Earth Makes Us All One Size.mp3,6.61,M
CD1/20. Ernest V. Stoneman - New River Train.mp3,6.61,M
"CD1/15. John D. Foster,Rutherford - Meet Me In The Moonlight.mp3",6.6,M
CD3/21. Ted Gossett's Band - Wild Geese.mp3,6.6,M
"CD1/17. John D. Foster,Rutherford - Two Faithful Lovers.mp3",6.59,M
CD4/06. Da Costa Woltz's Southern Broadcasters - Are You Washed In The Blood Of The Lamb.mp3,6.58,M
CD3/20. Tommy Whitmer - Fire On The Mountain.mp3,6.57,M
CD3/14. Fiddlin' Doc Roberts - Run Smoke Run.mp3,6.55,M
CD4/07. Da Costa Woltz's Southern Broadcasters - Wandering Boy.mp3,6.5,M
CD2/20. Red Fox Chasers - Virginia Bootleggers.mp3,6.49,M
CD4/04. Da Costa Woltz's Southern Broadcasters - Yellow Rose Of Texas.mp3,6.48,M
CD3/23. John Hammond - Little Birdie.mp3,6.45,M
CD2/17. Red Fox Chasers - The Blind Man And His Child.mp3,6.43,M
CD3/18. Marion Underwood - Coal Creek March.mp3,6.43,M
CD4/08. Da Costa Woltz's Southern Broadcasters - Take Me Back To The Sweet Sunny South.mp3,6.35,M
CD4/10. Da Costa Woltz's Southern Broadcasters - Old Joe Clark.mp3,6.32,M
CD3/10. Fiddlin' Doc Roberts - Arkansas Traveler.mp3,6.32,M
CD2/05. Red Fox Chasers - Stolen Love.mp3,6.31,M
CD2/13. Red Fox Chasers - We Shall Meet On That Beautiful Shore.mp3,6.3,M
CD3/16. Taylor's Kentucky Boys - Forked Deer.mp3,6.29,M
CD2/07. Red Fox Chasers - Weeping Willow Tree.mp3,6.29,M
CD4/05. Da Costa Woltz's Southern Broadcasters - I Know My Name Is There.mp3,6.29,M
CD4/11. Da Costa Woltz's Southern Broadcasters - Evening Star Waltz.mp3,6.27,M
CD3/19. Ted Gossett's Band - Eighth Of January.mp3,6.27,M
"CD1/14. John D. Foster,Rutherford - She's Only A Bird In A Guilded Cage.mp3",6.24,M
CD4/02. Da Costa Woltz's Southern Broadcasters - John Brown's Dream.mp3,6.23,M
CD2/15. Red Fox Chasers - Something Wrong With My Gal.mp3,6.21,M
"CD1/16. John D. Foster,Rutherford - There's More Pretty Girls Than One.mp3",6.18,M
CD3/15. Taylor's Kentucky Boys - Gray Eagle.mp3,6.14,M
CD2/22. Red Fox Chasers - Devilish Mary.mp3,6.11,M
CD2/16. Red Fox Chasers - Honeysuckle Time.mp3,6.1,M
CD2/04. Red Fox Chasers - Wreck On The Mountain Road.mp3,6.02,M
CD3/09. Fiddlin' Doc Roberts - Old Buzzard.mp3,6.02,M
CD4/09. Da Costa Woltz's Southern Broadcasters - When You Ask A Girl To Leave Her Happy Home.mp3,6,M
CD3/08. Fiddlin' Doc Roberts - Cripple Creek.mp3,5.99,M
CD3/17. Taylor's Kentucky Boys - Sourwood Mountain.mp3,5.97,M
CD2/12. Red Fox Chasers - Looking To My Prayer.mp3,5.96,M
CD3/12. Fiddlin' Doc Roberts - Buck Creek Gal.mp3,5.93,M
CD4/12. Da Costa Woltz's Southern Broadcasters - Home Sweet Home.mp3,5.91,M
"CD2/19. Red Fox Chasers - Makin' Likker In North Carolina, Pt. 2.mp3",5.86,M
CD2/25. Ted Chestnut - He's Only A Miner Killed In The Ground.mp3,5.83,M
CD3/25. John Hammond - As Free A Little Bird As Can Be.mp3,5.82,M
"CD1/04. John D. Foster,Rutherford - Storms May Rule The Ocean.mp3",5.65,M
"CD1/03. John D. Foster,Rutherford - My Sarah Jane.mp3",5.5,M
CD1/22. Ernest V. Stoneman - Kenney Wagner's Surrender.mp3,5.48,M
CD3/gennet country.JPG,58.64,K
CD2/gennet country.JPG,58.64,K
CD4/gennet country.JPG,58.64,K
CD1/gennet country.JPG,58.64,K
