User Type,Username,Date,Text
,Shiva_vb,2012-06-23T22:13Z,So late Pal Im waiting For it since last 2 hrs Continuous Refreshin
,phbelov,2012-06-23T22:14Z,LUV YOU!!!!
,phbelov,2012-06-23T22:15Z,@Shiva_vb same for me :D
,bochkin,2012-06-23T22:18Z,very strange - i saw your two releases of legend of korra about 2 hour before. but you had deleted it very fast
,ZombieMonkey23,2012-06-23T22:22Z,Thanks so much man. Will Seed!
,ccooluke,2012-06-23T22:26Z,LEGIT thanks
,PC187CA,2012-06-23T22:34Z,@Shiva_vb: More like last four hours. It aired at 11EST so it should've been available at 12EST. It is now 4:30EST.
,Darkmon,2012-06-23T22:34Z,Thank you so much!
,PC187CA,2012-06-23T22:35Z,"@bochkin: Those weren't SecTPB, they were Anonymous and they were fakes. They had 13,000+ seeds after being up for only 1 minute."
,ag25,2012-06-23T22:39Z,Thanks. Saves me from having to wait a month for it to air on TV where I live!
[T],SecTPB,2012-06-23T22:40Z,"Enjoy, guys. Sorry it's a bit late. Was asleep. You're all saved now so hooray. 1080p versions to come later."
,prongsi,2012-06-23T22:46Z,"DO YOU KNOW HOW MUCH I LOVE YOU? :d i've been refreshing your page for hours and when i finally saw this gdfnjnfdknvc, just I LOVE YOU "
,bassitos,2012-06-23T22:54Z,PASSWORD?
,jr283447,2012-06-23T23:05Z,"Can anybody plz help me, I just checked on speedtest, my Download speed is 16.86 Mbps, Upload speed is 3.33 Mbps. Yet when I download this file in utorrent, the download speed is 24 kB/s."
,bassitos,2012-06-23T23:07Z,PASSWORD???????????????????????
,Hirtch,2012-06-23T23:08Z,"There is a password required for the site that links you to www.bowad.com, where you will be prompted to do a survey.

Once this is complete, a screen displaying ""HERE IS YOUR CODE / YOUR CODE IS COMING UP / PLEASE WAIT...""

Nothing else happens despite any waiting. What is going on?"
,koldarm,2012-06-23T23:16Z,"Everyone asking for a password is a massive retard who downloaded the fake torrents, and not this one. Congrats, you probably have a virus."
,Lion_Turtle,2012-06-23T23:20Z,"Everyone asking for a password, I hate to break it to you but you downloaded a fake torrent.

Those were not uploaded by SecTPB, but an anonymous source. Did you really think it was legit that after only 2 minutes of being uploaded that they had 13,000 seeds."
,Katara_dk,2012-06-23T23:21Z,"Come one. Please fucking seed. 
Not fair, my speed:

Down: 80 kb/s
Up: 2.5 mb/s

Come one!"
,nyAgs,2012-06-23T23:25Z,thanx man. it doesnt matter how late it was. at least i got it. i probably wasnt gonna be able to sleep if i didnt watch it 2day
,Arcane_Ether,2012-06-23T23:27Z,"Torrent contents are Password locked and require you to ""Accept an Offer"" to receive password.

It's cheap attempt at farming cash from unsuspecting first-time downloaders.

Don't download!

Shame on you, Secludedly, bad pirate! Bad!"
,corey8084,2012-06-23T23:28Z,"why is everyone complaining about how long it took to get this up, just be glad they have uploaded this for free so you can all watch it."
,LordHades21999,2012-06-23T23:29Z,seed bro
,LordHades21999,2012-06-23T23:40Z,"No, I can vouch for him. No scam. I always download his torrents, The legend of Korra, and I always get nothing but the best in quality and sound. No scam. No farming cash. Just the utmost best in quality. It may have taken a little time today, but this dude really knows what he's doing. I respect him. or her, I was always assuming it was a guy. "
,IVIoogle,2012-06-23T23:42Z,Thank you!
,DarkForceMage,2012-06-23T23:43Z,"If it's asking you for a pass you either used a different link or your client needs updating for magnet links.

It's a straight mkv download. There is no password.

Thanks SecTPB!"
,LordHades21999,2012-06-23T23:45Z,Seed! Seed! I'm going to seed for the next month or so when I'm done. 
,koldarm,2012-06-23T23:56Z,"To those complaining about seeds:

It just came out, it hasn't finished initial seeding yet. No one has this torrent finished yet. Your download is going slow because of this, not because no one is seeding."
,firexninja,2012-06-24T00:12Z,thank you!
[T],SecTPB,2012-06-24T00:34Z,"I have been uploading episode 11 using most of my bandwidth while using less for this. Since 11 is done seeding, I put all of my speed into 12 just now. "
,sharer1064,2012-06-24T00:59Z,Thanks bodie.... we appreciate it. Keep it up.
,koldarm,2012-06-24T01:15Z,Initial seeding finally done. Enjoy everyone.
,Rapture1988,2012-06-24T01:39Z,Thank you!
,airbenderrr,2012-06-24T01:41Z,Just finished watching both of the episodes. Such an awesome ending. Will seed for as long as I can.
,KevinH613,2012-06-24T01:54Z,This show is amazing!
,RepThatCurry,2012-06-24T02:02Z,"@PEOPLE WHO NEED PASSWORD

download it again worked for me "
,ShayWithY,2012-06-24T02:02Z,"That was so amazing. I just love that series...
Thank you so much for uploading this :)
Gonna seed for the next month or so, which is a pain with my lame connection."
,LionelMessi10,2012-06-24T03:07Z,"This torrent does not have any password or surveys faggots, stop it already"
,andy18797,2012-06-24T03:13Z,thank you sooo much sec
[T],SecTPB,2012-06-24T05:26Z,1080p MP4 Encode Up: http://thepiratebay.se/torrent/7381479
,derfazoid,2012-06-24T07:31Z,Thanks so much for this! :D
,Shadust,2012-06-24T08:22Z,Does anyone know where i can get this episode in .avi format???
,The-IT,2012-06-24T12:35Z,Thank you Secludedly for giving me the opportunity to watch this amazing show. And thank you seeders for making this possible.
,Piratapr,2012-06-25T13:08Z,Gracias!!!!!!!!!!
,fjortis1,2012-06-26T21:14Z,Korra is so friggin badass :) thanx for UL!
,MitchAllen,2012-07-24T08:16Z,If you are having trouble with this get the VLC media player. It works with every video i have tried. Cant wait for the new episodes to come out.
,ACTIVEzz,2012-07-26T14:55Z,Could someone put all of the episodes in one download? All 720p or higher?
,vedderx79,2012-09-01T01:50Z,Audio gets outta sync with KMPlayer fine with Media player Classic
