Filename,Size,Unit
INFO/poster.jpg,152.2,K
INFO/Diary of a Wimpy Kid Dog Days (2012) x264 1080P DD 5.1 DTS EN NL Subs.txt,1.32,K
INFO/Torrent downloaded from Silvertorrent.org.txt,376,B
INFO/Torrent_downloaded_from_AhaShare.com.txt,278,B
INFO/Torrent Downloaded from  Movie-Torrentz.txt,260,B
INFO/Tracked by H33T.txt,257,B
INFO/Torrent downloaded from BettyBoop torrents on BTScene.eu.txt,68,B
INFO/Torrent Downloaded from  btscene.eu.txt,42,B
MOVIE/Diary of a Wimpy Kid Dog Days (2012) 1080P Simply ReleaseS Toppers.mkv,6.98,G
