Filename,Size,Unit
911-conspiracy-road-trip.jpg,5.3,K
CIA Spooks Wife Tells All in Ted Gunderson Interview.avi,174.1,M
DHS Ready to Fight The American People.avi,160.71,M
Hezbollah-620x455.jpg,72.65,K
POtHS - Why We Do What We Do.txt,7.89,K
Rev-Guards.jpg,46.33,K
Rumors of War III   Target US - GBTV Apr 27 2012.avi,258.41,M
Rumors of War III  Target US - GBTV Apr 27 2012.txt,3.97,K
Shorts/200 million man army in the making  - YouTube.flv,43.56,M
Shorts/2012 London Olympics Missile Defense Systems for possible Terrorist Attack 4-30-12.flv,15.47,M
Shorts/Alien Invasion   US Air Command is preparing for an Attack NBC 4-08-12.flv,14.47,M
Shorts/Australians call for suspension of military cooperation with US.flv,9.96,M
Shorts/Did NGOs help overthrow Gaddafi  - YouTube.flv,17.73,M
Shorts/Drones hit American universities - YouTube.flv,36.89,M
Shorts/Egypt   Muslim Brootherhood Protest turn deadly 5-05-12).flv,11.04,M
Shorts/Egypt   The Fruits of Islamic Brotherhood Chaos Clashes and Religious Tention 5-03-12.flv,15.92,M
Shorts/Exo-Skeleton Demonstrates Future Of Automation - YouTube.flv,3.99,M
Shorts/F-22 Raptor Stealth Fighter Armada deployed to a base near Iran 4-27-12.flv,6.01,M
Shorts/First joint Top Gun drills to be held in US With Russia In Colorado This May.flv,5.83,M
Shorts/Hamas Official Admits Palestinians are not from Israel.flv,5.05,M
Shorts/Military Black Helicopters fly over Chicago for whats gonna happen next month 4-17-12.flv,9.15,M
Shorts/Military Rape Victims Labeled As Crazy - YouTube.flv,20.78,M
Shorts/MORE Blackhawk Footage Flying Thru Chicago - will this be an upcoming routine.flv,11.89,M
Shorts/NATO Summit   Chicago Hospitals perform Radioactive Dirty Bomb Attack Drills 5-01-12.flv,8.19,M
Shorts/NATO Summit  Martial Redzone Armed Troops Mass Detentions   Evacuations.flv,17.53,M
Shorts/New Contact Lenses That Allow Satellite Feeds In HD - YouTube.flv,25.82,M
Shorts/Ohio Bridge Bomb Plot Another FBI Created To Tie The Occupy Movement To Homegrown Terrorism.flv,17.33,M
Shorts/Proof Bin Laden Death Another Govt Lie.flv,29.97,M
Shorts/Red Alert  FEMA Camp Manual for Internment Re-education Prisoners.flv,21.68,M
Shorts/Ron Paul Warns of False Flag Attack - YouTube.flv,15.45,M
Shorts/Stalins Ape-Man Superwarriors - YouTube.flv,12.24,M
Shorts/The Nazis Found Atlantis With All Its Evil Technological Booty - YouTube.flv,15.57,M
Shorts/Urgent  Leaked U S Army Document Outlines Plan for Re Education Camps In America.flv,14.27,M
Shorts/US And 17 Other Countries Will Be Working Together In Major Military Drill - Dont Worry.flv,10.77,M
Shorts/US spy bases taking over parts of the UK - YouTube.flv,14.55,M
"Shorts/We are Preparing for Massive Civil War, Says DHS Informant - YouTube.flv",6.38,M
Signs of the Times/1b - Earth ROCKS - YouTube.flv,7.2,M
Signs of the Times/1d - The Nibiru-Planet X-Wormwood Brochure - YouTube.flv,50.59,M
Signs of the Times/2012 Events - YouTube.flv,83.41,M
Signs of the Times/23 People Murdered And Decapitated In Nuevo Laredo - YouTube.flv,10.91,M
Signs of the Times/American drones sold to undisclosed countries - YouTube.flv,5.68,M
Signs of the Times/BLOCKBUSTER REVELATION Unqualified Obama Propped Up By Congress.flv,33.55,M
Signs of the Times/California Petitions Urge Labels On Genetically Altered Food   GMO 5-4-12.flv,4.93,M
Signs of the Times/Could The Pirate Bay suffer the same fate as MegaUpload.flv,24.81,M
Signs of the Times/DHS Prepares For Civil War - Red Alert- YouTube.flv,12.16,M
Signs of the Times/Egypt   Muslim Brootherhood Protest turn deadly 5-05-12).flv,11.04,M
Signs of the Times/FOX News Admits Ron Paul Has Won 5 States - He will win more.flv,6.79,M
Signs of the Times/Gods Final Warning The most important video you will ever watch in your life 5-2-12.flv,29.7,M
Signs of the Times/illuminati 2012 evolution karl marx communist atheist experience of hell - true ZEITGEIST.flv,47.87,M
Signs of the Times/KINGDOM AGAINST KINGDOM IT HAS BEGUN.avi,339.99,M
SIN-ister Clips/Human Genes Engineered in RICE being grown in Kanas - YouTube.flv,9.86,M
SIN-ister Clips/Is Israel about to take back the Sinai  5-7-12.flv,9.37,M
SIN-ister Clips/Israel - Mass Mobilization of 22 Reserve Battalions as Tensions rise with Egypt 5-02-12.flv,15.56,M
SIN-ister Clips/Lost Ancient Technologies Of Peru And Bolivia Tour August 2012.flv,17.53,M
SIN-ister Clips/NATO Summit  Martial Redzone Armed Troops Mass Detentions   Evacuations.flv,17.53,M
SIN-ister Clips/North Korean Defector Relies on Christ to Survive - YouTube.flv,46.95,M
SIN-ister Clips/Nuclear Threat from Germany   Missing Submarine AND Nuclear Weapon 5-3-12.flv,12.94,M
SIN-ister Clips/Obama close ties to the Islamic Brotherhood and end of Womens Rights 4-27-12.flv,26.46,M
SIN-ister Clips/Obvious Evidence Of Ancient Machine Technology In Egypt - YouTube.flv,14.28,M
SIN-ister Clips/Pentagon Staff Caught in Child Porn Sting-Fox News - YouTube.flv,27.32,M
SIN-ister Clips/PTSD Meds and the back door gun ban recovered - YouTube.flv,20.47,M
SIN-ister Clips/RT News -Pentagon prepares re-education camps for political activists.flv,41.21,M
SIN-ister Clips/This Blew My Mind. - YouTube.flv,4.24,M
SIN-ister Clips/UFO Parked By The Sun Revisited! It Is Still There - YouTube.mp4,38.94,M
Thats Impossible  Real Terminators.avi,173.5,M
The Holy Spirit/Overcoming Lust - Part 1 compilation  - YouTube.flv,12.79,M
The Holy Spirit/Prophecy 09-01-2011 - YouTube.mp4,96.81,M
The Holy Spirit/Prophetic Dream  Reptilians - YouTube.flv,11.24,M
The Holy Spirit/Put In What They Leave Out - YouTube (2).flv,3.42,M
The Holy Spirit/Righteous Anger by Shane Idleman - YouTube.flv,16.31,M
"The Holy Spirit/SackclothAshes The Cup My FATHER has given me, shall I not drink it  - YouTube.flv",67.99,M
The Holy Spirit/SUNDAY IS NOT THE SABBATH Coming Soon (2).flv,93.3,M
The Holy Spirit/The Lost Get Found- Britt Nicole  - YouTuberelated.flv,8.62,M
The Holy Spirit/THIS IS THE DAY that the Lord Hath Made - YouTube.mp4,35.83,M
The Holy Spirit/This is your Life by Switchfoot with lyrics  - YouTube.flv,5.56,M
The Holy Spirit/Through it All - Hillsong  - YouTubewf.flv,20.06,M
The Holy Spirit/TU ERES MI RESPIRAR - Breathe - YouTube.mp4,132.95,M
The Holy Spirit/Walk with me - Caedmons Call.flv,5.08,M
The Holy Spirit/Who Am I - Casting Crowns - YouTube.flv,10.42,M
Torrent downloaded from Conspiracyhub.com.txt,47,B
Torrent downloaded from Demonoid.me.txt,47,B
