User Type,Username,Date,Text
,Rattle189,2012-05-04T09:12Z,"Please seed, im currently seeding."
,ShenlyFlores,2012-05-04T10:01Z,hello im just checkin' out your stuff and downloading it if its any good.
,nydhoggur,2012-07-21T18:24Z,"Unfortunately ""Rattle189"" is not even an honest thief, you should find another uploader  that you can trust.

Do not take my words for it: 

http://thepiratebay.se/torrent/7159687/Minecraft_1.2.5_Cracked_[Full_Installer]

 go through the comments here and judge for yourselves.


You will find that either someone else is always sharing what he is trying to peddle as his own.


Have a nice day."
,Rattle189,2012-07-22T12:14Z,"@nydhoggur Hey, this torrent is original bitch. Stop commenting lies on some of my torrents."
,NormNyan,2012-07-22T12:22Z,"@nydhoggur This torrent ain't fake you moron, he made this by himself. Look at the files, idiot. Reply back if you saw anything. You should think twice before commenting here at a popular torrent."
