User Type,Username,Date,Text
,cUNDra666,2012-07-29T21:13Z,"wow thanks, really fast :)"
,tcc1,2012-07-30T10:15Z,theres newer version. ilauncher v2.1.10 anyone have this apk
[T],bobiras2009,2012-07-30T10:32Z,"@tcc1

This version is released today so tomorrow i will upload it."
,cUNDra666,2012-07-31T17:53Z,"Dar bobiras22, im really in need of the apk of ""รถffi"" its an app Form public transportation, its free in the play store, gut i need the apk...would bei awesome. Thx for all your effort "
,cUNDra666,2012-07-31T18:19Z,"Really sorry to bother you dude, but if you happen to have Google maps as an apk, id need that too... Again, sorry "
