User Type,Username,Date,Text
,pir8s003,2012-04-27T08:44Z,seed. Download nothing since 5 hours.   all at stuck at 0.00%. CWOT
,NiggerRapist,2012-04-28T06:25Z,Forgot uTorrent was not open. I have begun seeding. (I'm not seeding more than 24 hours of when this comment was posted)
,pir8s003,2012-04-28T08:35Z,"@NiggerRapist


download has been started. but its bit slow. m stick with it. hope it will complete!!!
"
,macha,2012-08-07T07:30Z,"Hey buddy, the serial number you provided is way too many digits. It ain't activating. :o("
,1ManClan,2012-08-08T23:47Z,Having some issues getting this activated too. Any help is appreciated
