User Type,Username,Date,Text
,pxusss,2012-05-21T00:21Z,"Tusen takk, men det trengs seedere :-)"
,pxusss,2012-05-21T09:51Z,"Det virker for meg som om dette er en fake, dessverre, jeg har sett en preview gjennom KMplayer. Åpnet filen ved 20 prosents nedlasting."
,fisker,2012-05-21T16:13Z,"Hvordan kan det virke som noe er fake?
Er det ikke Aalesund - Brann som spiller?
Er det ikke kampen som gikk 20-05-2012?

Denne er ikke fake!

Vurderer å stenge seeden pga slike kommentarer."
,pxusss,2012-05-21T19:48Z,"Hadde forventet at en hakkete (pga  kun 20% nedlastet) fotballkamp kom opp ved åpning av filen.Det gjør det ikke.Vil ikke være bombastisk, det kan vel være en feil hos meg.(Kune du tenke deg å dobbeltsjekke at du har lastet opp rett fil?)"
,fisker,2012-05-22T02:45Z,"Har fått bekreftet av andre som har lastet ned filen, at det er riktig fil og god kvalitet!"
,pxusss,2012-05-22T05:15Z,"Kjempebra, får frem kampen nå. Tusen takk igjen! :-)"
,qurray,2012-05-23T12:06Z,Takk! Will you continue with the new matches?
