User Type,Username,Date,Text
,nieveazul,2012-06-16T02:19Z,i just started watching the series today! and i'm halfway through season one. thanks for this torrent
,jrmcd49,2012-07-04T01:48Z,"Thank you, thank you, thank you. Good series. Am looking forward to season II."
,P_W_W,2012-07-11T22:54Z,"Font of subs could have been a little bigger, but most disturbing is blue backgrond or shade or outline. It's a pitty. Makes them more difficult to read.
Conventions regarding to subs are result of experience..."
,carolmurray,2012-07-23T09:40Z,Thank you.
,Kiki-D,2012-08-01T13:43Z,"Thanks for the quick upload! Excellent quality, including subs - there's no problem reading them with the blue outline, on the contrary!"
,svirens,2012-08-04T21:45Z,Can somebody please seed these files? Thank you so much!
