User Type,Username,Date,Text
[V],psspss,2012-10-31T10:52Z,"i have tattoo nightmares S01E03 however the source
isnt good.. as has massive flicker in it..

might wait for a better source to come to light before sharing"
[V],psspss,2012-10-31T11:36Z,the source for this one seems to be same as tattoo nightmares has some minor weather interference on the audio but picture dont flicker like nightmares 103
,AlyH,2012-11-01T02:11Z,thanks psspss
,Hoirc88,2012-11-02T05:02Z,Picture quality isn't that great but it's watchable none the less and fast download. Thanks man.
,Rosenberg666,2012-11-02T11:00Z,bad quality..... but thx anyway!
