User Type,Username,Date,Text
,nightprowler.,2012-12-18T04:16Z,"Is the girl sexually broken?
Is Matt sexually broken for doing this?
Are we sexually broken for enjoying this?
Or is it a triple entrandra?

Whatever the case thanks for the upload"
,mechanic35,2012-12-18T05:47Z,enjoying the great work.  can you upload more gwen diamond (mainly scene 4978) but all of her work is great!!  thanks for everything.
[V],merzedes,2012-12-18T23:10Z,"@mechanic35: that is the only mip/gwen diamond we dont have in 720p, would like to wait and see if it comes up in the near future..

The 960*540 ver is already up here:

http://thepiratebay.se/torrent/3996903/Cyber_Update_jan_02.2008-------MIP-4978-Gwen_Billy_Tj.wm"
,Tealemon,2013-01-01T06:58Z,Thank you for sharing!!
