User Type,Username,Date,Text
,heartcore123,2012-10-12T05:57Z,can anyone confirm if this is real?
,Kurumas,2012-10-12T17:23Z,"yeah man, this is real, enjoy!"
,Pohaloca,2012-10-14T18:09Z,"Hahaha massa cara, br? representou!

Torrent is fine, everything 320 kbps, absolutely legit! Downloaded with >1 Mb/s speed rate, finished dl within 3 minutes hahah amazing"
,Kurumas,2012-10-16T17:03Z,opa BR na área man!huauhauhauhaa abraços!
,kaduwalker,2012-10-18T02:09Z,BR BR BR!haha valeu mano!
,Kurumas,2012-10-18T22:01Z,"aê sim, vamo chegar BR!
acessem o blog para download diretos!

xrecoveryx

Acess the Blogspot for more downloads guys!

xrecoveryx  BLOGSPOT, enjoy, and support the band!

God Bless!"
,P149U3,2012-10-21T18:16Z,I don't take the word of a ULr who is a Non-VIP / Trusted / Helper that it is real.
,Kurumas,2012-10-25T16:28Z,"this is real man, no fake, enjoy!"
