User Type,Username,Date,Text
,Pimbax,2012-10-07T23:36Z,"Its real.. But i was hoping for something better coming from Reloaded.. They didnt remove all the protection etc.. It still requires origin.

Oh well.. But it works people. ITs the real deal."
,mrforint,2012-10-07T23:41Z,"Finally, fuck sake... 
Наконецто друзья!"
,Meak1,2012-10-07T23:49Z,ццц
,hotman96,2012-10-07T23:52Z,does it works???
,Sheevz0r,2012-10-07T23:55Z,I get only to messi screen with the 3dm release with this one.
,Grubster-11,2012-10-08T00:05Z,Not sure what youre talking about....running perfectly and I dont have origin installed
,TiSh3621,2012-10-08T00:19Z,"Thanks man!!!!!!!!!! 
finally get to play fifa13"
,Beetlejuicexx,2012-10-08T00:25Z,"If your origin login screen comes up (from having it installed for other legitimate games, let it come up, but don't login, just alt-tab back to the game to carry on (at least that's how it worked for Fifa 12)"
,madlax10,2012-10-08T00:27Z,FUCKING FINALLY
,Proseesy,2012-10-08T00:50Z,Works?
,Smoove13,2012-10-08T08:11Z,Is this working with Fifa 13(5.98 Gb) uploaded by Ghost_vas..
,hotman96,2012-10-08T10:13Z,IT FUCKING WORKS! THANK YOU GUYS !!!!!!!!!!!!!
,rainn021,2012-10-08T11:17Z,"It works brilliantly, i have origin installed even. So all you trolls out there gtfo. Purple skull = Trusted upploader, will never be a fake file from this person."
,nerko619,2012-10-08T12:06Z,"Yeah guys it works, thanks to RELOADED, Im wondering why SKIDROW didnt release his crack so far."
,madz1234,2012-10-08T12:30Z,"i replaced .EXE with CRACK wen i click top play it showing some error""PROGRAM CAN'T START BECAUSE  RLDEA.DLL IS MISSING IN YOUR COMPUTER"" ANY1 HELP..PLEASE.."
,sachin97,2012-10-08T14:44Z,"thank you,the game works perfectly,nice crack, works without stupid origin"
,santiCaz0rla,2012-10-08T20:23Z,"Stuck at Language selection screen. But Mouse is moving .Any help would be appreciated. 
Thank You :)"
,chrisbdu,2012-10-09T23:41Z,"yeah im getting crash dump error and then
rldea.dll is missing from your computer.try reinstalling..........ect"
,chrisbdu,2012-10-10T01:43Z,"SOLVED rldea.dll is missing from your computer,MAKE YOU INCLUDE IT FROM THE CRACK FOLDER"
,Thoros634,2012-10-20T10:40Z,Does anyone have the Game or the crack without the virus in the RLDEA.DLL file..
