User Type,Username,Date,Text
,lostInCube,2012-05-05T16:04Z,Virus. Avoid.
[V],gnv65,2012-05-05T18:48Z,Are you joking lostInCube ?
,vis3105,2012-05-06T14:19Z,Useful book for readers of all age groups. Thanks.
,virus.app,2012-05-12T06:16Z,my av quarantined it saying it had a trojan. if its an ebook why the fuck is it in .scr format. u should be banned
[V],gnv65,2012-05-12T19:43Z,"Hey virus.app, the book is clearly in PDF format!
Its your antivirus that is fucked up."
,Knightmare,2012-08-22T21:10Z,"Just confirming, it is in .pdf format.
No virus / trojan or whatever...it's a clean file.

Thank you for the upload gnv65!"
,machikneerandii,2012-09-18T15:40Z,it's gr8! dunt listen to these random assholes :) no offense n e wayzz thnx
