User Type,Username,Date,Text
,digimike50,2012-04-14T14:14Z,"Hey, thanks a million - so quick!"
,mutineer,2012-04-14T14:21Z,"Thank you Brother.
I've been going through withdrawal over the last three weeks, and now F1's BACK!!
Great season so far, and people like Footy make it sooo much better for us all.
Thanks Footy.
You Rock Brother."
,MukBro,2012-04-14T14:42Z,"Thanks again, Footy. "
,Bali2011,2012-04-14T14:58Z,Thank You!
,novsan,2012-04-14T15:22Z,Than you very much footy
,DataAndroid,2012-04-14T15:35Z,Thank you so much for this
,giffo5,2012-04-14T15:36Z,"Thank you so much man !!!!!!! 
Your a freaking star !! "
,gfox485,2012-04-14T16:01Z,"Thanks man!  But why does the does the 2nd video start in the middle of Q2?  Out of your control maybe?

Not a big deal though as this is the only way I am able to watch F1 now, so these torrents are much appreciated :)"
,resonator,2012-04-14T17:45Z,"Thank you footy, your F1 uploads are very appreciated."
,devnull1337,2012-04-14T18:23Z,just want to add my thank you as well. your efforts are much appreciated... maraming salamat.
,frostbite88,2012-04-14T18:23Z,pls also upload the HD version thanks a million !
,darren21,2012-04-14T18:48Z,"im running out of nice things to say to you....

may a thousand vaginas find their way to your penis by tomorrow,ggod sir!"
,JFever,2012-04-14T19:32Z,Thanks so much for these. In Canada it is difficult to get decent F1 coverage. Even better if you could upload F1 in HD.
,surfboi,2012-04-14T21:19Z,"Thanx a lot footy,if you're this quick with tomorrows race as well then you are a fucking superhero:)"
,SerSpec-V,2012-04-14T23:14Z,"Very much appreciated, thanks!"
,Johnpfw,2012-04-15T01:23Z,Many thanks footy
,srr37,2012-04-15T04:46Z,"footy- THANKS!

Qualy- WOWO!!"
,Paronomasiaster,2012-04-15T11:07Z,"Please never stop!
You are awesome!
I hope you realise how appreciated you are around the world!"
,john20011,2012-04-15T12:28Z,"look up F1 Season 2012 on facebook where there are links to these videos that stream via google video, i have all of the season so far for on demand viewing

cheers footy for your efforts"
,FiveeNil,2012-04-15T15:27Z,"footy, any chance of uploading this in 720p?"
,Peter_Alien,2012-04-15T20:33Z,"Hey footy, excellent as always... 
Thx a lot man!!!!"
