User Type,Username,Date,Text
,Farbror_Frej2,2012-07-15T15:14Z,"Tack för uppladdningen , har du möjlighet sedda lite mer för torrenten har kört fast på 98,6 % ?"
,kgklang,2012-07-16T11:35Z,"Jag blir allt mer och mer övertygad om att det är något fel på denna torrent också, tyvärr. Det är mitt andra försök med Desperate Housewives-torrtents. Själv har jag i alla fall inte lyckats ladda ner mer än 98,7 % efter två dagars nerladdning. De sista 1,3 procenten är väldigt sega! / kgklang"
,kgklang,2012-07-16T11:53Z,"Okay, jag har läst den första kommentaren. Det stämmer med min egen observation. Jag återkommer så fort som möjligt med en ny torrent med följande förbättringar:
1) Mindre storlek på episoderna.
2) Seedning under mycket längre tid.
3) Nerladdning från annan dator för koll.
/ kgklang"
,dozer82,2012-07-28T15:34Z,"Snälla seeda dom sista 1,8% allvarligt talat! Hur rubbad är man om man stänger ner torrenten innan någon har tankat??? Släng upp dom sista så ska jag låta min dator stå på tills alla som vill har tankat..."
,kgklang,2012-07-29T19:25Z,"Till dozer82: Skippa din nerladdning. Mina filer är kastade och jag vet inte hur man seedar igen. Använd istället torrenten:
Desperate Housewives s07 SWESUB 300 MB-filer
/ kgklang"
,dozer82,2012-07-31T23:04Z,"Men kvaliteten är helt kass på 300mb filerna, blir nästan ok kvalitet i ipaden men på tvn så är det bara rutor =(
men tack för ditt slit!"
,dozer82,2012-07-31T23:05Z,tips. Rippa i 800mb filer nästa gång då blir allt perfekt;) du kanske orkar göra en sista insats?
,kgklang,2012-08-09T00:38Z,Okay! Du har rätt! 300 MB för en TV är inte så lämpligt. Jag ska fixa 700-800 MB-filer snarast. / kgklang
