Filename,Size,Unit
"Anesthesia for Congenital Heart Disease - D. Andropoulos, et al., (Blackwell, 2005) BBS.pdf",10.93,M
"Anesthesia Outside of the Operating Room - R. Urman, et al., (Oxford, 2011) BBS.pdf",10.65,M
Anesthesia Secrets Duke 4ed (Elsevier 2011)BBS.pdf,6.63,M
"Essentials of Regional Anesthesia - A. Kaye, et. al., (Springer, 2012).pdf",21.66,M
"Kaplan's Cardiac Anesthesia - The Echo Era 6th ed. - J. Kaplan, et. al., (Saunders, 2011) BBS.pdf",187.88,M
"Manual of Anesthesia Practice [Pocket Clinician] - M. Pardo, J. Sonner (Cambridge, 2007) BBS.pdf",5.82,M
