User Type,Username,Date,Text
,jsparrowx,2012-09-24T18:52Z,how do i play it once i've downloaded it??
,naumi,2012-09-24T19:15Z,yep playble on dex 4.21 or wait for 3.55 patch
,RikiFeel,2012-09-24T22:44Z,"Hey thenoobish!! ;D 

I'm the real noob here, it's just my ps3 has a 4.00 firmware (the legal one) and i've meaning to jailbreak it, and despite efforts and douzens of downloads, couldn't get it to happen. Could you PLEASE help me?!"
,tanimr2002,2012-09-24T23:13Z,the eboot patch already released for cfw 3.55..so its playable..
,stoffinho17,2012-09-25T20:07Z,"Languages: Svenska, Dansk, Česky, Français, Deutch, Italiano,Español, Português, Polski, Magyr, русский язык, English, Norsk and Nederlands."
,drumenige,2012-10-04T14:48Z,"Dont Wait for Crack , I found working FIFA 13 Soccer K-E-Y-G-E-N, I heard it works for XBOX AND PS3 Also....

I tested it for PC using Origin , and it really works....

-------------------------------------------------
Hurry to get your:

gamerhelper.22web.org
-------------------------------------------------"
