Filename,Size,Unit
Many Shall Be Offended.avi,877.86,M
Prepare And Make Ready - A Watchman Cries Out.flv,511.02,M
Shorts/Brazilian Nazis making UFOs Whats with the Portuguese-Nazi connection.avi,337.37,M
The Day Of The Lord Is At Hand.flv,258.77,M
Come - The Harvest.flv,234.37,M
Endtime News Updates 11-14-12.avi,192.32,M
Endtime News Updates 10-23-12.flv,189.5,M
Endtime News Updates 12-02-12 (1).flv,159.89,M
Xtras/The Holy Spirit/Mercy - Casting Crown2.mp4,129.1,M
Xtras/Signs of the Times/The Illuminati Is Alot Closer Than You Think.mp4,128.62,M
Xtras/SIN-ister Clips/Warlords.mp4,115.28,M
Xtras/The Holy Spirit/Healing Begins-Tenth Avenue North w  Matt Chandler.mp4,82.73,M
Xtras/Martyrs of Today/Assyrian Christians of Iraq facing extinction part 1  - YouTube.flv,68.98,M
Xtras/Signs of the Times/Syria And The Chemical Weapons Propaganda.mp4,60.73,M
Shorts/2012 2016 Warning 16 CERN Frequencies etc.flv,56.89,M
Xtras/Signs of the Times/Nuclear Report - 11-30-12.mp4,51.15,M
Xtras/Signs of the Times/The Cycle of Civilization in 33 Words.mp4,50.67,M
Xtras/SIN-ister Clips/They Spend We Owe.flv,49.65,M
Shorts/2012 2016 Warning 17 What We Have Become_Sandy Hall School.flv,48.95,M
Xtras/The Holy Spirit/How to be READY For Rapture   Jesus Coming.flv,48.44,M
Xtras/Signs of the Times/String of mysterious booming noises reported.mp4,47.85,M
Xtras/SIN-ister Clips/Wretched Have a Hobby Lobby Christmas.mp4,47.67,M
Shorts/Bob Larson  Exorcism of a Witchcraft Demon.flv,47.38,M
Shorts/Egypt Mursi the new Pharaoh_ fierice king will envoke Sharia Law Isaiah 19 11-23-12.avi,41.71,M
Xtras/The Holy Spirit/Its Very Important You dont Skip Any Of This Video.flv,41.69,M
Shorts/Flu Facts plus Hospitals Threaten To Fire Empl If Dont Get Flu Shots.flv,40.25,M
Xtras/War and Rumors of Wars/HAMAS OFFICIAL Gaza Truce Questionabale 11-20-12.avi,36.62,M
Xtras/Martyrs of Today/Chiapas Persecution - YouTube.flv,34.72,M
Xtras/Martyrs of Today/Christian Persecution SNL Tim Tebow Skit   More A MUST SEE.flv,33.31,M
Shorts/Burma.flv,32.35,M
Xtras/The Holy Spirit/Clip - Day 2 Alberto Rivera Ex Jesuit Priest.avi,29.86,M
Shorts/12 Miles Of Dead Squid  Wash Ashore Bible Prophecy.mp4,29.36,M
Shorts/Fast and Sabbath - The Truth - Not Doctrine.mp4,28.37,M
Xtras/The Holy Spirit/FOREVER - hillsong.flv,28.11,M
Xtras/Signs of the Times/THE NEED.avi,26.56,M
Xtras/Signs of the Times/THERE IS A BATTLE BEING WAGED IN AMERICA.mp4,25.9,M
Shorts/Egypt Christians  Convert or Die.mp4,25.7,M
Xtras/SIN-ister Clips/US to send sophisticated arms to militants in Syria.mp4,23.8,M
Xtras/The Holy Spirit/OPEN THE EYES OF MY HEART-MICHAEL W SMITH.flv,23.6,M
Xtras/The Holy Spirit/David Wilkerson - Freedom from sin.flv,23.12,M
Xtras/SIN-ister Clips/WARWICK RI BAFFLED BY UNEXPLAINED LOUD EXPLOSION BOOMS FLASHES OF LIGHT.flv,22.93,M
Xtras/Signs of the Times/HE'LL GET YOU THROUGH - For the Families of Newtown CT.flv,22.62,M
Xtras/The Holy Spirit/FORGIVE.flv,22.43,M
Xtras/Signs of the Times/Plume rises from Ulawun volcano at Papua New Guinea.mp4,22.26,M
Xtras/War and Rumors of Wars/New Pharaoh Military fascism replaced by Islamofascism in Egypt.avi,22.08,M
Xtras/Signs of the Times/Tax Hell 73% rates cripple UK families killing aspiration nation.flv,21.77,M
Xtras/SIN-ister Clips/Why Dont You Rust.flv,16.73,M
Shorts/Athens Police Caught In Hail Of Firebombs - Raw Video.flv,16.57,M
Xtras/SIN-ister Clips/William Cooper Exposed Alex Jones - lost recording.flv,16.39,M
Xtras/SIN-ister Clips/Why Is the Media Ignoring the Mass Sinkholes Popping Up.mp4,15.83,M
Xtras/SIN-ister Clips/UN Overwhelmingly Bans Nuclear Weapons.flv,15.78,M
Xtras/SIN-ister Clips/Trainers teach dogs to drive cars.mp4,14.64,M
Shorts/Alert Global Sea Levels Rising Faster Than Expected 12-5-12.mp4,14.07,M
Xtras/The Holy Spirit/Kathryn Scott - Hungry.flv,14.02,M
Xtras/SIN-ister Clips/US Official Military Strike On Syria Could Happen with Ships  Aircraft In Region.flv,13.45,M
Xtras/Signs of the Times/SINKHOLE UPDATE 12-11-12.mp4,13.17,M
Xtras/The Holy Spirit/Coming Persecution To America - Paul Washer.flv,11.46,M
Xtras/War and Rumors of Wars/Israel IDF fires into SYRIA after Mortar Shell hits Israeli Army on Golan Heights 11-11-12.flv,10.61,M
Shorts/Ancient Syrian Ruins Destroyed.flv,10.47,M
Shorts/Company Layoffs - Military Uniforms to be Made by Prison Labor.flv,9.23,M
Shorts/Drought Will Cause Food Prices To Skyrocket - YouTube.flv,8.72,M
Xtras/The Holy Spirit/I Will Rise by Chris Tomlin with lyrics.flv,8.69,M
Xtras/SIN-ister Clips/Two enormous sinkholes in Bay Area California.mp4,8.41,M
Shorts/EU-funded NGO for youth glorifies violence promotes hatred of Israel and US.flv,8.31,M
Xtras/Signs of the Times/Second-Graders Charged for Bathroom Breaks.flv,7.53,M
Xtras/The Holy Spirit/Against All Odds  Israel Survives DVD Series Teaser Trailer2.flv,5.5,M
Shorts/Egypt declares Sharia Law 10-21-12.avi,5.01,M
Xtras/The Holy Spirit/Jehovah Jireh.flv,4.37,M
Shorts/China Floods Video  Dozens killed millions evacuated.flv,4.07,M
Shorts/2012 CAMP FEMA LIFE IN NJ WHAT IS IT LIKE.flv,3.75,M
Xtras/SIN-ister Clips/Worldwide Average Sperm Count Falls Dramatically.flv,3.06,M
Xtras/Signs of the Times/Ohio Sinkhole Devours Over 1000ft Of Land.mp4,3.01,M
Xtras/SIN-ister Clips/UFOs Aliens KGB tapes of alien visitors   UFOs Classified TOP SECRET Tape 2.flv,2.83,M
Shorts/BREAKING 666 ENERGY DRINK NO KIDDING EVIL AMERICA.avi,2.31,M
Xtras/Signs of the Times/Rio Arrests Scores Of Police In Bribery Probe.mp4,1.64,M
Shorts/Breaking News  Airforce UFO video goes Public.flv,845.52,K
books.jpg,14.47,K
POtHS - Why We Do What We Do.txt,7.89,K
Info.txt,3.86,K
Torrent downloaded from Conspiracyhub.com.txt,47,B
