User Type,Username,Date,Text
,LightnLar,2012-03-20T14:19Z,"Thanks for posting, but...
Just the EXE file only?
No code, no patch, no serial, etc."
,BlackAngelDoom,2012-03-20T14:27Z,"all you need packed in exe, just run and enjoy :)"
,LightnLar,2012-03-21T11:39Z,"Works great, thanks... :-)"
,freecall,2012-03-21T20:00Z,lottsa freeware being posted here now
,SCBright,2012-03-21T23:03Z,@freecall: Revo Uninstaller Pro is not freeware
,Td2j,2012-04-08T22:56Z,Thanks a lot BlackAngelDoom. Clean and works fine
