User Type,Username,Date,Text
,zakimar,2012-04-30T13:46Z,"The Fed is just a collection of Zionist jews that are sucking America dry like the parasites they are and supporting their true country, APARTHEID israel. That is why the jew controlled media ignored him as a Presidential candidate."
,tuvokk,2012-05-01T04:57Z,"I dunno much about this Ron Paul, but that the US Citizens give a private bank (the FED is a private bank) and their owners, private bankers, the exclusive right to print their money and sell it to them, and full control over the Dollar and the US economy, OMG, unbelievable, how can they be so stupid and accept that?????"
,anon.1776,2012-05-17T22:58Z,"Vote Ron Paul 2012. Despite what the media tells you, he is not dropping out! He needs your support!

For Liberty!

https://secure.ronpaul2012.com/?pid=dpmb"
,kophee,2012-09-07T07:21Z,thank you so much!!!
