User Type,Username,Date,Text
,spklupus,2012-03-25T15:56Z,thanks for all great kink
,zayanrox,2012-03-25T18:21Z,thx for ur efforts can u please get any of Clips 4 sale princess lyne/ brattybunny / princess rene ? or they are so hard 2 get ?
,emtoec,2012-03-25T18:52Z,Thanks!  Much appreciated M!
,shallow2,2012-03-25T19:14Z,"We always keep an eye out for requested material within the fetishes/genres we upload. But we dont get stuff directly from sites, we only re-distribute material found elsewhere.

Requests noted, stay tuned.."
,emtoec,2012-03-26T04:24Z,Thanks Shallow... !
,WhipassSA,2012-03-26T18:36Z,Thanks shallow2
