Filename,Size,Unit
Arjun.The.Warrior.Prince.2012.DVDRip.PAL.DD5.1.Eng.NL.Subs.nfo,791,B
Arjun.The.Warrior.Prince.2012.DVDRip.PAL.DD5.1.Eng.NL.Subs/Arjun The Warrior Prince (2012) Cover.jpg,706.34,K
Arjun.The.Warrior.Prince.2012.DVDRip.PAL.DD5.1.Eng.NL.Subs/Arjun.The.Warrior.Prince.2012.DVDRip.PAL.DD5.1.Eng.NL.Subs.iso,4.29,G
Torrent Downloaded From BTScene.eu.txt,45,B
Torrent Downloaded From ExtraTorrent.com.txt,353,B
Torrent Downloaded from limetorrent.txt,50,B
Torrent downloaded from AanMeHoelaJa Torrents on BTScene.eu.txt,71,B
Torrent downloaded from AhaShare.com.txt,58,B
Torrent downloaded from Demonoid.me.txt,46,B
Torrent downloaded from KAT.ph.txt,41,B
Torrent downloaded from Rarbg.com.txt,33,B
Torrent downloaded from thepiratebay.se.txt,50,B
tracked_by_h33t_com.txt,23,B
