Filename,Size,Unit
CD/01. Million Dollar Bill.mp3,7.83,M
CD/02. Nothin' But Love.mp3,8.29,M
CD/03. Call You Tonight.mp3,9.58,M
CD/04. I Look To You.mp3,10.24,M
CD/05. Like I Never Left.mp3,8.87,M
CD/06. A Song For You.mp3,9.68,M
CD/07. I Didn't Know My Own Strength.mp3,8.5,M
CD/08. Worth It.mp3,10.75,M
CD/09. For The Lovers.mp3,9.76,M
CD/10. I Got You.mp3,9.72,M
CD/11. Salute.mp3,9.7,M
CD/12. I Didn't Know My Own Strength (Daddy's Groove Magic Island Radio Mix).mp3,7.33,M
CD/Whitney Houston - I Look To You.mp3.cue,2.06,K
CD/~ - I Look To You.m3u,984,B
