Filename,Size,Unit
"Aerial view of Old Town (Stare Miasto) in Gdansk, Poland.jpg",486.42,K
"Alaskan brown bears wait for salmon at Brooks Falls in Katmai National Park and Preserve, Alaska.jpg",243.45,K
"Black-browed albatross family on Steeple Jason Island, Falkland Islands.jpg",186.95,K
"Bonfire in Iffeldorf, Bavaria, Germany.jpg",229.75,K
"Camel caravan through the Sahara Desert near Djanet, Algeria.jpg",220.39,K
"Eastern grey kangaroo in Murramarang National Park, New South Wales, Australia.jpg",377.96,K
"Elephant trails bisect the green grasses of Amboseli National Park, Kenya.jpg",501.49,K
"Field of sunflowers in Castile and Leon, Spain.jpg",256.99,K
July.31.2012.jpg,560.88,K
"Library of Parliament in Ottawa, Ontario, Canada.jpg",343.69,K
"Mustard rows during springtime in a vineyard of the Carneros wine region, California.jpg",543.23,K
"Northern Fulmar adult, in flight, view down precipitous cliff towards sea, Shetland Islands, Scotland.jpg",304.12,K
Ocean boardwalk.jpg,254.28,K
"Ocean waves near Ventura, California.jpg",352.35,K
"Overflow from Lower Nihotupu Reservoir near Auckland, New Zealand.jpg",211.32,K
Partial eclipse of the moon setting over the Gulf of Mexico.jpg,83.54,K
"Promenade Mall Fountain, Forsyth Park in Savannah, Georgia.jpg",560.28,K
"Rustic Black River covered bridge near South Haven, Michigan.jpg",415.04,K
"San Felipe Barajas Castle in Cartagena de Indias, Colombia.jpg",400.71,K
"Sea otter grooming in Prince William Sound, Alaska.jpg",236.04,K
"Still image of time-lapsed night sky and lights in Monument Valley Navajo Tribal Park, Utah.jpg",309.95,K
"Storm clouds over the mountains of Denali National Park and Preserve, Alaska.jpg",349.47,K
"The Athabasca River below the Athabasca Falls in Jasper National Park, Alberta.jpg",721.2,K
"The crypt at Winchester Cathedral, Hampshire, England.jpg",267.24,K
"The Saddledome with Calgary Tower and the city skyline in the background at dusk, Calgary, Alberta, Canada.jpg",363.43,K
"The snow-capped La Sal Mountains behind sandstone pinnacles at Devils Garden in Arches National Park, Utah.jpg",307.39,K
"Travertine terraces of Pamukkale, Turkey.jpg",331.39,K
Unbrellas on a sunny beach in Southern Thailand.jpg,186.01,K
Whitemargin unicornfish.jpg,141.27,K
"Wind turbines near Livermore, California.jpg",385.06,K
Yoyo tsuri water balloons in the pool at a neighborhood festival in Japan.jpg,305.85,K
