User Type,Username,Date,Text
,zorba088,2012-04-29T19:28Z,"Thank you
Can you please upload the new Where's my water version 1.5.1 that comes the levels and a new chapter of איק Cranky's story add-on ?"
,itsmedarla,2012-04-29T22:15Z,Bone..please upload the paperglider crazy copter HD..not in 3D--tnx:)
,puli9,2012-04-30T05:10Z,hi everyone visit www.apkmania.com and www.marketmilitia.org all your apk files are here
[T],cad40,2012-04-30T10:18Z,"have already uploaded where's my water 1.5.1 here

http://thepiratebay.se/torrent/7229223/WHERE_S_MY_WATER__1.5.1_Android"
[T],cad40,2012-04-30T12:33Z,"sorry the above link ive asked mods to remove as something went wrong when uploading have reuploaded and checked it works fine 

http://thepiratebay.se/torrent/7229507/WHERE_S_MY_WATER_1.5.1_Android"
,puli9,2012-04-30T18:16Z,plz upload block breaker 3 with sd data
