User Type,Username,Date,Text
,markyyy999,2012-06-17T06:17Z,thanks a lot man! :D 
,m.thrall,2012-06-22T04:57Z,"The original 72-episode run of Futurama was produced as four seasons; Fox broadcast it out of the intended order, resulting in five aired seasons. This list features the episodes in original production order, as featured on the DVD box sets.

http://epguides.com/Futurama/
"
,offthemap,2012-06-30T04:11Z,Wont play on VLC? help please.
,Fur0n,2012-07-04T03:15Z,The video is chopy
,dasjacobfilms,2012-07-26T09:59Z,Will this work on my Xbox..Because anything AVI on my Xbox 360 works fine and I think MPEG too but I don't know what AVC is.  
,_CVX_,2012-07-26T13:25Z,AVC-1  is used in Bluray
