User Type,Username,Date,Text
,pat.bateman,2012-10-15T15:29Z,"Thanks! And btw I didn't mean ""NLDS"" I meant NLCS Cardinals vs Giants game 1, when you can plzzz upload it."
[V],Nepotu,2012-10-15T21:03Z,"Yes, I know. It's already up."
,velocityvirus,2012-10-16T01:20Z,"Hey man, appreciate your uploads of these Giants games. I can't get to watch the games live, so you have been a lifesaver!"
,XYippie,2012-10-16T04:05Z,"Thanks, Nepotu. Really, really appreciate this way the fuck out here in the Giants' Exile. We all appreciate your work out here in the Galut. Rock on, and Go Big Blue!!!"
,Mwonderland,2012-10-16T10:32Z,thanks mate
