User Type,Username,Date,Text
,potprinc3,2012-07-08T21:57Z,Hey dude can you post any file info like Bitrate and other details?
,Mortikus,2012-07-08T22:03Z,"So far 14.4%, speed varies but bursts to 60kB/s, will post further details if OP doesn't when it is done."
,spann81,2012-07-08T22:26Z,Only 267.27 MIB? How is the quality on this one? It cant be good.
,potprinc3,2012-07-08T22:37Z,could be a stream copy. 
,nerbiyoso,2012-07-08T22:53Z,"same quality as my other upload:
http://thepiratebay.se/torrent/7401980/Motogp.2012.Round7.Assen.BBC.mp4

Video Codec: H264 - MPEG-4 AVC
Resolution: 640x360
Frame rate:25
Audio Codec: MPEG AAC Audio mp4a 44100 Hz

sorry i have slow max upload rate. will keep my initial seed until another release like regenzy's come up."
,potprinc3,2012-07-08T23:18Z,thanks for the info. waiting for regenzy. thanks anyways.
,Mortikus,2012-07-08T23:28Z,Thanks for the up nerbiyoso.  Anxious to see the race.
,Mortikus,2012-07-09T05:45Z,"You guys may enjoy this one...
http://thepiratebay.se/torrent/7426288"
