Filename,Size,Unit
Bill Salus - The Future of the Middle East - Psalm 83 vs Ezekiel 38-39.avi,1.53,G
War.avi,324.9,M
Shorts/The Holy and Profane - They Prefer Caviar Even If It Comes With Chains.mp4,207.39,M
History shows the 3rd Temple will soon be built.avi,188.2,M
3 Psalm 83 war and Ezekiel 38 war seminar with Frank DiMora.avi,168.24,M
Shorts/4 People Witness Angels Pulling People From Car Wreck.avi,164.92,M
And More/War and Rumors of Wars/Psalm 83 war and Ezekiel 38 war seminar with Frank DiMora-Pt 3.flv,164.17,M
Endtime News Updates 10-31-12.avi,161.01,M
Endtime News Updates 10-17-12.avi,152.4,M
Endtime News Updates 11-11-12.avi,150.33,M
WHEN YOU SEE ALL THESE THINGS-PROPHECY IN OUR FACE.avi,147.34,M
And More/The Holy Spirit/Beautiful - Mercy Me HD.mp4,143.41,M
5 Ezekiel and the Sudan puzzle coming together.avi,126.48,M
7 More attacks on Israel Nov. 14_ 2012.avi,119.67,M
6 Israel in the eye of the storm-America in the eye of the storm- Nov. 2012.avi,110.42,M
Shorts/Americas Christian Heritage - Dr G Thomas Sharp.flv,101.06,M
Psalm 83 Shorts/Ezekiel and the Sudan puzzle coming together.flv,97.02,M
SIGNS  pt4/Top Scientist Say Earth gripped by a Rapidly Changing Climate   Worst is Yet to Come.flv,96.91,M
4 Psalm 83 war and Ezekiel 38 war seminar with Frank DiMora.avi,88.65,M
And More/The Holy Spirit/A Muslim Man's AMAZING Testimony about Jesus.avi,86.48,M
SIGNS  pt4/Most Hated People - Israel Why I Stand With Them.flv,83.59,M
And More/The Holy Spirit/Copy of I Have Decided - IDOP.mp4,81.97,M
1 Psalm 83 war and Ezekiel 38 war Seminar with Frank DiMora.avi,80.18,M
SIGNS  pt4/Revelation There Shall Be Signs Welcome To The World_World Wide Message Pt 11.flv,78.99,M
SIGNS  pt4/GMO Foods  Science PR and Public Backlash.flv,77.74,M
SIGNS  pt4/Copy of I Have Decided - IDOP.mp4,74.52,M
Psalm 83 Shorts/UPDATE_ The Israel-Gaza Conflict and Syria (Part 1).avi,74.43,M
SIGNS  pt4/Past 15 Days of GLOBAL APOCALYPTIC SIGNS OF END TIMES Oct 2012.flv,73.39,M
SIGNS  pt4/Bob Larson Exorcises Pirate Demon.flv,71.72,M
Psalm 83 Shorts/Hamas fire Rockets at Jerusalem while Egypt embraces the Terrorist 11-16-12.avi,69.46,M
And More/Signs of the Times/QUADROTOR SHOW dance  manipulate sound and light.mp4,66.68,M
SIGNS  pt4/Warning To America 1987 by Lester Sumrall.flv,62.35,M
And More/The Holy Spirit/Be Still And Know That I Am God2.mp4,61.99,M
And More/SIN-ister Clips/The Bad Guys 101.flv,59.87,M
Psalm 83 Shorts/Breathtaking dishonesty and arrogance in Benghazi scandal.avi,58.98,M
Shorts/2011 - 2012   duty of remembrance.flv,58.67,M
2 Psalm 83 war and Ezekiel 38 war Seminar with Frank DiMora.avi,56.5,M
SIGNS  pt4/The Underground Job Work in Progress PART 1.flv,54.75,M
And More/War and Rumors of Wars/Whats Behind Libya.flv,54.18,M
SIGNS  pt4/2012 Pt9 Signs Tornados Floods   Prophecy 2010-2012.flv,53.82,M
Psalm 83 Shorts/UPDATE_ The Israel-Gaza Conflict and Syria (Part 2).avi,52.87,M
Shorts/2012  Iceland Dismantles Corrupt Govt Arrests All Rothschild Bankers.flv,51.96,M
And More/Signs of the Times/Polish Plane Crash GeoUNgineering Internet Surveillance 11 01 12.flv,50.21,M
Shorts/4 MORE Years.flv,49.56,M
SIGNS  pt4/2012 IS STRANGE Pt 68 OCTOBER 2012.flv,49.24,M
SIGNS  pt4/Bob Larson  Exorcism of a Witchcraft Demon.flv,47.38,M
And More/Martyrs of Today/2.7 BILLION_ How will they hear the name of Jesus_.avi,45.98,M
SIGNS  pt4/9 6 12 EQ Overview  Two weeks of major unrest.flv,44.9,M
Psalm 83 Shorts/Israeli naval vessels shooting at Gaza coast line as dawn breaks..avi,44.81,M
SIGNS  pt4/UFO mainstream media coverage MASS SIGHTINGS taking place.flv,44.26,M
SIGNS  pt4/EU forming Central Bank signs of New World Order 10-23-12.flv,44.06,M
SIGNS  pt4/Bible Prophecy - Brotherhood Executing Christians and Journalists in Egypt.flv,43.75,M
SIGNS  pt4/Marines Police Prepare for Mock Zombie Invasion.flv,43.11,M
SIGNS  pt4/Killed for Organs  China's Secret State Transplant Business.flv,40.66,M
SIGNS  pt4/United Nations Ready To Take Over Our Towns.flv,39.38,M
SIGNS  pt4/CLIMATE CHANGE.flv,39.2,M
And More/The Holy Spirit/Biggest Reason believers unbelievers reject the gospel revealed2.mp4,38.93,M
And More/SIN-ister Clips/The Fox Catholic Nazi NIV.flv,38.29,M
SIGNS  pt4/The Fox Catholic Nazi NIV.flv,38.29,M
SIGNS  pt4/North Korea.mp4,37.65,M
Psalm 83 Shorts/Endtime News Updates 11-17-12.avi,37.64,M
SIGNS  pt4/Woman named Veronica exorcised by Bob Larson - Video not for kids.flv,37.04,M
Shorts/Propaganda BBC Photos of Syrian Massacres Recycled as Gaza Atrocities.avi,36.85,M
Psalm 83 Shorts/HAMAS in OPEN WAR w Israel after AIRSTRIKE KILLS military LEADER.avi,35.29,M
And More/The Holy Spirit/Drug Generation will Starve.flv,34.61,M
SIGNS  pt4/Signs In th Sun Moon and Stars 2012-2015.flv,33.28,M
the-last-chronicles-of-planet-earth-october-19-2012.pdf,32.66,M
SIGNS  pt4/UFO Sighting OHare Airport - UFO hovering in sky over ORD Airport.mp4,31.81,M
Psalm 83 Shorts/Israel calls up reservists_ gets ready for Gaza invasion.avi,31.3,M
SIGNS  pt4/WALL STREET  Take action by January to avoid Financial Crisis Economic Slump.flv,30.61,M
And More/Signs of the Times/America's Dictatorship Founding Fathers turn in graves.flv,29.1,M
SIGNS  pt4/America's Dictatorship Founding Fathers turn in graves.flv,29.1,M
Psalm 83 Shorts/CNN uses Video Footage of Faked Palestinian Injuries.avi,28.47,M
And More/The Holy Spirit/Creation Calls.flv,26.87,M
Psalm 83 Shorts/Israel knocks out Hamas drone program - Turkey condems Israel.avi,26.19,M
SIGNS  pt4/PROJECT BLUE BEAM of NASA secret project of the illuminati.flv,25.97,M
And More/Signs of the Times/11 5 12  Hurricane Sandy Weather modification Frequency pulses control weather.flv,25.43,M
SIGNS  pt4/Election 2012  The Illusion of Choice.flv,23.31,M
And More/SIN-ister Clips/Texas Weather Modification in Progress on ABC News - Oct 2012.flv,23.29,M
Shorts/Govt Scientists Hide Vaccine Autism Link.flv,23.02,M
And More/War and Rumors of Wars/Iran Threatens to Attack America if Israel Strikes.flv,22.1,M
And More/Signs of the Times/Generators and supplies sit unused  People cold and hungry 11-5-12.flv,21.12,M
And More/The Holy Spirit/Bible questions answers by CD Brooks.flv,20.28,M
SIGNS  pt4/Is a New Madrid Earthquake the next 9 11.flv,20.23,M
SIGNS  pt4/How to Search the News   Prophecy in the News.flv,19.57,M
Shorts/Bush Signs Nuclear Deal with United Arab Emirates 1-15-2009.flv,18.87,M
Psalm 83 Shorts/Iran Unloads Bushehr Nuclear Fuel - Distrubing.avi,18.49,M
And More/SIN-ister Clips/The UN Plan for World Govt by Larry Spargimino.flv,18.21,M
And More/Signs of the Times/Mega Mosque in UK  Fears of Sharia ghetto   extremism on the rise.flv,17.81,M
SIGNS  pt4/Robots Have Conversations When Nobody is Around oO Social Media Psychological Warfare - YouTube.flv,17.79,M
And More/Signs of the Times/PA Fracking on Campuses and Public Parks.flv,17.33,M
SIGNS  pt4/Fukushima Radiation Concerns In Alaska.flv,17.04,M
Psalm 83 Shorts/BREAKING - 7 Weeks of War - Israel tells nation.avi,16.88,M
SIGNS  pt4/Demonic Behaviour continues  Man  tries to eat dog Pembroke ON Canada.flv,16.84,M
Psalm 83 Shorts/Air Force hits 70 Gaza Strip targets in an hour.avi,16.64,M
And More/The Holy Spirit/Forgiveness and the Freedom of Letting go.flv,16.39,M
SIGNS  pt4/Hillary Rodham Clinton and Her Advisor.flv,16.21,M
And More/Signs of the Times/Psychopath Alert - Joe Klein defends the murder of children.flv,16.13,M
SIGNS  pt4/BREAKING PREACH about Homosexuality GET 10 YEARS IN PRISON 2012.flv,15.85,M
And More/SIN-ister Clips/SINKHOLE UPDATE  Nov 1 2012.flv,15.85,M
Shorts/The Doomsday Book   Judgement.flv,15.39,M
And More/SIN-ister Clips/Sudan Threatens To Attack Israel -   For Those With Eyes To See 10-24-12.flv,14.89,M
Shorts/A fishing license for the sky.flv,14.53,M
SIGNS  pt4/Teacher Cries 'hate crime' over Bible Left On Desk.flv,14.26,M
And More/SIN-ister Clips/Teacher Cries 'hate crime' over Bible Left On Desk.flv,14.26,M
Shorts/CHARLI Robot Gangnam Style.flv,13.63,M
And More/The Holy Spirit/BLOOD MOON Stars Falling GREAT EARTHQUAKE & Strong winds.flv,13.17,M
Shorts/California Passes Law Allowing Autonomous Cars.flv,12.77,M
And More/Signs of the Times/BY BY FREE SPEECH WikiLeaks search ban - censorship.flv,12.43,M
And More/SIN-ister Clips/Secret State Dept cable contradicts White House story.flv,12.15,M
Shorts/2 Timothy The Last Days.flv,12.14,M
And More/Signs of the Times/Court upholds Law that could imprison Pastors for preaching Biblical Doctrine.flv,12.09,M
Psalm 83 Shorts/Egypt following the Psalm 83 path!.avi,11.81,M
And More/The Holy Spirit/Beautiful One - Jeremy Camp.flv,11.59,M
Shorts/Cairo Clashes  Islam-insulting film sparks waves of violence protests.flv,11.51,M
And More/Signs of the Times/Book Review The David Flynn Collection.flv,11.48,M
Shorts/HR 6566.flv,10.88,M
SIGNS  pt4/Week ending 10-14-12.flv,10.71,M
Psalm 83 Shorts/Israel IDF fires into SYRIA after Mortar Shell hits Israeli Army on Golan Heights 11-11-12.flv,10.61,M
SIGNS  pt4/Military Mosquito Robots Collecting DNA   Blood! - YouTube.flv,10.45,M
SIGNS  pt4/UFO 3minute Fly over Broadacres Bridlington.flv,9.91,M
SIGNS  pt4/Drones now come in swarms.flv,9.87,M
Shorts/Iran  Mahmoud Ahmadinejad calling for a New World Order 9-26-12 (2).flv,9.73,M
SIGNS  pt4/Why Does Venus Look Like A Phoenix - watch 2 mins on.flv,9.38,M
And More/The Holy Spirit/Always - Switchfoot.flv,8.52,M
SIGNS  pt4/WOW - USGS LIVE SEISMIC SERVERS OFF THE CHARTS.flv,8.25,M
And More/SIN-ister Clips/RADIATION UPDATE  10-24-12 - no clams salmon season canceled large mammals w huge sores.flv,7.97,M
SIGNS  pt4/Zombie Nation   US Military and Police train for Zombie Apocalypse 11-01-12.flv,7.72,M
SIGNS  pt4/Zombie Apocalypse Science.flv,7.66,M
Psalm 83 Shorts/Gazans killed Israeli soldiers hurt in border clash.flv,7.61,M
Shorts/BREAKING Obama Exec Order Allows Seizure of Americans Bank Accounts.flv,7.54,M
SIGNS  pt4/1000s of Migrating Birds lost in North Sea.flv,7.39,M
SIGNS  pt4/Scientist Design Babies With DNA From 3 People.flv,7.39,M
And More/Signs of the Times/FEMA Damage Control Propaganda Govt Web Site 11-5-12.flv,7.31,M
Shorts/Army Manual Outlines Plan To Kill Rioters In America.flv,7.21,M
And More/SIN-ister Clips/RADIATION UPDATE America  10-28-12.flv,6.92,M
SIGNS  pt4/Heavenly Angel visits dying girl caught on video.flv,6.9,M
Shorts/Heavenly Angel visits dying girl caught on video.flv,6.9,M
SIGNS  pt4/A Final Warning From George Orwell.flv,6.9,M
And More/SIN-ister Clips/The Moon Illusion.flv,6.62,M
Psalm 83 Shorts/IDF precision PR footage Gaza Underground Bunker blasted.avi,6.57,M
"Shorts/10,000 MUSLIMS Protest GOOGLE to Limit Free Speech in London .flv",6.25,M
SIGNS  pt4/US Deploys 70 Nuclear Bombs In Turkey.flv,6.13,M
SIGNS  pt4/More Christian Persecution in Pakistan 10-21-12.avi,5.36,M
And More/The Holy Spirit/Chris Tomlin - I Will Rise2.flv,5.12,M
Psalm 83 Shorts/Syria Mortar Rounds Fired Into Israel 11-10-12.flv,4.69,M
And More/Signs of the Times/Hess Gas Station Sabotage - Diesel Fuel Sold NOT Gasoline.flv,4.2,M
And More/SIN-ister Clips/State aware of fungal meningitis outbreak wk before telling public 10-29-12.flv,4.04,M
Psalm 83 Shorts/Israeli Tanks Fire Into Syria.flv,4.01,M
And More/SIN-ister Clips/SINKHOLE UPDATE  10-26-12.flv,3.88,M
And More/The Holy Spirit/Call Unto Me.flv,3.62,M
And More/SIN-ister Clips/ROCKETS   MORTARS from Gaza Strip PUMMEL Israel after Israeli Airstrike.flv,3.45,M
SIGNS  pt4/Can You Explain This To Me  HUGE Triangle UFO Caught On Video 10-19-12.flv,3.28,M
SIGNS  pt4/MUST SEE Strange Mystery Cross On Mars.mp4,2.94,M
And More/Signs of the Times/MUST SEE Strange Mystery Cross On Mars.mp4,2.94,M
SIGNS  pt4/Lybia Grand Mufti - Remove Religious & Govt Freedoms from Textbooks 10-22-12.avi,2.14,M
Psalm 83 Shorts/Israel Fires Into Syria After Shell Hits Military Post In Golan Heights Fired From Syrian Territory.flv,2.04,M
SIGNS  pt4/Flying Humanoid in Arizona.flv,2.02,M
SIGNS  pt4/Amazing UFO Footage over Washington DC 1952.flv,657.75,K
67399_165065816853339_7002917_n.jpg,46.91,K
POtHS - Why We Do What We Do.txt,7.89,K
Info.txt,5.09,K
Torrent downloaded from Conspiracyhub.com.txt,47,B
