User Type,Username,Date,Text
,georgegalily,2012-03-05T11:23Z,TtHANX iM HAPPY TO BE THE 1ST TO COMMENT
[V],globeplus,2012-03-05T11:27Z,"PLEASE EVERYONE , READ THE NOTES FIRST ...

Thank you for downloading and happy tool for all of you ..."
,roystone,2012-03-05T11:40Z,thanks for this.
,earth3,2012-03-05T12:01Z,dude it is circumstance you gotta correct the spelling error in your ripping site :D
,earth3,2012-03-05T12:05Z,"dude i have a problem the icon thing is below mytaskbar i cant see it prperly
P.S: you could write english in shorter sentences it is hard to understand your instructions file"
,earth3,2012-03-05T12:06Z,thanks mate
,earth3,2012-03-05T12:16Z,it is fucking cool great app mate keep it coming
,earth3,2012-03-05T12:24Z,dude what are you really? do you develop apps or you rip games?
[V],globeplus,2012-03-05T12:52Z,"To earth3 : i forgot to include my flashgames website , so it will be a new version later in the day and maybe with 1 new add beside the forgotten website ... see you ."
[V],globeplus,2012-03-05T12:56Z,"To earth3 and any other users : the newest rips website have already close 60 gb in games rips available for download , i don´t believe that all of them was played already for any of you and many times we got periods without too many new pc games and the available pc games maybe not recent but certainly great pc games to play ... happy gaming to all of you ..."
[V],globeplus,2012-03-05T13:10Z,"Any suggestion from anyone to an application that you liked to launch from the desktop and not too easy accessable ? 

enjoy your tool ..."
,earth3,2012-03-05T13:25Z,just post the link
[V],Anacondaz,2012-03-05T13:33Z,+1 rep for another great upload mate
[V],globeplus,2012-03-05T15:11Z,"To paritdada : copy and paste in a comment the conteud of the reg file , edit the reg file then select copy and paste to a comment , i want to look what you have on the reg file ."
[V],globeplus,2012-03-05T21:51Z,"To paritdada :

Click on this link :

http://www.text-upload.com/read.php?t=9557"
[V],globeplus,2012-03-05T22:00Z,"HI ! I am preparing carefully a new version better than ever with new features like computer volume , notes that are acessable always , open and close the cd/dvd drive of the computer with just a click on the icon , 1 more site that i forgot and new pratical things , by tomorrow i probably have this final version finished ... see you all soon and happy tool to all of you of course ..."
,earth3,2012-03-06T11:18Z,dude your mass effect 3 is not working i think you forgot to add something:P
[V],globeplus,2012-03-06T19:30Z,"To paritdad : Get new cracks to the game and try to apply that in that perspective on the reg file , also try the LaunchEFLC.exe . GET THE GAME GOING !!!"
[V],globeplus,2012-03-06T19:32Z,"The development on the new complete version is beeing maded carefully , with more new useful features than ever and new sites and funny applications ... see you soon ."
,Sabretou,2012-03-07T11:41Z,"Globe, are you coming up with a Mass Effect 3 crack or not?"
[V],globeplus,2012-03-07T11:43Z,To paritdada : you need the path on the reg file correctly with the position of the folder on the computer including the name of the executable .
