User Type,Username,Date,Text
,PilatusPorter,2012-06-17T13:23Z,"After the weekend I always wait eagerly for the next Nascar race torrent. In Europe it's difficult to watch, so I (or should I say ""we""?) appreciate these Nascar uploads very!

Thanks so much!"
,talisbriedis,2012-06-19T06:53Z,"THX for Pocono, what happened to Dover? I noticed I could watch Michigan live on-line, but in Europe it gets pretty late. I dozed off at lap 120 and only woke up to the cheers of Dale's win. I would still like to see the rest of the race..."
,Puterman,2012-06-21T00:50Z,"Thank you SOOOO much for the races. 
Please upload the full Michigan race......"
