User Type,Username,Date,Text
,slimshd,2012-03-14T04:20Z,thanks man...many many thanks... can you upload big bang theory s4 web dl version????http://thepiratebay.se/torrent/6431749
[V],maximersk,2012-03-14T06:08Z,"Sorry, not now ! I must upload HIMYM S02, S05 and S07 and after NEW GIRL S01 !!!
And nobody wants my 720p ReEnc ! People sucks !"
,Booz3,2012-03-14T22:13Z,"Max, 
That's not true. I am your fan mate. I have already downloaded all these season but I am replacing them with yours. "
[V],maximersk,2012-03-15T05:53Z,"@Booz3
Thanks a lot, m8 ! I know you love me, man ! We're fucking friend ! But, only 40 peers ! Explain... lol"
,Booz3,2012-03-15T21:05Z,"Max, 

Mate do you why the other uploaders have that many peers because they upload to other site and have more trackers. You just upload here at TPB only and these leachers are from TPB only. If you want more peers then mate you have to upload to the others sites as well. I am sure people will love you upload."
[V],maximersk,2012-03-16T06:08Z,"@Booz3 
You didn't read my ""read me"" ! I uploaded my torrents on Pirate Bay, Kick ass torrent, Fenopy, 1337x. "
,Booz3,2012-03-16T19:34Z,"Max I know you have a couple of site but upload on bigger and more popular sites. 

But anyway mate when are you going to upload the rest of the season. waiting for them mate  "
,akshayoh,2012-04-21T12:33Z,"thanks man for season: 1,2,3,4,6......
bye the way bro when are you going to upload season 5..... please upload it fastly, sothat we can enjoy it tooo.....
Thanks again man....."
[V],maximersk,2012-04-29T00:51Z,http://thepiratebay.se/torrent/7217314/How.I.Met.Your.Mother.S05.720p.HDTV.ReEnc-[maximersk]
,athanbjr,2012-04-30T10:38Z,"hi maximersk, two things, do u have top gear season 10 more specifically episode 3? then also for these seasons of how i met your mother from season 4-6 can u send me the torrent file coz am having a problem with magnet and i have updated my client 3 times already in the last 2 hours. my mail is athanbjr@gmail.com. thanks for the good job though keep it up"
