User Type,Username,Date,Text
,lhgaw2,2012-08-20T05:42Z,Thanks Dibya! Can always count on you for great 720p shows!
,Moops420,2012-08-20T05:52Z,Don't trust this fucker!
,baretoof,2012-08-20T06:10Z,thanks
,nuke4u,2012-08-20T07:02Z,Is this version censored?
,freaky4l,2012-08-20T07:23Z,Heyyy its legit. Thanks a lot
,freaky4l,2012-08-20T07:24Z,"And no, it is uncensored"
,freaky4l,2012-08-20T07:25Z,"Heyy its legit, and uncensored!!"
,freaky4l,2012-08-20T07:30Z,"oops I lied, and apparently I don't know how to comment either.  The video is good, it's censored though, I guess? They still swear and all"
,Eat_Guy,2012-08-20T08:35Z,PublicHD is always quality. Thanks!
,yousefak,2012-08-20T13:39Z,spoiler: walt dies
,samscam,2012-08-21T00:35Z,Definitely censored. Down to a blurred out on-screen use of the F-word. Ah well.
