User Type,Username,Date,Text
[V],psspss,2012-08-24T14:10Z,"this is a good read..

cant disagree with it myself

http://www.huliq.com/10473/american-gypsies-johns-family-makes-mockery-family-values"
[V],psspss,2012-08-24T17:06Z,"according to the antip2p you should be able to download this legal... 

so can we? itunes is it.. oh yeah you have to be a yank to buy it LOL

enjoy the read

http://torrentfreak.com/mpaa-wrongly-downplays-hollywoods-role-in-keeping-piracy-alive-120823/"
,jpopp98,2012-09-01T03:22Z,Episode 7 anyone? :)
[V],psspss,2012-09-06T14:17Z,"havent found a source as yet

must be out there though p2p is always the last place it will show up on"
