Filename,Size,Unit
Dance Moderno/02 Love For Sale.mp3,3.92,M
Dance Moderno/05 Olhou Para Mim.mp3,3.74,M
Dance Moderno/08 On Green Dolphin Street.mp3,3.6,M
Dance Moderno/06 Satin Doll.mp3,3.5,M
Dance Moderno/11 Nica's Dream.mp3,3.4,M
Dance Moderno/10 Disa.mp3,3.35,M
Dance Moderno/04 What Is This Thing Called Love.mp3,3.21,M
Dance Moderno/01 Oba-Lá-Lá.mp3,3.2,M
Dance Moderno/09 Outra Vez.mp3,3.12,M
Dance Moderno/03 Tristeza de Nós Dois.mp3,2.78,M
Dance Moderno/07 Tema Sem Palavras.mp3,2.66,M
Dance Moderno/12 Diagonal.mp3,1.92,M
Dance Moderno/sergio-mendes-dance_moderno.jpg,91.49,K
