Filename,Size,Unit
Thanks/Torrent downloaded from 1337x.org.txt,33,B
Thanks/Torrent downloaded from Darkcore.me.txt,35,B
Thanks/Torrent downloaded from Extratorrent.com.txt,47,B
Thanks/Torrent downloaded from h33t.com.txt,39,B
Thanks/Torrent downloaded from Silvertorrent.org.txt,25,B
Thanks/Torrent downloaded from thepiratebay.se.txt,39,B
CharmeLeon on FaceBook.txt,385,B
Cover.png,305.59,K
English.srt,147.72,K
Lage Raho Munna Bhai 2006 Hindi 720p BRRip CharmeLeon Silver RG.mkv,851.03,M
Sample.mkv,3.74,M
Silver RG on FaceBook.txt,165,B
SilverRG NFO Read it.nfo,8.24,K
