User Type,Username,Date,Text
,sabah1122,2012-02-27T02:25Z,fix is not working. help..... plzzzzz..........
,sabah1122,2012-03-01T13:10Z,anyone for help here?.................
,GameMasterDante,2012-03-24T01:03Z,"@sabah1122
Rename the pkg fix to have the extension .pkg and it will work.That's what I did.First install the game then the fix,Happy gaming ;)"
,Jamzilla,2012-04-09T22:30Z,wuld diz work on my psp??
,Haydz23,2012-08-04T10:06Z,can someone please explain how to install this to my ps3. I have put it on a usb stick but dont know how to install it through the system
