Filename,Size,Unit
INFO TBS/www.black-Sam org     Kom eens Langs !.jpg,13.1,K
INFO TBS/Torrent downloaded from Silvertorrent.org.txt,720,B
INFO TBS/Torrent_downloaded_from_AhaShare.com.txt,629,B
INFO TBS/Torrent Downloaded from  Movie-Torrentz.txt,607,B
INFO TBS/Tracked by H33T.txt,606,B
INFO TBS/Black-Sam.txt,128,B
INFO TBS/Torrent downloaded from BettyBoop torrents on BTScene.eu.txt,68,B
INFO TBS/Torrent Downloaded from  btscene.eu.txt,42,B
Person of Interest S02E01/Person.of.Interest.S02E01.720p.HDTV.X264-NLsubs.mkv,958.88,M
Person of Interest S02E01/Person.of.Interest.S02E01.720p.HDTV.X264-DIMENSION.srt,46.49,K
Person of Interest S02E01/Person of Interest S02E01 HDTV 720P DD 5.1 Eng NLsubs B-Sam.txt,2.26,K
