User Type,Username,Date,Text
,matthew99144,2012-08-25T06:10Z,hehe sorry about forgetting to seed my own fing torrent! Fixed and seeding indefinitely.
,matthew99144,2012-08-25T06:12Z,Please rate my torrents so that it gives me a reason to upload more of my lossless music!
,kiz,2012-08-27T15:54Z,"Good rip: no clipping, no bottoming out

It's not just some youtube rip converted to FLAC"
,matthew99144,2012-08-29T06:13Z,"It's a legit copy (I bought it), and due to security reasons please use ""my other""  account from now on:

thepiratebay.se/user/insanemusic777"
