User Type,Username,Date,Text
,CAPTAINBEYEO2,2012-09-18T08:48Z,WHAT CAN I SAY AFTER READING THAT COMMENT. !!!
,tbs2008wme,2012-09-18T16:11Z,"fuck you uploader
you know nothing about islam religion
I am Proud to be Muslim "
,Mega_troll,2012-09-18T23:04Z,"@CAPTAINBEYEO2
@tbs2008wme 


ACCEPT IT.
THIS IS WHO YOU ARE.
FIRST YOU ENTER COUNTRY OB HANDOUT next you shows your real color"
,Mega_troll,2012-09-18T23:06Z,good stuff
,CAPTAINBEYEO2,2012-09-19T10:57Z,"@ FUCK YOU.
                      I'M A TRUE SCOT AND NOT SOMEONE WHO LIES, STEALS, CHEATS, MURDERS OTHERS,AND I'M NOT BRAIN WASED EITHER.
            Drinking smoking stealing lying abusing young women are against your religion,but you do these things, So STFU. YOU LOT ARE NO SAINTS OR ANGELS EITHER OR PURE."
,CAPTAINBEYEO2,2012-09-19T11:00Z,"@ FUCK YOU.
                      I'M A TRUE SCOT AND NOT SOMEONE WHO LIES, STEALS, CHEATS, MURDERS OTHERS,AND I'M NOT BRAIN WASHED EITHER.
            Drinking smoking stealing lying abusing young women are against your religion,but you do these things, So STFU. YOU LOT ARE NO SAINTS OR ANGELS EITHER OR PURE."
,mrehabaly,2012-09-20T01:44Z,"WE ARE MUSLIMS  ,, WE LOVE ,,, WE RESPECT  , WE BELIEVE IN ALLAH AND MOHAMMAD  (  PBUH )  YOU HATE  ,, YOU MAKE WARS  ...  YOU KILL FOR OIL  ,,  YOU KILL YOUR SELVES ,,, YOU DRINK AND LOOK DEAF AND BLIND ,,  YOUR WOMEN ARE FOR ALL   ,,,  YOUR GIRLS FOR FREE  ,,,    YOU BETTER ASK YOUR SELF  ABOUT YOUR REALITY  MAN "
,raenkae,2012-09-28T21:34Z,"mrehabaly: Looks like some robot is saying this stuff. I believe it was Goebbel who said that if you repeat an lie enough times, it turn to truth in the eye of the follower.

What is your EVIDENCE that an purely ARABIC deity like Allah even exist? Disregard now your stupid book! What other evidences do you have that you are right and we are wrong?

Is it because your ""beautiful and wise"" Imam is telling you this SHIT?

Your Imam wants your money and obedience. NOTHING MORE!

He wouldnt tell you about all the suffering and persecutions that islamists have done through the centuries. He wouldnt tell you about all the terrible things that the saudi family as all the rulers in middle east is involved in today as before.

There is a lot of things that YOUR IMAM is not telling you about the world. He wants to have you brainwashed!

But the information is hard to stop these days. Although they try. They keep on trying! And there are always stupid peoples around falling for their trap!"
