User Type,Username,Date,Text
,whitepower72,2012-03-22T03:02Z,slow as 5 hrs to download. seed plz
,Wayne_Brady,2012-03-22T04:01Z,"I started streaming this from my Macbook Pro to my PS3 via a media server, and 2 minutes into the movie a message popped up saying something to the effect of ""this file is protected by _____"" and that streaming was not allowed, Wayne Brady has downloaded and streamed many movies and such a message has never popped up, wish I could remember what it said it was protected by but I was stoned then, and I'm stoned now."
,MalikeW,2012-03-22T05:20Z,"@Wayne_Brady, its a Sony picture.  You'll never be able to stream a Sony film pirated through your ps3 thanks to the Cinavia protection.  Those bastards."
,pjones452,2012-03-22T05:39Z,do not click those links they're BS!
,aceman2010,2012-03-22T07:24Z,@wayne  use showtime and you can watch in on your ps3
,aceman2010,2012-03-22T07:25Z,http://thepiratebay.se/torrent/6981642/%5BPS3%5D_Showtime_v3.4_Official
,aceman2010,2012-03-22T07:28Z,did you erase my comment
,some-young-guy,2012-03-22T10:38Z,"@ Wayne,

Sony uses Cinavia to screen out potentially pirated materials.  Some files that are in other formats PS3 also doesn't recognize.  My latest torrent has the PS3 sever and the codec app that enables PS3 to view the blacklisted formats but it still doesn't get around Cinavia.

The best solution I hope for is for someone to edit the PS3 operating system to exclude Cinavia, then release that OS right here on the bay. "
,lentheric,2012-03-22T12:52Z,"change the file name Wayne Brady, might be enough to bypass cinevia protection. :)"
,Kole97,2012-03-22T13:53Z,For those wondering whats this movie all about - Trailer -http://thepiratebay.se/torrent/7122787/21_Jump_Street_(Trailer_Official_2012)_HD___K97
,jcadman26,2012-03-22T15:22Z,new to pirate bay and just downloaded this movie and plays fine on laptop but when i stream through xbox its out of sync really bad just wondering if theres owt i can do to fix this thanks
,casper1690,2012-03-22T15:57Z,"jcadman26

there is a way to fix it!! copy to ub or data dvd and bingo sync is ok as per on laptop/pc"
,exarmy28,2012-03-22T18:16Z,13 comments and only 1 about the quality of the film??...LengendET is there any possibility you can metion the quality when uploading? cheers.
,TAP6945,2012-03-22T22:00Z,Not a bad TS..... v6 A6 very watchable!
,Sharpy408,2012-03-22T22:25Z,Why do people still upload this cam garbage bullshit?
,adam48,2012-03-22T23:56Z,they charge credit card even is free signup
,pacotato,2012-03-23T01:03Z,"I agree, watching this TS or cams is just from the past. If you want to watch a movie, better wait for the dvdrip. I don´t even know why I´m reading this post!"
,jcadman26,2012-03-23T01:13Z,casper1690 thanks for that great help appreciate it! :)
,jcadman26,2012-03-23T01:20Z,"casper1690 thanks for that great help appreciate it! :) and just saying the quality of this film in my opinion is pretty dam good considering only just come out and all week just been losers putting fakes on so either be greatful for it, dont bother or pay to go see it thanks for upload and thanks again for advice"
,seekr3333,2012-03-23T02:50Z,all you cunts could lick my ass cams are the shit if your broke and dont want to pay to see it in the cinema im a fucking bum this shit great peace out all e all ........ps dont clik the link above my comment its pure horse shit crap pond scum 
,seekr3333,2012-03-23T02:52Z,oh if you really want to see this movie streaming go to www.movie2k.com much much much better
,thsnfs,2012-03-23T04:35Z,"other comments linking to ""dvd"" and ""bluray"" versions are viruses.

ignore those cunts."
,jrcurrie,2012-03-23T07:14Z,good rip very watchable. anybody else has something negative to say about it go buy a movie ticket and go to the fuckin movie theater they are still around problem solved. thanks again LegendET! 
,jrcurrie,2012-03-23T07:31Z,good rip very watchable. anybody else that has something negative to say about it go buy a movie ticket and go to the fuckin movie theater problem solved. thanks again LegendET
,jo2theno,2012-03-23T11:26Z,not the best quality but very watchable. it was an alright movie thanks for the upload
,(hotrodder),2012-03-23T16:53Z,"this is the second time downloading this movie from 2 dif. sources, to try to get it to convert & burn with convert X but stops error saying audio discontinuity
 is there something i need to do to get this movie to burn on a DVD?
 i have other DVD burn programs just never had any problem with X before?
 convert DVD did burn but tried to play in my Sony blue ray player it came up with same bullshit Wayne_Brady had.
 anybody else have a fix or is everybody just streaming through the laptop?
 thanks all and keep the movies coming!
 and as far as bad ratings and bashing on cams who gives a shit as long as we have movies to watch when people do not have money or the means to get out to see at the show, watch the cams then burn dvdrips when they come out to watch over and over again!
jmo
p.s. i have quite the collection of programs and flicks so I'll be uploading a shitload of great quality soon"
,cragfrumtarn,2012-03-24T09:49Z,"a 6
v 3 like watching the film through frosted glass with clingfim over yr eyes , wait for screener"
,Rush,2012-03-24T09:56Z,"@(hotrodder)... go to settings>audio>tick... ""do not fix audio discontinuities""

this will override the encoder trying to fix the unfixable... sound will be left as original source quality."
,ste199021,2012-03-24T11:10Z,plz seed 
,neptune898,2012-03-24T19:51Z,http://www.imdb.com/title/tt1232829/
,tr99tr,2012-03-24T20:58Z,well why dont yous fuck off back to them sites then you fuckin trolls we all know there there but but choose not to go  ok
,(hotrodder),2012-03-25T06:57Z,"@rush.....THANKS!
da- I should of caught that but again thanks that did the trick, and i streamed through the laptop and thought was very watchable ,especially for a cam, idn 6-7?"
,mattM,2012-03-25T11:18Z,"m 8
watched at the cinema tonight. worthwhile paying for. very funny though quite cliche lol. enjoy guys :)"
,(hotrodder),2012-03-26T01:48Z,"how do you change the file name and to what? still having trouble burning it, runs for 30 sec and stops right after he walks in the door,just wasted 4 disc's:) but did seem to burn OK through X (no errors this time)but wouldn't play on the brp"
,nathanielbeander,2012-03-26T03:40Z,thx 4 the tip with the convertx
,LHRRecon,2012-03-26T04:21Z,bad upload. the audio doesn't match up with the video almost every scene. 
,Adroit-some,2012-03-26T11:00Z,fUck all the spammers. its the real deal. u wont get anyting better from any other friggin place
,revadam9,2012-03-26T11:41Z,"Superb Cam rip
V:7
A:7
For a cam I give it thumbs up all day long!!
M:9 "
,syst3m68,2012-03-26T12:38Z,"Best rip of this around, real too.

A - 5
V - 6

Good rip for a cam! Thanks LegendET! "
,pyramania,2012-03-27T00:52Z,"WTF are you stupid fvcking dorks doing here spamming for other sites and directing people to places to see movies. If your not here to download something on PB then go back to the aborted placental world you came from and leave this site alone, your simple fvcking brains aren't big enough to comprehend what PB is all about. I hope you all choke on a big dick you ignorant cock suckers."
,FluffyBunyAlpha,2012-03-28T18:33Z,"a - 8
v - 4
m - 9

funny, but quality sucked"
,oxjoexo,2012-03-29T02:03Z,"Audio-8
Video quality-8

Was very clean for being a camera recording :)
+1"
,Korriban,2012-03-29T19:02Z,"@ HotRodder to make your dvd's work on ps3 or any sony you have to go into your convertX settings then go to dvd specification then under format change it to NTSC (US,Asia) and then you should be good to go."
,RW-EXplosion,2012-03-29T20:53Z,"A8
V6

Decent Cam, watchable"
,don49,2012-03-29T21:06Z,CAUTION!!!  this file is currently being tracked!  just got my copywrite warning e-mail from ISP for this download
,huegart,2012-03-30T04:49Z,so is it good or bad  ppl need to make up there minds some of you say quality is good and the others say its bad what is it
,jmoney80,2012-03-31T06:52Z,The audio is very off by about 6-8 seconds and is missing big chunks of the audio as well.. Wait for a better download!
,REDEYESWOLF,2012-03-31T08:44Z,"To people who want to play this on your ps3, only one step, change the movies name to 1 or something random. That is the reason I don't fuck with sony, they suck major balls.."
,imunionjack,2012-03-31T15:02Z,Amazing amount of spam comes in TPB lately
,S33DM3,2012-03-31T22:22Z,"This movie is so epic, just saw it in cinema!!!!!! You must watch it.."
,p00nz,2012-04-03T05:26Z,"Yes LegendET im sure its great, put i want honest opinion without saying ""+3 for being camera so its A10 V10""

what quality is it?"
,p00nz,2012-04-03T05:40Z,"Ok straight up quality is:

V:4
A:6.5"
,TPB.rocks,2012-04-03T17:13Z,dont bother yet. the dubbing is away out so not worth watching
,tr99tr,2012-04-04T23:08Z,why dont you two above fuck off you fucking trolls why dont you two go and get layed instead of spamming no one gives a shit about your sites bellends
,TitsMcGee7,2012-04-08T02:15Z,"A 7
V 5
Turned it off 5 minutes after it started, couldnt see shit"
,andrewrope,2012-04-08T04:33Z,out of sync dont bother
,ShakeJunt,2012-04-09T01:18Z,Someone needs to ban these faggots who keep posting their shitty websites in the comments section on every damn torrent. Fuck you and your foreign websites!
,Rush,2012-04-09T22:25Z," @hotrodder (Off topic..) .... I assume you're previewing your encoded ConvertX TS file on VLC BEFORE you burn. 

If the TS vid file has problems this is where you want to catch it... not making coasters.

Don't need to change the file name for home dvd players or VLC playback. 

 ConvertX has a good built in burner but IMGburn is better and has wayyyyy more options...

Save all ConvertX files to location of choice and load from there to IMGburn, instead. Tick ""verify disk"" after burn to check for errors... if there is one it will show in log 

Thanks again LegendET... for all the effort... all disrespectful pukes should try and upload their own better copies or shut the fuck up, posting crap about a trusted and verified quality up-loader.... this guy spends hours of work tweaking these before uploading to PB....

Just like yo momma used to say ""If you don't have something nice to say shut the fuck up you little brat""

Like most cam-rips.... this is a little dark... tick up brightness/contrast a few clicks on your player  when playing cam-rips and it helps considerably."
,sh0.at,2012-04-11T01:13Z,if you are one of those newage retarded mtv kids u can watch this i guess but ... hell this is the biggest bullshit i've ever seen tbh
,captaincritic,2012-04-12T05:29Z,Turned it off couldnt see shit                                         A/5                                                                      V/ fuck it
,captaincritic,2012-04-12T05:31Z,Oh forgot to thank you for the up LegendET
,BaronVonWatermelon,2012-04-17T22:49Z,Since when did fat losers become funny...?
,Rastamanse,2012-04-19T00:46Z,chejaiwr // this is no noob hacking site! leave
,DexPedition,2012-04-27T14:51Z,"Verry watchable! v/7 A/6 M/10

loved the movie!"
,asercv,2012-04-28T00:24Z,"Christiany214 says the same bullshit on every torrent, with his bullshit link. fuck him"
,snabbnudlar,2012-05-19T18:39Z,"A:4
V:3
Bad quality"
