Filename,Size,Unit
600 Volumes - POtHS Torrents seeded 7-4-2012.rar,69.71,M
And More/Martyrs of Today/Chinese Use Shock Baton to Torture Christians.mp4,3.2,M
And More/Martyrs of Today/Coptic Christians Egyptian Security Forces Clash in Cairo.flv,6.74,M
And More/Martyrs of Today/IDOP 2011  Padina Trailer - YouTube.mp4,18.5,M
And More/Signs of the Times/18 Yr Old Charged With Attempt To Use Weapon Of Mass Destruction Supplied By The FBI.flv,1.73,M
And More/Signs of the Times/9 15 12  Freq Weather Documentary - Weather Modification via frequency.flv,17.82,M
And More/Signs of the Times/ALIENS - Ascended Masters or Decieving Spirits.flv,22.33,M
And More/Signs of the Times/Amazing Moto Stunts III.flv,11.57,M
And More/Signs of the Times/Another SUPERBUG GERM Is Killing.flv,5.61,M
And More/Signs of the Times/Apple Seeks To Define Card-Free Commerce.flv,17.68,M
And More/Signs of the Times/Assassination-Prelude to WW3 w Financial Collapse On the Side Or Is It.flv,80.91,M
And More/Signs of the Times/Canary Islands El Hierro Volcano EQ Swarm 174 Quakes So Far Today 9-16-12.flv,33.72,M
And More/Signs of the Times/False signs Miracles in Russia Project Blue Beam.flv,2.47,M
And More/Signs of the Times/Glenn Greenwald  Zero question we live in a surveillance state.flv,54.81,M
And More/Signs of the Times/How To Ban Controversial Film - Constitution Is Just Words.flv,11.21,M
And More/Signs of the Times/Iran resurrects Salman Rushdie death threat 9-16-12.flv,6.66,M
And More/Signs of the Times/ITS HAPPENING AGAIN - MAN SCREAMS LIKE ANIMAL TRIES TO EAT FACE OF TWO WOMAN.flv,2.37,M
And More/Signs of the Times/Man Tied To Film Creating Violent Protest In Libya Has Criminal Record  Lots of Fake Names.flv,24.03,M
And More/SIN-ister Clips/Middle East   Islamic Muslim Brotherhood spreading Chaos into 11 Arab Countries 8-13-12.flv,18.38,M
And More/SIN-ister Clips/Middle East   Planned Riots Burnings Murder to bring forth the New World Order 9-14-12.flv,33.91,M
And More/SIN-ister Clips/Natl Yard Sale for Obama Promotes Stealing From Neighbors to Sell Their Items.flv,9.22,M
And More/SIN-ister Clips/Obama  gave front row seats to Islamic Muslim Brotherhood in 2010 Cairo Speech 9-14-12.flv,20.56,M
And More/SIN-ister Clips/Obama official collaborated with prominent CAP to advance President's green energy agenda in email.flv,43.03,M
And More/SIN-ister Clips/Origami Pigs Chits End The FED.flv,36.48,M
And More/SIN-ister Clips/Planned Agenda- 3 Iran backed Hezbollah Terrorists Arrested In Mexico 9-12-12.flv,15.18,M
And More/SIN-ister Clips/Prominent Anti-Piracy Chief Suspected of Drug Crime 9-16-12.flv,9.28,M
And More/SIN-ister Clips/Report Claims US Ambassador Chris Stevens Raped Before Killed 9-15-12.flv,10.62,M
And More/SIN-ister Clips/Stuff They Don't Want You to Know - Lost Civilizations Part I.flv,42.38,M
And More/SIN-ister Clips/Sweden Aims To Be Cashless Society - here we go.flv,15.63,M
And More/SIN-ister Clips/Truthers  Some Libyan people what you to know something 9-13-12.flv,13.54,M
And More/SIN-ister Clips/UFO Man Photographed Clear Flying Saucer in Mexico 2010.flv,16,M
And More/SIN-ister Clips/Yemeni Muslim protesters attack US Embassy.flv,6.66,M
And More/The Holy Spirit/Bible Prophecy - Brotherhood Executing Christians and Journalists in Egypt.flv,43.75,M
And More/The Holy Spirit/Rise Up Shepherd - A Multitrack Collaboration - YouTube.mp4,52.19,M
And More/The Holy Spirit/Sermon Jam 8 - We are Losing it by Paul Washer.flv,14.88,M
And More/The Holy Spirit/Shroud Of Turin Carbon Dating Overturned By Scientific Peer Review - Video.flv,2.98,M
And More/The Holy Spirit/Stellar Kart - Something Holy  - YouTubep h.flv,8.52,M
And More/The Holy Spirit/STRONG ENOUGH by Matthew West - YouTube (2).mp4,203.52,M
And More/The Holy Spirit/SURRENDER - Medley - YouTube2.mp4,187.29,M
And More/The Holy Spirit/The Motions  [HD] Matthew West  (Along With The Lyrics) - YouTube.mp4,86.53,M
And More/The Holy Spirit/The Prophecy of Daniel 7 and The Beast of Revelation.flv,155.6,M
And More/The Holy Spirit/THE THIRD ANGELS MESSAGE  The Mark of the Beast 666.mp4,151.77,M
And More/The Holy Spirit/Theist Arguments.flv,6.6,M
And More/The Holy Spirit/Todd Agnew There Is Coming A Day with Lyrics (2).mp4,178.04,M
And More/The Holy Spirit/Watermark Christy Nockels - Constant.mp4,32.66,M
And More/The Holy Spirit/Wretched  The Other Prodigal Son.flv,29.68,M
And More/War and Rumors of Wars/War on an If Iran threat a tool for regime change.flv,6.88,M
And More/War and Rumors of Wars/Weaponized drones to patrol America  - YouTube.flv,34.91,M
Info.txt,1.86,K
Mike Hoggard  The Paradigm Shift Conference What is the Age of Aquarius.avi,142.93,M
Mike Hoggard  The Poison of Dragons The Alice Bunker  2012.avi,150.41,M
Mike Hoggard  The Vipers have been Sent The Harlot and the The Love of Money.avi,178.9,M
Mike Hoggard  They Worshipped the Dragon.avi,235.68,M
Mike Hoggard  What is the Singularity.avi,24.8,M
Mike Hoggard  Where Dragons Live.avi,112.93,M
Mike Hoggard A 500 Year Old Mystery Revealed The Kundalini Slumber What is Shekinah.avi,182.03,M
POtHS - Why We Do What We Do.txt,7.89,K
Shorts/2012-09-22 - SS - The Battle and the Victory.flv,58.42,M
Shorts/Angry Sick Old Men Manipulate The World Towards World War 3 Islamic Hate Film.flv,20.82,M
Shorts/Another SUPERBUG GERM Is Killing.flv,5.61,M
Shorts/Anti-US riots video  American flags burned across Arab world.flv,19.09,M
Shorts/China warns of armyworm outbreak Plague 8-15-12 - timed w US grain drought.flv,10.65,M
Shorts/Elemantary Kids Forced To Draw 9 11 Attacks.flv,1.7,M
"Shorts/Girl, 15, says cop forced her to strip and prove she wasnt having sex.flv",7.54,M
Shorts/IRS Challenging Freedom At The Pulpit.flv,17.48,M
Shorts/Man Tied To Film Creating Violent Protest In Libya Has Criminal Record  Lots of Fake Names (2).flv,24.03,M
Shorts/Man Tied To Film Creating Violent Protest In Libya Has Criminal Record  Lots of Fake Names.flv,24.03,M
Shorts/Marxism Too.flv,14.21,M
Shorts/Natl Yard Sale for Obama Promotes Stealing From Neighbors to Sell Their Items.flv,9.22,M
Shorts/Obamas Power Grab Within NDAA Bill More.flv,26.64,M
Shorts/Persecution In India by Francis Chan.flv,10.37,M
Torrent downloaded from Ahashare.com.txt,47,B
Torrent downloaded from Conspiracyhub.com.txt,47,B
