User Type,Username,Date,Text
,faizadi,2012-04-07T21:10Z,does anyone know this work?
,coolbot123,2012-04-15T14:01Z,Why does this fail to mount after i finished downloading??
,BLOVES,2012-04-18T22:28Z,I think its ur software problem
,saint1386,2012-04-23T12:30Z,"Hi, how could I change the language of this game?"
,adwten,2012-05-01T13:25Z,"I get an error code on launch. Some problem with secur32.dll 
Looked everywhere for a solution. Downloaded Physx etc - still no joy so uninstalled and deleted. Now downloading another version."
