User Type,Username,Date,Text
,MRMKHS1,2012-11-03T13:17Z,As Usual......   Maraming Salamat Po.
[V],Snowhiter,2012-11-06T19:16Z,1 more Varg Veum to go - after that the next uploads from me will be Forbrydelsen (The Killing) S03 and Engrenages (Spiral) S04   - Thanx for your support ;) Its appreciated... 
,Malveros,2012-11-10T02:04Z,Thanks a lot man. U have been doing an excellent job of keeping us happy. Really looking forward to the new seasons of Forbrydelsen and Engrenages.
,johnBlake,2012-11-10T04:40Z,"Hey Sno, Thanks a lot for uploading this splendid collection.

Any plans for the Johan Falk movies?"
,tapaleat,2012-11-26T06:44Z,really looking forward to Spiral so4. Thank you
