Filename,Size,Unit
The Words (2012) Extended NTSC DVDR DD5.1 Eng Spa NL Subs/The Words (2012) Extended NTSC DVDR DD5.1 Eng Spa NL Subs.iso,4.33,G
The Words (2012) Extended NTSC DVDR DD5.1 Eng Spa NL Subs.nfo,704,B
Torrent downloaded from AanMeHoelaJa Torrents on BTScene.eu.txt,71,B
Torrent downloaded from AhaShare.com.txt,58,B
Torrent Downloaded From BTScene.eu.txt,45,B
Torrent Downloaded from digtorrent.org.txt,184,B
Torrent Downloaded From ExtraTorrent.com.txt,353,B
Torrent downloaded from KAT.ph.txt,41,B
Torrent Downloaded from limetorrent.txt,50,B
Torrent downloaded from silvertorrent.org.txt,86,B
Torrent downloaded from thepiratebay.se.txt,50,B
tracked_by_h33t_com.txt,23,B
