User Type,Username,Date,Text
[V],boobsman,2012-07-02T20:59Z,"lol sorry wrong image :)

http://www.freeimage.us/image-C87A_4FF1EAD9.jpg"
[V],boobsman,2012-07-02T21:02Z,"double lol, right image wrong description :)

Gladget Magazine July 2012

Gladget Magazine is all about technology, gadgets and hardware. Published by the 
same crew as Gamecca Magazine, Gladget presentsinformation that is easy to 
understand and guarantees that every review is hands-on.

English | True PDF | 90 pages | 59.6 MB"
