User Type,Username,Date,Text
,Fitzy727,2012-12-17T05:14Z,Thanks!!!! +1
,lhgaw2,2012-12-17T05:16Z,"You da man Dibya!

Will seed 10.0"
,widderic,2012-12-17T05:28Z,"You are faster than eztv now, huge props!  Thanks a bunch!"
,pinkman1,2012-12-17T06:03Z,thank you for been the fastest...
,Ronalds550,2012-12-17T19:59Z,good job and great episode!
,anexio,2012-12-17T22:59Z,"OMG you guyz, the towelhead guy isn't dead.

That guy and girl that looks like she drunk aint gonna like that,  nope."
,aboudiza,2012-12-18T01:07Z,@DibyaTPB Could you please upload the series finale episode of Flashpoint (episode 13) in 720p
