User Type,Username,Date,Text
,3htthe,2012-07-10T22:07Z,"It'd be nice if you seeded it properly. I got up to %94.6%, and everyone else is stuck, too."
,jdude700,2012-07-12T02:10Z,my internet got fucked up for some reason so i havent been able to access it untill today i will continue seeding hopefully someone else will get 100% and can help in seeding
,TheJinzo,2012-07-12T12:18Z,Seeding. Thanks dude. :)
,jdude700,2012-07-14T05:29Z,thankyou everyone for seeding hopefully more people can share the love for this excellent show
,topk,2012-07-17T01:18Z,What the heck? There are no file extensions!? 
