User Type,Username,Date,Text
,bendaninc,2012-12-10T05:36Z,Thank you for helping us be there.
,nongnotno,2012-12-10T09:56Z,"Thank you very much VeroVenlo for all your torrents. 
Merry Christmas and happy 2013 to you."
,calvoce,2012-12-10T11:39Z,"Thanks Verovenlo for another great torrent, and thank you for everything you've done for us this season. Merry Christmas and a very Happy 2013!"
,coolzaaz,2012-12-10T12:06Z,thank you ! will wait for new season.
[V],verovenlo,2012-12-10T14:28Z,yall very welcome and merry christmas to all of u and a happy 2013
