Filename,Size,Unit
600 Volumes - POtHS Torrents seeded 7-4-2012.rar,69.71,M
6343335.jpg,16.62,K
And More/Signs of the Times/12 dead 50 wounded shooting at Colorado theater.flv,8.81,M
And More/Signs of the Times/Barack Obama The Scapegoat.mp4,21.85,M
And More/Signs of the Times/Batman Dark Rising Update -Shooter had License Plate of 119 RDC - DHS FBI forewarned Theatre attacks.flv,15.23,M
And More/Signs of the Times/Big Brother Street Lights Coming To A City Near You - YouTube.flv,6.8,M
And More/Signs of the Times/Cops Can Search Cell Phones Without Warrants - YouTube.flv,6.02,M
And More/Signs of the Times/Flag Ban On Vets Graves In Texas - YouTube.flv,9.18,M
And More/Signs of the Times/Hybrid Strain of Grass Produces Cyanide Kills Cattle Within Hours - Texas - 6-24-12.flv,10.39,M
And More/Signs of the Times/Important Information   Coca Cola Joins El Hierro Govt To Cover-up Volcanic Danger.flv,30.23,M
And More/Signs of the Times/Mayor Bloomberg Will Not Be Happy Until New York Is A Police State With Checkpoints Every 3 Blocks.flv,15.25,M
And More/Signs of the Times/Miami Face-Eater Only Had Marijuana In His System Toxicology Report NO BATH SALTS.flv,2.36,M
And More/Signs of the Times/Military Rape Victims Labeled As Crazy - YouTube.flv,20.78,M
And More/Signs of the Times/Our Taxpayers Are Funding The Taliban So They Can Kill Americans Congressman Walter Jones.flv,12.85,M
And More/Signs of the Times/Regular Patrol Cops To Get Ballistic Shields In Florida.flv,9.51,M
And More/Signs of the Times/Subliminal Propaganda Exposed - YouTube (2).flv,47.9,M
And More/SIN-ister Clips/The NSA Is Lying  US Gov Has Copies of Most of Your Emails Says NSA Whistleblower.flv,38.99,M
And More/SIN-ister Clips/The Truth about the Dover Intelligent Design Trial - YouTube.flv,2.84,M
And More/SIN-ister Clips/THE UNIVERSES MISSING LINK - YouTube.flv,9.61,M
And More/SIN-ister Clips/The Video the UK Government want banned.flv,31.04,M
And More/SIN-ister Clips/Tree Rings Prove Climate was warmer in Ancient Times - World has been Cooling for 2000 years.flv,32.63,M
And More/SIN-ister Clips/Under Age Sex   Prostitution In Columbia and The US Secret Service Scandal.flv,10.58,M
And More/SIN-ister Clips/US Post Office Does Test Run On Sunday In Case Theres A National Medical Emergency.flv,7.46,M
And More/SIN-ister Clips/Verichip Corp RFID Microchip 1st official TV Commercial and Mark of the Beast.flv,14.69,M
And More/SIN-ister Clips/Walmart Mechanic Wrote Satanic Symbols On Car - YouTube.flv,8.13,M
And More/SIN-ister Clips/Warning - July 27 Gun Control On Steroids. Global Arms Trade Treaty Obama to sign.flv,12.07,M
And More/SIN-ister Clips/Warning Get Your Money Out.flv,5.84,M
And More/SIN-ister Clips/When False Flags Dont Fly - YouTube.flv,30.65,M
And More/SIN-ister Clips/Worst Whooping Cough outbreak in over 50 years happening among the Fully Vaccinated.flv,13.79,M
And More/SIN-ister Clips/Zombie Nation   Cannibal Eats Heart Brains of Roommate in Harford County Maryland 6-01-12.webm,7.97,M
And More/The Holy Spirit/A Call to Anguish by David Wilkerson - Part 3 - YouTube.flv,6.68,M
And More/The Holy Spirit/Beautiful by MercyMe Lyrics.flv,16.2,M
And More/The Holy Spirit/BT Daily  Bible Prophecy and You - Part 5 - YouTube.flv,29.74,M
And More/The Holy Spirit/BT Daily  Bible Prophecy and You - Part 6 - YouTube.flv,24.16,M
And More/The Holy Spirit/BT Daily  Bible Prophecy and You - Part 7 - YouTube.flv,21.25,M
And More/The Holy Spirit/Comparing Matthew 24 and Revelation 6 - YouTube.flv,78.23,M
And More/The Holy Spirit/Does Your Church Teach Only Parts of the Truth - YouTube.flv,26.39,M
And More/The Holy Spirit/Finding Jesus - YouTube.flv,36.61,M
And More/The Holy Spirit/Holy Is The Lord God Almighty - Chris Tomlin - YouTube (2).flv,12.8,M
And More/The Holy Spirit/John 3 16 Gods Greatest Gift - Jesus  - YouTubeed.mp4,5.47,M
And More/The Holy Spirit/John Waller- God Is Good - YouTube.flv,15.62,M
And More/The Holy Spirit/Josh Groban - You Raise Me Up   Rain  - YouTubed.flv,26.65,M
And More/The Holy Spirit/Michael W Smith - Awesome God HD w Lyrics.mp4,63.99,M
And More/The Holy Spirit/Spoken For - Mercy Me.flv,10.12,M
Info.txt,2.92,K
Louie Giglio - UnThinkable You - Born to be Wild.avi,168.27,M
Louie Giglio - UnThinkable You - Journey with God.avi,239.35,M
POtHS - Why We Do What We Do.txt,7.89,K
Shorts/A Lot of Praying.webm,9.93,M
Shorts/Boston Area Pastor Kidnapped In Egypt - YouTube.flv,20.88,M
Shorts/CNN talks about Prophetic War in Pslams 83.flv,34.77,M
Shorts/Corrie Ten Boom on Tribulation and Persecution.flv,36.12,M
Shorts/Illuminati Satanic 2012 UFO event Bill Cooper and silenced NWO researchers.flv,55.34,M
Shorts/Nuclear Coast Jelly Fish Seaweed and Alex Jones.flv,31.5,M
Shorts/Pastor Freebie   WorshipHouse Media.mp4,11.47,M
Shorts/Put In What They Leave Out - YouTube.flv,3.42,M
Shorts/Questions about the SABBATH  - YouTube.flv,16.85,M
Shorts/Radiohalos Startling evidence of catastrophic geologic processes on a young earth.flv,31.25,M
Shorts/Sackcloth Ashes BEHOLD a PALE HORSE The BEAST enters THE HOLY LAND PART I - YouTube.flv,38.5,M
Shorts/Seek God With All Your Heart by Bob Jennings - YouTube.mp4,39.7,M
Shorts/Stephen Hawking and God - YouTube.webm,7.61,M
Shorts/The Bible and the word of God is Spiritual NOT Religious.flv,35.14,M
Torrent downloaded from Ahashare.com.txt,47,B
Torrent downloaded from Conspiracyhub.com.txt,47,B
Torrent downloaded from Demonoid.me.txt,47,B
Unthinkable Invitation - Louis Giglio.avi,128.4,M
Unthinkable Journey Art.avi,123.42,M
Unthinkable Journey Endeavor.avi,156.59,M
Unthinkable Rescue - Louis Giglio.avi,124.76,M
