User Type,Username,Date,Text
,stonner89,2012-03-02T06:26Z,"Dude, 'The girl with the Dragon tattoo' Blu-ray is out please do it asap."
,suhaibbb,2012-03-02T10:07Z,"will u please upload Mission Impossible 4: Ghost Protocol
asap.............."
,Teck1,2012-03-02T16:32Z,"Yify why are you uploading M.I. again? You've already uploaded the Trilogy set just in case you forgot. Anyway, please don't forget to upload the remaining seasons of Dragon Ball Z Kai. Thanks."
,puemtes,2012-03-03T07:14Z,Same question as teck1. I also think the mkv version you did was better than this mp4.
,sivapb08,2012-03-05T21:47Z,Must hav got better quality
,painkilleradnan,2012-03-14T13:18Z,yify....u r da grt......
,xevar,2012-03-17T19:03Z,"axxo who??? YIFY!!!! thank you thank you thank you
I'll never be able to say it enough...all the wonderful things you do..."
,michaelrwatson,2012-03-19T21:03Z,"Does this have subtitles for the foreign parts??

I don't mean a .SRT file with full English subs, e.g. for deaf people. I mean subs ONLY for the non-English parts. Someone please report. thanks."
,PauloFran,2012-04-18T01:48Z,"Great video quality.
Thank you!"
,pouz84,2012-06-04T17:28Z,Can you upload natural born killer please!!
,slmndow,2012-09-28T18:30Z,Thanks!
