Filename,Size,Unit
AC_DC Live_ Collector's Edition (Disc 1)/1-08 Jailbreak (Live).mp3,16.85,M
AC_DC Live_ Collector's Edition (Disc 2)/2-07 Let There Be Rock.mp3,14.06,M
Live - Disc 1/Jailbreak.mp3,13.47,M
AC_DC Live_ Collector's Edition (Disc 2)/2-04 High Voltage.mp3,12.08,M
Live From Atlantic Studios(bonfire Boxset)/The Jack (Live).mp3,11.81,M
If You Want Blood(You Got It)/Let There Be Rock.mp3,11.73,M
Live - Disc 2/Let There Be Rock.mp3,11.25,M
Dirty Deeds Done Dirt Cheap/07 Ain't No Fun (Waiting Round To Be A Millionaire).mp3,10.42,M
If You Want Blood(You Got It)/Bad Boy Boogie.mp3,10.23,M
Live - Disc 2/High Voltage.mp3,9.66,M
Highway To Hell/10 Night Prowler.mp3,8.91,M
'74 Jailbreak/04 Soul Stripper.mp3,8.84,M
Live From Atlantic Studios(bonfire Boxset)/Live Wire (Live).mp3,8.59,M
Let There Be Rock/06 Overdose.mp3,8.47,M
Iron Man 2/13 Let There Be Rock.mp3,8.45,M
Let There Be Rock/03 Let There Be Rock.mp3,8.41,M
Powerage/02 Down Payment Blues.mp3,8.36,M
AC_DC Live_ Collector's Edition (Disc 2)/2-11 For Those About To Rock (We Salute You).mp3,8.35,M
If You Want Blood(You Got It)/Riff Raff.mp3,8.22,M
Live From Atlantic Studios(bonfire Boxset)/High Voltage (Live).mp3,8.17,M
Dirty Deeds Done Dirt Cheap/08 Ride On.mp3,8.14,M
High Voltage/03 The Jack.mp3,8.11,M
High Voltage/04 Live Wire.mp3,8.04,M
Dirty Deeds Done Dirt Cheap/05 Problem Child.mp3,8.03,M
Who Made Who/Ride On.mp3,8.03,M
If You Want Blood(You Got It)/The Jack.mp3,8.01,M
AC_DC Live_ Collector's Edition (Disc 1)/1-09 The Jack (Live).mp3,7.97,M
For Those About to Rock/01 For Those About To Rock (We Sa.mp3,7.91,M
Who Made Who/For Those About To Rock (We Sa.mp3,7.87,M
High Voltage/07 Little Lover.mp3,7.8,M
Ballbreaker/05 The Honey Roll.mp3,7.69,M
Live From Atlantic Studios(bonfire Boxset)/Rocker (Live).mp3,7.61,M
Let There Be Rock/01 Go Down.mp3,7.6,M
AC_DC Live_ Collector's Edition (Disc 1)/1-01 Thunderstruck (Live).mp3,7.54,M
Let There Be Rock/05 Problem Child.mp3,7.46,M
Let There Be Rock/08 Whole Lotta Rosie.mp3,7.41,M
Blow Up Your Video/09 Twos Up.mp3,7.38,M
Iron Man 2/01 Shoot To Thrill.mp3,7.33,M
Dirty Deeds Done Dirt Cheap/09 Squealer.mp3,7.33,M
Back In Black/02 Shoot To Thrill.mp3,7.28,M
Ballbreaker/07 Hail Caesar.mp3,7.22,M
Back In Black/01 Hells Bells.mp3,7.18,M
Powerage/04 Riff Raff.mp3,7.18,M
Who Made Who/Hells Bells.mp3,7.17,M
Highway To Hell/03 Walk All Over You.mp3,7.13,M
Live From Atlantic Studios(bonfire Boxset)/Whole Lotta Rosie (Live).mp3,7.11,M
Powerage/07 Gone Shootin'.mp3,7.03,M
Ballbreaker/06 Burnin' Alive.mp3,7.02,M
High Voltage/02 Rock 'n' Roll Singer.mp3,6.98,M
If You Want Blood(You Got It)/High Voltage.mp3,6.97,M
High Voltage/01 It's A Long Way To The Top (If You Wanna Rock 'N' Roll).mp3,6.94,M
AC_DC Live_ Collector's Edition (Disc 2)/2-01 Hells Bells.mp3,6.89,M
The Razors Edge/01 Thunderstruck.mp3,6.86,M
Iron Man 2/06 Thunderstruck.mp3,6.75,M
"Rare, Rarer, Rarities/05 Little Lover.mp3",6.75,M
High Voltage/08 She's Got Balls.mp3,6.7,M
'74 Jailbreak/05 Baby Please Don't Go.mp3,6.69,M
Black Ice/13 Rock 'N Roll Dream.mp3,6.66,M
'74 Jailbreak/03 Show Business.mp3,6.6,M
Powerage/05 Sin City.mp3,6.55,M
Live - Disc 2/For Those About To Rock (We Sa.mp3,6.53,M
AC_DC Live_ Collector's Edition (Disc 1)/1-04 Sin City (Live).mp3,6.5,M
Live From Atlantic Studios(bonfire Boxset)/Dog Eat Dog (Live).mp3,6.45,M
'74 Jailbreak/01 Jailbreak.mp3,6.41,M
Live From Atlantic Studios(bonfire Boxset)/Problem Child (Live).mp3,6.39,M
Live - Disc 1/The Jack.mp3,6.36,M
Highway To Hell/08 If You Want Blood (You've Got It).mp3,6.36,M
The Razors Edge/08 Got You By The Balls.mp3,6.34,M
Stiff Upper Lip/11 All Screwed Up.mp3,6.34,M
If You Want Blood(You Got It)/Problem Child.mp3,6.33,M
Iron Man 2/07 If You Want Blood (You've Got It).mp3,6.33,M
Ballbreaker/10 Whiskey On The Rocks.mp3,6.32,M
Ballbreaker/02 Cover You In Oil.mp3,6.27,M
Fly On The Wall/08 Hell Or High Water.mp3,6.27,M
For Those About to Rock/10 Spellbound.mp3,6.25,M
Ballbreaker/11 Ballbreaker.mp3,6.25,M
Ballbreaker/01 Hard As A Rock.mp3,6.24,M
Blow Up Your Video/08 Ruff Stuff.mp3,6.21,M
Black Ice/01 Rock 'N Roll Train.mp3,6.21,M
The Razors Edge/04 The Razors Edge.mp3,6.17,M
AC_DC Live_ Collector's Edition (Disc 1)/1-02 Shoot To Thrill (Live).mp3,6.16,M
Let There Be Rock/04 Bad Boy Boogie.mp3,6.15,M
Flick of the Switch/04 Nervous Shakedown.mp3,6.14,M
Blow Up Your Video/04 Go Zone.mp3,6.14,M
Highway To Hell/04 Touch Too Much.mp3,6.13,M
Iron Man 2/08 Evil Walks.mp3,6.1,M
Fly On The Wall/09 Back In Business.mp3,6.09,M
For Those About to Rock/06 Evil Walks.mp3,6.08,M
For Those About to Rock/08 Breaking The Rules.mp3,6.08,M
Black Ice/12 Money Made.mp3,6.07,M
Iron Man 2/12 The Razor's Edge.mp3,6.07,M
Blow Up Your Video/10 This Means War.mp3,6.05,M
Fly On The Wall/04 Danger.mp3,6.05,M
Live - Disc 1/Thunderstruck.mp3,6.03,M
AC_DC Live_ Collector's Edition (Disc 1)/1-05 Who Made Who (Live).mp3,6.03,M
Blow Up Your Video/06 Nick Of Time.mp3,5.94,M
Highway To Hell/09 Love Hungry Man.mp3,5.92,M
Iron Man 2/05 Back In Black.mp3,5.91,M
Dirty Deeds Done Dirt Cheap/01 Dirty Deeds Done Dirt Cheap.mp3,5.9,M
The Razors Edge/07 Are You Ready.mp3,5.89,M
Fly On The Wall/05 Sink The Pink.mp3,5.88,M
Back In Black/06 Back In Black.mp3,5.88,M
Black Ice/06 Smash 'N Grab.mp3,5.87,M
Iron Man 2/10 Hell Ain't A Bad Place To Be.mp3,5.87,M
Ballbreaker/09 Caught With Your Pants Down.mp3,5.86,M
Back In Black/10 Rock And Roll Ain't Noise Pollution.mp3,5.85,M
High Voltage/09 High Voltage.mp3,5.85,M
Let There Be Rock/07 Hell Ain't A Bad Place To Be.mp3,5.84,M
Who Made Who/Sink The Pink.mp3,5.84,M
Powerage/08 Up To My Neck In You.mp3,5.83,M
Back In Black/05 Let Me Put My Love Into You.mp3,5.82,M
"Rare, Rarer, Rarities/04 She's Got Balls.mp3",5.82,M
The Razors Edge/06 Rock Your Heart Out.mp3,5.81,M
High Voltage/06 Can I Sit Next To You Girl.mp3,5.79,M
Live From Atlantic Studios(bonfire Boxset)/Hell Ain't A Bad Place To Be (.mp3,5.79,M
Blow Up Your Video/07 Some Sin For Nuthin.mp3,5.79,M
AC_DC Live_ Collector's Edition (Disc 1)/1-11 Dirty Deeds Done Dirt Cheap (Live).mp3,5.78,M
Fly On The Wall/02 Shake Your Foundations.mp3,5.78,M
Ballbreaker/03 The Furor.mp3,5.76,M
Who Made Who/Shake Your Foundations.mp3,5.74,M
If You Want Blood(You Got It)/Hell Ain't A Bad Place To Be.mp3,5.73,M
Blow Up Your Video/03 Meanstreak.mp3,5.73,M
Ballbreaker/04 Boogie Man.mp3,5.69,M
If You Want Blood(You Got It)/Whole Lotta Rosie.mp3,5.68,M
Black Ice/03 Big Jack.mp3,5.65,M
The Razors Edge/05 Mistress For Christmas.mp3,5.65,M
Back In Black/09 Shake A Leg.mp3,5.63,M
The Razors Edge/09 Shot Of Love.mp3,5.58,M
Stiff Upper Lip/10 Come And Get It.mp3,5.56,M
Black Ice/11 She Likes Rock 'N Roll.mp3,5.56,M
Stiff Upper Lip/07 Cant Stop Rock N Roll.mp3,5.54,M
Iron Man 2/11 Have A Drink On Me.mp3,5.53,M
Live - Disc 2/Hells Bells.mp3,5.52,M
Flick of the Switch/10 Brain Shake.mp3,5.52,M
Blow Up Your Video/05 Kissin Dynamite.mp3,5.5,M
Back In Black/08 Have A Drink On Me.mp3,5.48,M
Stiff Upper Lip/04 Hold Me Back.mp3,5.47,M
Flick of the Switch/05 Landslide.mp3,5.47,M
Stiff Upper Lip/05 Safe In New York City.mp3,5.45,M
Highway To Hell/05 Beating Around The Bush.mp3,5.43,M
Stiff Upper Lip/03 House Of Jazz.mp3,5.42,M
For Those About to Rock/03 Let's Get It Up.mp3,5.4,M
Fly On The Wall/07 Stand Up.mp3,5.37,M
Powerage/09 Kicked In The Teeth.mp3,5.37,M
Stiff Upper Lip/12 Give It Up.mp3,5.35,M
Flick of the Switch/08 Bedlam In Belgium.mp3,5.34,M
The Razors Edge/03 Moneytalks.mp3,5.34,M
Blow Up Your Video/01 Heatseeker.mp3,5.32,M
Stiff Upper Lip/09 Damned.mp3,5.31,M
AC_DC Live_ Collector's Edition (Disc 1)/1-10 The Razors Edge (Live).mp3,5.26,M
AC_DC Live_ Collector's Edition (Disc 2)/2-02 Are You Ready.mp3,5.23,M
Fly On The Wall/03 First Blood.mp3,5.21,M
Blow Up Your Video/02 Thats The Way I Wanna Rock 'n' Roll.mp3,5.19,M
Live - Disc 1/Sin City.mp3,5.19,M
Stiff Upper Lip/08 Satellite Blues.mp3,5.19,M
Fly On The Wall/06 Playing With Girls.mp3,5.19,M
Fly On The Wall/01 Fly On The Wall.mp3,5.18,M
AC_DC Live_ Collector's Edition (Disc 2)/2-06 Whole Lotta Rosie.mp3,5.17,M
AC_DC Live_ Collector's Edition (Disc 1)/1-12 Moneytalks (Live).mp3,5.15,M
Flick of the Switch/01 Rising Power.mp3,5.13,M
Black Ice/02 Skies On Fire.mp3,5.13,M
Black Ice/09 Decibel.mp3,5.12,M
AC_DC Live_ Collector's Edition (Disc 1)/1-03 Back In Black (Live).mp3,5.12,M
"Rare, Rarer, Rarities/03 Love Song.mp3",5.09,M
Stiff Upper Lip/02 Meltdown.mp3,5.08,M
If You Want Blood(You Got It)/Rock 'n' Roll Damnation.mp3,5.04,M
Iron Man 2/02 Rock 'n' Roll Damnation.mp3,5.03,M
The Razors Edge/10 Lets Make It.mp3,5.03,M
Stiff Upper Lip/06 Cant Stand Still.mp3,5.03,M
Flick of the Switch/09 Badlands.mp3,5.02,M
Powerage/01 Rock 'n' Roll Damnation.mp3,5,M
Black Ice/08 Wheels.mp3,5,M
"Rare, Rarer, Rarities/08 School Days.mp3",4.99,M
Iron Man 2/04 Cold Hearted Man.mp3,4.97,M
Iron Man 2/09 T.N.T..mp3,4.96,M
Let There Be Rock/02 Dog Eat Dog.mp3,4.94,M
High Voltage/05 T.N.T..mp3,4.94,M
Back In Black/03 What Do You Do For Money Honey.mp3,4.94,M
Live - Disc 1/Shoot to Thrill.mp3,4.93,M
Stiff Upper Lip/01 Stiff  Upper Lip.mp3,4.93,M
Black Ice/15 Black Ice.mp3,4.92,M
Powerage/06 What's Next To The Moon.mp3,4.88,M
For Those About to Rock/04 Inject The Venom.mp3,4.87,M
Back In Black/04 Givin' The Dog A Bone.mp3,4.86,M
Black Ice/14 Rocking All The Way.mp3,4.86,M
Black Ice/04 Anything Goes.mp3,4.85,M
Back In Black/07 You Shook Me All Night Long.mp3,4.84,M
Who Made Who/You Shook Me All Night Long.mp3,4.83,M
Live - Disc 1/Who made Who.mp3,4.82,M
Iron Man 2/15 Highway To Hell.mp3,4.81,M
'74 Jailbreak/02 You Ain't Got A Hold On Me.mp3,4.81,M
Highway To Hell/01 Highway To Hell.mp3,4.8,M
Fly On The Wall/10 Send For The Man.mp3,4.77,M
For Those About to Rock/09 Night Of The Long Knives.mp3,4.76,M
For Those About to Rock/02 Put The Finger On You.mp3,4.76,M
Iron Man 2/03 Guns For Hire.mp3,4.75,M
Who Made Who/Who Made Who.mp3,4.74,M
Black Ice/07 Spoilin' For A Fight.mp3,4.74,M
Flick of the Switch/06 Guns For Hire.mp3,4.7,M
For Those About to Rock/05 Snowballed.mp3,4.7,M
Highway To Hell/02 Girls Got Rhythm.mp3,4.68,M
Flick of the Switch/02 This House Is On Fire.mp3,4.68,M
Highway To Hell/06 Shot Down In Flames.mp3,4.67,M
Dirty Deeds Done Dirt Cheap/06 There's Gonna Be Some Rockin'.mp3,4.66,M
Powerage/03 Gimme A Bullet.mp3,4.64,M
Live - Disc 1/Dirty Deeds Done Dirt Cheap.mp3,4.62,M
For Those About to Rock/07 C.O.D..mp3,4.62,M
The Razors Edge/11 Goodbye And Good Riddance To Bad Luck.mp3,4.6,M
"Rare, Rarer, Rarities/10 Crapsody in Blue.mp3",4.6,M
Flick of the Switch/07 Deep In The Hole.mp3,4.59,M
Black Ice/10 Stormy May Day.mp3,4.58,M
Black Ice/05 War Machine.mp3,4.57,M
"Rare, Rarer, Rarities/06 Stick Around.mp3",4.54,M
AC_DC Live_ Collector's Edition (Disc 2)/2-03 That's The Way I Wanna Rock N Roll.mp3,4.53,M
Dirty Deeds Done Dirt Cheap/02 Love At First Feel.mp3,4.51,M
AC_DC Live_ Collector's Edition (Disc 2)/2-05 You Shook Me All Night Long.mp3,4.48,M
The Razors Edge/12 If You Dare.mp3,4.48,M
Ballbreaker/08 Love Bomb.mp3,4.47,M
AC_DC Live_ Collector's Edition (Disc 2)/2-09 Highway To Hell.mp3,4.46,M
"Rare, Rarer, Rarities/07 High Voltage.mp3",4.45,M
Flick of the Switch/03 Flick Of The Switch.mp3,4.45,M
If You Want Blood(You Got It)/Rocker.mp3,4.42,M
Iron Man 2/14 War Machine.mp3,4.4,M
AC_DC Live_ Collector's Edition (Disc 2)/2-10 T.N.T..mp3,4.36,M
"Rare, Rarer, Rarities/12 Down on the Borderline.mp3",4.34,M
AC_DC Live_ Collector's Edition (Disc 1)/1-07 Fire Your Guns (Live).mp3,4.22,M
Live - Disc 1/The Razors Edge.mp3,4.21,M
Live - Disc 2/Are You Ready.mp3,4.18,M
Who Made Who/Chase The Ace.mp3,4.16,M
The Razors Edge/02 Fire Your Guns.mp3,4.15,M
AC_DC Live_ Collector's Edition (Disc 1)/1-06 Heatseeker  (Live).mp3,4.14,M
Live - Disc 2/Whole Lotta Rosie.mp3,4.13,M
Live - Disc 1/Back in Black.mp3,4.09,M
Who Made Who/D.T..mp3,4.05,M
Dirty Deeds Done Dirt Cheap/04 Rocker.mp3,4.03,M
Live - Disc 1/Money Talks.mp3,3.95,M
"Rare, Rarer, Rarities/11 Carry Me Home.mp3",3.8,M
Dirty Deeds Done Dirt Cheap/03 Big Balls.mp3,3.77,M
Live - Disc 2/That's The Way I Wanna Rock N.mp3,3.62,M
Live - Disc 2/You Shook Me All Night Long.mp3,3.59,M
Live - Disc 2/Highway To Hell.mp3,3.57,M
Highway To Hell/07 Get It Hot.mp3,3.57,M
"Rare, Rarer, Rarities/09 Rock in Peace.mp3",3.55,M
"Rare, Rarer, Rarities/14 Cold Hearted Man.mp3",3.55,M
Live - Disc 2/T.N.T..mp3,3.48,M
Live - Disc 1/Fire your guns.mp3,3.38,M
Live - Disc 1/Heatseaker.mp3,3.31,M
"Rare, Rarer, Rarities/01 Can I Sit Next to You.mp3",3.31,M
"Rare, Rarer, Rarities/02 Rockin' In The Parlour.mp3",3,M
"Rare, Rarer, Rarities/13 Fling Thing.mp3",2.11,M
AC_DC Live_ Collector's Edition (Disc 2)/2-08 Bonny.mp3,1.21,M
Live - Disc 2/Bonny.mp3,988.46,K
