User Type,Username,Date,Text
[T],SCSA420,2012-10-31T12:49Z,"Here is the latest episode of Sons Of Anarchy HDTV S05E08 720p AVCHD-SC-SDH in 720p MP4 format!!! 

PLEASE READ THE .nfo FILE THIS WEEK FOR MORE INFORMATION!!!

Please stay connected after your download is finished to help seed this show for people still downloading it and enjoy the show!!! :D"
[T],SCSA420,2012-10-31T12:59Z,screenshots are here:   http://bayimg.com/daFHAaAeg
[M],Hero,2012-10-31T19:48Z,"Welcome to the Trusted club!
Congrats! :)"
[T],SCSA420,2012-10-31T20:47Z,"Thank You Pirate Bay staff for the Trusted Skull :D

Its about time I got it after all my releases here!!! :D"
