User Type,Username,Date,Text
[S],velvet.,2012-05-08T08:46Z,Moved to Audio > Other
,maawolfe36,2012-06-16T20:11Z,"Great show, been looking for this! Once it finishes DLing I'll seed too :)"
,alexandru20i,2012-06-18T18:53Z,Not very good. It's like watching the video on youtube at 360p
,.235.,2012-07-05T16:51Z,"Thanks so much man! Saves me the trouble of searching for then downloading every one off youtube. (what a headache)
@alex: stfu dude it's free."
,BewareOfTom,2012-07-17T03:41Z,Hmm... I could try to post an HD version of all the episodes.... :P
,Spadde94,2012-08-10T20:01Z,Could you put up the Dick figures movie pls
,kakashiomar,2012-08-24T00:47Z,thanks cant wait for the movie xD
