Filename,Size,Unit
Prophetic Proof   For Every Truth - Philip Sizemore.avi,807.38,M
Prayer Life.avi,700.2,M
Show No Partiality - David Butterbaugh.avi,357.93,M
Shorts/Toys of Anti-Christ - The Living Image.avi,276.99,M
Betrayed With A Kiss by Eric Ludy.avi,249.99,M
Hell-Shaking Prayer by David Wilkerson.avi,170.21,M
Living Out Prewrath During Lawlessness.avi,159.02,M
Xtras/Martyrs of Today/BEYOND TORTURE -The gulag of Pitesti ROMANIA.avi,136.78,M
Xtras/The Holy Spirit/Hadith & Qur'an PROOF the Vatican created Islam and much more.flv,135.91,M
Xtras/Signs of the Times/The Illuminati Is Alot Closer Than You Think.mp4,128.62,M
Xtras/SIN-ister Clips/Warlords.mp4,115.28,M
Shorts/Truthers Paralympics SunKing Rises  Rihanna Isis Nimrod  the NWO Religion.flv,107.05,M
CHRISTIANS STONED IN AN AMERICAN CITY Guest  Ruben Israel - YouTube.avi,101.47,M
Shorts/Chaotic Events 2012  Extreme Weather  Creation Groaning  People Continue To Sleep  Why.mp4,97.11,M
Xtras/War and Rumors of Wars/State Secession_ dissolution_ Pros and Cons.avi,82.9,M
Shorts/Saturday Sabbath PROVEN to be TRUE Not SUNday.flv,67.72,M
Shorts/Sackcloth Ashes 11-11-11AnnouncingTribulation A KING falls The FULLNESS has come in.avi,63.7,M
Xtras/The Holy Spirit/I WANT TO SING - CFN 1987.mp4,62.8,M
Xtras/Signs of the Times/Syria And The Chemical Weapons Propaganda.mp4,60.73,M
Shorts/2012 2013 Warnings_Sound The Alarm.flv,58.74,M
Xtras/The Holy Spirit/His Only Crime Was Love -- For You.mp4,52.96,M
Xtras/Signs of the Times/Nuclear Report - 11-30-12.mp4,51.15,M
Xtras/Signs of the Times/The Cycle of Civilization in 33 Words.mp4,50.67,M
Shorts/Earths INHABITED moon and airspace.flv,50.07,M
Xtras/SIN-ister Clips/They Spend We Owe.flv,49.65,M
Xtras/The Holy Spirit/Genesis 1.flv,49.01,M
Shorts/Beginning Of Sorrows  As The Tension Rises Don't Give Up.mp4,47.88,M
Xtras/Signs of the Times/String of mysterious booming noises reported.mp4,47.85,M
Xtras/SIN-ister Clips/Wretched Have a Hobby Lobby Christmas.mp4,47.67,M
Xtras/War and Rumors of Wars/Psychiatry  Man Redefined.flv,42.3,M
"Shorts/Cyber insecurity  Iranian hackers attack US  - Self-Created, Self-Imposed.flv",41.59,M
Xtras/The Holy Spirit/How He Loves.flv,27.54,M
Xtras/War and Rumors of Wars/Site 911 - US Building Secret $100 Mill Underground Facility Outside Tel Aviv.flv,27.32,M
Xtras/Signs of the Times/THE NEED.avi,26.56,M
Shorts/Whats the BIG DEAL About the KJV - Episode.flv,26.24,M
Xtras/Signs of the Times/THERE IS A BATTLE BEING WAGED IN AMERICA.mp4,25.9,M
Xtras/SIN-ister Clips/US to send sophisticated arms to militants in Syria.mp4,23.8,M
Xtras/SIN-ister Clips/WARWICK RI BAFFLED BY UNEXPLAINED LOUD EXPLOSION BOOMS FLASHES OF LIGHT.flv,22.93,M
Xtras/Martyrs of Today/Burning alive on Christisans in Pakistan 2009 by Shadow org   SARRC Pt 2 .flv,22.64,M
Xtras/Signs of the Times/HE'LL GET YOU THROUGH - For the Families of Newtown CT.flv,22.62,M
Xtras/Signs of the Times/Plume rises from Ulawun volcano at Papua New Guinea.mp4,22.26,M
Xtras/Signs of the Times/Tax Hell 73% rates cripple UK families killing aspiration nation.flv,21.77,M
Shorts/THE UNFORGIVABLE SIN.flv,21.27,M
Shorts/BIBLE CANON LIE DESTROYED - Council of Nicaea   Catholics did NOT create canon.flv,20.61,M
Shorts/Visions  One World Religion - A Jumbled Mess - YouTube.flv,19.88,M
Shorts/Top 5 Health Effects affecting Children Denied by Mainstream Media.flv,18.67,M
Xtras/The Holy Spirit/HAD YOUR EYES   EARS CHECKED OUT LATELY.flv,18.27,M
Xtras/The Holy Spirit/Hillsong - From the inside out - Instrumental lyrics.flv,18.2,M
Shorts/Obama Born In Kenya - YouTube.flv,17.8,M
Xtras/The Holy Spirit/How Great Is Our God ml.flv,17.04,M
Xtras/SIN-ister Clips/Why Dont You Rust.flv,16.73,M
Xtras/SIN-ister Clips/William Cooper Exposed Alex Jones - lost recording.flv,16.39,M
Xtras/SIN-ister Clips/Why Is the Media Ignoring the Mass Sinkholes Popping Up.mp4,15.83,M
Xtras/SIN-ister Clips/UN Overwhelmingly Bans Nuclear Weapons.flv,15.78,M
Shorts/Pictures of the remains of giants and such.flv,14.91,M
Xtras/SIN-ister Clips/Trainers teach dogs to drive cars.mp4,14.64,M
Xtras/The Holy Spirit/How to Awaken a Dead and Unregenerate Church  - Steve Lawson.flv,13.71,M
Xtras/SIN-ister Clips/US Official Military Strike On Syria Could Happen with Ships  Aircraft In Region.flv,13.45,M
Xtras/The Holy Spirit/I Am Free Newsboys 2007.flv,13.45,M
Xtras/Signs of the Times/SINKHOLE UPDATE 12-11-12.mp4,13.17,M
Shorts/Re - The Problem of Hell and a Loving God.flv,12.19,M
Shorts/Police State - Google Bans All Gun   Ammo Sales - YouTube.flv,11.59,M
Xtras/The Holy Spirit/How Great You Are.flv,11.08,M
Xtras/The Holy Spirit/I Will Lift My Eyes - Bebo Norman.flv,10.69,M
Shorts/Plugged In - YouTube.flv,9.23,M
Xtras/The Holy Spirit/I dreamed i had an interview with God.mp4,8.63,M
Xtras/SIN-ister Clips/Two enormous sinkholes in Bay Area California.mp4,8.41,M
Xtras/Signs of the Times/Second-Graders Charged for Bathroom Breaks.flv,7.53,M
Xtras/The Holy Spirit/Happy Reformation Day.flv,4.23,M
Shorts/Barry's Lucky harms.flv,3.56,M
Shorts/UPDATE on shooting - 5 Christians shot dead in collage in Oakland California - YouTube.flv,3.22,M
Xtras/SIN-ister Clips/Worldwide Average Sperm Count Falls Dramatically.flv,3.06,M
Xtras/Signs of the Times/Ohio Sinkhole Devours Over 1000ft Of Land.mp4,3.01,M
Xtras/SIN-ister Clips/UFOs Aliens KGB tapes of alien visitors   UFOs Classified TOP SECRET Tape 2.flv,2.83,M
Xtras/Signs of the Times/Rio Arrests Scores Of Police In Bribery Probe.mp4,1.64,M
Xtras/Martyrs of Today/110 Million Chinese Born Again Christians.flv,1,M
prayerlife_splashpage-awards.jpg,232.23,K
51Gc4AoIMJL._SL500_AA300_.jpg,18.87,K
POtHS - Why We Do What We Do.txt,7.89,K
Info.txt,5.63,K
Torrent downloaded from Conspiracyhub.com.txt,47,B
