Filename,Size,Unit
High School Of The Dead E01.Primavera Dos Mortos.avi,170.08,M
High School Of The Dead E02.Fuga Dos Mortos.avi,170.05,M
High School Of The Dead E03.Democracia Sob Os Mortos.avi,170.09,M
High School Of The Dead E04.Indo De Encontro Aos Mortos.avi,170.08,M
High School Of The Dead E05.Ruas Dos Mortos.avi,170.1,M
High School Of The Dead E06.Na noite Dos Mortos.avi,170.01,M
"High School Of The Dead E07.Noite Dos Mortos, Multidão De Mortos.avi",170.15,M
High School Of The Dead E08.Mortos A Caminho De Casa.avi,170.13,M
High School Of The Dead E09.A Espada E Os Mortos.avi,170.23,M
High School Of The Dead E10.A Casa Dos Mortos Governa.avi,170.4,M
High School Of The Dead E11.A Crescente Tempestade De Mortos.avi,170.29,M
High School Of The Dead E12.Ataque De Todos Os Mortos.avi,170.3,M
