Filename,Size,Unit
INFO TBS/The Secret Circle.jpg,239.69,K
INFO TBS/www.black-Sam org     Kom eens Langs !.jpg,13.1,K
INFO TBS/The Secret Circle S01E15 NLSubs DIVX  TBS.txt,1.4,K
INFO TBS/Torrent_downloaded_from_AhaShare.com.txt,674,B
INFO TBS/Torrent_downloaded_from_Demonoid.com.txt,662,B
INFO TBS/Torrent downloaded from Demonoid.me.txt,659,B
INFO TBS/Torrent Downloaded from deemtrack.in.txt,657,B
INFO TBS/Torrent Downloaded from SilverTorrents.me.txt,654,B
INFO TBS/Torrent Downloaded from  Movie-Torrentz.txt,652,B
INFO TBS/Tracked by H33T.txt,632,B
INFO TBS/Black-Sam.txt,128,B
Movie/the.secret.circle.S01E15.NLsubs.DivX-QoQ.avi,314.86,M
