Filename,Size,Unit
Crisis Preparedness Handbook - A Comprehensive Guide to Home Storage and Physical Survival.rar,5.27,M
"Finding Anyone, Anywhere, Anywhen.pdf",3.97,M
The Home Security Handbook.rar,3.01,M
Scene of the Cybercrime - Computer Forensics Handbook.pdf,2.2,M
The Psychology of Interrogations and Confessions A Handbook.rar,2.18,M
"Identity Theft Handbook - Detection, Prevention and Security.pdf",1.5,M
Law Enforcement Safety Handbook.pdf,1.3,M
How to Hide Anything.pdf,1.3,M
Privacy Means Profit - Prevent Identity Theft and Secure You and Your Bottom Line.pdf,1.15,M
Hacker Proof - Your Guide To PC Security.pdf,975.39,K
The Worst Case Scenario Survival Handbook.pdf,796.42,K
E-Mail Security A Pocket Guide.pdf,668.14,K
The A-Z of Home Security How to Keep Your Home and Family Safe from Crime.rar,636.1,K
Never Be Lied to Again - How to Get the Truth In 5 Minutes Or Less.pdf,503.98,K
Hugo Cornwall - The Hacker's Handbook.pdf,218.16,K
