User Type,Username,Date,Text
[T],jmz619,2012-09-11T17:47Z,wow this is an amazing upload 
[V],Nepotu,2012-09-11T17:50Z,"Thank you, bro!"
,englishman82,2012-09-11T18:09Z,"Sorry Nepotu, for a question unrelated to football, but do you happen to have the men's final for the us open tennis?"
,englishman82,2012-09-11T18:12Z,"Hey Nepotu, Any conclusion to the men's tennis? please don't leave us hanging"
,-xaliband-,2012-09-11T18:19Z,"tnx =) i wonder what the quality is though!!!....

(it says 720p but the files are so small)"
[V],Nepotu,2012-09-11T18:24Z,"Dear, friend! In the last 8 hours I didn't stop from searching. Until now, nothing. But I'm still searching. Stay tuned!"
[V],Nepotu,2012-09-11T19:08Z,"I think that the games are remastered but not entires, some large highlights. I don't know, I didn't see it."
,englishman82,2012-09-11T19:13Z,"Sorry buddy, I thought you uploaded these yourself!
I shall stay tuned, good luck with the search and again, thank you for your efforts."
[V],Nepotu,2012-09-11T19:59Z,"It's milala13's rip. Sorry, I can't tell, but from my experiences, this ripper is serious on his work."
[V],thetorrentlord,2012-09-12T00:30Z,A typical 480p for a game would run 1.5-2GB. These must be just highlights or very low bitrate encodes.
[V],Nepotu,2012-09-12T00:59Z,I think that who wants to see what really means this torrent to download a single year and verify if it's true. And then sharing with us his thoughts.
,rhflem12345,2012-09-12T04:10Z,Please seed!
,-xaliband-,2012-09-13T02:10Z,"i downloaded one part and it is only highlights...good quality though...8/8

def. worth downloading but gosh its slow..."
[V],Nepotu,2012-09-13T04:22Z,"Thank you for your sharing, bud!"
,tibird,2012-09-19T11:32Z,even though its only highlights its great to see these football legends go at it. great upload and well worth the effort thanks again.
,Grateful84,2012-09-26T07:55Z,"you are so kind Nepotu, epic work"
