User Type,Username,Date,Text
,darksniper48,2012-10-24T04:47Z,Thank u so much EZ !!!
,thechronic_13,2012-10-24T04:47Z,sweet!
,pberry,2012-10-24T05:00Z,Thank you! can't wait its gonna be bad asssss
,vklgame,2012-10-24T05:03Z,thank you extremezone...!
,punk420,2012-10-24T05:06Z,Finally...
,86ETA,2012-10-24T05:09Z,Thanks  zone    ;) 
,youngieiz,2012-10-24T05:30Z,"As always eXtreme, you deliver!  THANK YOU from Down Under"
,544nick101,2012-10-24T05:34Z,"@punk420 The game hasn't even been out for a day yet lay off extreamzone, i was going to say you were a fucking dick taking pussy but seeing how you have uploaded almost 2 pages of torrents i'll hold back. And thanks ez!"
,Butcher851,2012-10-24T05:45Z,Does this include Update 1 0 0 2? 
,ogvader,2012-10-24T05:47Z,"seed...?
it sooo slow."
,ogvader,2012-10-24T05:48Z,"i take that back, alot better now."
,Inlegend,2012-10-24T06:01Z,Holy crap the DL is extremely slow
,544nick101,2012-10-24T06:21Z,@Inlegend Well if you would look at the seeders to leachers there is 100 seeders and... 1000 fucking leachers.
,-jr-,2012-10-24T06:36Z,Someone rip the useless multiplayer out of this so I dont have to waste more time downloading...
,yogesh_gamer,2012-10-24T07:22Z,Waiting for BlackBox Repack
,bonyjosem,2012-10-24T07:36Z,thank you very much extremezone...you're the man..
,insect33,2012-10-24T07:37Z,thanks...you're the man EZ..
,bl4kk_mh4mb4,2012-10-24T07:43Z,Wow! finally! the Masters! i will be sweeter if all guys will not dload and run!!! seed more pls. dont limit...seeeeeeeeeeeeeeeeeeeeeeeeeeeeeeeeeed pleaseeeeeeeeeeeeeeeeee! seeding for a week! thank you so much FLT & Ex
,bl4kk_mh4mb4,2012-10-24T08:20Z,where are the kind people who seeds? darksniper thechronic pberry vklgame ogvader and other good people! help seed pls its very slow :(
,CrysisHawk,2012-10-24T08:34Z,Thanks a lot Ez...:)
,fadoobaba,2012-10-24T08:44Z,"thanks man!!

people keep seeding! I stopped Fifa 13 at 1:1.5 because of this game! to save bandwidth! so I will seed till 1:2 surely!!"
,D.C1999,2012-10-24T08:55Z,nice ty EZ
,GameFaqs198,2012-10-24T09:18Z,"This is a LIMITED or DELUXE Edition  ????

EXTREMEZONE , Please upload the LIMITED or DIGITAL DELUXE edition i am waiting for this edition's , i am downloading now from you , and anybody can say me can i play MP ??"
,epic_seeder97,2012-10-24T09:38Z,EZ to the rescue :D
,TanYongZai,2012-10-24T09:48Z,"Thank you ""extremezone"".But please seed :)"
,TanYongZai,2012-10-24T09:49Z,Thank you!!!!!!!!!
,Butcher851,2012-10-24T10:12Z,"No-one is seeding, 1 kb/s speeds. Geez. "
,Butcher851,2012-10-24T10:23Z,1 seeder out of 500
,LNAV737,2012-10-24T10:26Z,Does it work ? 
,bl4kk_mh4mb4,2012-10-24T10:41Z,come on bros! seeed! share to all! dont be greedy :(
,Patone,2012-10-24T10:54Z,Low speed for new torrents is common thing you morons
,Butcher851,2012-10-24T11:02Z,"@patone there are 300 seeds and only one is seeding, that is purely leeching"
,bafakos76,2012-10-24T11:07Z,"ppl who moan about speed seed etc > STFU ull get ur fuckin game as always.go masturbate 27 times and come back
oh and thx EZ"
,budabrat,2012-10-24T11:19Z,PLEASE SEED !!!
,epic_seeder97,2012-10-24T11:43Z,"@Butcher851

300 seeds but look at the peers 6500 :P how can u expect a fast download lol :P"
,mattee91,2012-10-24T11:59Z,"why cant i play? when i start the mission nothing happens, only black screen comes"
,Butcher851,2012-10-24T12:54Z,"Estimated download time, 3 years"
,iDontLie,2012-10-24T13:11Z,"seed people,thanx for game extreme,this game costs exactly half of my monthly wages in my country.south africa suxs,africa suxs."
,virtualmatrix258,2012-10-24T13:26Z,I'm seeding 25mb/s my game downloaded in about 2 hours.
,grantpro,2012-10-24T13:41Z,"I've seeded 11.7 gigs for this game on a different torrent, this game needs more seeds. 4 hours until its done."
,sweetwatr,2012-10-24T13:46Z,15 GB? jaw dropping....! will wait for blackbox :|
,visdom0,2012-10-24T13:51Z,"I only registered to say thank you. I have never had any problems with extremezone releases, but this one bugs me. I have done everything by the book. How it should be..Install, crack, block firewall, play. Yet, when I launch it from Launcher.exe it immediatly crashes when attempting to start Medal of Honor...Ideas?"
,visdom0,2012-10-24T13:52Z,Crash on startup....Ideas?
,visdom0,2012-10-24T14:08Z,Anyone? I am so pumped to play this game :/
,lukacthebest,2012-10-24T14:22Z,Is this really working because i want something what is simple to install and crack. Thanks :)
,marko8,2012-10-24T14:28Z,thanks extreme! no.1
,asnsmooker,2012-10-24T14:29Z,thnx extremezone been waiting for this ........u r the best
,lukacthebest,2012-10-24T14:52Z,What is FLT??
,visdom0,2012-10-24T14:56Z,"Does ANYONE know the fix for when it stops working at startup? I get blackscreen instantly and message saying ""Medal oh Honor Warfighte has stopped working""...:/"
,pirate_LD,2012-10-24T15:07Z,"thenks extremezone ! 15 GB..big file, i hope to finish this download quickly."
,CMDDVats,2012-10-24T15:33Z,Thank You EZ . U R The Star Of Pirate Bay . I cudnt thnk of Pirate Bay widot EZ !! N Many Thanks For Ur work . :-))
[T],3R01,2012-10-24T15:40Z,"Thnx extremezone for another game :D
Guys if you have problem download the update here ~>
http://thepiratebay.se/torrent/7755536/Medal_of_Honor_Warfighter_UPDATE-FLT"
,dimonakid,2012-10-24T16:05Z,"DiD evrything NFO say (crack from DVD1) & game wont start!!!
-"
,bl4kk_mh4mb4,2012-10-24T16:22Z,hopeless:( no one is seeding generously all is limiting..4kb dl/ 100kb ul...unfair :( 
,dimonakid,2012-10-24T16:24Z,"NOT WORKING!! - (copie crack from DVD1) on WIN7 sp1 X64
Not working even with dvd2 Crack
W-T-F////?"
,bl4kk_mh4mb4,2012-10-24T16:27Z,@dimonakid..you deserve it. your hit and run. no continuous seeding
,MTeo567,2012-10-24T16:29Z,thx extreme. but the game really suck
,Bboyyaman,2012-10-24T16:34Z,seed
,Marrow,2012-10-24T16:44Z,"Hi Extremezone,
I registered an account just to thank you for what you have done for me, and this whole community. Whilst many people rant on about seeders/speeds,etc, many fail to thank you for your time and effort that goes into the uploading of these torrents and the maintenance of your site. All of your torrents (I dl'ed +- 15 games from you in the past) always work flawlessly! And for that, on behalf of this whole community, thank you.

Im currently in Australia (Perth) for a while (but reside in South Africa) and if you ever decide to go there, I will be more than happy to offer you accomodation,and show you around...or just take you out for a drink ;)

Peace! :)"
,bl4kk_mh4mb4,2012-10-24T16:49Z,yeah many failed to thank Ex! only hit and run! 
,amr_elmasry,2012-10-24T17:02Z,fuck you
[V],extremezone,2012-10-24T17:20Z,already have the update included in this version
,bl4kk_mh4mb4,2012-10-24T17:22Z,another hit and run commented! ooops! LOL
,PeleGamer,2012-10-24T18:14Z,"Great trusted torrent!
if you can please seed guys!"
,Majestik1,2012-10-24T18:32Z,"like many of the other commenters on this thread, MANY fail to thank you for your very exquisit work that goes into doing what you do, me included; so here's your props.
FUCK YEAH!!! Thanks EAZY-Z!!!"
,lukacthebest,2012-10-24T18:36Z,SEEEEEEEEEEEEEEEEEEEEEEEEED so slow -.- better wait for SKIDROW torent or RELOADED 
,lukacthebest,2012-10-24T18:37Z,And what is FLT?
,PeleGamer,2012-10-24T18:40Z,"Guys i need some help :
Im seeding alot and all the time!
but my seeding speed IS SLOW :
i cant seed more than 15KB/s But my download speed (not downloading while seeding) is 1.1MB/s that is pretty high :
~ Somting i can do to raise my upload speed ? ~"
,Devil_jinn,2012-10-24T18:44Z,Help...Guyz...I Cannot Download...When..It Starts To Download.....It Gives ..Me Error...Unable...Too...Download...Help..Will Be Appreciated.....
,blaze31r,2012-10-24T18:46Z,"Can anyone confirm if this version crashes after first sniper part also, or works good?"
,MicroBalls,2012-10-24T19:05Z,"
Thanks, I'll help seeding with 2SB 1gbit up each."
,MicroBalls,2012-10-24T19:08Z,"@Pelegamer

Sounds to me like you have ADSL, you cant upload and download at the same time on your connection you need full duplex connection to get same speed up and down at the same time."
,ironymon,2012-10-24T19:27Z,"So the game itself is 16gb right, and thats WITHOUT language packs and unnecessary crap... tbh i don't care i have no limits."
,GObonzo,2012-10-24T19:43Z,"how the hell do y'all no who is seeding or is just ""hit&run"". everything i've ever dloaded seeds to at least 1:1 ratio and i dont usually comment unless there's a reason.
just dumbass kids hanging out here on torrent pages looking at user comments?"
,agnu,2012-10-24T20:05Z,"thanx extremezone!

I am posting the comment even before finishing the download as i am sure it will work flawlessly! :)"
,messycreampie,2012-10-24T20:23Z,Thanks extremezone good dl. I uploaded 48gb last night while dling enjoy!
,Galaksy1,2012-10-24T20:26Z,"down speed 23 kbs 
Up speed 0.01/1 "
,aer126,2012-10-24T22:31Z,SEED!!!SEED!!!SEED!!!SEED!!!SEED!!!SEED!!!SEED!!!SEED!!!SEED!!!SEED!!!SEED!!!SEED!!!SEED!!!SEED!!!SEED!!!SEED!!!SEED!!!SEED!!!SEED!!!SEED!!!SEED!!!SEED!!!SEED!!!SEED!!!SEED!!!SEED!!!SEED!!!SEED!!! PLEASE !!! No Downloading :(((
,aer126,2012-10-24T22:32Z,"SEED!!! SEED!!! SEED!!!

Please , No Downloading :((("
,Don_key_nr1,2012-10-24T22:34Z,"extremezone
THx mate will do good ratio after i have installed the game! 

All u Fokkers that don't appreciated a man/women uploading this good games and movies etc....
Should maybe press alt+f4 and u dont have to worry for a thing no more... no more pain ..... wahahaha"
,serbian96,2012-10-24T23:16Z,fuck only 1000 seders and 18000 leachers xD
,sr2005,2012-10-24T23:30Z,The game crashes everytime after I ram the car in the mission Hot Pursuit.After that a cutscene appears showing Preacher lying on the hospital bed and his wife enters and then the game freezes.Does anyone else are facing the same problem?Iam playing delux version with FLT crack.
,iggyca,2012-10-24T23:32Z,Thanks for upload this extremezone i will wait until Leechers going down and Seeders going up :)
,Kindergaten,2012-10-24T23:46Z,"If any of you guys are having trouble installing this game, then I uploaded a vid on you tube. Just search for gligar2tennyson"
,Tayls,2012-10-25T00:01Z,Stop leeching and wait for more seeds you fat stupid fucks
,Aliboy777,2012-10-25T00:25Z,is it multiplayer????
,biteme1011,2012-10-25T00:34Z,thanks for another great job extremezone! I really appreciate the work and effort you guys put in to these releases! You guys rule!!
,Quink666,2012-10-25T00:44Z,"WTF IS WITH THE FUCKING GAY FUCKING CUNT FUCKING MUSIC IN THE INSTALLER THAT YYOU CANT DISABLE??
FUCKING CUNT FLT!"
,topk,2012-10-25T01:02Z,"WTF it asks me to register with Origin (alternative Steam from EA) but I have no Origin account and when i regged at Origin it never send me activation
Fuck this shit.
ORIGIN NOT CRACKED
NUKE THIS SHIT"
,topk,2012-10-25T01:11Z,OK so i now realzie I am suppsoed to install from the crack folder installer... This is retarded. FLT is retarded
,PhuGame,2012-10-25T03:42Z,"WDF WITH PEOPLE TODAY?? NO SEED AT ALL?? DON""T BE SO FREAKING DEVIL !! Im download at 50kb/s and Upload at 500kb/s !!! FUCK ALL PEOPLE THAT SEEDING...I HELP THE WORLD BUT THE WORLD DON'T HELP ME :"
,djne123,2012-10-25T04:18Z,Am I the only guy seeding? really?
,rockodss,2012-10-25T04:58Z,"Everyone whining about seeing are just fucking retarded. Learn to use P2P and bittorrent fuckers. 

I have downlaoded this in about 2-3 hours with 4-6MB/S then I seeded all day .  Down:15G UP:85G. 

Stfu kids and learn to open your ports before whining about how slow it is. yes its slow, because you are retarded.   and ofcourse its gonna be slow .

 SEEDERS:1249   LEECHERS:15979 

you know how to count right ? theres 12x more downloader than uploaders because the game came out today fucking ignorant so ofcourse its gonna be slow for a week. ingrat people whining about free things, how fucking low IQ are you? "
,ogvader,2012-10-25T05:26Z,works good if you follow the directions.
,CharlieWaflesBR,2012-10-25T05:59Z,This is taking so fucking long... SEED PEOPLE!!!
,rockodss,2012-10-25T06:21Z,"Btw im getting the same crash as many, after the intro , the pratice range, and the 1st mission, you get a cutscene, a guy, a train, and a boom. and it crash after. no big deal will just wait for a patch or some trick on comments.  
just pointing it out. 
(I get every game from extreme and they always work.) "
,indium3,2012-10-25T06:55Z,"extreme zone plz upload this ......Assassin Creed
Revelation Rip
(RePack) Black
Box PC-AMW3~"
,lucabara,2012-10-25T07:22Z,P E R F E C T A M U N D O ! ! !
,yasm20,2012-10-25T07:47Z,the game crashes after the introduction every times plzzzzzzzzz help me i want to play this game..... :( :(
,orrzxz,2012-10-25T08:30Z,"Great download! it finish me in 2 hours! :D
Seeding!!!
and for the israelis:
אחלה הורדה, יורד בטיל עכשיו לחכות למולטיפלייר"
,ToxicRush,2012-10-25T08:31Z,"Please SEED People !! im downloading 0.3 kB/s
like WTF"
,jaywars,2012-10-25T10:07Z,good torrent~ fast speed and easy install~ thanks extremezone~ thanks.
,XHaloXX,2012-10-25T10:12Z,"@orrzxz

And for you, FUCK YA!!

gr8 upload thx, FLT rules, best installer i've seen, unlike skidrow fags bragging about their work and things gone fucked lately with them!"
,pokipsiany,2012-10-25T11:56Z,Guys..seed please.
,Shane05,2012-10-25T12:56Z,"Goddammit i fucking hate the music on the installer.
That's why i dont like FLT releases, always with the annoying loud songs, i want to watch a tv show while the game installs FFS"
,Anesito,2012-10-25T13:45Z,http://pokit.org/get/?1664f5240e1da1ed106d444702f4e61f.jpg
,orrzxz,2012-10-25T13:57Z,"its just me, or the its a generic virus?...
plz tell me he didnt put virus in his downloads again 0_0"
,lukacthebest,2012-10-25T14:01Z,SEEEEEEEEEEED 51 kb/s that is too slow :P
,Lordvicius,2012-10-25T14:15Z,"game works,i dont use launcher,just game exe.thanks extremezone.i really sucks at training."
,lukacthebest,2012-10-25T14:20Z,"FInally it's faster downloading guys just go to youtube and see ""how to speed up utorrent and speed it up ;)"
,meoP90,2012-10-25T14:26Z,Pls Seed! :/
,chaosyetti,2012-10-25T14:41Z,"wow people are greedy, i'm at 1:7 seed ratio and i'm 2% done. going at 0.2kbps. its going to take 14weeks......................."
,koyote89,2012-10-25T14:46Z,SEED SEED 100kb/s 1w5d left c'mon !!!!!!!!!!!!!!!
,tomppixu,2012-10-25T15:09Z,9 fucking hours seed you retards i've only downloaded 50%
,andzik,2012-10-25T15:15Z,1y left LOL :| Please SEED !! 
,Hapacz,2012-10-25T15:25Z,"100kb/s is it joke? , please dont be bad ass and seen this ! . "
,iggyca,2012-10-25T15:31Z,Leechers: 22247 Are you crazy guys :)
,CptFoley101,2012-10-25T15:43Z,"Anyone else having problems with mission 8 (finding faraz)?When Ajab comes to pick us up in the car at the end of the level,the next one doesnt load up."
,susulock,2012-10-25T15:46Z,@Shane05 I hate that stupid music too. I won't be downloading this one.
,00000000000087,2012-10-25T15:59Z,"OMG ...
Seeders 2427
Leechers 22897"
,pokipsiany,2012-10-25T16:21Z,"The slowest torrent ever... 
download: 0,5kb/s
sending : 90kb/s....the fuck?"
,ToxicRush,2012-10-25T16:24Z,SEEEEEEEEEEEEEEEEEEEEEEEEEEEEEEEEEEEEEEEEEEEEEEEEEEEEEEEEEEEEDD !!!
,Lordvicius,2012-10-25T16:40Z,"awesome game.i ll seed 15.5 gib ,no more."
,Devil_jinn,2012-10-25T16:49Z,Seeeeeeeed......guyz...come on....Download Speed...2.5 kb/s....this will take 10 years to download....lolz...seed...guyz....
,damito86,2012-10-25T17:05Z,"Please, anyone who has a duplex connection don't limit your upload speed!! when i finish i'll seed all day but i just have and ADSL connection"
,macha33,2012-10-25T17:06Z,"SEEDERS MORE i have 22,5 kb/s PLOX"
,Bugsy1981,2012-10-25T17:42Z,Add this peer guys 37.59.214.217:61603  good luck ;)
,thechronic_13,2012-10-25T17:52Z,"damn 25k leechers and only 2400 seeders?

ive been dling for 37 hours now and im still at 64%...

i hope this game is good on pc...its getting terrible reviews so far for the consoles if you check out gamerankings.com"
,gandles,2012-10-25T18:23Z,"anyone getting the studdering sound, like everything has an echo to it? ty"
,mandruf,2012-10-25T18:24Z,"This is terrible, 2ko/s.
Will you SEED please ? Fucking kids .."
,CrysisHawk,2012-10-25T18:47Z,GodDamn seed it fuckin we're stucked........
,Galaksy1,2012-10-25T18:56Z,I can't register on Origin. :/ Fuck! 
,BreakTTB,2012-10-25T19:02Z,thanks dude you re the best
,rockodss,2012-10-25T19:04Z,the torrent is not slow. YOU ARE RETARDED and need to learn how to PC. Downloaded in 2 hours with 4-6 MB/s.   Next person that co9mment about seeders is a total douche retarded kid. 
,Galaksy1,2012-10-25T19:17Z,Isn't work.! 
,XHaloXX,2012-10-25T19:21Z,"k game works perfect, beat it now, honestly the game is too fuckin short and doesnt worth the money.

only 6 hours SP, but all other stuff are good, graphics are awesome though."
,blaze31r,2012-10-25T19:31Z,Anyone experienced problems starting up the game? It wont load up after update/crack after i start with launcher...
,sajid1988,2012-10-25T19:34Z,do u guys really enjoyed it coz this game has got some really bad ratings by reviewers????
,lukacthebest,2012-10-25T19:38Z,I thinked it's the seeders but it isn't you need to see the video on youtube and set the utorrent options and it will be fast (500%) in the morning it will be done for me guys listen to me ;)
[V],DeGun,2012-10-25T20:14Z,"quote : 

 Shane05 at 2012-10-25 12:56 CET:
Goddammit i fucking hate the music on the installer.
That's why i dont like FLT releases, always with the annoying loud songs, i want to watch a tv show while the game installs FFS

Anesito at 2012-10-25 13:45 CET:
http://pokit.org/get/?1664f5240e1da1ed106d444702f4e61f.jpg

@ ANESITO : lol well done, thanks to show and proove a noob he really is a noob ... not only in gaming but also on what to expect and do with a computer.

@@ Shane05: must not be easy for you in everydayz life ... 

lol"
,brownnotesuicide,2012-10-25T20:21Z,anyone getting a game crash after 4 headshots while breaching?
,Bugsy1981,2012-10-25T21:11Z,"guys the game is ok,torrrent is ok,put the peer i wrote,and dont forget to update the latest driver.Im using radeon 5850 and catalyst 12,im playing for few hours and all fine for me ;) Good luck"
,Jedi_Farseer,2012-10-25T22:02Z,Please seed for me. Thanks XD
,RomanCl,2012-10-25T22:10Z,Is this game even worth the 10-20Kb download speed? seriously
[T],Knaster,2012-10-25T22:25Z,Anyone else got stuck at the boat mission somehow i cant drive the boat if i go forward i just walk off the boat LOL.....Worst game this year!
,bade06,2012-10-25T22:37Z,THIS GAME ISNT WORTH 5 $
,sigmas55,2012-10-25T22:54Z,"A question guys.. whats the difference between the two terrents of this game in this site, there is another torrent but it contain LIMITED EDITION in it's name and i almost finished downloading it,, is there any difference from this one????"
,Sirreal420,2012-10-25T23:04Z,"took longer to download than to beat it, maybe 5hrs of gameplay"
,1Kazanova,2012-10-25T23:14Z,Seed people what's wrong with ya!!
,kri1st,2012-10-25T23:15Z,"Awesome torrent, but shitty game. Not worth your time."
,tiritorro,2012-10-26T00:09Z,"Very nice game, check the full HD gameplay video:"
,Shane05,2012-10-26T00:10Z,"@DeGun: I never said that i didnt used mixer, I was making a point...I just said that i hate that fucking annoying song in every release. It almost blew my subwoofer.
PS: i use a custom desktop and i'm a programmer in RL...so yeah"
,tiritorro,2012-10-26T00:10Z,http://thepiratebay.se/torrent/7755536/Medal_of_Honor_Warfighter_UPDATE-FLT
,tony_hawk,2012-10-26T00:18Z,agora eu fiquei doce doce
,Hancock79,2012-10-26T00:23Z,"you people complaining about seeders are funny.  you think you're actually being useful somehow or it will change anything?  stop being so fucking lazy and learn how to configure your torrent client or some of you just need to start at a basic Torrent FAQ

yes my post is useless too.  but it just can't be said enough how retarded many piratebay users are and you're so god damned whiney maybe I can hurt your feelings and you'll go elsewhere, spare everyone else the headache.  who am I kidding there's too many, just wasted time typing this."
[V],DeGun,2012-10-26T01:23Z,"Shane

baaah no offense just the way you were shown the ""trick"" made me smile ... after yeah me too i already blew my boomerz with those kind of unexpected sounds so i do imagine ...

after moaning for this is quite too much when you think of the great great work those groups of crackers are doing, FLT released his crack what ? 4 days after the game was out so give thx at least you know what i mean ? 

Hope now you are enjoying the game though and that you can still use your boomerz as well .

Gr££tz"
,tony_hawk,2012-10-26T01:25Z,could upar Medal of Honor Limited Edition Warfighter PC Full Cracked
,tony_hawk,2012-10-26T01:27Z,could upar Medal of Honor Limited Edition Warfighter PC Full   Cracked
,Uploadm1n,2012-10-26T01:28Z,"Downloading @ 22.2 That is some crap, you guys need to seriously help everyone out here..."
,GrimmCro,2012-10-26T01:50Z,"Fast download considering the size.  Installing as I type, if only there was a way to turn off this wretched noise playing with the installer.

:)

Thanks for the up."
,SnH,2012-10-26T02:27Z,"1 st when i launched the game it came upto loadin screen n kept on loading never came 2 main menu,from the 2 nd time it kept on getting stuck at danger close logo somebody pls help me,tell me hw 2 install dz prpoerly tnx EZ"
,hatha71,2012-10-26T02:31Z,Big thanks to the uploader...Thumbs up
,opomarperez,2012-10-26T03:07Z,"you need ""powerISO"" to mount the game and  to install to play multilayer you need ""tunngle"" it work
thank you agian"
,GrimmCro,2012-10-26T03:29Z,"How to uninstall?  Won't work for me, won't even get in the main menu."
,4LC4PON3,2012-10-26T04:08Z,Super slow seeding. jumps from 400kb/s to 100kb/s. Goes from a decent 4 hours then to 10+ hours. Come on people seed
,visdom0,2012-10-26T04:12Z,"You people ARE SO FUCKING STUPID. IF YOU DON'T LIKE THE MUSIC IN THE INSTALLER JUST MUTE IT IN BOTTOM RIGHT! RIGHT CLICK SOUND ICON, OPEN VOLUMEMIXER ANDMUTE IT! HOW FUCKING HARD CAN IT BE? Unless you're 10. Sorry for being an ass here, but I'm fed up with all these FUCKING kids complaining ALL THE FUCKING TIME! Learn how to use a fucking computer."
,djokaaa,2012-10-26T04:14Z,"Game Work * Burn or mount
* Install the game using the installer located in
the Fairlight folder on DVD1
* Auto-apply the crack or manually copy it to your installation folder
* Play the game by starting the launcher.exe ( block it in your firewall )100%!"
,Galaksy1,2012-10-26T04:15Z,"This game work. 
I end this game buy 4hours. :D Good game ,perfect ,but to short and easy. :) "
,Galaksy1,2012-10-26T04:21Z,by*
,junrepdos,2012-10-26T04:37Z,seeeeeeeeeeeddddddddddddddddddd
,lukacthebest,2012-10-26T07:26Z,I'm instaling now seeding 10 kb/s
,lukacthebest,2012-10-26T08:13Z,"DON'T UPLOAD THIS SHIT IT'S A VIRUS!!!!!!!!!!!! AVG found it something like ""Generic"" and its 4th on the scale DON'T DOWNLOAD THIS SHIT!!!!!!"
,srkrock,2012-10-26T08:18Z,Galaxy....its a 6 hour gameplay n how could u end it in 4 hour u lier.....
,getslayer,2012-10-26T08:20Z,no there's no virus AVG don't like torrents thats all 
,yasm20,2012-10-26T09:03Z,game completed also uploaded 100 gb
,yasm20,2012-10-26T09:09Z,worst game off the year.....!!!!!! JUst waiting for CALL OF DUTY BLACK OPS 2
,savvy_148,2012-10-26T11:31Z,guys....SEEEEEEEEEEEEED its hardly 0.5 kbps...cumon seed.thanx..!:)
,miki80pirate,2012-10-26T11:41Z,"im waiting for CALL OF DUTY BLACK OPS 2 , also ,medal of honor 2010 was far better game, this part horrible, poor graphics,the shooting in all missions was the same ,poor weapon choice,and i think this is first person shooter, not racing game..."
,Rango456,2012-10-26T11:47Z,Download tunngle and play online.
,Arcis22,2012-10-26T11:57Z,seed 8.8 kB/s haha thx 
,Kindergaten,2012-10-26T11:59Z,"If u guys are having trouble to install this, then go to u tube and type in gligar2tennyson, his tutorials are great"
,iggyca,2012-10-26T13:32Z,3169 Seeders GREAT SEED! SEED SEED! 
,runner92,2012-10-26T14:17Z,"i herd this game is full of bugs and not as that good as its suposed to be, so im not downloading..."
,zamphire0,2012-10-26T15:21Z,"@lukacthebest 1.  if you use avg your a retard
2. why u so fucking ugly."
,ram789,2012-10-26T15:30Z,"@miki80pirate  um this is supposed to be a fps and not a racing game lol

@runner92 thnx for letting us know, some people here were dying to know what you were going to say about this game!"
,tom6968,2012-10-26T15:46Z,"Anybody stock at the car chasing part(Hot Pursue?)and then the Origin program pop up and the game crashed.

Any idea?"
,Galaksy1,2012-10-26T16:15Z,"@srkrock ,dude ,i am a not lier. If you don't believe i can prove it to you ,just tell me how? :) 
I play at NORMAL :P "
,dontpKaniC,2012-10-26T16:15Z,@lukacthebest that's a torrent from extremezone you IDIOT! About the ONLY uploader of whom you can be 100% sure that it's real and clean! So please STFU and crawl back to the hole you came out of!
,Diablo76,2012-10-26T17:14Z,"lukacthebest

Are you going for the ""Stupid Fuck of the Year"" award?"
,squaky,2012-10-26T18:00Z,"Avira antivirus:
In launcher exe.

Virus:

TR/Crypt.XPACK.Gen2



Date discovered:

08/10/2009



Type:

Trojan



In the wild:

Yes



Reported Infections:

Low



Distribution Potential:

Low



Damage Potential:

Low



Static file:

No



Engine version:

7.09.01.35"
