User Type,Username,Date,Text
,Waterson,2012-11-01T19:26Z,"Ok, downloaded it again and now the game works. Thanks Extreme. Only problem is the sound: it keeps repeating. Any ideas?"
,obliveron,2012-11-01T20:25Z,@ OGTMS NO YOU are the retard. you asked a stupid question. and he did speak properly as i understood him perfectly. i assume you meant you want him to speak more respectfully to you? further proof this is your first time using the internet as getting a polite reply to a dumb question is unheard of. but the cd key question is whats the really funny bit. 99% of the games downloaded from pirate sites dont have a cd key. they have a crack. you can buy the game and get a cd key if you want to play online. if not you can use the crack that's in the download folder to crack the game after you install it so that you can play single player. just like everyone else here.
,sekidevil,2012-11-01T22:17Z,"Need help!!!
when i complete the instalation i get this message:MSVCP100.dll missing plzzzzz help"
,Yorgal,2012-11-01T23:00Z,"Ok now i have an other problem , when i click on the exe , i have a black screen when it loading after the graphical motor picture etc .."
,xxgamers,2012-11-02T00:47Z,"Nice game !! :D. I finished the game earlier to day !. Thanks ""extremezone"" !!"
,piratol,2012-11-02T02:55Z,"Please seed people, got 5x more leechers"
,yogesh_gamer,2012-11-02T03:33Z,"For me its not working.
I know there is no problem in game. There is some problem in my pc.
I updated Graphics Card, DX, Windows.
But still its not working for me.
Please help"
,Rahul1992,2012-11-02T07:27Z,It's not smooth at all. I've a pc with good enough configurations but still it has delay in response. 
,purprinz,2012-11-02T10:41Z,"thanks extremezone, i never buy PC Games because of uploader like you. Keep it up! Really awesome game.... just dowload the game and install (i use Daemon Tools / Power ISO). Down the MEDAL OF HONOR WARFIGHTER UPDATE. If your crashes, run the game in compatibility mode. Smooth and easy, just use some BRAIN and READ the THREAD."
,purprinz,2012-11-02T10:42Z,"thanks extremezone, i never buy PC Games because of uploader like you. Keep it up! Really awesome game.... "
,Gary92,2012-11-02T14:41Z,"hello, after the sniper mission turn black and ask me the origin, what now?"
,tony_hawk,2012-11-02T15:36Z,FICAR DE SEEED
,dexamp60,2012-11-02T16:27Z,Thanks extreme u rock man.
,richard2012amd,2012-11-03T00:54Z,Great game
,SOAD619,2012-11-03T05:31Z,I did all that for win XP but doesnt launch to the game.Any solution
,CrysisHawk,2012-11-03T08:28Z,C'mon guyz seed it.......It's been so much time and the speed still sucks.....
,Shaggy1991,2012-11-03T11:48Z,seed plzz!
,cole90,2012-11-03T11:50Z,"working great but I have some problems with echo
on some missions.... ::("
,bartaz,2012-11-03T18:51Z,"ANY SEEDER? I HAVE 0,1KB/S !!!! WHAT A EGOISTS"
,savvy_148,2012-11-04T06:07Z,seed..u jerks..! i have uploaded abt 20 gb now..!
,omkara1008,2012-11-04T09:51Z,The music during the install is incredibly fucking annoying.  So basically I can't use my speakers for anything else while this thing is installing?  Who's the nerdy dickhead who's trying to launch his music career by forcing us to listen to this 8-bit crap?
,omkara1008,2012-11-04T10:01Z,"never mind, fixed it

http://pokit.org/get/?1664f5240e1da1ed106d444702f4e61f.jpg"
,yogesh_gamer,2012-11-04T14:07Z,"MSVCR.dll is missing from my computer.
Please Help Me
I downloaded it from dll-files.com and also installed VS c++ 2010. But not working for me.
Please Help Me"
,TDWho,2012-11-04T15:09Z,"My error:

Failed creating D3D device of least version 10.0 on adapter ''Intel(R) HD Graphics'' with driver ''Unknown''.Error os DXGI_ERROR-UNSUPPORTED (''Unsupported.'').

This is typically caused by not having the minimum required DirextX support in the GPU.
For NVIDIA GPUs,DirectX 10.0 support required.
For AMD and GPUs from other vendors, DirectX 10.1 support is required.

Problem is that i have windows 7 and i readed that windows 7 have built in DirectX 11,so what is the problem please help!!!!Im new in this stuff"
,matan172,2012-11-04T15:33Z,work ! but piece of shit game!
,Lidor11,2012-11-04T19:21Z,"Top 2 out of 50 most wanted pc game :)
the last one was HUGE fail lets see thier comeback now!"
,xlemuelx,2012-11-04T19:40Z,"working real fine, abit of choppy/echo during dialogue"
,x_nerko_x,2012-11-04T21:18Z,"Here is how to change controls for any game 
to play on Joystick or any Joypad
on YouTuBe :)

htt$p:$//$goo$.gl$/0j2SU

REMOVE  sign $ for link"
,phantaxtic,2012-11-05T02:56Z,"How is this game #2 in the top 100?? 

http://ca.ign.com/articles/2012/10/27/medal-of-honor-warfighter-review

Its pieces of crap like this that remind us all why it is we download before buying. "
,lemusun,2012-11-05T04:14Z,"PERFECT!!!
There is translation for brazilian portuguese?"
,kohh74,2012-11-05T07:42Z,Thanks a lot. It works perfectly! 
,savvy_148,2012-11-05T16:20Z,fuck u ppl seedd..!
,XbrusX,2012-11-05T18:39Z,"People who doesnt seed; i dont know who you are but i will find you, and i will make you seed."
,killert35,2012-11-05T22:27Z,solution for black screen - http://forum.gamevicio.com/i/topicos/253/253945-black-screen-medal-of-honor-warfighter/index.html#post_1548951
,lemusun,2012-11-06T00:47Z,Multiplayer works?
,HiggsBoson12,2012-11-06T03:24Z,"Hey, So I used the automatic installer and now I can't uninstall the game, any suggestions??"
,ShaulinX,2012-11-06T04:55Z,"I thought the game would be better than this crap! I have a i7 with the best components that can be but after the chasing misson the game gets stuck. 
Maybe some bug in this version... Any ideias???"
,platery,2012-11-06T05:29Z,"will you please help i am having trouble installing this game.
milburn.dmello@gmail.com"
,platery,2012-11-06T05:46Z,"after i mount mhwa the installer asks for the next disc when i select this disc it says 'not a valid file' and i cannot get past this, can someone please help..."
,kohh74,2012-11-06T07:09Z,"Hey platery, you have to select MOHW2.rar in the second cd mount drive"
,savvy_148,2012-11-06T07:17Z,"THIS GAME IS GOOD ,GOOD GFX, M PLAYING AT ULTRA MODE....GRT GAME BT IT FUCKS AL TIME BLACK OUT EVEN WHEN I RAN IT ADMINISTER..!!PLZ TEL ME HOW TO FIX...AND M ALSO SEEDING GUYZZ.!;)"
,Waterson,2012-11-06T07:51Z,Black screen / freeze problem: Just switch the game to windowed mode just before the freeze. It worked for me after the chase scene.
,platery,2012-11-06T11:27Z,"the dl file consists of 3 file
fairlight
mohwa
mohwb

mohwa mounts fine but it cannot recognise 
mohwb for some reason"
,gopi660,2012-11-06T15:07Z,"After ""finding faraz"" mission, the next level is not loading..., only black screen....:(
Any solution guys.....? thanks"
,obliveron,2012-11-06T16:23Z,"gotta love it when ppl read 0 comments before they ask strangers questions. so first off look at the comments or there isnt a point in having them, well other than so ppl can get pissy and yell SEED because their using dialup and cant figure out why they cant download torrents instantly. and second a lot of ppls questions can be answered by google with about 30 seconds worth of looking, but yet ppl still post the same question 20 times over the course of a week. so after skimming all of the comments and playing it for about a hour before i more or less rage quit here is a summary. the game is crap. buggy crap that needs to be patched to play without pissing you off. single player story is retarded. the ppl in the single player campaign look stupid. side note if you think any games released in the last 1-2 years can be used with windows xp then you really need to wake up and realize windows vista and 7 have passed you by and 8 is out now its about damn time you upgrade from over 10 years ago. so to reiterate the game is buggy, it crashes alot. and even when not crashing it just plain sucks imo. i would honestly rather just troll comments and forums for the next week until Call of Duty: Black Ops II releases. and if the single player sucks nearly as bad as it does here gonna go wonder the streets punching random ppl in the face or something."
,shaad_na,2012-11-06T16:29Z,"pppl having problem with this issue : The procedure entry point_invalid_parameter_noinfo_noreturn could not be located in the dynamic link library MSVCR100.dll
 try out the link n it will work fine..

You can fetch the Visual C++ 2010 Runtimes from: http://www.microsoft.com/downloads/details.aspx?displaylang=en&FamilyID=a7b7a05e-6de6-4d3a-a423-37bf0912db84

You can fetch the DirectX 9c Runtimes from: http://www.microsoft.com/downloads/details.aspx?familyid=2DA43D38-DB71-4C1B-BC6A-9B6652CD92A3&displaylang=en"
,Waterson,2012-11-06T16:38Z,"@platery: Had the same problem - have to download mohwb again.
@gopi660: switch the game to windowed mode just before the freeze, and play through until next level has loaded!"
,yourking,2012-11-06T17:00Z,"After the training mission the game just freeze in the next cutscene.

Tried downloading the update torrent and the crack only torrent but still happens every time.

Sometimes ~5 sec in and sometimes ~15 sec.

The game runs smooth but this is bugging me out.

Searched the web for an answer, any ideas?"
,Megabon,2012-11-06T19:29Z,This works perfectly :) Thank you again extremezone :D
,ndylostkid,2012-11-06T20:37Z,"the game is ridiculously smooooth....
but what happen with the sound?
i try desktop n tv mode still lag in sound effect...
solution please!!"
,WhoCare1911,2012-11-07T08:26Z,"Fuck seeeeeeeeeeed !!! been downloading this for 73 hours now and its only on 60.4%, average at 30.8kb/s "
,yourking,2012-11-07T16:29Z,Ok so i solved my problem and game runns just fine when i auto-applied the crack from the update & crack torrent.
,oldtvshow,2012-11-07T17:51Z,"kaspersky internet security 7th november 2012 database

no virus or trojan

install with confidence"
,oldtvshow,2012-11-07T17:52Z,"kaspersky internet security - no virus or trojan
works fine"
,3v1lg0d,2012-11-07T20:11Z,what the hell
,yogesh_gamer,2012-11-08T04:57Z,"Guyz can anybody help me?
I cant launch d game even no black screen.
I did everything correct but its not working for me.
I tried it on Windows 7 and 8 as well.
I have Win 7 32 Bit and Win 8 64 Bit. Please Help me"
,Shiraz365,2012-11-08T08:30Z,suckers seeeeeeeeeeeeeeeeddddddd
,pennknig,2012-11-08T14:05Z,"THIS GAME WORKS PERFECTLY
+1
Mounted on HDD2, HP Envy 17-3090NR 3D

If you can't get it to work, you're too dumb to be on the internet downloading software.
You're using up air that the sick and old people need.
Go kill yourself."
,Gary92,2012-11-08T15:20Z,"Crash after the sniper mission, if patch solved it where can i find?"
,pauldowe,2012-11-08T17:03Z,Works like a dream if you have any problems playing make sure it can not connect to internet once it has you will have to reinstall
,Natteulven,2012-11-08T17:55Z,"So I installed everything correctly, the crack, the patch, ect... 

When I click Launcher.exe the MoHW screen comes up and it has a button that says ""launch game"". I click that and nothing happens... What do I do? "
,4therace,2012-11-08T19:37Z,"Downloaded extremely fast, actually. In about 4 hours. Working flawlessly in Ultra mode. Great upload, thanks!"
,4therace,2012-11-08T19:37Z,I'm also seeding at 1mbps ;)
,samerdl,2012-11-09T13:08Z,having trouble with audio it breaks up most times during gameplay
,tutornorpax,2012-11-09T14:11Z,Seed plz 15 day to download
,junmark,2012-11-09T16:39Z,"4699 seeders ????
10148 leechers ???
c'mon ......
share the fun....."
,the_audiophiles,2012-11-10T01:00Z,"thanks EXTREMEZONE, you guys rock, shame this game sux balls."
,fendamn123,2012-11-10T03:13Z,"works great! install, auto apply crack, make sure video drivers are up to date and direct x works like a charm this game is actually bad ass... reminds me of BF2 but way better graphics

You rock Brajj"
,yogesh_gamer,2012-11-10T05:15Z,@Natteulven I have same problem. Found any solution?
,ruserious247,2012-11-10T06:49Z,WTF! I must be retarded? I cant get this thing to launch after 3 weeks of dl'ing? Says something about online activation failure. Any help?
,ruserious247,2012-11-10T06:53Z,"WTF!? I must be retarded, because i know extreme's torrents are great. I get an activation.dll failed, error message. what did i do wrong?"
,HITMAN00,2012-11-10T07:51Z,stop bitching its taking yay long do download. i got this weeks ago. maybe learn more about torrents and you'll get some speed. 
,jargs,2012-11-10T08:23Z,man that music from the installer is killing me! it was fun for a minute
,MiGKiller29,2012-11-10T10:39Z,"Thanks, works perfectly!"
,shadowraith98,2012-11-10T12:39Z,dose multiplayer work !?
,larry27,2012-11-10T13:12Z,How the hell I can shut up this fucking installer music?
,rafael52,2012-11-10T14:13Z,Thanks extremezone.Though I have a problem.At the mission with the car chase.The target car once stopped and I could hit it but nothing happened.After loading the last checkpoint it starts from a point.But the target car goes through walls and I can't see it.So I loose every time.Any help?
,Toastermd,2012-11-10T14:45Z,"mrmouth

thanks, this worked for me:

"" Black screen freezing has to do with the game creating processes with a DLL. If you have a good firewall with active defense, like Comodo, it will block that, game will freeze and you reboot without knowing it was the firewall blocking a process. 

 """
,P4r4n0id,2012-11-10T17:25Z,Works fine for me so far. The first time I installed it wouldn't work. I just deleted the directory and re-installed. Haven't had any problems with black screens and such like others have mentioned...yet.
,ProGamer001,2012-11-10T18:30Z,"extremzone are the best uploder
sorry for bad english"
,bartaz,2012-11-10T19:54Z,"Why nobody is seeding? Now i've 0,1kb/s !"
,Natteulven,2012-11-10T23:28Z,"@yogesh_gamer

Sorry still no solution :/

I was hoping someone here could help. "
,trokahawk,2012-11-10T23:39Z,If you dont like the music just mute it in the windows sound mixer. Geez.
[V],phatwarez,2012-11-10T23:46Z,Thanks i'll help seed for the next couple weeks.
,pennknig,2012-11-11T06:51Z,"larry27      at 2012-11-10 13:12 CET:
WROTE:   ""How the hell I can shut up this fucking installer music?""

ANSWER:
TURN THE VOLUME FUCKING DOWN YOU MORON!

Geesh..............noobs!"
,pennknig,2012-11-11T08:20Z,"OK, I'll try this game.
From what I read and see on YouTube, it's quite short.
The developers focused on the multiplayer aspect.

Downloading now, Average: +/- 850 kB/s.  ETA: 5h 3m
http://bayimg.com/nAfFeAaEn

I don't know WTF everyone's problem is!?"
,pennknig,2012-11-11T11:18Z,"Holly Shit!
Download Speed went up to 1300 kB/s! (1.3 Mb/s).
http://bayimg.com/EafIIaAeN"
,oobaka,2012-11-11T13:25Z,"Do yourselves a favor and pass on this game.
It has to be the worst game (online and offline) I have played in at least 10 years.
Both me and my cousin bought it and we both returned it the next day thanks to a very generous return policy."
,Kundli,2012-11-11T20:52Z,JERK MUSIC -.-
,whiteorc,2012-11-12T14:31Z,Anyone willing to upload the new patch for civ5? It's called fall patch or something. TY
,camozzz,2012-11-13T19:42Z,Someone can i play MULTIPLAYER on pirate MOH WARFIGHTER ? Yes or No
,manouras,2012-11-13T22:09Z,no
,Shiraz365,2012-11-14T08:35Z,1d 10h download only 22%
,floridalucifer,2012-11-14T13:04Z,Hi everyone i mounted this with daemon lite and installed did auto crack. But i can not fond the exe. file any help here?
,LaNzE456,2012-11-14T14:24Z,plx help me...after i play the introduction and it says ELECTRONIC ARTS PRESENT and the a black screen ..pls help
,camozzz,2012-11-14T16:09Z,"Why i cant play on multiplayer ? 
Can mp be cracked ? or patch can someone msg"
,Nima13,2012-11-15T01:10Z,When i install the game i crack it but when i try to play says that something xxx.dll is not found in the library something like that.Wheres the problem?
,brownfoxx,2012-11-15T05:42Z,Can some1 post cd keys for me thats i need and it would surely be a grewat help for me thankyou =)
,mystguy,2012-11-15T09:26Z,Plz seed . . 2kb/s !!!!
,LaNzE456,2012-11-15T11:53Z,the sniper part at act 3 has a glitch...aiming not accurate..please help
,flybikesbmx,2012-11-16T00:25Z,Stop leeching come one. I've already uploaded 21 gigs. The game is only 15!
,ikilledsuperman,2012-11-16T03:54Z,"THIS WORKS & IS EASY INSTALL ! ! GO here Gligar2Tennyson"" to make install even easier. Look for his how to install  ""Medal of Honor Warfighter-FLT "" vid. "
,samerdl,2012-11-16T09:24Z,stuck at the end of mission 11.. my team mates dont go down the ledge and breach the door.. 
,samerdl,2012-11-16T10:04Z,"found a solution if you get stuck at the end of mission 11, just download a save game that finished the game and then go to mission select and select mission 12. "
,camozzz,2012-11-17T07:58Z,For me working good but game its too short 3 days download 6h play ;/ maybe will be crack to multiplayer
,pennknig,2012-11-17T16:12Z,"OK, I'll try this game.
From what I read and see on YouTube, it's quite short.
The developers focused on the multiplayer aspect.

Downloading now, Average: +/- 850 kB/s. ETA: 5h 3m
http://bayimg.com/nAfFeAaEn

I don't know WTF everyone's problem is!? "
,pennknig,2012-11-17T16:19Z,Why aren't my posts showing?!
,pennknig,2012-11-17T16:21Z,"^ OH GREAT^,,,,,That one shows up!!!

Holly Shit!
Download Speed went up to 1300 kB/s! (1.3 Mb/s).
http://bayimg.com/EafIIaAeN"
,Tezukann,2012-11-17T20:30Z,"HOW TO FIX ERRORS + VIDEO TUTORIALsa


adf ly/EwpPz

!@#$%^&*()_+!@#$%^&*(*&^%$#@!@#wfwf42
change space to a period"
,anokone,2012-11-17T22:44Z,"DO NOT WASTE TIME ON THIS SHIT OF GAME !!!!
TORRENT IS GOOD "
,kssamseed,2012-11-17T23:17Z,Another shit MoH game. Don't bother downloading. Get Black OPS 2 instead
,crawlerz246,2012-11-17T23:36Z,"game crashes after the cutscenes of madrid (after the sniper job). retried many times. will not work. very frustrating. I have a good PC (i7 920/580GTX video, etc) and latest drivers. it just won't work! is there any fix?"
,kokikaka,2012-11-18T13:15Z,People just buy the game. I only need a crack so i can play without origin i have legit copy
,SwiftCobra,2012-11-18T15:12Z,"Awesome game story, graphics sad ending tho :)"
,blake2000,2012-11-19T03:19Z,wtf
,taelor_Z,2012-11-19T03:58Z,danke.
,Argris_D,2012-11-19T06:22Z,"I had the usual problem in the end of ""Finding Faraz"" mission. Black screen-audio on-options available-but it never proceedes to next level... I googled it and i found this...



I TRIED IT AND IT WORKED!!!! It also did for many people!!!"
,Argris_D,2012-11-19T06:24Z,"I had the usual problem in the end of ""Finding Faraz"" mission. Black screen-audio on-options available-but it never proceedes to next level... I googled it and i found this...

""""In User/Documents/MOHW/settings/ Open PROF_SAVE_profile with NOTEPAD 

First setting is GstAudio.AudioQuality change any other value to 4. then save it and try the game! On the source ive found there was another folder witch I dont have. It was something like MOH_dayOnePatch_PC so repeat the same steps if you have this folder in My documents... I my case the was only the folder MOHW...""""

I TRIED IT AND IT WORKED!!!! It also did for many people!!!"
,zagu123,2012-11-19T12:27Z,seed please ? :D
,petepat,2012-11-19T12:31Z,"alrighty guys, for those who get startup problems, run in admin mode. Works so far on win 7 64x"
,nelbkw,2012-11-20T00:02Z,"I'm from Brazil. Please, I have a dream of having this game, but I'm poor in this thid world country. I want it for christmas — I'm crying right now, but it's too expensive due to the high taxes. We must pay 400 dolars for a game here in Brazil and I earn just 300 a month. It would help so much to achieve this wish of my dreams if you just simply subscribe to my youtube gamer channel: ""contentegamer"" (have just 1080p gamming footages and I earn some cents if you just subscribe to my channel). Search on youtube and help me and my child. Thank you so much and god bless you all.

P.s: I just wanted to be one day in a first world country and could buy a game. I'd be the happiest person on earth."
,SyrusSmith,2012-11-20T04:01Z,"Hi guys, I need some help with one f*ckin' problem.
When the mission ""Hot Pursuit"" starts, after the cinematics, and I need to drive the car, the screen in the game start to blink, and it's really anoying, 'cause it never stop and I can see a sh*t, and, of course, I can't drive.
I've tried several times; restart the mission; and quit the game and opened it again, but nothing works...
I've been searching the problem on google and some forums, but I don't find a solution yet. Anyone has or had this problem too?, How do you fix it?.

Thks."
,xixi99,2012-11-20T16:47Z,"@nelbkw you're so full of shit. 400 dollars for a game, in brasil?? HAHAHAHAHAHA. So you say you live in a 3rd world country, yet you have the money and the means to record hd videos of games??? Dude, go kill yourself, you don't even know how to lie.
In portuguese, for you only, now.
És mesmo idiota, apelar a sentimentos das pessoas para fins mesquinhos, espero que o teu pc pegue fogo e aos teus jogos que custam 400 dólares."
,asd-08,2012-11-20T20:04Z,"Medal of Honor Airborne v1.3 Eng Repack (3.61 GB Only) Easy Installation - without Any Win7 or Win8 Installation Problem :
http://thepiratebay.se/torrent/7434904/Medal_of_Honor_Airborne_v1.3__Eng_Repack"
,Sandy106,2012-11-21T04:01Z,"lol fantastic, spent a week downloading this and the fucking thing is corrupt"
,Ext_in_use,2012-11-21T04:28Z,Thank you! Very quick and easy install
,xxxGAMExxx,2012-11-21T11:48Z,"Easy install no problem during installation.Game is
working like a charm.
Tnks for the torrent."
,thisshouldwork,2012-11-21T16:05Z,"Just to share that I had a ton of trouble with the game consistently crashing after the 'train bomb to car chase' mission. In the end, I deleted the game, downloaded and re-installed the Medal of Honor Warfighter Eng/Rus repack and was finally able to continue where I left off and complete the level.

The workaround for the issue (and another similar car chase scene later in the game) appears to be by switching the game language to Russian. After the car chase levels are completed, they revert back to English.

I was able to play the game to completion."
,SharinganEyes,2012-11-21T17:35Z,WHERE THE FUCK DO I FIND CD2?
,bos74360,2012-11-21T20:16Z,"Anyone know how to start the uninstall process? I can't find the file, and the game isn't listed within Control Panel/Programs and Features. I'd rather not have to resort to simply deleting the Program Files (x86) folder.

Thanks for the help."
,bos74360,2012-11-21T20:19Z,I didn't mean to say that I would be deleting the entire Program Files (x86) folder. I meant the Medal of Honor Warfighter folder located within. :D
,yogesh_gamer,2012-11-23T19:42Z,"@Natteulven If you found any solution. please reply me.

My Problem: I can't launch the game. And I already updated everything."
,Valkyria89,2012-11-24T11:24Z,"I have just installed the game with the autorun.exe, I said no to autocrack and the copy of libraries. And copied myself everything from the folder fairlight to teh folder where the game is installed.

But when I try to launch it, a little black window appears and mi PC freezes.

What can I do? :("
,svnintl,2012-11-25T04:58Z,"For the ones who gets the ""freeze"". I tried multiple things, but the one that that worked was I downloaded a ""saved game"" and just skipped to the next level. Then don't ask me how but after that I played around with the graphics settings and I can now go back and actually play the scenes that froze earlier (i.e. sniper, car chase)"
,converse11,2012-11-25T13:31Z,"WHAT THE PASSWORD TO EXTRACT BARUA?
FUCKING CIBAI BANGLA~!!!!
SOMEONE HELP ME PLS ~!!!!!!!!!"
,phobsy,2012-11-25T16:57Z,"How do you uninstall this? There's no uninstall from the ""program and features"" of win7."
,converse11,2012-11-25T17:29Z,"can someone tell me what the password the extract the file pls?
my country got survey to download the password..
plss help me.. or email me nvidiageforce1210@gmail.com.
i really appreciate if someone help me..
THX :)"
,prototyp223,2012-11-25T19:32Z,work! but you need to have realy strong computer to play this game
,besharm,2012-11-25T23:17Z,please seeed please 
,besharm,2012-11-25T23:19Z,14kb/s please seed
,feniks12,2012-11-26T01:32Z,"http://gameinfocenter.com/pc-games/system-requirements/Medal-of-Honor-Warfighter.html

Minimum system requirements

OS Windows Vista
CPU Intel Core 2 Duo 2.4GHz / Athlon X2 2.7GHz
RAM At least 2 GB
Hard Drive At least 20GB of free space
Graphics card NVidia 8800 GTS 512 MB VRAM or better / ATI Radeon 3870 512 MB VRAM
DirectX DirectX 10.1 compatible
Online Connection Requirements 1 MB DSL KBPS or faster Internet Connection
Input Keyboard and Mouse
"
,besharm,2012-11-26T01:44Z,please seed pleaseeeeeeeeeeeeeeeeeee
,CryOzed,2012-11-26T07:39Z,"Im now on 3 weeks waiting to complete!
Plssssssssseeeeeeeeeedddddd!!!!
You guyz!
And yet ddnt know if its working. :("
,CryOzed,2012-11-26T07:41Z,"At 7kb/s maximum!
With Bittorent 7.6.1"
