User Type,Username,Date,Text
,Devil_jinn,2012-10-26T18:49Z,"Seeeeeeeed.....

Come...on..

Guyz...

Downloading...

Is....

To...

Slow...."
,JoaoPauloBR,2012-10-26T18:50Z,26905 Leechers....are you fucking kidding me? Seed you greedy fucks!
,pluto_1973,2012-10-26T19:43Z,"so i bought moh warfigter and was disappointed ..
frostbite2 engine in this game sucks dick"
,thamaligz,2012-10-26T20:20Z,My game crash when i launch it!! Some help would be great!! :D !!!
,Fitzy727,2012-10-26T20:33Z,"This was uploaded not like 2 days ago so OF COURSE it's going to take a while to download!  Anyhoo, I just finished downloading and installed.  Game works perfectly!  Hopefully it will keep me satisfied until Black Ops 2!  I will seed when I go to bed tonight!  Thanks a lot !!! +1"
,dimohr,2012-10-26T20:44Z,"Are you Neatertals or something?
Can you read?
The last line of the uploaders note:
""Stop using stupid av's as AVG reporting false positive viruses-disable or use ESET""
This is extremezone we talking about with crack from fairlight!!!
GET SERIOUS"
,tony_hawk,2012-10-26T21:03Z,PESSOAL VAMO SEMEAR 
,Captain_Fuze,2012-10-26T21:06Z,"10H = 21,5%  :("
,brknwngs,2012-10-26T21:08Z,uploading at ~500kb/s. hope that helps people
,tomkar789,2012-10-26T21:53Z,"I cant get out of the windowed mode...
I have changed from windowed to fullscreen in options but nothing happens when i click the accept fullscreen button ingame. Any ideas ?"
,dimohr,2012-10-26T23:01Z,"@tomkar789
click on window then Alt+Enter"
,lbj17,2012-10-26T23:29Z,Multiplayer?
,Pj30,2012-10-26T23:50Z,"Hmmm, can´t get it to work, keeps asking for a missing dll..."
,Tommy204,2012-10-27T00:19Z,@tomkar789 have you tryed alt Enter
,Galaksy1,2012-10-27T00:25Z,"This game WORK ,again to write. :)"
,CharlieWaflesBR,2012-10-27T01:05Z,"That has to be one of the worst torrents I've ever seen when it comes to download speed. This shit's been out for 3 days, and the download speed sits at 40 kb/s... when my normal download speed is 1mb/s. Sad, just sad..."
,thechronic_13,2012-10-27T02:10Z,"waste of 15gbs...

the single-player is beyond horrid.....plus EA games dont have LAN support so no multiplayer for us.

This is a waste. Dreadful....the single-player in MOH 2010 was more better.


WARNING...GAME IS SHIT!!!! GAME IS SHIT!!!!

repeat....waste of gbs...game is shit."
,partyhardy247,2012-10-27T02:49Z,"IGN review is up.  4/10 is what it is.  Bit harsh.

I loved BF3 single player and multi.  But this game is really disappointing. 

I give it 5.5/10.  "
,sacramentwolf,2012-10-27T06:39Z,"Download speed is bloody atrocious. ~50 kb/s (my avg torrenting speed is 2.1 mb/s). Favorite game is MoH 2010, so I'm looking forward to this!"
,the_audiophiles,2012-10-27T08:36Z," thanx extremezone for the upload, but, well i can't get decent sound outta this. :( It keeps dropping out the main SFX and just playing the vox? WTF can't even hear bullets some times, which makes the game unplayable. any one else having same issues???? "
,Jedi_Farseer,2012-10-27T08:51Z,"I still need seeders, please guys, thanks XD"
,pirate6662012,2012-10-27T09:07Z,"just finished the game, it was very nice"
,somefrom,2012-10-27T10:04Z,"the game keeps crashing when the terrorist blows up the train, the game runs fine up to that point. the screen goes black and freezes. task manager says the game is still running but it doesn't do anything. any ideas?"
,talkhtw5,2012-10-27T11:28Z,Please upload F.E.A.R 3!!!!!
,led_zeppelin_2009,2012-10-27T13:25Z,"The game works fine, however playing every few minutes the game freezes & stops. Any solution or should I wait a little longer for an improved crack. I believe it has nothing to do with the driver, heat, or even the game itself. Any suggestion or advice would be highly appreciated and acknowledged.
I would rate the game 7/10."
,Scyrthis,2012-10-27T14:53Z,"@partyhardy247

I disagree, i too would give the game a 4, if not a strong 3."
,runner92,2012-10-27T15:04Z,"@ram789 go read some reviews u muron,i thaught thats  what are comments 4, blody muron go read something..."
,savvy_148,2012-10-27T15:29Z,guys no any improvement in speed its still 2kbps...my max sped is 70kbps..!plz suggest me wa t to do..and those who have finished plz seeeeeed..!! thanx..!:)
,MaxRip,2012-10-27T15:43Z,it plays like BF3
,chups123,2012-10-27T16:23Z,seeds please i have 90.6 % and i have to wait 11h ;ccc
,ImGreekWowWow,2012-10-27T16:47Z,WOW so huge.15 GB is a huge package..
,PeleGamer,2012-10-27T18:56Z,"im in 90.7%!
ETA 22h...

ehhh fuck life is good"
,Mike_Disturbed,2012-10-27T19:42Z,"sssseeeeeeeeddddddd please...
semear por favor..."
,BrodcausT,2012-10-27T20:04Z,Does the multiplayer work?
,csgo4life,2012-10-27T20:15Z,"played it. shit campaign, awesome multiplayer"
,haveaquestion,2012-10-27T20:22Z,"!!!GAME HAS NO VIRUSES, the only problem is that it has a problem with the sound, it does a repeating sound every time someone makes a sound? About the windowed screen, go to options on the top left corner of the screen after you click the single mode button, and click on the graphics or video, and there should be an option windowed or full screen mode click on that and play the game it should fix itself, or restart the game. What is up with the sound?"
,NiklasLow,2012-10-27T22:00Z,"@haveaquestion 

Are you serious with the repeating sound shit? It's called ""realism"". If you are near a guy talking in the radio you hear him both normal and in the radio..DUHH"
,joffe1971,2012-10-27T22:09Z,can anyone play it in 3d?
,joffe1971,2012-10-27T22:20Z,can anyone play it in 3d?or is it just me who cant?
,iggyca,2012-10-27T22:26Z,"I have a little problem on this game, when i put this game on Max Settings (Ultra) i have error with drivers, soo what i need to do i need it for walkthrough on youtube."
,partyhardy247,2012-10-27T22:38Z,"@somefrome:  I had BLACK SCREEN after terrorists blow up the train. Next mission is some gay-ass car chase I think that's what is screwing up your system as it did to mine.

You have to play that mission, ""hot pursuit"" in Windowed mode.  Go to options and switch it from Fullscreen.  You can go back to Fullscreen after that mission again.  Just to let you know, game doesn't get any funner if you are hoping it would improve.  Piece of shit game.  What a waste of Frostbite2 engine.  Fuck"
,Shadow416,2012-10-28T00:45Z,this game got such terrible reviews lol...but ive pretty much played everything else i wanted to ill just give it a shot...
,biteme1011,2012-10-28T01:18Z,When I start the first mission where you jump from the plane with the boats my controls mess up. The only ones that work are the movement keys! I can't shoot or zoom or crouch or anything except move. Has anyone else had this problem? Any help or advice would be much appreciated. Thanks in advance.
,3ushP1G,2012-10-28T01:20Z,"This game is broken ive dled 2 different versions and same shoit  such a shame, tried different res tried windowed mode tried all patches/cracks to no avail. strange though first install got me to end of hot pursuit and now i cant get past the train/hotel domestic phone call cut scene."
,3ushP1G,2012-10-28T01:27Z,the controls dont work until u get to the jetty after u get sniped
,tony_hawk,2012-10-28T02:11Z,seed
,Doompy,2012-10-28T02:32Z,"Gonna stop seeding now. Uploaded 56.0 GB, you're welcome peeps!"
,DVS_Recon,2012-10-28T02:34Z,"I'm having trouble starting, I've done what it says and when i start it, and it doesn't start. It goes to the ""windows is looking for a solution for this problem"" as soon as i start it up, I installed the game from FLT folder then auto copy and also manually pasted and when i try to start it, it wont start. Please help. "
,0GamesLover0,2012-10-28T07:27Z,"Plzzzzzzzzzzzzzzzzzzz........
Seeeeeeeeeeeeeeeed........"
,haveaquestion,2012-10-28T08:23Z,"!!!lol!!! No I ment to say there is a glitch in the game, and the glitch being the sound, like hi-hi, shoot-shoot, in-in, the-the, head-head. Any ideas?"
,f422el,2012-10-28T09:16Z,"I've been givin ya'll 1 Mbps for almost a week while I got 10 Kbp/s, would ya help me back?"
,coolpayerz,2012-10-28T09:41Z,"@paleos1
That's strange... if you're getting errors, try download the fix shared yesterday
sendspacｅ.ｃom/file/8fly49"
,xlemuelx,2012-10-28T09:53Z,"too many leechers, speed's not too good right now. Should be fine in a week"
,geek.maan,2012-10-28T10:14Z,Respect... Working perfectly on Windows 7 (x64). Seeding @ 8Mbps till share ratio gets 1.00 :D Happy Downloading m/
,sihenk,2012-10-28T11:55Z,"Medal of Honor Warfighter still cant play mission 4 keep black screen / error crash after cut scene ending of mission 3 / begiining mission 4

For any one finished all single player mission please give me advice to play it..
0. what patch and crack u use?
1. did u play with internet connection or turn off the internet in ur PC?
2. did u instal origin?
3. did u use lastest vga driver?
4. what windows u use?

pls answer my question"
,Slavke,2012-10-28T12:11Z,To all people that crash at breaching: DONT GO FOR HEADSHOTS! JUST GO FOR PLAIN KILLS! Getting headshots while breaching will crash your game after breach sequence
,cushoo,2012-10-28T12:58Z,"~~ * ~~ HELP ~~ * ~~

I'm having trouble starting, I've done what it says and when i start it, and it doesn't start. It goes to the ""windows is looking for a solution for this problem"" as soon as i start it up, I installed the game from FLT folder then auto copy and also manually pasted and when i try to start it, it wont start. Please help.

~~ * ~~ HELP ~~ * ~~"
,iggyca,2012-10-28T13:33Z,Thank you extremezone game works perfect and I just finish the game yesterday People you can watch Medal of Honor: Walkthrough on my channel i really apriciate that. 19iggy94 is my Nick type it.
,raiannub,2012-10-28T13:39Z,aqui não ficou muito bom em um Pentium Dual-Core e5800!!
,andersontan88,2012-10-28T14:27Z,"on the mission ""shore leave"" i can move but i can't shoot nor crouch

same problem with 

http://answers.ea.com/t5/Medal-of-Honor-Warfighter/Mission-Shore-Leave-can-move-but-cant-crouch-or-shoot/td-p/143914"
,laufer,2012-10-28T15:38Z,Guys how to fix this strange audio stutering???
,lukacthebest,2012-10-28T16:36Z,"OK now i discovered it's not a virus it's the fucking AVG so every time now i start the fairlight instaler in PowerISO it says: ""access denied"" any help? i will appreciate some help tnx."
,trabka6626,2012-10-28T17:12Z,seeeeeeeed 
,tungdp1992,2012-10-28T17:43Z,"Dl in 22 hours at 199 kb/s. Seeded 30.45 gb for 10 hours. Has never put a limit on the seed. Will continue seeded at night for the next few weeks. 

My way of saying Thanks!"
,tungdp1992,2012-10-28T17:46Z,"Dl in 22 hours at 199 kb/s. Seeded 30.45 gb for 10 hours at 277 kb/s average. Has never put a limit on the seed. Will continue seeded at night for the next few weeks. 

My way of saying Thanks!"
,getslayer,2012-10-28T18:02Z,this game is broken every now and then the game freeze for no reason EVEN PEOPLE WHO BOUGHT THE DAMN GAME FULL PRICE the game always crash its not the crack ITS THE DAMN GAME just wait for a patch this is just fucking ridiculous I can't believe I used to play MOH and for those who say the game is fine it can be but it can freeze anytime too. Also there's many sound glitch some people can't even go further the training mission AWESOME GAME 15 gb for this piece of shit is just WRONG 
,led_zeppelin_2009,2012-10-28T18:37Z,"@ getslayer - your information is through and informative. thank you so much, it helped us a lot esp. who has been facing freezing & sound problems. Please if or when you find a patch do provide the link.

At present condition since the game every now and then freezes and problem with sound issues, can they be solved alternatively

SLAYER RULEZZZZZZZZZZ ! Raining Blood"
,kuropatwa,2012-10-28T18:44Z,"Hi. Could someone tell me how to install this? There is bunch of files, but there is no file to mount by deamon tool. I have only some folders like _Installer; Core etc and filers Luncher.exe; MOHW.exe etc. What I supposed to do with them?! Thx for advice!"
,mrmouth,2012-10-28T20:27Z,"Im at 50% and getting 1.5kb/s. Are you fucking kidding me with this torrent? Seed, babydicks."
,Gary92,2012-10-28T20:33Z,"hello, thanks the upload, i start a launcher and launcher said cant accses internet blah blah, but you can play while not conected battlelog and i press launch game and then stopped working"
,lukacthebest,2012-10-28T21:13Z,"OK now i discovered it's not a virus it's the fucking AVG so every time now i start the fairlight instaler in PowerISO it says: ""access denied"" any help? i will appreciate some help tnx.

X2"
,JoaoPauloBR,2012-10-28T21:15Z,Seed you greedy fucks
,BetaPwn,2012-10-28T21:27Z,"Nice download speed 
: http://www.postimg.com/image/89000/mhwf-88604.jpg"
,tony_hawk,2012-10-28T22:34Z,seeed
,murderblur,2012-10-29T06:04Z,SEED PLEASE!!!!!!!
,murderblur,2012-10-29T06:04Z,seed pleaseee
,simonking1122,2012-10-29T07:12Z,Wow this torrent is so gready to bad there is no better 1s. i dont understand thoe is even if every capped there up speed at 1kb its still should be 3000 down but its not im downing at 200 and thats all from 1 person in New Jersey every1 else is at 10kb and under
,LNAV737,2012-10-29T09:56Z,It does work ....i find battlefield much better...yet not bad 
,stepxen,2012-10-29T11:30Z,SEED PLEASE :( ITS SO SLOW 
,marvin0408,2012-10-29T11:52Z,SEED! plz..
,Nima13,2012-10-29T12:57Z,I can not play.I t seems that origin wants an activation code which i don't have.The launcher transfers me to origin neither the crack helps.So anyone anywhere out there can help me?
,spiderforpc,2012-10-29T13:02Z,i test it its working win7sp1 x64 and dont need origin also if internet open or close in ur PC its work 
,neo-benedict,2012-10-29T13:53Z,"Seeded:
http://i.imgur.com/wAeXP.png

Going to stop now."
,spanish_ruler,2012-10-29T15:05Z,"This game sucks ass... i cant get pass mission 8 (finding faraz), the window turns black and nothing happens. it crashes all the time, eithe ri run it with origin or not, admin or not. xp or win7 compatibility... nothing helps. idk how u guys got passed the mission 8, but its not working for me, no matter what i do. so disappointed... damn it "
,mxplusb,2012-10-29T15:33Z,we really do need seeders...
,ChillyCrossFoot,2012-10-29T15:57Z,"What a SPECTACULAR Turd from Electronic Farts! Bug ridden Mess! Why must Video games SUCK so much? As for the Single Player...what a JOKE. It's like a movie that wouldn't even come out on Audio Tape if they wanted to. Even a Pirate wouldn't stock this. Too many gigabytes of JUNK. The main character looks like a crying Sissy Boy. His MILF wife looks 20 years older than him, and man does he have the Ugliest daughter I have EVER seen. Disgusting.. Same on Electronic Farts. They want to DRM this stuff, go ahead...no one wants crap games anyway."
,CrankyAVM,2012-10-29T16:26Z,^this guy
,lopiky1,2012-10-29T16:36Z,"Nima13, you have to play on a cracked server to play online and just delete origin"
,Nima13,2012-10-29T19:41Z,"@lopiky1 I don't want to play online,i really do not mind.My only problem is,the launcher which  drives me to origin fon authentication of the game and asks for code.If i delete origin from my pc i may play?"
,gunner4ever,2012-10-29T21:06Z,"Working great. Thx extremezone for uploading i'll keep seeding, + from me."
,gasjunkie,2012-10-29T23:53Z,"First off thank you extremezone for an awesome game, and of course to TPB for without whom none of this would be possible. But when I got to mission 3 Hot Pursuit I found that the camera is stuck looking to the right, I can look left and see 1/4 of the windscreen but not enough to make it through the tight winding alleyways that the target weaves through. I was hoping somebody might have experienced this themselves and had found a way to overcome the issue. Thanks in advance for any and all help and concern. - gasjunkie"
,SOAD619,2012-10-30T00:11Z,I did all that for win XP but doesnt launch to the game.Any solution????plzz
,Tequinss,2012-10-30T01:14Z,q
,NoFatChx,2012-10-30T05:16Z,Game works great. Auto crack and patch is awesome. Been playing an hour so far without any problems.
,rolclage7,2012-10-30T06:03Z,Game Crashes in the beginning of level 8..Any solution ??
,sammuchwano,2012-10-30T06:08Z,hey neo-benedict i don't think you'll see this but could you tell me how you got your upload rate so high. my connection is only good for 12mb upload speed but i can only get around 500kb if i'm lucky. think you can email me and tell me how you got yours to upload so fast. i try seeding much as i can for the next person but i don't think 500kb is really cutting it. even if i do it for hours sam_zeplin@hotmail.com drop me an email if you can and tell me how you did it please :). and as far as commenting i can't even download this right now to many leechers
,savvy_148,2012-10-30T07:47Z,people plzzzzzzzzzzzz seeeeeeeeed....i have downloaded 4GB and uploaded 10 GB..!!cumon..seeddd..!!
,CrysisHawk,2012-10-30T10:00Z,Guys plz SEED :(  Damn it when it'll be downloaded....
,mrmouth,2012-10-30T11:58Z,"Black screen freezing has to do with the game creating processes with a DLL. If you have a good firewall with active defense, like Comodo, it will block that, game will freeze and you reboot without knowing it was the firewall blocking a process. So go into windowed game mode before the area where you experience that freeze and allow it in your firewall when it happens again."
,rolclage7,2012-10-30T12:32Z,Game Crashes in the beginning of level 8 with Directx error Ran out of memory :(((
,mkgoel,2012-10-30T13:14Z,User interface is not showed up properly on ma pc....can't even see the controls.....any help??
,pluto_1973,2012-10-30T13:25Z,"Game is a joke ... it's really bad! regret that I bought it.
IGN's review was BAD
Last moh was better than this crap ...! keep playing BF3 or Bad company instead!"
,SOAD619,2012-10-30T13:26Z,I did all that for win XP but doesnt launch to the game.Any solution???? 
,Thejax10,2012-10-30T13:48Z,"Does it have Mutiplayer mode. Or u have to download sepreatly. if yes, where?"
,musahala,2012-10-30T14:39Z,"My game gets crashed after the TRAIN BLAST CUTSCENE , I AM EVEN running on Window mode and my ORIGIN is also open , Have updated and RE-CRACKED da GAME . Still dosent works . SOLUTIONS??"
,lacrossewacker,2012-10-30T17:36Z,"My game crashes too after the train explosion cutscene.  Cuts out and goes to ""origin uploading"""
,trixyguy,2012-10-30T17:56Z,"Ok GUYS!!

FIRST copy your saved game folder from my documents, and save the folder somewere else.

Delete the whole Medal of Honor map, and reinstall using the FIRELIGHT INSTALLER!!!
( RUN IN ADMIN MODE! ) 

When installation is finish, choose no to copy crack, and no to libary!

Then copy the Update folders and files to install directori.

Copy the new crack to same directori.
Then i startet the FAIRLIGHT installer from crack fairlight folder, that i just copied from the crack folder.
Just hit no to find files, no to libary.

Then just run the game in admin mode and start from last save in ""WINDOW MODE"" then it works :D  You can exit window mode after next cutscene that used to crash : D : D"
,trixyguy,2012-10-30T17:58Z,"You have to start the game one time and exit!!!
Then copy your saved game folders back to my documents and start the game :D 

( When i said delete medal of honor map. I did mean Folder :)"
,Born Again,2012-10-30T20:44Z,"This crack for those who crash after the first sniper mission. You have to restart the missions though

Google this: Medal.of.Honor.Warfighter.v1.0.0.2.Crack.Only.v3.0"
,Yorgal,2012-10-30T21:00Z,"I dl the game but i have on two .rar in fairlight and i cant dezip , so i have no crack , someone can help?"
,trixyguy,2012-10-30T21:47Z,"@Yorgal 

Hey Yorgal

First use deamon tools, and mount MOHW cd A:
Then run the FAIRLIGHT INSTALLER from the disc!

After 50% unmount cd A:, and monut cd B:

Let the install finish, and select NO to install crack, and libary files!!!!

Then copy the Patch files to your install directory.
Then copy the FLT crack only crack to install directory!

Then just lauch the game, and run it in window mode each time it crashes, and you arw able to countinue :D:D:D:D:D!!!! work fore me guyes! i just finish the whole game on S.P  AAAAAAWSOOOMEE ^^"
,trixyguy,2012-10-30T21:48Z,"@Yorgal 

Hey Yorgal

First use deamon tools, and mount MOHW cd A:
Then run the FAIRLIGHT INSTALLER from the disc!

After 50% unmount cd A:, and monut cd B:

Let the install finish, and select NO to install crack, and libary files!!!!

Then copy the Patch files to your install directory.
Then copy the FLT crack only crack to install directory!

Then just lauch the game, and run it in window mode each time it crashes, and you arw able to countinue :D:D:D:D:D!!!! work fore me guyes! i just finish the whole game on S.P  AAAAAAWSOOOMEE ^^"
,trixyguy,2012-10-30T21:51Z,"Hey Yorgal

First use deamon tools, and mount MOHW cd A:
Then run the FAIRLIGHT INSTALLER from the disc!

After 50% unmount cd A:, and monut cd B:

Let the install finish, and select NO to install crack, and libary files!!!!

Then copy the Patch files to your install directory.
Then copy the FLT crack only crack to install directory!

Then just lauch the game, and run it in window mode each time it crashes, and you arw able to countinue :D:D:D:D:D!!!! work fore me guyes! i just finish the whole game on S.P  AAAAAAWSOOOMEE ^^"
,Yorgal,2012-10-30T22:01Z,I did but i cant unzip it send to me an error message (sorry for my english)
,Ouazaaza,2012-10-30T22:32Z,"Thx for the game, but one question, does the multiplayer work and if yes, how ? :)"
,Ouazaaza,2012-10-30T22:37Z,"Thx for the game, but one question, does the multiplayer work and if yes, how ? :) "
,SOAD619,2012-10-30T23:00Z,I did all that for win XP but doesnt launch to the game.Any solution???? Plzzzzz
,kiangandude,2012-10-30T23:28Z,"lol game suck... 
IGN rating: 4
"
,9a3cmc,2012-10-30T23:49Z,reading the comments I didnt notice anyone having the same problem as me...for me the game crashes after not even 5 min of playing...it starts to lag until it completely freezes...so...if anybody knows how to fix that youre free to share your knowledge
,Kalitzi,2012-10-31T00:02Z,Anyone else getting blackscreen after the car chase mission?
,emulept,2012-10-31T00:48Z,"Hello
I did the installation as you explain. 
I launch the game and get the msg
Authentication failed, please login to Origin again
Below indicates;
You can still play while not connected to Battlelog, I click on launch game.
The window closes and nothing happens
I block in the firewall the launcher.exe and get msg.
Could not connect to Battlelog
Below indicates;
You can still play while not connected to Battlelog, I click on launch game.
The window closes and nothing happens
I run Win7 64
Can someone help

Thank you"
,FieroGT,2012-10-31T01:14Z,"anyone get past the ending of hello and dubai? after u get hit with that suv ?i keep getting a crash there... had the same prob after the 1st chase, but a new crack fixed that one. "
,djokaaa,2012-10-31T02:56Z,Problem Dubai mission in  tunnel game crashes!help
,Yorgal,2012-10-31T02:56Z,"Exactly the same prob as  emulept , the crack dont work"
,ChillyCrossFoot,2012-10-31T03:09Z,"This game crashes like a solid turd from the 3rd Floor to the Basement toilet. Maybe my last comment was removed for whatever reason but this game just plain sucks. It's buggy, and pisses off people who didn't even buy it. The first one was better than this junk. Save your time and skip it."
,ofest,2012-10-31T03:31Z,after the mission of drive the fu.. game crash..black screen........BETTER WAIT FOR A IMPROVE TORRENT (FROM EXTREMEZONE OF COURSE)
,SynysterJACK11,2012-10-31T06:34Z,"I haven't had any crashing problems at all and running this game fine around 45-39 fps

Amd FX-6100 3.3ghz
8gb Vengance DDr3
XFX HD 4890"
,SynysterJACK11,2012-10-31T06:36Z,Has anyone been able to get the Multiplayer to work? If so please let me know. Would love to try it before I buy the game.
,xslink,2012-10-31T08:24Z,"@Synyster Just buy it if you want Multiplayer. In torrents you cannot play multiplayer. Thank you for the torrent, EZ!"
,rkompatzki,2012-10-31T23:35Z,"same prolem as emulept! I get the launcher, but It wont start "
,sirqlar,2012-11-01T05:33Z,download speed too low. PLEASE PLEASE SEED
,Waterson,2012-11-01T05:46Z,Installation problem: 2nd DVD unmounts automatically after 50% installation. Was it a download error?. Downloading again now!!
,yogesh_gamer,2012-11-01T07:08Z,"I can't play. using windows 8 32 bit.
plzzzzzzzz help"
,hortonofdoom,2012-11-01T07:39Z,"Major issues with running it smoothly, game crashes etc. Shitty game, thanks for UL"
,askraj007,2012-11-01T08:29Z,"after 2 hours i play this then game crash why 
he say check you graphic card are properly install 
in you pc 
any one plz solve  my problem  "
,askraj007,2012-11-01T10:59Z,finding firaz crash
,OGTMS,2012-11-01T12:55Z,where can i find a working cd key for origin !!!??? please answer me !!!
,nakedguy,2012-11-01T15:42Z,OGTMS you are a real retard you know that? You can't get a working cd-key without buying the game. 
,ultamanl,2012-11-01T16:43Z,it works! thnx uploader
,Devil_jinn,2012-11-01T17:00Z,"Seeeeeed...

Come...on...

Guyz....

Too...Slow...

Seeeeeed...."
,djokaaa,2012-11-01T17:37Z,I ended up playing a good campaign! Perhaps the medal of honor 2010 campaign better! If you play in some places game crashes or whatever just lower the resolution and graphics medium or low!Bye-bye
,sekidevil,2012-11-01T18:02Z,What and where is Pach files plzzzzzz
,OGTMS,2012-11-01T19:12Z,"nakedguy YOU are the retard,i just asked a question..so please speak properly the next time...and then if i download the torrent how can i play it if i havent a key code ?"
