User Type,Username,Date,Text
[V],globeplus,2012-03-21T11:41Z,"Hi and this is the file report :

It is not kidding that i started with a cso image with close 800 mb but after a closer look on the iso detected that more games systems was included on the iso and really probably that none of them was possible to play only maybe the PSP emulators for other games systems but no special point on that , still the same game with small differences that can be played in other games systems , so leave on the iso only the PSP it was what maked sense because this is a PSP game file ... after a little correct work on the audio with the available movies not touched and after the 7zip compression the final size of the game file for download dropped at this amazing somehow 90 mb ... 

Happy PSP version to all of you for this game ..."
[V],globeplus,2012-03-21T11:42Z,"Hi and download and unzip my JpCsp STARTER.exe , a perfect executable to launch the emulator without the console window , don´t remove the bat , just put this worked executable on the emulator folder and run the emulator from this executable and it will be just the emulator going in a nice way ...

JPCSP STARTER.exe (24.7 kb) :


http://www.file
serve.com/file/cuSxgxx/Jpcsp STARTER.exe.7z

(COPY IN SUCCESSION WITH THE LEFT MOUSE CLICK THE LINK TO THE ADDRESS BAR)

HAPPY GAME TO ALL OF YOU ..."
,justincredible81,2012-04-13T04:43Z,Does this work on the system or only for emulators? 
,justincredible81,2012-04-13T06:25Z,"When I try this in jpcsp and I chose video only ge graphics then run it it shows Konami screen but then its static and it says ""this is a faked mpeg video"""
