User Type,Username,Date,Text
,sup1990,2012-06-01T18:40Z,Thanks! :)
,marcman951,2012-06-02T00:21Z,Thank you! I was wondering when this would be released online. :D
[T],MrUnpopular,2012-06-02T01:06Z,You're welcome. sorry for the wait.
,tr4shw,2012-06-15T07:11Z,Thank you so much for capping this! I was losing hope that it would be capped at all. And also thanks for sticking around for the credits for Toby Turner's dance! I really hope you continue to cap these. I will be downloading every single one.
,Vivic911,2012-06-19T00:39Z,Thank you so much!
