User Type,Username,Date,Text
,Solocid,2012-08-11T20:24Z,Guys anyone... is this Legit?
,Marcosmgt,2012-08-13T02:09Z,Seed please :D
,bish33,2012-08-16T20:28Z,this game is for psx2 or not ????????
,MagikMann,2012-08-20T12:30Z,"psx2...really? Bro, its an ISO, just mount it with power ISO, Daemon Tools, etc and Install. Ill let you know If its good when I play it :)"
,bish33,2012-08-24T07:29Z,to fuckin mother crappy liar MagikMann
,PoPhIgHExtreme,2012-08-30T16:59Z,is this game really for pc or for ps2?
,bish33,2012-08-31T09:46Z,THIS IS FOR PCSX2 PoPhIgHExtreme 
