Filename,Size,Unit
Cherry Bomb (2011) PAL DVDR DD5.1+LPCM2.0 NL Subs-NLU002/Cherry Bomb (2011) PAL DVDR DD5.1+LPCM2.0 NL Subs-NLU002.iso,4.32,G
Cherry Bomb (2011) PAL DVDR DD5.1+LPCM2.0 NL Subs-NLU002.nfo,567,B
Torrent downloaded from AanMeHoelaJa Torrents on BTScene.eu.txt,71,B
Torrent downloaded from AhaShare.com.txt,58,B
Torrent Downloaded From BTScene.eu.txt,45,B
Torrent downloaded from Demonoid.me.txt,46,B
Torrent Downloaded From ExtraTorrent.com.txt,353,B
Torrent downloaded from KAT.ph.txt   ,41,B
Torrent Downloaded from limetorrent.txt,50,B
Torrent downloaded from Rarbg.com.txt,33,B
Torrent downloaded from silvertorrent.org.txt,54,B
Torrent downloaded from thepiratebay.se.txt,50,B
tracked_by_h33t_com.txt,23,B
