Filename,Size,Unit
tom and jerry robin hood and his merry mouse 2012 1080p multisubs/tom and jerry robin hood and his merry mouse 2012 1080p multisubs.mkv,2.91,G
tom and jerry robin hood and his merry mouse 2012 1080p multisubs.nfo,2.43,K
Torrent downloaded from AanMeHoelaJa Torrents on BTScene.eu.txt,71,B
Torrent downloaded from AhaShare.com.txt,58,B
Torrent Downloaded From BTScene.eu.txt,45,B
Torrent Downloaded From ExtraTorrent.com.txt,353,B
Torrent downloaded from KAT.ph.txt,41,B
Torrent Downloaded from limetorrent.txt,50,B
Torrent downloaded from Rarbg.com.txt,33,B
Torrent downloaded from silvertorrent.org.txt,86,B
Torrent downloaded from thepiratebay.se.txt,50,B
tracked_by_h33t_com.txt,23,B
