User Type,Username,Date,Text
,snehit,2012-09-26T15:00Z,Hy Phantom thanks for uploaing my request ther is one more request brother....from long time me n my friend searchin Pushpak kamal hasan silent film if possible to u plzzz upload ...thanks in advance
[T],zyx55e,2012-09-26T15:32Z,"Hey snehit bro, Pushpak is avlble on tpb here with 9 seeders:

http://thepiratebay.se/torrent/5047120/Pushpak.1988.DVDRip.x264.AAC.mkv"
,snehit,2012-09-26T17:55Z,Hy Phantom thanks for uploaing my request ther is one more request brother....from long time me n my friend searchin Pushpak kamal hasan silent film which u upload in Desibbrg upload here brother if possible to u plzzz upload ...thanks in advance
[T],zyx55e,2012-09-27T04:18Z,"@snehit bro. I dont hv the copy of Pushpak which I hv U/L on desibbrg, in my HDD anymore.

There are many torrents of Pushpak on tpb. U can D/L from here. The tamil version is the best rip. Take it."
,anahad,2012-09-27T13:18Z,"@snehit 

best print for pushpak is here, just google it...

Pushpak.1988.DVDRip.x264.AAC -=[101]=-

"
