User Type,Username,Date,Text
,yrkeschaffis,2012-06-09T23:20Z,thanks much appreaciated
,Jaydagod,2012-06-11T22:18Z,downloading now..will comment upon install
,Jaydagod,2012-06-11T22:55Z,works like a BOSS! thank you
,doctorj2012,2012-06-22T01:06Z,"After installing for After Effects I downloaded the Avid Media Composer version from the website. It asks if you want to keep your existing registration details, and seems to work without having to run the crack again."
,doctorj2012,2012-06-22T03:13Z,"Sorry, not registration, I mean use existing licence when prompted. If you download Avid version off Boris site, I didn't use their trial serial number either. thanks psydeepm much appreciated"
