User Type,Username,Date,Text
[V],maximersk,2012-03-10T20:32Z,"Justin Bieber, seriously !
Who likes this little kid ? LOL & LMFAO"
[T],stumpie1971,2012-03-10T20:50Z,lol iknow i cant stand him either but kids love him lol :) 
[V],maximersk,2012-03-10T21:21Z,You don't upload your torrents on Kick ass torrent ! That's weird !
[T],stumpie1971,2012-03-10T22:01Z,My Torrents go directly too kat m8 i dont know how but they do lol
[V],maximersk,2012-03-11T00:28Z,"I know, you make your name in the file name !
But I prefer when I upload myself on KAT ! Anyway, I have many friend in KAT ! I want to have a skull green because I like green... LOL Pink is for girls... I'm not a girl ! Damn !"
[T],stumpie1971,2012-03-11T00:46Z,"lol me niether ha ha , iv just uploaded some torrents today because it wouldnt let me b4 :( .... iv uploaded a film and some music so does that mean ill get more seeders and that lol "
