User Type,Username,Date,Text
,lillbas19,2012-02-06T16:45Z,"PLEASE HELP TO SEED "" The Complete Motown Singles 10,11,12,13,15,19,28,30,31,32,35,42,43,44,45,46,47,48,49,50,51,52,53,54,55,56,57,58,59,60,61,62,63,64,65....
There are noone who seeding these"
[T],Monserik,2012-02-11T19:07Z,"Please seed, everyone"
,Tallalone,2012-02-11T22:05Z,Please SEED !!!!!!!!!!!!!!!!!
,Tallalone,2012-03-19T13:37Z,Boxerkoning where are the seeders
,Bobaloo123,2012-03-25T21:34Z,"Thank you Boxerkoning. The 320 is especially appreciated. Please seed, people. Half of this series is incomplete. Please don't let Boxerkoning's hard work and willingness to share go to waste. "
