User Type,Username,Date,Text
,makasif,2012-09-09T19:02Z,"hey bobiras i have downloaded the non rooted apk of amazing spiderman and also the sd data of these game after installing the apk and putting the data in android/obb when i launched the game with internet connection it started and worked but after closing the game when i launched the game second time without internet connection it doesn't starts  it asks for internet connection . so pls tell me what to do 
that i have to launch the game always with intenet connection on .plz help me"
,makasif,2012-09-09T19:06Z,hey bobiras i have also downloaded call of duty black ops zombie this game is also not working . what to do to run this game
,jadetmp,2012-09-10T08:35Z,Thanks for the upload man! I'll seed it downloads
[T],bobiras2009,2012-09-10T08:48Z,"@makasif

Amazing spiderman need lucky patcher to work without internet.The call of duty zombies also need lucky patcher.You can play without lucky patcher the old version 1 from COD zombies"
,makasif,2012-09-10T17:48Z,in the old verion of cod this new version data will work or i have download the old one.
