User Type,Username,Date,Text
,don_Haffz,2012-11-23T02:52Z,does it work?
,don_Haffz,2012-11-23T14:11Z,"it does not work for me, i press play on episode 5, the screen goes black and nothing happens..."
,jefry235,2012-11-23T17:41Z,i have the same problem as don_haffz im running lion and ive got all the other games to work .. i tried downloading the pc walking dead 105 and putting it in your old walking dead 104 package but the screen just stays black when i click play
,don_Haffz,2012-11-23T19:03Z,im running Mountain Lion and every other episode works
[V],skepticink,2012-11-23T20:44Z,"It seems a few people are having this issue, with the paid version >
http://www.telltalegames.com/forums/showthread.php?p=729973

It *may* be a save game issue which *may* be fixed by erasing or removing the previous save file and accepting the random progress you are left with :-

I'll keep an eye open for any cure that comes along."
,jefry235,2012-11-23T21:22Z,ooo i see yeah i tried using a new game but same thing but thanks for the info if i find something ill post update
