Filename,Size,Unit
INFO TBS/Black-Sam.txt,128,B
INFO TBS/De Bende van Oss (2011) MP4 (nl audio) Retail TBS.txt,1.8,K
INFO TBS/Read.Me.1st.[Movie-Torrentz].txt,2.02,K
INFO TBS/Torrent Downloaded from deemtrack.in.txt,657,B
INFO TBS/Torrent downloaded from Demonoid.me.txt,659,B
INFO TBS/Torrent Downloaded from SilverTorrents.me.txt,175,B
INFO TBS/Torrent_downloaded_from_AhaShare.com.txt,272,B
INFO TBS/Torrent_downloaded_from_Demonoid.com.txt,262,B
INFO TBS/Tracked by H33T.txt,632,B
INFO TBS/www.black-Sam org     Kom eens Langs !.jpg,13.1,K
MOVIE/De Bende van Oss (2011)Psp(PS3) NL.mp4,364.39,M
