Filename,Size,Unit
2012-03-24_13-17-18.AVI,54.65,M
Free sex video of Sleeping girl fucked by stranger.AVI,14.23,M
Fucking a sleeping girl - Sleep Surprise.flv.AVI,10.52,M
Fucking a sleeping girl.AVI,1.47,M
Sleeping teen sweetie getting touched - Ivana Fukalot.flv.AVI,1.71,M
"Sleeping with a sleeping girl  Redtube Free Teens Porn Videos, Movies  Clips (1).flv.AVI",1.1,M
"Sleeping with a sleeping girl  Redtube Free Teens Porn Videos,.AVI",1.99,M
Sweet girl gets fucked in her sleep  Naked Girls.flv.AVI,60.04,M
