Filename,Size,Unit
Coldplay - Live (2012) BR2DVD PAL DD5.1 Request/Coldplay - Live (2012) BR2DVD PAL DD5.1 Request.iso,4.34,G
Coldplay - Live (2012) BR2DVD PAL DD5.1 Request.nfo,798,B
Torrent downloaded from AanMeHoelaJa Torrents on BTScene.eu.txt,71,B
Torrent downloaded from AhaShare.com.txt,58,B
Torrent Downloaded From BTScene.eu.txt,45,B
Torrent Downloaded From ExtraTorrent.com.txt,353,B
Torrent downloaded from KAT.ph.txt,41,B
Torrent Downloaded from limetorrent.txt,50,B
Torrent downloaded from Rarbg.com.txt,33,B
Torrent downloaded from silvertorrent.org.txt,86,B
Torrent downloaded from thepiratebay.se.txt,50,B
tracked_by_h33t_com.txt,23,B
