User Type,Username,Date,Text
,naumi,2012-02-28T19:25Z,Iam Angry if u not say me Thanx
,aceman2010,2012-02-28T20:15Z,Thanx
,karan1234,2012-03-01T14:32Z,thnks naumi and again is this working on 3.55?
,naumi,2012-03-01T15:48Z,"Yes it Work on PS3 3.55 KMEAW ON INTERNAL HDD.../////

Dont Think Negative ......."
,naumi,2012-03-12T18:48Z,plz guys continue seeding for Downloader Dont Remove it file from ur torrent client...../////
,QuickShark,2012-09-07T18:48Z,"PS3 CFW 3.55 with true blue dongle, internal HDD and multiman. Black screen! :("
