Filename,Size,Unit
Secrets of the Tobacco Industry.mp4,793.46,M
Doctors Of Death.avi,330.63,M
And More/The Holy Spirit/Why You CAN Lose Your Salvation - YouTube.mp4,288.94,M
Dave Emory interviews Ed Haslam about Dr Marys Monkey 8-10-08.flv,185.1,M
Harvest of Despair Silent Genocide of 10 Million Christians in 1932.flv,166.32,M
And More/The Holy Spirit/One Sonic Society The Greatness of Our God - Fisher of Men.mp4,162.68,M
And More/Martyrs of Today/Socialist persecution of Christians - Survivors Speak Out.avi,80.95,M
And More/SIN-ister Clips/The Jones Plantation - A Story Illustrating Just How Free YOU Really Are.flv,78.68,M
And More/Martyrs of Today/Kitman TV  Hammadi Killings - Persecution of Coptic Christians.flv,77.17,M
And More/The Holy Spirit/True Love-Phil Wickham with Matt Chandler  CJ Mahaney - YouTube.mp4,74.24,M
And More/The Holy Spirit/I BELONG TO JESUS - YouTube.mp4,72.59,M
600 Volumes - POtHS Torrents seeded 7-4-2012.rar,69.71,M
And More/The Holy Spirit/Hillsong - Cornerstone featuring David Ware.mp4,61.88,M
And More/Signs of the Times/I saw rebels beheading men for religion - Syrian cleric.flv,61.42,M
And More/The Holy Spirit/Status Compromise Christianity - YouTube.flv,51.12,M
And More/The Holy Spirit/Signs of war and rumors of war - YouTube.flv,47.79,M
And More/Signs of the Times/Important - Its One Minute To Midnight  The Super EMP - NAM Agreement w N Korea.flv,43.4,M
And More/SIN-ister Clips/Origins Of Labor Day   Something That Should Be Taught 9-3-12.flv,42.3,M
And More/War and Rumors of Wars/We want Syria   Iran  US in-your-face revolution plans.flv,41.15,M
And More/SIN-ister Clips/World's Richest Woman Calls For Australian Workers To Be Paid $2 A Day -has reptilian eyes.flv,35.86,M
And More/SIN-ister Clips/Out of Options  Obama a failure Republicans not an alternative.flv,33.52,M
Shorts/Debunked  Organic Food Study Promoted By Lying Mainstream Media.flv,33.11,M
And More/Signs of the Times/Debunked  Organic Food Study Promoted By Lying Mainstream Media.flv,33.11,M
Shorts/Monsanto provoked the creation of super-worms.flv,32.74,M
And More/War and Rumors of Wars/Seattle Mayor Uses Emergency Powers Expands Police Powers.flv,32.27,M
And More/Signs of the Times/Divine Warnings Against Homosexuality - Divine Lightning Strikes Fires to Gay Capital of World.flv,31.37,M
And More/SIN-ister Clips/Obama - The DNC errupts in boos as God and Jerusalem are put back into the Platform 9-5-12.flv,30.48,M
Shorts/California Right to Know - GMO Labeling.flv,28.38,M
Shorts/Cutting Freedoms  Muslims Jews unite against German circumcision ban.flv,27.28,M
And More/The Holy Spirit/Lifesong - Casting Crowns  - YouTube.flv,27.25,M
Shorts/Audit of the Federal Reserve Reveals $16 Trillion in Secret Bailouts 9-3-12.flv,26.59,M
And More/Signs of the Times/Audit of the Federal Reserve Reveals $16 Trillion in Secret Bailouts 9-3-12.flv,26.59,M
And More/SIN-ister Clips/Obama's Change  Killing without trial spying without warrant.flv,24.69,M
And More/Signs of the Times/Dick Durbin Responds Defensively After DNC Drops God - Jerusalem From Party Platform.flv,22.41,M
And More/The Holy Spirit/INDESCRIBABLE  by Chris Tomlin.flv,22.14,M
Shorts/Something Going On Here With The West Nile Spraying.flv,21.92,M
And More/Signs of the Times/CNN International ignores Bahrain bloodshed.flv,21.91,M
Shorts/Chemical Barrels  Underwater threat may devastate Black Sea.flv,18.14,M
And More/SIN-ister Clips/They Knew For A Long Time  Just What Are Iran Planes Flying into Syria Thru Iraq.flv,17.26,M
And More/SIN-ister Clips/Oil Prices Rise From World Bank Buy Bad Bonds of Spain and Italy 9-6-12.flv,17.24,M
Shorts/The Killing Code - Epigenetics How behavior changes DNA - Dr Darlene Russell.flv,16.37,M
And More/SIN-ister Clips/Obama and DNC strikes down Jerusalem as Israels Capital 9-5-12.flv,14.9,M
"Shorts/Indiana Swine Flu Cases Increase 10-Fold, Hits 113 9-2-12.flv",14.67,M
Shorts/Cartoonist Jailed For Sedition Faces Life In Prison.flv,14.25,M
And More/War and Rumors of Wars/Breaking Furious Turkey mobilizes tanks troops to Syrian border.flv,13.43,M
"And More/War and Rumors of Wars/Israel Protests  Over 250,000 join biggest anti-govt rally in Tel Aviv - YouTube.flv",13.16,M
And More/The Holy Spirit/Should Christians say OMG or JC  - YouTube.flv,13.05,M
And More/SIN-ister Clips/Obama Jerusalem will be decided in Final Status Agreement in the near future 9-05-12.flv,12.63,M
And More/Signs of the Times/Important  Their Not Just Spraying for West Nile Virus in TX but Dengue Fever Outbreak.flv,12.54,M
Shorts/Doctors and Farmers find Eliminating GMOs Prevents Disease.flv,12.51,M
And More/The Holy Spirit/I Lift My Eyes Up Brian Doerksen.flv,12.16,M
And More/Signs of the Times/Godfather of Global Warming Found Wanting.flv,11.96,M
And More/Martyrs of Today/If They Kill Me Muslim Prince Conversion to Biblical Christianity.flv,11.73,M
And More/Signs of the Times/Asian Axis  India   China to bring two largest armies closer.flv,11.01,M
And More/Signs of the Times/Christians Fired For Not Counseling Gay Couple Wearing Cross.flv,10.84,M
Shorts/China warns of armyworm outbreak Plague 8-15-12 - timed w US grain drought.flv,10.65,M
And More/War and Rumors of Wars/Syria Says It Shot Down Turkish AF Plane 6-22-12.flv,10.05,M
Shorts/10000-ton Pile of Toxic Dirt Dumped on High School Grounds Left for 1 Year - San Diego CA.flv,9.78,M
And More/The Holy Spirit/BT Daily  Trusting God for Our Safety - YouTube (2).flv,9.64,M
And More/The Holy Spirit/Blessed Be Your Name worship video w  lyrics  - YouTube.flv,9.5,M
And More/Signs of the Times/Four Egypt Officials Acquitted of Uprising Murders 9-6-12.flv,9.49,M
And More/SIN-ister Clips/Wells Fargo Forclosed on Wrong Home Owners Lose Possessions.flv,9.39,M
And More/SIN-ister Clips/Pilot Whales die in mass after being stranded on the East Coast of Scotland 9-02-12.flv,9.26,M
Shorts/Merck Vaccines Bio Weapons created in 1941 US Biological Weapons Program - YouTube.flv,8.85,M
And More/SIN-ister Clips/Iran Minister Warns Workers Wages Cant be Paid for Next 3-6 Months 9-5-12.flv,8.28,M
Shorts/Home Remedies to prevent and treat West Nile and other Flu-like Viruses.flv,8.23,M
Shorts/Worlds first Genetically Modified Babies Born - YouTube.flv,8.12,M
Shorts/Food ingredient linked to Alzheimers 8-11-12.flv,7.56,M
And More/The Holy Spirit/The Narrow Way to Life - YouTube.flv,7.05,M
Shorts/Weight-Loss Pharmaceutical that caused Tumors in animal studies approved in America.flv,6.92,M
Shorts/Study  Vaccinated children have up to 500% more disease than unvaccinated children.flv,6.8,M
And More/SIN-ister Clips/Obama The Words God and Jerusalem dont just walk off a page from the DNC Platform 9-5-12.flv,6.5,M
Shorts/NEW Mysterious AIDS-like disease discovered  Dont know how its spread - Only Over 50 Catch it.flv,5.16,M
And More/Signs of the Times/France - Chemical Reaction sparks fire alert at French oldest Nuclear Plant 9-5-12.flv,4.81,M
And More/Signs of the Times/22 Pilot Whales Beach Themselves Near Fort Pierce Florida.flv,4.2,M
Shorts/Deadly Seal Flu Virus Poses Threat To Humans - adapting from Bird Flu Virus.flv,2.82,M
maogmaacc.jpg,12.25,K
timthumb.php.jpg,8.52,K
POtHS - Why We Do What We Do.txt,7.89,K
Info.txt,5.79,K
Torrent downloaded from Conspiracyhub.com.txt,47,B
Torrent downloaded from Ahashare.com.txt,47,B
