User Type,Username,Date,Text
,Buzzlightyear7,2012-10-31T14:38Z,can i play this one online?
,sealx86,2012-10-31T15:32Z,"Dude: ""Clan of Champions is a game that you can play with or against friends online."""
,Buzzlightyear7,2012-10-31T19:15Z,"I can read, but its a steam game... how do i play it online without steam"
,Buzzlightyear7,2012-10-31T20:19Z,"""A network error has occurred"" when i start or try to do team battle. So there is no online support for crack?"
,serthug,2012-10-31T22:34Z,same thing to me ' a network error has occurred'...
