Filename,Size,Unit
Subtitles template/English HD subtitles template/The Remains of the day 720p DivX HDTV H.264 (moviesbyrizzo).srt,118.96,K
Subtitles template/French/The Remains of the day 720p DivX HDTV H.264 (moviesbyrizzo).srt,108.94,K
Subtitles template/Spanish/The Remains of the day 720p DivX HDTV H.264 (moviesbyrizzo).srt,118.42,K
The Remains of the day 720p DivX HDTV H.264 (moviesbyrizzo).mkv,1.17,G
Bonus -Vera Lynn - As time goes by.mp3,7.76,M
The Remains of the Day (1993) poster.jpg,122.13,K
