Filename,Size,Unit
others/Torrent downloaded from 594mgnav torrents on BTScene.eu.txt,67,B
others/Torrent downloaded from AhaShare.com.txt,59,B
others/Torrent downloaded from Demonoid.me.txt,46,B
others/Torrent Downloaded From ExtraTorrent.com.txt,353,B
others/Torrent downloaded from Torrentmafia.org.txt,40,B
README.txt,993,B
Snakes- Ecology and Conservation(EPUB+PDF+MOBI)[Team Nanban]tmrg.jpg,213.58,K
Snakes- Ecology and Conservation[Team Nanban]tmrg.epub,1.55,M
Snakes- Ecology and Conservation[Team Nanban]tmrg.mobi,2.85,M
Snakes- Ecology and Conservation[Team Nanban]tmrg.pdf,6.57,M
VISIT ME ON FACEBOOK.txt,89,B
