User Type,Username,Date,Text
,syaugust8,2012-09-23T21:12Z,is it still that painfully unfunny seth meyers?  he should step down as head writer for snl; his inability to be funny is all too obvious.
,chillibean,2012-09-24T14:02Z,"Seth Meyers is a very funny guy and syaugust8 isn't .
If he was he would have said something funny and clever to put down Seth, Seth would have done it to him and been hilarious."
,chillibean,2012-09-24T14:04Z,"Seth Meyers is a very funny guy and syaugust8 isn't .
If he was, he would have said something funny and clever to put down Seth, Seth would have done it to him and been hilarious."
