User Type,Username,Date,Text
,arthur_cross,2012-07-19T22:20Z,Thanks...AD
,Bazza19,2012-07-19T22:47Z,"Cheers Dean, from across the pond in Canada. It's much appreciated."
,stitts,2012-07-19T23:29Z,Many thanks from the quiet lakeside of the Canadian Shield.
,Gerinracine,2012-07-20T04:53Z,"Thanks so much, Dean."
,heeddabaw,2012-07-20T04:57Z,"Great Work dean,from The Big Yin Waiheke island New Zealand.."
,Wendie52,2012-07-20T06:10Z,Thank you
,anna19567,2012-07-21T06:08Z,Thanks Dean From Greece
