User Type,Username,Date,Text
,Batmanfun,2012-05-10T05:54Z,"Can you upload batgirl 9? And reupload legion lost 9 and batman 9?
Thanks alot!"
[T],MrDowntown,2012-05-10T06:01Z,"As soon as I can BG9 will be up.

Others were re-upped by:
http://thepiratebay.se/user/mdusanjay/"
,OButton,2012-05-10T07:01Z,"Thanks very much. If possible can you please upload Amerca's Got Powers, Supurbia and Deadwardians updates too?"
,baam14,2012-05-10T11:18Z,"could you please upload Ultimate Comics X-MEN #10 too?

cant find it anywhere.."
,Lazer295,2012-06-01T21:55Z,The reader I am useing (ComicBookRack) cannot open the file. This has been happening more frequently with comic downloads. Is there a new format being used? Or a better program that I could download.
