User Type,Username,Date,Text
[V],ThumperTM,2013-01-03T12:54Z,enjoy & seed
,andienguyen,2013-01-07T04:54Z,"doesnt work at all. after installation, i didnt start the program, replaced all the crack files and entered the serials but it didnt work :("
,pjimmy74,2013-01-08T17:02Z,"Works great. Just follow the instructions. I actually installed a trial version from AVG's site. Went into my C:Program Files(x86)AVGAVG PC TuneUp"", did a copy and paste to replace the original files. Went and started AVG TuneUp. Registered with the serials provided. BINGO, it's working! Oh note that the first serial is incomplete. "
,spawtpawt,2013-01-08T19:50Z,"It didnt work for me.... I followed all the instructions perfectly and when I open it, GENUINE KEY is needed..... i ran it as admin.... im using WINDOW 7 Ultimate... HELP... whats the problem all about? "
,rajakumar,2013-01-10T18:34Z,"It didn't work for me, all serials are not GENUINE KEY. I get the error counterfeit message from AVG."
