Filename,Size,Unit
The.Red.and.White.Freedom.Trilogy.2012.3xPAL.DVDR.NL.Subs.nfo,1.31,K
The.Red.and.White.Freedom.Trilogy.2012.3xPAL.DVDR.NL.Subs/DVD_1_MERAH_PUTIH.ISO,4.37,G
The.Red.and.White.Freedom.Trilogy.2012.3xPAL.DVDR.NL.Subs/DVD_2_BLOOD_OF_EAGLES.ISO,4.05,G
The.Red.and.White.Freedom.Trilogy.2012.3xPAL.DVDR.NL.Subs/DVD_3_HEARTS_OF_FREEDOM.ISO,3.94,G
Torrent Downloaded From BTScene.eu.txt,45,B
Torrent Downloaded From ExtraTorrent.com.txt,353,B
Torrent Downloaded from limetorrent.txt,50,B
Torrent downloaded from AanMeHoelaJa Torrents on BTScene.eu.txt,71,B
Torrent downloaded from AhaShare.com.txt,58,B
Torrent downloaded from Demonoid.me.txt,46,B
Torrent downloaded from KAT.ph.txt,41,B
Torrent downloaded from Rarbg.com.txt,33,B
Torrent downloaded from silvertorrent.org.txt,54,B
Torrent downloaded from thepiratebay.se.txt,50,B
tracked_by_h33t_com.txt,23,B
