User Type,Username,Date,Text
,.V3N0M.,2012-12-20T21:35Z,Screens Included In Torrent
,ntongh2o,2012-12-20T22:00Z,Does the audio pause every 3-5 seconds like the other HDrips?
,.V3N0M.,2012-12-20T22:49Z,no it doesn't
,ntongh2o,2012-12-21T02:05Z,thanks for the great copy! no audio issues here confirmed
,michaelrwatson,2012-12-21T21:36Z,"Hmm... very tempting, but some of these guys who make the small files wreck them with watermarks, links, and other shit in your face. Does this one?"
,michaelrwatson,2012-12-22T00:07Z,"WARNING: This does have watermarks. 

Starts w/ a 1 minute long, 2-liner advertizing V3N0M's sleazy website--this continues right into the start of the movie. Than periodic watermarks throughout. Any screens are selected to not show the watermarks.

V3N0M: you're a fucking asshole. And did i mention that your mom sucks horse cock? "
,michaelrwatson,2012-12-22T10:52Z,"WELL, apologies for my previous nasty msg--i was only half right--the worst watermark is actually a separate track that can be turned off. However, there is still a hardcoded (though small) NITRO in the lower right corner for the first 5min. 

A 9 
v 8 (cropped, logo)
m 7

So...thanx. Maybe you can put all the watermarks on a separate track next time. "
