Filename,Size,Unit
others/Torrent downloaded from 594mgnav torrents on BTScene.eu.txt,67,B
others/Torrent downloaded from AhaShare.com.txt,59,B
others/Torrent downloaded from Demonoid.me.txt,46,B
others/Torrent Downloaded From ExtraTorrent.com.txt,353,B
others/Torrent downloaded from Torrentmafia.org.txt,40,B
README.txt,821,B
The BetterPhoto Guide to Digital Photography[Team Nanban]tmrg.epub,33.28,M
The BetterPhoto Guide to Digital Photography[Team Nanban]tmrg.jpeg,62.44,K
The BetterPhoto Guide to Digital Photography[Team Nanban]tmrg.mobi,33.87,M
The BetterPhoto Guide to Digital Photography[Team Nanban]tmrg.pdf,13.5,M
VISIT ME ON FACEBOOK.txt,89,B
