Filename,Size,Unit
CD/01. Pon De Replay.mp3,9.46,M
CD/02. Here I Go Again.mp3,9.62,M
CD/03. If It's Lovin' That You Want.mp3,7.98,M
"CD/04. You Don't Love Me (No, No, No).mp3",9.96,M
"CD/05. That La, La, La.mp3",8.66,M
CD/06. The Last Time.mp3,11.23,M
CD/07. Willing To Wait.mp3,10.64,M
CD/08. Music Of The Sun.mp3,9.04,M
CD/09. Let Me.mp3,9.06,M
CD/10. Rush.mp3,7.27,M
CD/11. There's A Thug In My Life.mp3,7.71,M
CD/12. Now I Know.mp3,11.56,M
CD/13. Pon De Replay (Remix).mp3,8.33,M
CD/Rihanna - Music Of The Sun.m3u,873,B
CD/Rihanna - Music Of The Sun.mp3.cue,1.71,K
