User Type,Username,Date,Text
,dash34,2012-04-28T06:35Z,no sample pics?! a/v ?? com'on!!
,erikli,2012-04-28T08:07Z,"http://imagerz.com/QEBPX0tvAwMHXw0fEwVQ

pics"
,dash34,2012-04-28T10:45Z,"please seed, let me download it at good speed!!"
[V],steevo-be-thy-name,2012-04-28T10:53Z,"@ up7845  YOU HAVE DONE THIS ON EVERY SINGLE UPLOAD OF THIS MOVIE , WOULD LOVE TO GET MY HANDS ON YOU AND RIP YOUR FUCKIN' NUTS RIGHT OFF , YOU ARE A PRIZE CUNT ."
,dash34,2012-04-28T11:31Z,"i dont see any ""up7845"" user comment ??"
[V],steevo-be-thy-name,2012-04-28T12:19Z,"up7845 's   COMMENT HAS BEEN DELETED , THAT'S HOW YOU DON'T SEE IT NOW . 
HE WAS TRYING TO RUIN THE MOVIE BY GIVING AWAY SPOILERS ."
,dash34,2012-04-28T14:00Z,"ok gr8 fuck u ""up7845"" ... please need a good print of this amazing movie!!"
[V],maximersk,2012-04-28T15:21Z,"Hi, guys ! "
,royrokit,2012-04-28T18:54Z,So now that you have all commented. How is this download
,-Ronin-,2012-04-28T22:47Z,"8a/5v 
awesome for being the weekend before it releases here. Its pretty dark but you can figure out what is happening quite easy, you lose a couple scenes subtitles, and it starts a minute or two into the movie. Also doesnt include the credits so no easter egg scenes. Audio is pretty good. Clear through out, with a bit of audience ""participation""
THANKS maximerks!!!!"
,predator7196,2012-04-30T14:00Z,steevo you do swear alot calm down lad its only a download
