Filename,Size,Unit
Extras/VideoClip - Sexta-Feira (Emprego Bom Já).m4v,38.94,M
CD/16. Li Kê Terra.mp3,10.62,M
CD/13. Eu Tou Aqui (Ao Vivo Em Estúdio).mp3,10.37,M
CD/10. Um Brinde À Amizade (feat. Gabriel o Pensador).mp3,9.56,M
CD/03. Tu És Mais Forte (feat. Shout).mp3,9.1,M
CD/15. Rimas de Saudade (feat. Toni Garrido) [Samba Remix].mp3,8.96,M
"CD/14. Eu Amei, Eu Chorei (Ao Vivo Em Estúdio).mp3",8.87,M
CD/12. Tu És Mais Forte (feat. Shout) [Versão Banda].mp3,8.69,M
CD/01. Gajo Normal.mp3,8.58,M
CD/11. Laia.mp3,8.23,M
CD/09. You're My Baby (feat. Deborah Goncalves).mp3,8.06,M
CD/07. Deixou-me (feat. Rui Veloso).mp3,7.73,M
CD/05. Problemas de Confiança.mp3,7.49,M
CD/08. P da C.mp3,7.42,M
CD/04. Sexta-feira (Emprego Bom Já).mp3,7.12,M
CD/02. Tástabater.mp3,7.11,M
CD/06. Dor de Barriga (feat. Raul Reyes).mp3,6.84,M
Extras/Digital Booklet - AC Para os Amigos.pdf,2.37,M
Extras/Capa.jpg,310.95,K
CD/Capa.jpg,310.95,K
