Filename,Size,Unit
INFO TBS/poster.jpg,299.22,K
INFO TBS/www.black-Sam org     Kom eens Langs !.jpg,13.1,K
INFO TBS/Rock of Ages (2012) PAL.DVD9 untouched multisubs audio B-Sam.txt,1.6,K
INFO TBS/Torrent downloaded from Silvertorrent.org.txt,720,B
INFO TBS/Torrent_downloaded_from_AhaShare.com.txt,629,B
INFO TBS/Torrent Downloaded from  Movie-Torrentz.txt,607,B
INFO TBS/Tracked by H33T.txt,606,B
INFO TBS/Black-Sam.txt,128,B
INFO TBS/Torrent downloaded from BettyBoop torrents on BTScene.eu.txt,68,B
INFO TBS/Torrent Downloaded from  btscene.eu.txt,42,B
Rock of Ages (2012) PAL.DVD9.untouched/ROCK OF AGES DVD9 -ita.iso,7.58,G
