User Type,Username,Date,Text
,rahulroy9202,2012-06-18T18:01Z,can someone confirm if this game is in english or not???
,SeregA_Lus,2012-06-19T17:33Z,It in Russian yazyke.A sound in English
,rahulroy9202,2012-06-23T01:44Z,"gives error when running setup.exe-


filename, volume name or directory name is incorrect....


why??"
,rahulroy9202,2012-06-23T06:57Z,"Works....
just need to rename the folder(to anything)...


language is in Russian...
but can be easily changed to English by editing the context.xml file..

open it in notepad and change 
language=""russia""
to ""english""

Thanks for the upload  SeregA_Lus..


and the Game is great too...."
