User Type,Username,Date,Text
,abhitj,2012-10-08T16:05Z,"That Crack Isnt Working !!

I Downloaded Working Crack From Here - 
"
,prashob86,2012-10-08T23:02Z,Is it working?? 
,skoxpress,2012-10-09T14:09Z,"Works for me, no sweat. Thanks, iahq76.

win 7-64"
,prashob86,2012-10-09T15:45Z,"verifying from platinum ip server?????????? and nothing else.... wen cancel it, telling check your network... wtf? not working at all "
,JBiz1,2012-10-18T19:49Z,"This did not hide my ip on: http://www.tracemyip.org/

I tried alot of different ip hiders and none worked for: http://www.tracemyip.org/"
