User Type,Username,Date,Text
,HvyMetal,2012-07-27T23:43Z,"I will be seeding for about 3 months,please help me seeding too for to share to all rock metal brothers and sisters :-)"
,teetertv,2012-07-27T23:56Z,"Hey,Hey Hey, HvyMetal, are you going to be up-loading more shows besides this?  need more rock and metal here.* You Rock!"
,HvyMetal,2012-07-28T02:39Z,"@ teetertv ,Yes I have rare Rock & Metal concerts specially from Mexico, regards :-)"
,HvyMetal,2012-07-28T22:20Z,"I will not available to upload the next Metal/Rock dvd until I see some seeders here, so please help to seed ;-)"
,Flyfisher61,2012-08-02T01:07Z,Thanks!
,mokeyzappa,2012-08-22T20:12Z,"wow great video quality is excellent ,thank HvyMetal  keep seeding  this things till the cows come home "
,DRESSEDTOKILL,2012-09-01T09:07Z,"PLEASE UPLOAD SOME MORE COOL SHIT
 I WILL TOO "
