Filename,Size,Unit
A Lot Like Love.jpg,60.96,K
A Lot Like Love_(2005)_BRRip_720p_KrazyKarvs.mkv,768.6,M
A Lot Like Love_(2005)_BRRip_720p_KrazyKarvs.srt,74.01,K
A Lot Like Love_(2005)_BRRip_720p_KrazyKarvs_Sample.mkv,4.33,M
KrazyKarvs.png,190.15,K
KrazyKarvs.txt,209,B
Torrent Downloaded from 1337x.org.txt,33,B
Torrent downloaded from AhaShare.com.txt,59,B
Torrent Downloaded From ExtraTorrent.com.txt,40,B
Torrent Downloaded from kat.ph.txt,30,B
Torrent Downloaded from thepiratebay.org.txt,40,B
Torrent Downloaded from Torrentmafia.in.txt,39,B
