Filename,Size,Unit
2012-06-23- John Thiel - Without Fault.avi,766.11,M
Faith And Works For Salvation  NO Book of James Explained.avi,589.64,M
And More/The Holy Spirit/WORSHIP TIME MIX 2 - with Lyrics.mp4,258.2,M
Jesus Calls Down Woes Pt 1 - Matthew 23 1-15 - Expositional Preaching Kerrigan Skelly.avi,199.01,M
"God's Salvation Rich, but not Free.avi",188.26,M
Can We Be Good Without God  William Lane Craig Lecture.avi,174.07,M
Shorts/Ephesians 2 - Only In Christ.flv,168.24,M
Justification Without the Deeds of the Law by Harold Sightler.avi,167.2,M
Jesus Calls Down Woes Pt 2 - Matthew 23 16-39 - Expositional Preaching - Kerrigan Skelly.avi,152.24,M
Shorts/Why Do You Use the Bible to Prove the Bible - Creation Today.mp4,128.83,M
And More/Signs of the Times/Purely Pacific Northwest.mp4,113.78,M
And More/The Holy Spirit/Ecumenism False Shepherds and Doctrines of Devils.flv,109.29,M
Have You Taken Up Your Cross  Tommy Heffner.avi,108.35,M
And More/The Holy Spirit/Eric Ludy - Depraved Indifference.mp4,93.09,M
And More/SIN-ister Clips/Vimanas - AA Debunked.flv,79.83,M
And More/Signs of the Times/And I Daniel Fainted Pt.2_Novus Ordo Seclorum.flv,75.69,M
600 Volumes - POtHS Torrents seeded 7-4-2012.rar,69.71,M
And More/Signs of the Times/And I Daniel Fainted Pt.1_Nuclear Holocaust_The Future.flv,61.03,M
And More/SIN-ister Clips/The New World Order Obamney and Robama.flv,46.07,M
Shorts/The Kirk Cameron Story - YouTube.flv,39.73,M
And More/Martyrs of Today/Christian Persecution  The world was not worthy of them - YouTube.flv,37.79,M
And More/Signs of the Times/Stuff They Don't Want You to Know - Lost Civilizations Part II.flv,37.09,M
And More/Signs of the Times/Selling Kids For Sex.flv,36.18,M
And More/The Holy Spirit/THIS IS THE DAY that the Lord Hath Made.mp4,35.83,M
And More/SIN-ister Clips/Zombies  Furious  Obamney.flv,35.33,M
Shorts/BT Daily  Bible Prophecy and You - Part 5 - YouTube.flv,29.74,M
And More/Signs of the Times/Cut   Bleeding  Austerity-bitten Spain stands up in.flv,27.65,M
Shorts/BT Daily  Bible Prophecy and You.webm,27.46,M
And More/The Holy Spirit/Does Your Church Teach Only Parts of the Truth.flv,26.39,M
And More/SIN-ister Clips/UN Seeking New Global Tax for new global govt.flv,23.23,M
And More/Signs of the Times/Germans Hold Nationwide Anti-Capitalism Protests.flv,22.32,M
Shorts/Wretched  Preaching to Goats.flv,22.27,M
Shorts/BT Daily  Bible Prophecy and You - Part 7 - YouTube.flv,21.25,M
And More/SIN-ister Clips/TSA Agent Caught On Video In Theft Sting.flv,19.88,M
And More/The Holy Spirit/Does Faith Heal  - Bible Answer Man.flv,19.77,M
And More/SIN-ister Clips/US to destabilize Iran by removing group from terror list.flv,19.71,M
And More/Signs of the Times/30k Dead   Ancient souk burns fighting rages in Syria Aleppo.flv,19.57,M
And More/Signs of the Times/Loaded Guns Go Undetected Through TSA Checkpoint.flv,17,M
And More/SIN-ister Clips/Wretched  Is this Christo-phobia.flv,16.38,M
Shorts/The Killing Code - Epigenetics How behavior changes DNA - Dr Darlene Russell.flv,16.37,M
And More/SIN-ister Clips/UN Call For Law Banning Blasphemy Based On A False Narrative.flv,15.95,M
Shorts/33RD DEGREE MASON LIST.flv,15.62,M
And More/SIN-ister Clips/Turkey Pilots Survived Crash Advised By Russia to Murder and Place Bodies in Plane.flv,14.94,M
And More/Signs of the Times/Mooned - Picture-proof of life on the Moon.flv,14.51,M
Shorts/Tracts Reach Hardened Souls in Prison - YouTube.flv,14.18,M
And More/The Holy Spirit/Evangelism.flv,13.9,M
And More/SIN-ister Clips/Subliminal Naked Man on Dinner Mat from WALMART.flv,13.68,M
And More/SIN-ister Clips/Why You Should Care  American student loan nightmare.flv,13.64,M
And More/Signs of the Times/Agent Orange Corn.flv,13.17,M
And More/SIN-ister Clips/Wendell Berry on Farming.flv,12.24,M
And More/War and Rumors of Wars/Libya Attackers Removing Ambassador Stevens Body Thru Window.flv,12.24,M
And More/War and Rumors of Wars/Exposed spyware linked to Stuxnet secret US nuke reactor kill code.flv,11.73,M
And More/The Holy Spirit/You Are Holy Prince of Peace Newsong.flv,11.72,M
And More/The Holy Spirit/Voice Of Truth - Casting Crowns(2).flv,11.25,M
Shorts/A Lot of Praying.webm,9.93,M
And More/The Holy Spirit/When God Made You.flv,9.67,M
And More/The Holy Spirit/Turn Your Eyes Upon Jesus by Alan Jackson.flv,8.89,M
And More/Signs of the Times/HAARP Driving Up Food Prices in the UK Weather Wars.flv,8.67,M
Shorts/Jesus Loves Us - A Touching Story - YouTube.flv,8.33,M
Shorts/The Intimacy of Prayer - YouTube.flv,7.75,M
And More/Signs of the Times/On your Marx.flv,7.29,M
And More/Martyrs of Today/Terrorists Everywhere christains Muslims whites  They are all ove.flv,7.03,M
Shorts/Study  Vaccinated children have up to 500% more disease than unvaccinated children.flv,6.8,M
And More/The Holy Spirit/Twila Paris - We Will Glorify.flv,5.86,M
And More/SIN-ister Clips/WEATHER WOMAN SPEAKS OUT.flv,5,M
And More/Signs of the Times/Child Killed In Nairobi Church Grenade Attack.flv,4.73,M
And More/SIN-ister Clips/US Calls For Military Intervention In Mali.flv,4.59,M
And More/The Holy Spirit/Did the Apostles Keep the Sabbath.flv,2.94,M
And More/The Holy Spirit/Does God Exist - The Human Eye.flv,2.58,M
POtHS - Why We Do What We Do.txt,7.89,K
Info.txt,2.47,K
Torrent downloaded from Conspiracyhub.com.txt,47,B
Torrent downloaded from Ahashare.com.txt,47,B
