User Type,Username,Date,Text
,tdawg2345,2012-09-17T04:36Z,Thanks a trillion
,Granchy,2012-09-17T05:20Z,I wouldn't go that far.  But thanks a thousand billion.
,xxx11385,2012-09-17T05:46Z,send for christs sake
,STAY-AT-HOME-GAMER,2012-09-17T06:15Z,THANKS
,sfoid,2012-09-17T08:04Z,Where would I get subtitles?
,girodice,2012-09-17T09:33Z,"Language is not specified. 

Is this in English, anyone who has downloaded please confirm? 

I just don't want to download some French or Spanish shit....lol."
,izwotitiz,2012-09-17T15:28Z,Thank you for sharing.....
,yousef86,2012-09-27T22:53Z,"Excellent Quality HDTV Rip! A/10 V/10!

EVOLVE / ettv Earns My +1 of Approval!"
