Filename,Size,Unit
Unplugged/01 Starflyer 59_ Unplugged.mp3,24.91,M
Fell In Love At 22 EP/04 Traffic Jam.mp3,19.53,M
The Fashion Focus/11 Too Much Fun.mp3,15.81,M
Leave Here A Stranger/07 I Like Your Photographs.mp3,15.32,M
Leave Here A Stranger/01 All My Friends Who Play Guitar.mp3,13.04,M
Leave Here A Stranger/05 Things Like This Help Me.mp3,12.15,M
Leave Here A Stranger/04 Give Up The War.mp3,11.81,M
Gold/06 Messed Up Over You.mp3,11.66,M
Gold/05 Stop Wasting Your Whole Life _ Me.mp3,11.61,M
Gold/07 When You Feel The Mess.mp3,10.82,M
Leave Here A Stranger/10 Your Company.mp3,10.75,M
Gold/16 Le Vainqueur (Le Vainqueur).mp3,10.56,M
Everybody Makes Mistakes/09 The Party.mp3,10.45,M
Gold/03 When You Feel Miserable.mp3,9.61,M
Gold/12 Next Time Around (Goodbyes Are Sa.mp3,9.46,M
Leave Here A Stranger/09 Night Music.mp3,9.24,M
Talking Voice Vs. Singing Voice/05 Night Life.mp3,9,M
Leave Here A Stranger/03 When I Learn To Sing.mp3,8.61,M
Gold/08 Somewhere When Your Heart Glowed.mp3,8.54,M
My Island/02 Nice Guy.mp3,8.53,M
Gold/02 Duel Overhead Cam.mp3,8.44,M
Gold/01 A Housewife Love Song.mp3,8.28,M
Gold/09 Indiana.mp3,8.1,M
The Fashion Focus/12 Days Of Lamech.mp3,7.9,M
The Fashion Focus/02 We're the Ordinary.mp3,7.89,M
Old/09 Unbelievers.mp3,7.64,M
Never Play Covers/06 Unbelievers.mp3,7.61,M
Talking Voice Vs. Singing Voice/02 Easy Street.mp3,7.55,M
Talking Voice Vs. Singing Voice/06 A Good Living.mp3,7.5,M
Leave Here A Stranger/02 Can You Play Drums_.mp3,7.49,M
"ArtCore, Vol. 1/03 Leigh and Me (as Starflyer 2000).mp3",7.46,M
Old/07 Old.mp3,7.44,M
Talking Voice Vs. Singing Voice/01 The Contest Completed.mp3,7.42,M
The Fashion Focus/03 Sundown.mp3,7.4,M
Leave Here A Stranger/06 This I Don't Need.mp3,7.4,M
My Island/04 Division.mp3,7.39,M
Talking Voice Vs. Singing Voice/08 Something Evil.mp3,7.34,M
My Island/03 I Win.mp3,7.3,M
Gold/11 One Shot Juanita.mp3,7.27,M
Easy Come Easy Go/2-18 Help Me When You're Gone.mp3,7.04,M
Ghosts Of The Past/2-10 Under The Milky Way.mp3,7.04,M
Americana/09 Help Me When You're Gone.mp3,6.96,M
Talking Voice Vs. Singing Voice/04 A Lists Go On.mp3,6.94,M
Plugged/02 Duel Overhead Cam.mp3,6.94,M
Dial M/10 I Love You Like the Little Bird.mp3,6.86,M
Easy Come Easy Go/2-22 When You Feel The Mess.mp3,6.86,M
Old/10 First Heart Attack.mp3,6.85,M
Silver/01 Blue Collar Love.mp3,6.84,M
Ghosts Of The Past/2-09 I Love You Like The Little Bird.mp3,6.78,M
The Fashion Focus/07 The Birthrite.mp3,6.74,M
Everybody Makes Mistakes/07 A Dethroned King.mp3,6.73,M
Ghosts Of The Past/1-04 Pearl Of Great Price (Daniel Br.mp3,6.72,M
The Changing Of The Guard/02 Shane.mp3,6.7,M
Gold/13 Goodbyes Are Sad (Goodbyes Are Sa.mp3,6.66,M
Americana/10 Everyone But Me.mp3,6.55,M
Americana/07 You Don't Miss Me.mp3,6.54,M
Old Demos/02 Old.mp3,6.44,M
Plugged/06 Le Vainqueur.mp3,6.43,M
Gold/15 The Starflyer 2000 Reprise (Le Va.mp3,6.43,M
The Fashion Focus/01 I Drive A Lot.mp3,6.41,M
Ghosts Of The Past/2-11 Magic.mp3,6.38,M
Americana/01 The Voyager.mp3,6.37,M
"Talking Voice Vs. Singing Voice/07 Softness, Goodness.mp3",6.37,M
Easy Come Easy Go/2-03 Elijah The Prophet.mp3,6.36,M
Old/01 Underneath.mp3,6.36,M
Plugged/04 Blue Collar Love.mp3,6.25,M
Ghosts Of The Past/1-14 Guitar Man.mp3,6.19,M
Gold/14 When No One Calls (Le Vainqueur).mp3,6.17,M
Le Vainqueur/01 Le Vainqueur (radio edit).mp3,6.08,M
"The Fashion Focus/10 Fashion Show, The.mp3",6.06,M
Ghosts Of The Future/04 D) Pearl Of Great Price.mp3,6.06,M
Talking Voice Vs. Singing Voice/09 The Longest Line.mp3,6.06,M
Dial M/07 Automatic.mp3,6.03,M
Americana/03 Harmony.mp3,6.01,M
Ghosts Of The Past/1-08 Spooky.mp3,5.99,M
The Fashion Focus/09 Shut Your Mouth.mp3,5.95,M
Ghosts Of The Past/2-08 The Brightest Of The Head (Acou.mp3,5.9,M
The Changing Of The Guard/06 I Had A Song For The Ages.mp3,5.89,M
Ghosts Of The Past/1-01 Automatic.mp3,5.88,M
Ghosts Of The Past/1-11 I Love You Like The Little Bird.mp3,5.86,M
Never Play Covers/10 Play The C Chord.mp3,5.85,M
Dial M/02 The Brightest of the Head.mp3,5.84,M
Ghosts Of The Past/1-15 Black Jacket.mp3,5.83,M
Ghosts Of The Past/1-19 The Brightest Of The Head.mp3,5.81,M
Ghosts Of The Past/1-05 Minor Keys.mp3,5.8,M
Ghosts Of The Past/1-02 Compulsion.mp3,5.79,M
Everybody Makes Mistakes/01 Play the C Chord.mp3,5.77,M
The Changing Of The Guard/07 Coconut Trees.mp3,5.76,M
Dial M/05 M23.mp3,5.75,M
Dial M/01 Minor Keys.mp3,5.75,M
Plastiq Musiq_ Electric Music Compilatio/03 We Got a Word For.mp3,5.74,M
"The Last Laurel/01 Softness, Goodness (Rough Mix).mp3",5.74,M
Dial M/04 Who Said It's Easy_.mp3,5.72,M
Can't Stop Eating EP/04 Give Up the War (stereo mix).mp3,5.71,M
Easy Come Easy Go/2-17 Play The C Chord.mp3,5.71,M
Easy Come Easy Go/2-01 I Was 17.mp3,5.69,M
Americana/05 You Think You're Radical.mp3,5.68,M
Ghosts Of The Past/1-09 Mr. Martin.mp3,5.67,M
Silver/05 The Zenith.mp3,5.65,M
Americana/02 The Hearttaker.mp3,5.65,M
Fell In Love At 22 EP/02 We Want It Bad.mp3,5.65,M
Easy Come Easy Go/2-10 Wherever You Go (First Space So.mp3,5.64,M
Dial M/08 Altercation.mp3,5.62,M
The Fashion Focus/06 All The Time.mp3,5.58,M
My Island Demos/01 Nice Guy.mp3,5.55,M
The Changing Of The Guard/08 Cry Me A River.mp3,5.55,M
Old Demos/03 Underneath.mp3,5.54,M
Ghosts Of The Future/15 O) Black Jacket.mp3,5.54,M
Americana/04 All You Want Are The Things I Nee.mp3,5.5,M
Never Play Covers/04 The Big Idea.mp3,5.49,M
The Changing Of The Guard/05 The Morning Rise _ Frightening Ey.mp3,5.46,M
Everybody Makes Mistakes/08 Going Places.mp3,5.44,M
Ghosts Of The Past/1-13 M23.mp3,5.36,M
The Changing Of The Guard/04 Trucker's Son.mp3,5.36,M
Never Play Covers/05 Not Funny.mp3,5.32,M
Easy Come Easy Go/2-16 Traffic Jam.mp3,5.31,M
Ghosts Of The Future/01 A) Automatic.mp3,5.3,M
The Changing Of The Guard/10 Lose My Mind.mp3,5.29,M
My Island/09 Lifeguard.mp3,5.28,M
Easy Come Easy Go/2-21 No New Kinda Story.mp3,5.27,M
Ghosts Of The Future/02 B) Compulsion.mp3,5.24,M
Ghosts Of The Future/14 N) Guitar Man.mp3,5.22,M
Dial M/09 Mr. Martin.mp3,5.2,M
Ghosts Of The Future/11 K) I Love You Like The Little Bir.mp3,5.19,M
My Island/08 Pearl of Great Price.mp3,5.19,M
Easy Come Easy Go/2-14 Prepare To Detour.mp3,5.18,M
"Never Play Covers/02 New Wife, New Life.mp3",5.16,M
Easy Come Easy Go/2-02 All Done Wrong.mp3,5.08,M
Portuguese Blues 12_/03 Troubles.mp3,5.07,M
Ghosts Of The Future/08 H) Spooky.mp3,5.04,M
Ghosts Of The Past/1-10 Mr. Martin (Acoustic).mp3,5.03,M
"Old/06 New Wife, New Life.mp3",4.98,M
Everybody Makes Mistakes/02 No New Kinda Story.mp3,4.97,M
Dial M/03 Concentrate.mp3,4.96,M
I Am The Portuguese Blues/09 No Revolution.mp3,4.95,M
Ghosts Of The Future/19 S) God Forbid.mp3,4.95,M
Ghosts Of The Past/1-20 Altercation.mp3,4.92,M
Easy Come Easy Go/2-04 Never Had A Name.mp3,4.91,M
Silver/14 Monterrey [Lounge Version] (She's.mp3,4.8,M
Never Play Covers/07 Birthrite.mp3,4.75,M
Easy Come Easy Go/2-19 Card Games And Old Friends.mp3,4.75,M
Ghosts Of The Future/05 E) Minor Keys.mp3,4.74,M
Ghosts Of The Future/09 I) Mr. Martin.mp3,4.73,M
The Changing Of The Guard/09 Kick The Can.mp3,4.69,M
Ghosts Of The Future/13 M) M23.mp3,4.66,M
Never Play Covers/03 Unlucky.mp3,4.66,M
Can't Stop Eating EP/02 West Coast Friendship.mp3,4.66,M
My Island/10 Ideas for the Talented.mp3,4.66,M
The Changing Of The Guard/01 Fun Is Fun.mp3,4.65,M
Talking Voice Vs. Singing Voice/03 Good Sons.mp3,4.65,M
The Fashion Focus/04 Fell In Love At 22.mp3,4.58,M
Ghosts Of The Past/1-12 Mall Monarchy.mp3,4.58,M
Silver/07 Droned.mp3,4.57,M
Ghosts Of The Future/20 T) Altercation.mp3,4.47,M
Fell In Love At 22 EP/03 E.P. Nights.mp3,4.44,M
My Island Demos/04 My Island.mp3,4.43,M
My Island/05 Mic the Mic.mp3,4.42,M
I Predict A Clone (as interpreted by som/03 Sin For A Season.mp3,4.41,M
Ghosts Of The Past/2-01 The Man Who Will Lead.mp3,4.38,M
Ghosts Of The Future/03 C) Concentrate.mp3,4.36,M
Ghosts Of The Future/10 J) Mr. Martin (Acoustic).mp3,4.36,M
Everybody Makes Mistakes/06 My Name.mp3,4.36,M
My Island Demos/05 Lifeguard.mp3,4.35,M
Old/05 The Lights On.mp3,4.34,M
My Island Demos/02 I Win.mp3,4.33,M
Start Right Here_ Remembering the Life o/06 Lord I'm Gonna Love You.mp3,4.32,M
Dial M/06 Taxi.mp3,4.31,M
Old/04 Passengers.mp3,4.29,M
Plugged/05 Do You Ever Feel That Way.mp3,4.28,M
Easy Come Easy Go/2-15 I Drive A Lot.mp3,4.26,M
Old/03 Loved Ones.mp3,4.24,M
Everybody Makes Mistakes/05 Just Try.mp3,4.23,M
Silver/18 Droned [In Love Version] (She's t.mp3,4.23,M
Ghosts Of The Past/1-03 Concentrate.mp3,4.21,M
Easy Come Easy Go/2-13 Your Company.mp3,4.21,M
Ghosts Of The Past/1-16 Broken Arm.mp3,4.21,M
Easy Come Easy Go/2-20 Shut Your Mouth.mp3,4.2,M
My Island/07 My Island.mp3,4.2,M
The Fashion Focus/05 A Holiday Song.mp3,4.19,M
Happy Christmas Vol. 2/08 Have Yourself a Merry Little Chri.mp3,4.19,M
The Changing Of The Guard/03 Time Machine.mp3,4.17,M
Never Play Covers/01 Wake Up Early.mp3,4.15,M
Plugged/01 A Housewife Love Song.mp3,4.12,M
Never Play Covers/08 Teens In Love.mp3,4.12,M
Never Play Covers/09 Worth Of Labor.mp3,4.11,M
Ghosts Of The Past/1-07 Easy.mp3,4.09,M
Ghosts Of The Past/2-07 W.S. 2005.mp3,4.09,M
Live Tribute Recording For Gene Eugene/02 Going Places.mp3,4.08,M
Old Demos/01 The Sheriff.mp3,4.07,M
Gold/10 Do You Ever Feel That Way.mp3,4.06,M
Ghosts Of The Future/12 L) Mall Monarchy.mp3,4.05,M
Happy Christmas Volume 4/05 Christmas Time Is Here.mp3,4.05,M
Old/08 A Kissing Song.mp3,4.04,M
Americana/06 The Translator.mp3,4.04,M
I Am The Portuguese Blues/01 Wake Up Early.mp3,4.03,M
Silver/13 Blue Collar Love [Joy Electric Du.mp3,4.03,M
Old/02 Major Awards.mp3,4.02,M
I Am The Portuguese Blues/03 Teens In Love.mp3,4.02,M
I Am The Portuguese Blues/04 The Big Idea.mp3,4.02,M
Easy Come Easy Go/2-09 Everyone But Me.mp3,4.01,M
Ghosts Of The Past/2-02 Thin As A Needle.mp3,3.94,M
Silver/10 The Dungeon.mp3,3.94,M
The Fashion Focus/08 Card Games And Old Friends.mp3,3.93,M
I Am The Portuguese Blues/05 Worth Of Labor.mp3,3.92,M
Ghosts Of The Past/2-06 Family Line.mp3,3.9,M
Silver/12 She Was My Sweetheart (She's the.mp3,3.9,M
Ghosts Of The Past/1-17 Taxi.mp3,3.89,M
Everybody Makes Mistakes/04 No More Shows.mp3,3.89,M
I Win/03 Family Line.mp3,3.88,M
Gold/04 You're Mean.mp3,3.88,M
Can't Stop Eating EP/03 Happy Birthday John.mp3,3.86,M
My Island/01 The Frontman.mp3,3.85,M
Leave Here A Stranger/08 ...Moves On.mp3,3.84,M
I Am The Portuguese Blues/10 I Need Some Help.mp3,3.82,M
My Island Demos/03 Division.mp3,3.82,M
Can't Stop Eating EP/01 Compeating.mp3,3.74,M
Can't Stop Eating EP/05 Theme From Dromedary.mp3,3.72,M
My Island/06 It's Alright Blondie.mp3,3.7,M
Ghosts Of The Future/17 Q) Taxi.mp3,3.68,M
Ghosts Of The Future/16 P) Broken Arm.mp3,3.6,M
I Am The Portuguese Blues/06 Not Funny.mp3,3.6,M
I Am The Portuguese Blues/07 Sound On Sound.mp3,3.58,M
Ghosts Of The Past/2-05 White Fog.mp3,3.58,M
Silver/03 Sled.mp3,3.58,M
Silver/11 She's The Queen (She's the Queen).mp3,3.52,M
Ghosts Of The Past/1-18 Gangs Of Riverside.mp3,3.52,M
Silver/06 2nd. Space Song.mp3,3.46,M
Plugged/03 You're Mean.mp3,3.43,M
Ghosts Of The Future/07 G) Easy.mp3,3.43,M
Fell In Love At 22 EP/05 Samson.mp3,3.42,M
Americana/08 The Boulevard.mp3,3.42,M
I Am The Portuguese Blues/08 Destiny.mp3,3.36,M
Ghosts Of The Past/2-03 The Lucky Ones.mp3,3.35,M
Portuguese Blues 12_/04 He'll Leave Me ALone.mp3,3.25,M
My Island/6845724216_d5b734150f_k.jpg,3.23,M
Everybody Makes Mistakes/03 20 Dollar Bills.mp3,3.21,M
Happy Christmas Vol. 3/12 I'll Be Home For Christmas.mp3,3.17,M
Silver/02 Monterrey.mp3,3.15,M
Live Tribute Recording For Gene Eugene/01 E.P. Nights.mp3,3.13,M
Ghosts Of The Past/1-06 Please Please Please Let Me Get.mp3,3.07,M
Silver/04 Hazel Would.mp3,3.07,M
I Am The Portuguese Blues/02 Unlucky.mp3,3.06,M
Silver/15 Canary Row (She's the Queen).mp3,3.04,M
Silver/16 Salinas (She's the Queen).mp3,3.03,M
Ghosts Of The Future/18 R) Gangs Of Riverside.mp3,3.02,M
Silver/17 The Drop (She's the Queen).mp3,2.64,M
Online Novel/Dromedary Theme Song.mp3,2.56,M
"Ghosts Of The Future/06 F) Please, Please, Please, Let Me.mp3",2.54,M
Easy Come Easy Go/2-11 Shedding The Mortal Coil.mp3,2.5,M
Ghosts Of The Past/2-04 For Us.mp3,2.44,M
The Last Laurel/05 For Us.mp3,2.37,M
Silver/09 She Only Knows.mp3,2.37,M
Silver/08 Happy Days Are Here Again.mp3,1.58,M
My Island/6991852851_b5fd8403e1_b.jpg,767.92,K
Ghosts Of The Future/2450924830_f5f185d8ee_b.jpg,693.92,K
Ghosts Of The Future/2450096771_4b4ae86fc7_b.jpg,669.69,K
My Island/241585815_028a07aba9_b.jpg,618.75,K
Ghosts Of The Future/2450921136_0188d71a7b_b.jpg,570.64,K
The Changing Of The Guard/TCOTG CD.jpg,550.48,K
Ghosts Of The Future/2450907196_d9e5b7278f_b.jpg,495.68,K
Ghosts Of The Future/2450099923_ea12194f60_b.jpg,484.72,K
Ghosts Of The Future/2450097755_1f21a5ca91_b.jpg,468.98,K
Ghosts Of The Future/2450088603_6666073f76_b.jpg,452.64,K
Ghosts Of The Future/2457929443_a8f2216aef_b.jpg,447.05,K
Ghosts Of The Future/2450083397_87c5da13f1_b.jpg,433.23,K
Ghosts Of The Future/2450917260_3ab74e4615_b.jpg,430.15,K
Ghosts Of The Future/2458753634_8dee69d685_b.jpg,425.27,K
Ghosts Of The Future/2450092865_48116f84c1_b.jpg,418.69,K
Ghosts Of The Future/2458749342_85b09fbc5c_b.jpg,393.19,K
Ghosts Of The Future/2458751202_8c12fbb968_b.jpg,379.3,K
Ghosts Of The Future/2457934331_aa06ea6a43_b.jpg,362.68,K
Ghosts Of The Future/2457936787_f598da2311_b.jpg,358.26,K
Ghosts Of The Future/2450100613_6fb2e6fa06_b.jpg,352.56,K
Ghosts Of The Future/2450912846_f77eb53299_b.jpg,331.09,K
Portuguese Blues 12_/3390938204_9f382c6a28_b.jpg,319.68,K
Ghosts Of The Future/2450915874_3b2a8057e4_b.jpg,318.7,K
Ghosts Of The Future/2450910922_d6d35b231d_b.jpg,313.75,K
Leave Here A Stranger/R-658133-1174096883.jpeg,291.39,K
Talking Voice Vs. Singing Voice/3390938184_2bff319178_b.jpg,289.62,K
My Island/starflyer_59_my_island_2006_retail_cd-back.jpg,280.65,K
Leave Here A Stranger/R-658133-1174096903.jpeg,252.64,K
Leave Here A Stranger/R-658133-1174096916.jpeg,245.51,K
Leave Here A Stranger/R-658133-1174096949.jpeg,216.88,K
Ghosts Of The Future/R-1321063-1265234509.jpeg,213.01,K
Talking Voice Vs. Singing Voice/2973223916_68ed91081a_b.jpg,211.91,K
Ghosts Of The Future/2450085579_f983a3862a_b.jpg,200.55,K
Leave Here A Stranger/R-658133-1174096980.jpeg,198.1,K
Leave Here A Stranger/R-658133-1174096966.jpeg,180.73,K
Americana/R-590524-1344732204-7520.jpeg,179.66,K
My Island/starflyer_59_my_island_2006_retail_cd-cd.jpg,160.54,K
Leave Here A Stranger/R-658133-1174096933.jpeg,145.42,K
Americana/R-590524-1344732213-5856.jpeg,143.93,K
Gold/R-720588-1344700363-1125.jpeg,132.36,K
Gold/R-720588-1344700360-5378.jpeg,131.89,K
Americana/R-590524-1344732210-1066.jpeg,131.57,K
Americana/R-590524-1344732217-6691.jpeg,127.26,K
Americana/R-590524-1344732220-7474.jpeg,127.09,K
Gold/R-720588-1344700354-1296.jpeg,125.79,K
Gold/R-720588-1344700367-5544.jpeg,125.34,K
Gold/R-720588-1344700350-8389.jpeg,125.06,K
Gold/R-720588-1344700329-2599.jpeg,122.34,K
Gold/R-720588-1344700377-7690.jpeg,121.15,K
Gold/R-720588-1344700370-2013.jpeg,120.94,K
Gold/R-720588-1344700382-8610.jpeg,119.63,K
Gold/R-720588-1344700348-7834.jpeg,118.58,K
Gold/R-720588-1344700386-4482.jpeg,113.6,K
Gold/R-720588-1344700374-8215.jpeg,111.44,K
Talking Voice Vs. Singing Voice/R-899164-1348442342-2192.jpeg,110.64,K
Gold/R-720588-1344700357-4145.jpeg,108.94,K
Talking Voice Vs. Singing Voice/R-899164-1348442457-5228.jpeg,106.84,K
Americana/R-590524-1344732195-6876.jpeg,101.7,K
Americana/R-590524-1344732207-5070.jpeg,98.22,K
Ghosts Of The Future/R-1321063-1210264950.jpeg,96.27,K
Ghosts Of The Future/R-1321063-1210264675.jpeg,96.25,K
Ghosts Of The Future/R-1321063-1210264945.jpeg,96.25,K
Gold/R-720588-1344700341-7979.jpeg,95.23,K
Americana/R-590524-1344732200-5650.jpeg,91.98,K
Gold/R-720588-1344700415-3071.jpeg,91.73,K
Never Play Covers/R-1131786-1194626446.jpeg,90.06,K
Talking Voice Vs. Singing Voice/R-899164-1348442362-1860.jpeg,86.42,K
Plugged/R-1181430-1198881054.jpeg,85.44,K
Gold/R-720588-1344700337-1998.jpeg,84.76,K
Ghosts Of The Future/R-1321063-1210264869.jpeg,84.39,K
Ghosts Of The Future/R-1321063-1210264681.jpeg,82.92,K
Ghosts Of The Future/R-1321063-1210264595.jpeg,81.89,K
Ghosts Of The Future/R-1321063-1210264817.jpeg,81.54,K
Ghosts Of The Future/R-1321063-1210264695.jpeg,79.79,K
Talking Voice Vs. Singing Voice/R-899164-1348442351-8606.jpeg,78.72,K
Ghosts Of The Future/R-1321063-1210264575.jpeg,77.83,K
Ghosts Of The Future/R-1321063-1210264854.jpeg,77.49,K
Ghosts Of The Future/R-1321063-1210264746.jpeg,75.8,K
Ghosts Of The Future/R-1321063-1210264658.jpeg,75.51,K
Ghosts Of The Future/R-1321063-1210264959.jpeg,75.35,K
Ghosts Of The Future/R-1321063-1210264736.jpeg,75.18,K
Ghosts Of The Future/R-1321063-1210264822.jpeg,74.18,K
Ghosts Of The Future/R-1321063-1210264663.jpeg,73.16,K
Ghosts Of The Future/R-1321063-1210264582.jpeg,73.1,K
Ghosts Of The Future/R-1321063-1210264833.jpeg,72.84,K
Ghosts Of The Future/R-1321063-1210264601.jpeg,72.24,K
Ghosts Of The Future/R-1321063-1210264955.jpeg,71.05,K
Silver/R-372087-1342620921-5801.jpeg,69.6,K
Ghosts Of The Future/R-1321063-1210264875.jpeg,69.25,K
Ghosts Of The Future/R-1321063-1210264750.jpeg,67.83,K
Ghosts Of The Future/R-1321063-1210264859.jpeg,67.3,K
Ghosts Of The Future/R-1321063-1210264837.jpeg,67.24,K
Everybody Makes Mistakes/R-590525-1346117809-7773.jpeg,67.23,K
Everybody Makes Mistakes/R-590525-1346117972-9292.jpeg,60.87,K
Gold/R-720588-1344700418-6733.jpeg,57.54,K
Ghosts Of The Future/R-1321063-1210264636.jpeg,56.55,K
Ghosts Of The Future/R-1321063-1210264848.jpeg,55.46,K
Americana/R-590524-1344732198-3315.jpeg,54.56,K
Ghosts Of The Future/R-1321063-1210264864.jpeg,53.84,K
Ghosts Of The Future/R-1321063-1210264740.jpeg,53.53,K
Never Play Covers/R-1131786-1342022443-3702.jpeg,49.42,K
Silver/R-372087-1342620940-5615.jpeg,48.78,K
Ghosts Of The Future/R-1321063-1210264879.jpeg,47.61,K
Ghosts Of The Future/R-1321063-1210264827.jpeg,47.57,K
Ghosts Of The Future/R-1321063-1210264758.jpeg,46.77,K
Gold/R-720588-1344700333-2819.jpeg,46.05,K
Talking Voice Vs. Singing Voice/R-899164-1348442346-7095.jpeg,46.04,K
Talking Voice Vs. Singing Voice/R-899164-1348442348-7416.jpeg,46.04,K
Talking Voice Vs. Singing Voice/R-899164-1348442380-3604.jpeg,44.09,K
Ghosts Of The Future/R-1321063-1210264667.jpeg,43.22,K
Everybody Makes Mistakes/R-590525-1346117835-7546.jpeg,42.78,K
Ghosts Of The Future/R-1321063-1210264589.jpeg,42.42,K
Talking Voice Vs. Singing Voice/R-899164-1348442355-3350.jpeg,41.95,K
Ghosts Of The Future/R-1321063-1210264686.jpeg,40.46,K
Never Play Covers/R-1131786-1194626798.jpeg,40.35,K
Silver/R-908525-1326440658.jpeg,36.4,K
Silver/R-908525-1326440648.jpeg,29.85,K
Silver/R-908525-1326440664.jpeg,23.68,K
