Filename,Size,Unit
Tinker Bell Secret of the Wings (2012) PAL Multi DVDR-NLU002/Tinker Bell Secret of the Wings (2012) PAL Multi DVDR-NLU002.iso,4.36,G
Tinker Bell Secret of the Wings (2012) PAL Multi DVDR-NLU002.nfo,941,B
Torrent downloaded from AanMeHoelaJa Torrents on BTScene.eu.txt,71,B
Torrent downloaded from AhaShare.com.txt,58,B
Torrent Downloaded From BTScene.eu.txt,45,B
Torrent Downloaded from digtorrent.org.txt,184,B
Torrent Downloaded From ExtraTorrent.com.txt,353,B
Torrent downloaded from KAT.ph.txt,41,B
Torrent Downloaded from limetorrent.txt,50,B
Torrent downloaded from silvertorrent.org.txt,86,B
Torrent downloaded from thepiratebay.se.txt,50,B
tracked_by_h33t_com.txt,23,B
