Filename,Size,Unit
Perry Stone - Journey To The Underworld.avi,1.2,G
Shorts/The Last 12 Shepherds of Israel - Prophecies Converge upon 2012.avi,663.52,M
The Holy Spirit/Turn Your Eyes Upon Jesus with Lyrics - Vicky Beeching - YouTube.mp4,133.5,M
The Holy Spirit/Todd Agnew Letting Go with Lyrics.mp4,120.94,M
The Holy Spirit/The God Song.mp4,108.05,M
SIN-ister Clips/Rob Dew Interviews Mike Adams - Andrew Wordes SSRI drugs GMOs and more.flv,72.97,M
The Holy Spirit/The Passion  - YouTubef.flv,58.35,M
SIN-ister Clips/TheAntiTerrorist on Poisons for Profit Part 1 4 - YouTube.avi,55.48,M
The Holy Spirit/The LORD Will Provide - YouTube.mp4,52.21,M
Shorts/UFOs Around the SUN   the Solar Anvil Conspiracy Elohims Ruach Anunnakis Rua.flv,47.92,M
The Holy Spirit/THE END TIMES ARE NOW Biblical Historical Evidence  Mini Documentary and Study - YouTube.flv,47.89,M
SIN-ister Clips/Senator Lieberman demands prosecution of whistleblowers.flv,45.35,M
The Holy Spirit/I DONT KNOW WHAT YOU CAME TO DO - CFN.mp4,44.78,M
SIN-ister Clips/THE ACT OF 1871 THE TRUTH USA Inc.flv,40.07,M
Shorts/THE SPIRITUAL WAR IN POLITICS -- Zeph Daniel - YouTube.flv,39.5,M
The Holy Spirit/Our God Is Great - Medley - Everlasting Praise 3 - YouTube.flv,36.62,M
Shorts/UFOS Do YOU BELIEVE  - YouTube.webm,31.99,M
Signs of the Times/Cyber expert David Chalk on SMART GRID massive vulnerability Unsafe Power Grid 6-12.flv,26.3,M
Shorts/Stuff They Dont Want You to Know - The Nommo.flv,25.57,M
Signs of the Times/Installation of a Guardian Air REME Air Purification System.flv,22.4,M
Signs of the Times/Egypt   Israeli Ambassador says Middle East is now a Time Bomb for Turmoil 6-19-12.flv,21.64,M
SIN-ister Clips/Texas Drinking Water Makes Pipes And Plumbing Radioactive - YouTube.flv,18.88,M
The Holy Spirit/Today Is The Day - Everlating Praise 3 - Worship Video - YouTube.flv,17.83,M
SIN-ister Clips/The Euro Has Collapsed - Letter to Steve Quayle - YouTube.flv,17.7,M
SIN-ister Clips/UFO During Shinzhou-9 Launch - Extended - 6-16-12.flv,17.55,M
SIN-ister Clips/Suppose Tomorrow President Told IRS Not To Enforce Tax Laws For Certain Special People.flv,16.89,M
Signs of the Times/GAME OVER Fukushimas parting gift isnt Turtle Wax  Absurdity Today 6-20-12.flv,16.27,M
The Holy Spirit/The Good LORD.flv,15.11,M
Signs of the Times/Bioactive Chemical Turns Up On Money - YouTube.flv,15.02,M
Signs of the Times/N J Courthouse Evacuated Again Dozens Sickened - Local News 6-18-12.flv,14.93,M
"Shorts/Zombie Apocalypse  Cannibalistic attacks in Miami, and also in Canada and France - YouTube.webm",14.7,M
SIN-ister Clips/The Plan to Kick Greece Out of the Eurozone 6-16-12.flv,12.78,M
Shorts/Stewart A Swerdlow - Reptilian Hierarchy & The Staged Alien Invasion.flv,12.54,M
The Holy Spirit/The God Conscience Part - YouTube.flv,11.73,M
Signs of the Times/Deaths By Foreclosures Set To Rise - YouTube.flv,11.66,M
Signs of the Times/Meteor Sightings Ground Flights Reports From CO NM and KS 6-20-12.flv,11.28,M
Shorts/William Koenig reporting from the Hass Promenade in Jerusalem.flv,10.94,M
SIN-ister Clips/The Insects are watching  The future of Govt Surveillance Technology.flv,10.93,M
Signs of the Times/Bad Air Everywhere - Health Alerts - Suspicious Smog in Phoenix - 6-20-12.flv,10.78,M
Signs of the Times/How to Safely Detox Fluoride from your Body - YouTube.flv,10.55,M
Shorts/Zombie Attack Victim Ronald Poppo Recovery Assistance - YouTube.flv,10.25,M
SIN-ister Clips/Sandusky Sounds Like He Is Admitting To Abusing Children In Unaired Portion Of Interview.flv,10.11,M
Shorts/The Hammer of Death - YouTube.flv,9.78,M
The Holy Spirit/The Hammer of Death - YouTube.flv,9.78,M
Shorts/Zbigniew Brzezinski Admits Elite Concerned With The Massive Global Political Awakening.flv,8.98,M
Signs of the Times/Obama White House asserts Executive privilege in Holder case Fast And Furious President Cover-Up.flv,7.98,M
The Holy Spirit/While You Were Sleeping - YouTube.flv,7.87,M
Signs of the Times/America Gun Sales explode as Americans fear crackdown on 2nd Amendment 6-20-12.flv,7.14,M
SIN-ister Clips/Study  Vaccinated children have up to 500% more disease than unvaccinated children.flv,6.8,M
Signs of the Times/Google Yanks Hundreds Of Terrorist Videos At Request Of UK Govt.flv,6.59,M
Shorts/Worlds First Robot Prison Guard - YouTube.flv,5.79,M
The Holy Spirit/Walk with me - Caedmons Call - YouTube.flv,5.08,M
Shorts/Vision  Counterfeit Substitutes - YouTube.flv,3.54,M
Signs of the Times/HA-HA FLASHBACK   Obama attacks George Bush trying to hide behind Executive Privilege 3-19-07.flv,3.26,M
Shorts/Wake Up Satan is Coming - YouTube.flv,2.99,M
SIN-ister Clips/POLICE STATE USSA  3rd Grader Strip Searched At School Parents NOT Notified.flv,2.59,M
SIN-ister Clips/THE NSAs MISSION AND DOMESTIC INTELLIGENCE OPERATION.flv,1.63,M
POtHS - Why We Do What We Do.txt,7.89,K
Torrent downloaded from Demonoid.me.txt,47,B
Torrent downloaded from Conspiracyhub.com.txt,47,B
