User Type,Username,Date,Text
,LadyAngel324,2012-03-02T15:02Z,"I never have any issues with your stuff.  Thank you for always being so on point.  By any chance would you happen to have Mystery Trackers The Void?  
Thank you again!!!! (Lady Angel)"
,madrian88,2012-03-28T18:43Z,utorrent sez this contains malware?
,Hyugz,2012-03-29T20:25Z,i'm running win7 ultimate 64bit. can't get it to work. windows error. the game stopped working..
,sprained_mind,2012-04-06T19:38Z,"thanks for the game, downloaded and played for a while with no issues (win7) now that I want to re-open and keep playing only a black screen opens and nothing happens :/ what am I doing wrong?
thanks for the help"
