User Type,Username,Date,Text
,pm3003,2012-05-30T16:05Z,"It's boring, Lori comes back as a (half) zombie and makes out with eugene....

Great Job !!!"
,shonuffx,2012-05-30T16:25Z,Kewl! Thank you very much!
,kata1111,2012-05-30T16:39Z,Thank you!
,grimaudio,2012-05-30T22:07Z,Thank You!
,reesedawkins,2012-05-30T23:00Z,"Wow, that was messed!!! Especially when, Eugene started biting dicks off!!!!"
,ZombArt,2012-05-31T00:06Z,"Nice to see so much action, less preachy talk in this issue."
,MuserClair,2012-05-31T12:36Z,thanks :)
,toteto,2012-05-31T17:09Z,Nice scan. One of the shorter issues (at least in reading time).
,harry218,2012-06-03T19:49Z,"Thanks, looking good on tablet."
,stijr,2012-06-05T05:32Z,thanks!
,swe_simon,2012-06-09T00:05Z,"Plz! Stop with the fucking spoiling in the damn comments!
Nice scan tho, keep it up!"
,Juxhin_666,2012-06-14T18:34Z,Lame....Rick loses another hand and puts two chainsaws.
,Street_Disciple,2012-06-19T02:40Z,Any chance of posting Robert Kirkman's Astounding Wolfman from Image comics? I've had no luck finding it anywhere Thanks in advance
,eragon.rox,2012-06-19T07:46Z,Thanks a bunch! :)
,thadmacracken,2012-06-24T00:22Z,"Shut the fuck up pm3003, what are you 12 ? Thank you GH90."
