User Type,Username,Date,Text
,harrystrong,2012-04-06T22:53Z,stuck at 99%
,Peperepepere,2012-04-07T00:31Z,Can someone please seed stuck at 99.6%
,qmavi,2012-04-07T11:08Z,"Everyone is stuck at 99.6%
This must be FAKE"
,qmavi,2012-04-07T14:29Z,"If you are interested in this movie, download it from .Bone.
http://thepiratebay.se/torrent/7164362/Black_Gold_2011_BRRIP_XVID-WBZ"
,download021980,2012-04-08T13:37Z,or just skip the sample text file and it's fine.
,download021980,2012-04-08T13:38Z,or just skip the sample and text file and it's fine.
