User Type,Username,Date,Text
,dielec,2012-08-24T05:02Z,Thank you!!
,ChaRiisMuH,2012-08-24T05:54Z,please seeddddd!
,xXBKXx,2012-08-24T06:07Z,i hate mid season breaks
,ONT_Man,2012-08-24T06:56Z,"Would you scumbag leechers like to maybe oh, I don't know ... SEED!"
,shadowht,2012-08-24T07:19Z,whats wrong with u guys? seed this cmon!!
,tpbtemp00,2012-08-24T07:33Z,"lol, no kidding. I have this set personal law of myself to not stop seeding until I hit minimum 2.0. Last season here, good luck fellas."
,bjl7878,2012-08-26T03:47Z,this is def NOT the last season guy! 
