User Type,Username,Date,Text
[V],smbdownload,2012-03-06T01:08Z,rock on brothers and sisters ~ peace
,l214l,2012-03-06T01:51Z,"Thanks for the music.

I found your recent music wasn't seeding, forced me to figure out the magnet link aspect.  All good now."
[V],smbdownload,2012-03-06T02:23Z,"it appears that all the 'new' torrents will use this feature...took me a few myself :-)

enjoy "
,lex860,2012-03-06T04:28Z,"Hey Now,Mr smbd your killing me.I was hopeing to find some more dead,and you hit us with these cool jems.I had no idea Brian did any solo stuff.In no way am I dissapointed.Thanks agian.This kicks ass!! Lex"
,Flyfisher61,2012-03-06T06:24Z,Thanks!
[V],smbdownload,2012-03-11T04:10Z,"happy you are all enjoying :-)

~ peace"
