User Type,Username,Date,Text
,pir8s007,2012-08-23T18:10Z,"Hate these types of torrent, ""strategies"" or bla bla bla...."
,sakstroy,2012-08-23T18:49Z,"C'mon, its very easy: CONVERT, INFIDEL DOG OR DIE....  AND IF YOU CONVERT AND GO BACK TO BE A CHRISTIAN, DIE....  Barbarians, these ghastly towelheads...."
,pir8s007,2012-08-23T19:08Z,Read a little bit... Its full of shit!!!
,anakuper,2012-08-24T09:37Z,hey... its a good read.. dont u think ?
,rayquest9,2012-08-24T12:43Z,"guys
thinks is if u study their faith 
u will find shocking stuff and when u ask them 
they will be dumb and mute or perhaps try even to harm or kill u 

t"
,nedand,2012-08-29T00:02Z,Thanks!
