User Type,Username,Date,Text
[S],velvet.,2012-08-24T05:56Z,"Do not upload the same item more than once.
Your other upload of this has been deleted. "
,leo68monkey,2012-08-24T06:02Z,i need help i have done evrything i can but its not seeding when i try to download on another computer my torrent is seeding just not uploading can someone help please or can i send to someone to torrent for me
,leo68monkey,2012-08-24T06:07Z,"this is not seeding for me
maybe you would like to seed for me

if you want copy i will send it

leo68monkey@yahoo.com.au"
,leo68monkey,2012-08-24T07:35Z,"have fixed seeding problem please enjoy

let me know if you like

and i will try and add more"
