User Type,Username,Date,Text
,MrFinch,2012-11-16T12:30Z,"HDTV ?? jajajajajajaja

se ve asqueroso como de costumbre."
[V],furtaperas,2012-11-16T12:40Z,pues subilo tu y ya esta  
[V],furtaperas,2012-11-16T12:42Z,"la semana que biene  no lo subo  y ya esta 

fijate que sencillo  "
,MrFinch,2012-11-16T13:17Z,"xDDDD

Una cosa no tiene que ver con la otra, haz lo que quieras pero eso no quita que etiquetar esta basura como HDTV es una trola.
"
,MrFinch,2012-11-16T13:18Z,"Y si lo dejas de subir no hay problema.

mucha mas gente se baja El.Barco.S03E05.SPANiSH.PDTV.x264-PERCEPTiON porque saben que es correcto, no como lo tuyo."
[V],furtaperas,2012-11-16T14:16Z,"ok   pues ke se bajen ese ..  tambien lo podias haber bajado tu    y no bajar este  

no problema   no subo el barco aqui jamas "
,MrFinch,2012-11-16T14:39Z,A ver si es verdad o la semana que viene tengo que volver a decir la verdad sobre lo que subes :)
[V],furtaperas,2012-11-16T15:07Z,"unnnnnnnn   creo ke tu  tienes algun problema 

que no lo bajes   el mioooooooooo

ke lo bajes de otrooooooooooooooooooo

os que  no lees ????????"
[V],furtaperas,2012-11-16T15:17Z,mejor me callo  que estare mas guapo  
