User Type,Username,Date,Text
,lilley77,2012-03-13T19:18Z,Thanks for this! Could you possibly post E07? 
,azybuzza,2012-03-13T23:21Z,"@lilley77

Havent found ep. 7, will post it if/when it pops up."
,sunsetaznsf72,2012-03-14T04:19Z,"yes, please post s04e07. Thank U soooo much! for these episodes! "
,Pinkiesbrain,2012-03-14T05:50Z,Just wanted to add my thanks and agree we need E07! ;) 
,ladyemerald,2012-03-15T10:11Z,"Thanks very kind of you, you are the only one uploading this, really appreciate it! Wish you all the best!"
,sonicpossum,2012-03-17T03:00Z,"Thanks for the upload, really enjoy this show.
i have s04e07 and s04e09, can anyone tell me how to remove the drm and then ill upload. have tried Aimersoft but no luck."
