User Type,Username,Date,Text
,botcrawl,2012-06-22T10:17Z,Dude hell yeah thanks chicken foot
,The__dude21,2012-06-22T15:59Z,thank you so much for this !
,gUsttav__,2012-06-23T20:18Z,"Finally!!! Thank you so much for this man, been waiting for this for ever

lol, sorry if i my english is wrong, im brazilian"
,hippiekiller1977,2012-06-24T14:52Z,"awesome dude thanks for the upload
been waiting for season 2 for ages funniest show for a long time.

aussie version worth a look too.
if you missed it."
,Dew_Schbag,2012-06-27T07:23Z,shazbot !
