User Type,Username,Date,Text
,ct-punisher,2012-03-25T01:16Z,scene4all. zab judah fight tonight. u gonna be uploading it? thnx bro
,antrinum,2012-04-25T09:25Z,"Can u plz tell me whats the serial no. ,n how to instal this as I can't instal it following your instructions."
,tchristo,2012-08-19T19:59Z,Thank you! Am I missing something? Cant find the keygen?
,antonk999,2012-09-18T00:34Z,"The reason you may not be able to find the keygen is because it gets insta-killed by antivirus. Trojan.Graybird.

scene4all, nice software but it would be MUCH better without a backdoor TROJAN in it."
