User Type,Username,Date,Text
,kevlad,2012-09-18T23:41Z,please seed! Thank you.
,dontlikefake,2012-09-19T00:57Z,where are the seeders for this?? 8 seeders  i dont think so  there not even one seeder seeding
,dontlikefake,2012-09-19T01:03Z,come on seed this please
[V],Nepotu,2012-09-19T02:03Z,"It's not my fault. If the ripper don't seed I can't do anything. But patience and you'll be pleased. Sorry, for the moment, guyz!"
,DMilesB,2012-09-19T16:07Z,this is in english right? not russian.
,drew1972,2012-09-19T16:48Z,"Thank you so much for posting every UCL game on day 1.  Now if I could find someone like you who's posting English language versions, I'd be in business."
[V],Nepotu,2012-09-19T18:35Z,It's RUSSIAN. Sorry for the wrong description!
