User Type,Username,Date,Text
,szunyi77,2012-12-31T21:41Z,"This version also, like all 8289. Remains free after worthwhile updating with!
FAKE!"
,peppersgc,2013-01-01T15:31Z,"There is no such thing as a ""Premium Edition"". Fake. Fake. Fake."
,helldemonfiend,2013-01-07T08:02Z,Look at these couple morons.  Ive not installed this one yet but about to give it a go.  Yeah if you let the program update itself it will go back to free.  That's why you update from here fuckin retards
,helldemonfiend,2013-01-08T07:15Z,"This one is fishy though.  doesent install to iobit,  some other crap"
