User Type,Username,Date,Text
,babybluetits24,2012-10-25T02:55Z,what does open matte mean ?
,clorf01,2012-10-25T04:07Z,same question as babybluetits24
[V],BOZX,2012-10-25T04:47Z,http://en.wikipedia.org/wiki/Open_matte
,ofpirate,2012-10-25T06:30Z,"so, this is the left side of an SBS 3D source print..?"
,tyl3rdurd3n,2012-10-25T07:42Z,"Open matte means no black bars at the top and bottom of the picture. Unlike the previous versions which had the 2.35:1 aspect ratio, this is 1.78:1 and no this isn't stretched or cropped. It just includes more of the movie."
,Cubical,2012-10-25T17:06Z,Any chance of getting a 1080p of the open matte? Would be eternally grateful!
