User Type,Username,Date,Text
,Noddan-60,2012-02-16T22:24Z,Sorry a stupid head! But what should we use it to? Thanks to the preview for anyone who bothers to explain to me!!!!
,elasher,2012-04-26T23:31Z,"Because you don't know what the fuck it is you have to comment? stfu, go away"
,elasher,2012-04-26T23:32Z,"And none of what you just said makes any sense at all, learn to type, then learn to use a computer."
,dajmahaj,2012-05-03T07:05Z,Please seed!
,mibmib007,2012-06-08T11:28Z,seed u mofos
,Nameguy,2012-07-18T21:46Z,SEED YOU SONS O BITCHES!
,Nameguy,2012-07-18T21:47Z,"@Elasher: Don't harass Noddan, he clearly doesn't speak English."
,sisirTPB,2012-08-28T11:49Z,36 Leechers and not Seeders? Seriously? Please Seeed X(
