User Type,Username,Date,Text
[V],ThumperTM,2012-04-13T15:52Z,enjoy
,techneck,2012-04-13T15:55Z,"I will check it out,thank you."
,wasifmehmood,2012-04-13T21:00Z,its a fake software dnt wast ur time duds.nothing heppens when u hide ur ip via this
,pattyo41,2012-04-14T02:32Z,"good, thank you ThumperTM"
,wired2,2012-04-26T07:07Z,"Thanks for the up,

Kind of flaky, sometime works, sometimes does not hide the IP. Really slows down the browser."
,DACreech,2012-05-06T02:07Z,This was not an easy install.  I'm  not meaning to be harsh on the up loader. Maybe it's just different than what I'm use to.  And What's the deal with Ask.com being downloaded with this Torrent?  Just curious.
