User Type,Username,Date,Text
,Shadow Master,2012-08-03T03:40Z,Works great. Finally someone uploaded the beta (12 is already out now). Thanks.
,stratax,2012-08-04T09:07Z,thanks!
,FieroGT,2012-08-11T04:06Z,"need a new cracked ver!!!! the dam app went and forced an upgrade here, and now the crack is gone! need a new crack for ver 5.1 b20 or newer"
,fargoth123,2012-09-10T09:45Z,5.1.0.21 is out.
,knight39,2012-09-15T02:49Z,this and the other 5.2 version the crack has dissapeared everytime I download this....I dont know what I am supposed to disable to get the crack but Im getting frustrated!
