User Type,Username,Date,Text
,anon149,2012-09-18T16:12Z,What's the source of this?
[T],Gh0stNet,2012-09-18T16:18Z,my computer;D
,Bot001,2012-09-18T16:34Z,"Some chinese text file comes along with it. 
In either case, it seems to work."
,Diizzy,2012-09-18T16:35Z,Its working for me just no voices anyone have a fix for that?
,brnjk,2012-09-18T16:45Z,working but no npc voices
,Sslesar,2012-09-18T16:46Z,WORK!!!
,TripplePie,2012-09-18T16:48Z,Does this work with the STEAM UNLOCKED torrent?
,bonan2,2012-09-18T17:02Z,Confirmed working.
,bonan2,2012-09-18T17:03Z,Confirmed working
,khaetz,2012-09-18T17:12Z,Yeah the voices don't work for me either. Claptrap doesn't say anything in the beginning for instance.
,ethys,2012-09-18T17:38Z,"Is the ""no voice"" problem on the whole game or just on beginning ?"
,khaetz,2012-09-18T18:04Z,I'm guessing it's the whole game. Haven't played more than 10 minutes but so far neither the claptraps or the guardian angel or whatever she is called doesn't have any voices.
,sky69,2012-09-18T19:31Z,"Getting a procedure entry point CreateInterface could not be located in the dynamic library C:/Program files (x86)/Borderlands 2/Win32/steam_api.dll
Can anyone help"
,madlax10,2012-09-18T20:19Z,The no voice problem is an issue within the game release.  Not related to the crack.  Skidrow's release works fine.  The Steam releases don't have NPC voice.
,madlax10,2012-09-18T20:20Z,"OR, just download the sound files and put them in the proper folder.  That will also fix the NPC sound."
,phadeb,2012-09-18T23:06Z,"Same error as sky69

OS ?"
,Silinter,2012-09-19T01:11Z,"english sound files: http://thepiratebay.se/torrent/7649779/Borderlands_2_-_English_Sound_FILES

chances are you downloaded a borderlands install that has non english sound files (mine was spanish), but this'll fix it"
,sqad5,2012-09-19T01:15Z,"getting same error as the other 2
Getting a procedure entry point CreateInterface could not be located in the dynamic library C:/Program files (x86)/Borderlands 2/Win32/steam_api.dll"
,sqad5,2012-09-19T01:22Z,"Getting same error as sky
Getting a procedure entry point CreateInterface could not be located in the dynamic library C:/Program files (x86)/Borderlands 2/Win32/steam_api.dll"
,stanley2428,2012-09-19T05:19Z,"http://thepiratebay.se/torrent/7649779/Borderlands_2_-_English_Sound_FILES

For English sound files"
,BoxedUp,2012-09-19T08:35Z,This works great no issues whatsoever on an I7 560m lappy maxed out. get the sound file as stated above and its every bit as good as the paid version. AND NO IT DOES NOT WORK ONLINE FOR THE FUCKTARDS THAT WILL ASK THE QUESTION!
,Xphome,2012-09-19T16:10Z,"Getting the same error as the other 3
Getting a procedure entry point CreateInterface could not be located in the dynamic library C:/Program files (x86)/Borderlands 2/Win32/steam_api.dll "
,debugman18,2012-09-19T16:35Z,Getting the steam_api.dll error. I've solved it before but now I forget...
,MrPete1985,2012-09-19T17:44Z,This crack worked for me
,lucky70,2012-09-19T18:41Z,thank you
,Revilo62,2012-09-19T19:36Z,"@BoxedUp It's not a stupid question to ask whether it works online, don't be such an ass. The first Borderlands worked online just as if it was a paid version, the company didn't want to fuck real owners over by adding a stupid DRM. I'm honestly surprised that they didn't do the same again. "
,XchaosXhazeX,2012-09-20T00:16Z,"http://thepiratebay.se/torrent/7653743/Borderlands_2_Windows_8_Fix

Tested + Working crack on Windows 8 x64 Pro.

I tried all the other cracks (skidrow fix+3dm)."
,KoaLARP,2012-09-20T00:25Z,"fixed everything for me.i have the full english audio,get skillpoints and everything works fine so far (level 11 assasin)
did it with the skidrow version just so you know.cheers mates."
,tops.c,2012-09-20T08:09Z,"This crack works win7 32bit, and you can play online with Tunngle, sweet."
,tacostand122,2012-09-20T16:25Z,"I keep getting BSOD when I run the game....
Idk why it does this with fucking steam crack games.

Can anyone help?
Specs:

Ibuypower
Window's 7 Premium
AMD FX(tm) 8120 Eight-Core Processor,3.10GHz 
8gb of ram
64bit
Amd Radeon HD 6800 series."
,bunnineeds,2012-09-20T20:00Z,doesn't work for me. it's already stuck for 10 mins at loading screen.
[T],3R01,2012-09-20T22:29Z,"Thnx man, this worked for me with Skidrow version :D"
,kcfunnthesun,2012-09-21T00:05Z,guys till downloading m stuck at 96.6 % someone pls seeed only for some time no after that i will seed for sure !!!
,urretado,2012-09-21T12:26Z,"Skidrow's crack won't even start with me.
3DM starts but randomly freezes/crashes the game.
I still haven't managed to start a new game, since it keeps freezing after showing the intro
Plus, if I try to alt-tab, it also freezes

Win 7 32bit"
,tops.c,2012-09-21T14:18Z,"I used another torrent, this crack works great Win7 32bit.

Borderlands 2 ENG torrent name."
,zerilo,2012-09-22T00:34Z,Can anyone walk me thru on what the fuck to do to play it . what to i paste the copied files into ? do i need to download Borderlands SKIDROW ect .  dont judge im a girl and blonde ;)
,Mcc100,2012-09-22T00:37Z,It works like a charm!!! Thanks a lot
,Neowarex,2012-09-22T01:39Z,"Test comment since it gives database error and i wanna rule out the """""
,Neowarex,2012-09-22T01:40Z,"To zerilo and others having issues:

1 - Copy the files in the crack to :

C:Program Files (x86)2K GamesGearbox SoftwareBorderlands 2BinariesWin32

or wherever you have the game installed to.

2- Edit the 3DMGame.ini file and change the line PlayerName ="""" to PlayerName =""YOURPLAYERNAME"" (with quotes)

3-Play !"
,Neowarex,2012-09-22T01:47Z,"3.1-If you want to play online go to 
tunngle and download Tunngle and create an account.

3.2-Follow the instructions at :
tunngle wiki for Borderlands_2 to find out how to configure everything.

Post here if you need more help but with this release and those instructions we've been playing online for many hours without any issues. Make sure to open port UDP 11155 on your firewall and router.

Thanks again for the crack Gh0stNet !"
,zerilo,2012-09-22T03:47Z,Neowarex very much appreciated ! but i do have to have the skidrow (full game ) torrent correct ?
,sasafurian,2012-09-22T10:04Z,@tacostand122 / dude same thing happened to me . once i pase properly the crack from skidrow i got the blue screen. and i restart . try open the game again and nothing happens. i will try this crack now 
,sasafurian,2012-09-22T10:16Z,This crack does not work for me. Restarts my PC when i start the game. ( WIN7 Ultimate 64bit/ AMD 6cores /4gbddr3 / GF550Ti ) 
,Tribalstyler,2012-09-23T01:14Z,"Worked like a charm. @ Neowarex thanks, did everything said and no problemo"
,buttonsswcb,2012-09-23T02:43Z,"the game works fine for me, BUT..im level 4 and i still have not got skill points. any ideas on how to fix?"
,nacothetaco,2012-09-23T06:41Z,"Use this guys http://steam-games-free.com/?i=BLCPqbHxc 

I just got a premium edition through steam free games, no joke. Check it out"
,kayman1979,2012-09-23T07:09Z,"if we all click on each others links, we'll all get the game for free. lol

http://steam-games-free.com/?i=lvUboi4sd"
,marcin252,2012-09-23T10:38Z,"10:28 You see 25 empty potion flasks.
They weigh 40.00 oz.
Return it to a potion store for your deposit."
,pomipomi,2012-09-24T05:13Z,"I can't get the game to run. Everytime I start it it does nothing. And when I try to change the username in the 3dmgame.ini I get ""access denied"" when I try to save the changes.
I downloaded the skidrow version, and it's crack did the same thing, I haven't tried installing steam yet"
,dardanelles,2012-09-24T07:12Z,"MULTIPLAYER DOESN'T WORK!!!!

http://getborderlands2.com/?q=pmGjlprne

Click mine to get real version and I'll click yours!"
,lolindir356,2012-09-24T12:43Z,"for those having problem to launch it, you have to have steam installed. you dont have to run it."
,abet17,2012-09-24T13:59Z,Thanks....
,rupelto,2012-09-25T05:38Z,Thank You
,Sparkyau,2012-09-25T06:20Z,"thank you so much!!!!!!!!! this made it work!!!!!!!!!!!11


:DDDD"
,Darkfirebird,2012-09-25T08:35Z,"To those that believe they will get the game for free from some ref link.

answers.yahoo.com/question/index?qid=20120606100403AAA0fWz

Its just a scam anyways. Have fun."
,miodrag2005l,2012-09-25T20:22Z,this crack is OK! respect Gh0stNet
,Yasume12,2012-09-27T16:50Z,"Tested and not working, it opens up steam and ask you to buy the game. "
,p5yk0tik,2012-09-27T22:49Z,"Thanks Gh0stNet ! This crack resolved the game not running for me!

I used the Skidrow release of BL2 and even after update 1, it just would not load - only the language selection tool, and the config tool would work. I had performed the crack and firewall operations correctly, and run BL2 as Admin, but to no avail.. After using this crack, however, it loads just fine. 

I'm looking forward to some gameplay after many hours of head-scratching trying to get the game to run at all. 


@lolindir356: I have not got Steam installed at all, so thats not a requirement"
,Marikhen,2012-09-28T01:35Z,"This crack works just fine without Steam.  It's why I'm using it instead of one of the Skidrow updates.  The only issues I see that might be put on the crack are that there is some stuttering in a couple of the early areas of the game where every 2-3 seconds my game freezes for a split second.

Still, I'll take that over a Steam crack that requires you to have Steam installed anyways.  Never saw the point in having Steam on my PC, and I see even less point in installing it just so a ""Steam crack"" will work."
,likeitis69,2012-09-28T06:07Z,"GETTING THE DX9 ""CRASH AFTER A FEW MINUTES"" UNREAL ENGINE BUG?

(D3DERR_DRIVERINTERNALERROR, video stops, sound continues)

Here's how to get around it:
Edit ""my games/Borderlands 2/WillowGame/config/WillowEngine.ini"" line 219, change False to True:

[Engine.ISVHacks]
bInitializeShadersOnDemand=True"
,lichy1986,2012-09-28T19:35Z,"Thanks a lot to you. It works now. Thanks again.
For users: Remember to seed.
Have fun with this amazing game."
,piraatbreker,2012-09-29T08:51Z,"wow this fix is working thanks 
to 3DM and to Gh0stNet ;-)"
,jihadinhorocks,2012-09-30T20:32Z,thank you so much this really worked :D
,Masimotinava1,2012-10-01T00:16Z,"Borderlands 2 trainer/cheat/hack

answers.yahoo.com/question/index?qid=20120928152726AAuzEty

Awesome stuff guys!!!!"
,Hotair10,2012-10-04T09:28Z,Will this work if I have updates 1-3 installed? Or is this only for a clean version of Borderlands 2?
