User Type,Username,Date,Text
,gothix12,2012-11-26T22:05Z,Confirmed to be working with no problems thank you
,yee2,2012-11-27T17:56Z,"Can you do scribblenauts unlimited plz
Ty for the torrent BTW"
[T],mbtorrents,2012-11-27T21:03Z,"U're welcome yee2.. here is ur Scribblenauts Unlimited which is already uploaded by a VIP:

https://thepiratebay.se/torrent/7847575/Scribblenauts.Unlimited-SKIDROW"
,Bean-Bandit,2012-12-01T03:02Z,Is this 3.5.7 or 3.5.9? The torrent title says 3.5.9 and yet your talking about 3.5.7
