Filename,Size,Unit
CD THREE/24-Bass Is Heavy (we're having a real good time).flac,87.95,M
CD TWO/12-Punky reggae party  (London Mastermix Single Tracked).flac,54.09,M
CD FIVE/44-Sittin In The Park.flac,54.05,M
CD ONE/10-Iron Lion Zion (Hometown Mix).flac,53.25,M
CD FOUR/31-Lord Sent Me From Zion (jad 68 acoustic).flac,53.03,M
CD SIX/57-Lord Sent Me From Zion.flac,53.03,M
CD TEN/96-Get up Stand up (live buffalo ny 78) SR Version.flac,45.66,M
CD THREE/21-Pomps & Pride ( acoustic ).flac,45.52,M
CD SIX/58-Son Of A Gun.flac,40.83,M
CD FIVE/45-Roots Natty Roots alt drumbass mix.flac,36.76,M
CD FOUR/35-Babylon Shystem Demo (SR Version).flac,35.9,M
CD TEN/98-get up stand up (life is your right).flac,34.21,M
CD NINE/85-Soul Rebel (JAD acoustic demo).wav,32.51,M
CD ONE/02-Legalize it (binghi bongo version).flac,31.9,M
CD SIX/52-Could You Be Loved (TGR 79 Session).flac,31.46,M
CD FOUR/30-Set My Night On Fire (jad 68 acoustic full take).flac,28.14,M
CD SIX/54-Rat Race (Dub Plate Special).flac,25.09,M
CD ONE/01-Exodus (acapella).flac,24.75,M
CD ONE/03-Rainbow country  (dubplate).flac,24.74,M
CD TWO/19-Jah Live (s.o.t special mix).flac,24.59,M
CD FOUR/40-She's gone Dub-Blackwell Dubs.flac,24.38,M
CD THREE/26-Let Jah Be Praised (prev. unreleased ShaJahShoka dubplate version).flac,23.83,M
CD SIX/59-Butterfly.flac,23.24,M
CD SEVEN/66-Shocks Almighty - Dub Plate original.flac,22.88,M
CD TEN/95-Bucking Hamm Palace (live pink pop 79).flac,22.48,M
CD NINE/89-African Herbsman (new mix).flac,22.34,M
CD THREE/28-I Ask Myself (jad 68 single).flac,22.22,M
CD NINE/83-Man To Man - (Sufferers Mix).flac,22.15,M
CD FOUR/38-Caution(jad 68 acoustic).flac,22.08,M
CD SIX/60-Ambush In The Night (Dub Plate Special).flac,21.58,M
CD TEN/90-Don't Rock The Boat.flac,21.19,M
CD SEVEN/68-Don't Rock My Boat - vocal mix.flac,21.02,M
CD EIGHT/78-Lonesome Feeling.flac,20.77,M
CD TEN/92-Naural Mystic.flac,20.61,M
CD SIX/53-Slogans Possibly Same Session [unknown instrumental 1979].flac,20.51,M
CD THREE/25-Man´s Greatest Adventure (aka Apollo 11) (SR Edit).flac,20.43,M
CD ONE/08-Satisfaction (7inch vinyle).flac,20.07,M
CD EIGHT/76-I Like It Like That.flac,19.96,M
CD SEVEN/63-How Many Times - Dubplate Special.flac,19.67,M
CD TWO/17-Hooligan Alternate  (7inch vinyle).flac,19.43,M
CD SIX/55-You make me feel alright.flac,19.15,M
CD EIGHT/77-Hold Onto This Feeling - Dub Plate Pressure.flac,18.63,M
CD TWO/18-Love Wont Be Mine Today Alternate  (7inch vinyle).flac,18.63,M
CD NINE/86-Music Gonna Teach version.flac,17.73,M
CD NINE/88-I'm Still Wailing.flac,17.39,M
CD TEN/91-I Stand Alone.flac,17.06,M
CD FOUR/39-The World Is Changing take 2.flac,16.91,M
CD SEVEN/70-Milk Shake & Potato Ships.flac,16.3,M
CD ONE/09-Misty morning (dubplate).flac,15.95,M
CD ONE/04-Rainbow country (dubplate version).flac,15.95,M
CD SEVEN/62-A Little Prayer.flac,15.88,M
CD ONE/07-King street (7inch vinyle).flac,15.63,M
CD TWO/16-Jump Nyabinghi (sr clean demo).flac,15.62,M
CD TWO/15-Rude Boy Prayer  (7inch vinyle).flac,15.48,M
CD FIVE/41-You talk Too Much.flac,15.14,M
CD SEVEN/69-It Hurts To Be Alone.flac,15.12,M
CD TEN/100-One Love Version (1981 overdubbed).flac,14.99,M
CD EIGHT/73-Pass It On.flac,14.95,M
CD TWO/13-Want more (dubplate).flac,14.88,M
CD EIGHT/71-Mellow Skank.flac,14.75,M
CD EIGHT/75-Why Should I.flac,14.73,M
CD EIGHT/72-Pass It On version.flac,14.6,M
CD NINE/81-Screw face Pablo - Dub Plate special.flac,13.78,M
CD TWO/14-War (dubplate).flac,13.57,M
CD EIGHT/74-Why Should I version.flac,13.41,M
CD NINE/85-Soul Rebel (JAD acoustic demo).flac,13.33,M
CD TWO/16-Play Boy Alternate  (7inch vinyle).flac,13.16,M
CD EIGHT/80-Hammer - alternate mix.flac,13.13,M
CD SEVEN/67-Nice Time version.flac,13.1,M
CD TWO/11-In The Laah (in the hour with the the wailers).flac,12.57,M
CD NINE/87-Hold On To This Feeling version.flac,12.55,M
CD FIVE/48-Do It Twice Version.flac,12.36,M
CD FIVE/47-Cheer Up Version.flac,11.79,M
CD NINE/82-Man To Man - Dub Plate Pressure (74).flac,11.73,M
CD FIVE/50-Legalize It Version (Long Version).flac,11.63,M
CD FOUR/33-Wings Of A Dove (i need your love so much).flac,11.33,M
CD TEN/97-Oh Lord I Got Too Get There (jad mix).flac,11.25,M
CD EIGHT/79-Comma Comma.flac,11.17,M
CD NINE/85-Redder Than Red - Dub Plate Mix (72).flac,10.93,M
CD SEVEN/65-Turn Me Loose bongo version.flac,10.7,M
CD NINE/84-Craven A - Dub Plate Mix.flac,10.62,M
CD FOUR/32-Because I Love You (jad 68 acoustic).flac,10.58,M
CD SEVEN/61-Soul Shakedown Party Version.flac,10.49,M
CD SEVEN/64-One Love True Love (SR Remastered Demo).flac,10.28,M
CD TEN/94-Here Comes The Sun Version.flac,10.05,M
CD SIX/51-Well Bred (a.k.a. Wellbread) (tosh).flac,10,M
CD ONE/07-Don´t Care What The People Say (The Soulettes & Peter Tosh).flac,9.66,M
CD ONE/06-White christmas (duel over dubbing).flac,9.12,M
CD SIX/56-Lemon Tree.flac,9.09,M
CD FOUR/36-Eleanor Rigby Instrumental jam(jad 68 acoustic).flac,9.07,M
CD FIVE/42-Kaya Duplate.flac,8.57,M
CD THREE/22-Lick it & Pack It (68 jad excerpt).flac,8.57,M
CD THREE/27-Whistling Jane (excerpt).flac,8.29,M
CD TEN/99-Toughest Version (1981 overdubbed).flac,8.17,M
CD TEN/93-Leave My Buisness Version.flac,7.95,M
CD FIVE/43-Sun Is Shining Alternate Dubplate Take.flac,7.86,M
CD THREE/29-Babylon Queendom (randy's 1976).flac,6.7,M
CD THREE/23-Bright Sun Shine Day's (jad 68 acoustic excerpt).flac,6.25,M
CD FOUR/34-And I Love Her (original) (7inch vinyle).flac,6.22,M
CD ONE/05-Dont rock my boat (live dj).flac,4.33,M
CD THREE/20-Russian invasion (drumbox demo).flac,2.52,M
CD FIVE/49-Peter Tosh Advert.flac,2.42,M
CD FIVE/46-Sitting Parc s.o.t Radio Aceppla Excerpt 1980.flac,1.43,M
10set.PNG,166.84,K
MARLEY & TOSH-ALTrnate mixs & dubplates & rareities s.o.t sellection.sfv,15,K
MARLEY & TOSH-ALTrnate mixs & dubplates & rareities s.o.t sellection.st5,10.22,K
MARLEY & TOSH-ALTrnate mixs & dubplates & rareities s.o.t sellection.ffp,8.78,K
MARLEY & TOSH-ALTrnate mixs & dubplates & rareities s.o.t sellection.md5,8.77,K
Marley & Tosh-Alternate Mixs & Dubplates & Rareities s.o.t Sellection 10 Cd Set List.txt,3.98,K
CD THREE/CD THREE.md5,823,B
CD ONE/CD ONE.md5,823,B
CD FOUR/CD FOUR.md5,807,B
CD TEN/CD TEN.md5,807,B
CD TWO/CD TWO.md5,779,B
CD NINE/CD NINE.md5,729,B
CD SIX/CD SIX.md5,711,B
CD SEVEN/CD SEVEN.md5,710,B
CD FIVE/CD FIVE.md5,690,B
CD EIGHT/CD EIGHT.md5,623,B
Torrent downloaded from VeryRare.org.txt,47,B
