User Type,Username,Date,Text
[V],promodsharma,2012-12-23T18:15Z,Thanks for the Up - works great !
[T],Tyr3ll,2013-01-03T12:16Z,glad for you so and happy new year 2013 as well.
,j-lp,2013-01-07T21:40Z,"I never get it to work, let's try one more time ;D

I would even pay for the program but it's really expensive"
,j-lp,2013-01-08T20:22Z,"Mother of god... it works!

Just install, reboot, close program from system tray and copy that .dll file from the ''Activator'' folder and you're set. 

No need to patch it."
[T],Tyr3ll,2013-01-09T15:01Z,"Exactly bud,normaly there's no need to patch it,however it is provided as additional extra helping for certain specific scenarios or circumstances ;)
enjoy"
