User Type,Username,Date,Text
,keirts,2012-02-29T05:18Z,tenks
,visionofpain,2012-02-29T06:06Z,how comes its not showing the link to D/L it when i click on get this torrent its blank
,Stargate4ever,2012-02-29T09:26Z,How can I download the torrent ? There's no Download button just something magnet thing... !!????
,TGMurdoc,2012-02-29T20:20Z,"@Stargate4ever and @visionofpain  If you aren't used to magnet files, most torrent programs like uTorrent can use magnet links. When the file downloads or prompts to use a program select your torrent program."
,synnr2012,2012-02-29T20:33Z,"there isnt even a prompt to dl...i click ""get this torrent"" and absolutely nothing happens lol"
,Dorell,2012-03-01T01:35Z,Just use 1337x. org .
