User Type,Username,Date,Text
[V],sujaidr,2012-06-08T22:22Z,"i have included a sample,so you could check for quality :-) ENJOY

i dont have a seed box so i'll provide maximum initial seeding but for the torrent to be alive please seed back too"
,B.Torrents,2012-06-09T05:57Z,Thanks for the Rip.
,Milo4ka,2012-06-10T04:21Z,"A-10
V-10
like always! 
Thank you soooo much!"
,fakeidmuhammad,2012-06-29T01:04Z,"I registered just to be able to thank you for so many tiny files & excellent quality movies. Somebody should build a virtual statue of you  - 1/10 scale, of course. (I also like the way you include proper subtitles - not the machine translated ones. Great for ESL students!)"
