User Type,Username,Date,Text
,MickCt75,2012-02-20T03:50Z,Thanks
,MickCt75,2012-02-20T03:58Z,Still Waiting For Dl To Start - 3 Hours Later
,MickCt75,2012-02-20T06:50Z,{Stay Away From This Torrent} 10 Leechers Ate The Greedy Bug.I Actually Had It Waiting For 5 Hours.....Complete Waste Of Time
,The4076,2012-02-20T07:29Z,"Sorry guys, my computer crashed at home after I started the torrent and I can't get back home for a few days. I'm going to kill this one to end the frustration. 

I'll get it back up when I return. "
,bongojiing,2012-02-20T16:08Z,Please please upload as there are books in this torrent i have been looking for for years
,Crowed,2012-04-04T17:01Z,"LOVE MOBI...

I'll be watching for you to put this back up.

Thanx for your efforts"
