User Type,Username,Date,Text
,gaurav900,2012-07-11T15:01Z,"@@ SAM BRO.

Thanks for your uploads ( 27 down, suraj ka satva ghoda , Duvidha, angoor , and many more ) Thanks for uploading all of these rare in DVD form .

Could u please fulfill my one request its about ""tunnu ki tina"" which just came out in DVD. Could u plz make that available to us.

THanks in advance and will wait for some more rare gems ( Art Cinema ) "
,sherjeel,2012-07-11T18:41Z,Sam plZ man upload TASHAN... I'll be veery thankful to u...:)
,aegan026,2012-07-13T10:52Z,"Can u plzzzz do Sholay and Bobby?
U are doing an excellent job thanks"
