User Type,Username,Date,Text
,BlueTak,2012-04-01T16:56Z,"Top work, once again. "
[T],tr108,2012-04-01T18:33Z,"Thanks, BlueTak"
,karimbaraka,2012-04-01T22:03Z,"Thanks keep up the 1080p
thanks again :)"
,geup15,2012-04-02T07:03Z,"Can you do Rum Diary!!!
And every disney movie.
=]
The last now might be a bit too much to ask, but RUM DIARY!!!"
,fede_2890,2012-04-02T22:38Z,"Hi tr108, it's me again!
Can you give me your preset for 1080p rip? Thansk! 

You're the best!"
[T],tr108,2012-04-07T21:09Z,"fede- once I get a reasonable preset going - my 1080 ups have been all over the place in the terms of settings, I'll share a 1080p preset."
