User Type,Username,Date,Text
,seed2all,2012-09-11T10:21Z,"i don't think that this would a good quality 400mb for a 2 hr 20 min show is mot good 

i'll go with scene4all
and will you upload wwe night of champions in hq"
[T],bzingaz,2012-09-11T11:05Z,this is for those who have low bandwidth..i will upload night of champions in same low sized version..many people upload hq u can get that from them..
,captnick2,2012-09-11T19:12Z,thanx man!!!
,RockySuja,2012-09-20T18:59Z,hey bzingaz..i was a big fan of yours..i prefer your torrenz than Scene4all...small size but still watchable..and i've been waiting for you to upload Raw of this week for three days now and i'm disappointed because i can't seem to find it...Please do upload Raw of this week!
