Filename,Size,Unit
covers/Ass Break Hotel DVD1.jpg,113.6,K
"_____padding_file_0_if you see this file, please update to BitComet 0.85 or above____",142.4,K
covers/Ass Break Hotel DVD2.jpg,109.7,K
"_____padding_file_1_if you see this file, please update to BitComet 0.85 or above____",146.3,K
covers/Ass Break Hotel DVD3.jpg,212.82,K
"_____padding_file_2_if you see this file, please update to BitComet 0.85 or above____",43.18,K
dvd/Ass Break Hotel DVD.avi,805.71,M
"_____padding_file_3_if you see this file, please update to BitComet 0.85 or above____",43.82,K
Ass Break Hotel DVD.docx,1.15,M
