User Type,Username,Date,Text
,mariodz,2012-04-27T10:22Z,multiplayer ?
,PLCpunk,2012-05-06T18:23Z,Seed Please!!!!
,jegerfrek,2012-06-01T21:59Z,can sombody pls seed?? thank you 
,jojo19001,2012-06-10T23:49Z,i need a seeder so i can download it then i would seed it....
,PP2000,2012-06-15T18:26Z,Fuck we need more SEEDERS!!!
,Tdaug1996,2012-07-02T18:48Z,"i don't know how to seed.  if i did, i would."
,drabie22,2012-07-29T16:33Z,"Seed, please, the download is very sloww(k*rva lassan jรถn :/ )"
,Fredioz,2012-08-17T20:04Z,To seed just let the damn torrent keep running people. CANT YOU READ WHAT IT SAYS THERE WHEN IT FINISHES DOWNLOADING FOR FUCKS SAKE?!
