User Type,Username,Date,Text
[V],HighCode,2012-11-10T01:41Z,"Lol, it seems this is the only extended version, everybody else left out the scene after credits ;-)
Not a big deal, it's only half a minute."
[V],HighCode,2012-11-10T09:06Z,"The only way to decode TrueHD 7.1 was with dvdfab to wav 5.1. Then encoded the wav to DTS but it sounded inferior to the DD-5.1 640. 
So I added then the Dolby track. 
Don't worry, it's crispy and loud. "
,irfan214,2012-11-14T04:55Z,"thanks , i am downloading it ."
