User Type,Username,Date,Text
,Shizty,2012-04-27T00:05Z,"Could u put up ""think like a man cause ur torrents are the best but dont just repost cause the ones that are up have bad audio!!"
,onett_home,2012-04-29T09:02Z,How on earth is this file over three and a half gigabytes?
,amnios,2012-04-30T04:30Z,"Do not download this piece of garbage.  Way way too dark and at the end when they go to explain the whole thing the audio is messed up.

A/1
V/2"
,SnowLVL100,2012-05-18T03:00Z,NOT WORTH IT!!
,tflagger997,2012-05-23T17:47Z,"""How on earth is this file over three and a half gigabytes? ""

It is because some 'people' think that large file size = good.  
What they do not pay attention to, is that stretching actually degrades the picture quality.  So ANY TS -> DVD will be CRAP just based on the file size alone.  It is NEVER DVD quality, just DVD size.

So much for the green skulls actually meaning anything..."
,dj-mopa,2012-07-20T05:03Z,"sorry, but the quality is poor.... I would wait till another version is uploaded."
,shoulderbrah,2012-08-04T21:31Z,"I cant watch this there is a folder called video_ts  but i cant reproduce nothing  please help!



sorry for my english its not my first language!"
,shoulderbrah,2012-08-04T21:35Z,"i can't watch this  help !! please there is a folder called video_ts but i can't watch anything

thanks in adavanced


sorry for my english i´ts not my first language"
