Filename,Size,Unit
The Curse v1.0.2 Final By bobiras2009.apk,36.89,M
Pudding Camera 2.3.0 Final By bobiras2009.apk,17.05,M
Instagram v3.1.0 Final By bobiras2009.apk,14.01,M
Galaxy S3 Apex Theme v2.0 Final By bobiras2009.apk,13.53,M
RealPlayer® Premium v1.1.1.0 Final By bobiras2009.apk,11.79,M
PhotoViva v2.07 Final By bobiras2009.apk,10.25,M
Camera360 Ultimate v3.8 build 198 Final By bobiras2009.apk,8.7,M
VidTrim Pro - Video Editor v2.0.15 Final By bobiras2009.apk,8.52,M
CM10AOKP Theme MURDER v2.0.0.1 Final By bobiras2009.apk,7.78,M
Olive Office Premium v1.0.75 Final By bobiras2009.apk,7.68,M
GO SMS Pro 4.65 Final By bobiras2009.apk,6.99,M
Viber Free Calls & Messages 2.2.3.108 Final By bobiras2009.apk,6.97,M
JEFIT Pro - Workout & Fitness v4.3.0927 Final By bobiras2009.apk,6.86,M
Jelly Bean Keyboard PRO v1.7.7 Final By bobiras2009.apk,6.63,M
iCircuit v1.5 Final By bobiras2009.apk,6.56,M
File Expert Pro v5.0.0 build 171 Final By bobiras2009.apk,6.47,M
MiHome Launcher v1.7.0 Final By bobiras2009.apk,6.35,M
CM9 CM10 AOKP THEME POPSTYLE v1.3.2 Final By bobiras2009.apk,6.13,M
YouTube v4.1.23 Final By bobiras2009.apk,6.02,M
OruxMaps Donate v4.8.61 Final By bobiras2009.apk,5.54,M
Titanium Backup Pro 5.6.0 Final By bobiras2009.apk,5.5,M
GO Keyboard 1.9.0 Final By bobiras2009.apk,5.16,M
Weather Station v2.0.0 Final By bobiras2009.apk,4.79,M
360 Launcher‎ v3.6 Final By bobiras2009.apk,4.77,M
ASTRO File Manager  Browser Pro v4.0.428 Final By bobiras2009.apk,4.64,M
Radardroid Pro v2.56 Final By bobiras2009.apk,4.53,M
KITT Voice Box & Speedometer v1.24 Final By bobiras2009.apk,4.43,M
One More Clock Widget v1.3.6 Final By bobiras2009.apk,4.38,M
Ozean Alive Video Wallpapers + v1.0.1 Final By bobiras2009.apk,4.19,M
SketchBook Mobile v1.5.2 Final By bobiras2009.apk,4.06,M
PowerAMP FULL v2.0.7-build-512a + Widget PackClassic Skin By bobiras2009/PowerAMP FULL v2.0.7-build-512a Final By bobiras2009.apk,4.03,M
JellyBean Theme for GOlauncher v1.0.0 Final By bobiras2009.apk,3.94,M
Lapse It Pro • Time Lapse v3.1.0 Final By bobiras2009.apk,3.81,M
Springpad 3.2.1 Final By bobiras2009.apk,3.52,M
Beautiful Battery Disc Premium v1.1.3 Final By bobiras2009/Beautiful Battery Disc Premium v1.1.3 Final By bobiras2009.apk,3.48,M
Bead GO LauncherEX Theme v1.0 Final By bobiras2009.apk,3.39,M
Circle Apex Theme v1.01 Final By bobiras2009.apk,3.25,M
GO Launcher HD for Pad 1.17 Final By bobiras2009.apk,3.24,M
CaroO Pro Driving Recorder v1.1.2 Final By bobiras2009.apk,3.09,M
Battery Widget Reborn! Pro v1.0.17 PRO Final By bobiras2009.apk,2.85,M
Zodiac GO Launcher 12 Walls v1.0 Final By bobiras2009.apk,2.75,M
AVStreamer - Remote Desktop HD v1.05 Final By bobiras2009.apk,2.64,M
Launcher 7 - Donate v1.1.14.15 Final By bobiras2009.apk,2.56,M
Full Screen Caller ID PRO v9.2.7 Final By bobiras2009.apk,2.39,M
Lucky Patcher 2.4.4 Final By bobiras2009.apk,2.33,M
PowerAMP FULL v2.0.7-build-512a + Widget PackClassic Skin By bobiras2009/LuckyPatcher.apk,2.33,M
Beautiful Battery Disc Premium v1.1.3 Final By bobiras2009/Lucky Patcher v2.4.1.apk,2.33,M
360 Panorama v1.0.15 Final By bobiras2009,2.28,M
BetterBatteryStats 1.11.0.0RC8 Final By bobiras2009.apk,1.99,M
BetterBatteryStats v1.11.0.0 [Google Play] Final By bobiras2009.apk,1.98,M
Space GO LauncherEX Theme v1.0 Final By bobiras2009.apk,1.94,M
System Tuner Pro v2.5.3 Final By bobiras2009.apk,1.83,M
AUDIOID v1.0.2 Final By bobiras2009.apk,1.77,M
Ultimate Call Screen HD Pro v7.2.0 Final By bobiras2009/Ultimate Call Screen HD Pro v7.2.0 Final By bobiras2009.apk,1.5,M
Halloween 2 GO Launcher theme v1.0 Final By bobiras2009.apk,1.4,M
Digital Embers Live Wallpaper v1.0.4 Final By bobiras2009.apk,1.34,M
PicSay Pro - Photo Editor v1.5.0.5 Final By bobiras2009.apk,1.25,M
Audio Control v1.8.1 Final By bobiras2009.apk,1.25,M
Smart Screen Off v3.3 Final By bobiras2009.apk,1.25,M
PowerMax FULL v1.8.6 Final By bobiras2009/PowerMax FULL v1.8.6 Final By bobiras2009.apk,1.14,M
Digital Hive Live Wallpaper v2.0.1 Final By bobiras2009.apk,1.02,M
Barcode Scanner+ (Plus) v1.8 Final By bobiras2009.apk,953.66,K
Angel Dialer Pro vp1.0.6a Final By bobiras2009.apk,811.9,K
Advanced Task Manager Pro v2.1.3 Final By bobiras2009.apk,777.1,K
All My Movies v2.4.4 Final By bobiras2009.apk,742.31,K
1Tap Eraser Pro v1.0.2 Final By bobiras2009.apk,479.23,K
Virtuous Widgets v1.0.2 Final By bobiras2009.apk,466.31,K
PowerAMP FULL v2.0.7-build-512a + Widget PackClassic Skin By bobiras2009/Poweramp Standard Widget Pack Final By bobiras2009.apk,454.98,K
PowerAMP FULL v2.0.7-build-512a + Widget PackClassic Skin By bobiras2009/Poweramp Classic Skin By bobiras2009.apk,268.2,K
franco.Kernel updater v6.8.1 Final By bobiras2009.apk,262.01,K
Motion Camera v1.0.2 Final By bobiras2009.apk,251.66,K
PowerMax FULL v1.8.6 Final By bobiras2009/Key By bobiras2009.apk,137.89,K
Ultimate Call Screen HD Pro v7.2.0 Final By bobiras2009/License By bobiras2009.apk,36.93,K
By bobiras2009.jpg,35.7,K
PowerAMP FULL v2.0.7-build-512a + Widget PackClassic Skin By bobiras2009/Poweramp Unlocker v1.1-Final By bobiras2009.apk,22.39,K
