Filename,Size,Unit
INFO TBS/www.black-Sam org     Kom eens Langs !.jpg,13.1,K
INFO TBS/World without End (2012) S01e04 x264 HDTV ENG NLSubs TBS B-Sam.txt,1.65,K
INFO TBS/Torrent downloaded from Silvertorrent.org.txt,720,B
INFO TBS/Torrent_downloaded_from_AhaShare.com.txt,629,B
INFO TBS/Torrent Downloaded from  Movie-Torrentz.txt,607,B
INFO TBS/Tracked by H33T.txt,606,B
INFO TBS/Black-Sam.txt,128,B
INFO TBS/Torrent downloaded from BettyBoop torrents on BTScene.eu.txt,68,B
INFO TBS/Torrent Downloaded from  btscene.eu.txt,42,B
Movie/world.without.end.s01e04.720p.x264.NLSubs-QoQ.mkv,1.09,G
Movie/World.Without.End.S01E04.720p.HDTV.x264-2HD eng.srt,39.46,K
