User Type,Username,Date,Text
,nitish29,2012-02-21T10:17Z,thanks a lot for this ...only if possible can u do castle latest episode ??...once again thank you so much for this :)
,Kole97,2012-02-21T11:51Z,THANKS !!
,Tuckle,2012-02-21T14:08Z,"Cheers ti 
I'll second that request for Castle :)"
,keeganzo,2012-02-21T14:54Z,thumbs up on the Castle..huge thumbs up on tonyisaac efforts
,bjhabal,2012-02-22T01:45Z,"Thank you very much, and for those who asked for castle, it is available in a small size:
http://thepiratebay.se/torrent/7049219/Castle.2009.S04E16.480p.HDTV.ReEnc.x264-BoB.mkv"
,zvucnjak,2012-02-29T21:48Z,Is it just me or is it nothing there?
,zvucnjak,2012-02-29T21:50Z,"oops, sorry, never mind that... took me a while to figure out how the whole 'magnetic linky thingy' works... (what happened to good old dl torrent files anyway?)"
