User Type,Username,Date,Text
[V],Daman4Iife,2012-05-29T09:03Z,"they are atleast 50-60seeds, Thepiratebay is not registering it."
,thekane,2012-07-14T03:06Z,where is the 25th episode?
,habwin,2012-07-26T09:13Z,"I haven't downloaded every episode yet. But I can say that for the ones I did download had very nice quality. On the other hand the subtitles were far off and the video wouldn't play on WMP but on WMP classic., but still very nice"
[V],Daman4Iife,2012-07-28T20:18Z,Use VLC
,Dr.Caplan,2012-08-27T02:10Z,"Thanks, you can try media player classic too. I use it and it works just fine."
