User Type,Username,Date,Text
,MYGTHO,2012-11-03T06:59Z,"It should be called a grannies sex book ,PASS !!!!"
[T],bill_214,2012-11-03T07:17Z,"Yeah?

That ""granny"" is hotter in her '50s than most women are in their '20s, and smarter too, which is one reason Lady Gaga modeled herself after her."
,blackestsheep,2012-11-03T07:30Z,shes a granny now but when she was younger in this book she was HOT
,blackestsheep,2012-11-03T07:33Z,shes HOT in some of these photos back in the day though
,Aimier_59,2012-11-03T09:59Z,"Hmmmmmm ! A woman is a woman whatever the age! We call her a man ( HOMO in latin ) vs. ther creatures on this earth. We call her a lady vs. a gentlemean, we call her a woman vs. a man. We call her her a wife vs. her husband. We call her a mother vs. her children. We call her a singer vs. her job. But we call her a grannie or grandmother vs. only her grandchildren and that's it. A woman is a woman. ( at any age )"
,Aimier_59,2012-11-03T10:09Z,"Hmmmmmm ! ... A woman is a woman, whatever the age! We call her a man ( HOMO in latin ) vs. the other creatures on this earth. We call her a lady vs. a gentleman. We call her a woman vs. a man. We call her a singer vs. her job. We call her her a wife vs. a her husband. We call her a mother vs. her children. But we call her a grannie or grandmother vs. only her grandchildren and that's it. A woman is a woman ( at any age ) !!!"
