Filename,Size,Unit
För den som älskar/01 För den som älskar.mp3,3.44,M
För den som älskar/02 Med hjärtat fyllt av ljus.mp3,2.87,M
För den som älskar/03 Det finns inga givna svar.mp3,2.91,M
För den som älskar/04 Jag tar en annan väg.mp3,3.35,M
För den som älskar/05 Lever mina drömmar.mp3,3.03,M
För den som älskar/06 Mina minnen.mp3,3.67,M
För den som älskar/07 Du är allt.mp3,3.06,M
För den som älskar/08 Aldrig.mp3,3.5,M
För den som älskar/09 Min kärlek.mp3,2.77,M
För den som älskar/10 Att älska dig.mp3,2.81,M
För den som älskar/11 Eviga längtan.mp3,3.21,M
För den som älskar/12 Längtan är allt jag har.mp3,3.78,M
För den som älskar/13 När kärleken föds.mp3,4.73,M
För den som älskar/14 Tålamod.mp3,3.5,M
För den som älskar/15 Mr Memory.mp3,2.78,M
För den som älskar/16 Jag fick låna en ängel.mp3,3.05,M
För den som älskar/17 I dina ögon.mp3,3.4,M
För den som älskar/18 Ingenting finns kvar.mp3,3.36,M
För den som älskar/19 Som en saga.mp3,4.55,M
För den som älskar/20 Miracle.mp3,2.79,M
För den som älskar/21 My love light.mp3,2.79,M
