Filename,Size,Unit
Blazoen Chamond.png,7.97,K
Chamond NLT Release.png,55.47,K
Nlt-Release Lees eerst.txt,2.58,K
Stephen King Christine Synopsis.txt,1.84,K
Stephen King Film/Stephen Kings Christine [1-2] NL Subs.srt,27.74,K
Stephen King Film/Stephen Kings Christine [1-2].avi,698.98,M
Stephen King Film/Stephen Kings Christine [2-2] NL subs.srt,19.31,K
Stephen King Film/Stephen Kings Christine [2-2].avi,697.61,M
Torrent downloaded from Demonoid.me.txt,46,B
Torrent downloaded from KAT.ph.txt,41,B
Torrent downloaded from thepiratebay.se.txt,50,B
Torrent seeded by seedbox.fr.txt,39,B
