User Type,Username,Date,Text
[V],sujaidr,2012-03-14T09:54Z,"i have included a sample,so you could check for quality :-) ENJOY

i dont have a seed box so i'll provide maximum initial seeding but for the torrent to be alive please seed back too"
,Kole97,2012-03-14T10:38Z,"I dunno how you do it, but man everytime you do it.....it's right on TARGET. 10/10 on rating-card xx"
,Kole97,2012-03-14T10:41Z,"hey, can you do my small-request.....i'd like you to do ""Fish Tank"" 720p - http://www.imdb.com/title/tt1232776/"
[V],sujaidr,2012-03-14T11:08Z,"@Kole97,i dont mind doing it but anoxmous has already done a rip of that movie,check it out and see if u can download it,if u cant download or the rip isnt good then post on my latest torrent and will do it,take care"
[V],neon,2012-03-16T00:47Z,great quality....never seen this movie so im gonna watch it this weekend ...thanks :)
[V],sujaidr,2012-03-16T14:46Z,"@ neon,if u like a good comedy then u'll enjoy this...have a nice weekend :)"
