User Type,Username,Date,Text
,jesusshockwave,2012-07-15T11:57Z,"It might say 0 seeders right now, but I am seeding. I just uploaded it."
,jesusshockwave,2012-07-15T12:47Z,"Click below to see screenshots for these loops:

http://s1091.photobucket.com/albums/i393/creationcentral/Light%20Rays/"
,laszlo1234,2012-07-23T08:15Z,"PLEASE SEED, I REALLY NEED THIS BUT I HAVE BEEN STUCK AT 69% FRO A WEEK. HAVE MERCY."
,jesusshockwave,2012-07-26T05:45Z,"Good News, I can seed 24/7 for a week."
,jesusshockwave,2012-07-27T12:19Z,In the near future I will be purchasing 10 more volumes (when there is a good deal). Please message me volumes you guys would like to see.
,meekscm,2012-08-10T22:14Z,Thanks! Awesome.  I'm downloading HD Motion Background Loops now.  Can you get the Blister Packs?
,jesusshockwave,2012-08-15T11:35Z,I was eyeballing those too. I will eventually... :)
,jesusshockwave,2012-08-15T11:39Z,I will be uploading more motion loops and also some more countdown videos in the coming week.
