Filename,Size,Unit
Covers/Absinthe and Flamethrowers.jpg,101.2,K
Covers/Astronomy Made Simple.jpg,37.17,K
Covers/English Idioms - Exercises on Phrasal Verbs.jpg,17.54,K
Covers/Foam Roller Workbook.jpg,182.76,K
Covers/How to Study in Medical School.jpg,97.71,K
Covers/Increase Your Word Power.jpg,160.78,K
Covers/Laboratory Safety for Chemistry Students.jpg,37.46,K
Covers/Minerals and Rocks.jpg,95.63,K
Covers/Practical Guide to Designing the Invisible.jpg,30.62,K
Covers/Uncle John’s Bathroom Reader Plunges into History.jpg,140.25,K
Absinthe and Flamethrowers.pdf,3.24,M
Astronomy Made Simple.pdf,5.19,M
English Idioms - Exercises on Phrasal Verbs.pdf,7.91,M
Foam Roller Workbook (gnv64).pdf,8.03,M
How to Study in Medical School.pdf,3.73,M
Increase Your Word Power.pdf,5.82,M
Laboratory Safety for Chemistry Students.pdf,3.06,M
Minerals and Rocks (gnv64).pdf,5.41,M
Practical Guide to Designing the Invisible.pdf,5.47,M
Torrent downloaded from Demonoid.me.txt,46,B
Uncle John’s Bathroom Reader Plunges into History.pdf,4.85,M
