User Type,Username,Date,Text
,shashank799,2012-08-19T02:08Z,"seeding..as it is a bit big file i could use some help seeding this ..

ty.."
,Lobuno,2012-08-19T10:39Z,"This game was first released in 2001, and officially became  freeware in 2005.

You can download from the following links:

http://www.gamershell.com/download_11942.shtml
http://www.fileplanet.com/159468/150000/fileinfo/SWINE-%5BFREE-Game%5D"
,shashank799,2012-08-19T14:58Z,"that link connects to 716mb file and it is a direct download....

this is a torrent file.. if a person has low bandwidth he is download will take hours,.. Unlike the direct download by using the torrent one can pause and continue downloading the next day

And this is a freeware too."
