User Type,Username,Date,Text
,longtan2,2012-09-18T15:59Z,a ton of pervs and no thanks.  thanks azizex666
,realpr,2012-09-18T17:14Z,Pretty cool azizex666...a change once in while is good ! +1
,MonkeyMindUSB,2012-09-18T17:36Z,"Thanks azizex666!

Also, I've been looking for the Heroes in Hell series by Janet Morris, CJ Cherryh, et al - any idea if these could be uploaded?  Thanks again for all of your great work!"
[V],azizex666,2012-09-18T18:54Z,"@MonkeyMindUSB
Sorry, Don't have any of those, I'll put them on my ""Watch"" List. :)"
,amphebo,2012-09-18T18:56Z,"thanks alot for sharing!
not the best boobs i've seen, but still, spread them royal knockers!, just to fuck with the french court who made them illegal to print. 
Seriously, the whole middle-east is burning, and all we see in the papers are ""scandals"" of famous women cought topless.. makes one think."
,jim3800,2012-09-18T22:20Z,Thank You !
,gig0l0,2012-09-19T01:27Z,She got a sweet tush.
,Aldreezy,2012-09-19T08:33Z,loved the article on page 56
,Ratcher,2012-09-21T02:42Z,"Just the pics...

http://imgur.com/a/AvkjB/noscript"
,submeyar,2012-09-22T08:52Z,I masterbated twice for those lil sweet tits. thanks @azizex666
,soletar,2012-09-23T17:13Z,"Monarchy is just plain stupidity to me...why would a human lord over me just because he was born in a certain family (not money inherited by hard work of a prior generation)?


Thank you,uploader...all hail Your future Majesty"
,stinson33,2012-09-24T11:12Z,thanks good guy ratcher!
,elonaxsex,2012-09-24T21:53Z,Kate Middleton - Naked Video - September 2012 - High Quality https://thepiratebay.se/torrent/7669292
,Wolton,2012-09-26T05:14Z,"Not Found (aka 404)

You're looking for something that does not, has not, will not, might not or must not exist ...

... but you're always welcome to search for it."
