User Type,Username,Date,Text
,Astakomakaronadas,2012-05-23T21:22Z,nice upload :D TY
,Liliedugg,2012-05-23T23:09Z,Thank you!!
[V],Maverick2587,2012-06-02T14:52Z,thx!
,halentien,2012-06-04T20:37Z,"Can't wait to hear it !!!
Many many thanks; i dowload it before to buy it as soon as possible !!! See ya..."
,Occultslayer,2012-06-05T04:30Z,thanks a lot !! :D
,glitchedgamer,2012-06-05T20:22Z,I couldn't wait for my preorder to come in the mail. I had to listen to this now. Thanks for the great torrent m/
,vwboy72,2012-06-06T03:53Z,The Bonus DVD has been uploaded. Search the bay and KAT for it.
,vwboy72,2012-06-06T04:18Z,"I have made a torrent for the bonus DVD.
It is DVD ISO NTSC
Search for Harvesting the grapes of Horror.
I don't make torrents often. Let me know if it works or not. 

http://thepiratebay.se/torrent/7332501/Harvesting_the_Grapes_of_Horror"
,vwboy72,2012-06-06T20:08Z,"http://thepiratebay.se/torrent/7334060/Kreator_Phantom_Antichrist_Pack

A Pack of Goodies!"
,medaiz,2012-06-09T18:52Z,thank you sooo much!!! seed people seed
,MoviemMRZ,2012-09-10T09:32Z,Good album for the gym =)
