User Type,Username,Date,Text
[V],Nepotu,2012-10-31T00:32Z,CRAZY CRAZY GAMEEE..... MUST BE SEEN!!!!
,doritobrother,2012-10-31T00:41Z,"Cheers, mate."
,askloomok,2012-10-31T01:29Z,Quite possibly the greatest game I've ever seen.
,shabbamanuk,2012-10-31T02:39Z,only french com?
,consik2jz,2012-10-31T02:47Z,amazing f*cking game
[V],Nepotu,2012-10-31T08:02Z,"You're welcome, guyz! Yes, only french, but it worth!"
,vanyto,2012-10-31T15:52Z,seed please!!! :-(
[V],Nepotu,2012-11-01T00:40Z,Sorry bro but ro7man have a special schedule to seed. I can't do nothing about this.
,redjelly,2012-11-01T18:32Z,This torrent is missing the extra time that decided the match. 
[V],Nepotu,2012-11-02T12:06Z,I didn't knew that. Sorry is not my fault! I'll put a link with fixed torrent!
[V],Nepotu,2012-11-02T12:11Z,Here it is fixed: http://thepiratebay.se/torrent/7784343/League.Cup.Last.16.(30-10-12).Reading.v.Arsenal.1080i.fixed
