User Type,Username,Date,Text
[V],psspss,2012-11-27T07:47Z,"spam yummy yum.. wonder how long to delete that fool by a mod *above comment

anyhow, this is 1.5hrs long !"
[V],psspss,2012-11-27T13:57Z,"ok 10 or more have this.. Im low on data so leave you to it.. pls keep it going for others 

help seed it cheers"
,nathanthekiwi,2012-11-28T01:08Z,Hey Bro. You need to seed. If you go to the peers tab everyone is at 0%
,nathanthekiwi,2012-11-28T01:12Z,"Disregard that comment :)
Seeding and the speed is good. Chur."
[V],psspss,2012-11-28T04:16Z,"yeh cant help but many have run already 

but many block nz/aus cos of their poor sharing speeds or lack off.. even the aussies do it to me

so many seeders you wont see as they block you
why best to get a vpn :)"
