User Type,Username,Date,Text
[H],HeroMaster,2012-05-28T04:29Z,ENJOY Game of Thrones New Episode Exclusive by ASAP!
,demonplasma,2012-05-28T04:36Z,"looks real, im going for it and dont forget to seed!"
,sscultima,2012-05-28T04:36Z,"sweet! not a rar file, thanks for the up!"
,FerSanTeL,2012-05-28T04:50Z,parece Real... ahora vamos a ver si como ronca sue単a!!!!
,FerSanTeL,2012-05-28T04:51Z,"HeroMaster es una uploader real, no ya como se ve tiene gran trayectoria... gracias se te agredece un monton!! "
