User Type,Username,Date,Text
,jamesensor,2012-10-16T02:57Z,"Hmm doesn't work. You'll know it when you one tries to change cpu cycles, it's blocked on 3000. That's the security feature this app has different from many other. Regards"
,tommybertsen1,2012-10-16T11:06Z,"True @jamesensor , this locks on 3000 cycles , but it still works . Its touchscreen joystick system sucks though, but this still works for me even locked on 3000 cycles."
,pierrard,2012-10-22T21:43Z,"Hi guys,
do you know how to use a XB360 controller with this  software? it actually says it is supported with this new release.
Thanks"
