Filename,Size,Unit
Torrent Downloaded From 1337x.org.txt,33,B
Torrent Downloaded From Ahashare.com.txt,59,B
Torrent Downloaded From Btarena.org.txt,35,B
Torrent Downloaded From DigTorrent.org.txt,38,B
Torrent Downloaded From ExtraTorrent.com.txt,353,B
Torrent Downloaded From H33t.com.txt,32,B
Torrent Downloaded From IsoHunt.com.txt,35,B
Torrent Downloaded From Kat.ph.txt,30,B
Torrent Downloaded From ThePirateBay.se.txt,39,B
WWE.Friday.Night.Smackdown.2012.05.25.HDTV.x264-Ebi.avi,842.25,M
WWE.Friday.Night.Smackdown.2012.05.25.HDTV.x264-Ebi.nfo,2.12,K
