User Type,Username,Date,Text
[H],HeroMaster,2012-08-23T18:18Z,Seed and ENJOY!
,babybluetits24,2012-08-23T19:00Z,"http://www.imdb.com/title/tt1540005/ imdb score 4.4/10

Everyone please seed or reseed this it says just 172 seed, if u find any file with low seeds & you still have the file please reseed (start sharing the file again from utorrent etc) torrent sites may not be around for ever so always help out. If you find a file lacking useful details like imdb info or wikipedia info please copy & paste it into a comment to help every1 else out ive more than done my share of helping now its your turn, and always report viruses to the suprbay forum thanks ps dont forget the faster you seed uploading the faster your files download so set upload speed to unlimited in Utorrent etc "
,Emplehod,2012-08-26T06:12Z,"Quality is terrible, highly pixelated video and audio is far out of sync. I'd rather watch a lower resolution movie that is consistent and in sync than a hi-def one that isn't."
,Emplehod,2012-08-26T06:21Z,"Not only is the quality so bad: audio nearly two seconds out of sync, video pixelated and jumping frames, but less than ten minutes into it, the movie is so bad (movie-wise), that I stopped it and deleted the file.

Don't waste your time."
