User Type,Username,Date,Text
,Pendaws,2012-06-04T08:01Z,Thanks for this. :)
,mr6ix,2012-06-04T13:07Z,thanks for the uploader 
,aororulez,2012-06-04T13:18Z,"Really enjoyed the first episode, I hope this one ain't shit."
,Fayo,2012-06-04T14:31Z,"Nice episode, good quality, except for the commercial in the middle :) Thx!"
,akif_mol,2012-06-04T21:24Z,thnx mate...
,lady696,2012-06-05T02:59Z,"This is a actually finally for real a quicktime  file format.... it would be nice if you all upgrade to  mp4 or m4v, which is the best most platform-independant and no loss enlarging file format, and hey, for all mac users, it can be dropped into iTunes to watch through an apple TV as well..."
,spektator,2012-06-06T22:50Z,"Argh, I agree, I downloaded this first, and no subs work after half (due to commercial break). First time that I had to re-download something I took from eztv..."
,snaabit,2012-08-22T21:24Z,love the doggy commercial in the middle
