User Type,Username,Date,Text
,midas02,2012-07-08T20:38Z,"Ter info. Er is een klein probleempje met de audio. Rond minuut 20 is de audio niet meer gesyncroniseerd, en zit er ongeveer 1 seconde verschil op. Dus moet je dat (in VLC bijvoorbeeld) even bijstellen om prettig verder te kunnen kijken."
[V],Petey85,2012-07-08T21:04Z,"True...

Dit komt bij zo'n beetje alle episodes van Vive Le Velo & De Avondetappe voor..
Ook bij de komende afleveringen.. 
Aangezien ik niet weet waar het probleem ligt, kan ik het ook niet verhelpen..

met VLC Player kan het inderdaad verholpen worden..

Sorry voor het ongemak maar toch veel kijkplezier :)"
