User Type,Username,Date,Text
,Magichai,2012-04-05T01:42Z,"Hi gtr225, could you please upload Asus EEE PC-1011PX Recovery System DVD please?"
,gtr225,2012-04-19T03:48Z,I'm sorry I do not have that disc
,mrhat557,2012-05-01T17:35Z,"I have the same model number Eee PC, 1005HA, but it came with XP. Will this allow me to upgrade to W7 or will I need a new serial number?"
,gtr225,2012-07-01T20:47Z,It should allow you to upgrade with no trouble
,Oneuser85,2012-09-26T04:46Z,I am going to try and Install it on my asus eeepc 900a notebook. Hopefully it installs fine. Thank you for sharing.
