User Type,Username,Date,Text
,vidyarathne,2012-07-27T18:11Z,hello can you please upload Geet (1970 film) movie ?
,manrelaxed,2012-08-16T09:32Z,"This is a good effort by the up loader. I have not yet downloaded it, but i hope that the quality of songs will be good and all the hit songs are covered in the torrent. Rajesh Khanna is first superstar of Hindi Film Industry. I will comment again after watching the video."
,manrelaxed,2012-08-17T11:45Z,"Really very good upload! It covers all hit songs of Rajesh Khanna. 
The audio video quality is very good. 
Amazing effort! Keep it up!"
,praths,2012-08-24T11:30Z,Thanks @manrelaxed..... Thanks fot the comment........
