User Type,Username,Date,Text
,nickwenz27,2012-07-19T10:06Z,Wow. That was quick.  Thanks a bunch. 
,unnim2,2012-07-19T11:13Z,thanks MM. 
,craigisthebest,2012-07-19T19:00Z,"hey mm82 do you upload manga too?
cuz if you can i would like if you could up ouran high school host club
i cant find it anywhere!

Btw this looks like a good series 
kinda reminds me od the deadwardians"
,JustAnotherApprentice,2012-07-21T02:04Z,Thanks a lot!
[T],MrDowntown,2012-07-27T03:32Z,Heard this was really good - thx
