Filename,Size,Unit
Pulp Fiction_01_Pumpkin and Honey Bunny (Dialogue)-Misirlou_320kbps.mp3,5.7,M
Pulp Fiction_02_Royale With Cheese_320kbps.mp3,4.02,M
Pulp Fiction_03_Jungle Boogie_320kbps.mp3,7.12,M
Pulp Fiction_04_Let's Stay Together_320kbps.mp3,7.51,M
Pulp Fiction_05_Bustin' Surfboards_320kbps.mp3,5.67,M
Pulp Fiction_06_Lonesome Town_320kbps.mp3,5.15,M
Pulp Fiction_07_Son of a Preacher Man_320kbps.mp3,5.65,M
"Pulp Fiction_08_Zed's Dead, Baby [Dialogue]_320kbps.mp3",5.77,M
Pulp Fiction_09_Jack Rabbit Slims Twist Contest (Dialogue)-You Never Can Tell_320kbps.mp3,7.39,M
"Pulp Fiction_10_Girl, You'll Be a Woman Soon_320kbps.mp3",7.26,M
Pulp Fiction_11_If Love Is a Red Dress (Hang Me in Rags)_320kbps.mp3,11.32,M
Pulp Fiction_12_Bring Out the Gimp (Dialogue)-Comanche_320kbps.mp3,5.04,M
Pulp Fiction_13_Flowers on the Wall_320kbps.mp3,5.55,M
Pulp Fiction_14_Personality Goes a Long Way [Dialogue]_320kbps.mp3,2.39,M
Pulp Fiction_15_Surf Rider_320kbps.mp3,7.62,M
Pulp Fiction_16_Ezekiel 25-17 [Dialogue]_320kbps.mp3,1.99,M
