User Type,Username,Date,Text
,glata10,2012-06-28T10:34Z,Please someone help me! I cant see the minimap or the picture in the menu. It's just white. Please help.
,anotherdler,2012-06-29T08:36Z,Go to the provided link and hit the email address for support. Perhaps a glitch in programming or something weird setup in your pc.
,linkguy333,2012-06-29T19:07Z,"Come on, Fireftw all the ones you've posted crash in 5-10 minutes."
,Mad_Hatt3r,2012-07-01T16:44Z,"@linkguy it's not the torrent's fault it crashes, it's your graphics driver.  ATI, right? http://www.townsgame.com/forums/viewtopic.php?f=10&t=2419"
,lightdrop,2012-07-01T17:23Z,"Thank you FireFtw, works well."
,Apollyon1,2012-08-10T23:46Z,Any chance for v0.50?
,FireFtw,2012-08-11T19:11Z,"Forgot about these lol.
Heres v0.50 guys:
http://thepiratebay.se/torrent/7523682"
