User Type,Username,Date,Text
,ahearns,2012-05-31T08:29Z,"All episodes are here too! Good Job, and thank you."
,tommytomthms5,2012-06-03T05:35Z,thank you
,thruthenever,2012-06-04T22:04Z,sweet man...thank you
,steelllynx,2012-06-05T05:10Z,Thank you.  My only disappointment on none of your part is that I just found out that episode 23 is the last one in this season.  :'(
,sadg0d,2012-06-20T21:13Z,You're a God amongst insects. :p
,sadg0d,2012-06-20T21:15Z,You're a God among insects. :)
,I_QBot,2012-06-24T22:11Z,Censored? or not?
,I_QBot,2012-06-24T22:15Z,Censored?
,TheEnlightened,2012-07-03T03:46Z,Great upload but they're TV Rips.... so in other words they're just censored episodes. 
,assafrox,2012-07-06T10:55Z,somebody needs to put up full season 10 without censored...!!
