Filename,Size,Unit
The Rush Limbaugh Radio Show JUN-15-2012 FRI KNZZ-CO LIVE   hr3.mp3,18.1,M
The Rush Limbaugh Radio Show JUN-15-2012 FRI KNZZ-CO LIVE   hr2.mp3,18.1,M
The Rush Limbaugh Radio Show JUN-15-2012 FRI KNZZ-CO LIVE   hr1.mp3,18.1,M
++   hr2 NEWS.mp3,1.77,M
++   hr1 NEWS.mp3,1.77,M
torrent thursday 15JUN12.rar,55.95,K
YOU TUBE-A Muslim In The White House - Proof Barack Hussein Obama Is A Secret Muslim.txt,2.98,K
LINKS TO MORE SHOWS.txt,536,B
Torrent downloaded from Demonoid.me.txt,46,B
