Filename,Size,Unit
Beauty and the Beast S01E01 WEB-DL nlsubs _nieuwe Serie_/Beauty.and.the.Beast.2012.S01E01.1080p.WEB-DL.DD5.1.H.264-KiNGSnlsubs.mkv,1.62,G
Beauty and the Beast S01E01 WEB-DL nlsubs _nieuwe Serie_/Beauty and the Beast (2012) S01E01 1080p WEB-DL NLSubs BB.nfo,1.63,K
INFO/poster.jpg,63.23,K
INFO/Beauty and the Beast (2012) S01E01 1080p WEB-DL NLSubs BB.txt,1.63,K
INFO/Torrent_downloaded_from_AhaShare.com.txt,278,B
INFO/Torrent Downloaded from  Movie-Torrentz.txt,260,B
INFO/Tracked by H33T.txt,257,B
INFO/Torrent downloaded from BettyBoop torrents on BTScene.eu.txt,68,B
INFO/Torrent Downloaded from  btscene.eu.txt,42,B
