User Type,Username,Date,Text
,gekfoot,2012-06-08T03:18Z,"If you push down on the base of your erect penis, you can make it pop like you're cracking a knuckle! The more you know..."
,moe411,2012-06-08T07:59Z,only works if u got a needle penis lika asian or caucasian  
,ghostrx,2012-06-08T11:22Z,Thanks!
,jwhitsel,2012-06-09T14:04Z,I'm Asian and I find that offensive.  I've got the biggest penis in my village.  All the women love all 5 inches.
,krzniuean,2012-06-17T22:10Z,what funny cunts lol....bhahahaha
