User Type,Username,Date,Text
[H],HeroMaster,2012-07-28T22:32Z,Seed and ENJOY Full BlackBox Edition in Non-RaR!
[T],Mr.Stifmeister,2012-07-28T22:44Z,"To bad you didnt think of the title you gave this, as i got the same...
But so people know, my release is for people with slower bandwidth. Movies are also encoded. Thats why mine release is 4.36GB :)"
,sami_nasri,2012-07-28T22:54Z,this is a repack nothing ripped?
,zuf90,2012-07-28T22:54Z,??
,DqZz,2012-07-28T22:58Z,MultiLanguage ?
,sami_nasri,2012-07-28T23:05Z,"Sorry.HERE Are the info


http://i.imgur.com/uEft8.png"
,bl4kk_mh4mb4,2012-07-29T10:35Z,People...there is KARMA! selfish non-seeding hit and run individual will experience problems with the game!...SEEEEEEEEEEEEEEEEEEEEEEED
,DoingYerMom,2012-07-29T11:34Z,plz upload the lossy one.It's just 4 gig. thnx
,DoingYerMom,2012-07-29T11:35Z,"Just pretend my last comment was never written,thnx."
[T],Knaster,2012-07-29T12:00Z,Well Mr.Stifmeister your upload gave me the speed of 100kbit While this torrent gave me between 2-3mbit speed. 
,007rambo007,2012-07-29T16:25Z,thanks :D
,Elmis19,2012-07-29T21:15Z,Seeeeed 
,ultamanl,2012-08-09T15:12Z,thanks it works with the latest proper-patch!
