User Type,Username,Date,Text
,steve30x,2012-07-30T22:04Z,Thank you. When the next update is released please upload the crack when it becomes available. I am having trouble with this update. When I play Free Form deliveries the game exits to the menu after a few seconds. So I hope the next update fixes this.
,tornade25,2012-07-31T17:18Z,"what is the point to upload the v1.1.1 and v1.2.0 as this one is cumulative ?

You may not have noticed those updates were already there, before your upload 
http://thepiratebay.se/torrent/7426860/Scania_Truck_Driving_Simulator_v1.2.1_Update-SKIDROW_by_T.F.K"
,steve30x,2012-07-31T23:04Z,"@ tornade25 : You may not have noticed that TPB is spammed with the same torrents over and over too.

Anyway the next patch will be out this weekend and a map upgrade next week. I hope they will get cracked."
,fragmas,2012-08-01T13:24Z,"NO need to download this update, because it's just a fix for Lithuanian translation."
,dhenny54,2012-08-06T21:02Z,need patch 1.3.0 now
