User Type,Username,Date,Text
[V],thegreenfrog,2012-09-10T07:36Z,How is this thing a good idea?
,sghetto,2012-09-10T07:52Z,how is it a bad idea?
,-darkangl-,2012-09-10T08:21Z,"First off, there's no preview.  Secondly it's posted in the wrong section."
,sghetto,2012-09-10T08:52Z,"its labeled porn because there is porn in it. fair warning.

here is your preview
http://spaceghetto.net"
[V],thegreenfrog,2012-09-10T08:54Z,"...and have you actually finished one of your uploads?

People are not fond of very large balls of stuff they cannot see. examine or sample."
,sghetto,2012-09-10T11:32Z,"what can i say, i have large balls. you will have to trust me"
[V],thegreenfrog,2012-09-10T23:20Z,Ummm... That was my point wasn't it? We have no reason to trust you.
,lif3isfr33,2012-09-11T11:05Z,These are just photos from random shit including porn.. nothing new you see from pics posted on blogs or forums. :l
