User Type,Username,Date,Text
,jwilla09,2012-11-04T18:47Z,best copy yet..audio is in-sync and has no watermarks
,wanderlustus,2012-11-04T18:52Z,Last one I grabbed was choppy.  Does this one have the same problem?
,tru_2_ublue,2012-11-04T21:15Z,SEED PLEASE!!!
,tru_2_ublue,2012-11-04T21:15Z,SEED PLEASE!!
,CBBilly,2012-11-05T01:08Z,This is bullshit. Less than 1kb/s and no seeds connected at all? I can't believe EVERYone of the 1500 or so peers is a tight arsed bastard...
,TWEETY2455,2012-11-05T03:46Z,"You got to go to a website, join up and pay money to get his torrents to download;for me scene is over On tpb."
[T],[jcgoku21],2012-11-05T03:59Z,Hace falta la carga completa 100%
,ruialvell,2012-11-05T06:31Z,"SEED PLEASE!!
I'm stuck at 36.1% and i'm not the only one!!"
,MelbourneAUS,2012-11-05T10:42Z,"Best quality ever found! Thanks!

I'LL STAY IN SEED"
,iverie,2012-11-05T20:07Z,"Totally watchable, V6 A7
Thanks very much!"
