Filename,Size,Unit
Inbred (2011) PAL DVDR DD5.1 NL Subs/Inbred (2011) PAL DVDR DD5.1 NL Subs.iso,4.36,G
Inbred (2011) PAL DVDR DD5.1 NL Subs.nfo,585,B
Torrent Downloaded From ExtraTorrent.com.txt,353,B
Torrent downloaded from silvertorrent.org.txt,86,B
Torrent downloaded from AanMeHoelaJa Torrents on BTScene.eu.txt,71,B
Torrent downloaded from AhaShare.com.txt,58,B
Torrent downloaded from thepiratebay.se.txt,50,B
Torrent Downloaded from limetorrent.txt,50,B
Torrent Downloaded From BTScene.eu.txt,45,B
Torrent Downloaded from digtorrent.org.txt,45,B
Torrent downloaded from KAT.ph.txt,41,B
tracked_by_h33t_com.txt,23,B
