User Type,Username,Date,Text
,chrisvelas87,2012-12-15T23:13Z,"oi ksadelfes sirina,  sto link auto - http://thepiratebay.se/torrent/7927280"
,chrisvelas87,2012-12-16T00:31Z,i ekdikisi tis nyfis sirina sto link auto - http://thepiratebay.se/torrent/7927437
,chrisvelas87,2012-12-16T07:12Z,ntopa 2 -  i syntagi tou giatrou -  (sirina) http://thepiratebay.se/torrent/7928368
,chrisvelas87,2012-12-17T00:15Z, greek next porn model by gousgounis - http://thepiratebay.se/torrent/7930384/GREEK_NEXT_PORN_MODEL_BY_GOUZGOUNIS_%28SIRINA%29
,chrisvelas87,2012-12-17T00:22Z,PROSOXI SEEDAROUMAI OLOI GIA NA KATEVASOUME 0LOI GRIGORA
,chrisvelas87,2012-12-20T03:02Z,AGROTISSA MONI PSAXNETAI SIRINA - http://thepiratebay.se/torrent/7940753/AGROTISSA_MONI_PSAXNETAI_%28SIRINA%29_GREEK_PORN_MOVIE.VOB
,chrisvelas87,2012-12-27T17:12Z,PAIDIA SEEDARETAI OPOSDIPOTE.................
,chrisvelas87,2012-12-27T20:26Z, O TAXITZIS SIRINA KATEVASTE TO EDO - http://thepiratebay.se/torrent/7963868
