User Type,Username,Date,Text
,MrWabbit,2012-03-23T05:05Z,Excellent program works perfectly.
,andreas1982_2009,2012-04-05T23:58Z,"My first pirate download to Samsung S2 Android 2.3. This program worked right away! Just like downloading it from Android Marked!

Thank you very much! .BONE !"
,SR4T9US,2012-05-31T03:20Z,"Didn't work on rooted a200, but was able to control video on pc via usb and wireless."
,bb33mm,2012-08-08T04:23Z,"hi thanks for this , but how do I use this on my android phone?

cheers"
,spunkster,2012-09-22T05:25Z,"Question - can you stream files across the internet from many miles away on your mobile device, or must you be local? 
(like on the same wifi network)"
