User Type,Username,Date,Text
[S],velvet.,2012-07-30T18:02Z,"Do not upload the same item more than once.
Your other upload of this has been deleted."
,BlueSonnet,2012-07-31T18:12Z,Someone said Bacon? Download I must.
,dellboy94,2012-08-02T14:25Z,seed and i will pay you back with cookies
,shezletic,2012-08-24T14:47Z,Audio 10/10. Thanks for the upload.
,holv,2012-08-25T06:14Z,Thanks for the upload. 
,victorxx,2012-08-28T07:10Z,thanks!
,victorxx,2012-08-28T07:11Z,Thanks!
,FosterKid,2012-09-03T09:40Z,Thank you so much!
