User Type,Username,Date,Text
,J3KAY,2012-04-29T00:21Z,Works greate! Thanks!
,chokeh0ld,2012-04-29T01:59Z,Is it working even if it says DEMO in the About..?
,hypnotoadtrance,2012-04-29T03:59Z,"@chokeh0ld

Yes. It still works. You have access to all the features without any limitations."
,SirTwitch,2012-05-05T23:08Z,"Not working, as of May 05, 2012"
,tbp_Out,2012-05-06T04:52Z,"Yeah, this patch gives an error which is weird if it's been working"
,tbp_Out,2012-05-06T04:57Z,"Ok, I found out why it gave me the error.
You need toright click and run the patch as an admin. "
,mfmedia,2012-05-07T21:09Z,I hope it is with all feautres or what they call Premium.
,tinytheboss,2012-05-08T19:11Z,"Hey, this crack worked yesterday but today it stopped working for no reason, i asked my friend he said the same happend, so are you gonna update your crack?"
,Lynerus,2012-05-08T23:57Z,"Some weird ip connection with this on that isn't xsplits ip as far as i can tell (it isn't the same ip when you run it without this)

So im not sure people should use this"
,Shade_45,2012-05-09T00:28Z,This also stopped working for me all of a sudden today. 
,boatflank,2012-05-09T07:35Z,you guys got fucked. wait for the ORIGINAL cracker to update it.
,FR33,2012-05-11T10:32Z,"hopefully they make an ""offline"" patcher"
,tinytheboss,2012-05-11T15:48Z,who is the original cracker?
,username757,2012-05-12T17:59Z,Is it possible to install this version and prevent xsplit from updating?
,evilhuman,2012-05-12T19:34Z,"isn't this the latest version? why would you need to update lol..


anyway changing resolution, fps does not work? :(

however adding source by Game and changing that horrible speecx sound to mp3/aac works "
,Zetta2r,2012-05-13T05:55Z,"It worked before, but suddenly stopped. Thanks for the upload though. Hope to see a updated one."
,Sythee,2012-05-31T20:55Z,"same here, suddenly stopped after working for a while, they probably patched it or something"
,MrMontag,2012-06-25T05:48Z,"Thank you for this, I've been trying to stream for a long time :D"
,malowi,2012-06-25T11:32Z,Any1 know how to stop it from updating?
,some_stupid_anon,2012-07-05T00:49Z,Doesn'
,some_stupid_anon,2012-07-05T00:50Z,"sorry.. Doesn't work, not anymore.

If there's any new patch..."
