Filename,Size,Unit
CD/01. Move It.mp3,9.47,M
CD/02. Anyone Who Had A Heart.mp3,8.05,M
CD/03. Miss You Nights.mp3,9.05,M
CD/04. Yesterday Once More.mp3,9.38,M
CD/05. She Means Nothing To Me.mp3,8.3,M
CD/06. All I Ask Of You.mp3,9.59,M
CD/07. Let There Be Love.mp3,7.47,M
CD/08. Throw Down A Line.mp3,6.5,M
CD/09. Fields Of Gold.mp3,7.73,M
CD/10. Up Where We Belong.mp3,10.31,M
CD/11. Slow Rivers.mp3,7.34,M
CD/12. Suddenly.mp3,9.26,M
CD/13. Danny Boy.mp3,9.06,M
CD/14. Reunited.mp3,9.21,M
"CD/Cliff Richard feat. Brian Bennett, Brian May - Two's Company The Duets.mp3.cue",2.15,K
CD/~ - Two's Company The Duets.m3u,1.21,K
