User Type,Username,Date,Text
[T],GusGuzz,2012-11-15T11:14Z,Het zou trouwens leuk zijn als iemand een berichtje zou achterlaten dan weten wij ook weer eens voor wie we het doen;)
,whymichael,2012-11-15T13:12Z,Exactly. What this guy ^^ said...
,_Elvis_,2012-11-15T18:33Z,"Ik heb de film net gedownload en het geluid is gewoon echt slecht en dit is bij al jou films dus  ga hem nou van een andere bron downloaden.
Mvg William"
[T],GusGuzz,2012-11-16T13:51Z,"Wat is er dan mis met het geluid op mijn films
Dit is het eerste wat ik er van hoor???????"
