User Type,Username,Date,Text
,Engelman,2012-09-01T12:44Z,"There is an error in movie ""Blodshämnd"""
,SirSaWa,2012-09-01T13:29Z,"Yes you told me.
But when I play it. It works like a charm.
So what exactly is your problem with it..?"
,SirSaWa,2012-09-01T14:29Z,"Could anyone else confirm if there's some kind of problem with disc 2?
As I said, it works like charm for me."
,norangel,2012-09-01T16:21Z,"Thank you once again, really appreciate that you share this series. Just downloaded this set and starts burning now. Will check for problems..."
,SirSaWa,2012-09-01T21:57Z,"norangel - Thank you!
And pelase check and tell me.
Thank you again!"
,norangel,2012-09-01T21:59Z,"Have tested the discs and they work like a charm for me as well...
Thanks again SirSaWa :-)"
,SirSaWa,2012-09-01T22:38Z,norangel - Thank you :) !!
,esiason97,2012-09-02T17:57Z,"Tack för att du förser oss med dessa avsnitt! Jag tillhör dem som inte pallar att följa serier veckovis i TV, utan vill gärna se ett helt gäng avsnitt på en gång. 

Supersnällt att du delar med dig!
TACK!!!"
,SirSaWa,2012-09-02T20:03Z,"esiason97 - Då är vi två.
tack!"
