Filename,Size,Unit
The Music Scene/01 It's Raining Clouds.mp3,5.48,M
The Music Scene/02 The Music Scene.mp3,4.5,M
The Music Scene/03 Only Sequences Change.mp3,4.42,M
The Music Scene/04 Which One Of You Jerks Drank My A.mp3,4.48,M
The Music Scene/05 Attack The Doctor.mp3,5.37,M
The Music Scene/06 The Prettiest Sea Slug.mp3,4.29,M
The Music Scene/07 The Daily Routine.mp3,6.31,M
The Music Scene/08 Tricky Turtle.mp3,4.33,M
The Music Scene/09 Four Walls.mp3,5.3,M
The Music Scene/10 Pity Party.mp3,4.09,M
The Music Scene/11 Hell Camp.mp3,4.32,M
The Music Scene/12 Farewell Spaceman Torrent downloaded from Demonoid.mp3,6.11,M
