User Type,Username,Date,Text
,oplahfling,2012-05-08T07:23Z,"Alright. This is how you make a offline account for Games For Windows Live. Before you bitch about how it doesn't work maybe you read this twice BEFORE posting.

1. Log out of your GFWL online profile if you have one, or simply hit escape, and GFWL will sign you out of Live but not your profile (if you do this, Windows Live will still track the achievements for this game but never require a product code, if you feel cyber cops are watching you- this won't help). Exit out of the GFWL interface.
2. Hit your ""Home"" key or whatever key you've set to open GFWL.
3. Click on the ""Create New Profile"" Button.
4. On the next page scroll the text box down a bit and you will see a ""create a local profile"" in blue lettering and underlined as well. Click on it.
5. Make profile.

Wow! That was so fucking hard. Now die for being retarded, so humanity can be better off."
,3Dazz,2012-05-08T07:53Z,Even with an offline GFW account this game will not save. Anyone else having this issue?
,3Dazz,2012-05-08T08:11Z,"Even with an offline GFW account this game will not save. Anyone else having this issue?And those of us who have a genuine account do not have the option of creating an offline account. Its just not there. Strange how it saves your achievements, but not the game. "
,thedj3,2012-05-08T09:11Z,"for those who are having the 'create offline account' issue, log the game up, and at the main screen hit 'home' key on the keyboard, this will allow you to scroll to the create offline bit.  "
,nox234558,2012-05-08T10:12Z,TNX extremezone i had problem with crash to desktop just run updates for windows 7 and thats it it worked for me tnx 
,cha0z28,2012-05-08T10:34Z,need more seeders
,3Dazz,2012-05-08T12:55Z,"Ok for those that already have a GFW Live account, Just make sure that your account is set to Offline, in other words dont log in. It seems to be saving. It seems you have to play it for a while for it to save. "
,buddda,2012-05-08T17:35Z,"Everything works great; easy install as always, but the game is rather shitty. I played for a matter of minutes before I decided there are much better things I could play instead. I will still seed back though! "
,Ali-Madan,2012-05-08T19:56Z,still seeding
,Slurpin10,2012-05-08T22:31Z,"Great upload 10/10 

the games utter rubbish "
,bitouu,2012-05-09T01:28Z,ok how i contact Extremezone i got a big question for him please help me!!!
,dieagain20113,2012-05-09T01:34Z,"this one is ok with gameplay, poor story, RE 4 5 are shitty, wut kind of cop couldn't shoot while walking, and couldn't walk straight left and right. "
,dieagain20113,2012-05-09T03:01Z,"there are 6 download missions for US Spec Ops squad coming soon, the game has no good dodge system, but i still expect to play those new missions. "
,bowchickawow,2012-05-09T06:51Z,"i HAVE three words for u skidrow team 
God BLESS U :))))))
and plz 1 favour for me upload max payne 3 before it release date :) 
remain in good health and spirit"
,bowchickawow,2012-05-09T06:53Z,"skidrow team i have three words for u god bless u :) 
and plz do upload max payne 3 before its release date :) 
remain in good health and spirit "
,cha0z28,2012-05-09T07:45Z,finish downloading.. I hope it works. 
,cha0z28,2012-05-09T08:51Z,it works! It sucks because there is no offline coop :/
,Muzikants,2012-05-09T11:40Z,The game is pretty shitty! It seems that RE series are getting worse and worse!
,zoogaezee,2012-05-09T12:08Z,"oplahfling at 2012-05-08 07:23 CET:
Alright. This is how you make a offline account for Games For Windows Live. Before you bitch about how it doesn't work maybe you read this twice BEFORE posting.

1. Log out of your GFWL online profile if you have one, or simply hit escape, and GFWL will sign you out of Live but not your profile (if you do this, Windows Live will still track the achievements for this game but never require a product code, if you feel cyber cops are watching you- this won't help). Exit out of the GFWL interface.
2. Hit your ""Home"" key or whatever key you've set to open GFWL.
3. Click on the ""Create New Profile"" Button.
4. On the next page scroll the text box down a bit and you will see a ""create a local profile"" in blue lettering and underlined as well. Click on it.
5. Make profile.

THANKS TO oplahfling FOR THIS INFO

oplahfling at 2012-05-08 07:23 CET:
Alright. This is how you make a offline account for Games For Windows Live. Before you bitch about how it doesn't work maybe you read this twice BEFORE posting.

1. Log out of your GFWL online profile if you have one, or simply hit escape, and GFWL will sign you out of Live but not your profile (if you do this, Windows Live will still track the achievements for this game but never require a product code, if you feel cyber cops are watching you- this won't help). Exit out of the GFWL interface.
2. Hit your ""Home"" key or whatever key you've set to open GFWL.
3. Click on the ""Create New Profile"" Button.
4. On the next page scroll the text box down a bit and you will see a ""create a local profile"" in blue lettering and underlined as well. Click on it.
5. Make profile.

THANKS TO oplahfling FOR THIS INFO"
,PHDIKOULAS,2012-05-09T13:19Z,"WHAT KIND OF FAGGET PUT A MINUS ON EXTREMEZONE? MODS BAN THE SHITHEAD

ALSO THE REST WHO DONT KNOW HOW TO MAKE AN OFFLINE PROFILE GO PLAY WITH YOUR MAMAS PUSSY FAGS

THE GAME SUCKS.CONGRATS CAPCOM"
,samerdl,2012-05-09T17:36Z,"my room mate downloaded this and it worked, i played it for a few minutes and hated it. This game is horrible, its nothing like the Old Resident evil games, its different.
Dont get me wrong, the torrent is great!, but the game sucks!!!!. "
,samerdl,2012-05-09T18:14Z,"by the way, i downloaded about 310MB only and my upload speed is 450 KB/SEC whilst the DL speed is 30KB/SEC. "
,pirate6662012,2012-05-09T19:31Z,game is very short
,osiris420,2012-05-09T20:13Z,"@zoogaezee - This might work on old versions of GFWL but not the new one for Windows 7. There is no option to ""create local profile"" on the webpage the program redirects you to!"
,Bozzanac22,2012-05-09T21:57Z,"WHATS WITH THE SOUND BUG ???? 
when i shoot i hear nothing !!!"
,philopateernabil,2012-05-09T22:14Z,guys seed please :)
,ai3643,2012-05-10T00:04Z,Anyone else run the setup.exe and get the warning.  1 Threat Found.  Trojan.Dropper
,ai3643,2012-05-10T00:10Z,Wheres my comment?
,dieagain20113,2012-05-10T02:00Z,"How many Moves do u know when u say this game is no fun?
1. dodge = run + pick up + direction  
2. head stab = knife then pick up   
3. zombie shield = knife then hold knife   
4. kick ass = zombie shield then knife   
5. cut throat = zombie shield then pick up   6. unlimited run/ knock down = run then knife then run then knife  
7. stomp = knock down then hold stomp"
,nazgull2k10,2012-05-10T07:02Z,game is total shit.  Torrent is 100% working.. but as many have stated.. you'd have more fun shoving random objects in your own home up your ass.
,SideSkroll,2012-05-10T09:52Z,Could somebody confirm if this is playable through Garena/Tunngle/whatever VPN with the teknogods dll or something?. Thanks.
,Vergilio,2012-05-10T13:35Z,The game is developed by Capcom but not made by them
,samerdl,2012-05-10T13:44Z,"seeded 3.33gb so far, will seed some more tonight. The game does suck :( "
,Soolbarimus,2012-05-10T13:57Z,"@extremezone
Tnx very much for the upload.
I've been having some sound issues..if i die or change level the sound of the weapons(mainly) gets distorted and really low is there anyway to fix it?"
,ID4RKx,2012-05-10T14:42Z,"Very Nicce Bro , ,

Thanks You

I Will Download It

:)"
,sasoa7x,2012-05-10T17:57Z,o crack não funciona em windows 7 64 bits?
,Seran1,2012-05-10T23:26Z,"Thanks for the torrent but man what a crappy game, played it for 2 hours then decided to uninstall it. Another half assed attempt to squeeze money from a known name, and  then add the crappy pc porting to that"
,Hishik,2012-05-11T02:24Z,"Everyone is hating on the game and honestly I don't see what the big deal is.

I actually really enjoy the game and I feel if you go into the game with an open mind you will too. I mean SURE there are some issues but I feel the game deserves a 7.5 - 8 it was honestly a good tid bit of fun.

But, on a serious note when I die my gun sounds disappear and I am getting lag on a system that should run the game at 60 FPS.

GPU: GTX 570
CPU: AMD BE 965 
8 gb of ram

I have a pretty beast PC that I built myself, is it the altered EXE that is causing the lag? Poor port? Poor Programming? I shouldn't be dropping to 30FPS with my setup."
,intenss,2012-05-11T02:53Z,"Thanks for the upload, I'll seed as much as I can. For all the complainers... fuck off ... if you don't like his shit then don't download it."
,hawk22,2012-05-11T03:00Z,"wow this is total bull -.- this game is in great quality but my BRAND NEW computer cant play it smoothly!!! if theres a way to make it run smoother, someone help me..."
,NecroFile,2012-05-11T03:22Z,"@Vergilio: That makes no sense.

Developer = The people who actually make the game/program.

Publisher = Distributor/Marketing.

It was co-developed by Slant Six and Capcom."
,Catchxhell,2012-05-11T04:22Z,"i have no clue why this is not working for me. 
i have done tons on torrents from skidrow but this one doesn't seem to work. 

i keep getting error code 5001.

and i'm not seeing an iso file. 

could someone please help me. "
,dieagain20113,2012-05-11T04:47Z,"Since when Resident evil is a horror game? I dont see horror when there is infinity rocket launcher. So this game is just fine, ok graphic, more action moves then other RE game, downloadable missions to extend fun, maybe play online... Why people think this game sux when they are ok with Dead Island?  "
,samerdl,2012-05-11T10:44Z,is there multiplayer cracK? Or a real KEYGEN? 
,PHDIKOULAS,2012-05-11T11:05Z,"@dieagain20113 

Are you dense son?

retarded? REsident evil games started as horror survival and turned into action shitty games

go play some pokemons moron"
,tiz2,2012-05-11T12:20Z,@ SideSkroll: I can confirm that it isn't atm. Tunngle page says wait for fix.
,renaissance503,2012-05-11T12:40Z,Thank you.
,preda96,2012-05-11T13:20Z,Worst RE game ever! Ahh dont waste your time on this fucking game
,dieagain20113,2012-05-11T18:22Z,"@PHDIKOULAS 
why action game = shitty game?"
,gamerkills_86,2012-05-12T03:29Z,this torrent is shit! sound is shit. you shooting and sound be bad :(
,LOSTLOVE1,2012-05-12T07:01Z,"CAN ANYONE TELL ME WHAT I NEED TO DO ABOUT WINDOWS LIVE?? I START THE GAME, THEN, WINDOWS LIVE COMES UP.. IT THEN ASKS FOR A GAME KEY....HELP PLEASE!!!!LATER"
,Mr.BlizzardBeta,2012-05-12T08:14Z,"So has n e body noticed in the install folder. the folder named DLC.  Im curious is this the first dlc pack. just ""Not"" implemented? If so could we just copy the files from the dlc folder over their original .? I don't know. just a thought."
,tktheng,2012-05-12T10:36Z,"this work for me ultimatex64,
but the game kind of shit"
,dirtyearl,2012-05-12T17:13Z,how can i safe ?
,Hishik,2012-05-12T17:31Z,"For people saying this game is shit and that it's too short...

I beat RE 1,2, and 3 within 5-6 hours each this year after downloading them off PSN (granted I never played the Alternate stories) The length of the campaign isn't that big of deal in a market where most games are 6-9 hours in length anyways. Play it on a harder difficulty AND with friends. I could understand people upset with paying 60 dollars for it because it ISN'T worth 60 dollars.

Then again I didn't consider L4D2 worth 60 dollars when is came out either. But, there IS fun to be had when playing on a powerful enough system with your friends. The controls are nowhere near as clunky as people say. I really enjoy the melee move sets that you can learn. Like kicking the feet out from under a guard and sticking your gun to his face is the shit.

If you play on a harder difficulty with friends the game can be really enjoyable and even at moments suspenseful. For example, In one particular moment I was fighting with my friends in a hall and two of them were infected. We didn't have any anti virus spray and we were down to our last bit of health when they turned and killed us. It was a pretty intense moment.

The game isn't supposed to be horror, it's supposed to deliver a fun co-op experience and too a degree it delivers.

7/10 because the game isn't perfect but it can provide some ""OHHH SHIIIT"" moments while playing with friends.

Don't spend more than 20-30 dollars on this game unless you plan on playing with good friends."
,Vergilio,2012-05-12T18:03Z,I wanted to say it was distribued by Capcom and developed by Slant Six. It's the first Resident Evil made by Slant Six.
,elitejoker,2012-05-12T18:56Z,"I GET A MESSAGE SAYING ""The program cant start beacause binkw32.dll is missing from your computer.try reinstalling to fix this problem"""
,warrior44,2012-05-12T20:52Z,"SEED SEED SEED SEED SEED SEED
SEED SEED SEED SEED SEED SEED
SEED SEED SEED SEED SEED SEED
SEED SEED SEED SEED SEED SEED
SEED SEED SEED SEED SEED SEED
SEED SEED SEED SEED SEED SEED"
,Hatebreeder_420,2012-05-12T20:53Z,"thanks for the up ez
game installs and works good but it sucks ass.
i uninstalled it after maybe 2 hours"
,ivory_soul,2012-05-12T23:00Z,"@Hishik The game is capped at 30 FPS. I have HD 5870, Intel i5 3GHz 8GB RAM and I have no FPS hits, but the game seems to be capped at 30.

Is there a way to use your GFWL account so you can get achievements, or do you have to use an offline profile to keep the save?"
,prince__vlad,2012-05-13T00:17Z,thx a lot man!
,SR4T9US,2012-05-13T02:15Z,"This worked great from the rip. I had another game with a live account so that didn't cause any issues.
i3 oc to 4.7, 550ti oc'd to 1 ghz, high settings all around.no lag, works great.. THX for the up..."
,somdy,2012-05-13T07:44Z,DIABLO III plsssss
,Poolsidzer,2012-05-13T13:26Z,"@salvadgery34
Yeah, you can download the crackfix to solve your problem
rａpidshare.coｍ/files/1701183455/Fix_serial_v1.9.zip"
,kthonos2,2012-05-13T13:47Z,"To Ati Radeon 6XXX series owners.
Do Not Install New Ati Driver Older From 122011
Is Better Works 100%, New Drivers Are So Bad, 2 Or 3 times restart computer before it finds HD Audio  And Sometimes No signal. GOOD WORK ATI RADEON SHITFACES!!!!!!!!!!!!!!!!!!!!"
,iQuitGamerscore,2012-05-13T16:45Z,i have this issue that the release date has not yet occurred so i cant play it? help plz.
,pluto_1973,2012-05-13T18:12Z,this game sucks....the worst resident evil ever!
,Sabbatmatyr,2012-05-13T19:12Z,"Any1 who`s gettin crash at startup of game click windows button type in services.msc in search box open it, then scroll dwn to Windows live ID sign in asst; if its showing as not runnin in status column then rght clik/properties, set 2 auto/ apply/ then clik start"
,DiegoForlan20,2012-05-13T19:22Z,THIS IS FAKE 100%  LOOK THERE FOR GAMEPLAY :http://www.capcom-europe.com/ WE DON'T CHOOSE CHARACTERS AND PREMIERE IS 2 October 2012! AND WE DON'T HAVE A LOGO AND MOVIE WHEN U LAUNCH GAME!!!!!!!!!!!!!!!!!!!!!!!!!!
,dieagain20113,2012-05-13T22:22Z,"these expendable accounts just repeat saying this game sux or this game not working, lol"
,goodie90,2012-05-14T02:23Z,SEED BITCHES... my DL IS ONLY 600 KB and upload is 7mb. if i dont get more dl i will not seed at the end!
,Hishik,2012-05-14T03:19Z,"@ivory_soul

I don't believe it's capped at 30 frames I normally stay around 45-60 frames per second. But I shouldn't be falling even below 60 with my setup unless the game is poorly optimized for PC."
,Pumpkings,2012-05-14T04:55Z,"Anyone else having huge frame rate problems with this? Is it the torrent/crack or just simply the game being a shit port to PC? 

Having problems on a PC that can run Skyrim at a solid 60 on high, even with the game windowed, everything low, no vsync, etc. Drivers are updated. Will check again. 

Even tried using game booster to no avail. Still drops frames pretty hard. Mouse control is garbage. "
,dieagain20113,2012-05-14T09:26Z,"maybe your resolution, graphic quality and aim speed set up are just wrong."
,rehceel99,2012-05-14T16:00Z,"+1 some say its a bad game, if it is good, ill buy one :)"
,dieagain20113,2012-05-14T18:59Z,"""if it is good?"" so why u +1 to bad game if u didnt even know the game? thats creepy."
,Onimaru78,2012-05-14T19:34Z,seed...seeed..seeeed...!!!
,goodie90,2012-05-14T23:36Z,"im in the game now..  install was easy.. all settings are at max... no lag what so ever..

intel core i5 quad 3.9 ghrz (clocked)
16Gb ram
GeForce GTX 560 TI 1 GB

i dont know what u guys are doing to make it NOT work u... 

i read some ppl say they have 12 gb ram and 1 gb grafic card... well i suggest u buy 1 gb grafic for more then 30$  or they dont last...


game  is good SEEDED 55 gb.. will seed  1-2 days till i hit 1000gb  

max opload 7.9mb have fun"
,BayGhost,2012-05-15T01:02Z,"Why are you guys bashing this game ? First of all, to whoever has any issues installing the game... Download (DUH!), mount, install, crack from the iso file, and play... If you don't have an account in game, you will be promped to create one. Select create offline account... Nothing more. It's not rocket science... 
Second of all... This game is awesome. I personally loved it, because it fills the story of resident evil 2 quite nicely, and i played it a few times already, and i don't think i'll stop playing it any time soon. Can't wait for it to come out so i can buy it, and play online. The story is sick, the graphics are sick, controlls are not too bad. Now quit your bitching, and if you don't like it, then by all means don't download it."
,Zipgun,2012-05-15T01:10Z,"@Hishik 

LOL Sorry dude but your rig ain't so much of a ""beast"" ;) 

LOL Just ragging on ya. I'm running my own build as well that will be outdated and upgraded as usual (well at least I do ;) ) in 6 months:
Liquid cooled
Intel 990 extreme 3.6
triple cross fired 7970's
32gb ram
No stuttering at all at max everything but even with my new sound blaster X-Fi titanium fatal1ty champion series sound system.

The freaking game still has the no gun sound bug when ya respawn crap. WTF? And I followed all the tips and tricks. And this game aint even good enough to buy. I usually buy if its good (torrents are demos to moi)So hell I'm just gonna play it out and delete this sucker or maybe buy it when it hits the 5 dollar bin at walmart etc. :)

"
,savagecabbage,2012-05-15T01:56Z,"@zipgun  bullshit, nobody who can afford to spend nearly $1000 on a cpu, and fork over nearly $1500 on 3 gpus would be downloading games for free."
,goodie90,2012-05-15T03:01Z,haha owned.. but still diagree lol my bro has 64 gb ram and 4.5 8cups with 6 gb graf he still dls games why aste money if u can get it for free?`?
,Zipgun,2012-05-15T09:27Z,"@savagecabbage 

LOL! Fucking jealous ass kids. Don't you fucking read this game isn't even out yet and I'm trying it out. And I'm NOT freaking 12 y/o kid dude. I work for a living and have kids who are probably older than your broke ass. That's how I buy stuff you idiot I work for a living. LOL! Owned? Yeah right :)"
,Zipgun,2012-05-15T09:33Z,"Man that was rich LOL!!!

NO ONE..Can afford a measly $1000 bucks cpu and couple of video cards? What a fucking joke HAHA!! You think that's expensive? Try a family with 2 kids a home, cars, insurance etc etc etc. I don't live with mommy and daddy anymore little boy."
,Zipgun,2012-05-15T09:47Z,"@savagecabbage

LOL! Usually I won't even bother with kids like you. How can I afford a measly $5000+ PC?

Easy I'm not a 10 year old who lives with mommy and daddy. I own a home, cars and family with 2 kids who are probably older than you're broke ass I work and pay my bills. 

And you obviously don't read as I said I use torrents as DEMO'S?  And like the other dude said its free. ;) Sorta like you tho you're most likely broke.  Just because you can't afford stuff doesnt mean the rest of us can't. NO ONE can afford it... Haha now that's rich!!

 The only who got ""OWNED"" is YOU kiddo. :)"
,Zipgun,2012-05-15T09:56Z,"Wtf is with this comment thing 3 times it didnt come up and all of a sudden it appears? Anyway saveacabbage or whatever your name was. Read the 3rd version it's the abridged version  LOL!

Ok enough with the kindergarten crap. Anyone have a real fix for the gun sound bug? From what i'm seeing so far on other forums seems like either its the game itself or the c word. In anycase this game isnt worth the effort to fix anyway. Seems like just another left 4 dead clone."
,savagecabbage,2012-05-15T13:26Z,"@zipgun

Yeah I totally believe you, you really sound ""mature"" enough to have two kids. If that is true though, then don't you think you are a bit old to be flaming at people online, surely only kiddo's do that kind of thing, maybe your mommy and daddy didn't raise you right. I wonder how your kids will turn out."
,savagecabbage,2012-05-15T13:49Z,http://legacy-cdn.smosh.com/smosh-pit/032011/trolling-irl-1.jpg
,led_zeppelin_2009,2012-05-16T12:52Z,"CAPCOM LISTEN TO THIS: Immediately FIRE the director, the producer and who ever came with the idea for this game. THIS IS GARBAGE, worst Resident Evil ever. IF you guys are only interested in making money, I will tell everybody that I know to DONT BUY this game. And﻿ also during my DAY OFF I will go to the nearest GAME STOP and discourage EVERY CUSTOMER that tries to buy this game!!"
,Flixe,2012-05-16T18:50Z,"@ Zipgun

Wow, bigboooooy. 
You're really living the dream, huh! "
,feniks12,2012-05-17T15:48Z,"http://viruskompjuteri.com/game.php?game=pc-games/system-requirements/Resident-Evil-Operation-Raccoon-City.html

Minimum Requirements

* OS: Windows XP, Vista or Windows 7
* CPU: ntel Core 2 Duo 2.4 Ghz or better, AMD Athlon X2 2.8 Ghz or better
* RAM: 2 GB
* HDD: 8 GB free disk space
* Graphics: 512 MB NVIDIA GeForce 8800GTS or ATI Radeon HD 3850 or better
* Sound Card: DirectX 9 Compatible"
,N4TH298,2012-05-17T21:42Z,How come this is on here? the game isnt even out for pc yet
,Damuel,2012-05-17T23:07Z,"Seriously guys, try looking back a page or two before posting the same damn complaint again and again.

The gun sound problem has been reported as being fixed when you run the game as an admin. Try that, multiple people with the problem have said it fixed the problem."
,ehsan15,2012-05-18T00:23Z,"I have 2 problems here:
1. what i put for product key of microsoft game live?
2. This game is laggy, how i fix lag problem to this game and to all other games that are HD?"
,bgunzelite87,2012-05-18T17:39Z,Game sounds are really bad.Damn do you play this before you upload this crap.
,samerdl,2012-05-20T10:06Z,ugh why is every 1 still downloading this.. it fucking sucks
,OMGTFO,2012-05-20T12:08Z,"Please help. I can't seem to make the game work on my computer. 
The game loads fine but after the Nvidia logo game stucks on loading screen forever w/ background music still playing. 
My computer specifications are good enough to run this game. :("
,stankobre,2012-05-20T13:00Z,"For anyone having problems runing this game, or having probs with xlive 
download this torrent http://thepiratebay.se/torrent/7283828
and put xlive.dll in the game folder."
,jfangeles,2012-05-20T14:30Z,"@stankobre

dude, is there any way for the xbox360 controller for the pc will work even if I already put the xLive.dll inside the game folder?"
,OMGTFO,2012-05-20T17:26Z,@jfangels - That dll file is for GFWL error only and have nothing to do w/ being able to make your controller work. You probably should try Motionin Joy software make it work.
,TaleMunja,2012-05-21T01:36Z,"Hey peoples, i am so confused here:

 I started the game, it's offline, i have expiriance in this-no problem. 
 Starting a offline campaign and game offer me to choose character. I choose and there is ENTER option and BACKSPACE. I pressed ENTER and character appear. I press again and then allot of characters appear. I choose and pres Enter....There is no other options then moving in circle. Can you help? tnx"
,dieagain20113,2012-05-21T03:12Z,"try space, lol"
,ArmutAsil,2012-05-21T06:34Z,"Perfect torrent - shit game.

I will try not pay attention other writer opinions...until i meet Birke or something motherfucker mutant guy. Eye on shoulder, huge pipe in hand, and hit me hard:)
""shoot the eyes to slow it"" ! Yeah, i can't get up, because permanently attacked me, so i how shoot this eyes?! Kill me twice, and i will decide quit to desktop.
Money for this? Forget about that.

I will continoue my adventures in Tropico 4 - also extremezone stuff."
,ReadThisNow,2012-05-21T14:55Z,Zipgun is a 13 y/o trying to sound all grown up. 
,teejayz23,2012-05-21T19:13Z,I need a little help here guys..the game gives me the black screen..it says the game stopped working and needs to shut down..i have updated the drivers..already have the GFWL account offline..still this happens..need help please?? thank you!! :)
,Hishik,2012-05-22T00:10Z,"""Insert immature response to ragging on my PC here""

Nah, it isn't top notch but it's a considerably nice PC especially for people around here who know nothing about PC Hardware. I went to the Best Buy here and they are still trying to get people to buy GTX 9800's, it's sick.

Anyways I can STILL run almost all games 100 % max so a game like this shouldn't be a problem especially when it looks no where near as good as Witcher 2 and I have hardly any issues with that.

Also, people.... do yourself a favor and at least make it past the first mission that one was pretty shit.... But I enjoyed the others. My main complaint is the gun sound issues."
,Mnaytorri,2012-05-22T04:23Z,@Zipgun is a totally fukin azz!
,sdazcasd122,2012-05-22T16:44Z,Some problem whit crack try some work crack : https://thepiratebay.se/torrent/7289882
