User Type,Username,Date,Text
[V],extremezone,2012-05-04T12:39Z,"Note: We need anything you can offer as early releases,seedboxes,links,accounts,etc
please contact us on piratepedia[@]msn/gmail.com or our website torentz 3xforum ro
Seed Stats: 20-400 GiB at aprox 10 MiB/sec/20 slots per torrent

Resident Evil Operation Raccoon City-SKIDROW Torrent Free Download

http://thepiratebay.se/user/extremezone/0/7

How To Get Your Maxspeed (uTorrent)

Torrent Client - Preferences - Bandwidth - Number of connections - Set aprox. 500 for each 
Torrent Client - Preferences - BiTorrent - Protocol Encryption - Forced
Bandwidth Allocation - High (Set download/upload limit - Unlimited)
Stop Other Active Torrents - Start downloading and wait for connections.
Enjoy and Seed for at least 1:1 ratio. Don't forget to say thanks/leave reviews.
For more info,crack only,PATCH,serial,keygen,trainers,CRACKFIX,UPDATES,
system requirements,cheats,NFO,gameplay trailers,free downloads,
pc iso,demos,screenshots,visit some RELEASE SITES or official web pages. 
IF the game does not work for you then update drivers, directX, components
as netframework/redist files/etc, run as administrator, change compatibility
mode, block/disable access to internet, copy crack/overwrite, other tweaks,etc
Search here for any future updates/working status/etc http://orlydb.com/s/games,
http://gamecopyworld.com or any other quality Scene Release & filesharing sites.
Stop using stupid av's as AVG reporting false positive viruses-disable or use ESET"
,freaky.X,2012-05-04T12:46Z,THANKS...YOU R THE BEST!!!!!!!!!
,JuYeon,2012-05-04T12:51Z,oh god! im waiting for this thank you extremezone ur the best! cant wait for darksiders 2 :D
,ZeroGravityZero,2012-05-04T12:52Z,"Although I have this game on PS3 , I have to say this is a really good game! Nemesis is a bit hard to * kill * though half - way through the Campaign :)"
,preda96,2012-05-04T12:57Z,"Wtf? This game soppouse to come out 15th may? is this full version, I mean did you try it ? @extremezone"
,dareangel11,2012-05-04T13:05Z,Nice upload.. downloading right now
[V],extremezone,2012-05-04T13:06Z,show comments
[V],extremezone,2012-05-04T13:08Z,preda96 it's scene release so it's full and working 100 procent...didn't have time to test it first because i have lots of work to do these days and this is the reason sometimes will have delay of few hours to upload it after scene release
[V],OneFourOne,2012-05-04T13:29Z,Thank you Ez =) 
,einzelhaft,2012-05-04T13:39Z,THX!
,I_dogg,2012-05-04T13:44Z,wtf is this shit? what has this to do with resident evil? how could these retards from capcom fuck up one of the best gameseries ever? thx for upload but this is the biggest disappointment in history of gaming.
,sinan101,2012-05-04T13:54Z,"thanx :) 
seed 4 ever "
,greenman541,2012-05-04T13:57Z,does it work online
,greenman541,2012-05-04T13:59Z,works online?
,iamnickyo,2012-05-04T14:03Z,Thanks EZ!!
,dirtbag84,2012-05-04T14:10Z,OMG!already here!thanx a million!!!
,abxyx,2012-05-04T14:10Z,"Now, its time for us to seed"
,adighraiz,2012-05-04T14:19Z,"thanks extremezone
am fan of your work
you always choose the big name to publish

@greenman541
not yet as i think
need some time to crack online like the previous
xlive crack take sometime to work
hope someone confirm it

thanks uploader again
you make my day"
,pirate6662012,2012-05-04T14:39Z,FINALLY
,Taix4,2012-05-04T14:42Z,Got heartattack thought it was the movie but then saw SKIDROW...
,psdasila,2012-05-04T14:49Z,Thax man 
,jkmk79,2012-05-04T14:56Z,Gives error about memory... Anybody else having this?
,Pavlezzz,2012-05-04T15:21Z,Seeeed seeed seeed seed seed!
,Whitebb,2012-05-04T15:39Z,"Cool thank u man, Guys after they have released this game for PS3 and Xbox360 they found out that there's alot of mistakes in the game, that's y they pushed PC version date, so means the game will be greatt"
,sealx86,2012-05-04T15:47Z,10q very much!
,omegaviper,2012-05-04T15:47Z,can you play this online with the crack or do you have to have a mini image?  or can you mount the image and play online? please specify.
,jogodoido1000,2012-05-04T15:54Z,Extremezone YOU ARE THE BEST!
,bobby358,2012-05-04T16:08Z,Is this in english? cos last RE I got here was in korean ;S
,ALuuuuuuuuuuuuuuu,2012-05-04T16:35Z,"EXTREMEZONE GAVE ME AN ORGASHM!
Nah, seriously, thanks for the hard work guys!"
,preda96,2012-05-04T16:36Z,"@extremezone all right man, I understand. Thanks for torrent bro. You are my favorite uploader on tpb, so keep up the good work! peace"
,shauwy,2012-05-04T17:00Z,"@Extremezone 
Here you are the BEST!!!!!!!!!!
Thanx for that ;)
and Skidrow too^^"
,dieagain20113,2012-05-04T17:27Z,"FAKEEE, THIS IS NOT AVENGERS MOVIE!!"
,UniversalSoldier1911,2012-05-04T17:45Z,"One of the most awaited games of this year for me. Although the rating is bad, a Resident Evil fan will still play it. Thanks a lot."
,Ali-Madan,2012-05-04T17:53Z,Seeds please 
,ALuuuuuuuuuuuuuuu,2012-05-04T17:59Z,"@dieagain20113 
God dammit Bamby!"
,BlackSite99,2012-05-04T17:59Z,Thanks :)
,Ntldr.,2012-05-04T19:17Z,Thanks extremezone! You are the best.
,camelcloud,2012-05-04T20:41Z,"Shittiest ""Resident Evil"" game ever to be made. From horror to pure action. This shit has more action than the CoD franchise."
,Marcosmgt,2012-05-04T20:46Z,Thank extremezone!
,fullmetaljc,2012-05-04T20:48Z,"Damn, people who get the game should seed.. I mean WTF, don't be a cockblock and FUCKING SEED!"
,Lardzor,2012-05-04T21:09Z,"Here's gametrailers.com's review.

http://www.gametrailers.com/video/review-resident-evil/728340

They didn't think much of the 5 hour single player campaign."
,extrarice,2012-05-04T21:17Z,Thanks extremezone!
,vinit5191,2012-05-04T21:18Z,Thanks extremezone !
,ChriisRedfield,2012-05-04T21:40Z,"extremezone, thanks! you are the best!"
,Pavlezzz,2012-05-04T21:42Z,Bad Quality It's a virus or something my Computer shuts down on 1st level! 
,ImmaSharkk,2012-05-04T22:46Z,"Guys, if you wouldn't mind seeding. I'm downloading at a whopping 30 kb/s. This is horrid. 

Anyways, thanks Extremezone."
,Jayzen_Freeze,2012-05-04T23:38Z,Right on wanted this so bad but don't get paid for 2 weeks this is great till then. If it is a good game I will always want to buy it some games i will get hate delete never ever buy. im babbling THANKS 
,0rochimaru,2012-05-04T23:45Z,"@camelcloud

Incidentally, the very retarded demographic Crapcom are targeting ."
,Jayzen_Freeze,2012-05-05T00:17Z,Game crashes to desktop...
,Jayzen_Freeze,2012-05-05T00:26Z,"Sorry, games for windows live had to be re installed. I knew I gave you a +1 right off the back for a reason. Great work and download speed is impressive. "
,WestPt,2012-05-05T01:44Z,DELETE torrent+data
,ChriisRedfield,2012-05-05T03:12Z,SEED PLEASE! SEED PLEASE! SEED PLEASE! SEED PLEASE!
,ashiva8910,2012-05-05T04:27Z,If I have a GFWL product key can I register this game now or do I have to wait until the 18th?
,Pavlezzz,2012-05-05T05:45Z,"Still my Computer Keeps on shutting Down, Why?! I have the Reqs To play the game! "
,simonb6868,2012-05-05T06:26Z,"Thanks Extremezone, Skidrow and PB for the upload.
Many thanks!"
,mileno123,2012-05-05T07:43Z,love it
,mohee23,2012-05-05T07:47Z,"@Pavlezzz
Maybe there is an overheating problem with your system and you should get your cpu checked...."
[T],swebarb,2012-05-05T12:05Z,this game sucks bigtime.. dont expect RE quality.. :(
,Moswco,2012-05-05T12:46Z,"when im getting to the capcom image﻿ it say ""Resident Evil Operation Raccon City Stop Working"" and shutdown the game anyhelp?"
,thehotsizzller,2012-05-05T13:32Z,"Its a damn Boring game....!!!!
Hate the Game Mechanics,....!!!!"
,LaNPaRtY1987,2012-05-05T14:03Z,yes this is crap game!:)
,koteyz,2012-05-05T14:25Z,"it is really stupid for people to download and not seed, FOOLS!!"
,dieagain20113,2012-05-05T14:38Z,"ya, and its not Avengers movie"
,tomgam75,2012-05-05T15:17Z,"http://viruskompjuteri.com/game.php?game=pc-games/system-requirements/Resident-Evil-Operation-Raccoon-City.html

Minimum system requirements

* OS: Windows XP, Vista or Windows 7
* CPU: ntel Core 2 Duo 2.4 Ghz or better, AMD Athlon X2 2.8 Ghz or better
* RAM: 2 GB
* HDD: 8 GB free disk space
* Graphics: 512 MB NVIDIA GeForce 8800GTS or ATI Radeon HD 3850 or better
* Sound Card: DirectX 9 Compatible
* DirectX: Version 9"
,Ali-Madan,2012-05-05T16:18Z,please seed when you finish downloading people
,Ali-Madan,2012-05-05T16:24Z,"thnx extremezone, great upload, I will seed when am done"
,nox234558,2012-05-05T18:58Z,"hi guys i downloaded this game but it keeps telling me this program sttoped worikng and does this realase its clean please tell and also i have i7 2600k
8gb ram HD 6970 2gb so that s it tnx"
,joshr_chanfan,2012-05-05T21:07Z,"dubbbby,

Just in case you've been living under a rock, or perhaps maybe you're new to the piratebay, but extremezone uploads most of the quality torrents here on the piratebay. He is well known and well respected.  His uploads are not fake. So go spew your nonsense somewhere else. 

And by the way, you commented the same message four times in a row.  You only have to submit your comment once. Your comment might not appear right away. just reload the page or come back later and you'll see it."
,TECTMFINC,2012-05-05T21:08Z,please seed at least for a lil  while 
,nox234558,2012-05-05T21:35Z,can someone confirm thats it clean
,kaiomaga,2012-05-05T21:51Z,Game works but the frame rate gets stuck after the logos and everything goes very slow even in the menus. anyone else getting this?
,nox234558,2012-05-05T22:04Z,yea but is it virus free tell me please 
,nox234558,2012-05-05T22:08Z,please i will be seeding for ever i have 20mbs just tell me is it virus free
,omegaviper,2012-05-05T22:27Z,@nox234558 it's obviously virus-free you dumb ass look at the uploader.  Your already seeding it and saying you will be for a while so why are you asking.   I swear the ignorance in this world is disgusting.
,kaiomaga,2012-05-05T22:32Z,No it's not a virus. i got no warnings or alerts
,pedro_lol,2012-05-05T22:37Z,almost a day and 45% seed dammit
,druhklam_orbowetsch,2012-05-05T22:44Z,"Works perfectly, for Live! to work just make an offline profile and log-in with it and everything would be OK, BUT the game SUCKS E-N-O-R-M-O-U-S-L-Y!!! "
,kaiomaga,2012-05-05T22:50Z,Is no one else getting slow down? it starts soon as GWL loads up
,TakeTheSkies,2012-05-05T22:55Z,"@asd08 I also don't have any gunfire noise, it worked until about halfway through the first level. Not too sure how to fix it though."
,Lerianis2,2012-05-05T23:00Z,"Is there any way to get this game working on Windows 8 Consumer Preview?

Every time I try to start it, it exits right back out of the game."
,TakeTheSkies,2012-05-05T23:02Z,"@asd08 This just worked for me, right click your raccooncity.exe, go into properties, compatibility, and set it to run program as an administrator."
,ChaosSabre,2012-05-05T23:11Z,People going AAAARHGHFGRGHGF!!! FAKE SHIT!! you should probably realize this is an extremezone torrent ya know? And it works perfectly. Sure the game does suck monkey balls but it works.
,nox234558,2012-05-05T23:15Z,omegaviper sorry but im just to scared so i know that extremezone has no virus but some people are scaring me and also i checked files with bitdefender 2012 ther is no virus but tnx guy and kaiomaga what av you are used please tell me
,Jayzen_Freeze,2012-05-05T23:30Z,"THIS is not fake.
THIS has no real viruses if any found false positive.
THIS works ie playable.
THIS game sucks compared to the others, no inventory, no combining stuff, It is an all out shooter like gears of war ish i replayed the 1st mission boring to many team mates I broke up and packed a bowl while my ai teammates killed everyone for me."
,pekkapouta,2012-05-06T00:05Z,"game worked great until after i managed to run away from birkin and hunk stayed behind closing the door then it just crashed with no error message. the game in itself from the very short time i played it is propably the by far crappiest game i have ever played, seriously theres no words to describe how horrible it is."
,Snorkel76,2012-05-06T00:19Z,Works great except for the gunfire sounds for me too..tnx for the upload.
,Snorkel76,2012-05-06T00:24Z,Tnx asd08. that worked.
,FpsPoopinator,2012-05-06T01:30Z,guys stop complaining about the fucking gameplay and start careing about the story insted omg
,dieagain20113,2012-05-06T02:17Z,"I dont think Resident evil must be Horror genre. During zombie outbreak, its horror genre for citizen victim, but its shooting genre for cops and special forces. Depend on wut role you are playing. I like this shooting genre too. "
,Slurpin10,2012-05-06T02:36Z,so so so sick of u f*****g leechers 
,Protoz,2012-05-06T02:48Z,"@dieagain20113 Using your logic Battlefield 4 could be a noncombat flight simulator game, you know this time you take a role of a Boeing 747 pilot that transports the troops from point A to point B..... Your statement is fucking idiotic and this game sucks. I would have more fun playing resident evil 2 right now then this piece of shit garbage, at least that game had a inventory system, better story, and better graphics."
,kidlonewolf,2012-05-06T03:00Z,"thanks for the upload extremezone

personly the game is shit tho it lost the biohazard feel."
,dieagain20113,2012-05-06T04:35Z,"They can make wutever genre they want to try, they even put gameplay video before released date. Nobody force u to play this, mr.center of the world."
,a7x070,2012-05-06T05:52Z,"hey i was wondering if anyone can help me with an issue apparently only im having when i try to start the game i get this ""the procedure entry point
??1_nonreentrantpplockholder@details@concurrency@@QAE@XZ could not be located in the dynamic link library MSVCR100.dll"" any help would be much appreciated"
,Hitokiri1,2012-05-06T06:04Z,Game slows down enormously when i enter the menus or in game 3-4 fps LOL wtf! 
,majuaraan,2012-05-06T06:37Z,Can someone help when I click on the game to start a black screen flashes for like 3 seconds then exits?
,rcctp,2012-05-06T07:17Z,seedddsssssssssss plzzz
,nox234558,2012-05-06T09:18Z,"TNX Extremezone its virus free ecxept 4 cookies but  
dont worry and just one question  i have problem when i start the game chrashes program sttoped working please tell me how to fix this "
,bLauney,2012-05-06T12:22Z,please seed guys :)
,nox234558,2012-05-06T12:53Z,guy im seeding but it crashes every time to desktop its not my pc 
,nox234558,2012-05-06T13:01Z,please new crack it crashes to desktop i have i7 2600k 8gb ram & HD 6970 2gb so it crashes to desktop 
,Deslip,2012-05-06T13:07Z,I have to register a windows live account to be able to save but when i try to register I must enter a product key! Please help!
,nox234558,2012-05-06T13:29Z,i cant even open game please new crack and deslip make an offline profile and disable you internet connection and it should work 
,haps88,2012-05-06T13:32Z,"Runs fine on good old r4870 however FOV is totally unplayable, i tried edit camera settings but its no go. Waiting till somone smarter mod it ;)"
,nox234558,2012-05-06T13:50Z,Deslip you need to make offline profile and disable your connection till you make profile so it cant ask you for a key but mine crashes to desktop every time someone have solution 
,deepak_rokz,2012-05-06T14:24Z,"Horrible game 
Gr8 upload"
,epic_seeder97,2012-05-06T14:34Z,is this game leaked or has it been officialy released
,opaleg,2012-05-06T15:41Z,"This game is very fun. In the vein of squad based third person shooters. It has a lot of details you'd noticed if you played the series.

People are saying its bad just because its not Resident Evil 2 redone. The game is good on its own. People here just say its bad and no comment on it. I hate sports games but that doesn't make sports games bad. It's all opinion."
,kaiomaga,2012-05-06T15:43Z,"Found the salution to my problem with slowdown/frame rate.

Roll back your graphics driver to the previous version and the game runs smoothyly."
,opaleg,2012-05-06T15:45Z,"Nobody listen to people talking shit about the game without giving an actual reason or opinion. 

Also, of course it's not the fucking Avengers movie. You GODDAMNED FUCKING IDIOTS!"
,bladerunnermkd,2012-05-06T16:02Z,"almoust every game i have is from SKIDROW ,no problems till now...I have offline profil and my drivers are up to date,but it crashes every time to my desktop,I dont know what is the problem and beleve me,I am veteran in this."
,Ali-Madan,2012-05-06T16:25Z,Seeding now
,Ali-Madan,2012-05-06T16:26Z,working like a charm
,dieagain20113,2012-05-06T16:32Z,"4 eyes is fun character, she can turn 1 zombie into powerful ally every 25 second, more zombie ally after upgrade skill."
,ResidentEvilQueen,2012-05-06T16:35Z,"I am terribly sorry... New at this!

I downloaded it - it went smoothly :)
Installed it - smoothly as well!
Until upon running it asked to be connected to Windows Live. With or without Internet access it just won't start for me. I have an offline profile from playing Resident Evil 5 :(

and, with internet, it says the game is ready on the 17th of May

I live in Asia*

Any help to bypass this? Thank you all.
I hope I did not offend anyone. I love extremezone's games as well :D"
,Deslip,2012-05-06T17:03Z,How do i create an offline profile?
,HLyricist,2012-05-06T18:28Z,"Got a slight problem. When i select the Campaign mode, choose the player and press ''ready'' - the game does the countdown, starts the loading screen with that text, then goes into Black screen.

After that - nothing, just the music in the background playing.

Im running a Dual Core Black Edition AMD CPU @ 2.8 Ghz, got 2 Gigs of Ram with a HD 4890. 

Any ideas what might be the problem?"
,BioHazardBiH,2012-05-06T19:08Z,WTF its happen with good old scary Resident Evil this game its just sad :(
,krikri3,2012-05-06T21:02Z,good graphics or shitty console port with crappy graphics like all games lately?
,nox234558,2012-05-06T21:13Z,new crack pleaaaaase ;)
,Rogue19,2012-05-06T21:25Z,bad game...w8 for re6 ;D
,snowstone,2012-05-06T22:18Z,game works perfect fast dl too yay! ty extremezone
,Pingguopi,2012-05-06T23:02Z,"Awesome game, but I have to admit the campaign was a bit too short!

In any case, thanks for the upload."
,dustcough,2012-05-06T23:09Z,Game Works Perfectly Thanks a Bunch!!!
,skotosa,2012-05-07T00:25Z,Game sucks. I miss the classic style RE games. Why can't they just give us those again somehow with modern day graphics. Jeez times are moving slow. I should be playing DX11 Resident Evil Games. Nope... 
,majuaraan,2012-05-07T00:26Z,"This IS CRAP, why am I the only one that this game doesn't work for, the release date check thing is screwing me I think how do you fix this?"
,gustavobocao,2012-05-07T00:43Z,please ppl seed more 2 days and dont got 30% please seed.
,dieagain20113,2012-05-07T02:54Z,"cheat trainer http://games.softpedia.com/dyn-postdownload.php?p=110763&t=4&i=1
home activate, F1 HP, F3 Ammo, I did enjoy the game with F3"
,Burner13,2012-05-07T05:22Z,"This is F***ING RIDICULOUS... almost 6x's the amount of leechers than seeders... you faggot leechers are douchebags...

Have a nice day.... fuckers"
,HLyricist,2012-05-07T08:16Z,"@majuaraan Actually, the games doesnt work for me neither. Got that black screen thing when it loads up a level."
,proffsim,2012-05-07T08:41Z,"THIS GAME IS FAGGOT SHIT GAY!!
Fuck this faggot homo fag shit. It's made for drooling low IQ mexicans & white trash. Faggot fuck japs shit dump fag fuck asshole fucks.
GOW/COD FAGGOT SHIT!!
NIGGERS!!"
,kuske93,2012-05-07T09:40Z,"Thank you extreme,best as always.Cheers!"
,nox234558,2012-05-07T09:42Z,new crack it crashes to desktop
,jinxes1211,2012-05-07T13:11Z,seed you ungrateful brutes!
,banditory,2012-05-07T14:47Z,"OMG, don't download this sh1t. WORST GAME EVER !  useless level design, sound effects, graphics, game-play....just total SHIT"
,dieagain20113,2012-05-07T16:17Z,"i think this game is a pre structure of future series, this game has no free path or side mission like Prototype game. There are still many possibilities to improve future RE. I guess RE6 will have similar gameplay and better system.  "
,Skaix3,2012-05-07T16:28Z,"For ATI users if u have problems with frame rate go to CCC->Gaming->3D Application Settings and reset everything to default then click Apply.

If you have problems like crashing 3-5 seconds after you start game Install Windows live sign-in assistant make sure that windows update service is running before you start Installation."
,kenshin03,2012-05-07T16:46Z,"hey guys, im having a bit of a prob changing my video settings. it keeps resetting itself. any ways to fix this? :)"
,psdasila,2012-05-07T16:49Z,seed plz
,limneos,2012-05-07T17:53Z,wow this is downloading slow.... like 5kb/s
,Miss101,2012-05-07T18:00Z,"So, I see you all jumping around, shouting that you're play it it.Can somebody EXPLAIN to me how to make a offline account for  GFWL?I can't save the game and I don't want to play it without saving.Will there be a crack or something for the games for windows live thing or?

Thanks."
,dilinwe,2012-05-07T18:16Z,"Que xuxa leechers culiaos!!!
llevo subido como 200 gigas y no llevo ni la mitad descargada. paren la wea!!"
,Tsoof,2012-05-07T18:26Z,"I have a problem and i can't find a solution!When i start the game i take black screen while it loads and then error..:(((((((( (exactly like the street fighter X tekken..)
I installed it again,run it as administrator,switched compatibility mode,but nothing works... "
,stevoidol,2012-05-07T18:53Z,in my opinion that this game is SUPER STUPID a game for 12 year olds 6/10
,Burner13,2012-05-07T18:59Z,"@Miss 101..... No, there is no way to save in this game. Unfortunately, unless you have, or find, a product code for it, then you're not going to be able to save it because of the GFWL. I installed it, copied over the crack and everything works. So whomever is having problems with this game, it's your computer. Sorry."
,Burner13,2012-05-07T19:20Z,"@Tsoof... just saying ""and then I get an error"" doesn't help anyone.... if you're specific MAYBE someone will be able to help you"
,Burner13,2012-05-07T19:42Z,"and for those of you trying to save.. all you have to do is when the GFWL thing comes up select Create New Profile... then scroll down to USER LOCAL PROFILE... this will create an offline profile and you'll be able to save... 

There ya go..... enjoy!

If you're still confused Youtube Search ""create offline GFWL profile"""
,aytma,2012-05-07T20:31Z,"+1
earlier than i thought!, keep it up skidrow! free pc games for poor people!!, fuck sopa, fuck acta, fuck pipa, pirate forever!!!!!"
,Pavlezzz,2012-05-07T20:41Z,nvm I fixed It but The game Is boring Idd :) 
,Fxxing,2012-05-07T21:19Z,"Direct link i made,  if u want:
http://samumu.com.br/pot/sr-reorc.iso"
,HLyricist,2012-05-07T21:27Z,"Same thing with black screen.
Dont know what is causing it.

Videocard drivers are up to date, got DX 11, running as administrator, tried changing settings, even to windowed mode, tried compatibility mode.

Still getting a black screen every single time after i press the ''Ready'' button in Campaign mode."
,tomgam75,2012-05-07T22:30Z,"http://viruskompjuteri.com/game.php?game=pc-games/system-requirements/Resident-Evil-Operation-Raccoon-City.html

Minimum system requirements

* OS: Windows XP, Vista or Windows 7
* CPU: ntel Core 2 Duo 2.4 Ghz or better, AMD Athlon X2 2.8 Ghz or better
* RAM: 2 GB
* HDD: 8 GB free disk space
* Graphics: 512 MB NVIDIA GeForce 8800GTS or ATI Radeon HD 3850 or better
* Sound Card: DirectX 9 Compatible
* DirectX: Version 9"
,Darksteel165,2012-05-07T22:39Z,"Game works perfectly, offline account works. Game seems kinda meh I prefer the older style of Resident Evil.

Thanks for the upload Extremezone"
,Tsoof,2012-05-07T23:01Z,"It says ""the file resident evil bla bla stoped working'.."
,revan09,2012-05-07T23:15Z,Can't Save the game? So why would i download? i wont play for hours then when i go to sleep i lose everything lol there is no point 
,Tsoof,2012-05-07T23:42Z,@HLyricist you are in better shape man at least you see something you see a button!
,virtualmatrix258,2012-05-08T00:37Z,"You stupid fucks! Pirating is for people who can't afford games but you should always support the developers. If you like the game, buy it, support them. They work their asses off for our entertainment."
,Call_of_duty,2012-05-08T04:17Z,"@virtualmatrix258 
look who's talking lol"
,dieagain20113,2012-05-08T04:20Z,"u can save game, create new account, scroll down find ""create local account"", type in ""a"" and done. next time u start game, just press ""esc"" to skip those game for window blah blah blah, u wont need to input account name ""a"".
play any game u need 1. directx  2. game for window live 3.5  3. your graphic card working, maybe Nvidia driver.  "
,j_ulysses,2012-05-08T05:01Z,"@dieagain: where's this ""create new account?"" it only ask for new profile or existing profile, even if you create new profile, it ends up asking for Product Key.. and nothing, still ends up nothing.."
,dieagain20113,2012-05-08T05:59Z,"select new profile, then find ""local profile"" among text content box below.
There is a fun move, use blade to hit then press ""E"", will instant kill zombie or soldier.   "
