User Type,Username,Date,Text
,namamaslivite,2012-05-23T00:17Z,If you have black screen try this crack https://thepiratebay.se/torrent/7290973 i no have anymore black screen :) (party)
,siro68,2012-05-23T04:05Z,Some problem whit crack try some work crack : https://thepiratebay.se/torrent/7289882 coloca de novo ..
,dieagain20113,2012-05-23T09:34Z,"http://thepiratebay.se/torrent/7286954/Resident_Evil_Operation_Raccoon_City_DLC_Pack__multi9.exe
the new download is out, u can play good guy side from Free Play. and new grenade launcher."
,Devilhahalo,2012-05-24T16:26Z,"not sure why many people are having problem with this game, before download, check gameplay at youtube, see it 1st, then decide, don't download 1st, then play, then say its garbage, 

for me its fine, since im a fan of RE, i didn't encounter any problem installing the game except the game shut down at mission Redemption, trying to find the solution for this..."
,L-sama,2012-05-24T20:51Z,Files infected with malwares =(
,dieagain20113,2012-05-24T21:59Z,"nobody cares about malware, antivirus is biggest malware, lol. it deleted my cheat trainer, damn. "
,BurnItRIpIt,2012-05-25T01:14Z,u don't die if u seed
,tehphilosopher,2012-05-25T01:48Z,"what's the point of the crack if it's not needed? Before I made an offline account, it changed nothing.  "
,bhinder94,2012-05-25T04:25Z,"DURING DOWNLOADING my game is stuck at 78.9% and show a message
DATA REDUNDANCY ERROR.
WHAT IS THIS.AND MY HARD DISC IS FREE UPTO 68GB.SO WHY IT IS HAPPENED.PLESE TELL ME THE SOLUTION"
,erickexp,2012-05-25T08:02Z,very good
,Resilience777,2012-05-25T09:46Z,"OK game runs fine for me, just put this XLive.dll file in the game folder:
http://thepiratebay.se/torrent/7283828

But seriously, WTF Capcom? You expect someone in Singleplayer on the easiest difficulty to survive a whole fucking horde of Lickers near the beginning of the game, by emptying 2 whole clips into EACH ONE!? All the while you and your team are constantly getting infected, with only 2 Anti-virus bottles laying around to compensate?And there are like 30 of these fuckers in one room? Jeez, can't imagine how retardingly hard it's going to be further in the game.

What kind of piss-poor rookie director did they hire to make this game? Anyways, this is one game that I can understand why everyone's criticizing. A really big let-down & I wouldn't recommend buying it. But hey, to each his own opinion, so try it for yourself.

But nonetheless, thank you Skidrow for taking the time to release your games, keep up the great work."
,dieagain20113,2012-05-25T14:11Z,"there are many zones where u can skip monsters, run to target location and enemy are gone. Run + knife = running knock down. or u can play with ammo trainer, or fight near ammo box."
,the_carobnjak,2012-05-25T20:35Z,"Whether this is just work a campaign, or they can play and something else .."
,SHr1KeS,2012-05-26T00:26Z,"I wouldn't even bother with this one guys. 
Its a terrible PC port, buggy game. Retarded AI, controls are just plain weird, the list goes on and on. 

Its only worth playing if you have a few friends to play with. Otherwise its a waste of bandwidth. "
,DeadStawker,2012-05-26T05:36Z,Works perfecyly just follow the instructions. I have only played the first mission
,CuttURface,2012-05-26T08:05Z,"Thx ez for the upload.

This game is just plain Awful.
team mate AI's are horrible.
shooting system terrible.
environment- plain and dull.
Combat system(falling and getting up is really annoying).
Any good features the game may have is trumpeted by all it's bad elements and game mechanics. 
What were they thinking. What a shame, it could have been much better game."
,Xebecs1,2012-05-26T12:14Z,"This game was NOT developed by generic Capcom programmers/ artists rather than just published off of the company. Its a bait to lure poor idiots who wants to see how the game itself had raped the title, ""Resident Evil"", its gears of war b!tch! RE never had such poorly designed fukked up zombies and the flat as hell AI system. It will crush your heart and piss you off, download this trolling title at your own risk!"
,Justdead,2012-05-26T20:26Z,it is possible to play the game over steam? and a non steam game? i download from u all the time ;) 
,pystdante,2012-05-26T23:00Z,"@ bhinder94 - Sounds like your Hard drive is failing or has bad sectors homie, run chkdisk and reboot"
,pystdante,2012-05-26T23:01Z,"@ Justdead - Yes, you can play on steam, just buy it first.        ......Moron"
,pystdante,2012-05-26T23:20Z,"I keep crashing at startup, 64bit win7 ultimate, even with the xlive.dll, is there a repost of crack? I'm not newb     ▲
          ▲ ▲"
,pystdante,2012-05-26T23:22Z,"  ▲
▲ ▲"
,Sidra21,2012-05-27T18:24Z,works 100%
,submeyar,2012-05-28T00:38Z,"Avira Antivirus Detected ""RaccoonCity.exe"" a Virus ""TR/Crypt.XPACK.Gen5"" Check using TotalVirus.com to know. Nice Trick Man "
,spiderforpc,2012-05-28T10:27Z,"if u get virus with avera just delete it its not the .exe for game , i finished the game 6 times ith all players and get S+ at pro level its not that hard buy all wopen and max all things to full the only 1 thing is bad the AI the 3 walk with u in the game so ediots , the best player SPECTER no 1 can get S+ else him"
,boomy96,2012-05-29T01:17Z,"WORKS 100% ON WIN7, BUT IS THE SHITTEST PC PORT EVER. "
,Resilience777,2012-05-29T14:00Z,"Yeah fellas, this game just seems like a failing attempt at trying to compete with Left4Dead. Guess we'll have to wait & see what Resident Evil 6 looks like, but until then, Left4Dead still remains my favorite zombie shooter :)"
,vonwisdom,2012-05-31T19:25Z,Only play without saving
,dawidio821,2012-06-01T14:25Z,i need more speed sed pleas :)
,Zstar,2012-06-01T22:43Z,"to all the morons saying its left4dead ripoff seem to forget, re made the first game like this, remember re outbreak?, 4 people escaping racoon city, it was out for ps2, you played online with the adapter, it defiantly came out before left4dead, so do some research before being a fucking moron "
,charlie.chinchilla,2012-06-02T02:04Z,Well I have come to the conclusion that leechers are droping their upload rate to 3bps so Im gonna do the same damn thing until you all make it equal unlimited so we can get these files quicker.... I mean shit I have a download rate of 20+mbps and its doing like 300kbs so come on people dont be greedy...
,TaleMunja,2012-06-02T15:02Z,Game sound is so bad that eventually most of people will stop playing this game. Everything works fine on the other side. 
,Woodah123,2012-06-02T15:12Z,Are we ever gonna see the echo six campaign I've beat the umbrella campaign 8 times now kinda gets repetitive just want some new levels and characters to try out so please upload A.S.A.P
,khanBay,2012-06-02T15:15Z,"3GiB version It works!!!
from black box

http://thepiratebay.se/torrent/7250085/Resident_Evil_Operation_Racoon_City_%283GB%29_%28BlackBox%29"
,TaleMunja,2012-06-02T21:18Z,"Sorry guys i thought sound is unfixable but, (as guy on some page says) you can fix that by starting the game as Administrator and sound will be ok. 
I installed and will continue now .."
,Woodah123,2012-06-03T05:29Z,@khanbay do you mean that it has the rest of the spec ops missions besides the first free one?
,cpatu7,2012-06-03T08:14Z,thank you so fucking much
,cpatu7,2012-06-03T08:15Z,"thank you so fucking much



"
,cpatu7,2012-06-03T08:16Z,"thank you so  much


:P


"
,Creyz1,2012-06-03T17:50Z,"Crap game, not even close to L4D and the likes,  much to arcade'ish, wich fails."
,Cesz_,2012-06-03T19:10Z,"seed please, im stuck on 97% :S"
,openarena,2012-06-03T20:51Z,"WORKS! Every torrent of Reloaded/Skidrow/Razor1991 worked at my PC so far :D!
Problem is that i have a online windows live acc /i havew created it before i knew torrents)
I blocked the game with the windows firewall.
Is this enough or should i do something more?"
,tj219720,2012-06-04T03:23Z,SEED PLEASE I BEG OF YOU
,tj219720,2012-06-04T03:25Z,seeeed
,Woodah123,2012-06-04T04:49Z,Can we please get info on the echo six missions.
,Wartinald,2012-06-04T10:03Z,"People dont download this torrent http://thepiratebay.se/torrent/7286954/Resident_Evil_Operation_Raccoon_City_DLC_Pack__multi9.exe.
it have inside a trojan, wich contais a BitCoin miner, that uses your GPU for generate a internet P2P coin. Also it contains a keylogger called Refog keylogger. here are the virus files and their locations, you must delete this files and folders.

C:Program filesjavakernelspoclbm

C:Program filesjava java.exe;divx.exe;svchost.exe

also look at the Localtemp folders for a .bat archive called java.bat. contains the gmail adress for the russian creator of this virus.

You thought you were smarter than I fucking Russian?

sorry for bad english."
,MsZa7ma,2012-06-04T15:01Z,"guys i can't save the game no matter what I do
how should I avoid signing in windows live ?"
,ja7ba,2012-06-05T01:47Z,can someone please upload the crack I lost mine and its rendered the entire game useless
,tomgam75,2012-06-05T13:00Z,"http://viruskompjuteri.com/game.php?game=pc-games/system-requirements/Resident-Evil-Operation-Raccoon-City.html

Minimum Requirements

* OS: Windows XP, Vista or Windows 7
* CPU: ntel Core 2 Duo 2.4 Ghz or better, AMD Athlon X2 2.8 Ghz or better
* RAM: 2 GB
* HDD: 8 GB free disk space
* Graphics: 512 MB NVIDIA GeForce 8800GTS or ATI Radeon HD 3850 or better"
,Woodah123,2012-06-05T17:52Z,Wonder how long it will take for the rest of the echo six missions to get uploaded
,filolilo1,2012-06-05T20:29Z,"if having problems with disk key. 
try this. u can't play online but the campaign is awsome.

http://thepiratebay.se/torrent/7283828/Resident_Evil_Operation_Raccoon_City_Fixed_Xlive.dll"
,Woodah123,2012-06-08T15:00Z,Damn does it usually take this long to upload a 10 dollar expansion pack?
,extr3mz,2012-06-09T17:19Z,"hey, when i create a account to be able to save the game it asks for the game key... what should i do?"
,danielsdiver,2012-06-09T19:18Z,"To create offline account: 

1) create account
2) scroll down the next window and find the hidden shortcut called CREATE LOCAL PROFILE and press ok
3) close the window and play the game.

Good luck people.

ps: the game is not that good. Fine... I'm using it to train my spanish. LOL"
,danielsdiver,2012-06-09T19:19Z,"To create offline account: 

1) click on create new profile
2) scroll down the next window and find the hidden shortcut called CREATE LOCAL PROFILE and press ok
3) close the window and play the game.

Good luck people.

ps: the game is not that good. Fine... I'm using it to train my spanish. LOL"
,danielsdiver,2012-06-10T06:07Z,"i really tryed hard to enjoy this game... but after some hours, got bored. For me, this game is crap... but I still respect if someone like it."
,Woodah123,2012-06-10T14:02Z,Its basically just a newer version of resident evil 5 really that doesn't have all the other crazy BOWs except mr x and the nemesis pretty much besides lickers and hunters too that is. they would have been better off making a resident evil 2 or 3 remake.
,danielsdiver,2012-06-10T15:41Z,"Agree with you Woodah123. Honestly, with this branch of guys using masks, I really felt: I'm missing Alice... LOL."
,Woodah123,2012-06-10T17:03Z,LOL omg fuck alice i hate the resident movie series its completely hollowoodized some random superhuman thats kinda like wesker only a good guy lol yea right all the OP characters are bad guys except in movies.
,Woodah123,2012-06-10T20:48Z,BTW heres a tip for new players Spectre is the easiest character to get S rating on all levels because of his Item radar to find all the data and laptops so yea unless you want a challenge pick Spectre
,danielsdiver,2012-06-12T10:10Z,"@Woodah123: actually I was talking about the first two games... If i dont remember wrong, alice was the main character of the first two or three games... She used to had personality... the sweet and bad girl at the same time. In this current version, the characters are using masks and it is all about to kill.
About the hollywood stuff, agree with you... but I still think that even hollywood has some good movies. but it was not the case of R.E. serie."
,danielsdiver,2012-06-12T10:34Z,"@Woodah123: actually I was talking about the first two games... If i dont remember wrong, because it happens many years ago, alice was the main character of the first two or three games... She used to had a strong personality: the sweet and bad girl at the same time. In this current version, the characters are using masks and it is all about to kill.

About the hollywood stuff, agree with you... but I still think that even hollywood has some good movies. but it was not the case of R.E. serie.

namasté!"
,dieagain20113,2012-06-12T13:00Z,"@danielsdiver
Alice didnt exist in RE games. Maybe u were talking about Jill."
,Raianjunior,2012-06-12T17:29Z,Esperando o 6! 
,Woodah123,2012-06-12T18:21Z,Honestly I'm just wondering when were gonna be able to play the rest of the spec ops missions.
,chrystz,2012-06-14T10:57Z,"thanks for the upload.. it was working well. .but when i reinstalled and try to play again, on entering offline campaign mode I am getting the errors 
""this game session no longer exists"" error.. 

What should I do? "
,danielsdiver,2012-06-14T23:03Z,tks dieagain20113 !! That one!
,Triton41,2012-06-15T20:50Z,"Guys, when I open the game it stops responding after 5 seconds.
I followed the install notes.. is there a solution?"
,smx4,2012-06-15T21:44Z,marce boko
,yahiko1992,2012-06-16T22:04Z,"xbox360 controller emulator 
work just fine

http://thepiratebay.se/torrent/7359093"
,HarleySturg,2012-06-19T05:34Z,"I downloaded this game, but I have no idea how to play it from the UTorrent application. There's no play button like the movies have. Help please?"
,nixon1026,2012-06-19T11:51Z,no one is seeding this crap! seed ya retards
,fcb...6,2012-06-19T12:55Z,seeeeeeeeeeeeeeeeeeeed!
,greenportable,2012-06-19T14:58Z,question? i know that this game includes DLC contents? am i right? and thus this DLC contents is not for free?? just asking :D thank you .
,rowboogs1,2012-06-19T21:26Z,how come i am only getting 20kb/s plz help 
,terrysilver,2012-06-21T10:46Z,hey how long do i have to wait to play the game ? i moved the file from the skidrow file and i got black screen after i try to play the game
,terrysilver,2012-06-21T14:46Z,hey how long do i have to wait to play the game ? i moved the file from the skidrow file and i got a black screen after i try to play the game
,heroboy2011111,2012-06-21T17:20Z,on which system does this game works pls somebody tell me quiklyyyyy 
,terrysilver,2012-06-24T05:51Z,is this game a online game only or can i play a one play3r game?  cause i tried it again i still get a black screen
,tornike,2012-06-24T15:53Z,slow speed :(
,Jones222,2012-06-30T10:00Z,Great Game SKIDROW! and now just have to wait for Resident Evil 6 to come out :)
,asafmiara,2012-06-30T21:06Z,this game sucks dont download it
,coderedfan13,2012-07-01T20:23Z,This Game Rules And For Those That Are Wondering About How This One Fits In It IS Just Part 1 & 2 But Ur on The Unbrella Side Of Things. You Play The Bad Guys 
,tiz2,2012-07-04T12:11Z,Why Would You Start Every Word With A Capital Letter? It Seems Like Something A Psychopath Would Do
,rafaelsalvador,2012-07-11T02:56Z,Extremezone you can upload all the seasons of supernatural in full hd or hd
,icewolf72,2012-07-14T23:21Z,"Then again I saw Modern Warfare 2 system requirements and my $500 laptop can run it all on high settings, integrated graphics."
,pluggiz,2012-07-16T10:06Z,"great game! thnx extremezone , you guys rock.."
,Don.Vitto,2012-07-19T03:21Z,"don't download this crap, it's a waste of time, fucking game"
,danesboy,2012-07-22T13:48Z,does it works
,crniTHEman,2012-07-23T21:03Z,work for me.thx ez
,Rahul1992,2012-07-27T11:18Z,This Game works but too much Laggy screen which will not let you play this suckiest game smoothly.
,tfas,2012-07-31T22:44Z,"When i start the game it crash... it turns a black screen and it says the game stop working, then it goes to desktop... SOMEONE HELP PLEASE"
,tfas,2012-07-31T22:49Z,"When i start the game it crash... it turns a black screen and it says the game stop working, then it goes to desktop... SOMEONE HELP PLEASE..."
,tfas,2012-08-02T21:10Z,"Great share. But i have a problem. when i start the game it goes all black and then it crash. goes to the desktop, it doesn't start. i have windows 7 with 64bits system. Please help me anyone"
,TheMostafa,2012-08-03T03:52Z,nice
,ahmedu04,2012-08-06T07:20Z,"when i mount image and click install, why downt it install. it just closes"
,LIMESTONE081,2012-08-18T15:01Z,"Got a small Problem, I can't copy the File to anything flash disk, External hard drive!!!"
,Parrow,2012-08-19T09:46Z,The gunshots stop hearing...what should i do?
,isauro,2012-08-19T22:46Z,Hey it works great 
,DrSalvador555,2012-08-21T22:02Z,"Can someone help me?? For some reason when i run the setup i get this this error and it wont install at all, i really wanna play but it stops halfway through the installation D:
Error Code:	-5006 : 0x80070005
Error Information:
>SetupNewsetup.cpp (597)
PAPP:Resident Evil Operation Raccoon City
PVENDOR:CAPCOM U.S.A., INC (http://www.capcom.com)
PGUID:43430FA1-12BB-4D88-862E-4F1000008400
$17.0.714
@Windows 7 / Server 2008 R2 Service Pack 1 (7601) 
IE Version: 9.0.8112.16421
"
,DrSalvador555,2012-08-21T22:10Z,"Can someone help me?? For some reason when i run the setup i get this this error and it wont install at all, i really wanna play but it stops halfway through the installation D:
Error Code:	-5006 : 0x80070005
Error Information:
>SetupNewsetup.cpp (597)
PAPP:Resident Evil Operation Raccoon City
PVENDOR:CAPCOM U.S.A., INC (http://www.capcom.com)
PGUID:43430FA1-12BB-4D88-862E-4F1000008400
$17.0.714
@Windows 7 / Server 2008 R2 Service Pack 1 (7601) 
IE Version: 9.0.8112.16421"
,PetaFlux,2012-08-22T18:16Z,Fucking FPS.
,PetaFlux,2012-08-22T18:16Z,Fucking FPS. They have destroyed my favourite game.
,stevyb95,2012-08-24T04:36Z,thanks for the upload 838 seeds WOW cool fast download then :) hopefully i dont even know if this game will run even if it does its gonna lag quite a bit lmao
,qman313,2012-08-24T21:44Z,anyone get this to work on Windows 8?
,Johnno1970,2012-08-25T01:20Z,"Bit of a noob at this, I mount, Install, copy everything and it asks me to register for windows live?? what am I doing wrong?. Confused gamer."
,LStryker,2012-08-28T15:50Z,"@Johnno1970
All you need to do is make an offline GFWL account. Go to the 'agreement' screen, scroll down until you find ""Create offline account"" There you go!"
,viciouz_kitten,2012-09-05T12:52Z,why is it really laggy? please help
,Urvek,2012-09-07T17:45Z,GFWL is PC-Aids
,johnnyycyber69,2012-09-08T18:48Z,thanks for the up... but this game sucks ass... just sayin
,kliker65,2012-09-10T16:53Z,"ok guys,al worked perfectly till i got there to nemesis,inject him this parasite then black screen ,crash,and resident evil operation racoon city has stoped working,and i cant acess the game now,it just pases nvidia comercial vid,loading one dot,second and again:resident evil operation racoon city has stoped working,any solution?"
,agent007uae,2012-09-16T20:58Z,"Cant launch the game!!! It closing automatically after start! Why? Tries compatibility mode, not working! Help!"
,AllintheFamily23,2012-09-18T01:36Z,Thank you so much for this!
,viciouz_kitten,2012-09-23T03:35Z,thanks
,jonjonson,2012-09-24T02:59Z,"http://viruskompjuteri.com/game.php?game=pc-games/system-requirements/Resident-Evil-Operation-Raccoon-City.html

Minimum Requirements

* OS: Windows XP, Vista or Windows 7
* CPU: ntel Core 2 Duo 2.4 Ghz or better, AMD Athlon X2 2.8 Ghz or better
* RAM: 2 GB
* HDD: 8 GB free disk space
* Graphics: 512 MB NVIDIA GeForce 8800GTS or ATI Radeon HD 3850 or better "
