User Type,Username,Date,Text
,wi_,2012-10-18T15:30Z,Thanks 
,cyberkeg,2012-10-20T03:27Z,Many thanks !!!
,dee60,2012-10-28T14:48Z,thanks
,cyberkeg,2012-11-04T17:15Z,"Many many thanks again!

I have tried many times to watch their online videos and never once have they worked. It seems like maybe you have to be located in the UK to watch their show, otherwise you are blocked.

Don't really know, except that I am very grateful that someone is posting this.

Can you PLEASE continue to post the next episodes?

Again, thank you in advance for posting this enjoyable show."
