User Type,Username,Date,Text
,BlueBlood93,2012-10-26T14:32Z,"INGEN TVIVL OM AT MIN

En Kongelig Affaere (2012)

ER MEGET BEDRE KVALITET."
,Mr.Storm,2012-10-26T15:09Z,"@BlueBlood93, 

Er det en joke? Ellers er der INGEN TVIVL om at du er en klaphat...!"
[T],Realuploads,2012-10-26T16:09Z,"@BlueBlood93

Filmen er hentet fra en R5 udgave: 

R5 refers to a specific format of DVD released in DVD Region 5, the former Soviet Union, and bootlegged copies of these releases that are distributed on the Internet.

Så det er ikke ensbetydende med, at alle mine avi film er af bedste kvalitet. 

Men god REKLAME på min torrent, du lige fik sneget ind. Syntes dog ikke at kunne se, du selv har uploadet den. 

Så hvis du vil dele med andre og din er af bedre kvalitet i avi format, hvorfor så ikke upload den. 

Greetings Realuploads "
,BlueBlood93,2012-10-27T11:51Z,"Til & Starte Med Er jeg Smigret Over, At Du Ser Mig som En Konkurrent. & Får Det Andet, En Video Kvalitet ""LYVER ALDRIG"". Alle Kan Se Mit Upload Er Bedre Kvalitet, Men F*** Nu det. Har Hentet Mange Af dine Uploads. Men Har Også altid Slettet Dem Igen Efter 5 min, & Ventet Til Der er Kommet En Bedre Kvalitet. Fordi Dine Uploads Ikke Er Go Kvali.

Dine Kvalitet Du Uploader Filmene I er ikke Ligefrem God KVALITET.

& Til Slut, Har Ikke Min Computer Tændt Om Natten. Derfor Jeg ikke Har Seedet, For Jeg Har Lige Har Tændt Min Pc Nu.

Go Weekend Herfra :)!"
[T],Realuploads,2012-10-28T23:00Z,"@BlueBlood93

Bliver altså nød til at svare på dit sidste indlæg. 

Konkurrenter, hvor filen ser du i mit indlæg, at jeg skulle være nervøs for dine uploads, du kan da upload, så det står ud af ørene på dig og jeg ville stadig lave mit normale og at håber folk stadig vil hente. Men når en tåbe som dig reklamere på mit upload, for sine egne uploads, så vil jeg mene at det er dig, der har et problem med konkurrence. 

Jeg har valgt at uploade i AVI fil, da jeg så sparer GB i uploads, så folk kan vælge mellem mange danske uploads. Nogle vælger DVDr og andre AVI. 

Du henter mine uploads, men efter 5 min. sletter du dem igen. ???? Hvorfor fanden henter du dem så."
,BlueBlood93,2012-10-31T13:20Z,"HAHA Ser Dig Sku ikk Som En Konkurent. Du Uploader Lorte Kvaliteter..

Som Sagt En Video Lyver Aldrig.
"
,fieryfly,2012-11-01T00:22Z,"I've been searching endlessly for this and I want to thank you so much for uploading it! :) Fantastic work.

I am in search of english subtitles for this movie and was hoping someone could point me in the right direction to download some? 

Thank you!"
[T],Realuploads,2012-11-02T02:06Z,"@BluePERK93

Du skal da godt nok gøre dig fortjent til at få en ""skull"" herinde, med den indstilling, du ligger for dagen. Kan kun gengive Mr.Storms comment, ""Du er en klaphat"""
[T],Realuploads,2012-11-02T02:10Z,"Griner, pludseligt har jeg fået -3 i kvalitet og på dit upload har du +3. Du jo bange KID. Upload nu noget mere i dit eget navn. "
