User Type,Username,Date,Text
,sunnyzafar,2012-11-01T06:12Z,"File showing error""archive not present"", please reload. Thanks!"
,Angelo20,2012-11-01T15:36Z,"This Loco have ecxellent Smoke Effects how much better as the normal Smoke effects, the Loco works perfectly, the Sounds and Light effects are Goods too.
Thank You Mr. TPB_4_EVER for this Apprecious Upload!"
,sunnyzafar,2012-11-09T09:10Z,works fine. great upload. thanks
,JUSTIN166,2012-11-10T18:21Z,Wow! Awesome! Do you have Waggonz Class 142 Pacer?
,sumon123,2012-11-15T04:05Z,rrrrrrrrrrr
