User Type,Username,Date,Text
,Ashoor1990,2012-04-25T18:37Z,"أنا رنكوس عم شوفا حنونة .. ياجبرة خاطري وبهجة عيوني
أنا مابنكر جميلة هواكي وشذا أزهارك اللي عم ينعشوني
مهما غيب مابنسى وفاكي وتنفرض لو ظروفي بعدوني
إذا كل يوم مابطلب رضاكي
ضميري والوفا بيوبخوني

ياقطعة من السما الله رماكي..على القلمون جنة تا تكوني
عطاكي أد مابدك عطاكي
حلا وأخلاق .. ومحبة وليونة
وزرع إدامك النجم وراكي ووين مابروح بشوف بيحسدوني
أنا ما ببيع بحصة من حماكي ..إذا كنوز الدني بملكوني "
,zakimar,2012-04-25T20:57Z,"Thanks. Let's hope when Assad is justifiably executed, he isn't replaced with an American stooge like Mubarak and Hussein were. "
,Ashoor1990,2012-04-26T14:40Z,"Assad Will continue Killing 
and the world still keep Hoping..

i really wonder!!"
