User Type,Username,Date,Text
[T],warriorph,2012-03-22T04:53Z,"@azunal: don't know what your problem is, but it plays on all the media players you mentioned with the right codecs. maybe you're just preventing others to d/l my uploads because you posted the same comment on most of my uploads. respect to all p2p groups & encoders!"
[T],warriorph,2012-03-22T09:02Z,U can try installing Combined Community Codec Pack. All my ups play perfectly in my vlc media player & wd tv live hub stand-alone hd media player.
,Sailor420,2012-05-27T03:12Z,"Salamat warriorph

For my wife, many THX.

I also play on wd tv live hub stand-alone hd media player, the BEST !!"
