User Type,Username,Date,Text
[V],HeroMaster,2013-01-05T05:47Z,ENJOY ENJOY ENJOY ENJOY ENJOY The Impossible 2012 DVDSCR New by PTpoWer Power is here!
,ag_orange,2013-01-05T10:39Z,Nice....thanks HeroMaster! +1
,bizyballin,2013-01-05T11:09Z,this copy is DELAYED big time....@ least its avi but sh#t really audio plays 1 min ahead of video ;(
,joaf01,2013-01-05T13:31Z,"Video is great , but audio is way out of sync. Tried WMP and VLC, same issue. "
,grifter_t7,2013-01-05T16:00Z,yeah audios out bigtime wished i'd looked at comments 1st but thx anyway hero
,ag_orange,2013-01-05T23:55Z,Out of sync!
