User Type,Username,Date,Text
,Airoch420,2012-04-06T23:46Z,damn I want this. Would need to upgrade my rig. a 220 GB HD wont get you very much anymore.
[V],bestec1234,2012-04-07T03:08Z,http://www.tigerdirect.com/applications/SearchTools/item-details.asp?EdpNo=7192141&CatId=4357
,MurphysLawyer,2012-04-08T00:50Z,thank you....would be a much better idea if you split this up into 10 or more torrents
,frifrau,2012-05-07T15:29Z,"if i can download this I`ll stay seeding. 
Preciso baixar essa porra nem que estoure o HD"
,hardox_400,2012-05-27T14:14Z,"Why only magnet link:(
This way i cant see what's inside:("
,aguila9,2012-06-18T19:12Z,PLEASE ALLOW INDIVIDUAL DOWNLOAD of folders... 82gb is too much 
