User Type,Username,Date,Text
[V],Nepotu,2012-11-13T14:40Z,"I know that is a very large size file, but if you want a lighter one I can upload it in russian only."
,cocomomo,2012-11-14T05:20Z,"Registered to say: I love you!! Your torrents are empirically awesome. If you get a chance, could you please upload the 2012 shanghai masters final and the 2011 us open final? That'd be epic, but either way, thanks for all your hard work.  "
,cocomomo,2012-11-14T05:25Z,Meant the 2011 us open semi final (no torrents of that one)... 
[V],Nepotu,2012-11-14T14:53Z,"You're welcome mate. So, Shanghai 2012 final and US Open 2011 semifinals?"
,cocomomo,2012-11-14T20:52Z,Yes!  Thank you!!
[V],Nepotu,2012-11-15T00:56Z,Shanghai final it's already up.
,cocomomo,2012-11-15T01:28Z,"I saw, TY & hats off to you Nepotu! That was super fast. And I was so excited to find such HQ tennis torrents, forgot to clarify that it was the Federer vs. Djokovic semi I was looking for."
,hinterland,2012-11-15T13:45Z,please smaller size beacause i want burn that file to dvd.
,SectorVector,2012-11-15T15:41Z,"Oooh. I too would like to see a smaller size file. 720p should do. 2 GB possible ? :)

I really want to learn Russian, but if you can do some magic and get the English commentary in, i will ...  i will ...  errrm ... learn russian :)

Don't want to miss this Fedex match."
,MoviesR101,2012-11-17T01:03Z,"Thanks!

I would take a smaller file if possible? I would also like to put on Dvd!"
