User Type,Username,Date,Text
,stereocilia,2012-07-27T06:58Z,"Please continue seeding until at least a week after classes start. This will allow other students  quick access to the materials. I scanned it all by hand to help you, now pass it on to others. :)

Thanks for your help.

-uploader"
,katnap,2012-08-01T05:00Z,Thank you! You just saved me $55.00!
,foxracer1,2012-08-22T16:13Z,Hey can we please seed i need this book :( thanks again for putting it up too!
,morgainm,2012-08-23T07:39Z,Hi! Please seed if you can-school starts next week and I need this book for notes. Thank you so much!!! 
,GlassJAw740,2012-08-23T17:35Z,"Thank you so much, and everyone please seed.  This is a book that cost over $100 new and about $85 used, which is crazy!"
