User Type,Username,Date,Text
,GRNS3,2012-08-05T01:35Z,"Wederom bedankt NLUPPER002, ben nog ff Ktorrent 4.1.3 an ut testuh en zal ook in deze torrent nog wat gas geven.
Hep in de vorige dik 550 GB kennen pompuh voor die finishte lol :) - ben benieuwd waar deze op uitkomt.
Alle peers bij voorbaat dank voor het delen, des te vlotter staat ie er op :) 
Thanks & garoeten, GoRinNoSho

""Feed me, i'm a seedbox""

"
,Kane201,2012-08-05T04:43Z,Looks great! Doesn't seem to have any repeating scenes.
,dabird4205,2012-08-05T05:28Z,NINE!! DUNCHOFF!!
,sm1ff,2012-08-05T06:10Z,"wow another great torrent, what program do u use to rip these blurays? im having trouble ripping some, to about the same sizes as you"
,milkofee,2012-08-05T10:35Z,seed please!
,Katniss-Everdeen,2012-08-05T18:21Z,"This seems to be the most promising one so far. Unfortunately, it's going to take a couple of days to download it.

I gotta be awesome quality, judging by the size resolution."
,pixet,2012-08-06T21:55Z,"omfg finally it's released!! can't wait till I finished downloading this, thx !! "
,redsx,2012-08-09T01:05Z,"This Is ,So Far THE Slowest New Movie Torrent I Have Yet Downloaded 17.6 KB's Over 1 Day and 5 Hours !!!!,What's Going on ,Is Anyone Seeding This Or What????"
,ttford,2012-08-14T09:35Z,Thanks
