User Type,Username,Date,Text
,SplhcbPrime,2012-11-16T00:15Z,moi = me
[T],blackcanary,2012-11-16T00:36Z,"Je sais ce que tu veux dire, but the English title chosen by the translator on page 2 is ""I, Dragon"". :)"
,SplhcbPrime,2012-11-16T00:58Z,blame it on the translator; blame it on the rain
,tisk,2012-11-16T19:38Z,"Besides ""I"" and ""me"" are constantly used in a grammatically wrong way even by native speakers. Since I am not and my English is as shoddy as my French I still think translating ""Moi, Dragon"" to ""I, Dragon"" makes perfect sense here.    "
,tisk,2012-11-17T02:04Z,"Oh, and thx for the up of course!!!!"
