Filename,Size,Unit
Sherlock.Holmes.a.Game.of.Shadows.2011.PAL.Retail.DVD5.nfo,599,B
Sherlock.Holmes.a.Game.of.Shadows.2011.PAL.Retail.DVD5/SHERLOCK_HOLMES_GAME_OF_SHADOW.ISO,4.33,G
Torrent downloaded from AhaShare.com.txt,58,B
Torrent downloaded from Demonoid.me.txt,46,B
Torrent Downloaded From ExtraTorrent.com.txt,353,B
Torrent downloaded from P2PDL.com.txt,81,B
Torrent downloaded from Rarbg.com.txt,33,B
Torrent downloaded from silvertorrents.me.txt,29,B
Torrent Downloaded from TorrentState.com.txt,46,B
tracked_by_h33t_com.txt,23,B
