User Type,Username,Date,Text
,goldpianogarden,2012-07-13T18:14Z,What's the difference between this torrent and the other torrent that ends in 'EN' that you uploaded?  One ends in 'IT' and one ends in 'EN'.   ??  Is it for language (English/Italian)? or something else?
[V],nikita200,2012-07-13T18:58Z,"@goldpianogarden

IT = Italiano

EN = English"
,rayquest9,2012-08-22T13:33Z,"thanks for all your torrent 
u are a darling

please can you upload the english version 
and can i install this on vista sp2 and i have 
Acronis.Backup.&.Recovery.Server.With.Universal.Restore.v11.0.17318 already installed?
so what to do"
