Filename,Size,Unit
Colour Of Your Dreams/10 Do You Feel Love.mp3,5.03,M
Colour Of Your Dreams/1 Lay Down My Life.mp3,4.89,M
City Streets/6 Legacy.mp3,4.75,M
Colour Of Your Dreams/9 Just One Thing.mp3,4.73,M
City Streets/5 I Can't Stop Thinking About You.mp3,4.72,M
City Streets/1 City Streets.mp3,4.7,M
Colour Of Your Dreams/7 Tears Falling Down on Me.mp3,4.62,M
Colour Of Your Dreams/2 Hold Out for Love.mp3,4.53,M
City Streets/2 Sweet Life.mp3,4.29,M
Colour Of Your Dreams/8 Friday's Tie-Dye Nightmare.mp3,4.27,M
City Streets/4 Lovelight.mp3,4.21,M
City Streets/8 Midnight Flyer.mp3,4.19,M
City Streets/3 Down To The Darkness.mp3,4.06,M
City Streets/9 Homeless Heart.mp3,3.86,M
Colour Of Your Dreams/3 Standing in the Rain.mp3,3.81,M
Colour Of Your Dreams/11 It's Never Too Late.mp3,3.46,M
Colour Of Your Dreams/5 Wishful Thinking.mp3,3.09,M
Colour Of Your Dreams/4 Now and Forever.mp3,3.04,M
City Streets/7 Ain't That The Way.mp3,3,M
Colour Of Your Dreams/6 Colour of Your Dreams.mp3,2.87,M
City Streets/10 Someone Who Believes In You.mp3,2.84,M
Carole King - City Streets.jpg,88.34,K
Carole King - Colour Of Your Dreams.jpg,72.66,K
