Filename,Size,Unit
American History X_01_American History X_320kbps.mp3,11.07,M
American History X_02_The Assignment_320kbps.mp3,6.11,M
American History X_03_Venice Beach_320kbps.mp3,3.47,M
American History X_04_Playing to Win_320kbps.mp3,8.96,M
American History X_05_People Look at Me and See My Brother_320kbps.mp3,3.98,M
American History X_06_I Had Testified_320kbps.mp3,9.52,M
American History X_07_A Stranger at My Table_320kbps.mp3,8.27,M
American History X_08_Putting up a Flag_320kbps.mp3,5.01,M
American History X_09_Raiders_320kbps.mp3,7.07,M
American History X_10_Complications_320kbps.mp3,3.91,M
American History X_11_Starting to Remind Me of You_320kbps.mp3,4.12,M
American History X_12_The Right Questions_320kbps.mp3,7.91,M
American History X_13_The Patch to Redemption_320kbps.mp3,6.86,M
American History X_14_We Are Not Enemies_320kbps.mp3,4.99,M
American History X_15_Two Brothers_320kbps.mp3,6,M
American History X_16_Storm Clouds Gathering_320kbps.mp3,4.89,M
American History X_17_Benedictus_320kbps.mp3,8.34,M
