User Type,Username,Date,Text
,Lerisimo,2012-10-16T01:30Z,Tusen takk.. Hadde slutta å se om hu ikke gikk ut i forje episode! 
,jmj2005,2012-10-17T17:51Z,kan du legge ut Hellfjord også
,svennastorm,2012-10-18T20:40Z,"Hei Andy, kommer 5'ern også? (og resten såklart;) hadde vært kjempe :)"
,AndyNor18.87,2012-10-18T22:55Z,Ute nå :)
,AndyNor18.87,2012-10-18T23:59Z,Hellfjord kan du se gratis i NRK nettTV
,jmj2005,2012-10-19T04:47Z,kan ikke se hellfjord fra utlandet
,erviher,2012-10-20T17:19Z,Du gjør en strålende jobb AndyNor! Hadde det vært mulig å legge ut årets sesong av 71 grader nord også?
