User Type,Username,Date,Text
,AnkevdW,2012-11-12T13:19Z,I really want to thank you for your good uploads. I can't wait to download them each week. Keep up the good work.* :)
,redcdiver,2012-11-13T11:34Z,Thanks for greta upload
,soldi3r,2012-11-16T18:58Z,"another great download, thanks again!!!"
,shawty007,2012-11-19T09:40Z,"Thankyou so much for the uploads inlove with this show, cant wait for ep 8 !! :) Thanks again "
,paunico,2012-11-19T23:25Z,thanks so much!! you rule!!
,shawty007,2012-11-21T10:43Z,When are you going to upload ep 8 ? 
,abbygail8,2012-11-22T11:04Z,so hanging out for Ep 8.....
