User Type,Username,Date,Text
,lockedup1,2012-09-12T03:33Z,"Thank you, dwnz. This is missing on iTunes for some odd reason. "
,Ar718,2012-09-12T22:45Z,Thank You So Much :) 
,Ar718,2012-09-12T22:51Z,Thank You So Much :)
,Ar718,2012-09-12T22:59Z,I would like to know if you can get Episode 15-20 in 720p excluding Episode 19 since that is already uploaded.
,dwnz,2012-09-15T01:00Z,"Sorry, that is unlikely to happen."
,Ar718,2012-09-15T20:00Z,How Come? How can i get the rest of the other episodes like the 2 you uploaded 
,dwnz,2012-09-19T16:57Z,"Because I need to seed this torrents as most people just leech and I can't keep my PC running all day and I only have 8mb upload as well.

Nevertheless all the ones you requested are here with a decent quality ;)"
