User Type,Username,Date,Text
[T],T.F.K,2012-10-14T16:16Z,SEED and ENJOY by T.F.K team
,hashuboy,2012-10-14T17:40Z,"DID YOU REMOVE YOUR ""DiRT 3"" TORRENT???

Why??"
,hashuboy,2012-10-14T17:44Z,"Sorry for the above comment,wrong torrent :)"
,solo1149,2012-10-14T18:31Z,Dilogie and not duologie lol
,solo1149,2012-10-14T18:34Z,In english Dilogy and not Duology :)
,sonic30,2012-10-14T18:56Z,Does it work with Win7? I know that I.G.I 1 had problems even with XP.
,IndigoAK,2012-10-15T08:50Z,"IGI is playable, but there are visual artifacts regardless of which settings you choose.

IGI 2 appears to be intact, but that leaves you with having to overcome the game itself.  Heh."
,bondstark,2012-10-15T13:39Z,not work in win 7 64 bit
,IndigoAK,2012-10-15T14:31Z,Both of them work.  I played both on 64-bit Windows 7 a few months ago.
