User Type,Username,Date,Text
,piraticezi,2012-05-19T17:40Z,"dl stuck at 99%, for hours... :-("
,piraticezi,2012-05-19T20:47Z,"one should be aware, after all those hours 2.5 mb remains to be dl, this doesn't look ok..."
,zombird,2012-05-20T05:14Z,"479.7 of 482.3 (99.45%)
I swear the uploader is trolling us."
,piraticezi,2012-05-20T19:35Z,this could be an example of 'network poisoning'; remember the original seeder...
,jumjumb,2012-05-21T18:45Z,"j4mp.ml's uploads always work like this one: 
When you reach some more than 99% the download stops. 
Don't waste your time on this and his other torrents."
,mac.the.ripper,2012-05-24T13:11Z,"Please, leechers... leave this torrent and all other torrents olet by this uploader. Stop acting naive. You will finally end up in jail..."
