User Type,Username,Date,Text
[V],extremezone,2012-10-01T11:49Z,"Uploader Note: Please don't mind inside .jpg file included by one of our preseeding
supporting uploader,sometimes my gameseedbox is dead and in this case i took a torrent
from a private site with private seeders for better speeds-seeds via dht/peer exchange+my
own bandwidth for about 100 GiB.

Note: We need anything you can offer as early releases,seedboxes,links,accounts,etc
please contact us on piratepedia[@]msn/gmail.com or our website torentz 3xforum ro
Seed Stats: 20-400 GiB at aprox 10 MiB/sec/20 slots per torrent

How To Get Your Maxspeed (uTorrent)

Torrent Client - Preferences - Bandwidth - Number of connections - Set aprox. 500 for each 
Torrent Client - Preferences - BiTorrent - Protocol Encryption - Forced
Bandwidth Allocation - High (Set download/upload limit - Unlimited)
Stop Other Active Torrents - Start downloading and wait for connections.
Enjoy and Seed for at least 1:1 ratio. Don't forget to say thanks/leave reviews.
For more info,crack only,PATCH,serial,keygen,trainers,CRACKFIX,UPDATES,
system requirements,cheats,NFO,gameplay trailers,free downloads,
pc iso,demos,screenshots,visit some RELEASE SITES or official web pages. 
IF the game does not work for you then update drivers, directX, components
as netframework/redist files/etc, run as administrator, change compatibility
mode, block/disable access to internet, copy crack/overwrite, other tweaks,etc
Search here for any future updates/working status/etc http://orlydb.com/s/games,
http://gamecopyworld.com or any other quality Scene Release & filesharing sites.
Stop using stupid av's as AVG reporting false positive viruses-disable or use ESET"
,raiz97,2012-10-01T12:00Z,"Thnx :) 

FIFA 13 ?"
,AntiVIRUS352,2012-10-01T12:05Z,Super game!
[V],extremezone,2012-10-01T12:42Z,"raiz97 i don't know when will be cracked and release it i will upload it...everywhere i go ""fifa 13, fifa 13"" just wait for it"
,MadMody,2012-10-03T11:59Z,"I love you extremezone, u r da best, #1 FTW m/"
,not.me,2012-10-03T18:16Z,extreme thanks ;D
