User Type,Username,Date,Text
,5-click,2012-08-10T23:53Z,"1999 - the good old time. Superhighspeed-Downloads with 384kbit/s and Super-VGA with 800x600px. All things has ""Super"" in the name.
Mmh, i feel me old, lets talk about other things...
Has somebody something hear about Elise Graves as Slave?

Reminder: kink.com/k/model/28827-Elise-Graves.html

Thank you guys for the (good) old stuff! (^_^)"
,shallow2,2012-08-11T00:02Z,"Heck, I was sitting on a 28.8k modem dl'ing pictures on IRC back in '96, that was speed I tell ya.. :D"
