User Type,Username,Date,Text
[V],polisdavid,2012-02-26T00:41Z,Thank You Seeders!!  ‚~)
,hymen45,2012-04-07T23:04Z,Could you please make a keygen available for windows?
,Jish2011,2012-04-08T08:05Z,"We can't find your purchase. Make sure you enter the same email address you have used to order DiskAid


7FAE8F0895877EC42E9A38F0542F387B"
,chewbacca.star,2012-05-23T22:46Z,"DiskAid asks for my email, and if it doesn´t match their purchase database it won´t let me do anything! How do you solve that?"
,arturo_fx,2012-09-01T16:47Z,Not Work in Mountain :(
