User Type,Username,Date,Text
[T],mrriser007,2012-07-06T21:55Z,"seed,comment,rate"
,jsc315,2012-07-07T18:59Z,"what an annoying upload! A rar file inside multiple rar files inside other rare files!? Plus bunch of spam as well trying to make money off of you. learn to upload better. 

that being said the crack works fine and no viruses but very annoying. Just give what is described and stop making things more complicated then they have to be.  "
,iiagrer,2012-08-22T17:01Z,"Jsc315 is right. Took some digging but the keygen is in there.  Just badly repackaged.
I only used the keygen and left the rest alone,
thanks for the upload anyway."
,The-Deathborg,2012-09-17T05:31Z,"That was simple to avoid all of the spam and shit. What the fuck are you complaining about guy? also will seed because that keygenerator is fucking amazing. I'm listening to that shit even now after I've installed it. Fuck me, now I need to go find a program to record music playing in my desktop background."
,The-Deathborg,2012-09-17T05:32Z,"I'm looping it for ten hours and putting it on my ipod classic. I hope the file is at least seventeen gigs, I need to fill the space somehow."
