Filename,Size,Unit
Shorts/PSYWAR  The Real Battlefield is the Mind.flv,319.23,M
Scientology the CIA and MIVILUDES  Cults of Abuse.avi,245.81,M
Christian Citizenship.avi,175.53,M
Shorts/We are Preparing for Massive Civil War.flv,111.69,M
And More/SIN-ister Clips/The Melting Pot Becomes the Boiling Pot - Fisher of Men.mp4,80.84,M
Shorts/Stuff They Dont Want You to Know - Drones.avi,80.02,M
Shorts/Dreams from My Real Father  Director Joel Gilbert at National Press Club Wash DC.flv,71.63,M
And More/Signs of the Times/Dreams from My Real Father  Director Joel Gilbert at National Press Club Wash DC.flv,71.63,M
600 Volumes - POtHS Torrents seeded 7-4-2012.rar,69.71,M
"And More/Signs of the Times/God and the Problem of Evil and Suffering - William Lane Craig, PhD.flv",66.27,M
And More/The Holy Spirit/Lucifers Plan for the Future  Jim Wilhelmsen - YouTube.flv,64.78,M
And More/SIN-ister Clips/S A T A N aka Burson-Marsteller - YouTube.flv,56.32,M
And More/SIN-ister Clips/US infrastructure doomed.flv,50.43,M
Shorts/Obama administration refuses to reveal TPP secrets - YouTube.flv,48.61,M
Shorts/The MOON WALK - Important - YouTube.flv,43.52,M
And More/SIN-ister Clips/Why doctors are more dangerous than guns - Health Ranger investigation.flv,40.78,M
And More/Signs of the Times/As US Postal Service Faces Default  Critics See Manufactured Crisis to Push Privatization.flv,39.98,M
Shorts/Colorado massacre - total surveillance didnt work.flv,39.23,M
And More/Signs of the Times/Chick-fil-A Appreciation Day - August 1 2012.flv,37.48,M
Shorts/Thunderstorm Solar Power Satellite as a Weather Modification Tool to Stop Tornadoes.flv,35.57,M
And More/Signs of the Times/Congressmen dont want to punish themselves for leaks.flv,35.17,M
"And More/SIN-ister Clips/Sight - látás, A jövo disztópikus világa -  Scary Future.flv",33.72,M
And More/The Holy Spirit/Passion of the Christ Salvation video  - YouTubeed.flv,31.86,M
Shorts/Important - Colorado Massacre Linked To Historic Bank Fraud  Self Thinking Killer Drones 7-28-12.flv,31.53,M
Shorts/If I wanted America to fail - YouTube.flv,31.13,M
Shorts/Tired Of Hearing BOSS138.flv,28.67,M
And More/Signs of the Times/Leaked  Obama approved covert CIA support for Syria rebels.flv,27.8,M
And More/SIN-ister Clips/Project Bluebeam ( Fake Rapture ) part - II -.avi,27.67,M
And More/The Holy Spirit/Mark Cahill - False Doctrine in the Church -  BEWARE.flv,24.78,M
And More/The Holy Spirit/OMG - NOT cool at ALL - YouTube.flv,24.66,M
And More/The Holy Spirit/The Reason For The World  - YouTube.flv,24.23,M
And More/SIN-ister Clips/Olympics -China Yu quits badminton after Olympic match-fixing disqualification 8-2-12.flv,22.98,M
Shorts/Stuff They Dont Want You to Know - Robert F Kennedy.flv,22.3,M
And More/SIN-ister Clips/Why I Left Jihad   Ex-Muslim militant Speaks Out - Part2 - YouTube.mp4,18.85,M
And More/The Holy Spirit/When the Tears Fall We are never alone  - YouTubed (2).flv,18.8,M
And More/Signs of the Times/ALEC will never end  Absurdity Today.flv,17.68,M
"And More/The Holy Spirit/Your Grace Still Amazes Me Phillips, Craig   Dean  - YouTube.flv",17.45,M
Shorts/Wretched  Christopher Hitchens Gets Spanked. - YouTube.flv,16.47,M
And More/The Holy Spirit/Know Your Enemy Part 1 - Introduction.avi,15.88,M
And More/SIN-ister Clips/Obama - Rev Fred Owens says Obama is a Judas sellout to the Homosexual Community 8-01-12.flv,15.64,M
Shorts/Leakers at Risk  UK seeks to silence whistleblowers - YouTube.flv,15.35,M
Shorts/Wikileaks Manning judge orders state reports released   US waging war on whistleblowers.flv,13.88,M
And More/Signs of the Times/Homeland Security Issuing Its Own DMCA Takedowns On YouTube To Stifle Speech.flv,13.72,M
Shorts/UK Aid Funds Forced Sterilization Of Indias Poor.flv,13.54,M
And More/The Holy Spirit/Phillips Craig   Dean - Let the Worshippers Arise.flv,12.98,M
And More/SIN-ister Clips/Syria - Its NOT A CAMP - Insurgents attack Palestinian refugee camp in Damascus.flv,12.82,M
Shorts/The Plan to Kick Greece Out of the Eurozone 6-16-12.flv,12.78,M
Shorts/Illegal Cloning  Dumped fetuses could be half human half engineered.flv,12.25,M
Shorts/Little Paul and the Pope - YouTube.flv,11.66,M
And More/The Holy Spirit/There is a Reason CMTC  - YouTubeswf.flv,11.17,M
And More/The Holy Spirit/The Reason We Sing - YouTube.flv,10.83,M
And More/Signs of the Times/Hologram Airport Guide In Newark.flv,10.76,M
And More/Signs of the Times/Are You a Terrorist.flv,10.73,M
And More/Signs of the Times/FOX19s Reality Check To Follow Up on CO Shooting   Questions the MSM Ignores.flv,10.4,M
And More/SIN-ister Clips/OWT Infographic web.flv,10.15,M
Shorts/Police Brutality POLICE PROVOCATEURS Dressed As Anarchist In Front Of News Cameras.flv,10.15,M
And More/The Holy Spirit/Love Letter From God.flv,9.87,M
Shorts/The Illusion of Choice  6 Corporations Control 90% of the Media in America.flv,9.75,M
Shorts/Anaheim police brutality systematic goes on for generations.flv,9.61,M
Shorts/Warning Over Pace Markers And Other Medical Implant Can Be Hacked.flv,9.46,M
And More/Signs of the Times/Japan - Volintary Recal Of Radioactive Mushrooms and Octopi Certified To Be Radiation Free.flv,9.04,M
Shorts/The Great World Depression of 2012 - YouTube.flv,8.87,M
And More/Signs of the Times/False Flag - Members Of Al Qaeda Arrested In Spain Move On Suicide Bomb Plot.flv,8.21,M
And More/SIN-ister Clips/What Dont You Get.flv,7.37,M
And More/Signs of the Times/I Wont Back Down - Johnny Cash in Concert.flv,7.29,M
Shorts/Sex Ed Too Racy For 5th Graders - Graphic Content - YouTube.flv,6.32,M
And More/SIN-ister Clips/Strange Fire Rainbow Cloud Appears Over South Florida 7-31-12.mp4,5.68,M
And More/The Holy Spirit/Still Here Waiting - Todd Agnew - YouTube.flv,4.96,M
And More/SIN-ister Clips/Mech Warrior Style Robot- Kuratas Unveiled In Japan.flv,4.38,M
Shorts/ZOMBIES  FLORIDA MAN ATE FACE OF HIS VICTIM AFTER ATTACK SHOT BY POLICE MANY TIMES.flv,4.25,M
Shorts/Man Threw Intestines At Officers After Stabbing Himself Under Influence of New Rabies Virus.webm,4.24,M
And More/The Holy Spirit/MLK  Messianic Arrogant America - YouTube.mp4,3.12,M
Shorts/Top 5 GMO Foods to Watch Out For - YouTube.flv,2.52,M
POtHS - Why We Do What We Do.txt,7.89,K
Info.txt,5.23,K
Torrent downloaded from Conspiracyhub.com.txt,47,B
Torrent downloaded from Demonoid.me.txt,47,B
Torrent downloaded from Ahashare.com.txt,47,B
