User Type,Username,Date,Text
,emilio_user,2012-03-02T22:01Z,what about an asirian/greek horoscope? or a tarot program? 
,ketanchi,2012-03-03T14:38Z,kindly upload kundli 2009 latest 
,noelnyc,2012-03-05T01:37Z,GOOD job
,danoa,2012-03-06T01:29Z,No idea about an asirian/greek horoscope? or a tarot program? 
,noelnyc,2012-03-09T04:21Z,Garbage it doesn't work  wasting time
,powerthazan,2012-06-12T15:47Z,I want to Vakyam Horoscope Explorer (http://itbix.com/VakyamHoroscope.aspx ) Please Help to crack
