Filename,Size,Unit
"20 - Hiran-dRazafimahefa , Indrisy mantsy zareo mpilalao tsy manan-tiana.mp3",4.71,M
"17 - Hiran-dRazafimahefa , O ry tsiriry mandalo an'Itaosy! (Bird Flying Above Lake Itaosy).mp3",4.67,M
"10 - Hiran-dRazafimahefa , O ry fody an'ala ê! o! (Tribute to the Cardinal of the Forest).mp3",4.43,M
"13 - Hiran-dRazafimahefa , Ry volon-danitra manga (Beautiful Blue Sky!).mp3",4.37,M
"11 - Hiran' ny tanoran'ny ntaolo , Maraina ny andro (Delightful Day).mp3",4.32,M
"19 - Hiran-dRazafimahefa , Mifohaza re rabetorimaso (Wake Up Sleepyhead).mp3",4.32,M
"09 - Hiran' ny tanoran'ny ntaolo , O ry dada sy neny malala ô (O! Dear Father And Mother).mp3",4.25,M
"03 - Hiran' ny tanoran'ny ntaolo , Mampahory ny masoandro seranin-javona.mp3",4.25,M
"08 - Hira Malaza taloha , Rambalamanana (Boy's Name).mp3",4.2,M
"06 - Hiran-dRazafimahefa , Fony hianao mbola kely sakaiza (Once When You Were A Child).mp3",4.12,M
"15 - Hira Malaza Taloha , Afindrafindrao (A Traditional Dance).mp3",4.09,M
"14 - Hiran' ny tanoran'ny ntaolo , Raivo ô (Girl's Name).mp3",4.09,M
"01 - Hiran' ny tanoran'ny ntaolo , Oay lahy é (O! Dear Friend).mp3",4.07,M
"02 - Hira Malaza Taloha , Eny rodorodoy ny famindra (Echos of Dance Steps).mp3",4.05,M
"12 - Mpilalao Malagasy , Fikasakasana ny eto an-tany (Life In This World Is But Preparation).mp3",4.04,M
"04 - Hira Malaza Taloha , Tery mafy loatra ny saina (The Mind Bound Up With Sorrow).mp3",4.02,M
"05 - Hiran' ny tanoran'ny ntaolo , Mazava atsinana ny any aminay (Clear Bright Day In My Country).mp3",3.88,M
"07 - Hiran' ny tanoran'ny ntaolo , Tanora tsy manaja tena (Youths with no self-respect).mp3",3.86,M
"16 - Hiran' ny tanoran'ny ntao lo , Hadalana, hadisoana (Folly Leads To Regrets).mp3",3.83,M
"18 - Hira Malaza Taloha , An'iza ny basy ! (Whose Gun Is This !).mp3",3.57,M
madagscar.jpg,62.37,K
