Filename,Size,Unit
Video/Maher Zain - Number One For Me.WEBM,32.51,M
Video/Maher Zain - Palestine Will Be Free.flv,31.86,M
Video/Irfan Makki Feat. Maher Zain - I Believe.flv,29.73,M
Video/Maher Zain - Freedom.flv,27.3,M
Video/Maher Zain Feat Fadly - Insha Allah.flv,25.04,M
Video/Maher Zain - Insha Allah.flv,24.76,M
Video/Maher Zain - Sepanjang hidup.flv,22.19,M
Video/Maher Zain - The Chosen One.flv,21.66,M
Thank You Allah/Thank You Allah (Acoustic Version).mp3,7.54,M
Thank You Allah/Allahi Allah Kiya Karo (Feat. Irfan Makki).mp3,7.22,M
Thank You Allah/Thank You Allah.mp3,7.21,M
Thank You Allah/Ya Nabi Salam Alayka (Arabic Version).mp3,6.88,M
Thank You Allah/Ya Nabi Salam Alayka.mp3,6.88,M
Thank You Allah/Subhana Allah (Feat. Mesut Kurtis).mp3,6.78,M
Thank You Allah/Palestine Will Be Free.mp3,6.63,M
Thank You Allah/Baraka Allahu Lakuma.mp3,6.21,M
Thank You Allah/Insha Allah.mp3,6.15,M
Thank You Allah/Open Your Eyes.mp3,6.14,M
Thank You Allah/Hold My Hand.mp3,5.66,M
Thank You Allah/For The Rest Of My Life.mp3,5.39,M
Thank You Allah/The Chosen One.mp3,5.39,M
Thank You Allah/Awaken.mp3,5.14,M
Forgive Me/So Soon.mp3,4.73,M
Forgive Me/Guide Me All The Way.mp3,4.62,M
Forgive Me/Radhitu Billahi Rabba (Arabic Version - Bonus Track) .mp3,4.57,M
Forgive Me/Radhitu Billahi Rabba .mp3,4.54,M
Forgive Me/Mawlaya (Arabic Version - Bonus Track).mp3,4.49,M
Forgive Me/Mawlaya.mp3,4.47,M
Forgive Me/Muhammad (pbuh).mp3,4.25,M
Forgive Me/I Love You So.mp3,4.22,M
Forgive Me/My Little Girl .mp3,4.18,M
Thank You Allah/Always Be There.mp3,4.11,M
Forgive Me/Number One For Me .mp3,3.97,M
Forgive Me/Assalamu Alayka (Arabic Version - Bonus Track) .mp3,3.89,M
Forgive Me/Assalamu Alayka .mp3,3.88,M
Forgive Me/Paradise .mp3,3.77,M
Forgive Me/One Big Family.mp3,3.76,M
Forgive Me/Masha Allah.mp3,3.66,M
Forgive Me/Forgive Me.mp3,3.55,M
Forgive Me/Freedom .mp3,3.4,M
