User Type,Username,Date,Text
,drew1972,2012-03-07T14:57Z,You rock!  Thank you.
,Kole97,2012-03-07T15:20Z,"Hey, been waiting for this !!!!!!!!!! For some stupid reson i couldn't follow Uefa champions League (:"
,katalysator,2012-03-07T15:30Z,Super! Any chance you could seed the 720p source file as well?
,katalysator,2012-03-07T15:40Z,"Trying to play this one in VLC but just get the sound and a gray flickering overlay instead of a proper picture!
:-( "
,katalysator,2012-03-07T18:18Z,"Never mind, it works on my TV anyway :)"
,41221,2012-03-08T09:01Z,Thanks
