User Type,Username,Date,Text
,awudu,2012-08-10T00:54Z,"AM having issues with this torrent today. It says; possibly insufficient sources.

I have searched uncle google, some forums say no one is seeding thats why its happening so and others say ISP is tracking me down because the material is copyrighted.

Some talked about windows firewall rules, to disable the inbound rules and re-enable it again."
,2010kaiser,2012-09-03T14:31Z,"Any requests for seeding/re-seeding should be posted at the forum below. You'll get a much quicker response from the uploader/s

https://forum.suprbay.org/index.php"
