Filename,Size,Unit
Ancient Aliens Debunked.avi,2.68,G
UFO End Time Delusion - True Predictions and Bible Prophecy.avi,415.08,M
Lost Pyramids and Other Hidden Ancient Artifacts.flv,269.56,M
UFOs and Media Desensitization of Children.avi,220.06,M
The Vaticans UFO Alien Psyop with Leo Zagami.avi,208.09,M
The Ancient Astronaut Lie.avi,180.26,M
Secret 5000 Year Old Flying Machine Discovery In Afganistan.avi,140.86,M
And More/The Holy Spirit/CELEBRATE JESUS   I HAVE A HOPE.mp4,125.71,M
Shorts/Autism Mom - her story using MMS on her child Aug 2012.flv,106.64,M
And More/The Holy Spirit/You Are More - Tenth Avenue North.mp4,105.14,M
And More/Signs of the Times/Dakuwaqa's Garden - Underwater footage from Fiji Tonga.mp4,103.45,M
Shorts/Dakuwaqa's Garden - Underwater footage from Fiji   Tonga.mp4,103.45,M
Shorts/Are Dragons Real - Creation Today with guest Darek Isaacs.flv,98.26,M
And More/SIN-ister Clips/Subliminal Walmart Cars Curtain - SUCK DI^@ SEX - warning foul language.flv,84.55,M
And More/The Holy Spirit/Live Like That Sidewalk Prophets (2).mp4,82.57,M
And More/Signs of the Times/2053 Nuclear Explosions Reactors Waste Dumped in Ocean LA Sinkhole New Madrid.flv,81.24,M
Shorts/2053 Nuclear Explosions Reactors Waste Dumped in Ocean LA Sinkhole New Madrid.flv,81.24,M
And More/The Holy Spirit/Ascend The Hill - Heaven Come Down -HD.mp4,76.14,M
600 Volumes - POtHS Torrents seeded 7-4-2012.rar,69.71,M
"And More/War and Rumors of Wars/UK trains, arms future enemies repeats errors of past.flv",66.58,M
And More/SIN-ister Clips/UK trains  arms future enemies repeats errors of past.flv,66.58,M
Shorts/UFOs Recorded Moving In Front Of The Sun.mp4,66.23,M
And More/The Holy Spirit/Be Still And Know That I Am God2.mp4,61.99,M
Shorts/Debunk This 009.flv,51.55,M
And More/The Holy Spirit/Evangelism - Untold Millions Are Still Untold.flv,49.23,M
And More/Signs of the Times/10 19 12 History of Assumption Sinkhole and New Madrid Seismic Zone NMSZ.flv,48.3,M
And More/The Holy Spirit/Beginning Of Sorrows  As The Tension Rises Don't Give Up.mp4,47.88,M
Shorts/What is coming to EARTH  MEDIA CONDITIONING - ALIEN AGENDA PART 1 - YouTube.flv,46.43,M
Shorts/UFO 2012 gravity BUG vs Nuclear Radio Trolls EMBED Propaganda Infopowerment.flv,45.96,M
And More/Signs of the Times/Athens Anger  Greek police rhetoric reminds of military dictatorship.flv,45.83,M
Shorts/Stuff They Don't Want You to Know - Lost Civilizations Part I.flv,42.38,M
And More/SIN-ister Clips/TX schools punish students who refuse to be tracked with microchips.flv,42.31,M
And More/SIN-ister Clips/Religious leaders call on US Congress to rethink military aid to Israel.flv,35.38,M
And More/The Holy Spirit/Clip- KNOW YOUR ENEMY  Satan The Fallen Angels The Children of Disobedience.avi,35.35,M
And More/Signs of the Times/Exposing The High Priests of Evolution - Tailbone Not Necessary.flv,34.04,M
Shorts/UFO Cross crucifix amazing UK - historical past.mp4,33.54,M
Shorts/Get Out of The Matrix Gary C Price.flv,33.24,M
Shorts/Reality TV - brainwashing the stupid.flv,28.22,M
And More/Signs of the Times/Biofarms to integrate vaccines pharmaceuticals into GMO biopharmaceutical crops.flv,28.03,M
Shorts/Giant Foot Print 200 Million Yrs Old - South Africa.flv,27.33,M
And More/The Holy Spirit/Bring My Heart Close To You - Gateway Pfortmiller.flv,22.48,M
And More/Signs of the Times/Mark of Beast -   Your right to resell your stuff is in peril Congress to rule.flv,22.42,M
And More/War and Rumors of Wars/War Not Far Off  Turkey retaliates against Syrian False Flag for fifth day.flv,22.05,M
And More/The Holy Spirit/BarAbbas and the Antichrist - Part 1.flv,21.72,M
And More/War and Rumors of Wars/Web Wars of Secrecy  Hackers for hire in demand by govts.flv,21.3,M
And More/War and Rumors of Wars/US Military Drones Terrorize Pakistani Civilians 24 Hrs A Day.flv,20.21,M
Shorts/To Bill Nye  Evolution Is NOT For Anyone by CMI.flv,19.02,M
And More/The Holy Spirit/When the Tears Fall We are never alone.flv,18.8,M
And More/SIN-ister Clips/Romney Ryan Mental State  Officially Full of Mitt  Absurdity Today 10-11-12.flv,18.11,M
And More/The Holy Spirit/Casting Crowns - Until the Whole World Hears.flv,17.23,M
And More/Signs of the Times/Hamas launches rockets at Israel in order to save face in Gaza   The GAME of War.flv,17,M
Shorts/UFO Man Photographed Clear Flying Saucer in Mexico 2010.flv,16,M
And More/Martyrs of Today/The Great Suffering - Underground Church N. Korea.flv,15.92,M
Shorts/Declassified Docs Reveal Genocide by Aerosols Chemtrails.flv,15.15,M
And More/SIN-ister Clips/UAE urges Gulf States to UNITE Against Islamist EXTREMISTS MUSLIM BROTHERHOOD THREAT to REGION.flv,14.69,M
And More/SIN-ister Clips/Radical Muslim Jihadists Train on American Soil 10-8-12.flv,14.15,M
And More/SIN-ister Clips/The Doctor Prescribed Honey Not A Pharma Medicine 10-8-12.flv,13.33,M
Shorts/Joshua's Altar  Dramatic Recent Discoveries.flv,12.88,M
And More/SIN-ister Clips/Turkish F16s intercept Syrian jet from Moscow over suspicious cargo.flv,12.73,M
And More/War and Rumors of Wars/Turkey FIRES ON Syria after MORTAR SHELLS from border KILL 5.flv,12.67,M
Shorts/Is Jesus our Sabbath.flv,12.24,M
And More/SIN-ister Clips/NATO Backs Turkey - sends fighter jets to Syrian border 10-9-12.flv,11.51,M
And More/Signs of the Times/BRAIN SURGEON  NOW I believe in God and Heaven Afterlife exists says top brain surgeon.flv,10.77,M
Shorts/Salmon Use Sophisticated Compass Cells.flv,10.58,M
Shorts/UFO or Project Blue Beam - Dont know what this is.mp4,10.44,M
And More/Martyrs of Today/Kids of Courage  Persecuted Christian Teens around the World.flv,10.33,M
Shorts/UFO Sightings on the Rise in 2012 - Fox News.flv,10.02,M
And More/Signs of the Times/Bloody Bite attack in Chinese Subway  Demonic Behaviour Continues.flv,9.82,M
And More/SIN-ister Clips/ROMNEY THREATERNS Iran   backs SYRIAN REBELS in FOREIGN policy SPEECH ARM the OPPOSITION.flv,9.53,M
And More/Signs of the Times/Entire Vaccine Industry (Big Pharma) Exposed Misrepresentation of Data.flv,9.51,M
And More/Signs of the Times/Four Herbs that heal the liver gall bladder and other ailments.flv,8.75,M
Shorts/Crosses chopped down  Anti-church hysteria spreads across Russia 8-26-12.flv,8.53,M
And More/Signs of the Times/Crosses chopped down  Anti-church hysteria spreads across Russia 8-26-12.flv,8.53,M
Shorts/CAPTURED CREATURE STILL A MYSTERY And Of ALIEN Origin.flv,8.19,M
And More/SIN-ister Clips/Vote Fraud - Diebold Whistleblower Speaks Out.flv,8.1,M
Shorts/Wretched  Paul Washer and Chic-fil-A.flv,7.98,M
And More/Signs of the Times/Global Warming Some areas 25-30 below norm breaking record-cold lows 100yrs old.flv,7.74,M
Shorts/Do YOU Have Dish TV - Disney Porn.flv,7.51,M
And More/SIN-ister Clips/Palestinian terrorists fired over 55 mortar shells at Israel settlements.flv,6.79,M
And More/The Holy Spirit/A Call to Anguish by David Wilkerson - Pt 1.flv,6.59,M
And More/SIN-ister Clips/TSA Ruins Dying Woman Last Trip Rips Bandages Off Ruins Meds.flv,6.53,M
Shorts/POPULATION AND THE AGE OF THE EARTH - YouTube.flv,6.36,M
And More/The Holy Spirit/Fellowship of the Unashamed.flv,5.9,M
Shorts/Scientists Urge People To Be Prepared For Alien Contact.flv,5.89,M
Shorts/UFO Kuban Russia - November 21st 2011 - YouTube.flv,1.95,M
Pics/header1.png,300.58,K
Pics/517xv4xaFvL._SL500_AA300_.jpg,23.7,K
Pics/imgres.htm,13.46,K
Info.txt,10.46,K
Pics/images2.jpg,10.04,K
Pics/459dhqdefault-150x150.jpg,8.75,K
POtHS - Why We Do What We Do.txt,7.89,K
Pics/images3.jpg,6.18,K
Torrent downloaded from Conspiracyhub.com.txt,47,B
