Filename,Size,Unit
Svensktoppen 50 År-100 Ettor 1962-2012.jpg,28.2,K
"Svensktoppsettor 1962-1969/01,Lars Lönndahl-Midnattstango.mp3",4.59,M
"Svensktoppsettor 1962-1969/02,Ann-Louise Hanson-Vita rosor från Aten.mp3",4.04,M
"Svensktoppsettor 1962-1969/03,Jan Höiland- En natt i Moskva.mp3",4.84,M
"Svensktoppsettor 1962-1969/04,Anna-Lena Löfgren- Regniga natt.mp3",4.19,M
"Svensktoppsettor 1962-1969/05,Jan Malmsjö-Bygga upp ett stort berg.mp3",4.55,M
"Svensktoppsettor 1962-1969/06,Trio Me' Bumba-Spel-Olles gånglåt.mp3",4.4,M
"Svensktoppsettor 1962-1969/07,Towa Carson-Jag måste ge mig av.mp3",4.69,M
"Svensktoppsettor 1962-1969/08,Per Myrberg-Trettifyran.mp3",3.73,M
"Svensktoppsettor 1962-1969/09,Sven-Ingvars-Min gitarr.mp3",4.76,M
"Svensktoppsettor 1962-1969/10,Gunnar Wiklund-Mest av allt.mp3",4.34,M
"Svensktoppsettor 1962-1969/11,Gitte Henning-Det kan väl inte jag rå för.mp3",3.95,M
"Svensktoppsettor 1962-1969/12,Lill-Babs-Jag kan inte leva utan dig.mp3",3.77,M
"Svensktoppsettor 1962-1969/13,Hootenanny Singers- Björkens visa.mp3",7.21,M
"Svensktoppsettor 1962-1969/14,Povel Ramel-Ta av dig skorna.mp3",9.06,M
"Svensktoppsettor 1962-1969/15,Östen Warnerbring-En sommardröm.mp3",5.37,M
"Svensktoppsettor 1962-1969/16,Hep Stars- Mot okänt land.mp3",4.93,M
"Svensktoppsettor 1962-1969/17,Claes-Göran Hederström-Det börjar verka kärlek banne.mp3",4.92,M
"Svensktoppsettor 1962-1969/18,Robert Broberg-Det som göms i snö.mp3",3.19,M
"Svensktoppsettor 1962-1969/19,Siw Malmkvist-Mamma är lik sin mamma.mp3",5.63,M
"Svensktoppsettor 1962-1969/20,Anita Lindblom-Kring de små husen i gränderna.mp3",5.91,M
"Svensktoppsettor 1962-1969/21,Ewa Roos-Vilken härlig dag.mp3",4.01,M
"Svensktoppsettor 1962-1969/22, Family Four-Kör långsamt.mp3",4.99,M
"Svensktoppsettor 1962-1969/23,Tommy Körberg-Judy min vän.mp3",3.98,M
"Svensktoppsettor 1962-1969/24,Lill Lindfors-En man i byrån.mp3",4.44,M
"Svensktoppsettor 1970-1979/25,Björn Ulvaeus & Benny Andersso-Hej gamle man.mp3",5.56,M
"Svensktoppsettor 1970-1979/26,Siw Malmkvist-Regnet det bara öser ner.mp3",3.93,M
"Svensktoppsettor 1970-1979/27,Svante Thuresson-Noaks Ark.mp3",5.89,M
"Svensktoppsettor 1970-1979/28,Cornelis Vreeswijk-En fattig trubadur.mp3",5.69,M
"Svensktoppsettor 1970-1979/29,Lena Andersson-Säg det med en sång.mp3",4.77,M
"Svensktoppsettor 1970-1979/30,Ted Gärdestad-Jag vill ha en egen måne.mp3",5.45,M
"Svensktoppsettor 1970-1979/31,Agnetha Fältskog-En sång om sorg och glädje.mp3",6.23,M
"Svensktoppsettor 1970-1979/32,Flamingokvintetten-Kärleksbrev i sanden.mp3",3.28,M
"Svensktoppsettor 1970-1979/33,Yngve Forsell-Så gick det till när farfar va.mp3",5.12,M
"Svensktoppsettor 1970-1979/34,Streaplers-Bara femton år.mp3",4.8,M
"Svensktoppsettor 1970-1979/35,Lasse Berghagen-Hålligång.mp3",4.53,M
"Svensktoppsettor 1970-1979/36,ABBA-Waterloo.mp3",4.61,M
"Svensktoppsettor 1970-1979/37,Mats Rådberg-Den vita duvan.mp3",4.94,M
"Svensktoppsettor 1970-1979/38,Frida- Fernando.mp3",7.05,M
"Svensktoppsettor 1970-1979/39,Paul Paljett-Guenerina.mp3",5.62,M
"Svensktoppsettor 1970-1979/40,Kjell Hansson-Roslagens vind.mp3",4.44,M
"Svensktoppsettor 1970-1979/41,Ann-Louise Hanson-Låt inte din skugga falla här.mp3",6.12,M
"Svensktoppsettor 1970-1979/42,Pugh Rogefeldt-Nattmara.mp3",4.1,M
"Svensktoppsettor 1970-1979/43,Gösta Linderholm-Rulla in en boll och låt den r.mp3",6.38,M
"Svensktoppsettor 1970-1979/44,Vikingarna-Djingis Khan.mp3",5.17,M
"Svensktoppsettor 1980-1991/45,Sten & Stanley-Santa Maria.mp3",7.1,M
"Svensktoppsettor 1980-1991/46,Stefan Borsch-Vid en liten fiskehamn.mp3",6.07,M
"Svensktoppsettor 1980-1991/47,Freestyle-Vill ha dig.mp3",6.06,M
"Svensktoppsettor 1980-1991/48,Chips-Dag efter dag.mp3",4.86,M
"Svensktoppsettor 1980-1991/49,Di Sma Undar Jordi-Snabbköpskassörskan.mp3",5.51,M
"Svensktoppsettor 1980-1991/50,Arja Saijonmaa-Högt över havet.mp3",4.78,M
"Svensktoppsettor 1980-1991/51,Kikki Danielsson-Papaya coconut.mp3",6.67,M
"Svensktoppsettor 1980-1991/52,Lotta Engberg-100 %.mp3",5.14,M
"Svensktoppsettor 1980-1991/53,Tommy Körberg-Stad i ljus.mp3",5.18,M
"Svensktoppsettor 1980-1991/54,Mauro Scocco-Sarah.mp3",7.64,M
"Svensktoppsettor 1980-1991/55,Orup-Då står pojkarna på rad.mp3",7.23,M
"Svensktoppsettor 1980-1991/56,Ainbusk-Lassie.mp3",6.89,M
"Svensktoppsettor 1980-1991/57,Anders Glenmark-Hon har blommor i sitt hår.mp3",5.12,M
"Svensktoppsettor 1980-1991/58,Grymlings-Mitt bästa för dig.mp3",7.06,M
"Svensktoppsettor 1980-1991/59,Carola-Fångad av en stormvind.mp3",5.12,M
"Svensktoppsettor 1980-1991/60,Tomas Ledin-Snart tystnar musiken.mp3",8.23,M
"Svensktoppsettor 1980-1991/61,Eva Dahlgren-Vem tänder stjärnorna.mp3",7,M
"Svensktoppsettor 1980-1991/62,Sven-Ingvars-Två mörka ögon.mp3",5.06,M
"Svensktoppsettor 1992-2002/63,Niklas Strömstedt-Halvvägs till framtiden.mp3",6.76,M
"Svensktoppsettor 1992-2002/64,Lisa Nilsson-Varje gång jag ser dig.mp3",6.38,M
"Svensktoppsettor 1992-2002/65,Christer Björkman-I morgon är en annan dag.mp3",5.34,M
"Svensktoppsettor 1992-2002/66,Nick Borgen-We are all the winners.mp3",5.25,M
"Svensktoppsettor 1992-2002/67,Lisa Ekdahl-Vem vet.mp3",5.1,M
"Svensktoppsettor 1992-2002/68,Thorleifs-Och du tände stjärnorna.mp3",5.68,M
"Svensktoppsettor 1992-2002/69,Tommy Nilsson-Öppna din dörr.mp3",9.58,M
"Svensktoppsettor 1992-2002/70,Ted Gärdestad-Ge en sol.mp3",5.08,M
"Svensktoppsettor 1992-2002/71,Glenmark Eriksson Strömstedt-En jävel på kärlek.mp3",6.28,M
"Svensktoppsettor 1992-2002/72,Jan Johansen-Se på mig.mp3",5.17,M
"Svensktoppsettor 1992-2002/73,Henrik Åberg-Du är alltid en del utav mig.mp3",5.41,M
"Svensktoppsettor 1992-2002/74,Peter Jöback-Guldet blev till sand.mp3",7.07,M
"Svensktoppsettor 1992-2002/75,Arvingarna-De ensammas promenad.mp3",5.36,M
"Svensktoppsettor 1992-2002/76,Charlotte Nilsson-Tusen och en natt.mp3",5.06,M
"Svensktoppsettor 1992-2002/77,Björn Afzelius-Farväl till släkt och vänner.mp3",4.54,M
"Svensktoppsettor 1992-2002/78,Barbados-Se mig.mp3",5.04,M
"Svensktoppsettor 1992-2002/79,Åsa Jinder & CajsaStina Åkerst-Av längtan till dig.mp3",5.88,M
"Svensktoppsettor 1992-2002/80,Alf Robertson-I mina skor.mp3",6.49,M
"Svensktoppsettor 1992-2002/81,Lasse Stefanz-Låt en morgon vakna.mp3",5.6,M
"Svensktoppsettor 2003-2012/100,Laleh-Some die young.mp3",6.14,M
"Svensktoppsettor 2003-2012/82,Per Gessle-Här kommer alla känslorna.mp3",4.55,M
"Svensktoppsettor 2003-2012/83,Jill Johnson-Crazy in love.mp3",5.09,M
"Svensktoppsettor 2003-2012/84,Björn Skifs-Håll mitt hjärta.mp3",7.19,M
"Svensktoppsettor 2003-2012/85,BAO och Helen-Du är min man.mp3",6.01,M
"Svensktoppsettor 2003-2012/86,Lena Philipsson-Det gör ont.mp3",5.07,M
"Svensktoppsettor 2003-2012/87,After Dark-Dolce Vita.mp3",5.04,M
"Svensktoppsettor 2003-2012/88,Nanne Grönvall-Håll om mig.mp3",5.07,M
"Svensktoppsettor 2003-2012/89,Martin Stenmarck-7milakliv.mp3",7.79,M
"Svensktoppsettor 2003-2012/90,Agnes-Right here right now.mp3",6.89,M
"Svensktoppsettor 2003-2012/91,Måns Zelmerlöw-Cara Mia.mp3",5.11,M
"Svensktoppsettor 2003-2012/92,Markoolio & Linda Bengtzing-Värsta schlagern.mp3",5.07,M
"Svensktoppsettor 2003-2012/93,Sanna Nielsen-Empty rooms.mp3",5.08,M
"Svensktoppsettor 2003-2012/94,Amanda Jenssen-Happyland.mp3",5.86,M
"Svensktoppsettor 2003-2012/95,Jessica Andersson-I did it for love.mp3",5.04,M
"Svensktoppsettor 2003-2012/96,Kalle Moraeus & Orsa Spelmän-Underbart.mp3",5.23,M
"Svensktoppsettor 2003-2012/97,Sara Varga-Spring för livet.mp3",4.98,M
"Svensktoppsettor 2003-2012/98,Lisa Miskovsky-Why start a fire.mp3",4.93,M
"Svensktoppsettor 2003-2012/99,Loreen-Euphoria.mp3",4.95,M
