Filename,Size,Unit
Al Quran And Akhir Al Zaman By ‪Sheikh Imran Hosein‬‏.mp4,200.29,M
An Islamic Response To The Imminent Zionist Attack On Iran By Sheikh Imran Hosein.mp4,366.59,M
Dajjal And The Samawat‬‏ By ‪Sheikh Imran Hosein.mp4,188.36,M
"Explaining Pax Islamica, The Islamic Conception Of An International Order.mp4",258.17,M
Fasting And Power By Sheikh Imran Hosein.mp4,567.56,M
Feminist Revolution By ‪Sheikh Imran Hosein‬‏.mp4,235.17,M
Imam Mahdi And The End Time By Sheikh Imran Hosein.mp4,478.27,M
Islam And Future Of Money By ‪Sheikh Imran Hosein‬‏.mp4,228.77,M
Islam And The End Of History By ‪Sheikh Imran Hosein‬‏.mp4,258.34,M
Islam The End Of History By ‪Sheikh Imran Hosein.mp4,370.33,M
"Islam, UN, And The New World Order By Sheikh Imran Hosein.mp4",501.2,M
Islamic Eschatology By Sheikh Imran Hosein.mp4,392.98,M
Islamic View Of Gog And Magog By ‪Sheikh Imran Hosein‬‏.mp4,247.24,M
Marriage In Islam By Sheikh Imran Hosein.mp4,406.94,M
River Euphrates A Mountain Of Gold By Sheikh Imran Hosein.mp4,470.17,M
Signs Of The Last Day By ‪Sheikh Imran Hosein‬‏.mp4,198.81,M
Strategic Sunnah By Sheikh Imran Hosein.mp4,187.09,M
Surah Al Kahfi By Sheikh Imran Hosein.mp4,291.53,M
The Divine Punishment For Adultery And Fornication By Sheikh.mp4,385.97,M
The Imperative of The Muslim Village (with improved audio) at Masjid Negeri by Sheikh Imran Hosein.mp4,243,M
The Imperative Of The Muslim Village By ‪Sheikh Imran Hosein.mp4,226.22,M
The Muslim Youth In A Glamorous World By Sheikh Imran Hosein.mp4,429.22,M
The Prohibition Of Riba By ‪Sheikh Imran Hosein‬‏.mp4,320.1,M
"The Sufi, The Salafi  And Akhirruzaman By Sheikh Imran Hosein.mp4",249.61,M
Understanding Dajjal By Logical Deduction By Sheikh Imran Ho.mp4,214.86,M
