User Type,Username,Date,Text
[V],sujaidr,2012-03-02T01:52Z,"i have included a sample,so you could check for quality :-) ENJOY

i dont have a seed box so i'll provide maximum initial seeding but for the torrent to be alive please seed back too"
,stan1408,2012-03-02T09:21Z,"Young.Adult.2011.720p, The.Muppets.2011.720p & The.Girl.With.The.Dragon.Tattoo.2011.720p plz"
,nexuswolf,2012-03-02T15:09Z,"@sujaidr
Hey, U Got Ny Plans For Doin Muppet And Gal wid Dragon Tattoo?"
[M],Hero,2012-03-02T15:16Z,"No idea why we didn't see you before....

I fix that now giving you a skull :D
"
,abj642,2012-03-02T16:34Z,congratulations for the skull
[H],manhide,2012-03-02T18:39Z,Enjoy Ur skull ..happy shearing 
[V],sujaidr,2012-03-02T18:52Z,"oh gee,thanks for the skull guys....will continue to share good stuff but rite now not able to upload any of my torrents,maybe its got to do something with the sites upload handle i think,hope the site is back as soon as possible"
,stan1408,2012-03-03T08:58Z,"Young.Adult.2011.720p 
The.Muppets.2011.720p
The.Descendants.2011.720p
Carnage.2011.LIMITED.720p
Machine.Gun.Preacher.2011.720p
The.Girl.With.The.Dragon.Tattoo.2011.720p"
,tripanuj,2012-03-03T09:41Z,Congratulations on ur skull!! it'll turn green very very soon. thanks for the quality upload!!
,pete_k,2012-03-03T10:42Z,"Many Many Congratulations on the SKULL!!!!!!!

A very well deserved recognition indeed.
Great quality in brilliant size."
[V],sujaidr,2012-03-03T11:50Z,"right now i am facing problems in uploading on pirate bay........i have already uploaded young adult 720p and the girl with the dragon tattoo 720p on other sites,grab it on other sites as i dont know when i'll be able to upload here again......i am gettin no response for my prob :("
[T],dude7001,2012-03-03T12:21Z,"Congrats 4 the skull !!!...

shud hav been given earlier..hope gets green soon..

thanks 4 ur efforts.."
[V],sujaidr,2012-03-03T16:24Z,"still not able to upload here,carnage 720p has been uploaded by me on other sites......."
,liverpoolfanatic100,2012-03-03T19:33Z,Congrats dude for getting a skull.......
,Kole97,2012-03-04T08:18Z,this dude hella deserve Green skull xx
,luvislife90,2012-03-06T09:23Z,"Dude, print is really good. & really fast download...
But, there are no subtitles given...!!!
Please give a link of perfect subtitles."
