User Type,Username,Date,Text
,siradude,2012-11-06T08:37Z,"Todavia no han puesto el capitulo #105 en el web original, no se si hay algun dia feriado o si las elecciones de qualquier pais esten afectando su transmision televisiva..."
,siradude,2012-11-06T08:39Z,Perdon... Quise decir el capitulo #106
,gambostin,2012-11-06T09:09Z,ya me imaginaba entonces puedo acostarme q ya son las 3 am aqui en new york gracias amigo
,gambostin,2012-11-06T09:15Z,gracias amigo d todos modos
,monteria,2012-11-06T10:59Z,"Hola saludos a todos 

Siradude en dia lunes 5 de noviembre fue feriado en colombia, esperemos el capitulo 106 el dia de hoy martes. Un abazo"
,meteo1234567,2012-11-06T13:02Z,que festejaran ese día los hermanos Colombianos? en Panamá el 5 de noviembre  es día patrio también
,xmars,2012-11-06T14:04Z,"En Colombia el 5 de Noviembre lo celebran como festivo ""Dia de Todos Los Santos""
Gracias Siradude, por resubir el 104 corregido, gran labor!"
,buddycano,2012-11-06T18:04Z,"Hey, siradude muchas gracias tus aportes eres uno de los buenos!!!!"
