User Type,Username,Date,Text
,marcoscu3,2012-04-17T20:30Z,Thanks!!
,shelleyjohn,2012-04-18T02:11Z,Thanks so much. Looking for The Replacement Wife by Eileen Goudge. 
,romeoji,2012-04-18T10:03Z,Thank You!!!
,seagull_special,2012-04-18T15:40Z,"thanks, very much appreciated, wondered if you had any luck with Hakan Nesser?"
,raptor52,2012-06-28T17:16Z,love your work.  can you please do the s.m. sterling series for dies the fire.  have looked and no one seems to have them listed.   thanks again
