Filename,Size,Unit
Torrent downloaded from AhaShare.com.txt,58,B
Torrent downloaded from Demonoid.me.txt,46,B
Torrent Downloaded From ExtraTorrent.com.txt,353,B
Torrent downloaded from P2PDL.com.txt,81,B
Torrent downloaded from Rarbg.com.txt,33,B
Torrent downloaded from silvertorrents.me.txt,29,B
Torrent Downloaded from TorrentState.com.txt,46,B
tracked_by_h33t_com.txt,23,B
Vares.The.Kiss.of.Evil.2011.R2.Retail.DVDr.DD5.1.MultiSubs.nfo,690,B
Vares.The.Kiss.of.Evil.2011.R2.Retail.DVDr.DD5.1.MultiSubs/Vares.The.Kiss.of.Evil.2011.R2.Retail.DVDr.DD5.1.MultiSubs.iso,4.36,G
