Filename,Size,Unit
Mirror.Mirror.2012.BRRip.XviD-MeRCuRY.avi,694.84,M
Torrent Downloaded From 1337x.org.txt,33,B
Torrent Downloaded From Ahashare.com.txt,59,B
Torrent Downloaded From Btarena.org.txt,35,B
Torrent Downloaded From ExtraTorrent.com.txt,353,B
Torrent Downloaded From H33t.com.txt,32,B
Torrent Downloaded From IsoHunt.com.txt,35,B
Torrent Downloaded From Kat.ph.txt,30,B
Torrent Downloaded From ThePirateBay.se.txt,39,B
Torrent downloaded from Demonoid.me.txt,46,B
nfo.nfo,2.44,K
