User Type,Username,Date,Text
,canadianice,2012-08-08T16:50Z,"Thanks, this one sounds great----more Rush, more Rush-----cheers"
,DOOLY-WZMB,2012-08-09T01:54Z,"****************************************************
THANKS TO RUSH FOR THEIR SUPPORT
OF AUDIENCE RECORDING,SHARING, AND TRADING.
PLEASE SPREAD, BUT PLEASE 
INCLUDE SOURCE INFO. DO NOT SELL OR 
DISTRIBUTE FOR A PROFIT BY ANY MEANS.!!!!!!!
****************************************************"
,DOOLY-WZMB,2012-08-10T04:43Z,"Thanks!  I think this one is the best sounding Rush show I have.  If I find another one in my collection that sounds good, I'll post it.  :)"
