Filename,Size,Unit
3 - Father of Lights -  2012.avi,700.33,M
1 - Finger of God -  2007.avi,698.79,M
2 - Furious Love -  2010.avi,691.99,M
Behold A Pale Horse  - America's Last Chance.avi,536.76,M
Xtras/SIN-ister Clips/ABCs Nephilim Anti-Christ  Mark of The Beast   Anti-Christ in Hollywood TV Shows - YouTube.mp4,194.51,M
Xtras/The Holy Spirit/A Vast Storm Of Evil Psalmody in practice session.mp4,145.8,M
Xtras/SIN-ister Clips/2001 A Space Odyssey - The True Meaning Behind the Movie.flv,100.74,M
Xtras/Signs of the Times/Amazing Top 100 Videos Pt1.flv,89.83,M
Xtras/War and Rumors of Wars/Endtime News Updates 11-13-12.avi,84.82,M
Xtras/Martyrs of Today/Beware of Good Liars by Francis Chan.flv,84.78,M
Xtras/SIN-ister Clips/A World of Imperative change EXTREME WEATHER EVENTS OCT 2012.flv,84.59,M
Xtras/The Holy Spirit/HALLELUJAH - YOUR LOVE IS AMAZING.mp4,77.39,M
Xtras/SIN-ister Clips/2012 2013 #8 Atheism or Intelligence.flv,76.99,M
Xtras/War and Rumors of Wars/Hamas fire Rockets at Jerusalem while Egypt embraces the Terrorist 11-16-12.avi,69.46,M
"Xtras/The Holy Spirit/DAME PAZ, MI CRISTO - Aline Barros.mp4",60.22,M
Xtras/SIN-ister Clips/2012 2013 Warnings  Signs   Wonders.flv,56.18,M
Xtras/Martyrs of Today/Christian Persecution Coming To America.flv,54.35,M
Xtras/Signs of the Times/9 12 11 - Purported former Groom Lake Technician Leak.avi,51.79,M
Xtras/Signs of the Times/40 Members of Congress Protest Indefinite Detention Bill.flv,50.39,M
Xtras/SIN-ister Clips/2012 IS STRANGE Pt 68 OCTOBER 2012.flv,49.24,M
Xtras/SIN-ister Clips/Abortion MURDER Repent or PERISH Will you take a stand.flv,42.99,M
Xtras/Signs of the Times/911 Conspiracy Debunk This.flv,42.62,M
Xtras/War and Rumors of Wars/(Part 9) Towards a WW3 Scenario  Special Report.flv,40.56,M
Xtras/The Holy Spirit/God Has Not Passed You by David Wilkerson - Part 2.avi,39.06,M
Xtras/The Holy Spirit/Evolutionists Debunk Evolution.avi,35.7,M
Xtras/SIN-ister Clips/Alex Jones  New Unconstitutional Super Congress One Step Closer To Dictatorship.flv,34.66,M
Xtras/The Holy Spirit/Cross Connection Band - Hallelujah Christ Jesus Is King.mp4,33.37,M
Xtras/SIN-ister Clips/A History Lesson Evolution Conservatives Liberals and other Stuff - A SATIRE.flv,28.55,M
Xtras/The Holy Spirit/Creation Calls I Believe.flv,28.17,M
Xtras/SIN-ister Clips/1958 Robert Welch Mind Blowing Speech On Elite Plans For World Control.flv,27.29,M
Xtras/SIN-ister Clips/1980s GI Joe Cartoon Predicts the Future.flv,26.14,M
Xtras/The Holy Spirit/I Will Rise sung by Chris Tomlin.flv,25.07,M
Xtras/Signs of the Times/12 28 11 Storm reaches around HALF THE PLANET N America to India.flv,21.9,M
Xtras/SIN-ister Clips/11000+ DEER FOUND DEAD FROM MYSTERY DISEASE 10-26-12.flv,21.38,M
Xtras/The Holy Spirit/Iran and Egypt connection in prophecy.flv,15.17,M
Xtras/Signs of the Times/85 arrested Rabbis & Orthodox Jewish community for child sex abuse kidnapping sodomy.flv,14.38,M
Xtras/Signs of the Times/1 Km Long UFO enters Volcano Popocatepet 10-26-12.flv,13.64,M
Xtras/Signs of the Times/All media biased  - YouTube.flv,13.54,M
Xtras/Signs of the Times/30 Important Facts All US Citizens Should Know.flv,12.64,M
Xtras/The Holy Spirit/Gods love letter.flv,11.96,M
Xtras/Signs of the Times/3 Nuke plants shutdown as Sandy ravages N US.flv,10.52,M
Xtras/The Holy Spirit/Humorous Illustration while speaking on Evolution.flv,9.84,M
Xtras/Signs of the Times/66 Year Old Man With Dementia Brutally Beaten   Tasered By Criminal Cop - YouTube.flv,9.05,M
Xtras/SIN-ister Clips/Agenda 21 in your town.flv,8.27,M
Xtras/The Holy Spirit/beautiful - Laetitia.flv,8.1,M
Xtras/Signs of the Times/1000s of Migrating Birds lost in North Sea.flv,7.39,M
Xtras/The Holy Spirit/GOD be with You.flv,6.52,M
Xtras/Martyrs of Today/Christian Persecution in Atheist China - YouTube.flv,6.38,M
"Xtras/Signs of the Times/10,000 MUSLIMS Protest GOOGLE to Limit Free Speech in London .flv",6.25,M
Xtras/Signs of the Times/33 YRS BEFORE 911 WTC NEWS IN 1968 SHOWS PLANE ABOUT TO HIT TOWER.flv,5.64,M
Xtras/SIN-ister Clips/Alien guinea pig on mars - Curiosity rover.flv,5.24,M
Xtras/Signs of the Times/13 Yr Old Girl Suspended For Terroristic Threat Pointing Finger Gun Near Teacher.flv,5.07,M
Xtras/The Holy Spirit/Holiness and Power.flv,4.88,M
Xtras/SIN-ister Clips/1600 sq ft  Land Collapsed into Giant LA Sinkhole 10-31-12.flv,2.42,M
Xtras/SIN-ister Clips/ABC News  UFO Spotted at Sunday Night Football.flv,1.66,M
Xtras/Signs of the Times/11 Arrested In Al Qaeda Terror Plot In Jordan.flv,1.42,M
POtHS - Why We Do What We Do.txt,7.89,K
Torrent downloaded from Conspiracyhub.com.txt,47,B
