User Type,Username,Date,Text
[T],SCSA420,2012-10-27T06:12Z,"Here is the latest WWE Friday Night Smackdown HDTV 2012-10-26 720p AVCHD-SC-SDH in 720p HD MP4 enjoy the show!!!

PLEASE READ THE .nfo FILE THIS WEEK FOR MORE INFORMATION!!!

Please stay connected after your download is finished to help seed this show for people still downloading it and enjoy the show!!! :D"
,NickMai,2012-10-27T14:49Z,"Thank you for the release! Always downloading your torrents, they're the best on the web!"
,Jerseyboy68,2012-11-03T05:21Z,thanks SCSA420 best quality torrents!! even though seeders suck!!
