User Type,Username,Date,Text
,babybluetits24,2012-06-05T15:52Z,"http://www.imdb.com/find?q=Inseparable.&s=all not sure what this is...useless info from tvteam as usual

Everyone please seed or reseed this it says just 0 seed, if u find any file with low seeds & you still have the file please reseed (start sharing the file again from utorrent etc) torrent sites may not be around for ever so always help out. If you find a file lacking useful details like imdb info or wikipedia info please copy & paste it into a comment to help every1 else out, and always report viruses to the suprbay forum thanks ps dont forget the faster you seed uploading the faster your files download so set upload speed to unlimited in Utorrent etc "
,meagain01,2012-06-05T23:35Z,looks good
,Mutegrill,2012-06-07T11:45Z,"Agree TvTeam being a bit lazy not putting up imdb links, but his uploads are flawless.

This movie was released in China 2011 and 2012 in Usa, maybe thats why I had problems finding enough results on PB (searching for ""Inseparable 2011"")."
