User Type,Username,Date,Text
,dalesteyn,2012-12-17T11:31Z,awsum....you made my day...
,reddragon92,2012-12-17T14:52Z,thnx for doing my request so fast...loving ur uploads man was hoping only for a 720p due to the time crux that u might be havin but u have outdone urself by giiving us the 1080p rips thnk u very much 
,tingya,2012-12-17T18:09Z,THnx 4 da series :D
,che3to,2012-12-30T20:38Z,"@Zen_Bud

Is there a place where I can see which uploads are you doing? Like see what movies you are doing next, kind of like YIF's site."
