User Type,Username,Date,Text
,cliftonenrico,2012-10-11T03:12Z,yesyesyesyesyes!!!
,bikerdoc1500,2012-10-11T03:16Z,Thanks.  It was great.  A keeper.  Appreciate your work ettv.
,bong420,2012-10-11T03:50Z,"thanks as always! you always got my back with SOA, now Arrow (""recorded"" it, but the god damn network fucked up and gave me a rerun on bones!!! wtf!! lol) "
,kalwin47,2012-10-11T04:56Z,finally a great show since smallville. ty 
,izwotitiz,2012-10-11T13:40Z,Thanks for sharing!
,tvbum,2012-10-21T23:08Z,A/V very good  Thanks
