User Type,Username,Date,Text
,intobearzz,2012-10-18T04:56Z,"OMFG! looooooooong awaited for all of us! this has i believe been ban or nobody production was interested to buy it n release it. too bad! it looks wild n sickening for the HORROR fans. YEZZZZZZ BIIIIIIITCH! thanks thanks much! Los Angeles,Ca"
,BKKJack,2012-10-18T05:18Z,"I too have been awaiting this accurate description of life in rural Yorkshire for a while now.

Many thanks. "
,NaNaMoose,2012-10-18T05:43Z,"After the first 2 comments, I am not even looking it up on IMDB. Str8 Dload!"
,babybluetits24,2012-10-18T15:53Z,"http://www.imdb.com/title/tt1723124/ imdb 6.0/10 horror

Everyone please seed or reseed this it says just 69 seed,(im never having a go at the uploader ! )  if you  find any file with low seeds & you still have the file please reseed (start sharing the file again from utorrent etc) torrent sites may not be around for ever so always help out. If you find a file lacking useful details like imdb.com  info or wikipedia info please copy & paste it into a comment to help every1 else out (eg if its porn what type eg lesbien) ive more than done my share of helping now its your turn, and always report viruses to the suprbay forum thanks ps dont forget the faster you seed uploading the faster your files download so set upload speed to unlimited in Utorrent etc ( copy and paste this comment & save it in a word document or open office or a draft email & then paste it as a reminder to people to be helpful on every torrent you look at â&#x20AC;Ś 1 by 1 teaching selfish snatch & grabbers to help out) "
