User Type,Username,Date,Text
[V],sujaidr,2012-03-13T19:09Z,"i have included a sample,so you could check for quality :-) ENJOY

i dont have a seed box so i'll provide maximum initial seeding but for the torrent to be alive please seed back too"
,Fishq,2012-03-14T18:14Z,thanks ..
,rasbora,2012-03-14T21:29Z,just thouht i would say congrats on skull you deserve it 
,dense83,2012-03-14T22:47Z,"seriously, thanks so much for all your work sujaidr! 

if by chance you could rip breathless (1960) that would be awesome! it's one of those classic that i've never seen.  thanks again!"
