User Type,Username,Date,Text
,ThePr0lim,2012-12-31T11:37Z,"Plz Seed Guys! If You Guys Have Any Questions, Feel Free To Ask"
,dandalis,2012-12-31T13:14Z,"this game sucks on PC, too much lagg even on good gaming rigs, but fun as hell tough."
,ThePr0lim,2012-12-31T14:41Z,"Sorry Guys! I CANT SEED FOR YOU AS I ACCIDENTALLY DELETED THE TORRENT.
This Is The Reuploaded Version, So Download This Instead:
http://thepiratebay.se/torrent/7975141"
,tmcmahon51,2012-12-31T21:43Z,"If you delete the torrent, all you need to do is redownload it, then verify the files so it doesn't redownload."
,ThePr0lim,2013-01-01T01:39Z,"the reuploaded torrent got more seeds so well, use the reuploaded"
