User Type,Username,Date,Text
[V],psspss,2013-01-02T09:34Z,"ta I will add to kat if you havent yet

ive yet to get around to watch the last 6 of these LOL "
,bro918,2013-01-09T02:57Z,Thank you so much for uploading these.
[V],steevo-be-thy-name,2013-01-09T12:13Z,"I thought after Mayan prophesy failed a lot of these nutters would stop . 
Alas they don't  , too many idiots with too much time and money to waste . They spend more time worrying and prepping instead of just enjoying life . What's even more amusing when it's some old cunt in their 70's  spending their last on more food to store away . The food is gonna outlast these lunatics easily . lol"
[T],k3nd00d,2013-01-09T18:15Z,@steevo .. shut up stupid
[T],k3nd00d,2013-01-09T18:19Z,"@steevo ..  why are you spamming this shit on all of these torrents of this show? If you ever watch the show, none of it was ever about 2012 or Mayan bullshit. Retard. And YOU are a VIP? That is nuts!"
