User Type,Username,Date,Text
,migotka21,2012-10-20T21:50Z,"Sorry, how do I follow you here or on kat? I don't want to miss your Presley torrents. BTW my dad says thanks a lot! Although he's not going to travel to Holland to kiss you, so don't worry!
M."
[V],jeroep,2012-10-20T23:25Z,put me under your favourites!
,ed9msi,2012-10-21T13:26Z,"jeroep, you're actually my starting page when i open firefox, this way i don't miss anything. Have you heard anything of Burning love?"
,fneves76,2012-10-25T18:02Z,you are my number one forever....thank's 
