User Type,Username,Date,Text
,inuyasha132,2012-08-11T22:28Z,Seed please its stuck at 64.9%
,Hawklar,2012-08-17T23:48Z,"Oh my, 21 GB's for this. Was searching for this and happy that I found it. I'll probably need to encode this to get a way smaller file size but keeping the same 720p. Hopefully I can manage to finish DL this. I see 1 seeder at the moment, hopefully some people are currently DL'ing it can seed for a while.

Thanks again for this up. When I get around to encoding this to smaller sizes and keeping everything the same i'll try to remember to upload it on here."
,RoFl_ChOpS,2012-08-22T21:19Z,"More and more leechers, no seeders. Forever 65.3% T.T"
,RoFl_ChOpS,2012-08-30T02:39Z,Someone please seed. It's been 7 days and I've only gone up by .3%
,beafman,2012-09-10T21:03Z,Need more seeds!  I'm seeding my 68.6%!
,beafman,2012-09-14T07:41Z,No seeds?
,Chromi,2012-09-19T00:36Z,"I found a duplicate torrent - same files, different infohash.  I'll use that to obtain the files, then seed this one."
