User Type,Username,Date,Text
,wirama,2012-06-17T11:58Z,"it's not a hentai or porn game
it's a fucking normal online game"
,sainichi,2012-06-24T18:09Z,this is NOT fucking porn
,Drunkefox,2012-06-26T03:26Z,omfg its not porn jesus christ it IS..NOT!...POOOOOOOORRRRNNNN!!!!! FUCKING HELL GOD HELP US IS NOT PORN!!!! yeah
,LimitingF,2012-07-26T12:42Z,not porn?...some people have appalling lack of manners
,kurohyoneko,2012-07-28T20:59Z,"@LimitingF, manners nothing.  This is a case of mis-classification.  He put a non-porn torrent into the porn games.  This is a breach of trust!"
