User Type,Username,Date,Text
[V],HobbitWarez,2012-12-21T00:24Z,"AnDrOiD Applications 12-20-12

3D Christmas Live Wallpaper v2.06P-ROOTED DEVICES ONLY-AnDrOiD
Advanced Task Manager Pro v3.0.1-AnDrOiD
Android Pro Widgets v1.3.4 Unlocked-AnDrOiD
Battery Widget Reborn Pro v1.5.3 PRO-AnDrOiD
Beautiful Widgets v5.0.5-AnDrOiD
Blue Infinitum Theme - CM10 v2.8.0 Android 4.0 Plus (Requires CM10 AOKP Rom)-AnDrOiD
Call Recorder Galaxy S2 and S3 FULL v1.9.36-AnDrOiD
Call Recorder Total Recall FULL v1.9.36-AnDrOiD
Convertor Pro v4.11-AnDrOiD
Daily Arm Workout v2.20-AnDrOiD
DRAGON designer clock widget v2.11-AnDrOiD
Dropsync PRO v2.4.11-AnDrOiD
ePSXe for Android v1.8.3-AnDrOiD
File Explorer Plus Root v1.2.0-AnDrOiD
Flightradar24 Pro v3.6.1 (Plus Aircraft model graphics)-AnDrOiD
FolderSync v2.3.1-AnDrOiD
ForeverMap 2 - Offline Maps v2.2.1.0-AnDrOiD
FPse for android v0.11.70-ROOTED DEVICES ONLY-AnDrOiD
GO SMS Pro v4.71-AnDrOiD
HD BLUE MEGA DRAGON THEME GO v1-AnDrOiD
Innovative Animus Theme v1.1-AnDrOiD
iPhone Go Launcher EX Theme vV-AnDrOiD
Its a Small World v1.0.0 LWP-AnDrOiD
LC Sunken Glass Apex Go Nova v1.01-AnDrOiD
Norton Utilities And Task Killer FULL v2.6.0.291-AnDrOiD
Pixlr-o-matic v2.2.1-AnDrOiD
PlayerPro Music Player v2.51-AnDrOiD
PolyClock World Clock v4.01-AnDrOiD
RealPlayer Premium v1.1.3.0-AnDrOiD
RepliGo PDF Reader v4.1.2-AnDrOiD
Solid Explorer FULL v1.4.1a-AnDrOiD
Starship C. GO Launcher Theme v1.0-AnDrOiD
StatusBar Plus Custom Status Bar v5.0-AnDrOiD
SwiftKey 3 Phone Keyboard v3.1.0.377-AnDrOiD
SwiftKey 3 Tablet Keyboard v3.1.0.377-AnDrOiD
TrackID v3.60.64-AnDrOiD
TweetCaster Pro for Twitter v6.9.6 -AnDrOiD
Tweetings for Twitter v2.10.6-AnDrOiD
Winamp Pro v1.4.5-AnDrOiD"
,jamesbarrett,2012-12-21T00:54Z,Thank you Hobbit....Will seed overnight.  Keep up the good work.
,Bynx,2012-12-21T03:12Z,Sure wish someone could upload Helicon Remote full version and not the free one.
,tommybertsen1,2012-12-21T23:45Z,"thanx Hobbit! 
@bynx, as long as this program u ask , requires a registration from a specific site in order to be full , I suppose nobody will bother cracking this one to upload it :) "
