User Type,Username,Date,Text
,Canoetothemoon,2012-10-09T16:40Z,"192kbps, sounds great. Thank you for this!"
[T],rajabmm,2012-10-09T23:50Z,you are welcome...
,brittle_14,2012-10-10T00:54Z,Wow! Thanks for getting this uploaded already =) Sound is good and everything is included.
,WolfParty,2012-10-10T02:46Z,You are my hero! Thanks rajabmm
[T],rajabmm,2012-10-11T01:38Z,you are all welcome and enjoy...cheers
,creative_expansion,2012-10-13T23:50Z,thank you so much!!
,firexninja,2012-11-23T23:41Z,thank you!
