Filename,Size,Unit
Professional Javascript for Web Developers 3rd Edition OnlyGill.pdf,51.38,M
JavaScript For Dummies Quick Reference.pdf,30,M
Start Here Learn JavaScript 2012.pdf,19.03,M
JavaScript and jQuery The Missing Manual 2nd Edition[A4].pdf,16.37,M
Modern JavaScript Develop And Design V413HAV.pdf,12.99,M
Applied jQuery Develop and Design (Peachpit-2012-Ed1) 978-0-321-77256-5.pdf,12.22,M
Mobile JavaScript Application Development V413HAV.pdf,8.75,M
Learning JavaScript V413HAV.pdf,6.66,M
JavaScript for DUMmIES 4th.pdf,6.62,M
JavaScript Step by Step 2nd Edition.pdf,6.07,M
jQuery Mobile Web Development Essentials.pdf,4.8,M
smashing-ebook-javascript-essentials.pdf,2.59,M
OReilly.JavaScript.The.Good.Parts.May.2008.chm,1.63,M
smashing-ebook-mastering-jquery.pdf,1.42,M
