User Type,Username,Date,Text
,pastor66,2012-09-16T19:03Z,"You are DEFINITELY ""The Man""...
.
Thanks SnakEye"
,DarkstarG,2012-09-17T00:22Z,you da man! thank you!
,Taco92,2012-09-17T06:21Z,"Thanks man, you the King!!"
,cbboner,2012-09-17T13:15Z,Snakeye thanks again any chance in getting the new US Cities Los Angeles X
,rainvel,2012-09-17T18:03Z,Thank you very much!
,peacerock,2012-09-22T13:39Z,Great torrent. Does anyone have AES 2.24 and serials.
,ravnen01,2012-09-22T13:44Z,Why is there no crack or serial?  
