User Type,Username,Date,Text
,J.Constantine,2012-11-02T14:24Z,Thanks bro
,austin4ever,2012-11-03T03:16Z,"the install instructions are in Russian, otherwise everything works ok "
,chreeze24,2012-11-04T23:43Z,"any way to remove connectionsettings reg?
it made some of my softwares to stop working.."
,ulrick01,2012-11-07T10:38Z,can anyone give a guide on installing this?:)
,gevaarlik,2012-11-13T13:03Z,It doesn't configure
,NTY,2012-11-13T23:11Z,The autoloader file is a Trojan.
,NTY,2012-11-14T00:43Z,Actually all the .exe files in the loader folder are Trojans. http://info.prevx.com/aboutprogramtext.asp?PX5=CEEF416117B3EA262E5A07E17009A900C24E1173 https://www.virustotal.com/file/f43bb7e52cdc05afeb8821682970cc8d1e8b4e51168894437ad4841bb1beeeec/analysis/
