User Type,Username,Date,Text
[V],polisdavid,2012-02-19T08:08Z,Thank You Seeders!!  “—]
,barubin88,2012-06-29T20:56Z,They just came up with an update don't download it. 
,lsbro1,2012-07-19T14:22Z,Fantastic! Thanks heaps :) 
,Immodium_432,2012-08-26T20:43Z,barubin88 Are you stupid enough to not use little snitch when using pirated software it's you problem. Tack så mycket Polisdavid! Detta programmet lyfter hela spotify!
,Paper_Tiger11,2012-09-19T06:25Z,This is actually Audio Hijack Pro 2.9...... title may be a bit misleading.
