User Type,Username,Date,Text
,Ragdoll303,2012-08-07T18:35Z,what about episode 3? any idea where I could find it please?
,mrstarbottom,2012-08-07T21:53Z,does anybody have episode 3?
,rude181971,2012-08-08T05:41Z,"Hi, if anybody has episode 3 it would be gratefully appreciated if they could upload it.

Thank you. "
,nshoren,2012-08-08T20:53Z,"Will you be uploading Episode 3 soon?
Please please please! So many of us would really appreciate it so much"
,xela_05,2012-08-09T20:25Z,try searching filestube for episode 3 - rapidshare is usually quite reliable but it is very slow
,kaceyp87,2012-08-09T23:43Z,Thanks xela_05! Found it easily - just searched bachelor pad s03e03 and the first link worked perfectly :)
,jmmarsh5,2012-08-10T04:36Z,Curious why no one has episode 3.
,jane_ved,2012-08-10T11:29Z,please SOMEONE upload episode 3 - going craaaaazy!
