User Type,Username,Date,Text
,pinkcat2,2012-05-27T08:55Z,"its original... good video...
thanks for uploadin...:-)"
,lorr8833,2012-05-27T09:44Z,i sure hope so all the others suck
,lorr8833,2012-05-27T09:46Z,its the same crappy torrent
,shih9019,2012-05-27T13:17Z,"definitely the same torrent ... slightly worse picture,,, scenes missing and end missing either way the uploader puts time and effort in so thankyou and I still watched it"
,silverstoned78,2012-05-27T13:56Z,"Why repost the same shit? i really dont get it. 

the uploader should not be thanked in this case.. for time and effort someone wrote... yes he spend his time and effort waisting our time and bandwith... jerk"
,Neraforesta,2012-05-27T17:51Z,"Bad quality. Same as the others already out.  Scrolling Chinese subs, and ads...on a bootleg. Ads, really? Now there's an angle that can be pursued for prosecution if one really wanted to. All n all though, its not really the uploaders fault.  Its not like they are EVER the ones in the theaters. They are simply the ones willing to post and sometimes pay the bootleggers for their contribution. So, keep in mind. You CAN get paid for camming movies. So go get motivated and not only make a buck for yourself, but in turn, give the rest of us the quality we deserve."
,FLAX_ceed,2012-05-27T22:29Z,"GOOD GOD MAN. LMAO...
Um yeah, not so good in the quality Dept. 
A-1.5
V- 0.5 

LOL "
,-Norcal-,2012-05-28T08:21Z,"We're sorry, the torrent you've downloaded is the same crappy version as all the others. Download the next MIB 3 torrent and try again. Thanks for playing! "
,benspocket,2012-05-28T19:30Z,"guess this is a good place to get a answer
  why when someone goes to the movies records the movie , doesn`t get the ending and the quality is awfull, maybe the web cam is a bad one if so then why bother doing anything at all, then others upload from theres which aint any better  maybe worse, so someone explain this to me please,and one other question there are good uploaders here why do they upload crap when i have seen good web cams from them"
,benspocket,2012-05-28T19:30Z,"guess this is a good place to get a answer
  why when someone goes to the movies records the movie , doesn`t get the ending and the quality is awfull, maybe the web cam is a bad one if so then why bother doing anything at all, then others upload from theres which aint any better  maybe worse, so someone explain this to me please,and one other question there are good uploaders here why do they upload crap when i have seen good web cams from them "
,kelv1969,2012-05-31T11:07Z,There are a lot of whining people on here. Personally I watched the film at the cinema. It was really great. The best movie I've seen in years. I don't know what you all expect. If you can do better then please do. Personally I think it's watchable but it's always going to be better to wait for the dvd rip. If you can't wait then stop whining.
