Filename,Size,Unit
CD/01. Sirius.mp3,4.42,M
CD/02. Eye In The Sky.mp3,10.57,M
CD/03. Children Of The Moon.mp3,11.14,M
CD/04. Gemini.mp3,4.99,M
CD/05. Silence And I.mp3,16.87,M
CD/06. You're Gonna Get Your Fingers Burned.mp3,10.01,M
CD/07. Psychobabble.mp3,11.19,M
CD/08. Mammagamma (Instrumental).mp3,8.23,M
CD/09. Step By Step.mp3,8.96,M
CD/10. Old And Wise.mp3,11.67,M
CD/11. Sirius (Demo).mp3,4.46,M
CD/12. Old And Wise (Eric Woolfson Guide Vocal).mp3,10.5,M
CD/13. Any Other Day (Studio Demo).mp3,3.93,M
CD/14. Silence & I (Early Version; Eric Woolfson Guide Vocal).mp3,17.34,M
CD/15. The Naked Eye.mp3,24.79,M
CD/16. Eye Pieces (Classical Naked Eye).mp3,18.01,M
"CD/Alan Parsons Project, The - Eye In The Sky.m3u",1.48,K
"CD/Alan Parsons Project, The - Eye In The Sky.mp3.cue",2.57,K
