User Type,Username,Date,Text
,indiaman,2012-08-17T08:34Z,Thanks as always.
[V],bigbluesea,2012-08-19T14:06Z,"@dynstab2 

You fucking piece of worthless dog shit

Stop spamming my torrents,nobody cares about your fucking bullshit.

You act like you own the fucking copy rights to ebooks

You fucking Idiot!!!!!! "
,maxjasper,2012-08-20T07:07Z,Thanks a lot bro
[V],dynstab2,2012-08-21T14:28Z,"Hear! Hear! The true nature of rogue duplicator bigbluesea {BBS} and the art of staying in context. Inarguably, torrentiquette doesn't apply to him/her. Sad, really sad..."
