Filename,Size,Unit
Tinker Bell Secret of the Wings 2012 3D-HSBS 1080p DTS HQ3D subs/Tinker Bell Secret of the Wings 2012 3D-HSBS 1080p DTS HQ3D subs.mkv,6.69,G
Tinker Bell Secret of the Wings 2012 3D-HSBS 1080p DTS HQ3D subs.nfo,1.44,K
Torrent downloaded from AanMeHoelaJa Torrents on BTScene.eu.txt,71,B
Torrent downloaded from AhaShare.com.txt,58,B
Torrent Downloaded From BTScene.eu.txt,45,B
Torrent downloaded from Demonoid.me.txt,46,B
Torrent Downloaded From ExtraTorrent.com.txt,353,B
Torrent downloaded from KAT.ph.txt,41,B
Torrent Downloaded from limetorrent.txt,50,B
Torrent downloaded from Rarbg.com.txt,33,B
Torrent downloaded from silvertorrent.org.txt,86,B
Torrent downloaded from thepiratebay.se.txt,50,B
tracked_by_h33t_com.txt,23,B
