User Type,Username,Date,Text
,CodeX96,2012-05-01T03:24Z,"I hope its good enough bitrate due to the filesizes, most often 720p X264 half an hour TV episodes are around 700mb to 800mb usually around 750mb but whatever ill take what i can get thank you anonymous uploader :)"
,willis00,2012-05-24T23:53Z,"10/10

However did not work on my PVR, any help?

The other torrent of season 3,4,5 by 'Konashine' works on my PVR"
,sircris2,2012-05-25T05:02Z,Amazing! Fabulous quality for season 1 and 2. Thanks!
