User Type,Username,Date,Text
,gooch418,2012-09-17T00:17Z,i am having trouble with this burning this. i normally use dvd shrink. please help.
[V],Big_dude,2012-09-18T00:15Z,"download imgburn (google it) burn ISO to
standard dvd5 and watch in your dvd player.

Or mount the iso with the included dameon tools
lite and watch in windows media player."
,gooch418,2012-09-19T00:05Z,okay. do you know why it does not burn with dvd shrink?
[V],Big_dude,2012-09-20T03:46Z,not sure about burning with dvd shrink I never have used it.
