User Type,Username,Date,Text
,tch321,2012-07-28T08:44Z,"Don't waste time and bandwidth, downloading torrents from Janesteve.
He will never finish his torrents, even if you see a few seeders.
Try to check his uploads - they all show a few seeders and more than 100
leechers, which is not normal.
He just want you to check his screenshot, so he can get some $ "
,janesteve,2012-07-28T12:35Z,"tch321 why u troll me, why not charge you for the download is complete and erasing"
,tch321,2012-07-28T13:32Z,"I have checked your torrent from july 1'st and until today, and you have 68  ( sixty-eight ) torrents which you haven't finished."
,snpdj,2012-07-28T17:07Z,tch321 says it how it is. Your never seed your torrents and all your link are to revenue clickers. Hopefully you'll get booted soon!
,old-dominion,2012-07-29T04:15Z,"Yup. Links to adverts/revenue sites. Dunno who Yoshiko is, and it's not worth finding out."
