Filename,Size,Unit
QI - 917 - The Immortal Bard.avi,242.47,M
QI S09E01 XL I-Spy 720p.mkv,898.1,M
QI S09E02 XL International 720p.mkv,667.99,M
QI S09E03 XL Imbroglio of issues 720p.mkv,1.06,G
QI S09E04 XL Indecision 720p.mkv,1.1,G
QI S09E05 XL Invertebrates 720p.mkv,1.06,G
QI S09E06 XL Inventive 720p.mkv,1.12,G
QI S09E07 XL Incomprehensible questions 720p.mkv,1.07,G
QI S09E08 XL Inequality and injustice 720p.mkv,1.08,G
QI S09E09 XL Illness 720p.mkv,1.06,G
QI S09E10 XL Inland revenue 720p.mkv,1.14,G
QI S09E11 XL Infantile 720p.mkv,1.14,G
QI S09E12 Illumination 720p.mkv,807.23,M
QI S09E13 XL Intelligence 720p.mkv,1.1,G
QI S09E14 VG Series I Compilation Show Part 1 720p.mkv,558.41,M
QI S09E15 VG Series I Compilation Show Part 2 720p.mkv,765.49,M
QI S09E16 XL Ice (X-mas special)720p.mkv,1.1,G
QI S09E18 720p.mkv,551.11,M
