Filename,Size,Unit
FOTO/Abella Anderson/Abella Anderson Hot Latina.jpg,95.35,K
FOTO/Abella Anderson/Abella Anderson Hot Threesome.jpg,117.43,K
FOTO/Abella Anderson/Abella Anderson Interracial Black Cock Slut.jpg,106.76,K
FOTO/Abella Anderson/Abella Anderson Miami Fuck.jpg,205.56,K
FOTO/Abella Anderson/Abella Anderson.jpg,34.12,K
FOTO/Adrianna Luna/Adrianna Luna Interracial Loves Black Cocks.jpg,131.87,K
FOTO/Adrianna Luna/Adrianna Luna Tag Team.jpg,125.09,K
FOTO/Adrianna Luna/Adrianna Luna.jpg,26.89,K
FOTO/Alanah Rae/Alanah Rae Destroyed By Mandingo.jpg,123.73,K
FOTO/Alanah Rae/Alanah Rae Interracial Black Cock In Her Ass.jpg,125.03,K
FOTO/Alanah Rae/Alanah Rae Interracial With Mandingo.jpg,116.37,K
FOTO/Alanah Rae/Alanah Rae.jpg,30.79,K
FOTO/Alaura Eden/Alaura Eden Anal.jpg,107.83,K
FOTO/Alaura Eden/Alaura Eden DP.jpg,101.01,K
FOTO/Alaura Eden/Alaura Eden.jpg,66.54,K
FOTO/Amber Michaels/Amber Michaels Anal.jpg,141.97,K
FOTO/Amber Michaels/Amber Michaels.jpg,36.59,K
FOTO/Ami Jordan/Ami Jordan Cum On My Tits.jpg,154.87,K
FOTO/Ami Jordan/Ami Jordan.jpg,58.85,K
FOTO/Amia Miley/Amia Miley & Sophia Sutra.jpg,145.03,K
FOTO/Amia Miley/Amia Miley Blowjob Princess.jpg,131.21,K
FOTO/Amia Miley/Amia Miley Cock Happy.jpg,139.78,K
FOTO/Amia Miley/Amia Miley Facial.jpg,132.37,K
FOTO/Amia Miley/Amia Miley Fucks Her Handyman.jpg,135.85,K
FOTO/Amia Miley/Amia Miley South Beach Pussy.jpg,99.93,K
FOTO/Amia Miley/Amia Miley Teen Cheerleader.jpg,115.33,K
FOTO/Amia Miley/Amia Miley.jpg,27.87,K
SAMPLE/Abella Anderson/Abella Anderson Hot Latina.avi,27.41,M
SAMPLE/Abella Anderson/Abella Anderson Hot Threesome.avi,27.44,M
SAMPLE/Abella Anderson/Abella Anderson Interracial Black Cock Slut.avi,23.04,M
SAMPLE/Abella Anderson/Abella Anderson Miami Fuck.avi,23.35,M
SAMPLE/Adrianna Luna/Adrianna Luna Interracial Loves Black Cocks.avi,16.85,M
SAMPLE/Adrianna Luna/Adrianna Luna Tag Team.avi,27.67,M
SAMPLE/Alanah Rae/Alanah Rae Destroyed By Mandingo.avi,17.83,M
SAMPLE/Alanah Rae/Alanah Rae Interracial Black Cock In Her Ass.avi,25.23,M
SAMPLE/Alanah Rae/Alanah Rae Interracial With Mandingo.avi,19.56,M
SAMPLE/Alaura Eden/Alaura Eden Anal.avi,14.57,M
SAMPLE/Alaura Eden/Alaura Eden DP.avi,24.34,M
SAMPLE/Amber Michaels/Amber Michaels Anal.avi,26.53,M
SAMPLE/Ami Jordan/Ami Jordan Cum On My Tits.avi,26.49,M
SAMPLE/Amia Miley/Amia Miley & Sophia Sutra.avi,26.69,M
SAMPLE/Amia Miley/Amia Miley Blowjob Princess.avi,16.82,M
SAMPLE/Amia Miley/Amia Miley Cock Happy.avi,27.55,M
SAMPLE/Amia Miley/Amia Miley Facial.avi,22.45,M
SAMPLE/Amia Miley/Amia Miley Fucks Her Handyman.avi,25.87,M
SAMPLE/Amia Miley/Amia Miley South Beach Pussy.avi,33.66,M
SAMPLE/Amia Miley/Amia Miley Teen Cheerleader.avi,23.65,M
SCREENSHOTS/Abella Anderson/Abella Anderson Hot Latina.jpg,37.46,K
SCREENSHOTS/Abella Anderson/Abella Anderson Hot Threesome.jpg,37.71,K
SCREENSHOTS/Abella Anderson/Abella Anderson Interracial Black Cock Slut.jpg,36.09,K
SCREENSHOTS/Abella Anderson/Abella Anderson Miami Fuck.jpg,33.48,K
SCREENSHOTS/Adrianna Luna/Adrianna Luna Interracial Loves Black Cocks.jpg,37.04,K
SCREENSHOTS/Adrianna Luna/Adrianna Luna Tag Team.jpg,36.97,K
SCREENSHOTS/Alanah Rae/Alanah Rae Destroyed By Mandingo.jpg,34.41,K
SCREENSHOTS/Alanah Rae/Alanah Rae Interracial Black Cock In Her Ass.jpg,39.6,K
SCREENSHOTS/Alanah Rae/Alanah Rae Interracial With Mandingo.jpg,37.3,K
SCREENSHOTS/Alaura Eden/Alaura Eden Anal.jpg,37.15,K
SCREENSHOTS/Alaura Eden/Alaura Eden DP.jpg,33.65,K
SCREENSHOTS/Amber Michaels/Amber Michaels Anal.jpg,35.84,K
SCREENSHOTS/Ami Jordan/Ami Jordan Cum On My Tits.jpg,39.53,K
SCREENSHOTS/Amia Miley/Amia Miley & Sophia Sutra.jpg,40.5,K
SCREENSHOTS/Amia Miley/Amia Miley Blowjob Princess.jpg,39.88,K
SCREENSHOTS/Amia Miley/Amia Miley Cock Happy.jpg,37.48,K
SCREENSHOTS/Amia Miley/Amia Miley Facial.jpg,35.31,K
SCREENSHOTS/Amia Miley/Amia Miley Fucks Her Handyman.jpg,41.5,K
SCREENSHOTS/Amia Miley/Amia Miley South Beach Pussy.jpg,39.05,K
SCREENSHOTS/Amia Miley/Amia Miley Teen Cheerleader.jpg,38.37,K
