User Type,Username,Date,Text
[V],HobbitWarez,2012-12-16T00:20Z,"AnDrOiD Applications 12-15-12

ADW APEX GO - ICS Plates Theme v2.9.9-AnDrOiD
Battery HD Pro v1.22-AnDrOiD
Beautiful Clock Widget Pro v1.53-AnDrOiD
BSPlayer v1.7.146 (All Devices)-AnDrOiD
CalenGoo v1.0.89-AnDrOiD
Camera FV-5 v1.37-AnDrOiD
Christmas HD LWP v1.4.2-AnDrOiD
Clock JB Plus v1.0.2-AnDrOiD
Color Splash Effect Pro v1.3.5-AnDrOiD
FlightTrack Pro v4.5-AnDrOiD
GBA.emu v1.5.3-AnDrOiD
GBC.emu v1.5.3-AnDrOiD
ICED PHONE OS6 THEME. v3.1-AnDrOiD
Jelly Bean HD Theme 5 in 1 v2.2-AnDrOiD
Lustre (adw go apex theme) v1.2.8-AnDrOiD
Mantano Ebook Reader Premium v2.3.8-AnDrOiD
MSX.emu v1.5.3-AnDrOiD
Multiscreen Multitasking THD v4.1-AnDrOiD
NAVIGON Europe v4.7 Patched-AnDrOiD
NAVIGON Europe v4.7 with Modded Google Play Or Lucky patcher ROOTED DEVICES ONLY-AnDrOiD
NEO.emu v1.5.3-AnDrOiD
NES.emu v1.5.3-AnDrOiD
Paris winter v1.0.5 LWP-AnDrOiD
PCE.emu v1.5.3-AnDrOiD
Playful Piano v1-AnDrOiD
Scanner Radio Pro v3.9-AnDrOiD
SD Maid Pro-System cleaning tool v2.0.2.3-AnDrOiD
SketchBook Mobile v2.1-AnDrOiD
Speed Boost Pro v4.1.2-AnDrOiD
Star Chart v2.42-AnDrOiD
TSF Shell Perfect Theme HD v1.8.3-AnDrOiD
TSF Shell Sky Theme HD v1.4-AnDrOiD
TSF Shell Suave Theme HD v2.2-AnDrOiD
Tweetings for Twitter v2.10.3.1-AnDrOiD
WhatsAppPLUSv2.70HoLo-AnDrOiD
Zooper Widget Pro v1.76-AnDrOiD"
,isse_manpower,2012-12-17T00:40Z,"Thanks, works fine. Keep up the good work "
