User Type,Username,Date,Text
,epicpow,2012-12-24T21:26Z,YES!! Thank you!! :)
[V],Nepotu,2012-12-24T21:48Z,"You're welcome, my friend! And sorry for the delay!"
,XYippie,2012-12-24T23:23Z,"Nepotu, you've done this community a great favor by keeping up this work - and it's damn good work too; don't let anyone tell you otherwise. Have a happy holiday. Cheers, bro! Yippie!"
,biondream,2012-12-25T03:45Z,"In my country it's 25th now, so thank you for this christmas gift and MERRY CHRISTMAS to you Nepotu !!  ^o^"
[V],Nepotu,2012-12-25T13:56Z,"Thank you my dear friends from all over the world! Your words means a lot to me. I wish you all a Happy hollyday and Merry Christmas, whoever and wherever you are!"
[V],rambam1776,2012-12-25T21:00Z,Thanks a lot.
