User Type,Username,Date,Text
,nalle70,2012-10-28T12:17Z,TY4UL   Bra jobbat.. textningen är klockren  :o)
,vampireslayes,2012-10-31T08:34Z,"Hej du gör ett fantastiskt bra jobb med torrenten och texten, men skulle du möjligen kunna fixa i 480 istället för 720? Min dator laggar när det är så hög upplösning och helt ärligt jag märker ingen skillnad på dem två i kvalité. :)"
,high90,2012-10-31T08:55Z,Tack för UL.. Uppskattas!
,fumblecheese,2012-11-01T00:37Z,"Hej, vill tacka för att du lägger upp 720p och i swesub, du förgyller min big bang theory upplevelse! och vampireslayes du kan öppna srt filen med vilken version av avsnitet som helst, så du kan ladda ner en 480p och bara srtn från den här torrenten! :)"
,kangoroo,2012-11-01T23:25Z,"Tack alla för feedbacken. Uppskattas!
vampireslayes: precis som fumblecheese skriver - srt-filen funkar med 480p också (kan dock vara problem med synken). Se bara till att byta namn på srt-filen, så att den har samma namn som 480p-filen.
Jag ska försöka se till att srt-filen funkar med lägre upplösningar framöver också - om det inte är för mycket jobb. Översättningen i sig tar inte så lång tid, men synkningen...jeeezuz - en halv dag i värsta fall :)"
,grobianen,2012-11-05T20:33Z,"Men kangoroo, har du testat att ta ner en engelsk undertext från t.ex. addic7ted och översatt den direkt? För då får du ju den redan färdigsynkad!"
,valentino1966,2012-11-06T23:11Z,Perfekt fortsæt gerna tack for denne serie
