Filename,Size,Unit
When I Look Down That Road/02 Angels Dancing.m4a,35.37,M
When I Look Down That Road/04 When Paris Was A Woman (According To Alice - 1928).m4a,34.43,M
Melissa Manchester/07 Whenever I Call You Friend.m4a,33.72,M
Hey Ricky/01 You Should Hear How She Talks About You.m4a,32.21,M
Don't Cry Out Loud/07 To Make You Smile Again.m4a,31.96,M
Melissa/06 Love Havin' You Around.m4a,31.69,M
When I Look Down That Road/01 I'll Know You By Your Heart.m4a,31.32,M
Hey Ricky/03 Hey Ricky (You're A Low Down Heel).m4a,31.11,M
If My Heart Had Wings/04 Heart Of Love.m4a,31.07,M
If My Heart Had Wings/09 Moments Like This.m4a,30.42,M
For The Working Girl/03 Working Girl (For The).m4a,30.24,M
If My Heart Had Wings/06 Here To Love You.m4a,30.21,M
Better Days & Happy Endings/09 Good News.m4a,30.19,M
The Essence Of Melissa Manchester/16 You Should Hear How She Talks About You.m4a,29.51,M
If My Heart Had Wings/01 The House That Love Built.m4a,29.1,M
Melissa Manchester/06 How Does It Feel Right Now.m4a,29.06,M
"Better Days & Happy Endings/10 Sing, Sing, Sing.m4a",28.8,M
Melissa/05 This Lady's Not Home.m4a,28.68,M
Melissa Manchester/04 When We Loved.m4a,28.31,M
Hey Ricky/06 Wish We Were Heroes.m4a,28.27,M
Melissa/01 We've Got Time.m4a,28.15,M
The Essence Of Melissa Manchester/14 Whenever I Call You Friend.m4a,28.07,M
Melissa Manchester/01 Pretty Girls.m4a,28.02,M
Melissa/10 I Don't Want To Hear It Anymore.m4a,28,M
Better Days & Happy Endings/08 Stand Up Woman.m4a,27.96,M
The Essence Of Melissa Manchester/02 Easy.m4a,27.32,M
Hey Ricky/07 Come In From The Rain.m4a,27.18,M
Hey Ricky/05 Race To The End.m4a,27.17,M
Joy/08 Christmas Angel.m4a,27.06,M
For The Working Girl/09 Lovers After All.m4a,26.92,M
Don't Cry Out Loud/09 Knowin' My Love's Alive.m4a,26.76,M
The Essence Of Melissa Manchester/09 Good News.m4a,26.76,M
Melissa Manchester/03 Don't Want A Heartache.m4a,26.51,M
When I Look Down That Road/06 Lucky Break.m4a,26.5,M
Melissa Manchester/02 Fire In The Morning.m4a,26.32,M
If My Heart Had Wings/07 Higher Ground.m4a,26.21,M
Hey Ricky/09 Your Place Or Mine.m4a,26.03,M
If My Heart Had Wings/10 Don't Let Me Walk This Road Alone.m4a,25.98,M
For The Working Girl/07 Talk.m4a,25.92,M
Better Days & Happy Endings/03 Better Days.m4a,25.75,M
Melissa Manchester/05 It's All In The Sky Above.m4a,25.7,M
Tribute/06 Stardust.m4a,25.65,M
When I Look Down That Road/11 Crazy Loving You.m4a,25.58,M
If My Heart Had Wings/03 If My Heart Had Wings.m4a,25.57,M
If My Heart Had Wings/02 In A Perfect World.m4a,25.28,M
Melissa/07 Midnite Blue.m4a,25.16,M
For The Working Girl/06 You And Me.m4a,25.16,M
Don't Cry Out Loud/03 Don't Cry Out Loud.m4a,24.99,M
For The Working Girl/08 A Fool's Affair.m4a,24.84,M
When I Look Down That Road/08 Where The Truth Lies.m4a,24.83,M
The Essence Of Melissa Manchester/03 Bright Eyes.m4a,24.82,M
Better Days & Happy Endings/01 Happy Endings.m4a,24.74,M
Tribute/05 Walk On By.m4a,24.59,M
Melissa/04 Stevie's Wonder.m4a,24.48,M
When I Look Down That Road/05 After All This Time.m4a,24.47,M
Don't Cry Out Loud/02 Caravan.m4a,24.46,M
For The Working Girl/10 Tears Of Joy.m4a,24.45,M
Joy/02 I've Got My Love to Keep Me Warm.m4a,24.42,M
If My Heart Had Wings/05 To Be In Love With Me.m4a,24.35,M
Melissa/08 It's Gonna Be Alright.m4a,24.28,M
When I Look Down That Road/09 Tyfyfim (Thank You For Your Faith In Me).m4a,24.18,M
For The Working Girl/01 If This Is Love.m4a,24.15,M
Tribute/01 Over The Rainbow.m4a,24,M
Tribute/02 The Gypsy In My Soul.m4a,23.98,M
Tribute/03 La Vie En Rose.m4a,23.97,M
Joy/05 I'll Be Home for Christmas.m4a,23.89,M
The Essence Of Melissa Manchester/12 Lovers After All.m4a,23.83,M
Better Days & Happy Endings/07 Just You And I.m4a,23.72,M
For The Working Girl/04 Without You.m4a,23.66,M
For The Working Girl/11 Happier Than I've Ever Been.m4a,23.64,M
Melissa Manchester/08 Holdin' On To The Lovin_.m4a,23.54,M
Hey Ricky/04 I'll Always Love You.m4a,23.54,M
Don't Cry Out Loud/05 Bad Weather.m4a,23.53,M
Tribute/09 Sophisticated Lady.m4a,23.09,M
Tribute/07 The Kind Of Man A Woman Needs.m4a,22.96,M
Melissa/03 Just Too Many People.m4a,22.89,M
Hey Ricky/08 Looking For The Perfect Ahh.m4a,22.74,M
Melissa/02 Party Music.m4a,22.57,M
Joy/09 The Christmas Song (Chestnuts Roasting on an Open Fire).m4a,22.49,M
Hey Ricky/02 Slowly.m4a,22.42,M
The Essence Of Melissa Manchester/18 Just You And I.m4a,22.25,M
For The Working Girl/05 Boys In The Backroom.m4a,22.24,M
The Essence Of Melissa Manchester/10 Through The Eyes Of Love (Theme From The Motion Picture _Ice Castles_).m4a,22.04,M
Joy/10 Christmas Time is Here.m4a,21.85,M
Better Days & Happy Endings/06 Rescue Me.m4a,21.83,M
When I Look Down That Road/03 Bend.m4a,21.83,M
Don't Cry Out Loud/01 Shine Like You Should.m4a,21.72,M
Joy/07 White Christmas.m4a,21.66,M
The Essence Of Melissa Manchester/13 Fire In The Morning.m4a,21.64,M
Better Days & Happy Endings/02 You Can Make It All Come True.m4a,21.54,M
Better Days & Happy Endings/04 My Sweet Thing.m4a,21.35,M
The Essence Of Melissa Manchester/11 Just Too Many People.m4a,21.25,M
For The Working Girl/02 Any Kind Of Fool.m4a,21.21,M
Joy/06 There's Still My Joy.m4a,21.11,M
The Essence Of Melissa Manchester/15 Don't Cry Out Loud.m4a,21.03,M
Hey Ricky/10 Someone To Watch Over Me.m4a,20.92,M
Melissa Manchester/10 Lights Of Dawn.m4a,20.92,M
Melissa Manchester/09 I Know Your Love Won't Let Me Down.m4a,20.81,M
Don't Cry Out Loud/06 Through the Eyes Of Grace.m4a,20.74,M
Better Days & Happy Endings/05 Come In From The Rain.m4a,20.74,M
Joy/03 Please Come Home for Christmas.m4a,20.7,M
Don't Cry Out Loud/10 Singin' From My Soul.m4a,20.63,M
The Essence Of Melissa Manchester/19 Come In From The Rain.m4a,20.45,M
Tribute/04 Tenderly.m4a,19.8,M
Joy/04 When You Wish Upon a Star.m4a,19.68,M
The Essence Of Melissa Manchester/17 Caravan.m4a,19.33,M
The Essence Of Melissa Manchester/04 Midnight Blue.m4a,19,M
When I Look Down That Road/12 A Mother's Prayer.m4a,18.96,M
Joy/01 Have Yourself a Merry Little Christmas.m4a,18.84,M
Don't Cry Out Loud/04 Almost Everything.m4a,18.37,M
When I Look Down That Road/07 When I Look Down That Road.m4a,18.33,M
Tribute/10 To Make You Smile Again.m4a,18.19,M
When I Look Down That Road/10 Still Myself.m4a,18.03,M
Melissa/09 I Got Eyes.m4a,17.97,M
The Essence Of Melissa Manchester/08 O Heaven (How You've Changed Me).m4a,17.96,M
The Essence Of Melissa Manchester/05 Through The Eyes Of Grace.m4a,16.91,M
The Essence Of Melissa Manchester/01 If It Feels Good (Let It Ride).m4a,16.16,M
Don't Cry Out Loud/08 Such A Morning.m4a,15.66,M
The Essence Of Melissa Manchester/07 Alone.m4a,15.02,M
Joy/11 A Cradle in Bethlehem.m4a,14.97,M
If My Heart Had Wings/08 Crazy People.m4a,14.96,M
Tribute/08 Lady Be Good.m4a,13.75,M
The Essence Of Melissa Manchester/06 Home To Myself.m4a,12.5,M
