User Type,Username,Date,Text
,Toolazytomakearealusernam,2012-07-19T21:00Z,"Is it sexually censored
because i love the show for the story and i don't want my dad to delete it if i download it"
,hydrocloridum,2012-07-31T17:22Z,"thanks lucybabe, my friend have begged me for over a year to watch game of thrones but i didnt think id liked it so i took me untill now to download and watch the show.... and its fuckin awesome!!!

great quality rips to.

thanks again."
,hydrocloridum,2012-07-31T17:25Z,"@Toolazytomakearealusernam: no, its not censored.. thank god for that :)"
,Durocks,2012-08-03T00:19Z,Thanks a Lot! Downloading...!
,Blackore,2012-09-04T09:41Z,tooo slow... :( 
,brettroscoe,2012-09-13T05:16Z,Got a notification from Charter for copyright infringement involving this torrent. Use an ip blocking service before downloading.
