User Type,Username,Date,Text
,whtvr2,2012-06-10T11:32Z,"Credits to ""E1ement71"""
,_SnakEye,2012-06-10T19:50Z,Thanks for the Update Charts...
,TravisA320,2012-06-11T20:18Z,Merci!
,iramacky,2012-06-12T02:06Z,"@Whtvr2 and @E1ement71, nice1 for upping these up to date charts there gonna help us out alot. Im very greatfull anyway and if you's can keep them coming. Again thanks alot guys, All the best."
,RAITGD,2012-08-26T12:30Z,"Is gonna be some update in near future.. Some star  of Copenhagen already changed.. 

Anyway, tnx for this good upload.. :)"
