User Type,Username,Date,Text
,Daddy3636,2012-03-26T07:17Z,"Also, as always, if you like what you download, go out and buy it!  (I did.)

And remember to seed, please, as I can only upload at ~100 KB/s..."
,coffeefree,2012-05-03T13:53Z,how can Idownload
,Daddy3636,2012-09-03T20:06Z,"@coffeefree
You can download this torrent by clicking the links on this page.  Either open the magnet link, or download the actual torrent file if the option is available.  You will need a modern torrent client installed; I recommend uTorrent (www.utorrent.com).

Once you've downloaded the ISO file, you will need another program, such as DAEMON Tools Pro or WinRAR to open it.  VLC may also be able to directly open and play the ISO, not sure."
