User Type,Username,Date,Text
,Bjellesau,2012-03-09T17:12Z,"Thanks for this, but cracks for Proteus have always been caught by antivirus software. So when you seed this with unpacked cracks I can not get it. It is deleted before download finished. PLEASE USE RAR or ZIP or whatever and pack cracks - so we can get them. PLESE RESEED WITH ZIP'ED CRACKS!!"
,rmmpb,2012-03-10T16:04Z,"The activation aplications doesn`t work for me it says ""for russian users"""
,rjcripe,2012-03-27T01:49Z,"@Bjellesau   ... There is a very easy way to fix that.   Have you even *bothered* to temporarily turn off your antivirus software?  It will take you a lot less time to do that than it will for umttplc to completely redo his upload.

There's no reason to go ask people (who are already doing a favor for all of us) to reupload over something so petty (and insignificant)."
,maqsmihil,2012-03-28T21:23Z,doesn't  work man!!1
,johnmth,2012-07-09T17:22Z,"Excellent, it's working perfectly

thank you!!!"
,msminhas,2012-07-11T18:39Z,how to use the key please give steps
,SFEA,2012-08-31T21:06Z,It reports Bad Product Key for me (Though the license key has been installed)
,jairoesp,2012-09-01T01:14Z,"To keep working the crack you have to open lkproteus as adminstrator, righ click on the file and Run as adminstrator and then you have to choose in the browser the place where you installed Proteus, that is all.  It work."
