User Type,Username,Date,Text
,bb236,2012-12-10T13:06Z,"14 seeders and 2651 leechers?!
WHAT THE HELL IS THAT?! I'm 93.5% finished downloading at 0.1kb/s people... don't download and close please. Be courteous. "
,firexninja,2012-12-10T21:52Z,thank you!
,okcman,2012-12-13T00:11Z,"Great upload!  Can you do ""The Perks of Being a Wallflower"" next?  

The yify team be holding it down yo!"
,dream1trix,2012-12-13T13:02Z,why so poor image quality ??? too much small squares..!
,HaXide,2013-01-06T11:42Z,GREAT UPL AS ALWAYS!! +1-ed! XD
