User Type,Username,Date,Text
,Pedroadx,2012-07-02T09:05Z,"Thank you so much! I have been trying to  play it for hours xD

ps: You have to set up a name on the login window and then press Play Offline."
,OceanShark,2012-07-02T09:07Z,"No problem ^_^, I just leave it empty and click Play Offline, But anything works =D"
,sangnabi,2012-07-02T15:52Z,"@OceanShark, is the save/load feature worked?"
,OceanShark,2012-07-02T23:29Z,@sangnabi Sorry but it looks like it doesn't. I'll try to find a fix for that.
,sangnabi,2012-07-03T07:30Z,"@OceanShark, thank you but dont bother, new version released (R), please spend your resource to contribute on the last version.
http://thepiratebay.se/torrent/7400187/Project_Zomboid_0.2.0R_RC2_Crack

I tested it and the save/load feature worked flawlessly."
,Deko260,2012-07-07T23:04Z,Im having Sound Issues here >.
,ITzWhiteboy,2012-07-08T02:42Z,"sangnabi: I tried that current torrent u listed but cant get past the username/password, I installed correctly and read notes, etc and also used pass:FuckAssKey and User:FREEDOM but still cant get through pls help.    -thx"
