User Type,Username,Date,Text
,Gman496,2012-07-27T10:56Z,"Much appreciated, thanks ;)"
,Ninj333,2012-07-27T15:30Z,"Love the .avi files, Keep them coming ETTV. Now I specifically search for ETTV files!!!"
,anygirl,2012-07-27T16:47Z,Thank you for your uploads! You help make the internet an awesome experience :)
,lasiodora,2012-07-27T19:14Z,"1600+ seeds, I'm connected to 30 of them, my download speed is .1-.3kpbs. WTF? Not even 1kbps!"
,RedLips23,2012-07-28T01:59Z,thanks for the avi!!
,Kupsha,2012-07-30T11:18Z,"Seems to me like it does not go through to the end.
Gives him back the recorder, says you owe me walks out and ends?????????
None of the stories are tied up and finished???"
,Kupsha,2012-07-30T23:58Z,My apology. Downloaded another version and it finished at the same place and credits started to roll. Sorry. And - Thanks 
