User Type,Username,Date,Text
,dwhit7074,2012-04-24T19:36Z,great quality for a cam. sound is matched with lips. hell i actually just made a accout here just to make sure people know its good. no virus
,dwhit7074,2012-04-24T19:40Z,"and also at the begin the spanish text says, 

""in 2005, scientists discovered a distant planet with a climate almost identical to that of the earth. in 2006, NASA built a transmission apparatus five times more potent than esistentes to date, kicking off a program to contact the planet. project called the beacon.""

enjoy"
,KevinCostner,2012-04-24T21:14Z,Can you hear people laughing in the background on this one?
