User Type,Username,Date,Text
,Crissygail,2012-09-20T18:32Z,I'm a newbie to this but I have already decided I'll only be  downloading ur apps  No one problem out of 100 downloads. I was curious if u have the paid  game  The price is right decades? Sorry to bother u Thanks for all the goodies I downloaded today. :-) 
[T],bobiras2009,2012-09-20T20:43Z,"@Crissygail

I answer you in the forum my friend"
,Crissygail,2012-09-20T21:09Z,Thank you I received it... :-) 
,salo111,2012-09-21T06:14Z,thanks bro :)
,shery007,2012-09-21T08:10Z,"Hello, i new to this, i wanted to ask where on the sd card do u put these games after uve downloaded em!! how to use these games on the andriod fone!! thanku"
[T],bobiras2009,2012-09-21T14:26Z,"@shery007

Just put the in your sdcard everywhere you want and install them through a file manager"
,battlecommander,2012-09-21T22:53Z,you rock :)
,blackboxcard,2012-09-24T10:59Z,Thank you comrade bobiras!!!
,Umar_Ch,2012-10-03T22:46Z,"is these games will install on my Samsung gio s5660. it has 800MHz  processor and Android OS, v2.2 (Froyo)??????? any one plz let me know "
,Umar_Ch,2012-10-03T22:50Z,"will these games  install on my Samsung gio s5660. it has 800MHz  processor and Android OS, v2.2 (Froyo)??????? any one plz let me know "
,Tiswah,2012-10-04T09:35Z,Hallo. Ik ben op zoek naar een RAL en Pantomime detector app. Kun jij mij daar aan helpen? Verder wil ik nog schrijven dat ik een groot fan van je ben! 
,Tiswah,2012-10-04T09:36Z,Pantomime moet zijn Pantome. Sorry... 
