User Type,Username,Date,Text
,themastertorrentseeder,2012-04-15T22:30Z,"Thank you so much for the upload! All working activation worked, Thanks!!! :D"
,pir8s003,2012-04-16T07:20Z,Would you upload crack only????
,Elbichu,2012-04-17T01:41Z,How can active it?....sorry I'm not a Geek
,Hen327,2012-04-21T15:03Z,TankX :)
,jinx0000x,2012-04-23T06:36Z,Thanks... Nice upload...
,cush87,2012-04-23T16:57Z,"Just installed this, but the crack program isnt generating a proper code.  Any help would be appreciated."
,cliner78,2012-04-25T01:59Z,after downloading I cant get the files to install. what am I missing? 
,rgarjr78,2012-04-26T20:37Z,Just installed it and works great.  
,win32x,2012-04-28T21:04Z,"can someone plz tell me the activation code for , request code . 8QPY D9V8 9VN6 JUWP YT97 0FZ0 YP23 0DTZ 

the mem patch doesnt seem to be working and is giving me activation code with 7 letters missing would be much appreciated thanks"
,rgarjr78,2012-04-29T02:43Z,"it works, it don't matter if it's a short it will activate.  "
,win32x,2012-04-29T03:52Z,"my bad , right clicked on xforce and ran as administrator worked perfect ! great torrent thanks "
,kirnj,2012-05-01T08:44Z,"Hello, it seems people are having success with this torrent... I've completed the download but am not sure how to install, can someone please post some instructions? any help would be greatly appreciated thanks!"
,kulghar101,2012-05-04T17:57Z,"I have downloaded this and started the install but it asks for a Serial Number. This is 3 digits followed by like 4 and 5 digits.

Were do I find this? Any helpers? :D"
,abohasham,2012-05-08T14:30Z,THANK YOU
,ucharq,2012-05-09T14:59Z,"This not work for me installation incomplete at 5/18 take'me over.

helpme with this please:

2012/5/5:02:13:52	------ 	-------	Rollback	Microsoft Visual C++ 2010 SP1 Redistributable (x64)	Failed	Installation aborted, Result=1619
2012/5/5:02:13:52	------ 	-------	Rollback	Microsoft Visual C++ 2010 SP1 Redistributable (x86)	Failed	Installation aborted, Result=1619"
,a_r_s_e_n_a_l_1,2012-05-13T03:30Z,wow..... works fine thanks a lot 
,a_r_s_e_n_a_l_1,2012-05-13T03:32Z,just read the text document on the crack folder and follow the instruction.... it will get activate..  right click and run everything as administrator :)
,ckoijun,2012-05-14T13:11Z,says it needs a disc 1 ?
,ckoijun,2012-05-15T03:21Z,"nvm, i got it to install by burning it onto a disc. Thanks."
,PraiseToTheCrackers,2012-05-28T21:54Z,"It says I need to insert Disc 1, anyone know how to resolve this? Im on Win7 Ultimate"
,sanmiglighter,2012-05-30T14:04Z,"To those having problems with ""insert Disk 1"" in installation, it's better you extract the iso file (same way you would extract a zip or rar) and install it that way instead of mounting it with PowerISO or similiar software. -->This will work if you are installing ONLY Autocad 2013 and NOT installing Inventor Fusion 2013 as well. (you will encounter a problem with certain files like: Autodesk.Catalyst.Freeway.UI.Controls.SheetDocSelector.resources.dll - due to limitations in filename length - google it. This file will not be extracted onto the target folder due to this limit, thus causing an error upon installation).  If you're just installing just Autocad 2013 (to save on space from software you won't use anyway), this method will work just fine.

The best is to burn iso to a CD if you want to install BOTH Autocad 2013 AND Inventor Fusion 2013."
,VisciusK,2012-06-01T21:07Z,"If ask you for Insert a disc 1 is easy to fix, copy all installation files in to a new folder in c: after that run the installation from that folder and Voila, no ask for disk 1 installation."
,iron4105,2012-06-08T23:17Z,"I'm confused as hell.  First time using PB.  Downloaded this torrent, and inside all I see are bunch of .rar folders with random videos and files in them.  Can someone shed some light on that?"
,Motsux99,2012-06-09T15:18Z,"iron4105, look for the AUTOCAD_2013 folder. Inside, you will see the Autocad compressed iso file. Extract that into another new folder. Those are the program install files. You can install from those files by clicking on setup. Make sure you read and understand the install text file inside the crack folder before starting.  "
,casaxa,2012-06-30T14:34Z,"This folder has autocad, but has also a lot of other crap."
,jinx00x,2012-07-01T09:05Z,Thanks...
,jinx00x,2012-07-01T09:12Z,"Thanks uploader... 
Works fine for me... 
I recommend to use virtualclonedrive to install.."
,skiesfell,2012-07-07T00:53Z,"Thanks uploader, & thanks to all who give help with comments....works great!"
,adaz5,2012-07-19T01:52Z,I love how the activation code is 666-696969696969
,texascookiemonster,2012-07-19T04:55Z,requesting flame premium please amazing upload by the way feel up the good work friend and dont forget to support your developers and buy product
,texascookiemonster,2012-07-19T04:55Z,keep*
,ferhad_huseynov,2012-07-20T07:32Z,Guys anyone please help to install this software. I downloaded the torrent and faced with 10 part .rar files every rar file has .iso file in it. should I go through all of them one by one? please help
,theDaberynth,2012-07-22T06:04Z,"downloaded. installed. followed all directions going into the xfKeygen. when i click on Patch i get ""Error: Make sure you can write to current directory"" this is my brick wall. anyone have a ladder of advice to boost me over to Activation"
,Forcedtoplaysolitare,2012-07-22T07:42Z,"First off, my anti-virus is freaking out when I go to unzip the crack. Is this usual? Is it a virus?

Can someone help me or give me a link that will show me what to do? It came with a lot of crap, and it has been awhile since I have done this so I am confused."
,JGX421,2012-07-26T02:48Z,"I'm having issues extracting the files. It says please install DirectX to continue, but I alredy have DirectX 11 installed on my PC. What should I do?"
,JGX421,2012-07-26T04:49Z,Nevermind my previous comment. I was able to extract and install the full registered product successfully!! Thank you very very much!!
,HeliumX,2012-07-31T20:07Z,"Kaspersky says: 

Status: Deleted	
1.8.2012 0:45:24	Deleted	virus P2P-Worm.Win32.Palevo.ewsf	F:Autodesk Autocad 2013 [PC Multi7 ~ x64]ADAK13PCE64ADAK13PCE64Autodesk Autocad 2013 [PC ENG ~ x64]AUTOCAD_2013Crackxf-autocad-kg_x64.exe	High

Patch crashes in Sandboxie and some marks are missing from activation code.

Any ideas to solve this?"
,ybisom,2012-08-03T00:39Z,DONT DOWNLOAD IT COMES WITH A LOT OF JUNK. There is others language packs and cracks without any shit that this guy has attached. I DON'T RECOMMEND!!!!
,blazefp,2012-09-25T15:34Z,"I have to thx avast for saving my new pc this time. Came with a trojan and loads of junk, things like american defense's pdf and crap like that.

I do NOT recommend this torrent"
