Filename,Size,Unit
Mystic Man/06 Buk-In-Hamm Palace.mp3,20.72,M
Mystic Man/14 Dubbing Buk-In-Hamm.mp3,20.11,M
Mystic Man/10 Buk-In-Hamm Palace 12 Inch.mp3,18.26,M
Captured Live/06 Rastafari Is.mp3,17.29,M
Mystic Man/11 Mystic Man (Long Version).mp3,17.23,M
Equal Rights/09 Pick Myself Up (Live).mp3,17.1,M
Bush Doctor/09 Creation.mp3,15.63,M
Equal Rights/02 Downpressor Man.mp3,15.25,M
Bush Doctor/07 Stand Firm.mp3,14.77,M
Equal Rights/05 Equal Rights.mp3,14.23,M
Mystic Man/01 Mystic Man.mp3,14.2,M
Equal Rights/04 Steppin' Razor.mp3,13.82,M
Bush Doctor/13 (You Gotta Walk) Don't Look Back (Version).mp3,13.7,M
Bush Doctor/10 Lesson in My Life (Outtake).mp3,13.39,M
Captured Live/08 Mama Africa.mp3,12.82,M
Equal Rights/08 Apartheid.mp3,12.82,M
Bush Doctor/01 (You Gotta Walk) Don't Look Back.mp3,12.77,M
Bush Doctor/11 Soon Came (Long Version).mp3,12.75,M
Mystic Man/13 Recruiting Soldiers (Version).mp3,12.48,M
Bush Doctor/12 I'm the Toughest (Long Version).mp3,12.47,M
Mystic Man/08 Crystal Ball.mp3,12.46,M
Bush Doctor/14 (You Gotta Walk) Don't Look Back (Version).mp3,12.05,M
Mystic Man/07 The Day the Dollar Die.mp3,11.67,M
Equal Rights/10 African (Live).mp3,11.52,M
Mystic Man/04 Jah Say No.mp3,11.28,M
Mama Africa/01 Mama Africa.mp3,11.19,M
No Nuclear War/01 No Nuclear War.mp3,11.06,M
Bush Doctor/15 Tough Rock Soft Stones.mp3,10.88,M
Equal Rights/07 Jah Guide.mp3,10.84,M
Mystic Man/02 Recruiting Soldiers.mp3,10.79,M
Equal Rights/03 I Am That I Am.mp3,10.78,M
Bush Doctor/08 Dem Ha Fe Get a Beatin.mp3,10.31,M
Captured Live/03 Equal Rights Downpressor.mp3,10.28,M
Bush Doctor/06 Bush Doctor.mp3,10.01,M
Bush Doctor/02 Pick Yourself Up.mp3,9.79,M
Bush Doctor/04 Soon Come.mp3,9.69,M
Bush Doctor/03 I'm the Toughest.mp3,9.61,M
Mystic Man/03 Can't You See.mp3,9.1,M
Equal Rights/06 African.mp3,9.03,M
Mystic Man/12 Fight On (Insturmental).mp3,9.03,M
Bush Doctor/05 Moses - the Prophet.mp3,8.92,M
Captured Live/05 Not Gonna Give It Up.mp3,8.92,M
Mystic Man/09 Rumors of War.mp3,8.69,M
"Equal Rights/01 Get Up, Stand Up.mp3",8.56,M
Legalize It/08 Till Your Well Runs Dry.mp3,8.42,M
Mama Africa/02 Glasshouse.mp3,8.27,M
Mystic Man/05 Fight On.mp3,8.25,M
Captured Live/01 (You Gotta Walk) Don't Look Ba.mp3,8.19,M
Mama Africa/03 Not Gonna Give Up.mp3,8.16,M
Captured Live/07 Where You Gonna Run.mp3,8.1,M
Captured Live/05 Bush Doctor.mp3,7.99,M
Captured Live/06 Johnny Be Good.mp3,7.94,M
Captured Live/02 Glass House (live).mp3,7.78,M
No Nuclear War/07 Testify.mp3,7.65,M
Captured Live/07 Get Up Stand Up.mp3,7.2,M
Wanted Dread or Alive/09 Fools Die.mp3,7.12,M
No Nuclear War/03 Fight Apartheid.mp3,6.83,M
Legalize It/07 Ketchy Shuby.mp3,6.8,M
Captured Live/02 Pick Myself Up.mp3,6.7,M
No Nuclear War/02 Nah Goa Jail.mp3,6.63,M
Legalize It/01 Legalize It.mp3,6.43,M
Captured Live/03 African.mp3,6.42,M
Legalize It/06 Igziabeher (Let Jah Be Praised).mp3,6.34,M
Legalize It/04 No Sympathy.mp3,6.29,M
Mama Africa/09 Maga Dog.mp3,6.25,M
Mama Africa/07 Peace Treaty.mp3,6.16,M
Wanted Dread or Alive/03 Reggaemylitis.mp3,6.16,M
Wanted Dread or Alive/07 Rastafari Is.mp3,6.15,M
No Nuclear War/08 Come Together.mp3,6.1,M
Captured Live/04 Coming in Hot.mp3,6,M
Mama Africa/06 Where You Gonna Run.mp3,5.92,M
No Nuclear War/05 In My Song.mp3,5.87,M
Mama Africa/05 Johnny B. Goode.mp3,5.79,M
Mama Africa/04 Stop That Train.mp3,5.72,M
Legalize It/09 Brand New Second Hand.mp3,5.59,M
No Nuclear War/06 Lessons In My Life.mp3,5.36,M
Legalize It/02 Burial.mp3,5.36,M
Mama Africa/08 Feel No Way.mp3,4.96,M
No Nuclear War/04 Vampire.mp3,4.91,M
Captured Live/04 Peters Rap.mp3,4.87,M
No Nuclear War/09 No Nuclear War (Single Version.mp3,4.81,M
Wanted Dread or Alive/05 Oh Bumbo Klaat.mp3,4.5,M
Legalize It/10 Ketchy Shuby (Instrumental).mp3,4.49,M
Legalize It/05 Why Must I Cry.mp3,4.23,M
Wanted Dread or Alive/06 Wanted Dread & Alive.mp3,4.23,M
Captured Live/01 Intro_ Creation_Buk-In Palace.mp3,4.15,M
Wanted Dread or Alive/08 Guide Me From My Friends.mp3,3.83,M
Wanted Dread or Alive/02 Nothing But Love.mp3,3.6,M
Wanted Dread or Alive/04 Rock With Me.mp3,3.55,M
Wanted Dread or Alive/01 Coming in Hot.mp3,3.52,M
Legalize It/03 Watcha Gonna Do.mp3,3.37,M
