User Type,Username,Date,Text
,astroblak,2012-02-12T00:36Z,psspss... your uploads blow
[V],psspss,2012-02-12T03:42Z,"you seem to -1 even without haveing downloaded it yet.. as I know at time of this post no one had it yet

perhaps I need to stop posting hard to find stuff on TPB and stick with demon where people apprev the missing episodes"
,researcher70,2012-02-12T05:14Z,"psspss...Speaking for myself, you are appreciated. Thanks for your fine efforts. Looking forward to other episodes."
[V],psspss,2012-02-15T10:39Z,"im going to rename mine starting at E00 not E01
so matches the other cappers and natgeo
listing and ignore tvrage

premiere can be S01E00

it will save the confusion on new episodes to come

so -1 in Episode name when get this"
