User Type,Username,Date,Text
[V],HobbitWarez,2012-12-28T00:46Z,"AnDrOiD Applications 12-27-12

1Tap Quick Bar-Quick Settings (Ultimate) v1.2-AnDrOiD
aCar Pro - Track your vehicles v4.2.1-AnDrOiD
aFirewall Call And Message blocker v4.0.4-AnDrOiD
Android Task Manager Pro v2.8.5-AnDrOiD
AndroZip Root File Manager v4.5 build 41-AnDrOiD
Archos Video Player v6.0.19 4.0.3 Plus-AnDrOiD
BetterBatteryStats v1.12 RC1-AnDrOiD
Black Infinitum - Inverted v3.1.3 Android 4.1 Plus (Requires CM10 AOKP Rom)-AnDrOiD
Black Infinitum - Inverted v3.1.4 Android 4.1 Plus (Requires CM10 AOKP Rom)-AnDrOiD
BusyBox Pro v9.6.7-ROOTED DEVICES ONLY-AnDrOiD
Chat Toolkit (smileys memes) v1.0-AnDrOiD
Clock JBplus v1.0.4-AnDrOiD
Color Booth Pro v1.2.4-AnDrOiD
Dsoid v1.9.6-AnDrOiD
eWeather HD Radar HD Quakes v4.6.4-AnDrOiD
Field Recorder v2.12.2-AnDrOiD
Fine Volume Control V2 (Full) v2.1.4-AnDrOiD
FPse for android v0.11.73-ROOTED DEVICES ONLY-AnDrOiD
FTL Launcher Pro v3.1.5 Android 4.1 Plus-AnDrOiD
GO Launcher EX v3.25 Beta4-AnDrOiD
Gym Book training notebook v3.5-AnDrOiD
GyroSpace 3D Live Wallpaper v1.0.3-AnDrOiD
Holo Launcher HD Plus v2.0.0 Android 4.0 Plus-AnDrOiD
Icon Pack - Darkness v1.0-AnDrOiD
Laser Clock ANDROID BLUE v2.1.5-AnDrOiD
Math Ref v2.5.3-AnDrOiD
Memory Booster (Full Version) v5.0-AnDrOiD
Music Player (Remix) v1.0.0-AnDrOiD
nanoloop v1.8.7-AnDrOiD
Performance Test Pro v1.2-AnDrOiD
Pho.to Lab PRO v1.2-AnDrOiD
ReNotify Plus v1.6.3 4.0 Plus-AnDrOiD
Root Call Blocker Pro v1.8.3.25-ROOTED DEVICES ONLY-AnDrOiD
Round White Theme Go Nova Apex v1.8-AnDrOiD
runtastic SitUps PRO v1.4-AnDrOiD
SketchBook Pro for Tablets v2.5.2- Android 3.0 plus-AnDrOiD
Smart Screen Off PRO v2.3-AnDrOiD
SoundWire (full version) v1.0.7-AnDrOiD
Spyware Shield v1.0-AnDrOiD
Switch Controls Full v2.3-AnDrOiD
Talking Battery Widget Pro v2.0.1-AnDrOiD
THEME RedPlaid v1.0-AnDrOiD
WiFi Mouse HD v1.7-AnDrOiD
ZDbox (All-In-One toolbox) v3.9.253-AnDrOiD
Zoner Mobile Security v1.0.0-AnDrOiD"
,sanket03,2012-12-28T07:00Z,"Plzzz Sir I request U To upload Poweramp Music Player latest Paid VERSION 

PLZ PLZ PLZ"
,free3dom,2012-12-28T15:43Z,Thanks for the updates!
,richg67,2012-12-28T18:24Z,"nice job once again, I REALLY REALLY appreciate your listing the contents of your uploads. Saves time and time is money.

P.S. looking for unecm for android. I know it's only a buck but I wonder if it works at all on my tablet. If anyone could upload it you could and I.m certain it would be a HIT!"
,nykd007,2012-12-28T21:35Z,more of a request then a comment. Looking for someone to alter a busted app. nykd007@gmail.com There are 2 rewrite issues
,Ganagul1,2012-12-30T16:42Z,Thank you! But my samsung Galaxy Tab 2.70 will not install apps not supplied by Android Market. One who knows how to unlock this?
,netlagger,2012-12-30T23:53Z,"Ganagul, in your developers menu in settings, check the box that allows you to install apps not from the market."
,Gince2,2013-01-02T10:20Z,"I know just only one thing : this dude is the best off all cool dudes!!!!

Thanks a lot for your great job.

Congrats from Lithuania

Gince"
