User Type,Username,Date,Text
,zeeyyy,2012-05-31T10:28Z,"There's a chunk missing in this version from the time a money-less team, after a challenge, is stranded, and to the next porky challenge."
,ubabub,2012-05-31T12:55Z,"Thank You so much, I just love this show."
,fuisp,2012-05-31T13:03Z,"I think there might be missing a part after the eggs?

Thanks so much for the upload!!"
,bryentheartist,2012-05-31T15:55Z,thank you love the amazing race au
,sup1990,2012-05-31T18:07Z,Thanks for uploading :)
[V],tonyisaac,2012-05-31T21:36Z,"Yeah, a little over 5 mins. missing. Sorry, didn't check it. Trust RTA to mess things up, yet again!!"
[V],tonyisaac,2012-05-31T21:36Z,Will upload a complete version soon!
,zeeyyy,2012-06-01T02:20Z,Is it possible to load the 720p version? TQ
,seevee1969,2012-06-02T14:55Z,"zeeyyy
Channel 7 in their wisdom have decided not to broadcast (or make) this in HD"
