User Type,Username,Date,Text
,porkbeenz,2012-02-24T06:00Z,thx +1
,psykotik1,2012-02-24T06:12Z,"That was fast, wasn't expecting this for a while!!  You guys are the best"
,69balzdp,2012-02-24T08:00Z,SEED PLEASE!!!!
,xnesta,2012-02-24T12:39Z,Thanks ettv ffor beeing so fast to upload! Very much appreciated!
,ajdv94,2012-02-24T15:51Z,"you are awesome ettv! thanks to you and all these seeders, in the last 5 minutes i downloaded the most recent episodes of The Office, Modern Family, and now Jersey Shore, THE BEST SHOWS you rock great quality"
