User Type,Username,Date,Text
,prodallas,2012-08-23T19:29Z,"Is this even released yet? Gotta try it,love firefox power. any suggestions on replacing igoogle."
[T],bobiras2009,2012-08-23T19:37Z,"@prodallas

Yes this is the official firefox 15 beta 6 from the firefox team.

For igoogle replacement check here:

www.pcworld.com/article/258815/three_alternatives_to_your_igoogle_home_page.html"
,xpmule,2012-08-23T22:17Z,crappy alt's in that story
[T],bobiras2009,2012-08-23T22:48Z,"@xpmule

Stop spamming my threads troll."
