User Type,Username,Date,Text
,gabeybaby,2012-10-04T10:32Z,shithead it starts oct.10. dumb loser in mommy's basement!
,risheel33,2012-10-04T14:47Z,@gabeybaby u are the dumb loser coz it already aired on oct3.
,amalkamal,2012-10-04T19:56Z,@gabeybaby .. You Need HELP Because you're NUTS .. So Go seek some :(
,mi.ghost,2012-10-04T20:42Z,gabeybaby checkout imdb dickhead.
,mi.ghost,2012-10-04T20:44Z,my favorite show back with a bang for the first time in the show this season offers more mystery...and they gave hint that this is gonna be the final season.thanx tony..a/v 10/10 and thanx for the subs too much appreciated.
