User Type,Username,Date,Text
,B.Torrents,2012-08-18T04:12Z,Thanks SaM...
,sweets110,2012-08-23T07:31Z,"sam- when its dvd/bluray/hd print will come plz tell.

Tell Me O Kkhuda - DVDScr - XviD - 1CDRip - [DDR] 
"
,edge1124,2012-09-04T05:08Z,Thx for the up!! Great quality but movie was like a 4.5 out of 10....expected better but was too corny the last 1/2
,Ezn0,2012-09-14T03:43Z,hey thanks torrent its good avi hd fast to thanks very mutch ppl get this!!!!~
,Ezn0,2012-09-14T05:24Z,diident like ending tho
