User Type,Username,Date,Text
[T],SCSA420,2012-10-24T05:52Z,"Here is the latest episode of Sons Of Anarchy HDTV S05E07 720p AVCHD-SC-SDH in 720p MP4 format!!! 

PLEASE READ THE .nfo FILE THIS WEEK FOR MORE INFORMATION!!!

Please stay connected after your download is finished to help seed this show for people still downloading it and enjoy the show!!! :D"
,Chetzz,2012-10-24T09:22Z,is this video 5.1 surround?
,Chetzz,2012-10-24T10:11Z,oh my bad its 2 way stereo just too bad :S
[T],SCSA420,2012-10-25T10:37Z,"Its a great quality 720p HD mp4 video that plays perfectly on my PS3, Xbox360, Samsung Galaxy S III Smartphone,  iPad 3, iPhone 4 and iPhone 5 and any other device that can playback 720p HD mp4 video with high quality 384 kbps AAC stereo audio. I try my best to make my 720p HD mp4 video files playable on lots of modern devices so that more people can enjoy them with less hassle. IF that is wrong please speak up with an opinion otherwise STFU."
