User Type,Username,Date,Text
,baptistear,2012-03-06T18:38Z,Please Seed ! There are not any else who Seed with me ?
,baptistear,2012-03-06T18:39Z,I Want this Pretty Post ! 
,thediego270188,2012-03-07T16:27Z,this was a hardwork doin' this cleanin up old the repeat song ... number it each song.. 13 gb of pure beatport !!! don't need to thank me :P
,Drakelet,2012-03-09T15:47Z,"@thediego270188: I want to thank you, but I'm getting a download speed of 0. :-("
,DanielCGU,2012-03-12T09:20Z,"No seeders?
Too bad, would love to download it :)"
,spexarn,2012-03-12T15:37Z,Can someone please seed :)? I Really want this
,spexarn,2012-03-12T15:39Z,And thx thediego270188 for a great torrent! 
,ddr305,2012-03-31T20:37Z,"this is crazy, 1 seed? i'll happily seed for a week if i could actually get it"
