Filename,Size,Unit
Real Steel 2011 BRRip 480p x246 200MB - cRcWoRLd [crcworld.in].mp4,303.1,M
RS sample.mp4,2.39,M
Real Steel 2011 BRRip 480p x246 200MB - cRcWoRLd [crcworld.in].srt,112.5,K
Torrent downloaded from Ahashare.com.txt,66,B
Torrent downloaded from Silvertorrents.me.txt,52,B
Torrent downloaded from ExtraTorrent.com.txt,51,B
Torrent downloaded from Demonoid.me.txt,46,B
Torrent Downloaded from TorrentState.com.txt,46,B
Torrent downloaded from Kickasstorrents.com.txt,43,B
Torrent downloaded from h33t.com.txt,43,B
Torrent downloaded from 1337x.org.txt,24,B
