User Type,Username,Date,Text
,groupiegran,2012-03-09T16:03Z,"Thank you soooo much BigFish5, who/where ever you are.  Really miss this at the weekends.  "
,dnico321,2012-03-09T16:28Z,ty !!
,sup1990,2012-03-09T18:16Z,Thanks for uploading this every day! :)
,TPBRools,2012-03-10T02:51Z,"Yep, please don't go fishing, or otherwise have a life, for the duration of this series. Would hate to miss an episode. :) 

I'm overseas for a few months, so your commitment to uploading these is greatly appreciated!"
