User Type,Username,Date,Text
,copertone,2012-11-05T11:51Z,espero se esté descargando bien...no dudeis en comentar si os queda por descargar...no lo borraré...aunque lleve mucho tiempo (interesante ir poniendo prioirdades en la descarga capitulo a capitulo)
,ofmistery,2012-11-09T17:10Z,"Descargando, gracias por el aporte :)"
,ofmistery,2012-11-10T17:29Z,por favor algun seeders para poder descargarlo
,copertone,2012-11-15T13:58Z,yo cuando estoy lo tengo conectado...debería descargar
,copertone,2012-11-16T11:59Z,"ofmistery...a mi en el utorrent me pone velocidad de subida (confirma que estás subiendo)....suelo viajer y estar fuera varios dias, es posible que no consigas bajar en varios dias, pero cuando vengo tengo siempre el ordenador conectado incluso de noche...aprovecha entonces"
