Filename,Size,Unit
World Of Hardstyle 2012.mp4,168.04,M
Psyko Punkz  BassBoom (Preview).mp4,22.72,M
Frontliner & BFront  Auditory Nerve  EMPORIUM 2010 BACKSTAGE.mp4,21.39,M
Headhunterz  Doomed.mp4,21.17,M
RanD  My Way (Official Videoclip).mp4,21.01,M
Zany  World Belongs To You (Official Video).mp4,20.92,M
Headhunterz vs. Psyko Punkz  Disrespect (official video).mp4,19.24,M
Psyko Punkz  Feel the Rhythm (Alpha² RMX)  Lets Get ill  Official Videoclip.mp4,18.65,M
"Isaac, DBlock & SteFan  In the air.mp4",17.96,M
Kaskade  Lessons In Love (Headhunterz Remix) Official Video.mp4,17.8,M
Coone  Beat On My Drum (Official Videoclip).mp4,17.31,M
Alusion meets Global Soundz  Beat The Bridge (Official Music Video).mp4,17.06,M
The Prophet  One Moment (Official Music Video).mp4,17.04,M
Brennan Heart  Running Late (Video).mp4,16.2,M
Psyko Punkz  Psyko Foundation  Official Videoclip.mp4,16.19,M
Brennan Heart & Wildstylez  Lose My Mind (Official videoclip).mp4,15.76,M
Noisecontrollers  So High [HD].mp4,15.64,M
DBlock & SteFan  Take me there (official videoclip).mp4,15.38,M
The Pitcher & Slim Shore  I&#39;m Alive (Official Music Video)(pres. by TimBo).mp4,14.68,M
Creating the main part of my new track From Within.mp4,14.67,M
Hard Driver  Under Attack (Official Bassleader 2012 Hardstyle Anthem).mp4,14.28,M
Brennan Heart  Life That We Dream Of (City2City).mp4,14.18,M
Zatox  My Life (Official Videoclip).mp4,12.26,M
Brennan Heart  We Can Escape (Intents Anthem 2012).mp4,12.11,M
Dirty Workz presents Hard Driver (Official Trailer).mp4,11.54,M
Ambassador Inc  It&#39;s all Confusion  (Official HQ Clip).mp4,11.42,M
