User Type,Username,Date,Text
,talia_burke,2012-12-16T21:19Z,Hablo espanol como idioma segunda -- podria entender eso?
,Cyberjanne,2012-12-16T21:20Z,is this spanish ed of hobbit or the documentary?
,Eldgernon,2012-12-16T22:05Z,"It's really spanish edition of hobbit. Not fake, at least.
Quality - average."
,cidon62,2012-12-17T00:37Z,"es la original garantizado esta en latino ok
calidad media"
,cidon62,2012-12-17T00:39Z,la acabo de ver es la buena ok!!
,talia_burke,2012-12-17T04:36Z,"Puedo entenderlo
calidad visual es medio a bueno
calidad de oir es muy bueno
Lo siento, hablo ingles primera, espanol segunda."
