User Type,Username,Date,Text
,Bobbamax,2012-06-04T15:38Z,any chance you have the Empire Film Magazine
[V],bigbluesea,2012-06-04T16:00Z,"@Bobbamax

I'm sorry,I don't get that magazine.I might in the future I'm not sure yet 

This is the closest I have"
,Bobbamax,2012-06-06T13:35Z,"bigbluesea, I appreciate all your efforts, thanks for replying"
,Bobbamax,2012-06-06T13:38Z,Any chance you have the following...DK-Eyewitness-Top-Travel-Guide Madiera
[V],bigbluesea,2012-06-06T20:58Z,"@Bobbamax

Yes I do, will upload it today"
