User Type,Username,Date,Text
,Platine,2012-10-15T20:29Z,Thanks Bro... Much Appreciated
,aeffaeff2,2012-10-16T06:14Z,Thanks!!
,walid_97,2012-10-16T12:18Z,"Can u please write the names of the apps and games in the description 
Thanks.."
,bobiras2009,2012-10-16T12:58Z,"@walid_97

Try to read my description its simple"
,stcapricorn,2012-10-16T22:30Z,Thank u so much bobiras2009
,walid_97,2012-10-17T15:07Z,"I dont understand ur english :S
and i think you are talking about the torrent file which i open and it show me all the content included 
but there is no torrent file on tpb anymore only magnet link :/"
,bobiras2009,2012-10-17T16:57Z,"@walid_97

I mean that right under the title of the torrent there is a word that says files.And in left from that is a number that says 17.It is the number of the files that included.If you press it the list of the files will appear down from my torrent description.With this way you can see what apps/games i have in my all packs.Hope you understand that."
,walid_97,2012-10-18T00:36Z,"Oh right :)
Thanks :)"
,louisrai,2012-10-27T01:35Z,"Hey, can anyone crack Plague Inc. full version? Thanks. >_"
