User Type,Username,Date,Text
[V],sujaidr,2012-02-11T01:37Z,"i have included a sample,so you could check for quality :-) ENJOY

i dont have a seed box so i'll provide maximum initial seeding but for the torrent to be alive please seed back too"
,dragunove,2012-02-11T09:09Z,thanks mate
,stan1408,2012-02-11T10:11Z,"Thanks mate, now do Puss.In.Boots.2011 & J.Edgar.2011"
,ibocanone,2012-02-11T12:15Z,thanks mate
,andrei.92brb,2012-02-11T17:14Z,good work .pls upload J EDGAR 2011 720p BRrip scOrp and all scOrp releases 
,RIDDICK20,2012-02-11T20:30Z,you rock. thanx
,opforce74,2012-02-11T21:14Z,"Rated +1 even before i download, knowing this gonna be good quality and sound....Thank you, sir"
,fofo141,2012-02-11T22:12Z,Thank you so much sujaidr
,bryentheartist,2012-02-11T23:06Z,wont play on windows
[V],sujaidr,2012-02-11T23:28Z,"@bryentheartist ,ofcourse it wont play on windows if u dont have the proper codec,read the description for the players that play mkv files.................use vlc,kmplayer or gom player........"
,raghav080,2012-02-15T06:34Z,Thnxxx for the Up... Awesome movie.. +1
,tcs_jr,2012-02-18T02:29Z,can you get school daze by spike lee?  thanks for the uploads!
,Nightfury_34,2012-03-14T18:21Z,Seriously love all your uploads!! But couldn't seed much as 3g connection is costly affair here in india. Will seed as much when I get wireline connection. THANK YOU SO MUCH!!! 
,gistuff3,2012-04-13T03:03Z,thx bro!!
