Filename,Size,Unit
Save Yourself/03 Save Yourself.mp3,6.4,M
Save Yourself/07 Still.mp3,5.71,M
Save Yourself/19 Square One.mp3,5.11,M
Save Yourself/18 Rivers of Blood.mp3,5.08,M
Save Yourself/04 Burn It Down.mp3,5.03,M
Save Yourself/12 When I Was Young.mp3,4.88,M
Save Yourself/13 Shadow Girl.mp3,4.72,M
Save Yourself/10 Mirror on the Wall.mp3,4.71,M
Save Yourself/17 Day One.mp3,4.63,M
Save Yourself/08 Hax Yo Face.mp3,4.45,M
Save Yourself/06 Remember the Dead.mp3,4.35,M
Save Yourself/14 Joining You.mp3,4.16,M
Save Yourself/09 Hexed.mp3,4.09,M
Save Yourself/11 Falling Down.mp3,3.83,M
Save Yourself/15 Make Tha Doe.mp3,3.73,M
Save Yourself/02 My Own.mp3,3.69,M
Save Yourself/16 Push.mp3,3.56,M
Save Yourself/05 Corruption.mp3,3.28,M
Save Yourself/01 Let Us Pray (Intro).mp3,1.84,M
