Filename,Size,Unit
tangerine dream_1985-08 le parc_01 Bois de Boulogne (Paris).mp3,12.4,M
tangerine dream_1985-08 le parc_02 Central Park (New York).mp3,8.45,M
tangerine dream_1985-08 le parc_03 Gaudi Park (Guell Garden Barcelona).mp3,12,M
tangerine dream_1985-08 le parc_04 Tiergarten (Berlin).mp3,7.29,M
tangerine dream_1985-08 le parc_05 Zen Garden (Ryoanji Temple Kyoto).mp3,11.14,M
tangerine dream_1985-08 le parc_06 Le Parc (L.A. - Streethawk).mp3,7.68,M
tangerine dream_1985-08 le parc_07 Hyde Park (London).mp3,9.19,M
tangerine dream_1985-08 le parc_08 The Cliffs of Sydney (Sydney).mp3,13.17,M
tangerine dream_1985-08 le parc_09 Yellowstone Park (Rocky Mountains).mp3,14.2,M
