User Type,Username,Date,Text
,323by,2012-06-22T01:38Z,gracias jcgoku por tus aporte
,ivnchavo,2012-06-22T02:39Z,Gracias Jcgoku21... como siempre excelentes aportes!!!... :D saludos!!
,Metallicodm,2012-06-23T01:53Z,"QUE MAESTRO SOS JCGOKU21, TE ADMIRO, SUBE MAS PELICULAS EN 720P"
,tianyisha,2012-06-23T08:21Z,"gracias por su aporte 
pero en la pagina descargar directo yalo tiene el dia 12 "
,Mollito,2012-06-23T18:37Z," Gracias por el aporte, te pido por favor que sigas subiendo versiones en hd720 de las Ăşltimas pelis. GRACIAS!!!!"
,Chofax_666,2012-06-23T19:13Z,sos grande jc!!! muy agradecido!
,AxelLoco,2012-06-29T18:16Z,"OYE!!! BUENAS PELI JCGOKU21!!! 

OYE ME PODRIAS DECIR QUE PROGRAMA HAS USADO PARA RIPPEAR LOS BLUE RAYS HEN TAN BUENA CALIDAD Y BIEN POCA MEMORIA ... GRACIAS TE LO AGRADECRIA!!!"
,BetoMovies,2012-07-02T00:05Z,grande jc ........ descargando........ (esperando) AMERICAN PIE (THE REUNION)
,SheyCrroix,2012-07-15T19:39Z,Gracias. Excelente calidad.
