Filename,Size,Unit
DSCN Privat Sex geile Ex Freundin Annette Ressa aus Essen MUSCHIFOTOS nackt girlfriend copine fotze nude amate.jpg,146.98,K
"Ex vriendin Karin in string, kont bloot naar de camera. Heerlijke billen om je op af te rukken! (prive amateur foto).jpg",133.7,K
"Ex vriendin Jen 36jr. bloot op d'r buik, geile volle billen.JPG",110.98,K
"Ex vriendin Karin foto van opzij, mooi lijf en prachtige billen bloot. Heerlijk om op te masturberen (prive amateur foto) ass, string, kiddy, pedo,.jpg",88.73,K
"Ex vriendin Karin op 't strand, lekkere volle billen in string.jpeg",56.93,K
Femke uit Wijchen 16 (slet naakt tieten neuken bloot nackt naked female fuck sex).jpg.jpg,38.71,K
"Ex vriendin Karin in string, kont bloot naar de camera. Heerlijke billen om je op af te rukken! (close up) (prive amateur foto).jpg",28.43,K
