User Type,Username,Date,Text
,bowlinwes300,2012-05-21T05:06Z,"0 seeders 0 leechers? I'll just wait, eztv you are always the best"
,hellowww,2012-05-21T07:33Z,Thanks
,robertification,2012-05-21T11:46Z,Stop spamming all of eztv's torrents you twat.
,Donjamos,2012-05-21T13:34Z,"great quality like always, but one of the worst episodes ever (s10e23 as well)"
,Snedde1,2012-05-21T18:10Z,Brilliance
,ebud,2012-05-23T07:37Z,"Why are mp4 files' size fickling(not sure it's the right word) so much through episode release EZTV?
U see ep.17 and ep.18 are under 100MiB, then ep.19 is over 100MiB mark. Then back to a small size under 100MiB with ep20-21, but the lasts two, ep.22-23, over 100....
Why, why is that?? Can anyone explain it to me plz?"
,ebud,2012-05-23T07:49Z,"oh, and btw, thank you so much EZTV for all these great torrents!! much appreciated"
,TehJon,2012-05-24T16:44Z,"Dude you always have episodes in HD 2 weeks before they air here in the US, thanks man."
,alterqaunt,2012-05-27T04:53Z,tnx
,Fosta_RM_Perth,2012-08-26T07:08Z,suck my cock 
