User Type,Username,Date,Text
,philsfan5,2012-06-02T00:06Z,thanksss!!
,Lola6700,2012-06-02T00:13Z,"Jag skulle precis gå och sova - det kan jag inte nu *skrattar* Jag må sluta och titta på din sida sent på kvällen.
Tack!
:o)"
,shallow2,2012-06-02T00:16Z,"If I didnt know better @philsfan5, I'd probably think you were just sitting there waiting for us :)"
,shallow2,2012-06-02T00:21Z,"How its looking from my end :)

http://image.bayimg.com/baocgaadp.jpg"
,shallow2,2012-06-02T00:44Z,"Det er det samme for oss :) 

Kink slipper shoots kl 21.00. Så er det bare å vente, og med en gang de dukker opp så er det å: laste ned, pakke ut, 'kvalitets sikre' (beste delen), lage torrent, å uploade. 

Og så håpe at det fremdeles er noen timer til søvn før jobb..

Men vi har folk som stoler på oss så.. :D

p.s. disse shoots var amazing!!!! :) "
,drakic,2012-06-04T08:21Z,thx
,nemez505,2012-06-04T22:54Z,it looks good ) thx a lot M&S 
,drexdrex,2012-06-08T07:10Z,how come i dont get to choose which files i want to download anymore? it just starts downloading everything
