User Type,Username,Date,Text
,Mtek2012,2012-04-29T16:01Z,"This is some Russian Pirate taking the complete Piss.
Could possibly be a false torrent do not waist your time.

RAR Passworded - Then asks you to go to Website where to complete the requests you have to phone a high rate phone number and can never complete but they will ring you back time and time again and charge you for the calls.

Warning this is a scam.

I am using my Quad Core Zeon Server working 24/7 to Crack the password as the RAR file is passworded.

As soon as it completes I will post the password up on here destroying the efforts of this piss taker.

One thing I can not stand is Russians they always take the piss and to make matters worse a Russian Pirate taking the piss ontop of taking the piss.

Let me make this clear to you I have a lot of Russian friends and they are not very nice people. 

So you take the piss just keep it up, we will find you who ever you are."
,Mtek2012,2012-04-29T17:00Z,"My Bad wrong place to post my text ooooopppps

Sorry 594mgnav"
[T],594mgnav,2012-04-29T18:31Z,"@Mtek2012

its ok.."
,xypher20,2012-05-01T22:19Z,"only the serial..there's any ""cracked amtlib.dll"" in this torrent..waste of time.."
,F586931,2012-05-09T02:50Z,"There are no ""amtlib.dll"" file include. Please recheck."
,Jasper77,2012-05-09T09:47Z,Yeah amtlib.dll is missing
,Klasic Kumputerz,2012-05-18T02:49Z,"This only has two serial numbers and an edited hosts entry. And there is no ""amtlib.dll"" file. Not sure of the serials work."
,MikuruX,2012-05-26T06:33Z,"amtlib.dll file is missing from this torrent. I'll check to see if you can register it without it but it not, really going to need to add that file to this, 594mgnav."
,cowboy36,2012-06-12T08:11Z,without the amtlib.dll this file is useless
