User Type,Username,Date,Text
,Evilution,2012-02-13T10:13Z,"I donÂ´t remember the quality of the previous episodes this season being this grainy... could be that im watching it on a smaller screen now (laptop), but it feels a bit too noisy from what i remember. The file is big enough to have fine picture, must be something with the source of transmission?"
,Kole97,2012-02-13T12:03Z,"Thanks been waiting for this edition HD
Season 3 A:10 V:10"
,Ninjaflipp,2012-02-13T12:26Z,"I really don't get it. My internet speeds are more than fine, but whenever it comes to downloadning TWD from TPB regardless of uploader, it's always reaaaaaaaaaaaaaaaaaally slow. Sitting at 0.5kb/s for the moment. What could be the issue?"
,googieman70,2012-02-13T12:48Z,Very good copy Thanx!
,PauloFran,2012-02-13T13:25Z,"TERRIBLE video quality. It looks the same as the HDTV version, only a bit less dark.

NOT HD, no way."
,yalF,2012-02-13T13:36Z,Obg. senhores. Aloha
,90remo,2012-02-13T14:52Z,"@Ninjaflipp 

The first thing that really matters is that if your IP Address is public or private. The second thing is how many seeds/leechers there are. For most new torrents the ratio S/L is low (there are many more people who are downloading than uploading). ATM it is 3888 seeds / 8289 leechers, and in most countries connections are asynchronous [uploading speed 8x slower than downloading]. Just wait a little."
,Actinium89,2012-02-14T19:57Z,"V:9
A:9
This series has been getting so boring and very predictable. I keep wait for something to happen but the story just seems to progress so slowly. This show is really pissing me OFF!"
,Sonofsun69,2012-02-15T00:25Z,"This show is becoming too predictable and too fucking slow. They need to kill off all the bitches and give the zombies some steroids, "
,DriverAus,2012-02-15T20:40Z,Svensk text: http://www.undertexter.se/?p=serier&id=270
,Julientelo29,2012-02-17T19:40Z,Sous-titres franĂ§ais : http://www.addic7ed.com/updated/8/59746/2
,LordHumungusNOS,2012-02-20T04:11Z,"WTF! ""The video sucks, the story sucks and I got sand in my pussy"". Fuck Ya'll. The story is great and the vid is fine. Thanks eztv. Great job."
,LordHumungusNOS,2012-02-20T04:17Z,I noticed every body that does all the pissing and moning doesn't upload shit.
,zestfulmass,2012-02-20T11:27Z,FFS can people seed please. It's going at 100KB/s
,smurf80,2012-02-27T14:03Z,"WARNING to the GERMANS, IP's are being tracked by german lawyers ""Sasse und Partner"", be careful for all walking dead episodes "
