Filename,Size,Unit
911 Explosive Evidence - Experts Speak Out.avi,465.67,M
911 and The Trillion Dollar Conspiracy by Jim Marrs/Jim Marrs - The Trillion Dollar Conspiracy 2010.avi,285.38,M
Shorts/Is the Bible Historical  - Charlie Campbell.flv,180.26,M
911 and The Trillion Dollar Conspiracy by Jim Marrs/Red Ice Radio - Jim Marrs - Trillion-Dollar Bailout Conspiracy American Revolutions   Wikileaks.flv,99.72,M
And More/Signs of the Times/Obama and the Christians - USA.flv,85.76,M
And More/The Holy Spirit/My Savior My God  - Aaron Shust - Copy.mp4,71.94,M
600 Volumes - POtHS Torrents seeded 7-4-2012.rar,69.71,M
Shorts/8 11 12 Louisiana Sink Hole Explained - POSSIBLE HUGE CATASTROPHE 100 Hiroshimas.flv,68.62,M
Shorts/Govt Experiments on US Troops- Dan Bidondi Special Report.flv,62.52,M
Shorts/Preparing The Kids For A Future With Big Brother.flv,61.59,M
Shorts/Muslim Brotherhood CRUCIFIXIONS - Russian Chinese Islamic Military Invasion coming to the USA.flv,57.38,M
And More/The Holy Spirit/NADA SE SOBRE EL FUTURO - I Know Who Holds Tomorrow - YouTube.mp4,55.71,M
And More/War and Rumors of Wars/Gazas Realityk p.mp4,54.47,M
And More/SIN-ister Clips/Rothschilds Infowars and GITMO.flv,48.65,M
Shorts/Monsanto GMO corn soon to flood Walmarts.flv,47.41,M
Shorts/Five US Nuclear Reactors Shutdown Past 3 Days - Various Issues NRC Claims Coincidental.flv,45.28,M
And More/Signs of the Times/RFID Chip Implanted into mans Hand in Washington State Mark of the Beast.flv,41.74,M
And More/SIN-ister Clips/Sneezing the New WMD Weaponized Mucus Devicee.flv,40.88,M
And More/SIN-ister Clips/Survival Doc Addresses Bridgeton MO City Council Mtg Regarding Red Light Cameras.flv,38.45,M
Shorts/Gulf Oil Spill - Biloxi Dome.flv,36.99,M
Shorts/DHS Source  Its going hot   Rosebud's Latest Info False Flag Against Obama.flv,35.48,M
Shorts/Bioelectric Implants And The Evolution Of Transhumanism.flv,32.48,M
And More/The Holy Spirit/Revelation Song - Phillips Craig and Dean - YouTube.flv,32.01,M
And More/The Holy Spirit/Our God is Greater - Chris Tomlin  - YouTubeelated.flv,31.78,M
And More/The Holy Spirit/Wretched  Dudley-Do-Wrong. - YouTube.flv,29.31,M
Shorts/Wikileaks released half a million documents related to 9 11.flv,29.07,M
And More/War and Rumors of Wars/Israel Managing the Conflict - The Jerusalem Connection Spot Report - YouTube.flv,27.79,M
And More/Signs of the Times/Privacy No More  TrapWire's all-seeing eye tracks your every move.flv,27.56,M
And More/The Holy Spirit/This One Is For The Mormons  - YouTube1.flv,27.39,M
And More/The Holy Spirit/My Hope Is In You - Aaron Shust - worship Video with lyrics - YouTube.flv,27.14,M
And More/SIN-ister Clips/Yosemite rangers in triage mode after hantavirus outbreak 9-2-12.flv,24.92,M
And More/The Holy Spirit/Matthew West - Strong Enough - Instrumental with lyrics - YouTube.mp4,24.14,M
Shorts/Mississippi River Is Drying Up.flv,20.73,M
And More/SIN-ister Clips/Social Security Admin To Purchase 174 Thousand Rounds Of Hollow Point Bullets.flv,19.49,M
And More/SIN-ister Clips/Romneys potential presidency is ALREADY hurting Americans - Cancer and more.flv,17.52,M
And More/SIN-ister Clips/SCREENSHOT Journal of Medical Ethics OKs Killing HEALTHY BABIES AFTER THEY ARE BORN.flv,17.49,M
And More/War and Rumors of Wars/Another Illegal Executive Assassination  THE PLAIN TRUTH by Judge Napolitano 10_3_11.flv,17.31,M
And More/SIN-ister Clips/Rob Schneider Speaks Out Against Vaccines.flv,16.87,M
Shorts/Exposed Auschwitz-like US death camp hospital in Kabul.flv,16.13,M
And More/Signs of the Times/Reasons for God - Chad V Meister PhD - vid clip.avi,16.01,M
And More/Martyrs of Today/Do not call conspiracy what the false Prophets and wayward believers call conspiracy.flv,15.8,M
And More/Signs of the Times/Police Kill Striking Miners in S Africa.flv,15.67,M
Shorts/Behind The Curtain Of Lebanon Evacuations - Is It Really Kidnappings  8-15-12.flv,15.52,M
And More/Signs of the Times/Radioactive Sinkhole in Louisiana may cause explosion   Lawsuit.flv,15.19,M
"And More/Signs of the Times/Indiana Swine Flu Cases Increase 10-Fold, Hits 113 9-2-12.flv",14.67,M
And More/SIN-ister Clips/Science Proves Teaching Abstinence Works.flv,13.41,M
And More/SIN-ister Clips/Suicide Or Police Cover-Up.flv,13.37,M
And More/SIN-ister Clips/Syria - RAW Video of al Qaeda Rebels Toss Syrians From Office Bldg 8-14-12.flv,12.7,M
And More/Signs of the Times/Propaganda Reel - Prepare False Flag Anarchist Threaten RNC watch for agent provocateurs.flv,12.54,M
Shorts/Solve this Mystery - changing the mindsets for future events.flv,11.35,M
And More/Signs of the Times/NY Times Poll  Majority of Americans feel Police Discrimination.flv,11.27,M
And More/War and Rumors of Wars/Asian Axis  India   China to bring two largest armies closer.flv,11.01,M
And More/Signs of the Times/Public Schools use RFID Chips to track and Punish Students for Pre-Crime.flv,10.98,M
And More/Signs of the Times/Officials Find Another Bubbles on the Bayou Site in Louisiana Near Bayou Corne.flv,10.37,M
Shorts/Iranians Affected With Depleted Uranium Toxic Air.flv,9.27,M
And More/The Holy Spirit/Todd Friel on true Christianity   Repentance  - YouTube.flv,9.22,M
Shorts/Behind Bars But Still Teaching the Word.flv,9.02,M
Shorts/Fire broke out at Torness Nuclear Power Station in East Lothian   Cooling System running TOO hot.flv,8.66,M
Shorts/Crosses chopped down  Anti-church hysteria spreads across Russia 8-26-12.flv,8.53,M
Shorts/Federal Reserve and IRS are organized crime.flv,7.48,M
Shorts/EPA Warns DEET Bug Spray is a Developmental Neurotoxin.flv,7.39,M
And More/Signs of the Times/Apology Issued For Birth Defect Drug 50 Years Later.flv,7.36,M
And More/SIN-ister Clips/Something Found In The Baltic Sea.flv,7.31,M
And More/Martyrs of Today/Aschs Conformity.flv,7.29,M
And More/Signs of the Times/POLICE STATE - Students Tracked Like Cattle In New RFID Chip Program.flv,7.26,M
And More/The Holy Spirit/This is the Truth  - YouTubeconfig.xml.flv,6.48,M
And More/The Holy Spirit/Let It Rain Original  - YouTubeg.flv,6.47,M
And More/The Holy Spirit/The Religion of Humanism in Public Education - YouTube.flv,5.94,M
And More/The Holy Spirit/Who Made GOD  - YouTube.flv,5.92,M
And More/Martyrs of Today/Voice of the Martyrs .flv,5.88,M
And More/The Holy Spirit/Was the Sabbath Changed to Sunday  - YouTube.flv,5.46,M
And More/SIN-ister Clips/Sex Survey Given To North Carolina Students.flv,5.28,M
And More/Signs of the Times/22 Pilot Whales Stranded In Florida.flv,3.87,M
And More/SIN-ister Clips/Squid-Bot Robot Camouflages Itself.flv,2.83,M
And More/Martyrs of Today/Nigeria Video.flv,1.57,M
ESO_store_promo_banner.jpg,25.24,K
Jim Marrs - Trillion-Dollar Bailout Conspiracy_.jpg,21.91,K
explo2.jpg,15.43,K
POtHS - Why We Do What We Do.txt,7.89,K
Info.txt,3.22,K
Torrent downloaded from Conspiracyhub.com.txt,47,B
Torrent downloaded from Ahashare.com.txt,47,B
