User Type,Username,Date,Text
[V],psspss,2012-09-18T03:08Z,"make sure you connect to the CCC tracker
as seems most seeders are updating to it
not the other trackers that have 1/4 the number showing"
[V],psspss,2012-09-18T04:09Z,"make sure you using a good AV list avast and avoid IE.. stick with firefox google chrome is like a cut down firefox it sucks too

but new flash exploit to infect PCs via web page

http://www.symantec.com/connect/blogs/new-internet-explorer-zero-day-vulnerability-exploited-wild"
