Filename,Size,Unit
CD/01. You Give Good Love.mp3,10.58,M
CD/02. Thinking About You.mp3,12.57,M
CD/03. Someone for Me.mp3,11.52,M
CD/04. Saving All My Love for You.mp3,9.23,M
CD/05. Nobody Loves Me Like You Do.mp3,8.68,M
CD/06. How Will I Know.mp3,10.62,M
CD/07. All at Once.mp3,10.29,M
CD/08. Take Good Care of My Heart.mp3,10.01,M
CD/09. Greatest Love of All.mp3,11.4,M
CD/10. Hold Me.mp3,13.96,M
CD/11. Thinking About You (12-Inch Dance Remix).mp3,16.69,M
CD/12. Someone For Me (12-Inch Dance Remix).mp3,17.03,M
CD/13. How Will I Know (Acappella).mp3,9.2,M
CD/14. How Will I Know (12-Inch Dance Remix).mp3,15,M
"CD/15. Greatest Love of All (Live from Radio City Music Hall, 1990).mp3",16.29,M
CD/Whitney Houston - Whitney Houston (The Deluxe Anniversary Edition).mp3.cue,2.75,K
CD/Whitney Houston - Whitney Houston.m3u,1.37,K
