Filename,Size,Unit
"Adolph Louis Luetgert, asesino del jabón.mp3",1.98,M
"Albert Fish, el ogro de Nueva York.mp3",2.12,M
"Alexander Pearce, el caníbal Irlandés.mp3",2.67,M
"Andrei Romanovich Chikatilo, killer ruso.mp3",3.82,M
"Belle Gunness, la viuda negra.mp3",2.62,M
"Burke y Hare, vendedores de cadáveres.mp3",2.49,M
"Carmen Broto Buil, la cencienta de Barcelona.mp3",2.56,M
"Daniel Camargo, la bestia de los Andes.mp3",1.57,M
"David Richard Berkowitz, asesino del calibre 44.mp3",1.9,M
Ed Gain y la mansión de los horrores.mp3,2.01,M
"Edmund Emil Kemper III, gigante cortacabezas.mp3",1.73,M
"Frizt Haarman, carnicero de Hannover.mp3",2.5,M
"Gary Michael Heidnik, la secta Heidnik.mp3",2.08,M
"Harvey Murray Glatman, un feo asesino.mp3",2.63,M
"Henry Landru, el mataviudas.mp3",2.62,M
"Henry Lee Lucas, retrato de un asesino.mp3",2.78,M
"Issei Sagawa, el caníbal Japonés.mp3",2.38,M
"Jane Weber, estranguladora de niños.mp3",2.03,M
"Jeffrey Dahmer, carnicero de Milwaukee 1.mp3",2.22,M
"Jeffrey Dahmer, carnicero de Milwaukee 2.mp3",2.85,M
"John George Haigh, doctor ácido.mp3",1.4,M
"Jonh Ketch, el verdugo cruel.mp3",1.86,M
"Jonh Wesley Harding, más frío que una piedra.mp3",2.75,M
La cabeza misteriosa.mp3,3.25,M
"La casa de Amity Ville, familia de feos.mp3",1.85,M
"Louis van Schoor, asesino Dum Dum.mp3",1.76,M
"Peter Hurkos, el detective psíquico.mp3",1.85,M
"Peter Kürten, vampiro de Düsseldorf.mp3",2,M
"Pilar Prades, envenenadora de Valencia.mp3",4.14,M
"Richard Chase, vampiro de Sacramento.mp3",1.97,M
"Robert Hansen, el depredador de Alaska.mp3",2.92,M
"Samuel Herbert Dugal, asesino galante.mp3",3.67,M
"Theodore Robert Bundy, depredador de Seatle.mp3",2.7,M
