User Type,Username,Date,Text
,seadog23,2012-09-16T11:11Z,guys go here http://thepiratebay.se/torrent/7641462/Nastia_Mouse_[115_video__298_photosets]_[Dream_Studio]
,seadog23,2012-09-16T11:12Z,how to delete this message? button does not work
,idsa,2012-09-29T17:27Z,"Is this Nastia Mouse doing porn?

-----------------------------------------------

Does anybody else think that this could be Nastia Mouse doing porn.

http://xhamster.com/movies/1421398/blond_girl_suck_two_cocks_for_along_time.html


The video clip is only a minute and a half long, and the quality is not great, so it's tough to tell if it's her.

Both Nastia and the girl in the video have large breasts, large nipples, big blue eyes, blonde hair, and even the same large freckle on the left upper arm.

Please let me know if you know the name of the movie or who the girl is.

Thanks."
