User Type,Username,Date,Text
[S],velvet.,2012-12-08T06:39Z,"Do not upload the same item more than once.
Your other upload of this has been deleted."
,thien90,2012-12-08T06:42Z,"sorry , this is first upload of me :))"
,thien90,2012-12-08T06:43Z,Sorry this is the first time I upload file
[S],velvet.,2012-12-08T06:50Z,"In addition to not uploading the same torrent twice, it is also not necessary to post the same, or similar, comment twice.  :)

You need to understand that the TPB web site is a bank of identical, load balanced web servers that get a database refresh every 5 minutes or so."
,thien90,2012-12-08T06:56Z,.
,zhangdaomao,2012-12-08T07:18Z,"Why you picking on him, you should have a bloody good look at the files that are on here there is thousands of the same bloody files, not just this."
,65c02,2012-12-08T22:48Z,Awesome! Thanks thein90
,jabba50,2012-12-08T23:15Z,"Awesome, thanks for the upload."
,user024,2012-12-09T09:54Z,thank you
,talia_burke,2013-01-08T03:00Z,Thanks for the up!
