User Type,Username,Date,Text
,haydenm96,2012-10-22T03:06Z,What are people's DL Speed's? Am i Seeding Fast enough?
,lobs11,2012-10-22T12:21Z,"Hey man, Any chance you could rip MYOB AccountEdge for mac? I can download the trial version but the cracked is no where to be found online. Cheers if you can!"
,djamesburke,2012-10-23T02:30Z,can i go straight from 10.5.8 to this?
,haydenm96,2012-10-23T06:05Z,@djamesburke Yes you can but you may need to burn it to a DL DVD
,haydenm96,2012-10-23T06:06Z,"@lobs11

I will see what i can find"
