User Type,Username,Date,Text
,SectorVector,2012-08-03T17:58Z,"Spetses, would you have ""Mastering the Nikon D5000"" ? And, were there any past issues of ""What Camera?"" magazine ? You had uploaded the 2012 issue (100 cameras tested)  a while back. Merci."
,bobbyphoto2,2012-08-03T19:01Z,Thank you for What Digital Camera!
[T],Spetses,2012-08-03T19:11Z,SectorVector - Just click on tag(s) for other issues.
,SectorVector,2012-08-03T20:09Z,"Thanks Spetses. I was referring this torrent.
http://thepiratebay.se/torrent/7458081/What_Camera__-_100_Cameras_Tested_2012_(.PDF)

I suppose then, the above is a compilation of articles from earlier WDC mag issues. I just wanted to see if i could get the issue that featured Nikon D5000. I started reading WDC only recently."
