User Type,Username,Date,Text
,naugas,2012-05-13T12:20Z,"Thanks for sharing! Great stuff, much appreciated!"
,deetar,2012-05-19T22:43Z,"Finish seeding this, please.  Everyone is stuck at 93.9%."
,naugas,2012-05-29T19:58Z,"bazwela - stop and do a rehash of what you're seeding. Maybe something have been corrupted or there's some other problem, but either way it's not working now."
,bazwela,2012-06-02T16:54Z,"hye guys, many many people have completed the torrent download and simply left the seed.  I am back now to reseed, but this is the last time!  Enjoy!"
,naugas,2012-06-06T21:33Z,"Cool, thanks! I noticed one seed at the very beginning, but no one since mid may."
