User Type,Username,Date,Text
,trimidogg,2012-05-03T21:20Z,"NOTE:
IF YOU ALREADY HAVE THE GAME YOU DON'T HAVE TO RE DOWNLOAD JUST COPY THE GAME FILES INTO MW3 FOLDER GAME WILL UPDATE ONLY"
,uchiha.,2012-05-03T22:05Z,didnt work for me ... i mean the multiplayer but the single player worked fine 
,vedroo43,2012-05-03T22:06Z,odlican posao momci
,vedroo43,2012-05-03T22:07Z,mp is teknogods and works for me
,trimidogg,2012-05-03T22:31Z,"@uchiha. 

Why not whats the problem ?"
,dandalis,2012-05-04T19:16Z,do i need steam to play MP ?
,trimidogg,2012-05-04T19:41Z,"No you don't need steam 1 thing you must do, you must GO TO Options>Deticated Servers> Say yes for both options there which enables a Servers option on the main menu. 

The is a youtube video search on youtube type this 
Call of Duty Modern Warfare 3 Full Game (Single Player And MultiPlayer) 
it's a video uploaded by me ""thepiratebay"" removing that link from post idk why ?"
,123game2010,2012-05-05T05:30Z,I cant find enough player for mp. 
,agenx0,2012-05-06T16:33Z,work co-op?
,pequepsp,2012-05-10T15:53Z,"WORKING PERFECT

I Followed the tutorial of youtube. I used the skidrow game and I only installed the crack folder an everything ok...

You have to open the patch as administrator"
,timothy5353,2012-05-12T20:37Z,ahhhhhhhhh i hate being a noob suck donkey balls. i will come back to this torrent after i do few diff torrents maybe i will be able to figure it out sucks cause i want to play this game
,inoth79,2012-06-02T12:30Z,"So i just have to wait untill the cmd install the MW3 , then install patches and i am ok ? "
,kundz,2012-09-10T13:13Z,mr.trimidogg..... plz hlp !!!!! whenever i start the game it shows mw3 couldn't load fileSysCheck.cfg
