User Type,Username,Date,Text
[V],dynstab2,2012-08-24T20:13Z,"http://thepiratebay.se/search/advanced%20engineering%20electromagnetics/0/99/600

So I was right from the gitgo: You've been lying through your teeth all along.

Congratulations, you won."
[V],bigbluesea,2012-08-24T20:22Z,"@dynstan2

Shut the fuck up you fucking stupid ass loser

Get a fucking life you ass clown

The only liar here is YOU and everyone know it"
,indiaman,2012-08-25T05:48Z,"I look back on all my downloads and there are many from dynstab2 and as many from bigbluesea.You both are equally dear to us so please end this feud and keep on uploading those wonderful books you have been uploading for so long. It does not matter if they were already uploaded,its the effort of the uploader that we appreciate."
[V],bigbluesea,2012-08-25T13:10Z,"@indiaman

dynstab2 does this to several uploaders.He is clearly mentally unstable."
