User Type,Username,Date,Text
,vidcruzz,2012-10-12T10:31Z,"caso nao funcione para aulgumas pessoas baixem o LAUNCHER, copie e cole na pasta Win32 e execute como adiministrador,selecione a linguagem e salve:link http://thepiratebay.se/torrent/7719550/DISHONORED_LAUNCHER"
,Mastalios,2012-10-12T14:29Z,Ok so I am new to this stuff.....so sorry for the noobish question.  How do I get this to work correctly?   I installed it and when I launch it takes me right to steam to purchase it.   I can't find the crack to use and such.  Can someone please tell thsi noob what to do?
,Mastalios,2012-10-12T14:38Z,nevermind i figured it out.....game works awesome thank you
[T],PittaSk8,2012-10-12T15:15Z,"@ Mastalios : hello, you can find everything in the postmortem folder :-)"
,vada505,2012-10-15T17:41Z,"thank you works well only problem is the hours for backup
to see if a cause of crack
tutorial install [url]thank you works well only problem is the hours for backup
to see if a cause of crack"
,awsomeILA,2012-10-22T13:04Z,@mastalios Did you make a disc image or did you mount the disk onto a virtual disc? if you dont have one here is a link for a program:  http://www.poweriso.com/
,Foolrkrum,2012-11-03T19:59Z,Anyone know where to get your hands on the pre-order content stuff? I don't want to play until I have the full game.
,eder426,2012-11-04T09:13Z,Works great on windows 8 32 bit. and on my EVGA GTX 550TI graphic card BIG THANKS PITTASK8 been playing for the past 4 HOURS. And I did seed un like others :)
,lolpirate42,2012-11-05T01:29Z,SEEEEEEED please please.....
,lolpirate42,2012-11-05T21:22Z,seed please.. is super slow
,filo1984,2012-11-09T15:52Z,The file is protected by password. where is possible to find it?
,Dulla1,2012-11-10T06:48Z,sweeettt :) keep the spirit man!!! thax so mauch
