User Type,Username,Date,Text
,jacob5800,2012-08-30T22:13Z,i have and older program of stardock cusor and still work i ll take a look thanks
,jacob5800,2012-08-30T22:50Z,someting wrong it stop working i dont know why can not do anything will have to delete and install old version
,jacob5800,2012-08-31T03:21Z,do not touch will stop working the old version its a  trap do not tucht toucht  and dont seed thanks he is an trout cu du cu
,Luwac,2012-08-31T08:19Z,"@jacob: the software works fine on my pc, I am running win 7 64.

@GoldBay:  thanks dude, what a wonderful share!"
,jacob5800,2012-08-31T21:40Z,i dont mean to be bad it just dint work here i dowload direct from the site cause i had and older version i guess  and something must went wrong thanks anyway
