User Type,Username,Date,Text
,albo88,2012-08-19T04:57Z,that's  scania truck driving simulation on your picture 
,yopyo,2012-08-19T12:58Z,"So, is this real ?"
,MIme2006,2012-08-19T16:10Z,Where is the serial
,shaharoza,2012-08-20T12:53Z,Okay now tell me the serial no. seriously Mr.Tinyiso. Right Now . I am waitingggggg.
,shaharoza,2012-08-24T12:23Z,Here is the serial :- lkjgfd457uhgf54gf6kjh
,shaharoza,2012-08-24T12:32Z,Thanks Mr.Tinyiso .
,Derick24,2012-09-08T17:22Z,You little bitch. after i download this thing 4 2 days and seed it for a week and finaly try to play it there is a fucking password really give me a fucken serial NOW!!!!!!!!!!!
,pkmacedon,2012-09-11T15:16Z,"What a creep! 
This is a very dishonest way to make people give their phone number and pay for sending a text message in order to get a password."
