Filename,Size,Unit
Schwartz - Dialogues with Forgotten Voices; Relational Perspectives on Child Abuse Trauma and Treatment (2000).pdf,87.85,M
"Wright (Ed.) - Sex Offenders Laws; Failed Policies, New Directions (2009).epub",7.45,M
Kalfoglu & Faikoglu (Eds.) - Sexual Abuse - Breaking the Silence (2012).pdf,6.82,M
"Bryant - The Franklin Scandal; a Story of Powerbrokers, Child Abuse & Betrayal (2011).epub",6.64,M
Johnson - Physical Abuses and Sexual Offenders; Forensic and Clinical Strategies (2007).pdf,5.42,M
Muela (Ed.) - Child Abuse and Neglect; a Multidimensional Approach (2012).pdf,5.3,M
"Savirimuthu - Online Child Safety; Law, Technology and Governance (2012).pdf",4.07,M
Pappas - The Dark Side of Sports; Exposing the Sexual Culture of Collegiate and Professional Athletes (2012).pdf,3.91,M
Davidson & Gottschalk (Eds.) - Internet Child Abuse; Current Research and Policy (2011).pdf,3.82,M
Fourth National Incidence Study of Child Abuse and Neglect (NIS–4) - Report to Congress (2010).pdf,3.65,M
"Schafer - Brothels, Depravity, and Abandoned Women; Illegal Sex in Antebellum New Orleans (2009).pdf",3.29,M
Jones & Jemmott - Child Sexual Abuse in the Eastern Caribbean (2011).pdf,3.22,M
Wertheimer - Consent to Sexual Relations (2003).djvu,3.07,M
Laaser - Healing the Wounds of Sexual Addiction (2004).pdf,2.24,M
Moffatt - Wounded Innocents and Fallen Angels; Child Abuse and Child Aggression (2003).pdf,1.07,M
"Sexual Victimization in Prisons and Jails Reported by Inmates, 2008-09 (BJS, 2010).pdf",1.06,M
"Understanding Sexual Abuse by a Church Leader, 2nd ed. (2011).pdf",1.05,M
"Sandusky Grand Jury Report (July 12, 2012).pdf",973.51,K
"Hooks - Unholy Matrimony; Healing for the Abused Woman, 2nd ed. (2007).pdf",604.51,K
Parkinson - Study of Reported Child Sexual Abuse in the Anglican Church (May 2009).pdf,499.74,K
Davis - Daddy's Little Secret (2011).epub,359.79,K
Glass - Damaged; the Heartbreaking True Story of a Broken Child (2006).epub,319.29,K
Cartagenas - The Terror of the Sexual Abuse by the Roman Catholic Clergy and the Philippine Context  (2011).pdf,268.25,K
Peters - Abandoned; the True Story of a Little Girl Who Didn't Belong (2007).epub,265.05,K
Pedophile in Palace; the Sexual Abuse of King Sebastian of Portugal (1554-1578) and Its Consequences.pdf,263.96,K
Vanderbilt - A Chilling Report; Do You Want to Know What Incest Is (1992).pdf,221.26,K
"Hypocrites; Evidence and Statistics on Child Sexual Abuse Amongst Church Clergy, 1990-2000 (EROS Foundation, 2000).pdf",206.45,K
"Berry - Legion Eager to Get Past Founder's Sex Abuse Charges (NCR, June 3, 2005).pdf",194.65,K
Wormer & Berns - The Impact of Priest Sexual Abuse; Female Survivors’ Narratives (2004).pdf,173.7,K
Telling the Secret; Channels of Communication for the Recovering Survivor of Child Sexual Abuse - A Literature Review (1985-1993).pdf,131.7,K
"Sex Abuse Scandal in US & Italy Taints Papacy (Yahoo News, 2010).pdf",55.95,K
"Berry - The Legion of Christ and the Vatican Meltdown (June 21, 2012).pdf",54.86,K
"Child-abusing Ex-bishop's Tell-all Shocks Belgium (Yahoo News, 2011).pdf",52.74,K
"Jesuits settle NW abuse claims for $166 million (Yahoo News, 2011).pdf",51.97,K
Basw - More than just Child’s Play; a Study on Sibling Incest.pdf,29.99,K
