User Type,Username,Date,Text
,StormQ,2012-12-23T17:43Z,Thanks for the download. I did install it on a fresh windows 7 (64bits) i was wondering if I can update it?
,mindcrasher,2012-12-24T21:29Z,i never had a problem updating it i just like used the patch again.
,LogicMan,2012-12-26T13:39Z,"Thank you man, I've been searching this forever! You've just got seeding for 2 days :D! Oh! Can you help me with the patch? What do I do to patch it and still have it cracked?"
,mindcrasher,2012-12-26T19:41Z,you just install the program and then after that u just run the patch and it shall be cracked 
,dentra,2013-01-05T13:56Z,:)
,mindcrasher,2013-01-06T04:16Z,:( 
,lokkx2,2013-01-07T17:49Z,"Vira com crack !
ĂŠ seguro, tem virus."
,mindcrasher,2013-01-08T13:41Z,lokkx2 this program is safe it does not have a virus inside of it. i ran it and it is just fine.
