User Type,Username,Date,Text
,SLOPSBOX666,2012-11-22T05:44Z,SEED YOU FUCKING SCUMBAGS
,Bagzz,2012-11-22T06:15Z,"This has to be the worst seeded torrent ever, fuck you leechers.  I hope you wake up to Hornswoggle fucking your eardrum.

Thank you for the upload, been wanting to see this."
,ldyal09,2012-11-22T08:03Z,"Damn, 775 Leechers already; wow, thanks for this Anonymous"
,KiLLeR_SiX,2012-11-22T12:47Z,"Wow, I've been waiting for this one. Is it PG or TV-14 ? 


Will download it a bit later when the leechers will go out."
,gold3neagle89,2012-11-22T16:55Z,SEEEED!!!!!
,MrALUCARDIII,2012-11-22T23:16Z,"well, thanks a lot for the upload, now please all of you: eat your vegetables, say your prayers and seed the god damn torrent."
