Filename,Size,Unit
The Holy Spirit/The Last 12 Shepherds of Israel - Prophecies Converge upon 2012.avi,663.52,M
What are the Public Schools Teaching Our Children.avi,426.26,M
Indoctrination  Public Schools and the Decline of Christianity in America.avi,333.54,M
Who Controls The Children - schools dumb down kids deliberately.avi,271.45,M
OUTFOXED Rupert Murdochs War on Journalism Interviews Video.avi,204.99,M
KGB Defector Accurately Predicts Americas Future in 83 - Censored by US Edu.avi,180.48,M
Charles Kraut - YouTube.flv,179.53,M
SIN-ister Clips/Cocaine Iran Contra Scandal   The CIA - Freeway Ricky Ross Tells All.flv,131.36,M
Shorts/Ugandan Girl Exposes KONY 2012 Film - YouTube.flv,85.18,M
The Holy Spirit/MUSIC IN WORSHIP AND THE CHURCH - YouTube (2).flv,79.01,M
Shorts/The MicroChip Invasion Spy Chips in your home Over 30 Billion RFIDs made a Year.flv,78.34,M
Shorts/The Shocking Truth About Public Schools - YouTube.flv,77.54,M
SIN-ister Clips/Dirty Electricity - Measurement and Mitigation - Dr. Sam Milham - YouTube.flv,74.42,M
The Holy Spirit/GOD IS HERE - There is a sweet anointing in this sanctuary.mp4,72.87,M
Signs of the Times/Blowing Off Some Steam 121 - HR 3166 Ron Paul Iran.flv,66.15,M
Signs of the Times/9 12 11 - Purported former Groom Lake Technician Leak.avi,51.79,M
Shorts/Public Education has become indoctrination and distraction.flv,49.81,M
Signs of the Times/1980s GI Joe Cartoon Show Reveals the Truth About Subliminal Messages & TV.flv,48.63,M
The Holy Spirit/Satanism in hip hop encore Ed pt 38 CIVIL UNREST LYCANS ZOMBIES   GENETIC MUTATIONS.webm,43.15,M
"The Holy Spirit/The Beast Government, Mark of Cain X, The Borgs Pt. 4 - YouTube.flv",41.14,M
The Holy Spirit/John Lennox Vs Richard Dawkins Christianity Vs Atheism - YouTube.flv,35.58,M
The Holy Spirit/AstroMicroBiology.mp4,33.34,M
SIN-ister Clips/Christian Persecution SNL Tim Tebow Skit   More A MUST SEE.flv,33.31,M
Shorts/Electroshock Therapy still used in USA - boy tortured with 31 shocks over 7 hours strapped to table.flv,31.96,M
Shorts/ExperimentalVaccines Consuming Kids - YouTube.flv,31.29,M
SIN-ister Clips/Cash Transactions Banned by Louisiana Government Takes Private Property Without Due Process.avi - YouTube.flv,29.46,M
The Holy Spirit/How Can A Man Be Right With God - Various Speakers.webm,29.33,M
Signs of the Times/ANOTHER Embarrassing Evolution Conundrum - How Symbiosis Defies Darwin.flv,28.79,M
Signs of the Times/5 Police Officers vs A law knowing Citizen - YouTube.flv,27.41,M
Shorts/Stuff They Dont Want You to Know- Is your brain tricking you.flv,27.01,M
SIN-ister Clips/Demons In My Backyard Part 1 UFO sighting 1-5-2012 - YouTube.flv,25.67,M
SIN-ister Clips/Earthquake Warning For March 22 2012 - 4 58 34 UTC.flv,23.93,M
SIN-ister Clips/Calling Mark Wahlberg about False Flag Terrorism - Mind Control.flv,23.77,M
The Holy Spirit/Casting Crowns Set Me Free drama human video by The Circuit Youth - YouTube.flv,23.53,M
The Holy Spirit/MercyMe - Spoken For - Instrumental with lyrics - YouTube.mp4,23.06,M
The Holy Spirit/matthew west the motions - YouTube.flv,21.45,M
Shorts/Are Fossils Ever Found in the Wrong Place  - YouTube.flv,20.92,M
Shorts/Why Arent Schools Teaching Our Children Their Rights and Freedoms.flv,20.77,M
Shorts/A 165 million year surprise - YouTube.flv,19.78,M
SIN-ister Clips/Englands Catholic Church attempt to silence Canada mass murder.flv,19.43,M
Shorts/Lost Ancient Technologies Of Peru And Bolivia Tour August 2012.flv,17.53,M
Signs of the Times/ALERT - HOMELAND SECURITY BORDER PATROL FOREIGN TROOPS CONSTITUTION FREE ZONE.flv,16.69,M
Shorts/Fukushima 85 times WORSE than Chernobyl nuclear disaster.flv,16.5,M
Shorts/Alert Obama Working With Secret New World-OIC Order To Make US  Europe Into Islamic States.flv,16.23,M
Shorts/Propagandas Founding Father Edward Bernays Exposed.flv,16.05,M
Shorts/Lab Studies Show Evolutionary Evidence Is Merely Assumed - YouTube.flv,15.29,M
Shorts/Know Your Enemy (Part 65 - The World Core Curriculum).avi,15.17,M
SIN-ister Clips/Chemtrails  Why  - U.S. conducted biowarfare experiments in America - YouTube.flv,13.92,M
Shorts/How to Build a Bomb in a Public School System - YouTube.flv,13.57,M
Signs of the Times/Big Daddy  - creation vs evolution.flv,13.31,M
Signs of the Times/30 Important Facts All US Citizens Should Know YouTube - YouTube.flv,12.64,M
Shorts/kids being put on buses and transported from school to alternate locations in Terror Drills.flv,12.43,M
The Holy Spirit/the beast.mp4 - YouTube.flv,12.17,M
SIN-ister Clips/Domestic Drones becoming a growing menace - YouTube.flv,12.05,M
Shorts/The purpose and origins of public education - John Gatto.flv,11.82,M
Shorts/Scientists Discover Growing Glaciers In Asia - YouTube.flv,11.4,M
The Holy Spirit/Hillsong - Run  - YouTube.flv,11,M
SIN-ister Clips/Could Deep Impact Be REAL - YouTube.flv,10.22,M
SIN-ister Clips/Dumping dead troops around since Bush - Press TV News.flv,10.12,M
Signs of the Times/Barack Obama CIA Asset - Terrorist Number 1 Obama   Morning Liberty Radio Program.flv,9.62,M
The Holy Spirit/Apologetics Training - YouTube.flv,9.62,M
Signs of the Times/9 11 The Pet Goat Satanic Ritual - YouTube.flv,7.45,M
Signs of the Times/Athens Burns The Mark of the Beast Series - YouTube.flv,7.25,M
Signs of the Times/Alien Moon Base Facility Captured By Chinas Change-2 Orbiter 2012.flv,7.23,M
"Shorts/2-Minute Video  FOX Edits, Fakes Applause for John Bolton Pro-War Statement.flv",7.04,M
Signs of the Times/3-D Facial Scans Sold To Public Under Guise That It Helps Children.flv,6.28,M
SIN-ister Clips/Bringing Expired Debt Back to Life-Yahoo Finance - YouTube.flv,5.83,M
SIN-ister Clips/BREAKING - US DISTRICT COURT SUBPOENAS Obamas Original Birth Certificate Aug. 8 Deadline  - YouTubeP.flv,5.16,M
Signs of the Times/2-21-12 STRANGE SOUNDS in Montana - Amazing from Radio DJ.flv,3.79,M
POtHS - Why We Do What We Do.txt,7.89,K
Torrent downloaded from Conspiracyhub.com.txt,47,B
Torrent downloaded from Demonoid.me.txt,47,B
