Filename,Size,Unit
One Man Show/10 So Afraid.mp3,15.11,M
One Man Show/06 Shut Us Down.mp3,11.94,M
One Man Show/05 Come.mp3,11.56,M
One Man Show/03 Not Too Late.mp3,11.51,M
One Man Show/08 Never Going Back Again.mp3,11.31,M
One Man Show/01 Cast Away Dreams.mp3,10.63,M
One Man Show/12 Trouble.mp3,10.12,M
One Man Show/02 Bleed to Love Her.mp3,9.76,M
One Man Show/11 Go Your Own Way.mp3,9.38,M
One Man Show/07 Go Insane.mp3,9.04,M
One Man Show/13 Seeds We Sow.mp3,8.08,M
One Man Show/09 Big Love.mp3,6.95,M
One Man Show/04 Stephanie.mp3,4.45,M
Lindsey Buckingham - One Man Show.jpg,55.5,K
