User Type,Username,Date,Text
,xiceman92eidx,2012-06-09T09:39Z,seriously guys seed
,xiceman92eidx,2012-06-09T09:49Z,seed plz don't be dicks
,niggazluvchicken,2012-06-09T12:35Z,A big thank you to the 5 people that are seeding this out of the 700 that have it downloaded...the people who aren't can go fuck yourselves
,hasten888,2012-06-09T14:39Z,Yeah! All those not seeding and still lurking around the comment section...coz they evil
,3dot14,2012-06-09T15:59Z,"Seed!
Why cant all just seed as much as they downloaded!?"
,A_Dying_Baby,2012-06-09T21:56Z,SEED YOU FUCKIN BUTTHOLES!
,demme,2012-06-11T15:53Z,Why are Sir paul rips ALWAYS retarded and bad video/sound?
