User Type,Username,Date,Text
[V],merzedes,2012-08-04T15:02Z,"Sorry, no pics on this one, just MP4 and WMV."
,jworks10,2012-08-04T15:17Z,"Love your uploads, especially the US ones. I was wondering if you have ever seen or know where i can get any torrents from either fantasyteenageassault.com, or realbrutalfamily.com would appreciate it, thanks again~"
[V],merzedes,2012-08-04T15:42Z,"jworks10 @ Sorry cant find any ,,and some hoist are down for the moment :-("
,shallow2,2012-08-04T16:09Z,"@jworks10: new US coming in w little while, it seems to be the least popular series and we usually save that for last.

If ppl want the US shoots earlier pls let us know."
,Kainthedamned,2012-08-05T10:25Z,"I really like the upper floor, it's even more enjoyable than it's fappable. Thanks for the upload!"
