User Type,Username,Date,Text
,Coffeeman2cups,2012-10-30T19:50Z,"SAVE YOUR TIME,THE MOVIE REALY SUCKS BIG TIME
EPILEPSI WARRING A LOT OF WHITE FLASING AND I MEAN A lot"
,FlashM,2012-10-31T08:05Z,"Thx for upload Starchild666. Great job.

I agree with Coffeeman2cups aboute his warning.

Pointless effects of bright lights during all movie. This movie was probably one of the worst movie I saw in last 10 years."
,WinkyPirate,2012-11-15T11:25Z,My dads love his swedish subs so thank you Starchild666 for uploading this. :-)
,sinjanju2,2012-11-16T14:15Z,Coffeeman2cups. EPILEPSI WARNING A LOT OF WHITE FLASING   ok GOOD my back prodj Tv NEEDS a GOD RUBBING
