User Type,Username,Date,Text
,snorsic,2012-08-14T07:53Z,Thanks again Dibya. Your the best.
,rob2012,2012-08-15T18:31Z,"Kings, não consigo descompactar o arquivo porque não tenho a senha, pode fornecer?"
,rob2012,2012-08-15T18:32Z,"Kings can not unzip the file because I do not have the password, you can provide?"
,rob2012,2012-08-15T21:23Z,"DibyaTPB, não consigo descompactar o arquivo porque não tenho a senha, pode fornecer?"
,rob2012,2012-08-15T21:25Z,"DibyaTPB can not unzip the file because I do not have the password, you can provide?"
,kiwij,2012-08-18T11:44Z,"There is no zip file, so no password is needed. (TROLL?)"
,Skram0,2012-08-19T09:15Z,На прошлой неделе кормите троллей. Они меня с ума.
