User Type,Username,Date,Text
,bvrsknr,2012-03-10T02:08Z,"thanks Who
she sure grew up !"
,TPBWhore,2012-03-10T08:17Z,"Far from new as they've already been posted a few times in both Other > Pictures and in Porn > Pictures over the past 6 months or so, but thanks all the same. +1"
,poondog2,2012-03-10T19:14Z,Fantastic!! Anything you have on any old Vlad or Showcase models that are now 18+ would be fantastic!!! thanks again +1! 
,blacksidex6,2012-03-11T18:01Z,I love this vladm... more would be excellent...Thanks @Who-He-iZ
,josh_W,2012-03-14T08:42Z,more of her please!
,vwguyy,2012-03-30T22:31Z,Awesome stuff! Someone should upload all the sets where the vlad girls wore the green and yellow bikini ;)
,leftdeffer,2012-07-13T19:54Z,"Ahh, the magic number. 18!!!!!"
