User Type,Username,Date,Text
,obiku,2012-11-18T18:50Z,Thanks a ton! I was worried you had stopped uploading this show after last weeks show went missing.
,scifiactiondan,2012-11-18T20:16Z,any possibility on the show from 10-11-2012?thats saturday the 10th of november for us yanks.:-)
,Fulgencio123,2012-11-18T21:27Z,Thanks so much. You seem to be the only person ever to torrent this show. Really appreciate it.
[V],footy,2012-11-19T02:59Z,"Unable to upload torrent, i get an Error (File empty) when uploading here, the US GP Race torrent has been uploaded to KAT (footy7)"
,lucabara,2012-11-19T15:03Z,legend mate
,DeviousMoth,2012-11-24T02:11Z,:) Hmm no show from 10 Nov? You're not a Leeds fan are you Footy?
