Filename,Size,Unit
CD/01. Out Here In The Cold.mp3,14.8,M
CD/02. True To You.mp3,11.84,M
CD/03. The Only Thing I Know.mp3,16.73,M
CD/04. Wonder Why You Want Her.mp3,10.19,M
CD/05. What Do You Want.mp3,7.85,M
CD/06. Out Of My Mind.mp3,9.81,M
CD/07. Here In This Place.mp3,13.82,M
CD/08. Waiting For You.mp3,3.77,M
CD/09. Loath To Refuse.mp3,13.23,M
CD/10. Noir Excursion.mp3,14.18,M
CD/11. Baby.mp3,13.84,M
CD/12. Waiting For You (Reprise).mp3,2.47,M
CD/Gotye - Boardface.m3u,784,B
CD/Gotye - Boardface.mp3.cue,1.56,K
