User Type,Username,Date,Text
,jacob5800,2012-10-31T02:51Z,always lots of seeders and leechers fuck u ass   hole
,nzboy123,2012-10-31T10:23Z,is this for ipad too?
,magellan2012,2012-10-31T17:14Z,thanx man nice work
,akurox,2012-11-04T14:11Z,"when i sync the apps which i have downloaded to my ipod touch ios 6.1, why isn't it installing?"
,rocketcat101,2012-11-05T17:51Z,@akurox: is your device jailbroken?
,farhanilkarim,2012-11-06T16:18Z,is this for ipad?
,akurox,2012-11-10T07:38Z,"@rocketcat101 no i have just bought it recently. I tried to jailbreak using redsnow, but it gets stuck during the waiting to boot process"
,akurox,2012-11-10T08:11Z,"and my iOS version is 6.0.1, not 6.1"
,J18way,2012-11-10T12:10Z,"@akurox is there already a jailbreak for iOS6? (unthethered i mean, i know about the tethered one whereby A4 devices can be easily jailbroken)"
,akurox,2012-11-16T07:34Z,@J18way i tried a tethered one using redsn0w_win_0.9.15b3 butit gets stuck in the waiting to reboot process
