Filename,Size,Unit
Melrose Place.05x06.Jane's Addiction'96.avi,699.91,M
Melrose Place.05x15.Escape from LA'97.avi,699.88,M
Melrose Place.05x09.Farewell Mike's Concubine'96.avi,699.87,M
Melrose Place.05x08.Mission Interpersonal'96.avi,699.86,M
Melrose Place.05x14.The Accidental Doctor'97.avi,699.86,M
Melrose Place.05x13.Crazy love'96.avi,699.85,M
Melrose Place.05x10.Nice work if you can get it'96.avi,699.83,M
Melrose Place.05x12.Quest for Mother'96.avi,699.82,M
Melrose Place.05x11.Sole Sister'96.avi,699.82,M
Melrose Place.05x07.Young doctors in heat'96.avi,699.81,M
Melrose Place.05x02.Over Dick's dead body'96.avi,699.18,M
Melrose Place.05x01.Living with disaster'96.avi,699.05,M
Melrose Place.05x04.Hunka hunka burnin' love'96.avi,698.94,M
Melrose Place.05x05.Un-Janed Melody'96.avi,698.81,M
Melrose Place.05x03.Moving Violations'96.avi,698.45,M
