User Type,Username,Date,Text
[H],HeroMaster,2012-04-30T04:23Z,ENJOY Game of Thrones New Episode 5 HDTV by ASAP!
,rewepewe,2012-04-30T04:31Z,already well seeded here: http://thepiratebay.se/torrent/7228629/Game_of_Thrones_S02E05_HDTV_x264-ASAP%5Bettv%5D
,buff24seven,2012-04-30T04:31Z,i absolutely love this show.
,McCaster,2012-04-30T04:44Z,THANKS HERO!!!
,storybank,2012-04-30T05:46Z,"Thanks for spoiling stoley714

Fuck you and your shitty opinion."
,Vegeta9021,2012-04-30T06:08Z,"LMFAO , you're such a DUMB ASS darkizzle, at least read the books

and learn to SPOILER IT CORRECTLY, YOU FUCKING RETARD. THOSE ARE NOT EVEN THE CORRECT SPOILERS, I READ THE BOOKS.

YOU just embarrassed YOURSELF BAHAHAHAHAHAA

What a DUMB ASS, how does it feel to feel like a DUMB ASS?"
,M3LK1,2012-04-30T07:40Z,SEEEEEEEEED !
,M3LK1,2012-04-30T07:58Z,"Finaly... Took me about 1 hour to get it.
Thanks for the torrent heromaster and ASAP :)"
,M3LK1,2012-04-30T08:02Z,"V - 10
A - 10

Gj! :)"
,Vegeta9021,2012-04-30T08:04Z,g
,DiRAY,2012-04-30T12:07Z,Great torrent!
