User Type,Username,Date,Text
,cblakeshore,2012-05-17T03:26Z,"excellent copy...a-9, v-9... thx"
,litesoar,2012-05-17T16:06Z,清晰吗？
,ultraG,2012-05-20T20:16Z,"This is a cam, and while it's an okay cam, it's not a DD5.

 a7v7 - for a cam"
,tflagger997,2012-05-25T18:19Z,Scam of a Cam.  Lose the skull.
,karunama,2012-05-30T15:02Z,"I can live with it being a cam.  The hardcoded dutch subtitles however...  Well, I wouldn't inflict that on my worst enemy... unless he spoke dutch, i guess?  But even then... they're hardcoded :(..."
,senhamat,2012-07-24T19:02Z,"I'm downloading it, pretty sure is the best and cleanest cam, can't wait for rate :)"
