User Type,Username,Date,Text
,nikos_xatz,2012-04-06T17:13Z,can someone SEED please!!!!!!!
,nikos_xatz,2012-04-06T18:21Z,thank you very very very much!!!!!!!great SEED SPEED from dutch people!!!!!thank you all
,nikos_xatz,2012-04-06T18:24Z,And US People!!!!!!
,Beowulf6666,2012-06-09T02:22Z,"same fucking story...not proper quality

black grainy effect during darker scenes 

this guy cant get his fucking rips right...

take a message nlupper and if ur doing rips and uploading at LEAST do it the fuck right"
,Zapfinger,2012-09-06T15:24Z,beowulf if you don't know much about movies in general you should just stfu.. thank you.
