Filename,Size,Unit
Amelia Lily - You Bring Me Joy.mp4,35.29,M
Amelia Lily - You Bring Me Joy.m4a,3.23,M
Please read.nfo,1.94,K
Thanks/Torrent downloaded from Vitamin_X torrents on BTScene.eu.txt,68,B
Thanks/Torrent downloaded from AhaShare.com.txt,59,B
Thanks/Torrent downloaded from Extratorrent.com.txt,40,B
Thanks/Torrent downloaded from Thepiratebay.se.txt,39,B
Thanks/Torrent downloaded from P2PDL.com.txt.txt,37,B
Thanks/Torrent downloaded from TinyM.eu.txt,36,B
Thanks/Torrent downloaded from 1337x.org.txt,33,B
Thanks/Torrent downloaded from Kat.ph.txt,30,B
